localID,SurveyDate,,Year,Month,Day,Observer,Latitude,Longitude,County,State,Species,Comments,AOU_code1,5/13/2010,00:00.0,2010,5,13,Lundblad,NULL,NULL,Nye,NV,Eared Grebe,NULL,000402,5/4/2010,00:00.0,2010,5,4,Lundblad,NULL,NULL,Nye,NV,Eared Grebe,NULL,000403,5/4/2010,00:00.0,2010,5,4,Lundblad,NULL,NULL,Nye,NV,White-faced Ibis,NULL,018704,5/19/2010,00:00.0,2010,5,19,Lundblad,NULL,NULL,Nye,NV,Eared Grebe,NULL,000405,5/19/2010,00:00.0,2010,5,19,Lundblad,NULL,NULL,Nye,NV,White-faced Ibis,NULL,018706,6/22/2010,00:00.0,2010,6,22,Lundblad,NULL,NULL,Nye,NV,Eared Grebe,NULL,000407,6/22/2010,00:00.0,2010,6,22,Lundblad,NULL,NULL,Nye,NV,White-faced Ibis,NULL,018708,7/22/2010,00:00.0,2010,7,22,Lundblad,NULL,NULL,Nye,NV,Eared Grebe,NULL,000409,7/22/2010,00:00.0,2010,7,22,Lundblad,NULL,NULL,Nye,NV,White-faced Ibis,NULL,0187010,5/5/2010,00:00.0,2010,5,5,Lundblad,NULL,NULL,Nye,NV,Eared Grebe,NULL,0004011,5/5/2010,00:00.0,2010,5,5,Lundblad,NULL,NULL,Nye,NV,White-faced Ibis,NULL,0187012,5/20/2010,00:00.0,2010,5,20,Lundblad,NULL,NULL,Nye,NV,Eared Grebe,NULL,0004013,5/20/2010,00:00.0,2010,5,20,Lundblad,NULL,NULL,Nye,NV,White-faced Ibis,NULL,0187014,7/22/2010,00:00.0,2010,7,22,Lundblad,NULL,NULL,Nye,NV,Eared Grebe,NULL,0004015,7/22/2010,00:00.0,2010,7,22,Lundblad,NULL,NULL,Nye,NV,White-faced Ibis,NULL,0187016,6/12/2009,00:00.0,2009,6,12,Jeffers,NULL,NULL,Churchill,NV,Black-crowned Night-Heron,NULL,0202017,5/24/2011,00:00.0,2011,5,24,Jeffers,NULL,NULL,Churchill,NV,Great Egret,NULL,0196018,5/24/2011,00:00.0,2011,5,24,Jeffers,NULL,NULL,Churchill,NV,Snowy Egret,NULL,0197019,5/24/2011,00:00.0,2011,5,24,Jeffers,NULL,NULL,Churchill,NV,White-faced Ibis,NULL,0187020,5/24/2011,00:00.0,2011,5,24,Jeffers,NULL,NULL,Churchill,NV,White-faced Ibis,NULL,0187021,5/15/2009,00:00.0,2009,5,15,Jeffers,NULL,NULL,Churchill,NV,Black-crowned Night-Heron,NULL,0202022,5/15/2009,00:00.0,2009,5,15,Jeffers,NULL,NULL,Churchill,NV,Great Blue Heron,NULL,0194023,5/15/2009,00:00.0,2009,5,15,Jeffers,NULL,NULL,Churchill,NV,Great Egret,NULL,0196024,5/24/2011,00:00.0,2011,5,24,Jeffers,NULL,NULL,Churchill,NV,Black-crowned Night-Heron,NULL,0202025,5/24/2011,00:00.0,2011,5,24,Jeffers,NULL,NULL,Churchill,NV,Great Egret,NULL,0196026,5/24/2011,00:00.0,2011,5,24,Jeffers,NULL,NULL,Churchill,NV,Snowy Egret,NULL,0197027,5/24/2011,00:00.0,2011,5,24,Jeffers,NULL,NULL,Churchill,NV,White-faced Ibis,NULL,0187028,5/15/2009,00:00.0,2009,5,15,Jeffers,NULL,NULL,Churchill,NV,Great Blue Heron,NULL,0194029,6/12/2009,00:00.0,2009,6,12,Jeffers,NULL,NULL,Churchill,NV,Great Blue Heron,NULL,0194030,5/24/2011,00:00.0,2011,5,24,Jeffers,NULL,NULL,Churchill,NV,Great Blue Heron,NULL,0194031,4/6/2009,00:00.0,2009,4,6,Woods,NULL,NULL,Douglas,NV,Great Blue Heron,NULL,0194032,4/6/2009,00:00.0,2009,4,6,Woods,NULL,NULL,Douglas,NV,Snowy Egret,NULL,0197033,6/27/2009,00:00.0,2009,6,27,Ballard,NULL,NULL,Douglas,NV,Black-crowned Night-Heron,NULL,0202034,NULL,,2009,4,NULL,Cottle,NULL,NULL,Churchill,NV,Great Blue Heron,NULL,0194035,5/19/2010,00:00.0,2010,5,19,Bradley,NULL,NULL,Elko,NV,White-faced Ibis,NULL,0187036,6/12/2009,00:00.0,2009,6,12,Jeffers,NULL,NULL,Churchill,NV,Great Blue Heron,NULL,01940129,6/14/2011,00:00.0,2011,6,14,Ballard,NULL,NULL,Elko,NV,Western Grebe,NULL,0001037,6/10/2009,00:00.0,2009,6,10,Teske,NULL,NULL,Lander,NV,Black-crowned Night-Heron,NULL,0202038,6/10/2009,00:00.0,2009,6,10,Teske,NULL,NULL,Lander,NV,Snowy Egret,NULL,0197039,7/1/2010,00:00.0,2010,7,1,Teske,NULL,NULL,Lander,NV,Black-crowned Night-Heron,NULL,0202040,7/1/2010,00:00.0,2010,7,1,Teske,NULL,NULL,Lander,NV,Great Egret,NULL,0196041,7/1/2010,00:00.0,2010,7,1,Teske,NULL,NULL,Lander,NV,Snowy Egret,NULL,0197042,5/26/2010,00:00.0,2010,5,26,Bauman,NULL,NULL,Humboldt,NV,Great Egret,NULL,0196043,5/26/2010,00:00.0,2010,5,26,Bauman,NULL,NULL,Humboldt,NV,White-faced Ibis,NULL,0187044,5/26/2010,00:00.0,2010,5,26,Bauman,NULL,NULL,Humboldt,NV,White-faced Ibis,NULL,0187045,5/26/2010,00:00.0,2010,5,26,Bauman,NULL,NULL,Humboldt,NV,Great Egret,NULL,0196046,5/26/2010,00:00.0,2010,5,26,Bauman,NULL,NULL,Humboldt,NV,White-faced Ibis,NULL,0187047,5/26/2010,00:00.0,2010,5,26,Bauman,NULL,NULL,Humboldt,NV,Great Egret,NULL,0196048,5/26/2010,00:00.0,2010,5,26,Bauman,NULL,NULL,Humboldt,NV,Black-crowned Night-Heron,NULL,0202049,5/26/2010,00:00.0,2010,5,26,Bauman,NULL,NULL,Humboldt,NV,White-faced Ibis,NULL,0187050,5/26/2010,00:00.0,2010,5,26,Bauman,NULL,NULL,Humboldt,NV,Snowy Egret,NULL,0197051,5/26/2010,00:00.0,2010,5,26,Bauman,NULL,NULL,Humboldt,NV,White-faced Ibis,NULL,0187052,5/26/2010,00:00.0,2010,5,26,Bauman,NULL,NULL,Humboldt,NV,White-faced Ibis,NULL,0187053,7/16/2010,00:00.0,2010,7,16,Boyd,NULL,NULL,Elko,NV,Black Tern,NULL,0077054,5/25/2009,00:00.0,2009,5,25,Teske,NULL,NULL,Lander,NV,Great Blue Heron,NULL,0194055,5/25/2009,00:00.0,2009,5,25,Teske,NULL,NULL,Lander,NV,Great Egret,NULL,0196056,5/25/2009,00:00.0,2009,5,25,Teske,NULL,NULL,Lander,NV,Snowy Egret,NULL,0197057,6/15/2010,00:00.0,2010,6,15,Teske,NULL,NULL,Lander,NV,Black-crowned Night-Heron,NULL,0202058,6/15/2010,00:00.0,2010,6,15,Teske,NULL,NULL,Lander,NV,Great Blue Heron,NULL,0194059,6/15/2010,00:00.0,2010,6,15,Teske,NULL,NULL,Lander,NV,Great Egret,NULL,0196060,6/15/2010,00:00.0,2010,6,15,Teske,NULL,NULL,Lander,NV,Snowy Egret,NULL,0197061,7/13/2010,00:00.0,2010,7,13,Teske,NULL,NULL,Humboldt,NV,Black-crowned Night-Heron,NULL,0202062,7/13/2010,00:00.0,2010,7,13,Teske,NULL,NULL,Humboldt,NV,Cattle Egret,NULL,0200163,7/13/2010,00:00.0,2010,7,13,Teske,NULL,NULL,Humboldt,NV,Snowy Egret,NULL,0197064,5/19/2010,00:00.0,2010,5,19,Bradley,NULL,NULL,Elko,NV,White-faced Ibis,NULL,0187065,7/1/2010,00:00.0,2010,7,1,Teske,NULL,NULL,Lander,NV,Black-crowned Night-Heron,NULL,0202066,7/1/2010,00:00.0,2010,7,1,Teske,NULL,NULL,Lander,NV,Great Blue Heron,NULL,0194067,7/1/2010,00:00.0,2010,7,1,Teske,NULL,NULL,Lander,NV,Great Egret,NULL,0196068,7/1/2010,00:00.0,2010,7,1,Teske,NULL,NULL,Lander,NV,Snowy Egret,NULL,0197069,5/13/2009,00:00.0,2009,5,13,Wong,NULL,NULL,Lincoln,NV,Great Blue Heron,NULL,0194070,5/30/2009,00:00.0,2009,5,30,Wendland,NULL,NULL,Nye,NV,Caspian Tern,NULL,0064071,5/29/2009,00:00.0,2009,5,29,Jeffers,NULL,NULL,Churchill,NV,California Gull,NULL,0053072,5/29/2009,00:00.0,2009,5,29,Jeffers,NULL,NULL,Churchill,NV,Caspian Tern,NULL,0064073,5/29/2009,00:00.0,2009,5,29,Jeffers,NULL,NULL,Churchill,NV,Ring-billed Gull,NULL,0054074,5/29/2009,00:00.0,2009,5,29,Jeffers,NULL,NULL,Churchill,NV,Black-crowned Night-Heron,NULL,0202075,5/29/2009,00:00.0,2009,5,29,Jeffers,NULL,NULL,Churchill,NV,California Gull,NULL,0053076,5/29/2009,00:00.0,2009,5,29,Jeffers,NULL,NULL,Churchill,NV,Great Egret,NULL,0196077,5/29/2009,00:00.0,2009,5,29,Jeffers,NULL,NULL,Churchill,NV,Ring-billed Gull,NULL,0054078,5/29/2009,00:00.0,2009,5,29,Jeffers,NULL,NULL,Churchill,NV,Snowy Egret,NULL,0197079,4/21/2009,00:00.0,2009,4,21,Barnes,NULL,NULL,Clark,NV,Great Blue Heron,NULL,0194080,4/10/2009,00:00.0,2009,4,10,Barnes,NULL,NULL,Clark,NV,Great Blue Heron,NULL,0194081,6/20/2011,00:00.0,2011,6,20,Pietrzak,NULL,NULL,Washoe,NV,California Gull,NULL,0053082,5/24/2009,00:00.0,2009,5,24,Withers,NULL,NULL,Washoe,NV,American White Pelican,NULL,0125083,5/24/2009,00:00.0,2009,5,24,Withers,NULL,NULL,Washoe,NV,California Gull,NULL,0053084,5/24/2009,00:00.0,2009,5,24,Withers,NULL,NULL,Washoe,NV,Double-crested Cormorant,NULL,0120085,5/24/2009,00:00.0,2009,5,24,Withers,NULL,NULL,Washoe,NV,Great Blue Heron,NULL,0194086,5/18/2010,00:00.0,2010,5,18,Withers,NULL,NULL,Washoe,NV,American White Pelican,NULL,0125087,5/18/2010,00:00.0,2010,5,18,Withers,NULL,NULL,Washoe,NV,California Gull,NULL,0053088,5/18/2010,00:00.0,2010,5,18,Withers,NULL,NULL,Washoe,NV,Great Blue Heron,NULL,0194089,6/22/2010,00:00.0,2010,6,22,Withers,NULL,NULL,Washoe,NV,Double-crested Cormorant,NULL,0120090,5/26/2010,00:00.0,2010,5,26,Bauman,NULL,NULL,Humboldt,NV,Black-crowned Night-Heron,NULL,02020185,NULL,,1983,NULL,NULL,Rawlings,NULL,NULL,Lander,NV,White-faced Ibis,NULL,0187091,5/26/2010,00:00.0,2010,5,26,Bauman,NULL,NULL,Humboldt,NV,Great Blue Heron,NULL,0194092,5/26/2010,00:00.0,2010,5,26,Bauman,NULL,NULL,Humboldt,NV,Great Egret,NULL,0196093,5/27/2010,00:00.0,2010,5,27,Bauman,NULL,NULL,Humboldt,NV,White-faced Ibis,NULL,0187094,5/27/2010,00:00.0,2010,5,27,Bauman,NULL,NULL,Humboldt,NV,Black-crowned Night-Heron,NULL,0202095,5/27/2010,00:00.0,2010,5,27,Bauman,NULL,NULL,Humboldt,NV,Great Egret,NULL,0196096,5/27/2010,00:00.0,2010,5,27,Bauman,NULL,NULL,Humboldt,NV,White-faced Ibis,NULL,0187097,5/27/2010,00:00.0,2010,5,27,Bauman,NULL,NULL,Humboldt,NV,Black-crowned Night-Heron,NULL,0202098,5/27/2010,00:00.0,2010,5,27,Bauman,NULL,NULL,Humboldt,NV,Great Egret,NULL,0196099,5/27/2010,00:00.0,2010,5,27,Bauman,NULL,NULL,Humboldt,NV,White-faced Ibis,NULL,01870100,5/26/2010,00:00.0,2010,5,26,Bauman,NULL,NULL,Humboldt,NV,White-faced Ibis,NULL,01870101,5/26/2010,00:00.0,2010,5,26,Bauman,NULL,NULL,Humboldt,NV,White-faced Ibis,NULL,01870102,6/29/2009,00:00.0,2009,6,29,Maples et. al,NULL,NULL,Nye,NV,White-faced Ibis,NULL,01870103,6/16/2010,00:00.0,2010,6,16,Slatauski,NULL,NULL,Nye,NV,White-faced Ibis,NULL,01870104,6/13/2011,00:00.0,2011,6,13,Ballard et al.,NULL,NULL,Elko,NV,Double-crested Cormorant,NULL,01200105,6/13/2011,00:00.0,2011,6,13,Ballard et al.,NULL,NULL,Elko,NV,Forster's Tern,NULL,00690106,6/13/2011,00:00.0,2011,6,13,Ballard et al.,NULL,NULL,Elko,NV,Black-crowned Night-Heron,NULL,02020107,6/13/2011,00:00.0,2011,6,13,Ballard et al.,NULL,NULL,Elko,NV,Double-crested Cormorant,NULL,01200108,6/13/2011,00:00.0,2011,6,13,Ballard et al.,NULL,NULL,Elko,NV,Forster's Tern,NULL,00690109,6/13/2011,00:00.0,2011,6,13,Ballard et al.,NULL,NULL,Elko,NV,White-faced Ibis,NULL,01870110,6/13/2011,00:00.0,2011,6,13,Ballard et al.,NULL,NULL,Elko,NV,White-faced Ibis,NULL,01870111,6/13/2011,00:00.0,2011,6,13,Ballard et al.,NULL,NULL,Elko,NV,Double-crested Cormorant,NULL,01200112,6/13/2011,00:00.0,2011,6,13,Ballard et al.,NULL,NULL,Elko,NV,Forster's Tern,NULL,00690113,6/13/2011,00:00.0,2011,6,13,Ballard et al.,NULL,NULL,Elko,NV,White-faced Ibis,NULL,01870114,4/1/2009,00:00.0,2009,4,1,Cottle,NULL,NULL,Churchill,NV,Double-crested Cormorant,NULL,01200115,5/13/2009,00:00.0,2009,5,13,Jeffers,NULL,NULL,Churchill,NV,Double-crested Cormorant,NULL,01200116,5/13/2009,00:00.0,2009,5,13,Jeffers,NULL,NULL,Churchill,NV,Great Egret,NULL,01960117,5/13/2009,00:00.0,2009,5,13,Jeffers,NULL,NULL,Churchill,NV,Snowy Egret,NULL,01970118,6/12/2009,00:00.0,2009,6,12,Jeffers,NULL,NULL,Churchill,NV,Double-crested Cormorant,NULL,01200119,6/12/2009,00:00.0,2009,6,12,Jeffers,NULL,NULL,Churchill,NV,Great Egret,NULL,01960120,5/24/2011,00:00.0,2011,5,24,Jeffers,NULL,NULL,Churchill,NV,Great Egret,NULL,01960121,NULL,,2009,4,NULL,Cottle,NULL,NULL,Churchill,NV,Great Egret,NULL,01960122,5/19/2010,00:00.0,2010,5,19,Bradley,NULL,NULL,Elko,NV,Great Blue Heron,NULL,01940123,5/24/2010,00:00.0,2010,5,24,Bradley,NULL,NULL,Elko,NV,Great Blue Heron,NULL,01940124,7/13/2010,00:00.0,2010,7,13,Ballard,NULL,NULL,Elko,NV,Eared Grebe,NULL,00040125,7/13/2010,00:00.0,2010,7,13,Ballard,NULL,NULL,Elko,NV,Western Grebe,NULL,00010126,6/14/2011,00:00.0,2011,6,14,Ballard,NULL,NULL,Elko,NV,Caspian Tern,NULL,00640127,6/14/2011,00:00.0,2011,6,14,Ballard,NULL,NULL,Elko,NV,Eared Grebe,NULL,00040128,6/14/2011,00:00.0,2011,6,14,Ballard,NULL,NULL,Elko,NV,Ring-billed Gull,NULL,00540130,5/19/2010,00:00.0,2010,5,19,Bradley,NULL,NULL,White Pine,NV,Black-crowned Night-Heron,NULL,02020131,5/19/2010,00:00.0,2010,5,19,Bradley,NULL,NULL,White Pine,NV,White-faced Ibis,NULL,01870132,5/25/2010,00:00.0,2010,5,25,Bradley,NULL,NULL,Elko,NV,White-faced Ibis,NULL,01870133,5/25/2010,00:00.0,2010,5,25,Bradley,NULL,NULL,Elko,NV,Black-crowned Night-Heron,NULL,02020134,5/25/2010,00:00.0,2010,5,25,Bradley,NULL,NULL,Elko,NV,Egret species,NULL,NULL135,6/26/2009,00:00.0,2009,6,26,Dozet,NULL,NULL,White Pine,NV,Eared Grebe,NULL,00040136,5/28/2010,00:00.0,2010,5,28,Conner/Henderson,NULL,NULL,White Pine,NV,Eared Grebe,NULL,00040137,6/12/2009,00:00.0,2009,6,12,Jeffers,NULL,NULL,Churchill,NV,Black-crowned Night-Heron,NULL,02020138,6/12/2009,00:00.0,2009,6,12,Jeffers,NULL,NULL,Churchill,NV,Great Egret,NULL,01960139,6/12/2009,00:00.0,2009,6,12,Jeffers,NULL,NULL,Churchill,NV,White-faced Ibis,NULL,01870140,5/24/2011,00:00.0,2011,5,24,Jeffers,NULL,NULL,Churchill,NV,Black-crowned Night-Heron,NULL,02020141,5/24/2011,00:00.0,2011,5,24,Jeffers,NULL,NULL,Churchill,NV,Great Blue Heron,NULL,01940142,5/24/2011,00:00.0,2011,5,24,Jeffers,NULL,NULL,Churchill,NV,Great Egret,NULL,01960143,5/24/2011,00:00.0,2011,5,24,Jeffers,NULL,NULL,Churchill,NV,White-faced Ibis,NULL,01870144,5/24/2011,00:00.0,2011,5,24,Jeffers,NULL,NULL,Churchill,NV,Black-crowned Night-Heron,NULL,02020145,5/24/2011,00:00.0,2011,5,24,Jeffers,NULL,NULL,Churchill,NV,Great Egret,NULL,01960146,5/24/2011,00:00.0,2011,5,24,Jeffers,NULL,NULL,Churchill,NV,White-faced Ibis,NULL,01870147,5/24/2011,00:00.0,2011,5,24,Jeffers,NULL,NULL,Churchill,NV,Black-crowned Night-Heron,NULL,02020148,5/24/2011,00:00.0,2011,5,24,Jeffers,NULL,NULL,Churchill,NV,Great Egret,NULL,01960149,5/24/2011,00:00.0,2011,5,24,Jeffers,NULL,NULL,Churchill,NV,White-faced Ibis,NULL,01870150,6/12/2009,00:00.0,2009,6,12,Jeffers,NULL,NULL,Churchill,NV,Black-crowned Night-Heron,NULL,02020151,6/12/2009,00:00.0,2009,6,12,Jeffers,NULL,NULL,Churchill,NV,Black-crowned Night-Heron,NULL,02020152,6/12/2009,00:00.0,2009,6,12,Jeffers,NULL,NULL,Churchill,NV,Black-crowned Night-Heron,NULL,02020153,6/12/2009,00:00.0,2009,6,12,Jeffers,NULL,NULL,Churchill,NV,White-faced Ibis,NULL,01870154,5/15/2009,00:00.0,2009,5,15,Jeffers,NULL,NULL,Churchill,NV,Great Blue Heron,NULL,01940155,6/12/2009,00:00.0,2009,6,12,Jeffers,NULL,NULL,Churchill,NV,Great Blue Heron,NULL,01940156,7/16/2010,00:00.0,2010,7,16,Boyd,NULL,NULL,Elko,NV,Black Tern,NULL,00770157,7/5/2010,00:00.0,2010,7,5,Goodman,NULL,NULL,Washoe,NV,Eared Grebe,NULL,00040158,6/5/2011,00:00.0,2011,6,5,Serdehely/Serdehely,NULL,NULL,Washoe,NV,Eared Grebe,NULL,00040159,6/5/2011,00:00.0,2011,6,5,Serdehely/Serdehely,NULL,NULL,Washoe,NV,White-faced Ibis,NULL,01870160,6/4/2009,00:00.0,2009,6,4,Dozet,NULL,NULL,Washoe,NV,California Gull,NULL,00530161,6/4/2009,00:00.0,2009,6,4,Dozet,NULL,NULL,Washoe,NV,Double-crested Cormorant,NULL,01200162,6/17/2010,00:00.0,2010,6,17,Ballard,NULL,NULL,Washoe,NV,California Gull,NULL,00530163,6/17/2010,00:00.0,2010,6,17,Ballard,NULL,NULL,Washoe,NV,Double-crested Cormorant,NULL,01200164,6/17/2010,00:00.0,2010,6,17,Ballard,NULL,NULL,Washoe,NV,Snowy Egret,NULL,01970165,6/15/2011,00:00.0,2011,6,15,Serdehely/Serdehely,NULL,NULL,Washoe,NV,Black-crowned Night-Heron,NULL,02020166,6/15/2011,00:00.0,2011,6,15,Serdehely/Serdehely,NULL,NULL,Washoe,NV,White-faced Ibis,NULL,01870167,6/15/2011,00:00.0,2011,6,15,Serdehely/Serdehely,NULL,NULL,Washoe,NV,Black-crowned Night-Heron,NULL,02020168,6/15/2011,00:00.0,2011,6,15,Serdehely/Serdehely,NULL,NULL,Washoe,NV,Caspian Tern,NULL,00640169,6/15/2011,00:00.0,2011,6,15,Serdehely/Serdehely,NULL,NULL,Washoe,NV,White-faced Ibis,NULL,01870170,NULL,,2007,NULL,NULL,Teske,NULL,NULL,Humboldt,NV,Black-crowned Night-Heron,NULL,02020171,NULL,,2007,NULL,NULL,Teske,NULL,NULL,Humboldt,NV,Great Egret,NULL,01960172,NULL,,2007,NULL,NULL,Teske,NULL,NULL,Humboldt,NV,Snowy Egret,NULL,01970173,NULL,,1993,NULL,NULL,Teske,NULL,NULL,Eureka,NV,Great Blue Heron,NULL,01940174,NULL,,NULL,NULL,NULL,Teske,NULL,NULL,Elko,NV,Black-crowned Night-Heron,SurveyDate:1982-?,02020175,NULL,,NULL,NULL,NULL,Jeffers,NULL,NULL,Churchill,NV,NULL,"SurveyDate:1970-2008 ; multiple species: Great Blue Heron, Great Egret, Snowy Egret, Cattle Egret, Black-crowned Night Heron  and White-faced Ibis",NULL176,NULL,,NULL,NULL,NULL,Jeffers,NULL,NULL,Churchill,NV,NULL,"SurveyDate:1970-2008 ; multiple species: Great Blue Heron, Great Egret, Snowy Egret, Cattle Egret, and Black-crowned Night Heron",NULL177,NULL,,1998,NULL,NULL,Bradley,NULL,NULL,Elko,NV,American White Pelican,NULL,01250178,NULL,,NULL,NULL,NULL,Bradley,NULL,NULL,Elko,NV,Black-crowned Night-Heron,SurveyDate:1983-?,02020179,NULL,,NULL,NULL,NULL,Stiver,NULL,NULL,Elko,NV,White-faced Ibis,SurveyDate:1980-?,01870180,NULL,,1983,NULL,NULL,Rawlings,NULL,NULL,Lander,NV,NULL,"Great Egret, Snowy Egret, and Cattle Egret",NULL181,NULL,,NULL,NULL,NULL,Teske/Bradley,NULL,NULL,Elko,NV,NULL,"SurveyDate: 1980-2008 ; Multiple specie: Great Egret, Snowy Egret, Cattle Egret, and Black-crowned Night Heron",NULL182,NULL,,NULL,NULL,NULL,Boyd,NULL,NULL,Elko,NV,Black Tern,SurveyDate: 2001-7/16/2010,00770183,NULL,,NULL,NULL,NULL,Teske,NULL,NULL,Lander,NV,NULL,"SurveyDate: 2005-2010 ; Multiple specie: Great Egret, Snowy Egret, Cattle Egret, and Black-crowned Night Heron",NULL184,NULL,,1983,NULL,NULL,Teske,NULL,NULL,Lander,NV,Great Blue Heron,NULL,01940186,NULL,,NULL,NULL,NULL,Bradley,NULL,NULL,Elko,NV,Great Egret,SurveyDate:1993-2008,01960187,NULL,,NULL,NULL,NULL,Boyd,NULL,NULL,Elko,NV,Black Tern,SurveyDate:2001-2009,00770188,NULL,,NULL,NULL,NULL,Boyd,NULL,NULL,Elko,NV,White-faced Ibis,SurveyDate:2001-6/6/2008,018702069,5/28/2009,00:00.0,2009,5,28,Warrenet al.,NULL,NULL,Beaverhead,MT,Great Blue Heron,NULL,019402070,6/1/2009,00:00.0,2009,6,1,Warren et al.,NULL,NULL,Beaverhead,MT,California Gull,NULL,005302071,6/16/2009,00:00.0,2009,6,16,Warren et al.,NULL,NULL,Beaverhead,MT,Franklin's Gull,NULL,005902072,6/23/2009,00:00.0,2009,6,23,Warren et al.,NULL,NULL,Beaverhead,MT,Forster's Tern,NULL,006902073,6/23/2009,00:00.0,2009,6,23,Warren et al.,NULL,NULL,Beaverhead,MT,White-faced Ibis,NULL,018702074,6/18/2010,00:00.0,2010,6,18,Warren et al.,NULL,NULL,Beaverhead,MT,Franklin's Gull,NULL,005902075,6/18/2010,00:00.0,2010,6,18,Warren et al.,NULL,NULL,Beaverhead,MT,White-faced Ibis,NULL,018702076,6/22/2010,00:00.0,2010,6,22,Warren et al.,NULL,NULL,Beaverhead,MT,California Gull,NULL,005302077,7/21/2010,00:00.0,2010,7,21,Warren et al.,NULL,NULL,Beaverhead,MT,Eared Grebe,NULL,000402078,7/13/2009,00:00.0,2009,7,13,Amestoy/Donahey,NULL,NULL,Phillips,MT,Eared Grebe,NULL,000402079,5/11/2009,00:00.0,2009,5,11,Bissell/Tempel,NULL,NULL,Flathead,MT,Great Blue Heron,NULL,019402080,7/2/2010,00:00.0,2010,7,2,Stutzman,NULL,NULL,Flathead,MT,Great Blue Heron,NULL,019402081,5/13/2011,00:00.0,2011,5,13,Vore/Hammond,NULL,NULL,Flathead,MT,Great Blue Heron,NULL,019402082,NULL,,2011,4,16,Stewart,NULL,NULL,Carbon,MT,Great Blue Heron,NULL,019402083,7/7/2010,00:00.0,2010,7,7,Tilly,NULL,NULL,Chouteau,MT,Black Tern,NULL,007702084,6/10/2009,00:00.0,2009,6,10,Tilly,NULL,NULL,Chouteau,MT,Black Tern,NULL,007702085,6/10/2009,00:00.0,2009,6,10,Tilly,NULL,NULL,Chouteau,MT,Eared Grebe,NULL,000402086,6/28/2009,00:00.0,2009,6,28,Tilly,NULL,NULL,Hill,MT,Eared Grebe,NULL,000402087,5/12/2011,00:00.0,2011,5,12,Hammond/Cascaddan,NULL,NULL,Lincoln,MT,Great Blue Heron,NULL,019402088,6/29/2009,00:00.0,2009,6,29,Paige,NULL,NULL,Flathead,MT,Black Tern,NULL,007702089,6/30/2009,00:00.0,2009,6,30,Prellwitz,NULL,NULL,Phillips,MT,Common Tern,NULL,007002090,NULL,,2010,5,9,Waltee,NULL,NULL,Prairie,MT,Great Blue Heron,NULL,019402091,5/19/2011,00:00.0,2011,5,19,DuBois/Throop,NULL,NULL,Missoula,MT,Great Blue Heron,NULL,019402092,6/20/2009,00:00.0,2009,6,20,Paige/Kelly,NULL,NULL,Lake,MT,Black Tern,NULL,007702093,7/2/2010,00:00.0,2010,7,2,Doney,NULL,NULL,Lake,MT,Black Tern,NULL,007702094,7/13/2009,00:00.0,2009,7,13,Amestoy/Donahey,NULL,NULL,Phillips,MT,Eared Grebe,NULL,000402095,7/15/2010,00:00.0,2010,7,15,Amestoy/George,NULL,NULL,Phillips,MT,Eared Grebe,NULL,000402096,NULL,,2011,4,2,Wightman,NULL,NULL,Lewis & Clark,MT,Great Blue Heron,NULL,019402097,4/22/2011,00:00.0,2011,4,22,Sterling,NULL,NULL,Sanders,MT,Great Blue Heron,NULL,019402098,6/16/2009,00:00.0,2009,6,16,Paige,NULL,NULL,Liberty,MT,Ring-billed Gull,NULL,005402099,5/8/2010,00:00.0,2010,5,8,Waltee,NULL,NULL,Custer,MT,Great Blue Heron,NULL,019402100,NULL,,2009,4,26,Waltee,NULL,NULL,Custer,MT,Great Blue Heron,NULL,019402101,NULL,,2009,4,26,Waltee,NULL,NULL,Rosebud,MT,Great Blue Heron,NULL,019402102,NULL,,2009,4,26,Waltee,NULL,NULL,Rosebud,MT,Great Blue Heron,NULL,019402103,NULL,,2009,4,26,Waltee,NULL,NULL,Rosebud,MT,Great Blue Heron,NULL,019401966,NULL,,2009,4,24,Waltee,NULL,NULL,Rosebud,MT,Great Blue Heron,NULL,019401967,NULL,,2009,4,24,Waltee,NULL,NULL,Rosebud,MT,Great Blue Heron,NULL,019401968,NULL,,2009,4,24,Waltee,NULL,NULL,Rosebud,MT,Great Blue Heron,NULL,019401,5/27/2013,00:00.0,2013,5,27,"Bonter, David",42.9882,-70.6143,York,ME,HERG,1 additional confirmed nest of lesser Black-bakced gull x herring gull pair.  No correction.Location comm: We attempted to count all nests on the island.  Nest locations were marked with chalk to prev,005102,6/4/2013,00:00.0,2013,6,4,"Bonter, David",42.9882,-70.6143,York,ME,GBBG,"Multiday census:  MAY 27- JUN 4, 2013.  1 additional confirmed nest of lesser Black-bakced gull x herring gull pair.  No correction.Location comm: We attempted to count all nests on the island.  Nest",004703,5/31/2013,00:00.0,2013,5,31,"Chalfant, Jordan",42.9882,-70.6143,York,ME,GBBG,GBBG correction factor = 1.004; HEGU correction factor = 0.9882.Location comm:,004704,5/31/2013,00:00.0,2013,5,31,"Chalfant, Jordan",42.9882,-70.6143,York,ME,HERG,GBBG correction factor = 1.004; HEGU correction factor = 0.9882.Location comm:,005105,5/31/2013,00:00.0,2013,5,31,"Chalfant, Jordan",42.9882,-70.6143,York,ME,DCCO,GBBG correction factor = 1.004; HEGU correction factor = 0.9882.Location comm:,012006,6/6/2013,00:00.0,2013,6,6,"Swann, Scott",44.4204,-68.2112,Hancock,ME,HERG,NULL,005107,6/6/2013,00:00.0,2013,6,6,"Swann, Scott",44.4204,-68.2112,Hancock,ME,GBBG,NULL,004708,5/30/2013,00:00.0,2013,5,30,"Williams, Sarah",44.561,-67.5529,Washington,ME,HERG,Only two HEGU nests were found in tall/thick vegetation (may not be visible in aerial photo).  One egg GBBG nests were likely HEGU- this represents the only correction made.  Nest clutch by size HEGU,005109,5/30/2013,00:00.0,2013,5,30,"Williams, Sarah",44.561,-67.5529,Washington,ME,GBBG,Only two HEGU nests were found in tall/thick vegetation (may not be visible in aerial photo).  One egg GBBG nests were likely HEGU- this represents the only correction made.  Nest clutch by size HEGU,0047010,5/30/2013,00:00.0,2013,5,30,"Williams, Sarah",44.561,-67.5529,Washington,ME,LAGU,Only two HEGU nests were found in tall/thick vegetation (may not be visible in aerial photo).  One egg GBBG nests were likely HEGU- this represents the only correction made.  Nest clutch by size HEGU,0058011,5/30/2013,00:00.0,2013,5,30,"Williams, Sarah",44.561,-67.5529,Washington,ME,DCCO,Only two HEGU nests were found in tall/thick vegetation (may not be visible in aerial photo).  One egg GBBG nests were likely HEGU- this represents the only correction made.  Nest clutch by size HEGU,0120012,5/30/2013,00:00.0,2013,5,30,"Williams, Sarah",44.561,-67.5529,Washington,ME,COEI,Only two HEGU nests were found in tall/thick vegetation (may not be visible in aerial photo).  One egg GBBG nests were likely HEGU- this represents the only correction made.  Nest clutch by size HEGU,0159013,5/28/2013,00:00.0,2013,5,28,"Schauffler, Rick",43.9176,-69.2961,Knox,ME,GBBG,GBBG correction factor = 1.004; HEGU correction factor = 0.9882.  2 CAGO???Location comm:,0047014,5/28/2013,00:00.0,2013,5,28,"Schauffler, Rick",43.9176,-69.2961,Knox,ME,HERG,GBBG correction factor = 1.004; HEGU correction factor = 0.9882.  2 CAGO???Location comm:,0051015,5/28/2013,00:00.0,2013,5,28,"Schauffler, Rick",43.9176,-69.2961,Knox,ME,DCCO,GBBG correction factor = 1.004; HEGU correction factor = 0.9882.  2 CAGO???Location comm:,0120016,5/28/2013,00:00.0,2013,5,28,"Schauffler, Rick",43.9176,-69.2961,Knox,ME,CANG,GBBG correction factor = 1.004; HEGU correction factor = 0.9882.  2 CAGO???Location comm:,0172017,5/30/2013,00:00.0,2013,5,30,"Langlois, Michael",44.268,-68.7197,Hancock,ME,GBBG,GBBG correction factor = 1.004; HEGU correction factor = 0.9882.Location comm:,0047018,5/30/2013,00:00.0,2013,5,30,"Langlois, Michael",44.268,-68.7197,Hancock,ME,HERG,GBBG correction factor = 1.004; HEGU correction factor = 0.9882.Location comm:,0051019,5/30/2013,00:00.0,2013,5,30,"Langlois, Michael",44.268,-68.7197,Hancock,ME,DCCO,GBBG correction factor = 1.004; HEGU correction factor = 0.9882.Location comm:,0120020,5/30/2013,00:00.0,2013,5,30,"Gettle, Beth",44.2312,-68.4407,Hancock,ME,GBBG,GBBG correction factor = 1.004; HEGU correction factor = 0.9882.Location comm:,0047021,5/30/2013,00:00.0,2013,5,30,"Gettle, Beth",44.2312,-68.4407,Hancock,ME,HERG,GBBG correction factor = 1.004; HEGU correction factor = 0.9882.Location comm:,0051022,5/30/2013,00:00.0,2013,5,30,"Gettle, Beth",44.2312,-68.4407,Hancock,ME,DCCO,GBBG correction factor = 1.004; HEGU correction factor = 0.9882.Location comm:,0120023,5/30/2013,00:00.0,2013,5,30,"Gettle, Beth",44.2326,-68.4494,Hancock,ME,GBBG,GBBG correction factor = 1.004; HEGU correction factor = 0.9882.Location comm:,0047024,5/30/2013,00:00.0,2013,5,30,"Gettle, Beth",44.2326,-68.4494,Hancock,ME,HERG,GBBG correction factor = 1.004; HEGU correction factor = 0.9882.Location comm:,0051025,5/30/2013,00:00.0,2013,5,30,"Gettle, Beth",44.2326,-68.4494,Hancock,ME,DCCO,GBBG correction factor = 1.004; HEGU correction factor = 0.9882.Location comm:,0120026,6/6/2013,00:00.0,2013,6,6,"Mittelhauser, Glen",44.4722,-67.6644,Washington,ME,GBBG,One roosting GBBG and 3 roossting DCCO on island.  No nesting suspected.Location comm:,0047027,6/6/2013,00:00.0,2013,6,6,"Mittelhauser, Glen",44.4722,-67.6644,Washington,ME,HERG,One roosting GBBG and 3 roossting DCCO on island.  No nesting suspected.Location comm:,0051028,6/6/2013,00:00.0,2013,6,6,"Mittelhauser, Glen",44.4722,-67.6644,Washington,ME,DCCO,One roosting GBBG and 3 roossting DCCO on island.  No nesting suspected.Location comm:,0120029,6/6/2013,00:00.0,2013,6,6,"Swann, Scott",44.4759,-68.2059,Hancock,ME,HERG,No nesting seabirds encountered.  Eagle nest - not sure if active or not.Location comm:,0051030,6/6/2013,00:00.0,2013,6,6,"Swann, Scott",44.4759,-68.2059,Hancock,ME,GBBG,No nesting seabirds encountered.  Eagle nest - not sure if active or not.Location comm:,0047031,5/31/2013,00:00.0,2013,5,31,"Chalfant, Jordan",44.4673,-67.7374,Washington,ME,GBBG,GBBG correction factor = 1.004; HEGU correction factor = 0.9882.  48 CANADA GEESE.Location comm:,0047032,5/31/2013,00:00.0,2013,5,31,"Chalfant, Jordan",44.4673,-67.7374,Washington,ME,HERG,GBBG correction factor = 1.004; HEGU correction factor = 0.9882.  48 CANADA GEESE.Location comm:,0051033,5/31/2013,00:00.0,2013,5,31,"Chalfant, Jordan",44.4673,-67.7374,Washington,ME,DCCO,GBBG correction factor = 1.004; HEGU correction factor = 0.9882.  48 CANADA GEESE.Location comm:,0120034,5/31/2013,00:00.0,2013,5,31,"Chalfant, Jordan",44.4673,-67.7374,Washington,ME,CANG,GBBG correction factor = 1.004; HEGU correction factor = 0.9882.  48 CANADA GEESE.Location comm:,0172035,6/15/2013,00:00.0,2013,6,15,"Anderson, John",44.0272,-68.5757,Knox,ME,HERG,7 HEGU + 2 GBBG (individuals) present with no evidence of nesting at this island.Location comm:,0051036,6/15/2013,00:00.0,2013,6,15,"Anderson, John",44.0272,-68.5757,Knox,ME,GBBG,7 HEGU + 2 GBBG (individuals) present with no evidence of nesting at this island.Location comm:,0047037,6/15/2013,00:00.0,2013,6,15,"Anderson, John",44.0272,-68.5757,Knox,ME,DCCO,7 HEGU + 2 GBBG (individuals) present with no evidence of nesting at this island.Location comm:,0120038,5/28/2013,00:00.0,2013,5,28,"Chalfant, Jordan",43.5091,-70.3178,York,ME,GBBG,GBBG correction factor = 1.004; HEGU correction factor = 0.9882.Location comm:,0047039,5/28/2013,00:00.0,2013,5,28,"Chalfant, Jordan",43.5091,-70.3178,York,ME,HERG,GBBG correction factor = 1.004; HEGU correction factor = 0.9882.Location comm:,0051040,5/28/2013,00:00.0,2013,5,28,"Chalfant, Jordan",43.5091,-70.3178,York,ME,DCCO,GBBG correction factor = 1.004; HEGU correction factor = 0.9882.Location comm:,0120041,6/15/2013,00:00.0,2013,6,15,"Anderson, John",44.0124,-68.7709,Knox,ME,HERG,cannot extrapolate number of nests from single bird count in boat.Location comm:,0051042,6/15/2013,00:00.0,2013,6,15,"Anderson, John",44.0124,-68.7709,Knox,ME,GBBG,cannot extrapolate number of nests from single bird count in boat.Location comm:,0047043,6/15/2013,00:00.0,2013,6,15,"Anderson, John",44.0124,-68.7709,Knox,ME,DCCO,cannot extrapolate number of nests from single bird count in boat.Location comm:,0120044,5/30/2013,00:00.0,2013,5,30,"Williams, Sarah",44.1094,-68.4671,Hancock,ME,GBBG,GBBG correction factor = 1.004; HEGU correction factor = 0.9882.Location comm:,0047045,5/30/2013,00:00.0,2013,5,30,"Williams, Sarah",44.1094,-68.4671,Hancock,ME,HERG,GBBG correction factor = 1.004; HEGU correction factor = 0.9882.Location comm:,0051046,5/30/2013,00:00.0,2013,5,30,"Williams, Sarah",44.1094,-68.4671,Hancock,ME,DCCO,GBBG correction factor = 1.004; HEGU correction factor = 0.9882.Location comm:,0120047,5/30/2013,00:00.0,2013,5,30,"Schauffler, Rick",44.0124,-68.7709,Knox,ME,GBBG,GBBG correction factor = 1.004; HEGU correction factor = 0.9882.Location comm:,0047048,5/30/2013,00:00.0,2013,5,30,"Schauffler, Rick",44.0124,-68.7709,Knox,ME,HERG,GBBG correction factor = 1.004; HEGU correction factor = 0.9882.Location comm:,0051049,5/30/2013,00:00.0,2013,5,30,"Schauffler, Rick",44.0124,-68.7709,Knox,ME,DCCO,GBBG correction factor = 1.004; HEGU correction factor = 0.9882.Location comm:,0120050,5/28/2013,00:00.0,2013,5,28,"Houston, Bob",43.6982,-70.0676,Cumberland,ME,COEI,No correction noted.Location comm:,0159051,5/28/2013,00:00.0,2013,5,28,"Houston, Bob",43.6982,-70.0676,Cumberland,ME,GBBG,No correction noted.Location comm:,0047052,5/28/2013,00:00.0,2013,5,28,"Houston, Bob",43.6982,-70.0676,Cumberland,ME,HERG,No correction noted.Location comm:,0051053,5/28/2013,00:00.0,2013,5,28,"Houston, Bob",43.6982,-70.0676,Cumberland,ME,DCCO,No correction noted.Location comm:,0120054,5/28/2013,00:00.0,2013,5,28,"Houston, Bob",43.7005,-70.0665,Cumberland,ME,COEI,No correction noted.Location comm:,0159055,5/28/2013,00:00.0,2013,5,28,"Houston, Bob",43.7005,-70.0665,Cumberland,ME,GBBG,No correction noted.Location comm:,0047056,5/28/2013,00:00.0,2013,5,28,"Houston, Bob",43.7005,-70.0665,Cumberland,ME,HERG,No correction noted.Location comm:,0051057,5/28/2013,00:00.0,2013,5,28,"Houston, Bob",43.7005,-70.0665,Cumberland,ME,DCCO,No correction noted.Location comm:,0120058,6/19/2013,00:00.0,2013,6,19,"Houston, Bob",43.7077,-69.8913,Cumberland,ME,COTE,No correction noted.  DCCO appear to be nesting but couldn't count them accurately.  Gull chicks also seen.Location comm:,0070059,6/19/2013,00:00.0,2013,6,19,"Houston, Bob",43.7077,-69.8913,Cumberland,ME,ROST,No correction noted.  DCCO appear to be nesting but couldn't count them accurately.  Gull chicks also seen.Location comm:,0072060,6/19/2013,00:00.0,2013,6,19,"Houston, Bob",43.7077,-69.8913,Cumberland,ME,ARTE,No correction noted.  DCCO appear to be nesting but couldn't count them accurately.  Gull chicks also seen.Location comm:,0071061,5/28/2013,00:00.0,2013,5,28,"Mittelhauser, Glen",43.7077,-69.8913,Cumberland,ME,GBBG,GBBG Corecction factor = 1.004; HEGU correction factor = 0.9882.Location comm:,0047062,5/28/2013,00:00.0,2013,5,28,"Mittelhauser, Glen",43.7077,-69.8913,Cumberland,ME,HERG,GBBG Corecction factor = 1.004; HEGU correction factor = 0.9882.Location comm:,0051063,5/28/2013,00:00.0,2013,5,28,"Mittelhauser, Glen",43.7077,-69.8913,Cumberland,ME,DCCO,GBBG Corecction factor = 1.004; HEGU correction factor = 0.9882.Location comm:,0120064,5/28/2013,00:00.0,2013,5,28,"Chalfant, Jordan",43.6954,-70.0722,Cumberland,ME,GBBG,GBBG Corecction factor = 1.004; HEGU correction factor = 0.9882.Location comm:,0047065,5/28/2013,00:00.0,2013,5,28,"Chalfant, Jordan",43.6954,-70.0722,Cumberland,ME,HERG,GBBG Corecction factor = 1.004; HEGU correction factor = 0.9882.Location comm:,0051066,5/28/2013,00:00.0,2013,5,28,"Chalfant, Jordan",43.6954,-70.0722,Cumberland,ME,DCCO,GBBG Corecction factor = 1.004; HEGU correction factor = 0.9882.Location comm:,0120067,5/31/2013,00:00.0,2013,5,31,"Mittelhauser, Glen",44.4625,-67.6194,Washington,ME,GBBG,GBBG correction factor = 1.004; HEGU correction factor = 0.9882.Location comm:,0047068,5/31/2013,00:00.0,2013,5,31,"Mittelhauser, Glen",44.4625,-67.6194,Washington,ME,HERG,GBBG correction factor = 1.004; HEGU correction factor = 0.9882.Location comm:,0051069,5/31/2013,00:00.0,2013,5,31,"Mittelhauser, Glen",44.4625,-67.6194,Washington,ME,DCCO,GBBG correction factor = 1.004; HEGU correction factor = 0.9882.Location comm:,0120070,5/31/2013,00:00.0,2013,5,31,"Chalfant, Jordan",43.3467,-70.4471,York,ME,GBBG,GBBG correction factor = 1.004; HEGU correction factor = 0.9882.Location comm:,0047071,5/31/2013,00:00.0,2013,5,31,"Chalfant, Jordan",43.3467,-70.4471,York,ME,HERG,GBBG correction factor = 1.004; HEGU correction factor = 0.9882.Location comm:,0051072,5/31/2013,00:00.0,2013,5,31,"Chalfant, Jordan",43.3467,-70.4471,York,ME,DCCO,GBBG correction factor = 1.004; HEGU correction factor = 0.9882.Location comm:,0120073,5/30/2013,00:00.0,2013,5,30,"Mittelhauser, Glen",44.8816,-66.9978,Washington,ME,GBBG,GBBG correction factor = 1.004; HEGU correction factor = 0.9882.Location comm:,0047074,5/30/2013,00:00.0,2013,5,30,"Mittelhauser, Glen",44.8816,-66.9978,Washington,ME,HERG,GBBG correction factor = 1.004; HEGU correction factor = 0.9882.Location comm:,0051075,5/30/2013,00:00.0,2013,5,30,"Mittelhauser, Glen",44.8816,-66.9978,Washington,ME,DCCO,GBBG correction factor = 1.004; HEGU correction factor = 0.9882.Location comm:,0120076,5/30/2013,00:00.0,2013,5,30,"Schauffler, Rick",44.0239,-68.7982,Knox,ME,GBBG,GBBG correction factor = 1.004; HEGU correction factor = 0.9882.Location comm:,0047077,5/30/2013,00:00.0,2013,5,30,"Schauffler, Rick",44.0239,-68.7982,Knox,ME,HERG,GBBG correction factor = 1.004; HEGU correction factor = 0.9882.Location comm:,0051078,5/30/2013,00:00.0,2013,5,30,"Schauffler, Rick",44.0239,-68.7982,Knox,ME,DCCO,GBBG correction factor = 1.004; HEGU correction factor = 0.9882.Location comm:,0120079,5/31/2013,00:00.0,2013,5,31,"Chalfant, Jordan",42.9783,-70.6078,York,ME,GBBG,GBBG correction factor = 1.004; HEGU correction factor = 0.9882.Location comm:,0047080,5/31/2013,00:00.0,2013,5,31,"Chalfant, Jordan",42.9783,-70.6078,York,ME,HERG,GBBG correction factor = 1.004; HEGU correction factor = 0.9882.Location comm:,0051081,5/31/2013,00:00.0,2013,5,31,"Chalfant, Jordan",42.9783,-70.6078,York,ME,DCCO,GBBG correction factor = 1.004; HEGU correction factor = 0.9882.Location comm:,0120082,5/28/2013,00:00.0,2013,5,28,"Chalfant, Jordan",43.7512,-69.9483,Cumberland,ME,GBBG,GBBG Corecction factor = 1.004; HEGU correction factor = 0.9882.Location comm:,0047083,5/28/2013,00:00.0,2013,5,28,"Chalfant, Jordan",43.7512,-69.9483,Cumberland,ME,HERG,GBBG Corecction factor = 1.004; HEGU correction factor = 0.9882.Location comm:,0051084,5/28/2013,00:00.0,2013,5,28,"Chalfant, Jordan",43.7512,-69.9483,Cumberland,ME,DCCO,GBBG Corecction factor = 1.004; HEGU correction factor = 0.9882.Location comm:,0120085,5/30/2013,00:00.0,2013,5,30,"Langlois, Michael",44.2129,-68.8121,Hancock,ME,GBBG,GBBG correction factor = 1.004; HEGU correction factor = 0.9882.Location comm:,0047086,5/30/2013,00:00.0,2013,5,30,"Langlois, Michael",44.2129,-68.8121,Hancock,ME,HERG,GBBG correction factor = 1.004; HEGU correction factor = 0.9882.Location comm:,0051087,5/30/2013,00:00.0,2013,5,30,"Langlois, Michael",44.2129,-68.8121,Hancock,ME,DCCO,GBBG correction factor = 1.004; HEGU correction factor = 0.9882.Location comm:,0120088,5/20/2013,00:00.0,2013,5,20,"Houston, Bob",43.713,-70.1943,Cumberland,ME,COEI,No correction noted.Location comm: Ledge with 2 trees on it.,0159089,5/20/2013,00:00.0,2013,5,20,"Houston, Bob",43.713,-70.1943,Cumberland,ME,GBBG,No correction noted.Location comm: Ledge with 2 trees on it.,0047090,5/20/2013,00:00.0,2013,5,20,"Houston, Bob",43.713,-70.1943,Cumberland,ME,HERG,No correction noted.Location comm: Ledge with 2 trees on it.,0051091,5/30/2013,00:00.0,2013,5,30,"Mittelhauser, Glen",44.2605,-68.8411,Hancock,ME,GBBG,GBBG correction factor = 1.004; HEGU correction factor = 0.9882.Location comm:,0047092,5/30/2013,00:00.0,2013,5,30,"Mittelhauser, Glen",44.2605,-68.8411,Hancock,ME,HERG,GBBG correction factor = 1.004; HEGU correction factor = 0.9882.Location comm:,0051093,5/30/2013,00:00.0,2013,5,30,"Mittelhauser, Glen",44.2605,-68.8411,Hancock,ME,DCCO,GBBG correction factor = 1.004; HEGU correction factor = 0.9882.Location comm:,0120094,5/30/2013,00:00.0,2013,5,30,"Mittelhauser, Glen",44.0228,-69.0353,Knox,ME,GBBG,GBBG correction factor = 1.004; HEGU correction factor = 0.9882.Location comm:,0047095,5/30/2013,00:00.0,2013,5,30,"Mittelhauser, Glen",44.0228,-69.0353,Knox,ME,HERG,GBBG correction factor = 1.004; HEGU correction factor = 0.9882.Location comm:,0051096,5/30/2013,00:00.0,2013,5,30,"Mittelhauser, Glen",44.0228,-69.0353,Knox,ME,DCCO,GBBG correction factor = 1.004; HEGU correction factor = 0.9882.Location comm:,0120097,5/21/2013,00:00.0,2013,5,21,"Houston, Bob",43.708,-70.1354,Cumberland,ME,COEI,No correction noted.  GBBG seen on nest on northeast edge of island (survey by boat). No other birds seen from boat; light vegetation on island may be hiding other nesters.Location comm: Ledge north o,0159098,5/21/2013,00:00.0,2013,5,21,"Houston, Bob",43.708,-70.1354,Cumberland,ME,GBBG,No correction noted.  GBBG seen on nest on northeast edge of island (survey by boat). No other birds seen from boat; light vegetation on island may be hiding other nesters.Location comm: Ledge north o,0047099,5/21/2013,00:00.0,2013,5,21,"Houston, Bob",43.708,-70.1354,Cumberland,ME,HERG,No correction noted.  GBBG seen on nest on northeast edge of island (survey by boat). No other birds seen from boat; light vegetation on island may be hiding other nesters.Location comm: Ledge north o,00510100,5/21/2013,00:00.0,2013,5,21,"Houston, Bob",43.6867,-70.1868,Cumberland,ME,COEI,"No correction noted.  GBBG sen on nest on west edge of island (survey by boat) but couldn't see any gulls on interior of island (if they were there, we probably would have seen them).  Many eiders see",01590101,5/21/2013,00:00.0,2013,5,21,"Houston, Bob",43.6867,-70.1868,Cumberland,ME,GBBG,"No correction noted.  GBBG sen on nest on west edge of island (survey by boat) but couldn't see any gulls on interior of island (if they were there, we probably would have seen them).  Many eiders see",00470102,5/21/2013,00:00.0,2013,5,21,"Houston, Bob",43.6867,-70.1868,Cumberland,ME,HERG,"No correction noted.  GBBG sen on nest on west edge of island (survey by boat) but couldn't see any gulls on interior of island (if they were there, we probably would have seen them).  Many eiders see",00510103,5/30/2013,00:00.0,2013,5,30,"Gettle, Beth",44.1878,-68.4378,Hancock,ME,GBBG,GBBG correction factor = 1.004; HEGU correction factor = 0.9882. 1 canada goose nest.Location comm:,00470104,5/30/2013,00:00.0,2013,5,30,"Gettle, Beth",44.1878,-68.4378,Hancock,ME,HERG,GBBG correction factor = 1.004; HEGU correction factor = 0.9882. 1 canada goose nest.Location comm:,00510105,5/30/2013,00:00.0,2013,5,30,"Gettle, Beth",44.1878,-68.4378,Hancock,ME,DCCO,GBBG correction factor = 1.004; HEGU correction factor = 0.9882. 1 canada goose nest.Location comm:,01200106,5/30/2013,00:00.0,2013,5,30,"Gettle, Beth",44.1878,-68.4378,Hancock,ME,CANG,GBBG correction factor = 1.004; HEGU correction factor = 0.9882. 1 canada goose nest.Location comm:,01720107,6/6/2013,00:00.0,2013,6,6,"Mittelhauser, Glen",44.4432,-67.6012,Washington,ME,HERG,6 eagles on island.Location comm:,00510108,6/6/2013,00:00.0,2013,6,6,"Mittelhauser, Glen",44.4432,-67.6012,Washington,ME,GBBG,6 eagles on island.Location comm:,00470109,6/6/2013,00:00.0,2013,6,6,"Mittelhauser, Glen",44.4409,-67.6064,Washington,ME,GBBG,Landed and checked island visually. 3 eggs in nest.  No correction necessary.Location comm:,00470110,5/31/2013,00:00.0,2013,5,31,"Mittelhauser, Glen",44.4409,-67.6064,Washington,ME,GBBG,GBBG correction factor = 1.004; HEGU correction factor = 0.9882.Location comm:,00470111,5/31/2013,00:00.0,2013,5,31,"Mittelhauser, Glen",44.4409,-67.6064,Washington,ME,HERG,GBBG correction factor = 1.004; HEGU correction factor = 0.9882.Location comm:,00510112,5/31/2013,00:00.0,2013,5,31,"Mittelhauser, Glen",44.4409,-67.6064,Washington,ME,DCCO,GBBG correction factor = 1.004; HEGU correction factor = 0.9882.Location comm:,01200113,5/30/2013,00:00.0,2013,5,30,"Chalfant, Jordan",43.7568,-69.6162,Lincoln,ME,GBBG,GBBG correction factor = 1.004; HEGU correction factor = 0.9882. 36 individual CAGO (some may be eiders).Location comm:,00470114,5/30/2013,00:00.0,2013,5,30,"Chalfant, Jordan",43.7568,-69.6162,Lincoln,ME,HERG,GBBG correction factor = 1.004; HEGU correction factor = 0.9882. 36 individual CAGO (some may be eiders).Location comm:,00510115,5/30/2013,00:00.0,2013,5,30,"Chalfant, Jordan",43.7568,-69.6162,Lincoln,ME,DCCO,GBBG correction factor = 1.004; HEGU correction factor = 0.9882. 36 individual CAGO (some may be eiders).Location comm:,01200116,5/30/2013,00:00.0,2013,5,30,"Chalfant, Jordan",43.7568,-69.6162,Lincoln,ME,CANG,GBBG correction factor = 1.004; HEGU correction factor = 0.9882. 36 individual CAGO (some may be eiders).Location comm:,01720117,6/19/2013,00:00.0,2013,6,19,"Houston, Bob",43.8065,-69.686,Lincoln,ME,COTE,No correction noted.Location comm:,00700118,6/19/2013,00:00.0,2013,6,19,"Houston, Bob",43.8065,-69.686,Lincoln,ME,ROST,No correction noted.Location comm:,00720119,6/19/2013,00:00.0,2013,6,19,"Houston, Bob",43.8065,-69.686,Lincoln,ME,ARTE,No correction noted.Location comm:,00710120,5/31/2013,00:00.0,2013,5,31,"Chalfant, Jordan",43.0049,-70.6046,York,ME,GBBG,GBBG correction factor = 1.004; HEGU correction factor = 0.9882.  5 COEI/CAGO/Unknown.Location comm:,00470121,5/31/2013,00:00.0,2013,5,31,"Chalfant, Jordan",43.0049,-70.6046,York,ME,HERG,GBBG correction factor = 1.004; HEGU correction factor = 0.9882.  5 COEI/CAGO/Unknown.Location comm:,00510122,5/31/2013,00:00.0,2013,5,31,"Chalfant, Jordan",43.0049,-70.6046,York,ME,DCCO,GBBG correction factor = 1.004; HEGU correction factor = 0.9882.  5 COEI/CAGO/Unknown.Location comm:,01200123,5/31/2013,00:00.0,2013,5,31,"Chalfant, Jordan",43.0049,-70.6046,York,ME,COEI,GBBG correction factor = 1.004; HEGU correction factor = 0.9882.  5 COEI/CAGO/Unknown.Location comm:,01590124,5/28/2013,00:00.0,2013,5,28,"Chalfant, Jordan",43.7689,-69.9213,Cumberland,ME,GBBG,GBBG Corecction factor = 1.004; HEGU correction factor = 0.9882. 1 CSGOLocation comm:,00470125,5/28/2013,00:00.0,2013,5,28,"Chalfant, Jordan",43.7689,-69.9213,Cumberland,ME,HERG,GBBG Corecction factor = 1.004; HEGU correction factor = 0.9882. 1 CSGOLocation comm:,00510126,5/28/2013,00:00.0,2013,5,28,"Chalfant, Jordan",43.7689,-69.9213,Cumberland,ME,DCCO,GBBG Corecction factor = 1.004; HEGU correction factor = 0.9882. 1 CSGOLocation comm:,01200127,6/13/2013,00:00.0,2013,6,13,"Allen, Brad",43.7689,-69.9213,Cumberland,ME,HERG,No correction factors noted.Location comm:,00510128,6/13/2013,00:00.0,2013,6,13,"Allen, Brad",43.7689,-69.9213,Cumberland,ME,GBBG,No correction factors noted.Location comm:,00470129,6/13/2013,00:00.0,2013,6,13,"Allen, Brad",43.7689,-69.9213,Cumberland,ME,DCCO,No correction factors noted.Location comm:,01200130,5/28/2013,00:00.0,2013,5,28,"Chalfant, Jordan",43.7689,-69.9213,Cumberland,ME,CANG,GBBG Corecction factor = 1.004; HEGU correction factor = 0.9882. 1 CSGOLocation comm:,01720131,5/28/2013,00:00.0,2013,5,28,"Chalfant, Jordan",43.711,-70.0529,Cumberland,ME,GBBG,GBBG Corecction factor = 1.004; HEGU correction factor = 0.9882.  2 bald eagles.Location comm:,00470149,5/31/2013,00:00.0,2013,5,31,"Welch, Linda",44.4041,-67.9364,Washington,ME,HERG,GBBG correction factor = 1.004; HEGU correction factor = 0.9882.Location comm:,00510132,5/28/2013,00:00.0,2013,5,28,"Chalfant, Jordan",43.711,-70.0529,Cumberland,ME,HERG,GBBG Corecction factor = 1.004; HEGU correction factor = 0.9882.  2 bald eagles.Location comm:,00510133,5/28/2013,00:00.0,2013,5,28,"Chalfant, Jordan",43.711,-70.0529,Cumberland,ME,DCCO,GBBG Corecction factor = 1.004; HEGU correction factor = 0.9882.  2 bald eagles.Location comm:,01200134,5/28/2013,00:00.0,2013,5,28,"Chalfant, Jordan",43.4796,-70.3592,York,ME,GBBG,GBBG correction factor = 1.004; HEGU correction factor = 0.9882.Location comm:,00470135,5/28/2013,00:00.0,2013,5,28,"Chalfant, Jordan",43.4796,-70.3592,York,ME,HERG,GBBG correction factor = 1.004; HEGU correction factor = 0.9882.Location comm:,00510136,5/28/2013,00:00.0,2013,5,28,"Chalfant, Jordan",43.4796,-70.3592,York,ME,DCCO,GBBG correction factor = 1.004; HEGU correction factor = 0.9882.Location comm:,01200137,6/5/2013,00:00.0,2013,6,5,"Langlois, Michael",43.7779,-69.3102,Lincoln,ME,HERG,"vegetation did not obscure nests.  Adjusted actual count to reflect visual observations of a maximum of 3-8 GBBG on/flying over isalnd during ground count.  Nest count by clutch size  HERG 1 egg:13, 2",00510138,6/5/2013,00:00.0,2013,6,5,"Langlois, Michael",43.7779,-69.3102,Lincoln,ME,GBBG,"vegetation did not obscure nests.  Adjusted actual count to reflect visual observations of a maximum of 3-8 GBBG on/flying over isalnd during ground count.  Nest count by clutch size  HERG 1 egg:13, 2",00470139,6/5/2013,00:00.0,2013,6,5,"Langlois, Michael",43.7779,-69.3102,Lincoln,ME,COEI,"vegetation did not obscure nests.  Adjusted actual count to reflect visual observations of a maximum of 3-8 GBBG on/flying over isalnd during ground count.  Nest count by clutch size  HERG 1 egg:13, 2",01590140,6/15/2013,00:00.0,2013,6,15,"Lee Post, Maggie",43.8608,-69.3823,Knox,ME,COTE,Nests numbers were 708 with 1.032 apllied correction andtehnadding instudy nests (100) to equal 831.Location comm:,00700141,6/21/2013,00:00.0,2013,6,21,"Lee Post, Maggie",43.8608,-69.3823,Knox,ME,ROST,No correction noted.Location comm:,00720142,6/21/2013,00:00.0,2013,6,21,"Lee Post, Maggie",43.8608,-69.3823,Knox,ME,ARTE,No correction noted.Location comm:,00710143,6/15/2013,00:00.0,2013,6,15,"Lee Post, Maggie",43.8608,-69.3823,Knox,ME,LAGU,No correction noted.  This nest count could be low due to pre-census nest destruction of over 200 LAGU nests.  This sampling took palce over three says JUN 13-15.  ALL nests were reported to have been,00580144,NULL,,2013,NULL,NULL,"Lee Post, Maggie",43.8608,-69.3823,Knox,ME,COEI,No correction noted.  Common Eifer nests were identified opportunistically during the census.Location comm:,01590145,NULL,,2013,NULL,NULL,"Lee Post, Maggie",43.8608,-69.3823,Knox,ME,ATPU,"No correction noted. ""This year 86 active puffin burrows were on the island, not including complexes."" ; therefore, it is uncertain if it is a complete count.Location comm:",00130146,NULL,,2013,NULL,NULL,"Lee Post, Maggie",43.8608,-69.3823,Knox,ME,GBBG,No correction noted.  Nest was destroyed. NineHerring gulls were shot over the island over the courseof the season. LAGU and GBBG appeared to the the predominant predators forterns.Location comm:,00470147,NULL,,2013,NULL,NULL,"Lee Post, Maggie",43.8608,-69.3823,Knox,ME,BLGU,No correction noted.  BLGU nests were part of a productivity studyfor the first tme and 23 nests were followed.Location comm:,00270148,5/31/2013,00:00.0,2013,5,31,"Welch, Linda",44.4041,-67.9364,Washington,ME,GBBG,GBBG correction factor = 1.004; HEGU correction factor = 0.9882.Location comm:,004701969,NULL,,2009,4,24,Waltee,NULL,NULL,Custer,MT,Great Blue Heron,NULL,019401970,NULL,,2009,4,25,Waltee,NULL,NULL,Prairie,MT,Great Blue Heron,NULL,019401971,NULL,,2009,4,25,Waltee,NULL,NULL,Dawson,MT,Great Blue Heron,NULL,019401972,NULL,,2009,4,24,Waltee,NULL,NULL,Custer,MT,Great Blue Heron,NULL,019401973,NULL,,2009,4,24,Waltee,NULL,NULL,Rosebud,MT,Great Blue Heron,NULL,019401974,NULL,,2009,4,24,Waltee,NULL,NULL,Treasure,MT,Great Blue Heron,NULL,019401975,NULL,,2009,4,24,Waltee,NULL,NULL,Treasure,MT,Great Blue Heron,NULL,019401976,NULL,,2009,4,24,Waltee,NULL,NULL,Treasure,MT,Great Blue Heron,NULL,019401977,6/18/2009,00:00.0,2009,6,18,Tilly et al.,NULL,NULL,Roosevelt,MT,Black-crowned Night-Heron,NULL,020201978,NULL,,2009,6,18,Tilly et al.,NULL,NULL,Roosevelt,MT,Eared Grebe,NULL,000401979,6/18/2009,00:00.0,2009,6,18,Tilly et al.,NULL,NULL,Roosevelt,MT,Forster's Tern,NULL,006901980,6/18/2009,00:00.0,2009,6,18,Tilly et al.,NULL,NULL,Roosevelt,MT,Franklin's Gull,NULL,005901981,6/18/2009,00:00.0,2009,6,18,Tilly et al.,NULL,NULL,Roosevelt,MT,White-faced Ibis,NULL,018701982,7/8/2011,00:00.0,2011,7,8,Spaur,NULL,NULL,Roosevelt,MT,Black-crowned Night-Heron,NULL,020201983,7/8/2011,00:00.0,2011,7,8,Spaur,NULL,NULL,Roosevelt,MT,Forster's Tern,NULL,006901984,7/8/2011,00:00.0,2011,7,8,Spaur,NULL,NULL,Roosevelt,MT,Franklin's Gull,NULL,005901985,7/8/2011,00:00.0,2011,7,8,Spaur,NULL,NULL,Roosevelt,MT,White-faced Ibis,NULL,018701986,NULL,,2011,5,5,Tilly/Taylor,NULL,NULL,Chouteau,MT,Great Blue Heron,NULL,019401987,6/14/2009,00:00.0,2009,6,14,Tilly,NULL,NULL,Sheridan,MT,Black Tern,NULL,007701988,5/29/2009,00:00.0,2009,5,29,Tilly et al.,NULL,NULL,Sheridan,MT,American White Pelican,NULL,012501989,5/29/2009,00:00.0,2009,5,29,Tilly et al.,NULL,NULL,Sheridan,MT,Black-crowned Night-Heron,NULL,020201990,5/29/2009,00:00.0,2009,5,29,Tilly et al.,NULL,NULL,Sheridan,MT,California Gull,NULL,005301991,5/29/2009,00:00.0,2009,5,29,Tilly et al.,NULL,NULL,Sheridan,MT,Double-crested Cormorant,NULL,012001992,5/29/2009,00:00.0,2009,5,29,Tilly et al.,NULL,NULL,Sheridan,MT,Ring-billed Gull,NULL,005401993,6/11/2009,00:00.0,2009,6,11,Tilly,NULL,NULL,Sheridan,MT,Forster's Tern,NULL,006901994,6/3/2010,00:00.0,2010,6,3,Tilly,NULL,NULL,Sheridan,MT,Ring-billed or California Gull,NULL,NULL1995,6/16/2010,00:00.0,2010,6,16,Jamison/Hale,NULL,NULL,Sheridan,MT,American White Pelican,NULL,012501996,6/20/2010,00:00.0,2010,6,20,Tilly,NULL,NULL,Sheridan,MT,Forster's Tern,NULL,006901997,6/21/2010,00:00.0,2010,6,21,Tilly/Jamison,NULL,NULL,Sheridan,MT,Black-crowned Night-Heron,NULL,020201998,6/21/2010,00:00.0,2010,6,21,Tilly/Jamison,NULL,NULL,Sheridan,MT,California Gull,NULL,005301999,6/21/2010,00:00.0,2010,6,21,Tilly/Jamison,NULL,NULL,Sheridan,MT,Ring-billed Gull,NULL,005402000,6/8/2011,00:00.0,2011,6,8,Jamison et al.,NULL,NULL,Sheridan,MT,American White Pelican,NULL,012502001,6/8/2011,00:00.0,2011,6,8,Jamison et al.,NULL,NULL,Sheridan,MT,Black-crowned Night-Heron,NULL,020202002,6/8/2011,00:00.0,2011,6,8,Jamison et al.,NULL,NULL,Sheridan,MT,California Gull,NULL,005302003,6/8/2011,00:00.0,2011,6,8,Jamison et al.,NULL,NULL,Sheridan,MT,Double-crested Cormorant,NULL,012002004,6/8/2011,00:00.0,2011,6,8,Jamison et al.,NULL,NULL,Sheridan,MT,Ring-billed Gull,NULL,005402005,6/18/2011,00:00.0,2011,6,18,Tilly,NULL,NULL,Sheridan,MT,Ring-billed or California Gull,NULL,NULL2006,NULL,,2010,6,0,Tilly et al.,NULL,NULL,Sheridan,MT,Double-crested Cormorant,NULL,012002007,6/27/2009,00:00.0,2009,6,27,Tilly,NULL,NULL,Phillips,MT,Black Tern,NULL,007702008,NULL,,2011,5,5,Tilly,NULL,NULL,Blaine,MT,Great Blue Heron,NULL,019402009,NULL,,2011,5,5,Tilly,NULL,NULL,Blaine,MT,Great Blue Heron,NULL,019402010,NULL,,2011,4,21,Taylor,NULL,NULL,Cascade,MT,Great Blue Heron,NULL,019402011,4/1/2011,00:00.0,2011,4,1,Wightman,NULL,NULL,Broadwater,MT,Great Blue Heron,NULL,019402012,6/18/2009,00:00.0,2009,6,18,Paige,NULL,NULL,Pondera,MT,Black Tern,NULL,007702013,6/20/2011,00:00.0,2011,6,20,DuBois/Throop,NULL,NULL,Powell,MT,Great Blue Heron,NULL,019402014,NULL,,2011,4,27,Stewart,NULL,NULL,Stillwater,MT,Great Blue Heron,NULL,019402015,6/4/2009,00:00.0,2009,6,4,DuBois,NULL,NULL,Mineral,MT,Great Blue Heron,NULL,019402016,6/18/2011,00:00.0,2011,6,18,DuBois/Throop,NULL,NULL,Mineral,MT,Great Blue Heron,NULL,019402017,6/14/2009,00:00.0,2009,6,14,Tilly,NULL,NULL,Sheridan,MT,Black Tern,NULL,007702018,6/14/2009,00:00.0,2009,6,14,Tilly,NULL,NULL,Sheridan,MT,Eared Grebe,NULL,000402019,7/14/2009,00:00.0,2009,7,14,Prellwitz,NULL,NULL,Phillips,MT,Eared Grebe,NULL,000402020,6/5/2009,00:00.0,2009,6,5,Paige/Hoyt,NULL,NULL,Lake,MT,Black Tern,NULL,007702021,6/5/2009,00:00.0,2009,6,5,Paige/Hoyt,NULL,NULL,Lake,MT,Caspian Tern,NULL,006402022,6/5/2009,00:00.0,2009,6,5,Paige/Hoyt,NULL,NULL,Lake,MT,Double-crested Cormorant,NULL,012002023,6/5/2009,00:00.0,2009,6,5,Paige/Hoyt,NULL,NULL,Lake,MT,Forster's Tern,NULL,006902024,6/5/2009,00:00.0,2009,6,5,Paige/Hoyt,NULL,NULL,Lake,MT,Great Blue Heron,NULL,019402025,6/5/2009,00:00.0,2009,6,5,Paige/Hoyt,NULL,NULL,Lake,MT,Ring-billed or California Gull,NULL,NULL2026,6/14/2010,00:00.0,2010,6,14,Doney et al.,NULL,NULL,Lake,MT,Clark's Grebe,NULL,000112027,6/14/2010,00:00.0,2010,6,14,Doney et al.,NULL,NULL,Lake,MT,Forster's Tern,NULL,006902028,6/14/2010,00:00.0,2010,6,14,Doney et al.,NULL,NULL,Lake,MT,Western Grebe,NULL,000102029,6/15/2010,00:00.0,2010,6,15,Doney et al.,NULL,NULL,Lake,MT,California Gull,NULL,005302030,6/15/2010,00:00.0,2010,6,15,Doney et al.,NULL,NULL,Lake,MT,Double-crested Cormorant,NULL,012002031,6/15/2010,00:00.0,2010,6,15,Doney et al.,NULL,NULL,Lake,MT,Forster's Tern,NULL,006902032,6/15/2010,00:00.0,2010,6,15,Doney et al.,NULL,NULL,Lake,MT,Great Blue Heron,NULL,019402033,6/15/2010,00:00.0,2010,6,15,Doney et al.,NULL,NULL,Lake,MT,Ring-billed Gull,NULL,005402034,6/14/2011,00:00.0,2011,6,14,Wightman/Lichtenberg,NULL,NULL,Lake,MT,California Gull,NULL,005302035,6/14/2011,00:00.0,2011,6,14,Wightman/Lichtenberg,NULL,NULL,Lake,MT,Caspian Tern,NULL,006402036,6/14/2011,00:00.0,2011,6,14,Wightman/Lichtenberg,NULL,NULL,Lake,MT,Double-crested Cormorant,NULL,012002037,6/14/2011,00:00.0,2011,6,14,Wightman/Lichtenberg,NULL,NULL,Lake,MT,Forster's Tern,NULL,006902038,6/14/2011,00:00.0,2011,6,14,Wightman/Lichtenberg,NULL,NULL,Lake,MT,Great Blue Heron,NULL,019402039,6/14/2011,00:00.0,2011,6,14,Wightman/Lichtenberg,NULL,NULL,Lake,MT,Ring-billed Gull,NULL,005402040,6/14/2011,00:00.0,2011,6,14,Wightman/Lichtenberg,NULL,NULL,Lake,MT,Western Grebe,NULL,000102041,6/14/2009,00:00.0,2009,6,14,Tilly,NULL,NULL,Sheridan,MT,Black Tern,NULL,007702042,NULL,,2010,5,8,Waltee,NULL,NULL,Prairie,MT,Great Blue Heron,NULL,019402043,5/8/2010,00:00.0,2010,5,8,Waltee,NULL,NULL,Custer,MT,Great Blue Heron,NULL,019402044,5/8/2010,00:00.0,2010,5,8,Waltee,NULL,NULL,Fallon,MT,Great Blue Heron,NULL,019402045,5/8/2010,00:00.0,2010,5,8,Waltee,NULL,NULL,Fallon,MT,Great Blue Heron,NULL,019402046,5/8/2010,00:00.0,2010,5,8,Waltee,NULL,NULL,Fallon,MT,Great Blue Heron,NULL,019402047,6/14/2010,00:00.0,2010,6,14,Wightman et al.,NULL,NULL,Lake,MT,Double-crested Cormorant,NULL,012002048,6/14/2010,00:00.0,2010,6,14,Wightman et al.,NULL,NULL,Lake,MT,Double-crested Cormorant,NULL,012002049,6/14/2010,00:00.0,2010,6,14,Wightman et al.,NULL,NULL,Lake,MT,Great Blue Heron,NULL,019402050,6/14/2011,00:00.0,2011,6,14,Wightman,NULL,NULL,Lake,MT,Double-crested Cormorant,NULL,012002051,6/17/2009,00:00.0,2009,6,17,Tilly,NULL,NULL,Phillips,MT,Eared Grebe,NULL,000402052,5/20/2011,00:00.0,2011,5,20,DuBois/Throop,NULL,NULL,Missoula,MT,Great Blue Heron,NULL,019402053,5/20/2011,00:00.0,2011,5,20,DuBois/Throop,NULL,NULL,Missoula,MT,Great Blue Heron,NULL,019402054,5/8/2010,00:00.0,2010,5,8,Waltee,NULL,NULL,Custer,MT,Great Blue Heron,NULL,019402055,5/8/2010,00:00.0,2010,5,8,Waltee,NULL,NULL,Custer,MT,Great Blue Heron,NULL,019402056,5/1/2009,00:00.0,2009,5,1,Waltee,NULL,NULL,Powder River,MT,Great Blue Heron,NULL,019402057,5/1/2009,00:00.0,2009,5,1,Waltee,NULL,NULL,Powder River,MT,Great Blue Heron,NULL,019402058,5/1/2009,00:00.0,2009,5,1,Waltee,NULL,NULL,Custer,MT,Great Blue Heron,NULL,019402059,5/1/2009,00:00.0,2009,5,1,Waltee,NULL,NULL,Powder River,MT,Great Blue Heron,NULL,019402060,5/8/2010,00:00.0,2010,5,8,Waltee,NULL,NULL,Custer,MT,Great Blue Heron,NULL,019402061,5/8/2010,00:00.0,2010,5,8,Waltee,NULL,NULL,Custer,MT,Great Blue Heron,NULL,019402062,5/1/2009,00:00.0,2009,5,1,Waltee,NULL,NULL,Powder River,MT,Great Blue Heron,NULL,019402063,7/16/2010,00:00.0,2010,7,16,Amestot/George,NULL,NULL,Phillips,MT,Eared Grebe,NULL,000402064,6/16/2010,00:00.0,2010,6,16,Doney/Lichtenburg,NULL,NULL,Sanders,MT,Black Tern,NULL,007702065,4/24/2010,00:00.0,2010,4,24,Waltee,NULL,NULL,Powder River,MT,Great Blue Heron,NULL,019402066,NULL,,2010,NULL,NULL,Warren et al.,NULL,NULL,Beaverhead,MT,Double-crested Cormorant,NULL,012002067,NULL,,2010,NULL,NULL,Warren et al.,NULL,NULL,Beaverhead,MT,Great Blue Heron,NULL,019402068,5/28/2009,00:00.0,2009,5,28,Warren et al.,NULL,NULL,Beaverhead,MT,Double-crested Cormorant,NULL,01200941,4/26/2010,00:00.0,2010,4,26,Zaun,NULL,NULL,La Paz,AZ,Great Blue Heron,NULL,01940942,5/11/2010,00:00.0,2010,5,11,Zaun,NULL,NULL,La Paz,AZ,Great Blue Heron,NULL,01940943,3/24/2011,00:00.0,2011,3,24,Zaun,NULL,NULL,La Paz,AZ,Great Blue Heron,NULL,01940944,4/18/2011,00:00.0,2011,4,18,Zaun,NULL,NULL,La Paz,AZ,Great Blue Heron,NULL,01940945,5/14/2011,00:00.0,2011,5,14,Zaun,NULL,NULL,La Paz,AZ,Great Blue Heron,NULL,01940946,4/26/2010,00:00.0,2010,4,26,Zaun,NULL,NULL,La Paz,AZ,Great Blue Heron,NULL,01940947,4/16/2011,00:00.0,2011,4,16,Zaun,NULL,NULL,La Paz,AZ,Great Blue Heron,NULL,01940948,4/27/2010,00:00.0,2010,4,27,Kee,NULL,NULL,Santa Cruz,AZ,Great Blue Heron,NULL,01940949,5/27/2010,00:00.0,2010,5,27,Corman,NULL,NULL,Santa Cruz,AZ,Great Blue Heron,NULL,01940950,5/31/2010,00:00.0,2010,5,31,Kee,NULL,NULL,Santa Cruz,AZ,Great Blue Heron,NULL,01940951,6/9/2010,00:00.0,2010,6,9,Kee,NULL,NULL,Santa Cruz,AZ,Great Blue Heron,NULL,01940952,7/14/2010,00:00.0,2010,7,14,Kee,NULL,NULL,Santa Cruz,AZ,Great Blue Heron,NULL,01940953,3/27/2011,00:00.0,2011,3,27,Kee,NULL,NULL,Santa Cruz,AZ,Great Blue Heron,NULL,01940954,4/8/2009,00:00.0,2009,4,8,Corman,NULL,NULL,Maricopa,AZ,Great Blue Heron,NULL,01940955,4/7/2010,00:00.0,2010,4,7,Corman,NULL,NULL,Maricopa,AZ,Great Blue Heron,NULL,01940956,3/6/2011,00:00.0,2011,3,6,Corman,NULL,NULL,Maricopa,AZ,Great Blue Heron,NULL,01940957,4/8/2009,00:00.0,2009,4,8,Corman,NULL,NULL,Maricopa,AZ,Great Blue Heron,NULL,01940958,4/25/2009,00:00.0,2009,4,25,Corman,NULL,NULL,La Paz,AZ,Cattle Egret,NULL,02001959,4/25/2009,00:00.0,2009,4,25,Corman,NULL,NULL,La Paz,AZ,White-faced Ibis,NULL,01870960,7/9/2009,00:00.0,2009,7,9,Piest,NULL,NULL,La Paz,AZ,Cattle Egret,NULL,02001961,7/9/2009,00:00.0,2009,7,9,Piest,NULL,NULL,La Paz,AZ,White-faced Ibis,NULL,01870962,7/15/2009,00:00.0,2009,7,15,Piest,NULL,NULL,La Paz,AZ,Cattle Egret,NULL,02001963,7/15/2009,00:00.0,2009,7,15,Piest,NULL,NULL,La Paz,AZ,Snowy Egret,NULL,01970964,7/15/2009,00:00.0,2009,7,15,Piest,NULL,NULL,La Paz,AZ,White-faced Ibis,NULL,01870965,5/1/2011,00:00.0,2011,5,1,Harter/Vander Pluym,NULL,NULL,La Paz,AZ,White-faced Ibis,NULL,01870966,5/14/2011,00:00.0,2011,5,14,Harter/Vander Pluym,NULL,NULL,La Paz,AZ,White-faced Ibis,NULL,01870967,4/24/2011,00:00.0,2011,4,24,Harter/Vander Pluym,NULL,NULL,La Paz,AZ,Cattle Egret,NULL,02001968,4/24/2011,00:00.0,2011,4,24,Harter/Vander Pluym,NULL,NULL,La Paz,AZ,White-faced Ibis,NULL,01870969,5/9/2011,00:00.0,2011,5,9,Harter/Vander Pluym,NULL,NULL,La Paz,AZ,Black-crowned Night-Heron,NULL,02020970,5/9/2011,00:00.0,2011,5,9,Piest,NULL,NULL,La Paz,AZ,Cattle Egret,NULL,02001971,5/9/2011,00:00.0,2011,5,9,Piest,NULL,NULL,La Paz,AZ,White-faced Ibis,NULL,01870972,6/3/2011,00:00.0,2011,6,3,Harter/Vander Pluym,NULL,NULL,La Paz,AZ,Snowy Egret,NULL,01970973,6/3/2011,00:00.0,2011,6,3,Harter/Vander Pluym,NULL,NULL,La Paz,AZ,White-faced Ibis,NULL,01870974,5/1/2011,00:00.0,2011,5,1,Harter/Vander Pluym,NULL,NULL,La Paz,AZ,Great Egret,NULL,01960975,5/9/2011,00:00.0,2011,5,9,Piest,NULL,NULL,La Paz,AZ,Great Egret,NULL,01960976,4/29/2011,00:00.0,2011,4,29,Corman/Lewis,NULL,NULL,Maricopa,AZ,Great Blue Heron,NULL,01940977,4/29/2011,00:00.0,2011,4,29,Corman/Lewis,NULL,NULL,Maricopa,AZ,Neotropic Cormorant,NULL,01210978,3/24/2011,00:00.0,2011,3,24,Ottinger/Vader,NULL,NULL,Maricopa,AZ,Great Blue Heron,NULL,01940979,5/10/2009,00:00.0,2009,5,10,Piest,NULL,NULL,Yuma,AZ,Great Blue Heron,NULL,01940980,5/9/2010,00:00.0,2010,5,9,Piest,NULL,NULL,Yuma,AZ,Great Blue Heron,NULL,01940981,4/20/2011,00:00.0,2011,4,20,Piest,NULL,NULL,Yuma,AZ,Great Blue Heron,NULL,01940982,4/12/2009,00:00.0,2009,4,12,Corman,NULL,NULL,Maricopa,AZ,Great Blue Heron,NULL,01940983,4/7/2010,00:00.0,2010,4,7,Corman,NULL,NULL,Maricopa,AZ,Great Blue Heron,NULL,01940984,4/28/2011,00:00.0,2011,4,28,Corman,NULL,NULL,Maricopa,AZ,Great Blue Heron,NULL,01940985,4/15/2010,00:00.0,2010,4,15,Lynn,NULL,NULL,Coconino,AZ,Great Blue Heron,NULL,01940986,5/31/2011,00:00.0,2011,5,31,Lemon,NULL,NULL,Coconino,AZ,Great Blue Heron,NULL,01940987,4/2/2010,00:00.0,2010,4,2,Anderson,NULL,NULL,Cochise,AZ,Great Blue Heron,NULL,01940988,4/27/2010,00:00.0,2010,4,27,Radke,NULL,NULL,Cochise,AZ,Great Blue Heron,NULL,01940989,1/30/2010,00:00.0,2010,1,30,Paintner/Paintner,NULL,NULL,La Paz,AZ,Great Blue Heron,NULL,01940990,2/25/2010,00:00.0,2010,2,25,Paintner/Paintner,NULL,NULL,La Paz,AZ,Great Blue Heron,NULL,01940991,3/30/2010,00:00.0,2010,3,30,Paintner/Paintner,NULL,NULL,La Paz,AZ,Great Blue Heron,NULL,01940992,3/8/2011,00:00.0,2011,3,8,Paintner/Paintner,NULL,NULL,La Paz,AZ,Great Blue Heron,NULL,01940993,3/21/2011,00:00.0,2011,3,21,Richmond,NULL,NULL,La Paz,AZ,Great Blue Heron,NULL,01940994,4/15/2011,00:00.0,2011,4,15,Silva,NULL,NULL,Yavapai,AZ,Double-crested Cormorant,NULL,01200995,4/7/2010,00:00.0,2010,4,7,Stewart et al.,NULL,NULL,Yavapai,AZ,Double-crested Cormorant,NULL,01200996,4/15/2011,00:00.0,2011,4,15,Silva,NULL,NULL,Yavapai,AZ,Double-crested Cormorant,NULL,01200997,5/13/2010,00:00.0,2010,5,13,Morrall,NULL,NULL,Coconino,AZ,Great Blue Heron,NULL,01940998,6/16/2011,00:00.0,2011,6,16,Morrall,NULL,NULL,Coconino,AZ,Great Blue Heron,NULL,01940999,5/27/2009,00:00.0,2009,5,27,Corman,NULL,NULL,Santa Cruz,AZ,Great Blue Heron,NULL,019401000,5/28/2009,00:00.0,2009,5,28,MacVean/Lamkin,NULL,NULL,Coconino,AZ,Great Blue Heron,NULL,019401001,5/4/2010,00:00.0,2010,5,4,Lamkin,NULL,NULL,Coconino,AZ,Great Blue Heron,NULL,019401002,4/27/2011,00:00.0,2011,4,27,Lamkin,NULL,NULL,Coconino,AZ,Great Blue Heron,NULL,019401003,2/22/2009,00:00.0,2009,2,22,Maikis/Janssen,NULL,NULL,Yavapai,AZ,Double-crested Cormorant,NULL,012003975,NULL,,1984,NULL,NULL,NULL,NULL,NULL,Natrona,WY,Caspian Tern,NULL,006401004,3/25/2009,00:00.0,2009,3,25,Maikis/Janssen,NULL,NULL,Yavapai,AZ,Double-crested Cormorant,NULL,012001005,4/20/2009,00:00.0,2009,4,20,Maikis/Janssen,NULL,NULL,Yavapai,AZ,Black-crowned Night-Heron,NULL,020201006,4/20/2009,00:00.0,2009,4,20,Maikis/Janssen,NULL,NULL,Yavapai,AZ,Double-crested Cormorant,NULL,012001007,4/20/2009,00:00.0,2009,4,20,Maikis/Janssen,NULL,NULL,Yavapai,AZ,Great Blue Heron,NULL,019401008,2/24/2010,00:00.0,2010,2,24,Maikis/Janssen,NULL,NULL,Yavapai,AZ,Double-crested Cormorant,NULL,012001009,2/24/2010,00:00.0,2010,2,24,Maikis/Janssen,NULL,NULL,Yavapai,AZ,Great Blue Heron,NULL,019401010,3/22/2010,00:00.0,2010,3,22,Maikis/Janssen,NULL,NULL,Yavapai,AZ,Double-crested Cormorant,NULL,012001011,3/22/2010,00:00.0,2010,3,22,Maikis/Janssen,NULL,NULL,Yavapai,AZ,Great Blue Heron,NULL,019401012,4/20/2010,00:00.0,2010,4,20,Maikis/Janssen,NULL,NULL,Yavapai,AZ,Great Blue Heron,NULL,019401013,4/20/2010,00:00.0,2010,4,20,Maikis/Janssen,NULL,NULL,Yavapai,AZ,Great Egret,NULL,019601014,4/22/2010,00:00.0,2010,4,22,Maikis/Janssen,NULL,NULL,Yavapai,AZ,Double-crested Cormorant,NULL,012001015,2/23/2009,00:00.0,2009,2,23,Maikis/Janssen,NULL,NULL,Yavapai,AZ,Great Blue Heron,NULL,019401016,3/25/2009,00:00.0,2009,3,25,Maikis/Janssen,NULL,NULL,Yavapai,AZ,Great Blue Heron,NULL,019401017,3/25/2009,00:00.0,2009,3,25,Maikis/Janssen,NULL,NULL,Yavapai,AZ,Great Blue Heron,NULL,019401018,4/20/2009,00:00.0,2009,4,20,Maikis/Janssen,NULL,NULL,Yavapai,AZ,Great Blue Heron,NULL,019401019,2/24/2010,00:00.0,2010,2,24,Maikis/Janssen,NULL,NULL,Yavapai,AZ,Great Blue Heron,NULL,019401020,3/22/2010,00:00.0,2010,3,22,Maikis/Janssen,NULL,NULL,Yavapai,AZ,Great Blue Heron,NULL,019401021,4/19/2010,00:00.0,2010,4,19,Maikis/Janssen,NULL,NULL,Yavapai,AZ,Great Blue Heron,NULL,019401022,3/28/2010,00:00.0,2010,3,28,Brewster,NULL,NULL,Apache,AZ,Great Blue Heron,NULL,019401023,6/17/2010,00:00.0,2010,6,17,Brewster,NULL,NULL,Apache,AZ,Great Blue Heron,NULL,019401024,6/27/2011,00:00.0,2011,6,27,Brewster,NULL,NULL,Apache,AZ,Great Blue Heron,NULL,019401025,4/29/2010,00:00.0,2010,4,29,Corman,NULL,NULL,Maricopa,AZ,Great Blue Heron,NULL,019401026,4/29/2011,00:00.0,2011,4,29,Corman/Lewis,NULL,NULL,Maricopa,AZ,Great Blue Heron,NULL,019401027,4/18/2009,00:00.0,2009,4,18,Dockens,NULL,NULL,Maricopa,AZ,Black-crowned Night-Heron,NULL,020201028,4/18/2009,00:00.0,2009,4,18,Dockens,NULL,NULL,Maricopa,AZ,Great Blue Heron,NULL,019401029,4/10/2010,00:00.0,2010,4,10,Dockens,NULL,NULL,Maricopa,AZ,Black-crowned Night-Heron,NULL,020201030,4/10/2010,00:00.0,2010,4,10,Dockens,NULL,NULL,Maricopa,AZ,Great Blue Heron,NULL,019401031,3/22/2011,00:00.0,2011,3,22,Dockens,NULL,NULL,Maricopa,AZ,Black-crowned Night-Heron,NULL,020201032,3/22/2011,00:00.0,2011,3,22,Dockens,NULL,NULL,Maricopa,AZ,Great Blue Heron,NULL,019401033,5/8/2010,00:00.0,2010,5,8,Piest,NULL,NULL,Yuma,AZ,Great Blue Heron,NULL,019401034,4/20/2011,00:00.0,2011,4,20,Piest,NULL,NULL,Yuma,AZ,Great Blue Heron,NULL,019401035,5/26/2009,00:00.0,2009,5,26,Piest,NULL,NULL,Yuma,AZ,Great Blue Heron,NULL,019401036,4/22/2010,00:00.0,2010,4,22,Piest,NULL,NULL,Yuma,AZ,Great Blue Heron,NULL,019401037,4/22/2011,00:00.0,2011,4,22,Piest,NULL,NULL,Yuma,AZ,Great Blue Heron,NULL,019401038,1/16/2010,00:00.0,2010,1,16,Corman,NULL,NULL,Maricopa,AZ,Great Blue Heron,NULL,019401039,4/29/2011,00:00.0,2011,4,29,Corman,NULL,NULL,Maricopa,AZ,Great Blue Heron,NULL,019401040,6/7/2010,00:00.0,2010,6,7,Tso et al.,NULL,NULL,Coconino,AZ,Great Blue Heron,NULL,019401041,6/20/2011,00:00.0,2011,6,20,Thompson,NULL,NULL,Coconino,AZ,Great Blue Heron,NULL,019401042,3/31/2010,00:00.0,2010,3,31,Arnett,NULL,NULL,Maricopa,AZ,Black-crowned Night-Heron,NULL,020201043,3/31/2010,00:00.0,2010,3,31,Arnett,NULL,NULL,Maricopa,AZ,Cattle Egret,NULL,020011044,3/31/2010,00:00.0,2010,3,31,Arnett,NULL,NULL,Maricopa,AZ,Double-crested Cormorant,NULL,012001045,3/31/2010,00:00.0,2010,3,31,Arnett,NULL,NULL,Maricopa,AZ,Great Blue Heron,NULL,019401046,3/31/2010,00:00.0,2010,3,31,Arnett,NULL,NULL,Maricopa,AZ,Great Egret,NULL,019601047,3/31/2010,00:00.0,2010,3,31,Arnett,NULL,NULL,Maricopa,AZ,Snowy Egret,NULL,019701048,5/21/2011,00:00.0,2011,5,21,Harter/Vander Pluym,NULL,NULL,La Paz,AZ,Great Blue Heron,NULL,019401049,5/21/2011,00:00.0,2011,5,21,Harter/Vander Pluym,NULL,NULL,La Paz,AZ,Great Egret,NULL,019601050,4/3/2009,00:00.0,2009,4,3,Hanna,NULL,NULL,Maricopa,AZ,Great Blue Heron,NULL,019401051,1/29/2010,00:00.0,2010,1,29,Hanna,NULL,NULL,Maricopa,AZ,Great Blue Heron,NULL,019401052,3/30/2011,00:00.0,2011,3,30,Burger,NULL,NULL,Maricopa,AZ,Great Blue Heron,NULL,019401053,3/25/2009,00:00.0,2009,3,25,Clark,NULL,NULL,Maricopa,AZ,Great Blue Heron,NULL,019401054,3/8/2010,00:00.0,2010,3,8,Clark,NULL,NULL,Maricopa,AZ,Great Blue Heron,NULL,019401055,3/20/2011,00:00.0,2011,3,20,Clark,NULL,NULL,Maricopa,AZ,Great Blue Heron,NULL,019401056,3/25/2009,00:00.0,2009,3,25,Clark,NULL,NULL,Maricopa,AZ,Great Blue Heron,NULL,019401057,3/8/2010,00:00.0,2010,3,8,Clark,NULL,NULL,Maricopa,AZ,Great Blue Heron,NULL,019401058,3/20/2011,00:00.0,2011,3,20,Clark,NULL,NULL,Maricopa,AZ,Great Blue Heron,NULL,019401059,8/6/2009,00:00.0,2009,8,6,Luedeker,NULL,NULL,Coconino,AZ,Great Blue Heron,NULL,019401060,4/21/2010,00:00.0,2010,4,21,Luedeker,NULL,NULL,Coconino,AZ,Great Blue Heron,NULL,019401061,4/4/2011,00:00.0,2011,4,4,Luedeker,NULL,NULL,Coconino,AZ,Great Blue Heron,NULL,019401062,4/24/2010,00:00.0,2010,4,24,Sitko/Davis,NULL,NULL,Apache,AZ,Double-crested Cormorant,NULL,012001063,4/28/2011,00:00.0,2011,4,28,Valencia/Paradzick,NULL,NULL,Yavapai,AZ,Great Blue Heron,NULL,019401064,5/10/2009,00:00.0,2009,5,10,Piest,NULL,NULL,Yuma,AZ,Cattle Egret,NULL,020011065,5/10/2009,00:00.0,2009,5,10,Piest,NULL,NULL,Yuma,AZ,Great Blue Heron,NULL,019401066,5/10/2009,00:00.0,2009,5,10,Piest,NULL,NULL,Yuma,AZ,Great Egret,NULL,019601067,5/9/2010,00:00.0,2010,5,9,Piest,NULL,NULL,Yuma,AZ,Cattle Egret,NULL,020011068,5/9/2010,00:00.0,2010,5,9,Piest,NULL,NULL,Yuma,AZ,Great Egret,NULL,019601069,5/9/2010,00:00.0,2010,5,9,Piest,NULL,NULL,Yuma,AZ,Snowy Egret,NULL,019701070,4/20/2011,00:00.0,2011,4,20,Piest,NULL,NULL,Yuma,AZ,Cattle Egret,NULL,020011071,4/20/2011,00:00.0,2011,4,20,Piest,NULL,NULL,Yuma,AZ,Great Egret,NULL,019601072,4/20/2011,00:00.0,2011,4,20,Piest,NULL,NULL,Yuma,AZ,Snowy Egret,NULL,019701073,5/9/2009,00:00.0,2009,5,9,Piest,NULL,NULL,Yuma,AZ,Snowy Egret,NULL,019701074,5/6/2011,00:00.0,2011,5,6,Piest,NULL,NULL,Yuma,AZ,Cattle Egret,NULL,020011075,5/14/2011,00:00.0,2011,5,14,Piest,NULL,NULL,Yuma,AZ,Cattle Egret,NULL,020011076,5/14/2011,00:00.0,2011,5,14,Piest,NULL,NULL,Yuma,AZ,Great Egret,NULL,019601077,5/14/2011,00:00.0,2011,5,14,Piest,NULL,NULL,Yuma,AZ,Snowy Egret,NULL,019701078,4/9/2009,00:00.0,2009,4,9,McFarlin,NULL,NULL,Gila,AZ,Double-crested Cormorant,NULL,012001079,4/9/2009,00:00.0,2009,4,9,McFarlin,NULL,NULL,Gila,AZ,Great Blue Heron,NULL,019401080,5/6/2010,00:00.0,2010,5,6,McFarlin/Rodriguez,NULL,NULL,Gila,AZ,Double-crested Cormorant,NULL,012001081,5/6/2010,00:00.0,2010,5,6,McFarlin/Rodriguez,NULL,NULL,Gila,AZ,Great Blue Heron,NULL,019401082,3/15/2011,00:00.0,2011,3,15,Sayer/McFarlin,NULL,NULL,Gila,AZ,Double-crested Cormorant,NULL,012001083,3/15/2011,00:00.0,2011,3,15,Sayer/McFarlin,NULL,NULL,Gila,AZ,Great Blue Heron,NULL,019401084,2/26/2009,00:00.0,2009,2,26,Stroh,NULL,NULL,Gila,AZ,Double-crested Cormorant,NULL,012001085,2/26/2009,00:00.0,2009,2,26,Stroh,NULL,NULL,Gila,AZ,Great Blue Heron,NULL,019401086,4/9/2009,00:00.0,2009,4,9,McFarlin,NULL,NULL,Gila,AZ,Double-crested Cormorant,NULL,012001087,4/9/2009,00:00.0,2009,4,9,McFarlin,NULL,NULL,Gila,AZ,Great Blue Heron,NULL,019401088,5/6/2010,00:00.0,2010,5,6,McFarlin/Rodriguez,NULL,NULL,Gila,AZ,Great Blue Heron,NULL,019401089,4/9/2009,00:00.0,2009,4,9,McFarlin,NULL,NULL,Gila,AZ,Great Blue Heron,NULL,019401090,5/2/2010,00:00.0,2010,5,2,McFarlin/Rodriguez,NULL,NULL,Gila,AZ,Double-crested Cormorant,NULL,012001091,5/2/2010,00:00.0,2010,5,2,McFarlin/Rodriguez,NULL,NULL,Gila,AZ,Great Blue Heron,NULL,019401092,3/15/2011,00:00.0,2011,3,15,Sayer/McFarlin,NULL,NULL,Gila,AZ,Great Blue Heron,NULL,019401093,4/9/2009,00:00.0,2009,4,9,McFarlin,NULL,NULL,Gila,AZ,Great Blue Heron,NULL,019401094,2/25/2009,00:00.0,2009,2,25,O'Brien,NULL,NULL,Gila,AZ,Double-crested Cormorant,NULL,012001095,2/25/2009,00:00.0,2009,2,25,O'Brien,NULL,NULL,Gila,AZ,Great Blue Heron,NULL,019401096,4/26/2009,00:00.0,2009,4,26,McFarlin,NULL,NULL,Gila,AZ,Double-crested Cormorant,NULL,012001097,4/26/2009,00:00.0,2009,4,26,McFarlin,NULL,NULL,Gila,AZ,Great Blue Heron,NULL,019401098,5/3/2009,00:00.0,2009,5,3,Wike,NULL,NULL,Gila,AZ,Double-crested Cormorant,NULL,012001099,5/3/2009,00:00.0,2009,5,3,Wike,NULL,NULL,Gila,AZ,Great Blue Heron,NULL,019401100,2/24/2010,00:00.0,2010,2,24,Wike/Ward,NULL,NULL,Gila,AZ,Double-crested Cormorant,NULL,012001101,2/24/2010,00:00.0,2010,2,24,Wike/Ward,NULL,NULL,Gila,AZ,Great Blue Heron,NULL,019401102,4/8/2010,00:00.0,2010,4,8,McFarlin/Rodriguez,NULL,NULL,Gila,AZ,Double-crested Cormorant,NULL,012001103,4/8/2010,00:00.0,2010,4,8,McFarlin/Rodriguez,NULL,NULL,Gila,AZ,Great Blue Heron,NULL,019401104,5/2/2010,00:00.0,2010,5,2,McFarlin/Rodriguez,NULL,NULL,Gila,AZ,Double-crested Cormorant,NULL,012001105,5/2/2010,00:00.0,2010,5,2,McFarlin/Rodriguez,NULL,NULL,Gila,AZ,Great Blue Heron,NULL,019401106,5/5/2010,00:00.0,2010,5,5,Wike,NULL,NULL,Gila,AZ,Black-crowned Night-Heron,NULL,020201107,5/5/2010,00:00.0,2010,5,5,Wike,NULL,NULL,Gila,AZ,Snowy Egret,NULL,019701108,3/10/2011,00:00.0,2011,3,10,Joder,NULL,NULL,Gila,AZ,Double-crested Cormorant,NULL,012001109,3/10/2011,00:00.0,2011,3,10,Joder,NULL,NULL,Gila,AZ,Great Blue Heron,NULL,019401110,5/3/2011,00:00.0,2011,5,3,Joder,NULL,NULL,Gila,AZ,Double-crested Cormorant,NULL,012001111,5/3/2011,00:00.0,2011,5,3,Joder,NULL,NULL,Gila,AZ,Great Blue Heron,NULL,019401112,4/9/2009,00:00.0,2009,4,9,McFarlin,NULL,NULL,Gila,AZ,Double-crested Cormorant,NULL,012001113,5/6/2010,00:00.0,2010,5,6,McFarlin/Rodriguez,NULL,NULL,Gila,AZ,Great Blue Heron,NULL,019401114,5/19/2011,00:00.0,2011,5,19,Stejskal/Stevenson,NULL,NULL,Gila,AZ,Black-crowned Night-Heron,NULL,020201115,5/19/2011,00:00.0,2011,5,19,Stejskal/Stevenson,NULL,NULL,Gila,AZ,Snowy Egret,NULL,019701116,5/29/2009,00:00.0,2009,5,29,Holm et al.,NULL,NULL,Coconino,AZ,Double-crested Cormorant,NULL,012001117,5/29/2009,00:00.0,2009,5,29,Holm et al.,NULL,NULL,Coconino,AZ,Great Blue Heron,NULL,019401118,5/31/2010,00:00.0,2010,5,31,Holm/Price,NULL,NULL,Coconino,AZ,Double-crested Cormorant,NULL,012001119,5/31/2010,00:00.0,2010,5,31,Holm/Price,NULL,NULL,Coconino,AZ,Great Blue Heron,NULL,019401120,6/15/2011,00:00.0,2011,6,15,Holm/Price,NULL,NULL,Coconino,AZ,Double-crested Cormorant,NULL,012001121,6/15/2011,00:00.0,2011,6,15,Holm/Price,NULL,NULL,Coconino,AZ,Great Blue Heron,NULL,019401122,3/25/2011,00:00.0,2011,3,25,Drown/Arndt,NULL,NULL,Yavapai,AZ,Great Blue Heron,NULL,019401123,6/3/2011,00:00.0,2011,6,3,McCarty,NULL,NULL,Navajo,AZ,Great Blue Heron,NULL,019401124,5/21/2011,00:00.0,2011,5,21,Morrall,NULL,NULL,Coconino,AZ,Great Blue Heron,NULL,019401125,5/26/2011,00:00.0,2011,5,26,Cagle,NULL,NULL,Greenlee,AZ,Great Blue Heron,NULL,019401126,2/19/2011,00:00.0,2011,2,19,Ford,NULL,NULL,Maricopa,AZ,Great Blue Heron,NULL,019401127,3/17/2011,00:00.0,2011,3,17,Ford,NULL,NULL,Maricopa,AZ,Great Blue Heron,NULL,019401128,4/20/2009,00:00.0,2009,4,20,Cagle,NULL,NULL,Navajo,AZ,Double-crested Cormorant,NULL,012003949,NULL,,1997,NULL,NULL,NULL,NULL,NULL,Albany,WY,Black-crowned Night-Heron,NULL,020203950,NULL,,1998,NULL,NULL,NULL,NULL,NULL,Albany,WY,Forster's Tern,NULL,006903951,NULL,,1998,NULL,NULL,NULL,NULL,NULL,Albany,WY,Black-crowned Night-Heron,NULL,020203952,NULL,,1999,NULL,NULL,NULL,NULL,NULL,Albany,WY,White-faced Ibis,NULL,018703953,NULL,,1999,NULL,NULL,NULL,NULL,NULL,Albany,WY,Forster's Tern,NULL,006903954,NULL,,1999,NULL,NULL,NULL,NULL,NULL,Albany,WY,Black-crowned Night-Heron,NULL,020203955,NULL,,2001,NULL,NULL,NULL,NULL,NULL,Albany,WY,White-faced Ibis,NULL,018703956,NULL,,2001,NULL,NULL,NULL,NULL,NULL,Albany,WY,Forster's Tern,NULL,006903957,NULL,,2001,NULL,NULL,NULL,NULL,NULL,Albany,WY,Black-crowned Night-Heron,NULL,020203958,NULL,,2002,NULL,NULL,NULL,NULL,NULL,Albany,WY,Black-crowned Night-Heron,NULL,020203959,NULL,,2003,NULL,NULL,NULL,NULL,NULL,Albany,WY,Forster's Tern,NULL,006903960,NULL,,2004,NULL,NULL,NULL,NULL,NULL,Albany,WY,Forster's Tern,NULL,006903961,NULL,,2005,NULL,NULL,NULL,NULL,NULL,Albany,WY,Black-crowned Night-Heron,NULL,020203962,NULL,,2006,NULL,NULL,NULL,NULL,NULL,Albany,WY,White-faced Ibis,NULL,018703963,NULL,,2006,NULL,NULL,NULL,NULL,NULL,Albany,WY,Black-crowned Night-Heron,NULL,020203964,NULL,,1983,NULL,NULL,NULL,NULL,NULL,Fremont,WY,Double-crested Cormorant,NULL,012003965,NULL,,1984,NULL,NULL,NULL,NULL,NULL,Fremont,WY,Double-crested Cormorant,NULL,012003966,NULL,,1986,NULL,NULL,NULL,NULL,NULL,Fremont,WY,Double-crested Cormorant,NULL,012003967,NULL,,1982,NULL,NULL,NULL,NULL,NULL,Fremont,WY,Snowy Egret,NULL,019703968,NULL,,1983,NULL,NULL,NULL,NULL,NULL,Fremont,WY,Snowy Egret,NULL,019703969,NULL,,1984,NULL,NULL,NULL,NULL,NULL,Fremont,WY,Snowy Egret,NULL,019703970,NULL,,1989,NULL,NULL,NULL,NULL,NULL,Fremont,WY,Black-crowned Night-Heron,NULL,020203971,NULL,,1983,NULL,NULL,NULL,NULL,NULL,Natrona,WY,Snowy Egret,NULL,019703972,NULL,,1983,NULL,NULL,NULL,NULL,NULL,Natrona,WY,Double-crested Cormorant,NULL,012003973,NULL,,1984,NULL,NULL,NULL,NULL,NULL,Natrona,WY,Snowy Egret,NULL,019703974,NULL,,1984,NULL,NULL,NULL,NULL,NULL,Natrona,WY,Double-crested Cormorant,NULL,012003976,NULL,,1984,NULL,NULL,NULL,NULL,NULL,Natrona,WY,Black-crowned Night-Heron,NULL,020203977,NULL,,1985,NULL,NULL,NULL,NULL,NULL,Natrona,WY,Snowy Egret,NULL,019703978,NULL,,1985,NULL,NULL,NULL,NULL,NULL,Natrona,WY,Double-crested Cormorant,NULL,012003979,NULL,,1985,NULL,NULL,NULL,NULL,NULL,Natrona,WY,Black-crowned Night-Heron,NULL,020203980,NULL,,1986,NULL,NULL,NULL,NULL,NULL,Natrona,WY,Snowy Egret,NULL,019703981,NULL,,1986,NULL,NULL,NULL,NULL,NULL,Natrona,WY,Double-crested Cormorant,NULL,012003982,NULL,,1986,NULL,NULL,NULL,NULL,NULL,Natrona,WY,Black-crowned Night-Heron,NULL,020203983,NULL,,1987,NULL,NULL,NULL,NULL,NULL,Natrona,WY,Snowy Egret,NULL,019703984,NULL,,1987,NULL,NULL,NULL,NULL,NULL,Natrona,WY,Double-crested Cormorant,NULL,012003985,NULL,,1987,NULL,NULL,NULL,NULL,NULL,Natrona,WY,Black-crowned Night-Heron,NULL,020203986,NULL,,1988,NULL,NULL,NULL,NULL,NULL,Natrona,WY,Double-crested Cormorant,NULL,012003987,NULL,,1988,NULL,NULL,NULL,NULL,NULL,Natrona,WY,Black-crowned Night-Heron,NULL,020203988,NULL,,1989,NULL,NULL,NULL,NULL,NULL,Natrona,WY,Double-crested Cormorant,NULL,012003989,NULL,,1989,NULL,NULL,NULL,NULL,NULL,Natrona,WY,Black-crowned Night-Heron,NULL,020203990,NULL,,1990,NULL,NULL,NULL,NULL,NULL,Natrona,WY,Double-crested Cormorant,NULL,012003991,NULL,,1990,NULL,NULL,NULL,NULL,NULL,Natrona,WY,Caspian Tern,NULL,006403992,NULL,,1990,NULL,NULL,NULL,NULL,NULL,Natrona,WY,Black-crowned Night-Heron,NULL,020203993,NULL,,1992,NULL,NULL,NULL,NULL,NULL,Natrona,WY,Double-crested Cormorant,NULL,012003994,NULL,,1992,NULL,NULL,NULL,NULL,NULL,Natrona,WY,Caspian Tern,NULL,006403995,NULL,,1992,NULL,NULL,NULL,NULL,NULL,Natrona,WY,Black-crowned Night-Heron,NULL,020203996,NULL,,1994,NULL,NULL,NULL,NULL,NULL,Natrona,WY,Double-crested Cormorant,NULL,012003997,NULL,,1994,NULL,NULL,NULL,NULL,NULL,Natrona,WY,Caspian Tern,NULL,006403998,NULL,,1994,NULL,NULL,NULL,NULL,NULL,Natrona,WY,Black-crowned Night-Heron,NULL,020203999,NULL,,1995,NULL,NULL,NULL,NULL,NULL,Natrona,WY,Double-crested Cormorant,NULL,012004000,NULL,,1995,NULL,NULL,NULL,NULL,NULL,Natrona,WY,Black-crowned Night-Heron,NULL,020204001,NULL,,1996,NULL,NULL,NULL,NULL,NULL,Natrona,WY,Double-crested Cormorant,NULL,012004002,NULL,,1996,NULL,NULL,NULL,NULL,NULL,Natrona,WY,Black-crowned Night-Heron,NULL,020204003,NULL,,1997,NULL,NULL,NULL,NULL,NULL,Natrona,WY,Double-crested Cormorant,NULL,012004004,NULL,,1997,NULL,NULL,NULL,NULL,NULL,Natrona,WY,Black-crowned Night-Heron,NULL,020204005,NULL,,1998,NULL,NULL,NULL,NULL,NULL,Natrona,WY,Double-crested Cormorant,NULL,012004006,NULL,,1998,NULL,NULL,NULL,NULL,NULL,Natrona,WY,Black-crowned Night-Heron,NULL,020204007,NULL,,1999,NULL,NULL,NULL,NULL,NULL,Natrona,WY,Double-crested Cormorant,NULL,012004008,NULL,,1999,NULL,NULL,NULL,NULL,NULL,Natrona,WY,Black-crowned Night-Heron,NULL,020204009,NULL,,2000,NULL,NULL,NULL,NULL,NULL,Natrona,WY,Double-crested Cormorant,NULL,012004010,NULL,,2000,NULL,NULL,NULL,NULL,NULL,Natrona,WY,Caspian Tern,NULL,006404011,NULL,,2000,NULL,NULL,NULL,NULL,NULL,Natrona,WY,Black-crowned Night-Heron,NULL,020204012,NULL,,2001,NULL,NULL,NULL,NULL,NULL,Natrona,WY,Double-crested Cormorant,NULL,012004013,NULL,,2001,NULL,NULL,NULL,NULL,NULL,Natrona,WY,Caspian Tern,NULL,006404014,NULL,,2001,NULL,NULL,NULL,NULL,NULL,Natrona,WY,Black-crowned Night-Heron,NULL,020204015,NULL,,2002,NULL,NULL,NULL,NULL,NULL,Natrona,WY,Double-crested Cormorant,NULL,012004016,NULL,,2002,NULL,NULL,NULL,NULL,NULL,Natrona,WY,Caspian Tern,NULL,006404017,NULL,,2002,NULL,NULL,NULL,NULL,NULL,Natrona,WY,Black-crowned Night-Heron,NULL,020204018,NULL,,2003,NULL,NULL,NULL,NULL,NULL,Natrona,WY,Double-crested Cormorant,NULL,012004019,NULL,,2003,NULL,NULL,NULL,NULL,NULL,Natrona,WY,Black-crowned Night-Heron,NULL,020204020,NULL,,2005,NULL,NULL,NULL,NULL,NULL,Natrona,WY,Double-crested Cormorant,NULL,012004021,NULL,,2005,NULL,NULL,NULL,NULL,NULL,Natrona,WY,Caspian Tern,NULL,006404022,NULL,,2005,NULL,NULL,NULL,NULL,NULL,Natrona,WY,Black-crowned Night-Heron,NULL,020204023,NULL,,2006,NULL,NULL,NULL,NULL,NULL,Natrona,WY,Caspian Tern,NULL,006404024,NULL,,2002,NULL,NULL,NULL,NULL,NULL,Goshen,WY,Double-crested Cormorant,NAD 83,012004025,NULL,,1988,NULL,NULL,NULL,NULL,NULL,Bighorn,WY,Western Grebe,NULL,000104026,NULL,,1988,NULL,NULL,NULL,NULL,NULL,Bighorn,WY,Clark's Grebe,NAD 83,000114027,NULL,,1986,NULL,NULL,NULL,NULL,NULL,Albany,WY,Black-crowned Night-Heron,NULL,020204028,NULL,,1987,NULL,NULL,NULL,NULL,NULL,Albany,WY,Black-crowned Night-Heron,NULL,020204029,NULL,,1997,NULL,NULL,NULL,NULL,NULL,Albany,WY,Black-crowned Night-Heron,NULL,020204030,NULL,,1998,NULL,NULL,NULL,NULL,NULL,Albany,WY,Black-crowned Night-Heron,NULL,020204031,NULL,,1999,NULL,NULL,NULL,NULL,NULL,Albany,WY,Black-crowned Night-Heron,NULL,020204032,NULL,,2000,NULL,NULL,NULL,NULL,NULL,Albany,WY,Snowy Egret,NULL,019704033,NULL,,2000,NULL,NULL,NULL,NULL,NULL,Albany,WY,Black-crowned Night-Heron,NULL,020204034,NULL,,1992,NULL,NULL,NULL,NULL,NULL,Albany,WY,American White Pelican,NULL,012504035,NULL,,1993,NULL,NULL,NULL,NULL,NULL,Albany,WY,American White Pelican,NULL,012504036,NULL,,1985,NULL,NULL,NULL,NULL,NULL,Teton,WY,American White Pelican,NULL,012504037,NULL,,1986,NULL,NULL,NULL,NULL,NULL,Teton,WY,American White Pelican,NULL,012504038,NULL,,1987,NULL,NULL,NULL,NULL,NULL,Teton,WY,Caspian Tern,NULL,006404039,NULL,,1987,NULL,NULL,NULL,NULL,NULL,Teton,WY,American White Pelican,NULL,012504040,NULL,,1988,NULL,NULL,NULL,NULL,NULL,Teton,WY,Caspian Tern,NULL,006404041,NULL,,1988,NULL,NULL,NULL,NULL,NULL,Teton,WY,American White Pelican,NULL,012504042,NULL,,1989,NULL,NULL,NULL,NULL,NULL,Teton,WY,Caspian Tern,NULL,006404043,NULL,,1989,NULL,NULL,NULL,NULL,NULL,Teton,WY,American White Pelican,NULL,012504044,NULL,,1990,NULL,NULL,NULL,NULL,NULL,Teton,WY,Caspian Tern,NULL,006404045,NULL,,1990,NULL,NULL,NULL,NULL,NULL,Teton,WY,American White Pelican,NULL,012504046,NULL,,1991,NULL,NULL,NULL,NULL,NULL,Teton,WY,Caspian Tern,NULL,006404047,NULL,,1991,NULL,NULL,NULL,NULL,NULL,Teton,WY,American White Pelican,NULL,012504048,NULL,,1992,NULL,NULL,NULL,NULL,NULL,Teton,WY,Caspian Tern,NULL,006404049,NULL,,1992,NULL,NULL,NULL,NULL,NULL,Teton,WY,American White Pelican,NULL,012504050,NULL,,1993,NULL,NULL,NULL,NULL,NULL,Teton,WY,Caspian Tern,NULL,006404051,NULL,,1993,NULL,NULL,NULL,NULL,NULL,Teton,WY,American White Pelican,NULL,012504052,NULL,,1994,NULL,NULL,NULL,NULL,NULL,Teton,WY,Caspian Tern,NULL,006404053,NULL,,1994,NULL,NULL,NULL,NULL,NULL,Teton,WY,American White Pelican,NULL,012504054,NULL,,1995,NULL,NULL,NULL,NULL,NULL,Teton,WY,Caspian Tern,NULL,006403096,NULL,,1940,NULL,NULL,Behle 1958,NULL,NULL,Box Elder,UT,Double-crested Cormorant,NULL,012004055,NULL,,1995,NULL,NULL,NULL,NULL,NULL,Teton,WY,American White Pelican,NULL,012504056,NULL,,1996,NULL,NULL,NULL,NULL,NULL,Teton,WY,Caspian Tern,NULL,006404057,NULL,,1996,NULL,NULL,NULL,NULL,NULL,Teton,WY,American White Pelican,NULL,012504058,NULL,,1997,NULL,NULL,NULL,NULL,NULL,Teton,WY,Caspian Tern,NULL,006404059,NULL,,1997,NULL,NULL,NULL,NULL,NULL,Teton,WY,American White Pelican,NULL,012504060,NULL,,1998,NULL,NULL,NULL,NULL,NULL,Teton,WY,Caspian Tern,NULL,006404061,NULL,,1998,NULL,NULL,NULL,NULL,NULL,Teton,WY,American White Pelican,NULL,012504062,NULL,,1999,NULL,NULL,NULL,NULL,NULL,Teton,WY,Caspian Tern,NULL,006404063,NULL,,1999,NULL,NULL,NULL,NULL,NULL,Teton,WY,American White Pelican,NULL,012504064,NULL,,2000,NULL,NULL,NULL,NULL,NULL,Teton,WY,American White Pelican,NULL,012504065,NULL,,2001,NULL,NULL,NULL,NULL,NULL,Teton,WY,Caspian Tern,NULL,006404066,NULL,,2001,NULL,NULL,NULL,NULL,NULL,Teton,WY,American White Pelican,NULL,012504067,NULL,,2002,NULL,NULL,NULL,NULL,NULL,Teton,WY,Caspian Tern,NULL,006404068,NULL,,2002,NULL,NULL,NULL,NULL,NULL,Teton,WY,American White Pelican,NULL,012504069,NULL,,2003,NULL,NULL,NULL,NULL,NULL,Teton,WY,Caspian Tern,NULL,006404070,NULL,,2003,NULL,NULL,NULL,NULL,NULL,Teton,WY,American White Pelican,NULL,012504071,NULL,,2004,NULL,NULL,NULL,NULL,NULL,Teton,WY,Caspian Tern,NULL,006404072,NULL,,2004,NULL,NULL,NULL,NULL,NULL,Teton,WY,American White Pelican,NULL,012503097,NULL,,1941,NULL,NULL,Behle 1958,NULL,NULL,Box Elder,UT,California Gull,NULL,005304073,NULL,,2005,NULL,NULL,NULL,NULL,NULL,Teton,WY,Double-crested Cormorant,NULL,012004074,NULL,,2005,NULL,NULL,NULL,NULL,NULL,Teton,WY,Caspian Tern,NULL,006404075,NULL,,2005,NULL,NULL,NULL,NULL,NULL,Teton,WY,American White Pelican,NULL,012504076,NULL,,2006,NULL,NULL,NULL,NULL,NULL,Teton,WY,Double-crested Cormorant,NULL,012004077,NULL,,2006,NULL,NULL,NULL,NULL,NULL,Teton,WY,American White Pelican,NULL,012504078,NULL,,1987,NULL,NULL,NULL,NULL,NULL,Big Horn,WY,Forster's Tern,NULL,006903009,6/25/2009,00:00.0,2009,6,25,Parker/Frokjer,NULL,NULL,Weber,UT,Clark's Grebe,NULL,000113010,6/15/2009,00:00.0,2009,6,15,Neill,NULL,NULL,Box Elder,UT,Black-crowned Night-Heron,GSL,020203011,6/15/2009,00:00.0,2009,6,15,Neill,NULL,NULL,Box Elder,UT,Clark's Grebe,GSL,000113012,6/15/2009,00:00.0,2009,6,15,Neill/Mathis,NULL,NULL,Box Elder,UT,Eared Grebe,GSL,000403013,6/15/2009,00:00.0,2009,6,15,Neill,NULL,NULL,Box Elder,UT,Forster's Tern,GSL,006903014,6/15/2009,00:00.0,2009,6,15,Neill,NULL,NULL,Box Elder,UT,Great Blue Heron,GSL,019403015,6/15/2009,00:00.0,2009,6,15,Neill,NULL,NULL,Box Elder,UT,Snowy Egret,GSL,019703016,6/15/2009,00:00.0,2009,6,15,Neill,NULL,NULL,Box Elder,UT,Western Grebe,GSL,000103017,6/15/2009,00:00.0,2009,6,15,Neill,NULL,NULL,Box Elder,UT,White-faced Ibis,GSL,018703018,5/24/2010,00:00.0,2010,5,24,Parker/Frokjer,NULL,NULL,Sevier,UT,California Gull,NULL,005303019,6/15/2009,00:00.0,2009,6,15,Neill,NULL,NULL,Box Elder,UT,Great Blue Heron,GSL,019403020,6/10/2010,00:00.0,2010,6,10,Parker/Frokjer,NULL,NULL,Millard,UT,Caspian Tern,NULL,006403021,6/10/2010,00:00.0,2010,6,10,Parker/Frokjer,NULL,NULL,Millard,UT,Eared Grebe,NULL,000403022,6/10/2010,00:00.0,2010,6,10,Parker/Frokjer,NULL,NULL,Millard,UT,Western Grebe,NULL,000103023,6/2/2010,00:00.0,2010,6,2,Parker/Frokjer,NULL,NULL,Carbon,UT,Great Blue Heron,NULL,019403024,6/26/2009,00:00.0,2009,6,26,Parker/Frokjer,NULL,NULL,Carbon,UT,Western Grebe,NULL,000103025,6/22/2009,00:00.0,2009,6,22,Parker/Frokjer,NULL,NULL,Sanpete,UT,Great Blue Heron,NULL,019403026,6/22/2009,00:00.0,2009,6,22,Parker/Frokjer,NULL,NULL,Sanpete,UT,Great Blue Heron,NULL,019403027,5/24/2010,00:00.0,2010,5,24,Parker/Frokjer,NULL,NULL,Sanpete,UT,Great Blue Heron,NULL,019403028,5/18/2010,00:00.0,2010,5,18,Parker/Frokjer,NULL,NULL,Millard,UT,Great Blue Heron,NULL,019403029,5/24/2010,00:00.0,2010,5,24,Parker/Frokjer,NULL,NULL,Piute,UT,Great Blue Heron,NULL,019403030,5/24/2010,00:00.0,2010,5,24,Parker/Frokjer,NULL,NULL,Sevier,UT,Great Blue Heron,NULL,019403031,5/24/2010,00:00.0,2010,5,24,Parker/Frokjer,NULL,NULL,Sevier,UT,Great Egret,NULL,019603032,6/11/2009,00:00.0,2009,6,11,Parker/Frokjer,NULL,NULL,Cache,UT,Great Blue Heron,NULL,019403033,4/30/2009,00:00.0,2009,4,30,Parker,NULL,NULL,Weber,UT,Great Blue Heron,NULL,019403034,6/22/2009,00:00.0,2009,6,22,Parker/Frokjer,NULL,NULL,Sanpete,UT,Great Blue Heron,NULL,019403035,6/22/2009,00:00.0,2009,6,22,Parker/Frokjer,NULL,NULL,Sanpete,UT,Great Egret,NULL,019603036,6/2/2009,00:00.0,2009,6,2,Parker/Frokjer,NULL,NULL,Tooele,UT,Black-crowned Night-Heron,NULL,020203037,6/2/2009,00:00.0,2009,6,2,Parker/Frokjer,NULL,NULL,Tooele,UT,California Gull,NULL,005303038,6/2/2009,00:00.0,2009,6,2,Parker/Frokjer,NULL,NULL,Tooele,UT,Caspian Tern,NULL,006403039,6/2/2009,00:00.0,2009,6,2,Parker/Frokjer,NULL,NULL,Tooele,UT,Double-crested Cormorant,NULL,012003040,6/2/2009,00:00.0,2009,6,2,Parker/Frokjer,NULL,NULL,Tooele,UT,Great Blue Heron,NULL,019403041,6/2/2009,00:00.0,2009,6,2,Parker/Frokjer,NULL,NULL,Tooele,UT,Snowy Egret,NULL,019703042,6/16/2009,00:00.0,2009,6,16,Parker/Frokjer,NULL,NULL,Uintah,UT,Great Blue Heron,NULL,019403043,6/16/2009,00:00.0,2009,6,16,Parker/Frokjer,NULL,NULL,Uintah,UT,Western Grebe,NULL,000103044,6/25/2009,00:00.0,2009,6,25,Parker/Frokjer,NULL,NULL,Utah,UT,Black-crowned Night-Heron,NULL,020203045,6/25/2009,00:00.0,2009,6,25,Parker/Frokjer,NULL,NULL,Utah,UT,Cattle Egret,NULL,020013046,6/25/2009,00:00.0,2009,6,25,Parker/Frokjer,NULL,NULL,Utah,UT,Franklin's Gull,NULL,005903047,6/25/2009,00:00.0,2009,6,25,Parker/Frokjer,NULL,NULL,Utah,UT,Snowy Egret,NULL,019703048,6/25/2009,00:00.0,2009,6,25,Parker/Frokjer,NULL,NULL,Utah,UT,White-faced Ibis,NULL,018703049,7/14/2010,00:00.0,2010,7,14,Williams,NULL,NULL,Utah,UT,Great Egret,NULL,019603050,5/4/2009,00:00.0,2009,5,4,Parker/Frokjer,NULL,NULL,Utah,UT,Great Blue Heron,NULL,019403051,5/21/2009,00:00.0,2009,5,21,Parker/Frokjer,NULL,NULL,Utah,UT,Great Blue Heron,NULL,019403052,6/1/2009,00:00.0,2009,6,1,Parker,NULL,NULL,Utah,UT,Black-crowned Night-Heron,NULL,020203053,6/1/2009,00:00.0,2009,6,1,Parker,NULL,NULL,Utah,UT,Great Blue Heron,NULL,019403054,6/28/2010,00:00.0,2010,6,28,Parker/Gurr,NULL,NULL,Utah,UT,Clark's Grebe,NULL,000113055,6/28/2010,00:00.0,2010,6,28,Parker/Gurr,NULL,NULL,Utah,UT,Western Grebe,NULL,000103056,6/25/2009,00:00.0,2009,6,25,Parker/Frokjer,NULL,NULL,Utah,UT,Clark's Grebe,NULL,000113057,6/25/2009,00:00.0,2009,6,25,Parker/Frokjer,NULL,NULL,Utah,UT,Forster's Tern,NULL,006903058,6/23/2009,00:00.0,2009,6,23,Parker/Frokjer,NULL,NULL,Sanpete,UT,Eared Grebe,NULL,000403059,6/10/2009,00:00.0,2009,6,10,Parker/Frokjer,NULL,NULL,Summit,UT,Great Blue Heron,NULL,019403060,4/27/2009,00:00.0,2009,4,27,Parker/Frokjer,NULL,NULL,Summit,UT,Great Blue Heron,NULL,019403061,4/27/2009,00:00.0,2009,4,27,Parker/Frokjer,NULL,NULL,Morgan,UT,Great Blue Heron,NULL,019403062,4/27/2009,00:00.0,2009,4,27,Parker/Frokjer,NULL,NULL,Morgan,UT,Great Blue Heron,NULL,019403063,4/27/2009,00:00.0,2009,4,27,Parker/Frokjer,NULL,NULL,Morgan,UT,Great Blue Heron,NULL,019403064,6/10/2009,00:00.0,2009,6,10,Parker/Frokjer,NULL,NULL,Summit,UT,Great Blue Heron,NULL,019403065,6/10/2009,00:00.0,2009,6,10,Parker/Frokjer,NULL,NULL,Summit,UT,Great Blue Heron,NULL,019403066,6/20/2010,00:00.0,2010,6,20,Parker/Parker,NULL,NULL,Morgan,UT,Great Blue Heron,NULL,019403067,6/10/2009,00:00.0,2009,6,10,Parker/Frokjer,NULL,NULL,Summit,UT,Great Blue Heron,NULL,019403068,5/25/2010,00:00.0,2010,5,25,Neill/Bartosz,NULL,NULL,Davis,UT,California Gull,GSL,005303069,7/1/2010,00:00.0,2010,7,1,Neill et al.,NULL,NULL,Davis,UT,California Gull,GSL,005303070,6/18/2009,00:00.0,2009,6,18,Neill/Mathis,NULL,NULL,Box Elder,UT,Franklin's Gull,GSL,005903071,6/18/2009,00:00.0,2009,6,18,Neill/Mathis,NULL,NULL,Box Elder,UT,Franklin's Gull,GSL,005903072,6/18/2009,00:00.0,2009,6,18,Neill/Mathis,NULL,NULL,Box Elder,UT,Snowy Egret,GSL,019703073,6/18/2009,00:00.0,2009,6,18,Neill/Mathis,NULL,NULL,Box Elder,UT,Snowy Egret,GSL,019703074,6/18/2009,00:00.0,2009,6,18,Neill/Mathis,NULL,NULL,Box Elder,UT,White-faced Ibis,GSL,018703075,6/18/2009,00:00.0,2009,6,18,Neill/Mathis,NULL,NULL,Box Elder,UT,White-faced Ibis,GSL,018703076,7/1/2009,00:00.0,2009,7,1,Neill,NULL,NULL,Box Elder,UT,Black-crowned Night-Heron,GSL,020203077,7/1/2009,00:00.0,2009,7,1,Bankhead,NULL,NULL,Box Elder,UT,Franklin's Gull,GSL,005903078,7/1/2009,00:00.0,2009,7,1,Bankhead,NULL,NULL,Box Elder,UT,Snowy Egret,GSL,019703079,7/1/2009,00:00.0,2009,7,1,Neill,NULL,NULL,Box Elder,UT,White-faced Ibis,GSL,018703080,6/18/2009,00:00.0,2009,6,18,Neill/Mathis,NULL,NULL,Box Elder,UT,Western or Clark's Grebe,GSL,NULL3081,7/1/2009,00:00.0,2009,7,1,Neill,NULL,NULL,Box Elder,UT,Eared Grebe,GSL,000403082,7/1/2009,00:00.0,2009,7,1,Bankhead,NULL,NULL,Box Elder,UT,Forster's Tern,GSL,006903083,7/1/2009,00:00.0,2009,7,1,Bankhead,NULL,NULL,Box Elder,UT,Forster's Tern,GSL,006903084,7/7/1999,00:00.0,1999,7,7,NULL,NULL,NULL,Box Elder,UT,Black-crowned Night-Heron,NULL,020203085,7/7/1999,00:00.0,1999,7,7,NULL,NULL,NULL,Box Elder,UT,Great Blue Heron,NULL,019403086,7/7/1999,00:00.0,1999,7,7,NULL,NULL,NULL,Box Elder,UT,Great Egret,NULL,019603087,7/7/1999,00:00.0,1999,7,7,NULL,NULL,NULL,Box Elder,UT,Snowy Egret,NULL,019703088,7/7/1999,00:00.0,1999,7,7,NULL,NULL,NULL,Box Elder,UT,Black Tern,NULL,007703089,7/7/1999,00:00.0,1999,7,7,NULL,NULL,NULL,Box Elder,UT,Black-crowned Night-Heron,NULL,020203090,7/7/1999,00:00.0,1999,7,7,NULL,NULL,NULL,Box Elder,UT,Snowy Egret,NULL,019703091,NULL,,1935,NULL,NULL,Behle 1958,NULL,NULL,Box Elder,UT,Caspian Tern,NULL,006403092,NULL,,1936,NULL,NULL,Behle 1958,NULL,NULL,Box Elder,UT,California Gull,NULL,005303093,NULL,,1936,NULL,NULL,Behle 1958,NULL,NULL,Box Elder,UT,Double-crested Cormorant,NULL,012003094,NULL,,1939,NULL,NULL,Behle 1958,NULL,NULL,Box Elder,UT,California Gull,NULL,005303095,NULL,,1939,NULL,NULL,Behle 1958,NULL,NULL,Box Elder,UT,Double-crested Cormorant,NULL,012003098,NULL,,1941,NULL,NULL,Behle 1958,NULL,NULL,Box Elder,UT,Double-crested Cormorant,NULL,012003099,NULL,,1942,NULL,NULL,Behle 1958,NULL,NULL,Box Elder,UT,California Gull,NULL,005303100,NULL,,1942,NULL,NULL,Behle 1958,NULL,NULL,Box Elder,UT,Double-crested Cormorant,NULL,012003101,NULL,,1943,NULL,NULL,Behle 1958,NULL,NULL,Box Elder,UT,California Gull,NULL,005303102,NULL,,1943,NULL,NULL,Behle 1958,NULL,NULL,Box Elder,UT,Double-crested Cormorant,NULL,012003103,NULL,,1944,NULL,NULL,Behle 1958,NULL,NULL,Box Elder,UT,California Gull,NULL,005303104,NULL,,1944,NULL,NULL,Behle 1958,NULL,NULL,Box Elder,UT,Double-crested Cormorant,NULL,012003105,NULL,,1945,NULL,NULL,Behle 1958,NULL,NULL,Box Elder,UT,California Gull,NULL,005303106,NULL,,1945,NULL,NULL,Behle 1958,NULL,NULL,Box Elder,UT,Double-crested Cormorant,NULL,012003107,NULL,,1946,NULL,NULL,Behle 1958,NULL,NULL,Box Elder,UT,California Gull,NULL,005303108,NULL,,1946,NULL,NULL,Behle 1958,NULL,NULL,Box Elder,UT,Double-crested Cormorant,NULL,012003109,NULL,,1947,NULL,NULL,Behle 1958,NULL,NULL,Box Elder,UT,California Gull,NULL,005303110,NULL,,1947,NULL,NULL,Behle 1958,NULL,NULL,Box Elder,UT,Double-crested Cormorant,NULL,012003111,NULL,,1948,NULL,NULL,Behle 1958,NULL,NULL,Box Elder,UT,California Gull,NULL,005303112,NULL,,1948,NULL,NULL,Behle 1958,NULL,NULL,Box Elder,UT,Double-crested Cormorant,NULL,012003113,NULL,,1949,NULL,NULL,Behle 1958,NULL,NULL,Box Elder,UT,California Gull,NULL,005303114,NULL,,1949,NULL,NULL,Behle 1958,NULL,NULL,Box Elder,UT,Double-crested Cormorant,NULL,012003115,NULL,,1950,NULL,NULL,Behle 1958,NULL,NULL,Box Elder,UT,California Gull,NULL,005303116,NULL,,1939,NULL,NULL,Behle 1958,NULL,NULL,Box Elder,UT,Caspian Tern,NULL,006403117,5/13/1941,00:00.0,1941,5,13,Behle 1958,NULL,NULL,Box Elder,UT,Caspian Tern,NULL,006403118,5/21/1942,00:00.0,1942,5,21,Behle 1958,NULL,NULL,Box Elder,UT,Caspian Tern,NULL,006403119,5/19/1943,00:00.0,1943,5,19,Behle 1958,NULL,NULL,Box Elder,UT,Caspian Tern,NULL,006403120,5/9/1946,00:00.0,1946,5,9,Behle 1958,NULL,NULL,Box Elder,UT,Caspian Tern,NULL,006403121,6/6/1949,00:00.0,1949,6,6,Behle 1958,NULL,NULL,Box Elder,UT,Caspian Tern,NULL,006403122,NULL,,1947,5,NULL,Behle 1958,NULL,NULL,Box Elder,UT,Caspian Tern,NULL,006403123,NULL,,1948,5,NULL,Behle 1958,NULL,NULL,Box Elder,UT,Caspian Tern,NULL,006403124,NULL,,1936,NULL,NULL,Behle 1958,NULL,NULL,Box Elder,UT,Caspian Tern,NULL,006403125,5/7/2007,00:00.0,2007,5,7,NULL,NULL,NULL,Box Elder,UT,Franklin's Gull,NULL,005903126,5/7/2007,00:00.0,2007,5,7,NULL,NULL,NULL,Box Elder,UT,Franklin's Gull,NULL,005903127,7/6/1999,00:00.0,1999,7,6,NULL,NULL,NULL,Box Elder,UT,Black-crowned Night-Heron,NULL,020203128,7/6/1999,00:00.0,1999,7,6,NULL,NULL,NULL,Box Elder,UT,Forster's Tern,NULL,006903129,7/6/1999,00:00.0,1999,7,6,NULL,NULL,NULL,Box Elder,UT,Franklin's Gull,NULL,005903130,7/6/1999,00:00.0,1999,7,6,NULL,NULL,NULL,Box Elder,UT,Great Heron,NULL,NULL3131,7/6/1999,00:00.0,1999,7,6,NULL,NULL,NULL,Box Elder,UT,Snowy Egret,NULL,019703132,5/27/1999,00:00.0,1999,5,27,NULL,NULL,NULL,Box Elder,UT,Black-crowned Night-Heron,NULL,020203133,7/6/1999,00:00.0,1999,7,6,NULL,NULL,NULL,Box Elder,UT,Forster's Tern,NULL,006903134,7/6/1999,00:00.0,1999,7,6,NULL,NULL,NULL,Box Elder,UT,Franklin's Gull,NULL,005903135,5/7/2007,00:00.0,2007,5,7,NULL,NULL,NULL,Box Elder,UT,Franklin's Gull,NULL,005903136,5/27/1999,00:00.0,1999,5,27,NULL,NULL,NULL,Box Elder,UT,Black-crowned Night-Heron,NULL,020203137,5/27/1999,00:00.0,1999,5,27,NULL,NULL,NULL,Box Elder,UT,Great Blue Heron,NULL,019403138,7/6/1999,00:00.0,1999,7,6,NULL,NULL,NULL,Box Elder,UT,Black-crowned Night-Heron,NULL,020203139,7/6/1999,00:00.0,1999,7,6,NULL,NULL,NULL,Box Elder,UT,Forster's Tern,NULL,006903140,7/6/1999,00:00.0,1999,7,6,NULL,NULL,NULL,Box Elder,UT,Snowy Egret,NULL,019703141,6/16/2000,00:00.0,2000,6,16,NULL,NULL,NULL,Box Elder,UT,Black-crowned Night-Heron,NULL,020203142,6/16/2000,00:00.0,2000,6,16,NULL,NULL,NULL,Box Elder,UT,Franklin's Gull,NULL,005903143,6/16/2000,00:00.0,2000,6,16,NULL,NULL,NULL,Box Elder,UT,Great Egret,NULL,019603144,6/16/2000,00:00.0,2000,6,16,NULL,NULL,NULL,Box Elder,UT,Snowy Egret,NULL,019703145,6/17/2000,00:00.0,2000,6,17,NULL,NULL,NULL,Box Elder,UT,Black-crowned Night-Heron,NULL,020203146,6/17/2000,00:00.0,2000,6,17,NULL,NULL,NULL,Box Elder,UT,Franklin's Gull,NULL,005903147,6/17/2000,00:00.0,2000,6,17,NULL,NULL,NULL,Box Elder,UT,Snowy Egret,NULL,019703148,6/17/2000,00:00.0,2000,6,17,NULL,NULL,NULL,Box Elder,UT,White-faced Ibis,NULL,018703149,5/7/2007,00:00.0,2007,5,7,NULL,NULL,NULL,Box Elder,UT,Franklin's Gull,NULL,005903150,NULL,,1912,NULL,NULL,Behle 1958,NULL,NULL,Davis,UT,Great Blue Heron,NULL,019403151,NULL,,1932,NULL,NULL,Behle 1958,NULL,NULL,Davis,UT,Double-crested Cormorant,NULL,012003152,NULL,,1932,NULL,NULL,Behle 1958,NULL,NULL,Davis,UT,Great Blue Heron,NULL,019403153,NULL,,1941,NULL,NULL,Behle 1958,NULL,NULL,Davis,UT,California Gull,NULL,005303154,NULL,,1982,NULL,NULL,Robinette et al. 1993,NULL,NULL,Davis,UT,California Gull,NULL,005303155,NULL,,1983,NULL,NULL,Robinette et al. 1993,NULL,NULL,Davis,UT,California Gull,NULL,005303156,NULL,,1990,NULL,NULL,Robinette et al. 1993,NULL,NULL,Davis,UT,California Gull,NULL,005303157,NULL,,1991,NULL,NULL,Robinette et al. 1993,NULL,NULL,Davis,UT,California Gull,NULL,005303158,NULL,,1993,NULL,NULL,Robinette et al. 1993,NULL,NULL,Davis,UT,California Gull,NULL,005303159,5/11/1906,00:00.0,1906,5,11,Behle 1958,NULL,NULL,Davis,UT,California Gull,NULL,005303160,5/11/1906,00:00.0,1906,5,11,Behle 1958,NULL,NULL,Davis,UT,Double-crested Cormorant,NULL,012003161,5/11/1906,00:00.0,1906,5,11,Behle 1958,NULL,NULL,Davis,UT,Great Blue Heron,NULL,019403162,5/16/1907,00:00.0,1907,5,16,Behle 1958,NULL,NULL,Davis,UT,Great Blue Heron,NULL,019403163,6/25/1934,00:00.0,1934,6,25,Behle 1958,NULL,NULL,Davis,UT,Double-crested Cormorant,NULL,012003164,6/25/1934,00:00.0,1934,6,25,Behle 1958,NULL,NULL,Davis,UT,Great Blue Heron,NULL,019403165,4/10/1935,00:00.0,1935,4,10,Behle 1958,NULL,NULL,Davis,UT,California Gull,NULL,005303166,4/10/1935,00:00.0,1935,4,10,Behle 1958,NULL,NULL,Davis,UT,Double-crested Cormorant,NULL,012003167,4/10/1935,00:00.0,1935,4,10,Behle 1958,NULL,NULL,Davis,UT,Great Blue Heron,NULL,019403168,5/9/1936,00:00.0,1936,5,9,Behle 1958,NULL,NULL,Davis,UT,California Gull,NULL,005303169,5/9/1936,00:00.0,1936,5,9,Behle 1958,NULL,NULL,Davis,UT,Double-crested Cormorant,NULL,012003170,5/9/1936,00:00.0,1936,5,9,Behle 1958,NULL,NULL,Davis,UT,Great Blue Heron,NULL,019403171,5/7/1937,00:00.0,1937,5,7,Behle 1958,NULL,NULL,Davis,UT,California Gull,NULL,005303172,5/7/1937,00:00.0,1937,5,7,Behle 1958,NULL,NULL,Davis,UT,Double-crested Cormorant,NULL,012003173,5/7/1937,00:00.0,1937,5,7,Behle 1958,NULL,NULL,Davis,UT,Great Blue Heron,NULL,019403174,5/7/1938,00:00.0,1938,5,7,Behle 1958,NULL,NULL,Davis,UT,Double-crested Cormorant,NULL,012003175,5/7/1938,00:00.0,1938,5,7,Behle 1958,NULL,NULL,Davis,UT,Great Blue Heron,NULL,019403176,6/3/1939,00:00.0,1939,6,3,Behle 1958,NULL,NULL,Davis,UT,California Gull,NULL,005303177,6/3/1939,00:00.0,1939,6,3,Behle 1958,NULL,NULL,Davis,UT,Double-crested Cormorant,NULL,012003178,4/21/1940,00:00.0,1940,4,21,Behle 1958,NULL,NULL,Davis,UT,Double-crested Cormorant,NULL,012003179,6/8/1940,00:00.0,1940,6,8,Behle 1958,NULL,NULL,Davis,UT,California Gull,NULL,005303180,5/27/1941,00:00.0,1941,5,27,Behle 1958,NULL,NULL,Davis,UT,Double-crested Cormorant,NULL,012003181,5/8/1942,00:00.0,1942,5,8,Behle 1958,NULL,NULL,Davis,UT,Double-crested Cormorant,NULL,012003182,6/6/1942,00:00.0,1942,6,6,Behle 1958,NULL,NULL,Davis,UT,California Gull,NULL,005303183,5/13/1944,00:00.0,1944,5,13,Behle 1958,NULL,NULL,Davis,UT,Double-crested Cormorant,NULL,012003184,6/8/1947,00:00.0,1947,6,8,Behle 1958,NULL,NULL,Davis,UT,California Gull,NULL,005303185,6/8/1947,00:00.0,1947,6,8,Behle 1958,NULL,NULL,Davis,UT,Double-crested Cormorant,NULL,012003186,NULL,,1850,4,19,Behle 1958,NULL,NULL,Davis,UT,Double-crested Cormorant,NULL,012003187,NULL,,1850,4,9,Behle 1958,NULL,NULL,Davis,UT,California Gull,NULL,005303188,NULL,,1850,4,9,Behle 1958,NULL,NULL,Davis,UT,Great Blue Heron,NULL,019403189,NULL,,1907,5,NULL,Behle 1958,NULL,NULL,Davis,UT,California Gull,NULL,005303190,NULL,,1908,6,NULL,Behle 1958,NULL,NULL,Davis,UT,California Gull,NULL,005303191,NULL,,1908,6,NULL,Behle 1958,NULL,NULL,Davis,UT,Great Blue Heron,NULL,019403192,NULL,,1912,NULL,NULL,Behle 1958,NULL,NULL,Davis,UT,California Gull,SurveyDate: Spring 1912,005303193,7/9/1998,00:00.0,1998,7,9,Paul,NULL,NULL,Davis,UT,Black Tern,NULL,007703194,7/9/1998,00:00.0,1998,7,9,Paul,NULL,NULL,Davis,UT,Eared Grebe,NULL,000403195,7/9/1998,00:00.0,1998,7,9,Paul,NULL,NULL,Davis,UT,Forster's Tern,NULL,006903196,7/9/1998,00:00.0,1998,7,9,Paul,NULL,NULL,Davis,UT,Franklin's Gull,NULL,005902104,NULL,,2009,4,26,Waltee,NULL,NULL,Rosebud,MT,Great Blue Heron,NULL,019402105,NULL,,2009,NULL,NULL,Waltee,NULL,NULL,Bighorn,MT,Double-crested Cormorant,NULL,012002106,NULL,,2009,NULL,NULL,Waltee,NULL,NULL,Bighorn,MT,Great Blue Heron,NULL,019402107,5/11/2011,00:00.0,2011,5,11,DuBois/Mamutich,NULL,NULL,Missoula,MT,Great Blue Heron,NULL,019402108,6/18/2010,00:00.0,2010,6,18,Doney,NULL,NULL,Beaverhead,MT,Great Blue Heron,NULL,019402109,6/5/2009,00:00.0,2009,6,5,Lipsey/Smith,NULL,NULL,Valley,MT,Eared Grebe,NULL,000402110,6/12/2009,00:00.0,2009,6,12,Paige et al.,NULL,NULL,Deer Lodge,MT,Double-crested Cormorant,NULL,012002111,6/12/2009,00:00.0,2009,6,12,Paige et al.,NULL,NULL,Deer Lodge,MT,Great Blue Heron,NULL,019402112,6/12/2009,00:00.0,2009,6,12,Paige et al.,NULL,NULL,Deer Lodge,MT,Ring-billed Gull,NULL,005402113,6/21/2010,00:00.0,2010,6,21,Swant,NULL,NULL,Deer Lodge,MT,Eared Grebe,NULL,000402114,6/29/2010,00:00.0,2010,6,29,Swant,NULL,NULL,Deer Lodge,MT,California Gull,NULL,005302115,6/29/2010,00:00.0,2010,6,29,Swant,NULL,NULL,Deer Lodge,MT,Double-crested Cormorant,NULL,012002116,6/29/2010,00:00.0,2010,6,29,Swant,NULL,NULL,Deer Lodge,MT,Great Blue Heron,NULL,019402117,6/29/2010,00:00.0,2010,6,29,Swant,NULL,NULL,Deer Lodge,MT,Ring-billed Gull,NULL,005402118,5/22/2011,00:00.0,2011,5,22,DuBois/Throop,NULL,NULL,Deer Lodge,MT,Double-crested Cormorant,NULL,012002119,5/22/2011,00:00.0,2011,5,22,DuBois/Throop,NULL,NULL,Deer Lodge,MT,Great Blue Heron,NULL,019402120,7/26/2010,00:00.0,2010,7,26,Prellwitz,NULL,NULL,Phillips,MT,Great Blue Heron,NULL,019402121,6/19/2009,00:00.0,2009,6,19,Tilly,NULL,NULL,Daniels,MT,Common Tern,NULL,007002122,6/27/2009,00:00.0,2009,6,27,Tilly,NULL,NULL,Phillips,MT,Ring-billed Gull,NULL,005402123,6/2/2010,00:00.0,2010,6,2,Tilly,NULL,NULL,Phillips,MT,Ring-billed Gull,NULL,005402124,7/3/2010,00:00.0,2010,7,3,Tilly,NULL,NULL,Phillips,MT,Black Tern,NULL,007702125,7/3/2010,00:00.0,2010,7,3,Tilly,NULL,NULL,Phillips,MT,Black-crowned Night-Heron,NULL,020202126,7/3/2010,00:00.0,2010,7,3,Tilly,NULL,NULL,Phillips,MT,Eared Grebe,NULL,000402127,7/4/2011,00:00.0,2011,7,4,Tilly,NULL,NULL,Phillips,MT,Eared Grebe,NULL,000402128,NULL,,2011,NULL,NULL,Tilly,NULL,NULL,Phillips,MT,Ring-billed Gull,NULL,005402129,6/27/2009,00:00.0,2009,6,27,Tilly,NULL,NULL,Phillips,MT,Double-crested Cormorant,NULL,012002130,6/27/2009,00:00.0,2009,6,27,Tilly,NULL,NULL,Phillips,MT,Ring-billed Gull,NULL,005402131,6/27/2009,00:00.0,2009,6,27,Tilly,NULL,NULL,Phillips,MT,Western Grebe,NULL,000102132,6/2/2010,00:00.0,2010,6,2,Tilly,NULL,NULL,Phillips,MT,Double-crested Cormorant,NULL,012002133,6/2/2010,00:00.0,2010,6,2,Tilly,NULL,NULL,Phillips,MT,Ring-billed or California Gull,NULL,NULL2134,7/3/2010,00:00.0,2010,7,3,Tilly,NULL,NULL,Phillips,MT,Western Grebe,NULL,000102135,NULL,,2010,NULL,NULL,Waltee,NULL,NULL,Carter,MT,Great Blue Heron,NULL,019402136,NULL,,2010,4,8,Waltee,NULL,NULL,Custer,MT,Great Blue Heron,NULL,019402137,NULL,,2011,4,16,Stewart,NULL,NULL,Carbon,MT,Great Blue Heron,NULL,019402138,5/23/2011,00:00.0,2011,5,23,Begley,NULL,NULL,Sweet Grass,MT,Double-crested Cormorant,NULL,012002139,5/23/2011,00:00.0,2011,5,23,Begley,NULL,NULL,Sweet Grass,MT,Great Blue Heron,NULL,019402140,5/23/2011,00:00.0,2011,5,23,Begley,NULL,NULL,Stillwater,MT,Great Blue Heron,NULL,019402141,5/23/2011,00:00.0,2011,5,23,Begley,NULL,NULL,Sweet Grass,MT,Great Blue Heron,NULL,019402142,4/28/2011,00:00.0,2011,4,28,Begley,NULL,NULL,Yellowstone,MT,Great Blue Heron,NULL,019402143,4/28/2011,00:00.0,2011,4,28,Begley,NULL,NULL,Yellowstone,MT,Great Blue Heron,NULL,019402144,4/28/2011,00:00.0,2011,4,28,Begley,NULL,NULL,Yellowstone,MT,Great Blue Heron,NULL,019402145,4/28/2011,00:00.0,2011,4,28,Begley,NULL,NULL,Yellowstone,MT,Great Blue Heron,NULL,019402146,5/23/2011,00:00.0,2011,5,23,Begley,NULL,NULL,Stillwater,MT,Great Blue Heron,NULL,019402147,5/23/2011,00:00.0,2011,5,23,Begley,NULL,NULL,Yellowstone,MT,Great Blue Heron,NULL,019402148,5/23/2011,00:00.0,2011,5,23,Begley,NULL,NULL,Yellowstone,MT,Great Blue Heron,NULL,019402149,5/23/2011,00:00.0,2011,5,23,Begley,NULL,NULL,Yellowstone,MT,Great Blue Heron,NULL,019402150,5/23/2011,00:00.0,2011,5,23,Begley,NULL,NULL,Sweet Grass,MT,Double-crested Cormorant,NULL,012002151,5/23/2011,00:00.0,2011,5,23,Begley,NULL,NULL,Sweet Grass,MT,Great Blue Heron,NULL,019402152,NULL,,1980,NULL,NULL,Olson,NULL,NULL,Teton,MT,Great Blue Heron,NULL,019402153,NULL,,1990,NULL,NULL,NULL,NULL,NULL,Teton,MT,American White Pelican,NULL,012502154,NULL,,1993,NULL,NULL,NULL,NULL,NULL,Teton,MT,American White Pelican,NULL,012502155,NULL,,2000,NULL,NULL,NULL,NULL,NULL,Teton,MT,American White Pelican,NULL,012502156,NULL,,2001,NULL,NULL,NULL,NULL,NULL,Teton,MT,American White Pelican,NULL,012502157,NULL,,1977,NULL,NULL,Billings,NULL,NULL,Fergus,MT,Great Blue Heron,NULL,019402158,NULL,,1978,NULL,NULL,Billings,NULL,NULL,Broadwater,MT,Great Blue Heron,NULL,019402159,NULL,,1979,NULL,NULL,Billings,NULL,NULL,Broadwater,MT,Great Blue Heron,NULL,019402160,NULL,,1989,NULL,NULL,NULL,NULL,NULL,Broadwater,MT,American White Pelican,NULL,012502161,NULL,,2000,NULL,NULL,NULL,NULL,NULL,Broadwater,MT,American White Pelican,NULL,012502162,NULL,,1996,NULL,NULL,NULL,NULL,NULL,Hill,MT,Ring-billed Gull,NULL,005402163,NULL,,1978,NULL,NULL,Parker,NULL,NULL,Flathead,MT,Great Blue Heron,NULL,019402164,NULL,,1979,NULL,NULL,Parker,NULL,NULL,Flathead,MT,Great Blue Heron,NULL,019402165,NULL,,1985,NULL,NULL,Prellwitz,NULL,NULL,Phillips,MT,Black-crowned Night-Heron,NULL,020202166,NULL,,1981,NULL,NULL,Prellwitz,NULL,NULL,Phillips,MT,Common Tern,NULL,007002167,NULL,,1983,NULL,NULL,Prellwitz,NULL,NULL,Phillips,MT,Common Tern,NULL,007002168,NULL,,1986,NULL,NULL,Prellwitz,NULL,NULL,Phillips,MT,Common Tern,NULL,007002169,NULL,,1976,NULL,NULL,Shupe,NULL,NULL,Valley,MT,Great Blue Heron,NULL,019402170,NULL,,1977,NULL,NULL,Shupe,NULL,NULL,Valley,MT,Double-crested Cormorant,NULL,012002171,NULL,,1978,NULL,NULL,Shupe,NULL,NULL,Valley,MT,Double-crested Cormorant,NULL,012002172,NULL,,1976,NULL,NULL,Shupe,NULL,NULL,Garfield,MT,Double-crested Cormorant,NULL,012002173,NULL,,1978,NULL,NULL,Shupe,NULL,NULL,Garfield,MT,Double-crested Cormorant,NULL,012002174,NULL,,1976,NULL,NULL,Shupe,NULL,NULL,McCone,MT,Double-crested Cormorant,NULL,012002175,NULL,,1976,NULL,NULL,Shupe,NULL,NULL,McCone,MT,Great Blue Heron,NULL,019402176,NULL,,1976,NULL,NULL,Shupe,NULL,NULL,McCone,MT,Great Blue Heron,NULL,019402177,NULL,,1978,NULL,NULL,Shupe,NULL,NULL,McCone,MT,Double-crested Cormorant,NULL,012002178,NULL,,1978,NULL,NULL,Shupe,NULL,NULL,McCone,MT,Great Blue Heron,NULL,019402179,NULL,,1980,NULL,NULL,Children,NULL,NULL,Teton,MT,Double-crested Cormorant,NULL,012002180,NULL,,1994,NULL,NULL,Schwitters,NULL,NULL,Teton,MT,Caspian Tern,NULL,006402181,NULL,,1980,NULL,NULL,Trueblood,NULL,NULL,Phillips,MT,Double-crested Cormorant,NULL,012002182,NULL,,1985,NULL,NULL,Prellwitz,NULL,NULL,Phillips,MT,Black-crowned Night-Heron,NULL,020202183,NULL,,1987,NULL,NULL,Prellwitz,NULL,NULL,Phillips,MT,Black-crowned Night-Heron,NULL,020202184,NULL,,1996,NULL,NULL,Prellwitz,NULL,NULL,Phillips,MT,Black-crowned Night-Heron,NULL,020202185,NULL,,1935,NULL,NULL,NULL,NULL,NULL,Phillips,MT,American White Pelican,NULL,012502186,NULL,,1968,NULL,NULL,NULL,NULL,NULL,Phillips,MT,Great Blue Heron,NULL,019402187,NULL,,1972,NULL,NULL,Reichel,NULL,NULL,Phillips,MT,Double-crested Cormorant,NULL,012002188,NULL,,1972,NULL,NULL,NULL,NULL,NULL,Phillips,MT,Great Blue Heron,NULL,019402189,NULL,,1973,NULL,NULL,NULL,NULL,NULL,Phillips,MT,Double-crested Cormorant,NULL,012002190,NULL,,1973,NULL,NULL,NULL,NULL,NULL,Phillips,MT,Great Blue Heron,NULL,019402191,NULL,,1974,NULL,NULL,NULL,NULL,NULL,Phillips,MT,Double-crested Cormorant,NULL,012002192,NULL,,1974,NULL,NULL,NULL,NULL,NULL,Phillips,MT,Great Blue Heron,NULL,019402193,NULL,,1975,NULL,NULL,NULL,NULL,NULL,Phillips,MT,Double-crested Cormorant,NULL,012002194,NULL,,1975,NULL,NULL,NULL,NULL,NULL,Phillips,MT,Great Blue Heron,NULL,019402195,NULL,,1976,NULL,NULL,NULL,NULL,NULL,Phillips,MT,Double-crested Cormorant,NULL,012002196,NULL,,1976,NULL,NULL,NULL,NULL,NULL,Phillips,MT,Great Blue Heron,NULL,019402197,NULL,,1979,NULL,NULL,NULL,NULL,NULL,Phillips,MT,Double-crested Cormorant,NULL,012002198,NULL,,1979,NULL,NULL,NULL,NULL,NULL,Phillips,MT,Great Blue Heron,NULL,019402199,NULL,,1993,NULL,NULL,NULL,NULL,NULL,Phillips,MT,American White Pelican,NULL,012502200,NULL,,1998,NULL,NULL,NULL,NULL,NULL,Phillips,MT,Arctic Tern,NULL,007102201,NULL,,1999,NULL,NULL,NULL,NULL,NULL,Phillips,MT,American White Pelican,NULL,012502202,NULL,,1999,NULL,NULL,NULL,NULL,NULL,Phillips,MT,Arctic Tern,NULL,007102203,NULL,,2000,NULL,NULL,NULL,NULL,NULL,Phillips,MT,American White Pelican,NULL,012502204,NULL,,2000,NULL,NULL,Dinsmore,NULL,NULL,Phillips,MT,Arctic Tern,NULL,007102205,NULL,,1996,NULL,NULL,NULL,NULL,NULL,Petroleum,MT,Common Tern,NULL,007002206,NULL,,1996,NULL,NULL,NULL,NULL,NULL,Petroleum,MT,Double-crested Cormorant,NULL,012002207,NULL,,1996,NULL,NULL,NULL,NULL,NULL,Petroleum,MT,Forster's Tern,NULL,006902208,NULL,,1979,NULL,NULL,Marble,NULL,NULL,Liberty,MT,Great Blue Heron,NULL,019402209,NULL,,1938,NULL,NULL,NULL,NULL,NULL,Sheridan,MT,American White Pelican,NULL,012502210,NULL,,1939,NULL,NULL,NULL,NULL,NULL,Sheridan,MT,American White Pelican,NULL,012502211,NULL,,1939,NULL,NULL,NULL,NULL,NULL,Sheridan,MT,American White Pelican,NULL,012502212,NULL,,1940,NULL,NULL,NULL,NULL,NULL,Sheridan,MT,American White Pelican,NULL,012502213,NULL,,1941,NULL,NULL,NULL,NULL,NULL,Sheridan,MT,American White Pelican,NULL,012502214,NULL,,1942,NULL,NULL,NULL,NULL,NULL,Sheridan,MT,American White Pelican,NULL,012502215,NULL,,1943,NULL,NULL,NULL,NULL,NULL,Sheridan,MT,American White Pelican,NULL,012502216,NULL,,1944,NULL,NULL,NULL,NULL,NULL,Sheridan,MT,American White Pelican,NULL,012502217,NULL,,1945,NULL,NULL,NULL,NULL,NULL,Sheridan,MT,American White Pelican,NULL,012502218,NULL,,1946,NULL,NULL,NULL,NULL,NULL,Sheridan,MT,American White Pelican,NULL,012502219,NULL,,1947,NULL,NULL,NULL,NULL,NULL,Sheridan,MT,American White Pelican,NULL,012502220,NULL,,1948,NULL,NULL,NULL,NULL,NULL,Sheridan,MT,American White Pelican,NULL,012502221,NULL,,1949,NULL,NULL,NULL,NULL,NULL,Sheridan,MT,American White Pelican,NULL,012502222,NULL,,1950,NULL,NULL,NULL,NULL,NULL,Sheridan,MT,American White Pelican,NULL,012502223,NULL,,1951,NULL,NULL,NULL,NULL,NULL,Sheridan,MT,American White Pelican,NULL,012502224,NULL,,1952,NULL,NULL,NULL,NULL,NULL,Sheridan,MT,American White Pelican,NULL,012502225,NULL,,1953,NULL,NULL,NULL,NULL,NULL,Sheridan,MT,American White Pelican,NULL,012502226,NULL,,1954,NULL,NULL,NULL,NULL,NULL,Sheridan,MT,American White Pelican,NULL,012502227,NULL,,1955,NULL,NULL,NULL,NULL,NULL,Sheridan,MT,American White Pelican,NULL,012502228,NULL,,1956,NULL,NULL,NULL,NULL,NULL,Sheridan,MT,American White Pelican,NULL,012502229,NULL,,1957,NULL,NULL,NULL,NULL,NULL,Sheridan,MT,American White Pelican,NULL,012502230,NULL,,1958,NULL,NULL,NULL,NULL,NULL,Sheridan,MT,American White Pelican,NULL,012502231,NULL,,1959,NULL,NULL,NULL,NULL,NULL,Sheridan,MT,American White Pelican,NULL,012502232,NULL,,1960,NULL,NULL,NULL,NULL,NULL,Sheridan,MT,American White Pelican,NULL,012502233,NULL,,1961,NULL,NULL,NULL,NULL,NULL,Sheridan,MT,American White Pelican,NULL,012502234,NULL,,1962,NULL,NULL,NULL,NULL,NULL,Sheridan,MT,American White Pelican,NULL,012502235,NULL,,1963,NULL,NULL,NULL,NULL,NULL,Sheridan,MT,American White Pelican,NULL,012502236,NULL,,1964,NULL,NULL,NULL,NULL,NULL,Sheridan,MT,American White Pelican,NULL,012502237,NULL,,1966,NULL,NULL,NULL,NULL,NULL,Sheridan,MT,American White Pelican,NULL,012502238,NULL,,1967,NULL,NULL,NULL,NULL,NULL,Sheridan,MT,American White Pelican,NULL,012502239,NULL,,1968,NULL,NULL,NULL,NULL,NULL,Sheridan,MT,American White Pelican,NULL,012502240,NULL,,1969,NULL,NULL,NULL,NULL,NULL,Sheridan,MT,American White Pelican,NULL,012502241,NULL,,1970,NULL,NULL,NULL,NULL,NULL,Sheridan,MT,American White Pelican,NULL,012502242,NULL,,1971,NULL,NULL,NULL,NULL,NULL,Sheridan,MT,American White Pelican,NULL,012502243,NULL,,1972,NULL,NULL,NULL,NULL,NULL,Sheridan,MT,American White Pelican,NULL,012502244,NULL,,1975,NULL,NULL,NULL,NULL,NULL,Sheridan,MT,American White Pelican,NULL,012502245,NULL,,1976,NULL,NULL,NULL,NULL,NULL,Sheridan,MT,American White Pelican,NULL,012502246,NULL,,1979,NULL,NULL,NULL,NULL,NULL,Sheridan,MT,American White Pelican,NULL,012502247,NULL,,1981,NULL,NULL,NULL,NULL,NULL,Sheridan,MT,American White Pelican,NULL,012502248,NULL,,1982,NULL,NULL,NULL,NULL,NULL,Sheridan,MT,American White Pelican,NULL,012502249,NULL,,1983,NULL,NULL,NULL,NULL,NULL,Sheridan,MT,American White Pelican,NULL,012502250,NULL,,1984,NULL,NULL,NULL,NULL,NULL,Sheridan,MT,American White Pelican,NULL,012502251,NULL,,1985,NULL,NULL,NULL,NULL,NULL,Sheridan,MT,American White Pelican,NULL,012502252,NULL,,1986,NULL,NULL,NULL,NULL,NULL,Sheridan,MT,American White Pelican,NULL,012502253,NULL,,1987,NULL,NULL,NULL,NULL,NULL,Sheridan,MT,American White Pelican,NULL,012502254,NULL,,1988,NULL,NULL,NULL,NULL,NULL,Sheridan,MT,American White Pelican,NULL,012502255,NULL,,1989,NULL,NULL,NULL,NULL,NULL,Sheridan,MT,American White Pelican,NULL,012502256,NULL,,1990,NULL,NULL,NULL,NULL,NULL,Sheridan,MT,American White Pelican,NULL,012501129,4/27/2010,00:00.0,2010,4,27,Cagle,NULL,NULL,Navajo,AZ,Double-crested Cormorant,NULL,012001130,5/13/2011,00:00.0,2011,5,13,Cagle,NULL,NULL,Navajo,AZ,Double-crested Cormorant,NULL,012001131,1/25/2011,00:00.0,2011,1,25,West,NULL,NULL,Mohave,AZ,Double-crested Cormorant,NULL,012001132,2/3/2011,00:00.0,2011,2,3,West,NULL,NULL,Mohave,AZ,Double-crested Cormorant,NULL,012001133,4/16/2011,00:00.0,2011,4,16,West,NULL,NULL,Mohave,AZ,Double-crested Cormorant,NULL,012001134,5/10/2011,00:00.0,2011,5,10,Allen,NULL,NULL,Mohave,AZ,Great Blue Heron,NULL,019401135,5/9/2009,00:00.0,2009,5,9,Piest,NULL,NULL,Yuma,AZ,Great Blue Heron,NULL,019401136,5/8/2010,00:00.0,2010,5,8,Piest,NULL,NULL,Yuma,AZ,Great Blue Heron,NULL,019401137,5/29/2009,00:00.0,2009,5,29,Holm et al.,NULL,NULL,Coconino,AZ,Great Blue Heron,NULL,019401138,6/2/2010,00:00.0,2010,6,2,Holm,NULL,NULL,Coconino,AZ,Great Blue Heron,NULL,019401139,6/15/2011,00:00.0,2011,6,15,Holm/Price,NULL,NULL,Coconino,AZ,Great Blue Heron,NULL,019401140,4/14/2009,00:00.0,2009,4,14,Corman,NULL,NULL,Yavapai,AZ,Double-crested Cormorant,NULL,012001141,4/14/2009,00:00.0,2009,4,14,Corman,NULL,NULL,Yavapai,AZ,Great Blue Heron,NULL,019401142,2/15/2011,00:00.0,2011,2,15,Tomoff,NULL,NULL,Yavapai,AZ,Double-crested Cormorant,NULL,012001143,3/4/2011,00:00.0,2011,3,4,Tomoff,NULL,NULL,Yavapai,AZ,Double-crested Cormorant,NULL,012001144,3/4/2011,00:00.0,2011,3,4,Tomoff,NULL,NULL,Yavapai,AZ,Great Blue Heron,NULL,019401145,4/9/2011,00:00.0,2011,4,9,Tomoff,NULL,NULL,Yavapai,AZ,Double-crested Cormorant,NULL,012001146,4/9/2011,00:00.0,2011,4,9,Tomoff,NULL,NULL,Yavapai,AZ,Great Blue Heron,NULL,019401147,4/15/2011,00:00.0,2011,4,15,Tomoff,NULL,NULL,Yavapai,AZ,Double-crested Cormorant,NULL,012001148,4/15/2011,00:00.0,2011,4,15,Tomoff,NULL,NULL,Yavapai,AZ,Great Blue Heron,NULL,019401149,7/14/2010,00:00.0,2010,7,14,Helgren,NULL,NULL,Coconino,AZ,Great Blue Heron,NULL,019401150,7/27/2010,00:00.0,2010,7,27,Helgren,NULL,NULL,Coconino,AZ,Great Blue Heron,NULL,019401151,6/16/2011,00:00.0,2011,6,16,Willard,NULL,NULL,Coconino,AZ,Great Blue Heron,NULL,019401152,5/4/2006,00:00.0,2006,5,4,Corman,NULL,NULL,LaPaz,AZ,Great Blue Heron,NULL,019401153,12/1/2008,00:00.0,2008,12,1,Barnes,NULL,NULL,Mohave,AZ,Double-crested Cormorant,NULL,012001154,1/25/2008,00:00.0,2008,1,25,Barnes,NULL,NULL,Mohave,AZ,Double-crested Cormorant,NULL,012001155,6/3/2008,00:00.0,2008,6,3,Barnes,NULL,NULL,Mohave,AZ,Double-crested Cormorant,NULL,012001156,4/21/2008,00:00.0,2008,4,21,Kaiser,NULL,NULL,Maricopa,AZ,Great Blue Heron,NULL,019401157,5/21/2008,00:00.0,2008,5,21,McCarty,NULL,NULL,Maricopa,AZ,Great Blue Heron,NULL,019401158,5/16/1997,00:00.0,1997,5,16,Piest,NULL,NULL,Yuma,AZ,Great Blue Heron,NULL,019401159,5/16/1997,00:00.0,1997,5,16,Piest,NULL,NULL,Yuma,AZ,Great Egret,NULL,019601160,2/29/2004,00:00.0,2004,2,29,Corman/Edwards,NULL,NULL,Maricopa,AZ,Neotropic Cormorant,NULL,012101161,3/29/2007,00:00.0,2007,3,29,O'Callaghan,NULL,NULL,Pima,AZ,Great Blue Heron,NULL,019401162,4/4/2008,00:00.0,2008,4,4,Corman,NULL,NULL,Maricopa,AZ,Great Blue Heron,NULL,019401163,4/28/2008,00:00.0,2008,4,28,Lehman,NULL,NULL,LaPaz,AZ,Cattle Egret,NULL,020011164,7/12/2008,00:00.0,2008,7,12,Lehman,NULL,NULL,La Paz,AZ,Cattle Egret,NULL,020011165,4/28/2008,00:00.0,2008,4,28,Lehman,NULL,NULL,LaPaz,AZ,Snowy Egret,NULL,019701166,4/28/2008,00:00.0,2008,4,28,Lehman,NULL,NULL,LaPaz,AZ,White-faced Ibis,NULL,018701167,5/17/2008,00:00.0,2008,5,17,Lehman,NULL,NULL,LaPaz,AZ,Great Egret,NULL,019601168,7/12/2008,00:00.0,2008,7,12,Lehman,NULL,NULL,La Paz,AZ,White-faced Ibis,NULL,018701169,6/22/1999,00:00.0,1999,6,22,Piest,NULL,NULL,Yuma,AZ,Cattle Egret,NULL,020011170,6/22/1999,00:00.0,1999,6,22,Piest,NULL,NULL,Yuma,AZ,Great Blue Heron,NULL,019401171,6/22/1999,00:00.0,1999,6,22,Piest,NULL,NULL,Yuma,AZ,Great Egret,NULL,019601172,6/22/1999,00:00.0,1999,6,22,Piest,NULL,NULL,Yuma,AZ,Snowy Egret,NULL,019701173,6/19/1996,00:00.0,1996,6,19,Piest,NULL,NULL,LaPaz,AZ,Great Egret,NULL,019601174,6/19/1996,00:00.0,1996,6,19,Piest,NULL,NULL,LaPaz,AZ,Great Egret,NULL,019601175,6/8/1996,00:00.0,1996,6,8,Piest,NULL,NULL,Yuma,AZ,Great Blue Heron,NULL,019401176,4/7/2006,00:00.0,2006,4,7,Corman,NULL,NULL,Maricopa,AZ,Great Blue Heron,NULL,019401177,3/22/2007,00:00.0,2007,3,22,Corman,NULL,NULL,Maricopa,AZ,Great Blue Heron,NULL,019401178,4/4/2008,00:00.0,2008,4,4,Corman,NULL,NULL,Maricopa,AZ,Great Blue Heron,NULL,019401179,3/15/2007,00:00.0,2007,3,15,Driscoll,NULL,NULL,Maricopa,AZ,Great Blue Heron,NULL,019401180,4/7/2006,00:00.0,2006,4,7,Corman,NULL,NULL,Maricopa,AZ,Great Blue Heron,NULL,019401181,3/22/2007,00:00.0,2007,3,22,Corman,NULL,NULL,Maricopa,AZ,Great Blue Heron,NULL,019401182,4/4/2008,00:00.0,2008,4,4,Corman,NULL,NULL,Maricopa,AZ,Great Blue Heron,NULL,019401183,2/29/2008,00:00.0,2008,2,29,Paintner/Paintner,NULL,NULL,LaPaz,AZ,Great Blue Heron,NULL,019401184,3/12/2008,00:00.0,2008,3,12,Paintner/Paintner,NULL,NULL,La Paz,AZ,Great Blue Heron,NULL,019401185,3/24/2008,00:00.0,2008,3,24,Paintner/Paintner,NULL,NULL,La Paz,AZ,Great Blue Heron,NULL,019401186,6/9/1996,00:00.0,1996,6,9,Piest,NULL,NULL,Yuma,AZ,Black-crowned Night-Heron,NULL,020201187,6/12/1997,00:00.0,1997,6,12,Piest,NULL,NULL,Yuma,AZ,Black-crowned Night-Heron,NULL,020201188,4/8/1996,00:00.0,1996,4,8,Piest,NULL,NULL,Yuma,AZ,Black-crowned Night-Heron,NULL,020201189,6/9/1996,00:00.0,1996,6,9,Piest,NULL,NULL,Yuma,AZ,Cattle Egret,NULL,020011190,6/12/1997,00:00.0,1997,6,12,Piest,NULL,NULL,Yuma,AZ,Cattle Egret,NULL,020011191,4/8/1996,00:00.0,1996,4,8,Piest,NULL,NULL,Yuma,AZ,Cattle Egret,NULL,020011192,6/9/1996,00:00.0,1996,6,9,Piest,NULL,NULL,Yuma,AZ,Great Egret,NULL,019601193,6/9/1996,00:00.0,1996,6,9,Piest,NULL,NULL,Yuma,AZ,Snowy Egret,NULL,019701194,6/12/1997,00:00.0,1997,6,12,Piest,NULL,NULL,Yuma,AZ,Snowy Egret,NULL,019701195,4/8/1996,00:00.0,1996,4,8,Piest,NULL,NULL,Yuma,AZ,Snowy Egret,NULL,019701196,4/5/2007,00:00.0,2007,4,5,Maikis/Janssen,NULL,NULL,Yavapai,AZ,Black-crowned Night-Heron,NULL,020201197,4/5/2007,00:00.0,2007,4,5,Maikis/Janssen,NULL,NULL,Yavapai,AZ,Double-crested Cormorant,NULL,012001198,4/2/2008,00:00.0,2008,4,2,Maikis/Janssen,NULL,NULL,Yavapai,AZ,Double-crested Cormorant,NULL,012001199,3/17/2008,00:00.0,2008,3,17,Maikis/Janssen,NULL,NULL,Yavapai,AZ,Double-crested Cormorant,NULL,012001200,3/17/2008,00:00.0,2008,3,17,Maikis/Janssen,NULL,NULL,Yavapai,AZ,Great Blue Heron,NULL,019401201,4/2/2008,00:00.0,2008,4,2,Maikis/Janssen,NULL,NULL,Yavapai,AZ,Great Blue Heron,NULL,019401202,4/5/2007,00:00.0,2007,4,5,Janssen,NULL,NULL,Yavapai,AZ,Great Blue Heron,NULL,019401203,4/2/2008,00:00.0,2008,4,2,Maikis/Janssen,NULL,NULL,Yavapai,AZ,Great Blue Heron,NULL,019401204,3/17/2008,00:00.0,2008,3,17,Maikis/Janssen,NULL,NULL,Yavapai,AZ,Great Blue Heron,NULL,019401205,3/25/2008,00:00.0,2008,3,25,Brewster,NULL,NULL,Apache,AZ,Great Blue Heron,NULL,019401206,4/14/2008,00:00.0,2008,4,14,Peddie,NULL,NULL,Apache,AZ,Great Blue Heron,NULL,019401207,5/28/2008,00:00.0,2008,5,28,White Trifaro/Morris,NULL,NULL,Apache,AZ,Great Blue Heron,NULL,019401208,5/20/2008,00:00.0,2008,5,20,Brewster,NULL,NULL,Apache,AZ,Double-crested Cormorant,NULL,012001209,4/8/1996,00:00.0,1996,4,8,Piest,NULL,NULL,Yuma,AZ,Great Blue Heron,NULL,019401210,4/7/1997,00:00.0,1997,4,7,Piest,NULL,NULL,Yuma,AZ,Great Blue Heron,NULL,019401211,6/9/2000,00:00.0,2000,6,9,Piest,NULL,NULL,Yuma,AZ,Great Blue Heron,NULL,019401212,6/15/1996,00:00.0,1996,6,15,Piest,NULL,NULL,Yuma,AZ,Great Blue Heron,NULL,019401213,4/8/1996,00:00.0,1996,4,8,Piest,NULL,NULL,Yuma,AZ,Great Egret,NULL,019601214,4/7/1997,00:00.0,1997,4,7,Piest,NULL,NULL,Yuma,AZ,Great Egret,NULL,019601215,6/9/2000,00:00.0,2000,6,9,Piest,NULL,NULL,Yuma,AZ,Great Egret,NULL,019601216,6/15/1996,00:00.0,1996,6,15,Piest,NULL,NULL,Yuma,AZ,Great Egret,NULL,019601217,6/18/1996,00:00.0,1996,6,18,Piest,NULL,NULL,Maricopa,AZ,Cattle Egret,NULL,020011218,6/18/1996,00:00.0,1996,6,18,Piest,NULL,NULL,Maricopa,AZ,Double-crested Cormorant,NULL,012001219,6/18/1996,00:00.0,1996,6,18,Piest,NULL,NULL,Maricopa,AZ,Great Blue Heron,NULL,019401220,6/18/1996,00:00.0,1996,6,18,Piest,NULL,NULL,Maricopa,AZ,Great Egret,NULL,019601221,6/14/1996,00:00.0,1996,6,14,Piest,NULL,NULL,Maricopa,AZ,Great Egret,NULL,019601222,6/14/1996,00:00.0,1996,6,14,Piest,NULL,NULL,Maricopa,AZ,Snowy Egret,NULL,NULL1223,6/18/1996,00:00.0,1996,6,18,Piest,NULL,NULL,Maricopa,AZ,Snowy Egret,NULL,019701224,7/20/2005,00:00.0,2005,7,20,Piest,NULL,NULL,Maricopa,AZ,White-faced Ibis,NULL,018701225,6/11/1999,00:00.0,1999,6,11,Piest,NULL,NULL,Maricopa,AZ,Cattle Egret,NULL,020011226,6/11/1999,00:00.0,1999,6,11,Piest,NULL,NULL,Maricopa,AZ,Great Egret,NULL,019601227,6/11/1999,00:00.0,1999,6,11,Piest,NULL,NULL,Maricopa,AZ,Snowy Egret,NULL,019701228,6/1/2008,00:00.0,2008,6,1,Fleming/MacKinnon,NULL,NULL,Santa Cruz,AZ,Great Blue Heron,NULL,019401229,4/29/2007,00:00.0,2007,4,29,Corman,NULL,NULL,Graham,AZ,Great Blue Heron,NULL,019401230,3/2/2008,00:00.0,2008,3,2,Clark,NULL,NULL,Maricopa,AZ,Great Blue Heron,NULL,019401231,3/2/2008,00:00.0,2008,3,2,Clark,NULL,NULL,Maricopa,AZ,Great Blue Heron,NULL,019401232,8/6/2008,00:00.0,2008,8,6,Luedeker,NULL,NULL,Coconino,AZ,Great Blue Heron,NULL,019401233,4/19/2006,00:00.0,2006,4,19,Corman,NULL,NULL,Apache,AZ,Double-crested Cormorant,NULL,012001234,4/19/2006,00:00.0,2006,4,19,Corman,NULL,NULL,Apache,AZ,Great Blue Heron,NULL,019401235,5/5/1999,00:00.0,1999,5,5,Piest,NULL,NULL,Yuma,AZ,Great Blue Heron,NULL,019401236,5/5/1999,00:00.0,1999,5,5,Piest,NULL,NULL,Yuma,AZ,Great Egret,NULL,019601237,6/5/1999,00:00.0,1999,6,5,Piest,NULL,NULL,Yuma,AZ,Great Blue Heron,NULL,019401238,6/5/1999,00:00.0,1999,6,5,Piest,NULL,NULL,Yuma,AZ,Great Egret,NULL,019601239,4/13/2006,00:00.0,2006,4,13,Corman,NULL,NULL,Gila,AZ,Double-crested Cormorant,NULL,012001240,4/13/2006,00:00.0,2006,4,13,Corman,NULL,NULL,Gila,AZ,Great Blue Heron,NULL,019401241,4/17/2007,00:00.0,2007,4,17,Young/Wike,NULL,NULL,Gila,AZ,Great Blue Heron,NULL,019401242,4/17/2007,00:00.0,2007,4,17,Young/Wike,NULL,NULL,Gila,AZ,Snowy Egret,NULL,019701243,4/13/2006,00:00.0,2006,4,13,Corman,NULL,NULL,Gila,AZ,Great Blue Heron,NULL,019401244,3/2/2008,00:00.0,2008,3,2,Kline,NULL,NULL,Gila,AZ,Double-crested Cormorant,NULL,012001245,6/8/1996,00:00.0,1996,6,8,Piest,NULL,NULL,Yuma,AZ,Great Blue Heron,NULL,019401246,6/8/1996,00:00.0,1996,6,8,Piest,NULL,NULL,Yuma,AZ,Great Egret,NULL,019601247,6/8/1996,00:00.0,1996,6,8,Piest,NULL,NULL,Yuma,AZ,Black-crowned Night-Heron,NULL,020201248,6/8/1996,00:00.0,1996,6,8,Piest,NULL,NULL,Yuma,AZ,Snowy Egret,NULL,019701249,6/12/2008,00:00.0,2008,6,12,Huselton,NULL,NULL,Maricopa,AZ,Great Blue Heron,NULL,019401250,3/26/2007,00:00.0,2007,3,26,Jacobsen,NULL,NULL,Yuma,AZ,Great Blue Heron,NULL,019401251,5/16/2008,00:00.0,2008,5,16,Cagle,NULL,NULL,Navajo,AZ,Double-crested Cormorant,NULL,012001252,4/2/2007,00:00.0,2007,4,2,Jacobsen,NULL,NULL,Yuma,AZ,Great Blue Heron,NULL,019401253,5/15/1997,00:00.0,1997,5,15,Piest,NULL,NULL,Yuma,AZ,Great Blue Heron,NULL,019401254,6/5/1999,00:00.0,1999,6,5,Piest,NULL,NULL,Yuma,AZ,Great Blue Heron,NULL,019401255,5/6/2000,00:00.0,2000,5,6,Piest,NULL,NULL,Yuma,AZ,Great Blue Heron,NULL,019401256,6/5/1999,00:00.0,1999,6,5,Piest,NULL,NULL,Yuma,AZ,Great Egret,NULL,019601257,5/6/2000,00:00.0,2000,5,6,Piest,NULL,NULL,Yuma,AZ,Great Egret,NULL,019601258,7/9/2007,00:00.0,2007,7,9,DeRosier,NULL,NULL,Coconino,AZ,Great Blue Heron,NULL,019401259,4/23/2008,00:00.0,2008,4,23,Divine,NULL,NULL,Coconino,AZ,Great Blue Heron,NULL,019401260,4/8/1996,00:00.0,1996,4,8,Piest,NULL,NULL,Yuma,AZ,Great Blue Heron,NULL,019401261,5/13/1996,00:00.0,1996,5,13,Piest,NULL,NULL,Yuma,AZ,Great Blue Heron,NULL,019401262,4/8/1996,00:00.0,1996,4,8,Piest,NULL,NULL,Yuma,AZ,Great Egret,NULL,019601263,4/8/1996,00:00.0,1996,4,8,Piest,NULL,NULL,Yuma,AZ,Great Blue Heron,NULL,019401264,5/3/1996,00:00.0,1996,5,3,Piest,NULL,NULL,Yuma,AZ,Great Blue Heron,NULL,019401265,5/20/1999,00:00.0,1999,5,20,Piest,NULL,NULL,Yuma,AZ,Great Blue Heron,NULL,019401266,6/22/1999,00:00.0,1999,6,22,Piest,NULL,NULL,Yuma,AZ,Great Blue Heron,NULL,019401267,5/31/2000,00:00.0,2000,5,31,Piest,NULL,NULL,Yuma,AZ,Great Blue Heron,NULL,019401268,5/20/1999,00:00.0,1999,5,20,Piest,NULL,NULL,Yuma,AZ,Great Egret,NULL,019601269,6/22/1999,00:00.0,1999,6,22,Piest,NULL,NULL,Yuma,AZ,Great Egret,NULL,019601270,5/31/2000,00:00.0,2000,5,31,Piest,NULL,NULL,Yuma,AZ,Great Egret,NULL,019601271,5/20/1999,00:00.0,1999,5,20,Piest,NULL,NULL,Yuma,AZ,Snowy Egret,NULL,019701272,7/1/2010,00:00.0,2010,7,1,Ehlers/Runco,NULL,NULL,Bingham,ID,Western Grebe,NULL,000101273,7/1/2010,00:00.0,2010,7,1,Ehlers/Runco,NULL,NULL,Bingham,ID,Clark's Grebe,NULL,000111274,6/1/2009,00:00.0,2009,6,1,Moulton et al.,NULL,NULL,Bingham,ID,Ring-billed Gull,NULL,005401275,6/1/2009,00:00.0,2009,6,1,Moulton et al.,NULL,NULL,Bingham,ID,California Gull,NULL,005301276,7/1/2010,00:00.0,2010,7,1,Ehlers/Runco,NULL,NULL,Power,ID,Western Grebe,NULL,000101277,6/25/2009,00:00.0,2009,6,25,Wackenhut/Anderson,NULL,NULL,Bannock,ID,Snowy Egret,NULL,019701278,6/25/2009,00:00.0,2009,6,25,Wackenhut/Anderson,NULL,NULL,Bannock,ID,Great Egret,NULL,019601279,6/25/2009,00:00.0,2009,6,25,Wackenhut/Anderson,NULL,NULL,Bannock,ID,Great Blue Heron,NULL,019401280,6/25/2009,00:00.0,2009,6,25,Wackenhut/Anderson,NULL,NULL,Bannock,ID,Double-crested Cormorant,NULL,012001281,4/26/2009,00:00.0,2009,4,26,Cavallaro,NULL,NULL,Madison,ID,Great Blue Heron,NULL,019401282,5/8/2009,00:00.0,2009,5,8,Wackenhut/Anderson,NULL,NULL,Bear Lake,ID,Great Blue Heron,NULL,019401283,6/9/2010,00:00.0,2010,6,9,Moulton et al.,NULL,NULL,Bear Lake,ID,White-faced Ibis,NULL,018701284,6/9/2010,00:00.0,2010,6,9,Moulton et al.,NULL,NULL,Bear Lake,ID,Franklin's Gull,NULL,005901285,6/1/2009,00:00.0,2009,6,1,Moulton et al.,NULL,NULL,Bear Lake,ID,Ring-billed Gull,NULL,005401286,6/1/2009,00:00.0,2009,6,1,Moulton et al.,NULL,NULL,Bear Lake,ID,Double-crested Cormorant,NULL,012001287,6/1/2009,00:00.0,2009,6,1,Moulton et al.,NULL,NULL,Bear Lake,ID,California Gull,NULL,005301288,5/17/2009,00:00.0,2009,5,17,Swift,NULL,NULL,Benewah,ID,Great Blue Heron,NULL,019401289,6/2/2009,00:00.0,2009,6,2,Moulton et al.,NULL,NULL,Caribou,ID,Snowy Egret,NULL,019701290,6/2/2009,00:00.0,2009,6,2,Moulton et al.,NULL,NULL,Caribou,ID,Ring-billed Gull,NULL,005401291,6/2/2009,00:00.0,2009,6,2,Moulton et al.,NULL,NULL,Caribou,ID,Great Blue Heron,NULL,019401292,6/2/2009,00:00.0,2009,6,2,Moulton et al.,NULL,NULL,Caribou,ID,Double-crested Cormorant,NULL,012001293,6/2/2009,00:00.0,2009,6,2,Moulton et al.,NULL,NULL,Caribou,ID,Caspian Tern,NULL,006401294,6/2/2009,00:00.0,2009,6,2,Moulton et al.,NULL,NULL,Caribou,ID,California Gull,NULL,005301295,6/2/2009,00:00.0,2009,6,2,Moulton et al.,NULL,NULL,Caribou,ID,American White Pelican,NULL,012501296,6/3/2010,00:00.0,2010,6,3,Wackenhut/Boudreau,NULL,NULL,Caribou,ID,Double-crested Cormorant,NULL,012001297,6/3/2010,00:00.0,2010,6,3,Wackenhut/Boudreau,NULL,NULL,Caribou,ID,American White Pelican,NULL,012501298,6/1/2011,00:00.0,2011,6,1,Wackenhut,NULL,NULL,Caribou,ID,Double-crested Cormorant,NULL,012001299,6/1/2011,00:00.0,2011,6,1,Wackenhut,NULL,NULL,Caribou,ID,American White Pelican,NULL,012501300,6/2/2009,00:00.0,2009,6,2,Wackenhut et al.,NULL,NULL,Caribou,ID,Snowy Egret,NULL,019701301,6/2/2009,00:00.0,2009,6,2,Wackenhut et al.,NULL,NULL,Caribou,ID,American White Pelican,NULL,012501302,6/3/2010,00:00.0,2010,6,3,Moulton et al.,NULL,NULL,Caribou,ID,American White Pelican,NULL,012501303,6/1/2011,00:00.0,2011,6,1,Wackenhut,NULL,NULL,Caribou,ID,American White Pelican,NULL,012501304,4/7/2009,00:00.0,2009,4,7,McCarthy/Malhas,NULL,NULL,Canyon,ID,Great Blue Heron,NULL,019401305,4/7/2009,00:00.0,2009,4,7,McCarthy/Malhas,NULL,NULL,Canyon,ID,Great Blue Heron,NULL,019401306,4/7/2009,00:00.0,2009,4,7,McCarthy/Malhas,NULL,NULL,Canyon,ID,Double-crested Cormorant,NULL,012001307,4/7/2009,00:00.0,2009,4,7,McCarthy/Malhas,NULL,NULL,Canyon,ID,Great Blue Heron,NULL,019401308,4/7/2009,00:00.0,2009,4,7,McCarthy/Malhas,NULL,NULL,Canyon,ID,Great Blue Heron,NULL,019401309,4/7/2009,00:00.0,2009,4,7,McCarthy/Malhas,NULL,NULL,Canyon,ID,Great Blue Heron,NULL,019401310,4/7/2009,00:00.0,2009,4,7,McCarthy/Malhas,NULL,NULL,Canyon,ID,Double-crested Cormorant,NULL,012001311,4/23/2009,00:00.0,2009,4,23,Moulton,NULL,NULL,Ada,ID,Great Blue Heron,NULL,019401312,7/13/2010,00:00.0,2010,7,13,Ehlers/Runco,NULL,NULL,Owyhee,ID,Western Grebe,NULL,000101313,7/13/2010,00:00.0,2010,7,13,Ehlers/Runco,NULL,NULL,Owyhee,ID,Clark's Grebe,NULL,000111314,6/21/2010,00:00.0,2010,6,21,Moulton,NULL,NULL,Elmore,ID,Great Blue Heron,NULL,019401315,6/21/2010,00:00.0,2010,6,21,Moulton,NULL,NULL,Elmore,ID,Great Blue Heron,NULL,019401316,5/13/2009,00:00.0,2009,5,13,Cavallaro,NULL,NULL,Fremont,ID,Great Blue Heron,NULL,01940189,NULL,,NULL,NULL,NULL,Teske,NULL,NULL,Elko,NV,NULL,"SurveyDate:1983-? ; Multiple specie: Great Egret, Snowy Egret, Cattle Egret, and Black-crowned Night Heron",NULL190,NULL,,NULL,NULL,NULL,Rawlings,NULL,NULL,Elko,NV,White-faced Ibis,SurveyDate:1983-?,01870191,NULL,,1997,NULL,NULL,Bradley,NULL,NULL,Humboldt,NV,NULL,"Great Egret, Snowy Egret, and Cattle Egret",NULL192,NULL,,2005,NULL,NULL,Bradley,NULL,NULL,Elko,NV,Double-crested Cormorant,NULL,01200193,NULL,,NULL,NULL,NULL,Bradley,NULL,NULL,Elko,NV,White-faced Ibis,NULL,01870194,NULL,,NULL,NULL,NULL,Bradley,NULL,NULL,Elko,NV,White-faced Ibis,SurveyDate:2001-6/5/2008,01870195,NULL,,NULL,NULL,NULL,Bradley,NULL,NULL,Elko,NV,Black-crowned Night-Heron,SurveyDate:2005-?,02020196,NULL,,2005,NULL,NULL,Bradley,NULL,NULL,Eureka,NV,White-faced Ibis,SurveyDate:2005-?,01870197,NULL,,NULL,NULL,NULL,Bauman,NULL,NULL,NULL,NV,White-faced Ibis,This mapped outside of NV (in Oregon,01870198,NULL,,2005,NULL,NULL,Bauman,NULL,NULL,Humboldt,NV,Great Blue Heron,SurveyDate:5/27/2010,01940199,NULL,,2005,NULL,NULL,Bauman,NULL,NULL,Humboldt,NV,Great Blue Heron,NULL,01940200,NULL,,2005,NULL,NULL,Bauman,NULL,NULL,Lander,NV,Black-crowned Night-Heron,NULL,02020201,NULL,,NULL,NULL,NULL,Ruby,NULL,NULL,Elko,NV,White-faced Ibis,SurveyDate:1979-?,01870202,NULL,,1979,NULL,NULL,Ruby,NULL,NULL,White Pine,NV,White-faced Ibis,NULL,01870203,NULL,,NULL,NULL,NULL,Rawlings,NULL,NULL,Elko,NV,Great Blue Heron,SurveyDate:1983-?,01940204,NULL,,NULL,NULL,NULL,Rawlings,NULL,NULL,Elko,NV,NULL,"SurveyDate:1982-? ; Multiple specie: Great Egret, Snowy Egret, Cattle Egret, and Black-crowned Night Heron",NULL205,NULL,,NULL,NULL,NULL,Bradley,NULL,NULL,Elko,NV,Great Blue Heron,SurveyDate:1983-5/24/2010,01940206,NULL,,NULL,NULL,NULL,Teske,NULL,NULL,Elko,NV,Black-crowned Night-Heron,SurveyDate:1982-?,02020207,NULL,,2009,NULL,NULL,Jeffers,NULL,NULL,Churchill,NV,NULL,"Mutilple species: Double-crested Cormorant, Great Egret, Great Blue Heron, Snowy Egret, and Cattle Egret",NULL208,NULL,,NULL,NULL,NULL,Bradley,NULL,NULL,Elko,NV,Great Blue Heron,SurveyDate:1977-2009,01940209,NULL,,NULL,NULL,NULL,Bradley,NULL,NULL,Elko,NV,Great Blue Heron,SurveyDate:1983-2009,01940210,NULL,,1983,NULL,NULL,Rawlings,NULL,NULL,White Pine,NV,Great Blue Heron,NULL,01940211,NULL,,1983,NULL,NULL,Rawlings,NULL,NULL,White Pine,NV,Black-crowned Night-Heron,NULL,02020212,NULL,,1983,NULL,NULL,Rawlings,NULL,NULL,White Pine,NV,Black-crowned Night-Heron,NULL,02020213,NULL,,1990,NULL,NULL,Bradley,NULL,NULL,White Pine,NV,White-faced Ibis,NULL,01870214,NULL,,NULL,NULL,NULL,Jeffers,NULL,NULL,Churchill,NV,White-faced Ibis,SurveyDate:1980-?,01870215,NULL,,NULL,NULL,NULL,Boyd,NULL,NULL,Elko,NV,Black Tern,SurveyDate:2001-2009,00770216,NULL,,1983,NULL,NULL,Teske,NULL,NULL,Eureka,NV,NULL,"Multiple specie: Great Egret, Snowy Egret, Cattle Egret, and Black-crowned Night Heron",NULL217,6/29/2010,00:00.0,2010,6,29,Beason,NULL,NULL,Conejos,CO,White-faced Ibis,NULL,01870218,5/23/2011,00:00.0,2011,5,23,Rawinski,NULL,NULL,Alamosa,CO,White-faced Ibis,NULL,01870219,5/23/2011,00:00.0,2011,5,23,Rawinski,NULL,NULL,Alamosa,CO,Western Grebe,NULL,00010220,4/23/2009,00:00.0,2009,4,23,Nelson,NULL,NULL,Kiowa,CO,Great Blue Heron,NULL,01940221,4/5/2010,00:00.0,2010,4,5,Nelson,NULL,NULL,Kiowa,CO,Great Blue Heron,NULL,01940222,5/17/2011,00:00.0,2011,5,17,Rawinski,NULL,NULL,Alamosa,CO,White-faced Ibis,NULL,01870223,7/9/2009,00:00.0,2009,7,9,Wilson,NULL,NULL,Kiowa,CO,White-faced Ibis,NULL,01870224,6/21/2010,00:00.0,2010,6,21,Hundertmark,NULL,NULL,Park,CO,American White Pelican,NULL,01250225,6/21/2010,00:00.0,2010,6,21,Hundertmark,NULL,NULL,Park,CO,Double-crested Cormorant,NULL,01200226,8/1/2009,00:00.0,2009,8,1,Hundertmark,NULL,NULL,Jackson,CO,Black-crowned Night-Heron,NULL,02020227,6/12/2010,00:00.0,2010,6,12,Hundertmark,NULL,NULL,Jackson,CO,Eared Grebe,NULL,00040228,8/7/2010,00:00.0,2010,8,7,Hundertmark,NULL,NULL,Jackson,CO,Black-crowned Night-Heron,NULL,02020229,NULL,,2010,NULL,NULL,Johnson,NULL,NULL,Jackson,CO,Eared Grebe,NULL,00040230,7/15/2009,00:00.0,2009,7,15,Johnson,NULL,NULL,Jackson,CO,Eared Grebe,NULL,00040231,7/15/2009,00:00.0,2009,7,15,Johnson,NULL,NULL,Jackson,CO,Eared Grebe,NULL,00040232,NULL,,2010,NULL,NULL,Johnson,NULL,NULL,Jackson,CO,Black-crowned Night-Heron,NULL,02020233,7/13/2009,00:00.0,2009,7,13,Johnson,NULL,NULL,Jackson,CO,Black-crowned Night-Heron,NULL,02020234,7/15/2009,00:00.0,2009,7,15,Johnson,NULL,NULL,Jackson,CO,Eared Grebe,NULL,00040235,NULL,,2010,NULL,NULL,Johnson,NULL,NULL,Jackson,CO,Black-crowned Night-Heron,NULL,02020236,7/13/2009,00:00.0,2009,7,13,Johnson,NULL,NULL,Jackson,CO,Black-crowned Night-Heron,NULL,02020237,4/25/2009,00:00.0,2009,4,25,Gamble,NULL,NULL,Adams,CO,Double-crested Cormorant,NULL,01200238,4/25/2009,00:00.0,2009,4,25,Gamble,NULL,NULL,Adams,CO,Great Blue Heron,NULL,01940239,4/25/2009,00:00.0,2009,4,25,Gamble,NULL,NULL,Adams,CO,Black-crowned Night-Heron,NULL,02020240,4/8/2010,00:00.0,2010,4,8,Gamble,NULL,NULL,Adams,CO,Double-crested Cormorant,NULL,01200241,4/8/2010,00:00.0,2010,4,8,Gamble,NULL,NULL,Adams,CO,Great Blue Heron,NULL,01940242,7/30/2010,00:00.0,2010,7,30,Hatch/Hatch,NULL,NULL,Adams,CO,Snowy Egret,NULL,01970243,9/6/2009,00:00.0,2009,9,6,Beltz,NULL,NULL,Adams,CO,Western Grebe,NULL,00010244,4/27/2010,00:00.0,2010,4,27,Takamine,NULL,NULL,Weld,CO,Great Blue Heron,NULL,01940245,7/9/2010,00:00.0,2010,7,9,Goff,NULL,NULL,El Paso,CO,Western Grebe,NULL,00010246,6/9/2011,00:00.0,2011,6,9,Rawinski,NULL,NULL,Conejos,CO,Eared Grebe,NULL,00040247,4/24/2009,00:00.0,2009,4,24,Kogler,NULL,NULL,Larimer,CO,Great Blue Heron,NULL,01940248,3/28/2010,00:00.0,2010,3,28,Huwer,NULL,NULL,Larimer,CO,Great Blue Heron,NULL,01940249,4/18/2009,00:00.0,2009,4,18,Pals,NULL,NULL,El Paso,CO,Great Blue Heron,NULL,01940250,5/18/2010,00:00.0,2010,5,18,Pals,NULL,NULL,El Paso,CO,Great Blue Heron,NULL,01940251,5/19/2011,00:00.0,2011,5,19,Rawinski,NULL,NULL,Alamosa,CO,White-faced Ibis,NULL,01870252,6/5/2011,00:00.0,2011,6,5,Rawinski,NULL,NULL,Alamosa,CO,White-faced Ibis,NULL,01870253,6/5/2011,00:00.0,2011,6,5,Rawinski,NULL,NULL,Alamosa,CO,Black-crowned Night-Heron,NULL,02020254,NULL,,2010,NULL,NULL,Cowardin,NULL,NULL,Summit,CO,Great Blue Heron,NULL,01940255,4/24/2009,00:00.0,2009,4,24,Kogler,NULL,NULL,Larimer,CO,Great Blue Heron,NULL,01940256,4/21/2010,00:00.0,2010,4,21,Huwer,NULL,NULL,Larimer,CO,Great Blue Heron,NULL,01940257,7/19/2009,00:00.0,2009,7,19,Sanders,NULL,NULL,Yuma,CO,Black Tern,NULL,00770258,4/26/2010,00:00.0,2010,4,26,George,NULL,NULL,Boulder,CO,Great Blue Heron,NULL,01940259,4/26/2010,00:00.0,2010,4,26,George,NULL,NULL,Boulder,CO,Great Blue Heron,NULL,01940260,4/24/2009,00:00.0,2009,4,24,George,NULL,NULL,Weld,CO,Great Blue Heron,NULL,01940261,4/26/2010,00:00.0,2010,4,26,George,NULL,NULL,Weld,CO,Great Blue Heron,NULL,01940262,5/21/2009,00:00.0,2009,5,21,Beason,NULL,NULL,Delta,CO,Great Blue Heron,NULL,01940263,4/5/2010,00:00.0,2010,4,5,Riggle,NULL,NULL,Eagle,CO,Great Blue Heron,NULL,01940264,6/9/2009,00:00.0,2009,6,9,Moore,NULL,NULL,Fremont,CO,White-faced Ibis,NULL,01870265,5/1/2009,00:00.0,2009,5,1,Potter,NULL,NULL,Eagle,CO,Great Blue Heron,NULL,01940266,NULL,,2010,NULL,NULL,McGilvray,NULL,NULL,Douglas,CO,Great Blue Heron,NULL,01940267,5/13/2009,00:00.0,2009,5,13,McGilvray,NULL,NULL,Douglas,CO,Great Blue Heron,NULL,01940268,6/17/2009,00:00.0,2009,6,17,Beason,NULL,NULL,Mesa,CO,Eared Grebe,NULL,00040269,6/17/2009,00:00.0,2009,6,17,Beason,NULL,NULL,Mesa,CO,Eared Grebe,NULL,00040270,7/9/2010,00:00.0,2010,7,9,Beason,NULL,NULL,Mesa,CO,White-faced Ibis,NULL,01870271,7/23/2009,00:00.0,2009,7,23,Beltz,NULL,NULL,Arapahoe,CO,White-faced Ibis,NULL,01870272,7/20/2010,00:00.0,2010,7,20,Beltz/eBird,NULL,NULL,Arapahoe,CO,White-faced Ibis,NULL,01870273,4/11/2009,00:00.0,2009,4,11,Owen,NULL,NULL,Montrose,CO,Great Blue Heron,NULL,01940274,8/31/2009,00:00.0,2009,8,31,Ecton,NULL,NULL,Larimer,CO,Black-crowned Night-Heron,NULL,02020275,8/18/2010,00:00.0,2010,8,18,Ecton,NULL,NULL,Larimer,CO,Black-crowned Night-Heron,NULL,02020276,NULL,,2010,NULL,NULL,Cooper,NULL,NULL,Mesa,CO,Great Blue Heron,NULL,01940277,5/9/2009,00:00.0,2009,5,9,Cooper,NULL,NULL,Mesa,CO,Great Blue Heron,NULL,01940278,4/22/2009,00:00.0,2009,4,22,Nelson,NULL,NULL,Kiowa,CO,Great Blue Heron,NULL,01940279,4/6/2010,00:00.0,2010,4,6,Nelson,NULL,NULL,Kiowa,CO,Great Blue Heron,NULL,01940280,4/24/2009,00:00.0,2009,4,24,Beason,NULL,NULL,Delta,CO,Double-crested Cormorant,NULL,01200281,7/9/2010,00:00.0,2010,7,9,Beason,NULL,NULL,Delta,CO,Double-crested Cormorant,NULL,01200282,5/23/2011,00:00.0,2011,5,23,Rawinski,NULL,NULL,Alamosa,CO,White-faced Ibis,NULL,01870283,6/1/2009,00:00.0,2009,6,1,Figueroa,NULL,NULL,Morgan,CO,Great Blue Heron,NULL,01940284,5/17/2009,00:00.0,2009,5,17,Hundertmark,NULL,NULL,Jackson,CO,Western Grebe,NULL,00010285,6/15/2009,00:00.0,2009,6,15,Hundertmark,NULL,NULL,Jackson,CO,Eared Grebe,NULL,00040286,5/10/2010,00:00.0,2010,5,10,Hilkey,NULL,NULL,Rio Blanco,CO,Great Blue Heron,NULL,01940287,5/26/2009,00:00.0,2009,5,26,Luke,NULL,NULL,Moffat,CO,Great Blue Heron,NULL,01940288,6/10/2009,00:00.0,2009,6,10,Beason,NULL,NULL,Delta,CO,Western Grebe,NULL,00010289,6/24/2010,00:00.0,2010,6,24,Beason,NULL,NULL,Delta,CO,Western Grebe,NULL,00010290,6/21/2009,00:00.0,2009,6,21,Beason,NULL,NULL,Gunnison,CO,Great Blue Heron,NULL,01940291,6/4/2010,00:00.0,2010,6,4,Fisher,NULL,NULL,Gunnison,CO,Great Blue Heron,NULL,01940292,5/16/2009,00:00.0,2009,5,16,Hundertmark,NULL,NULL,Jackson,CO,Eared Grebe,NULL,00040293,6/13/2010,00:00.0,2010,6,13,Hundertmark,NULL,NULL,Jackson,CO,Forster's Tern,NULL,00690294,8/1/2009,00:00.0,2009,8,1,Hundertmark,NULL,NULL,Jackson,CO,Western Grebe,NULL,00010295,6/13/2010,00:00.0,2010,6,13,Hundertmark,NULL,NULL,Jackson,CO,Western Grebe,NULL,00010296,5/12/2009,00:00.0,2009,5,12,Parks,NULL,NULL,Denver,CO,Double-crested Cormorant,NULL,01200297,5/12/2009,00:00.0,2009,5,12,Parks,NULL,NULL,Denver,CO,Black-crowned Night-Heron,NULL,02020298,5/12/2009,00:00.0,2009,5,12,Parks,NULL,NULL,Denver,CO,Snowy Egret,NULL,01970299,5/15/2009,00:00.0,2009,5,15,Parks,NULL,NULL,Denver,CO,Black-crowned Night-Heron,NULL,02020300,5/15/2009,00:00.0,2009,5,15,Parks,NULL,NULL,Denver,CO,Snowy Egret,NULL,01970301,5/15/2009,00:00.0,2009,5,15,Parks,NULL,NULL,Denver,CO,Double-crested Cormorant,NULL,01200302,5/27/2009,00:00.0,2009,5,27,Bond,NULL,NULL,La Plata,CO,Great Blue Heron,NULL,01940303,6/23/2010,00:00.0,2010,6,23,Bond,NULL,NULL,La Plata,CO,Great Blue Heron,NULL,01940304,4/19/2009,00:00.0,2009,4,19,Zeman,NULL,NULL,Delta,CO,Great Blue Heron,NULL,01940305,6/21/2010,00:00.0,2010,6,21,Hundertmark,NULL,NULL,Park,CO,California Gull,NULL,00530306,6/21/2010,00:00.0,2010,6,21,Hundertmark,NULL,NULL,Park,CO,Double-crested Cormorant,NULL,01200307,5/18/2010,00:00.0,2010,5,18,Hughes,NULL,NULL,Routt,CO,Great Blue Heron,NULL,01940308,5/9/2009,00:00.0,2009,5,9,Ecton,NULL,NULL,Larimer,CO,Great Blue Heron,NULL,01940309,NULL,,2009,NULL,NULL,Mitchell,NULL,NULL,El Paso,CO,Great Blue Heron,NULL,01940310,4/18/2009,00:00.0,2009,4,18,Pals,NULL,NULL,El Paso,CO,Great Blue Heron,NULL,01940311,5/18/2010,00:00.0,2010,5,18,Pals,NULL,NULL,El Paso,CO,Great Blue Heron,NULL,01940312,NULL,,2010,NULL,NULL,Beason,NULL,NULL,Delta,CO,White-faced Ibis,NULL,01870313,5/1/2009,00:00.0,2009,5,1,Garrison,NULL,NULL,Delta,CO,Double-crested Cormorant,NULL,01200314,5/1/2009,00:00.0,2009,5,1,Garrison,NULL,NULL,Delta,CO,Great Blue Heron,NULL,01940315,6/11/2009,00:00.0,2009,6,11,Beason,NULL,NULL,Delta,CO,Western Grebe,NULL,00010316,6/11/2009,00:00.0,2009,6,11,Beason,NULL,NULL,Delta,CO,White-faced Ibis,NULL,01870317,6/11/2009,00:00.0,2009,6,11,Beason,NULL,NULL,Delta,CO,Clark's Grebe,NULL,00011318,6/11/2009,00:00.0,2009,6,11,Garrison,NULL,NULL,Delta,CO,Clark's Grebe,NULL,00011319,4/24/2010,00:00.0,2010,4,24,Beason,NULL,NULL,Delta,CO,Great Blue Heron,NULL,01940320,4/24/2010,00:00.0,2010,4,24,Beason,NULL,NULL,Delta,CO,Double-crested Cormorant,NULL,01200321,6/21/2010,00:00.0,2010,6,21,Beason,NULL,NULL,Delta,CO,Western Grebe,NULL,00010322,6/21/2010,00:00.0,2010,6,21,Beason,NULL,NULL,Delta,CO,American White Pelican,NULL,01250323,6/21/2010,00:00.0,2010,6,21,Beason,NULL,NULL,Delta,CO,Eared Grebe,NULL,00040324,6/21/2010,00:00.0,2010,6,21,Beason,NULL,NULL,Delta,CO,Clark's Grebe,NULL,00011325,NULL,,2009,NULL,NULL,Dexter,NULL,NULL,Mesa,CO,Great Blue Heron,NULL,01940326,5/15/2009,00:00.0,2009,5,15,Beason,NULL,NULL,Dolores,CO,Eared Grebe,NULL,00040327,5/3/2009,00:00.0,2009,5,3,Lefko,NULL,NULL,Weld,CO,Black-crowned Night-Heron,NULL,02020328,5/3/2009,00:00.0,2009,5,3,Lefko,NULL,NULL,Weld,CO,Snowy Egret,NULL,01970329,7/27/2009,00:00.0,2009,7,27,Lefko,NULL,NULL,Weld,CO,Cattle Egret,NULL,02001330,7/4/2010,00:00.0,2010,7,4,Lefko,NULL,NULL,Weld,CO,Snowy Egret,NULL,01970331,7/4/2010,00:00.0,2010,7,4,Lefko,NULL,NULL,Weld,CO,Cattle Egret,NULL,02001332,7/4/2010,00:00.0,2010,7,4,Lefko,NULL,NULL,Weld,CO,Black-crowned Night-Heron,NULL,02020333,6/24/2010,00:00.0,2010,6,24,Beason,NULL,NULL,Montrose,CO,Eared Grebe,NULL,00040334,6/4/2010,00:00.0,2010,6,4,Fisher,NULL,NULL,Gunnison,CO,Great Blue Heron,NULL,01940335,NULL,,2009,NULL,NULL,Everman,NULL,NULL,Eagle,CO,Great Blue Heron,NULL,01940336,6/16/2009,00:00.0,2009,6,16,Hundertmark,NULL,NULL,Jackson,CO,Forster's Tern,NULL,00690337,8/1/2009,00:00.0,2009,8,1,Hundertmark,NULL,NULL,Jackson,CO,Eared Grebe,NULL,00040338,5/16/2010,00:00.0,2010,5,16,Hundertmark,NULL,NULL,Jackson,CO,Eared Grebe,NULL,00040339,5/16/2010,00:00.0,2010,5,16,Hundertmark,NULL,NULL,Jackson,CO,Western Grebe,NULL,00010340,NULL,,2010,NULL,NULL,Smith,NULL,NULL,Weld,CO,Western Grebe,NULL,00010341,5/25/2009,00:00.0,2009,5,25,Smith,NULL,NULL,Weld,CO,Western Grebe,NULL,00010342,5/25/2009,00:00.0,2009,5,25,Smith,NULL,NULL,Weld,CO,Double-crested Cormorant,NULL,01200343,4/30/2009,00:00.0,2009,4,30,George,NULL,NULL,Boulder,CO,Great Blue Heron,NULL,01940344,NULL,,2009,NULL,NULL,Cowardin,NULL,NULL,Grand,CO,Western Grebe,NULL,00010345,6/5/2011,00:00.0,2011,6,5,Rawinski,NULL,NULL,Rio Grande,CO,Western Grebe,NULL,00010346,6/5/2011,00:00.0,2011,6,5,Rawinski,NULL,NULL,Rio Grande,CO,Eared Grebe,NULL,00040347,7/6/2009,00:00.0,2009,7,6,Beason,NULL,NULL,Delta,CO,Great Blue Heron,NULL,01940348,4/28/2010,00:00.0,2010,4,28,Beason,NULL,NULL,Delta,CO,Great Blue Heron,NULL,01940349,7/19/2009,00:00.0,2009,7,19,Beason,NULL,NULL,Delta,CO,Great Blue Heron,NULL,01940350,5/21/2009,00:00.0,2009,5,21,Hilkey,NULL,NULL,Rio Blanco,CO,Great Blue Heron,NULL,01940351,7/30/2010,00:00.0,2010,7,30,Floyd,NULL,NULL,Boulder,CO,Western Grebe,NULL,00010352,4/15/2009,00:00.0,2009,4,15,Nelson,NULL,NULL,Bent,CO,Great Blue Heron,NULL,01940353,4/6/2010,00:00.0,2010,4,6,Nelson,NULL,NULL,Bent,CO,Great Blue Heron,NULL,01940354,7/25/2009,00:00.0,2009,7,25,Cameron,NULL,NULL,Jefferson,CO,Snowy Egret,NULL,01970355,NULL,,2010,NULL,NULL,Crosby,NULL,NULL,Grand,CO,Great Blue Heron,NULL,01940356,5/3/2009,00:00.0,2009,5,3,Crosby,NULL,NULL,Grand,CO,Great Blue Heron,NULL,01940357,6/9/2011,00:00.0,2011,6,9,Rawinski,NULL,NULL,Conejos,CO,Eared Grebe,NULL,00040358,6/9/2011,00:00.0,2011,6,9,Rawinski,NULL,NULL,Conejos,CO,Western Grebe,NULL,00010359,5/28/2011,00:00.0,2011,5,28,Rawinski,NULL,NULL,Conejos,CO,White-faced Ibis,NULL,01870360,7/15/2009,00:00.0,2009,7,15,McCormick,NULL,NULL,Grand,CO,Great Blue Heron,NULL,01940361,5/28/2010,00:00.0,2010,5,28,McCormick,NULL,NULL,Grand,CO,Great Blue Heron,NULL,01940362,6/14/2009,00:00.0,2009,6,14,Hundertmark,NULL,NULL,Jackson,CO,Forster's Tern,NULL,00690363,6/14/2009,00:00.0,2009,6,14,Hundertmark,NULL,NULL,Jackson,CO,Franklin's Gull,NULL,00590364,8/2/2009,00:00.0,2009,8,2,Hundertmark,NULL,NULL,Jackson,CO,Eared Grebe,NULL,00040365,8/2/2009,00:00.0,2009,8,2,Hundertmark,NULL,NULL,Jackson,CO,Western Grebe,NULL,00010366,6/13/2010,00:00.0,2010,6,13,Hundertmark,NULL,NULL,Jackson,CO,Franklin's Gull,NULL,00590367,7/10/2010,00:00.0,2010,7,10,Hundertmark,NULL,NULL,Jackson,CO,Eared Grebe,NULL,00040368,8/8/2010,00:00.0,2010,8,8,Hundertmark,NULL,NULL,Jackson,CO,Forster's Tern,NULL,00690369,8/2/2009,00:00.0,2009,8,2,Hundertmark,NULL,NULL,Jackson,CO,Western Grebe,NULL,00010370,7/10/2010,00:00.0,2010,7,10,Hundertmark,NULL,NULL,Jackson,CO,Western Grebe,NULL,00010371,NULL,,2009,NULL,NULL,Mason,NULL,NULL,Hinsdale,CO,Black-crowned Night-Heron,NULL,02020372,NULL,,2010,NULL,NULL,Mason,NULL,NULL,Hinsdale,CO,Black-crowned Night-Heron,NULL,02020373,5/15/2009,00:00.0,2009,5,15,Klute,NULL,NULL,Adams,CO,Snowy Egret,NULL,01970374,5/15/2009,00:00.0,2009,5,15,Klute,NULL,NULL,Adams,CO,Great Blue Heron,NULL,01940375,5/15/2009,00:00.0,2009,5,15,Klute,NULL,NULL,Adams,CO,Black-crowned Night-Heron,NULL,02020376,6/4/2010,00:00.0,2010,6,4,Klute,NULL,NULL,Adams,CO,Snowy Egret,NULL,019703197,7/9/1998,00:00.0,1998,7,9,Paul,NULL,NULL,Davis,UT,White-faced Ibis,NULL,018703198,NULL,,1982,NULL,NULL,Robinette et al. 1993,NULL,NULL,Davis,UT,California Gull,NULL,005303199,NULL,,1991,NULL,NULL,Robinette et al. 1993,NULL,NULL,Davis,UT,California Gull,NULL,005303200,NULL,,1992,NULL,NULL,Robinette et al. 1993,NULL,NULL,Davis,UT,California Gull,NULL,005303201,NULL,,1993,NULL,NULL,Robinette et al. 1993,NULL,NULL,Davis,UT,California Gull,NULL,005303202,NULL,,1983,NULL,NULL,Robinette et al. 1993,NULL,NULL,Davis,UT,California Gull,NULL,005303203,NULL,,1990,NULL,NULL,Robinette et al. 1993,NULL,NULL,Davis,UT,California Gull,NULL,005303204,NULL,,1991,NULL,NULL,Robinette et al. 1993,NULL,NULL,Davis,UT,California Gull,NULL,005303205,NULL,,1992,NULL,NULL,Robinette et al. 1993,NULL,NULL,Davis,UT,California Gull,NULL,005303206,NULL,,1993,NULL,NULL,Robinette et al. 1993,NULL,NULL,Davis,UT,California Gull,NULL,005303207,NULL,,1982,NULL,NULL,Robinette et al. 1993,NULL,NULL,Box Elder,UT,California Gull,NULL,005303208,NULL,,1989,NULL,NULL,Robinette et al. 1993,NULL,NULL,Box Elder,UT,California Gull,NULL,005303209,NULL,,1990,NULL,NULL,Robinette et al. 1993,NULL,NULL,Box Elder,UT,California Gull,NULL,005303210,NULL,,1991,NULL,NULL,Robinette et al. 1993,NULL,NULL,Box Elder,UT,California Gull,NULL,005303211,NULL,,1992,NULL,NULL,Robinette et al. 1993,NULL,NULL,Box Elder,UT,California Gull,NULL,005303212,NULL,,1993,NULL,NULL,Robinette et al. 1993,NULL,NULL,Box Elder,UT,California Gull,NULL,005303213,NULL,,1850,NULL,NULL,Behle 1958,NULL,NULL,Box Elder,UT,American White Pelican,NULL,012503214,NULL,,1896,NULL,NULL,Behle 1958,NULL,NULL,Box Elder,UT,American White Pelican,NULL,012503215,NULL,,1908,NULL,NULL,Behle 1958,NULL,NULL,Box Elder,UT,California Gull,NULL,005303216,NULL,,1937,NULL,NULL,Behle 1958,NULL,NULL,Box Elder,UT,California Gull,NULL,005303217,NULL,,1963,NULL,NULL,Behle 1958,NULL,NULL,Box Elder,UT,American White Pelican,NULL,012503218,NULL,,1972,NULL,NULL,Neill et al. 2010,NULL,NULL,Box Elder,UT,American White Pelican,NULL,012503343,6/13/2000,00:00.0,2000,6,13,NULL,NULL,NULL,Davis,UT,Snowy Egret,NULL,019703219,NULL,,1973,NULL,NULL,Neill et al. 2010,NULL,NULL,Box Elder,UT,American White Pelican,NULL,012503220,NULL,,1974,NULL,NULL,Neill et al. 2010,NULL,NULL,Box Elder,UT,American White Pelican,NULL,012503221,NULL,,1976,NULL,NULL,Neill et al. 2010,NULL,NULL,Box Elder,UT,American White Pelican,NULL,012503222,NULL,,1980,NULL,NULL,Neill et al. 2010,NULL,NULL,Box Elder,UT,American White Pelican,NULL,012503223,NULL,,1982,NULL,NULL,Robinette et al. 1993,NULL,NULL,Box Elder,UT,California Gull,NULL,005303224,NULL,,1983,NULL,NULL,Robinette et al. 1993,NULL,NULL,Box Elder,UT,California Gull,NULL,005303225,NULL,,1986,NULL,NULL,Neill et al. 2010,NULL,NULL,Box Elder,UT,American White Pelican,NULL,012503226,NULL,,1986,NULL,NULL,Robinette et al. 1993,NULL,NULL,Box Elder,UT,California Gull,NULL,005303227,NULL,,1987,NULL,NULL,Robinette et al. 1993,NULL,NULL,Box Elder,UT,California Gull,NULL,005303228,NULL,,1989,NULL,NULL,Neill et al. 2010,NULL,NULL,Box Elder,UT,American White Pelican,NULL,012503229,NULL,,1989,NULL,NULL,Robinette et al. 1993,NULL,NULL,Box Elder,UT,California Gull,NULL,005303230,NULL,,1990,NULL,NULL,Robinette et al. 1993,NULL,NULL,Box Elder,UT,California Gull,NULL,005303231,NULL,,1991,NULL,NULL,Robinette et al. 1993,NULL,NULL,Box Elder,UT,California Gull,NULL,005303232,NULL,,1992,NULL,NULL,Robinette et al. 1993,NULL,NULL,Box Elder,UT,California Gull,NULL,005303233,NULL,,1994,NULL,NULL,Neill et al. 2010,NULL,NULL,Box Elder,UT,American White Pelican,NULL,012503234,NULL,,2004,NULL,NULL,Neill et al. 2010,NULL,NULL,Box Elder,UT,American White Pelican,NULL,012503235,NULL,,2006,NULL,NULL,Neill et al. 2010,NULL,NULL,Box Elder,UT,American White Pelican,NULL,012503236,6/29/1932,00:00.0,1932,6,29,Behle 1958,NULL,NULL,Box Elder,UT,American White Pelican,NULL,012503237,6/29/1932,00:00.0,1932,6,29,Behle 1958,NULL,NULL,Box Elder,UT,California Gull,NULL,005303238,6/29/1932,00:00.0,1932,6,29,Behle 1958,NULL,NULL,Box Elder,UT,Great Blue Heron,NULL,019403239,6/4/1936,00:00.0,1936,6,4,Behle 1958,NULL,NULL,Box Elder,UT,American White Pelican,NULL,012503240,6/4/1936,00:00.0,1936,6,4,Behle 1958,NULL,NULL,Box Elder,UT,California Gull,NULL,005303241,6/4/1936,00:00.0,1936,6,4,Behle 1958,NULL,NULL,Box Elder,UT,Great Blue Heron,NULL,019403242,6/23/1937,00:00.0,1937,6,23,Behle 1958,NULL,NULL,Box Elder,UT,American White Pelican,NULL,012503243,6/22/1940,00:00.0,1940,6,22,Behle 1958,NULL,NULL,Box Elder,UT,American White Pelican,NULL,012503244,6/22/1940,00:00.0,1940,6,22,Behle 1958,NULL,NULL,Box Elder,UT,California Gull,NULL,005303245,6/22/1940,00:00.0,1940,6,22,Behle 1958,NULL,NULL,Box Elder,UT,Great Blue Heron,NULL,019403246,6/12/1943,00:00.0,1943,6,12,Behle 1958,NULL,NULL,Box Elder,UT,California Gull,NULL,005303247,6/23/1943,00:00.0,1943,6,23,Behle 1958,NULL,NULL,Box Elder,UT,American White Pelican,NULL,012503248,7/3/1946,00:00.0,1946,7,3,Behle 1958,NULL,NULL,Box Elder,UT,American White Pelican,NULL,012503249,7/3/1946,00:00.0,1946,7,3,Behle 1958,NULL,NULL,Box Elder,UT,California Gull,NULL,005303250,6/19/1947,00:00.0,1947,6,19,Behle 1958,NULL,NULL,Box Elder,UT,American White Pelican,NULL,012503251,6/11/1948,00:00.0,1948,6,11,Behle 1958,NULL,NULL,Box Elder,UT,American White Pelican,NULL,012503252,7/15/1948,00:00.0,1948,7,15,Behle 1958,NULL,NULL,Box Elder,UT,California Gull,NULL,005303253,6/11/1949,00:00.0,1949,6,11,Behle 1958,NULL,NULL,Box Elder,UT,Great Blue Heron,NULL,019403254,7/9/1964,00:00.0,1964,7,9,Neill et al. 2010,NULL,NULL,Box Elder,UT,American White Pelican,NULL,012503255,5/13/1981,00:00.0,1981,5,13,Neill et al. 2010,NULL,NULL,Box Elder,UT,American White Pelican,NULL,012503256,5/20/1985,00:00.0,1985,5,20,Neill et al. 2010,NULL,NULL,Box Elder,UT,American White Pelican,NULL,012503257,5/20/1988,00:00.0,1988,5,20,Neill et al. 2010,NULL,NULL,Box Elder,UT,American White Pelican,NULL,012503258,5/17/1991,00:00.0,1991,5,17,Neill et al. 2010,NULL,NULL,Box Elder,UT,American White Pelican,NULL,012503259,5/18/1992,00:00.0,1992,5,18,Neill et al. 2010,NULL,NULL,Box Elder,UT,American White Pelican,NULL,012503260,5/19/1993,00:00.0,1993,5,19,Robinette et al. 1993,NULL,NULL,Box Elder,UT,California Gull,NULL,005303261,5/20/1997,00:00.0,1997,5,20,Neill et al. 2010,NULL,NULL,Box Elder,UT,American White Pelican,NULL,012503262,5/20/1998,00:00.0,1998,5,20,Neill et al. 2010,NULL,NULL,Box Elder,UT,American White Pelican,NULL,012503263,5/20/1999,00:00.0,1999,5,20,Neill et al. 2010,NULL,NULL,Box Elder,UT,American White Pelican,NULL,012503264,5/20/2002,00:00.0,2002,5,20,Neill et al. 2010,NULL,NULL,Box Elder,UT,American White Pelican,NULL,012503265,NULL,,1983,NULL,NULL,Neill et al. 2010,NULL,NULL,Box Elder,UT,American White Pelican,SurveyDate:5/15:6/15/1983,012503266,NULL,,2001,5,NULL,Neill et al. 2010,NULL,NULL,Box Elder,UT,American White Pelican,SurveyDate:5/17:5/18/2001,012503267,NULL,,2007,NULL,NULL,Neill et al. 2010,NULL,NULL,Box Elder,UT,American White Pelican,SurveyDate:5/18:6/19:7/27/2007,012503268,NULL,,1995,NULL,NULL,Neill et al. 2010,NULL,NULL,Box Elder,UT,American White Pelican,SurveyDate:5/19:6/20/1995,012503269,NULL,,1987,NULL,NULL,Neill et al. 2010,NULL,NULL,Box Elder,UT,American White Pelican,SurveyDate:5/19:6/22/1987,012503270,NULL,,1993,NULL,NULL,Neill et al. 2010,NULL,NULL,Box Elder,UT,American White Pelican,SurveyDate:5/19:6/22/1993,012503271,NULL,,2000,NULL,NULL,Neill et al. 2010,NULL,NULL,Box Elder,UT,American White Pelican,SurveyDate:5/19:6/8/2000,012503272,NULL,,1996,NULL,NULL,Neill et al. 2010,NULL,NULL,Box Elder,UT,American White Pelican,SurveyDate:5/20:6/20/1996,012503273,NULL,,2008,NULL,NULL,Neill et al. 2010,NULL,NULL,Box Elder,UT,American White Pelican,SurveyDate:5/20:6/20:7/22/2008,012503274,NULL,,2003,NULL,NULL,Neill et al. 2010,NULL,NULL,Box Elder,UT,American White Pelican,SurveyDate:5/20:6/26/2003,012503275,NULL,,1984,NULL,NULL,Neill et al. 2010,NULL,NULL,Box Elder,UT,American White Pelican,SurveyDate:5/21:6/20/1984,012503276,NULL,,1990,NULL,NULL,Neill et al. 2010,NULL,NULL,Box Elder,UT,American White Pelican,SurveyDate:5/21:June/1990,012503277,NULL,,2005,NULL,NULL,Neill et al. 2010,NULL,NULL,Box Elder,UT,American White Pelican,SurveyDate:5/23:6/22:7/5/2005,012503278,NULL,,1982,NULL,NULL,Neill et al. 2010,NULL,NULL,Box Elder,UT,American White Pelican,SurveyDate:5/24:6/12/1982,012503279,NULL,,1850,5,8,Behle 1958,NULL,NULL,Box Elder,UT,California Gull,NULL,005303280,NULL,,1937,6,NULL,Behle 1958,NULL,NULL,Box Elder,UT,Great Blue Heron,SurveyDate:6/-/1937,019403281,NULL,,1935,6,NULL,Behle 1958,NULL,NULL,Box Elder,UT,American White Pelican,SurveyDate:6/18:19/1935,012503282,NULL,,1935,6,NULL,Behle 1958,NULL,NULL,Box Elder,UT,California Gull,SurveyDate:6/18:19/1935,005303283,NULL,,1935,6,NULL,Behle 1958,NULL,NULL,Box Elder,UT,Great Blue Heron,SurveyDate:6/18:19/1935,019403284,NULL,,1886,7,NULL,Behle 1958,NULL,NULL,Box Elder,UT,American White Pelican,SurveyDate:7/-/1886,012503285,NULL,,1886,7,NULL,Behle 1958,NULL,NULL,Box Elder,UT,California Gull,SurveyDate:7/-/1886,005303286,NULL,,1938,7,NULL,Behle 1958,NULL,NULL,Box Elder,UT,American White Pelican,SurveyDate:7/11:12/1938,012503287,NULL,,1938,7,NULL,Behle 1958,NULL,NULL,Box Elder,UT,California Gull,SurveyDate:7/11:12/1938,005303288,NULL,,1938,7,NULL,Behle 1958,NULL,NULL,Box Elder,UT,Great Blue Heron,SurveyDate:7/11:12/1938,019403289,NULL,,1896,NULL,NULL,Behle 1958,NULL,NULL,Box Elder,UT,California Gull,SurveyDate:Spring 1896,005303290,NULL,,1885,NULL,NULL,Behle 1958,NULL,NULL,Box Elder,UT,American White Pelican,NULL,012503291,NULL,,1885,NULL,NULL,Behle 1958,NULL,NULL,Box Elder,UT,Great Blue Heron,NULL,019403292,NULL,,1896,NULL,NULL,Behle 1958,NULL,NULL,Box Elder,UT,American White Pelican,NULL,012503293,NULL,,1912,NULL,NULL,Behle 1958,NULL,NULL,Box Elder,UT,American White Pelican,NULL,012503294,NULL,,1912,NULL,NULL,Behle 1958,NULL,NULL,Box Elder,UT,Great Blue Heron,NULL,019403295,NULL,,1932,NULL,NULL,Behle 1958,NULL,NULL,Box Elder,UT,Great Blue Heron,NULL,019403296,NULL,,1943,NULL,NULL,Behle 1958,NULL,NULL,Box Elder,UT,American White Pelican,NULL,012503297,NULL,,1982,NULL,NULL,Robinette et al. 1993,NULL,NULL,Box Elder,UT,California Gull,NULL,005303298,NULL,,1983,NULL,NULL,Robinette et al. 1993,NULL,NULL,Box Elder,UT,California Gull,NULL,005303299,NULL,,1986,NULL,NULL,Robinette et al. 1993,NULL,NULL,Box Elder,UT,California Gull,NULL,005303300,NULL,,1987,NULL,NULL,Robinette et al. 1993,NULL,NULL,Box Elder,UT,California Gull,NULL,005303301,NULL,,1989,NULL,NULL,Robinette et al. 1993,NULL,NULL,Box Elder,UT,California Gull,NULL,005303302,NULL,,1990,NULL,NULL,Robinette et al. 1993,NULL,NULL,Box Elder,UT,California Gull,NULL,005303303,NULL,,1991,NULL,NULL,Robinette et al. 1993,NULL,NULL,Box Elder,UT,California Gull,NULL,005303304,NULL,,1992,NULL,NULL,Robinette et al. 1993,NULL,NULL,Box Elder,UT,California Gull,NULL,005303305,NULL,,1993,NULL,NULL,Robinette et al. 1993,NULL,NULL,Box Elder,UT,California Gull,NULL,005303306,5/8/1906,00:00.0,1906,5,8,Behle 1958,NULL,NULL,Box Elder,UT,American White Pelican,NULL,012503307,5/8/1906,00:00.0,1906,5,8,Behle 1958,NULL,NULL,Box Elder,UT,California Gull,NULL,005303308,5/8/1906,00:00.0,1906,5,8,Behle 1958,NULL,NULL,Box Elder,UT,Great Blue Heron,NULL,019403309,5/14/1915,00:00.0,1915,5,14,Behle 1958,NULL,NULL,Box Elder,UT,Caspian Tern,NULL,006403310,6/21/1917,00:00.0,1917,6,21,Behle 1958,NULL,NULL,Box Elder,UT,California Gull,NULL,005303311,7/5/1924,00:00.0,1924,7,5,Behle 1958,NULL,NULL,Box Elder,UT,Great Blue Heron,NULL,019403312,5/17/1925,00:00.0,1925,5,17,Behle 1958,NULL,NULL,Box Elder,UT,American White Pelican,NULL,012503313,5/17/1925,00:00.0,1925,5,17,Behle 1958,NULL,NULL,Box Elder,UT,California Gull,NULL,005303314,5/8/1926,00:00.0,1926,5,8,Behle 1958,NULL,NULL,Box Elder,UT,Great Blue Heron,NULL,019403315,5/21/1926,00:00.0,1926,5,21,Behle 1958,NULL,NULL,Box Elder,UT,American White Pelican,NULL,012503316,5/21/1926,00:00.0,1926,5,21,Behle 1958,NULL,NULL,Box Elder,UT,California Gull,NULL,005303317,5/15/1932,00:00.0,1932,5,15,Behle 1958,NULL,NULL,Box Elder,UT,American White Pelican,NULL,012503318,6/1/1935,00:00.0,1935,6,1,Behle 1958,NULL,NULL,Box Elder,UT,California Gull,NULL,005303319,6/4/1935,00:00.0,1935,6,4,Behle 1958,NULL,NULL,Box Elder,UT,Great Blue Heron,NULL,019403320,5/3/1936,00:00.0,1936,5,3,Behle 1958,NULL,NULL,Box Elder,UT,Great Blue Heron,NULL,019403321,6/22/1937,00:00.0,1937,6,22,Behle 1958,NULL,NULL,Box Elder,UT,American White Pelican,NULL,012503322,7/11/1937,00:00.0,1937,7,11,Behle 1958,NULL,NULL,Box Elder,UT,California Gull,NULL,005303323,7/11/1938,00:00.0,1938,7,11,Behle 1958,NULL,NULL,Box Elder,UT,American White Pelican,NULL,012503324,7/11/1938,00:00.0,1938,7,11,Behle 1958,NULL,NULL,Box Elder,UT,California Gull,NULL,005303325,NULL,,1907,5,NULL,Behle 1958,NULL,NULL,Box Elder,UT,American White Pelican,NULL,012503326,NULL,,1907,5,NULL,Behle 1958,NULL,NULL,Box Elder,UT,Great Blue Heron,NULL,019403327,NULL,,1933,NULL,NULL,Behle 1958,NULL,NULL,Box Elder,UT,American White Pelican,SurveyDate:5/30:6/16/1933,012503328,NULL,,1933,6,NULL,Behle 1958,NULL,NULL,Box Elder,UT,California Gull,SurveyDate:6/-/1933,005303329,NULL,,1886,7,NULL,Behle 1958,NULL,NULL,Box Elder,UT,American White Pelican,SurveyDate:7/-/1886,012503330,NULL,,1886,7,NULL,Behle 1958,NULL,NULL,Box Elder,UT,California Gull,SurveyDate:7/-/1886,005303331,NULL,,1886,7,NULL,Behle 1958,NULL,NULL,Box Elder,UT,Great Blue Heron,SurveyDate:7/-/1886,019403332,NULL,,1907,7,NULL,Behle 1958,NULL,NULL,Box Elder,UT,California Gull,SurveyDate:7/-/1907,005303333,NULL,,1885,NULL,NULL,Behle 1958,NULL,NULL,Box Elder,UT,California Gull,SurveyDate:Spring 1885,005303334,NULL,,1912,NULL,NULL,Behle 1958,NULL,NULL,Box Elder,UT,California Gull,SurveyDate:Spring 1912,005303335,NULL,,1970,NULL,NULL,NULL,NULL,NULL,Davis,UT,White-faced Ibis,NULL,018703336,NULL,,2000,NULL,NULL,NULL,NULL,NULL,Davis,UT,White-faced Ibis,NULL,018703337,NULL,,2001,NULL,NULL,NULL,NULL,NULL,Davis,UT,White-faced Ibis,NULL,018703338,7/10/1999,00:00.0,1999,7,10,NULL,NULL,NULL,Davis,UT,Black-crowned Night-Heron,NULL,020203339,7/10/1999,00:00.0,1999,7,10,NULL,NULL,NULL,Davis,UT,Snowy Egret,NULL,019703340,7/10/1999,00:00.0,1999,7,10,NULL,NULL,NULL,Davis,UT,White-faced Ibis,NULL,018703341,6/13/2000,00:00.0,2000,6,13,NULL,NULL,NULL,Davis,UT,Black-crowned Night-Heron,NULL,020203342,6/13/2000,00:00.0,2000,6,13,NULL,NULL,NULL,Davis,UT,Franklin's Gull,NULL,005903344,NULL,,1970,NULL,NULL,NULL,NULL,NULL,Davis,UT,White-faced Ibis,NULL,018703345,NULL,,2000,NULL,NULL,NULL,NULL,NULL,Davis,UT,White-faced Ibis,NULL,018703346,NULL,,2001,NULL,NULL,NULL,NULL,NULL,Davis,UT,White-faced Ibis,NULL,018703347,7/10/1999,00:00.0,1999,7,10,NULL,NULL,NULL,Davis,UT,Black-crowned Night-Heron,NULL,020203348,7/10/1999,00:00.0,1999,7,10,NULL,NULL,NULL,Davis,UT,Forster's Tern,NULL,006903349,7/10/1999,00:00.0,1999,7,10,NULL,NULL,NULL,Davis,UT,Franklin's Gull,NULL,005903350,7/10/1999,00:00.0,1999,7,10,NULL,NULL,NULL,Davis,UT,Snowy Egret,NULL,019703351,7/10/1999,00:00.0,1999,7,10,NULL,NULL,NULL,Davis,UT,White-faced Ibis,NULL,018703352,6/13/2000,00:00.0,2000,6,13,NULL,NULL,NULL,Davis,UT,Franklin's Gull,NULL,005903353,6/13/2000,00:00.0,2000,6,13,NULL,NULL,NULL,Davis,UT,Snowy Egret,NULL,019703354,6/25/2001,00:00.0,2001,6,25,NULL,NULL,NULL,Davis,UT,Black-crowned Night-Heron,NULL,020203355,NULL,,1982,NULL,NULL,Robinette et al. 1993,NULL,NULL,Rich,UT,California Gull,NULL,005303356,NULL,,1983,NULL,NULL,Robinette et al. 1993,NULL,NULL,Rich,UT,California Gull,NULL,005303357,NULL,,1991,NULL,NULL,Robinette et al. 1993,NULL,NULL,Rich,UT,California Gull,NULL,005303358,NULL,,1992,NULL,NULL,Robinette et al. 1993,NULL,NULL,Rich,UT,California Gull,NULL,005303359,NULL,,1993,NULL,NULL,Robinette et al. 1993,NULL,NULL,Rich,UT,California Gull,NULL,005303360,NULL,,1993,NULL,NULL,Robinette et al. 1993,NULL,NULL,Rich,UT,Double-crested Cormorant,NULL,012003361,NULL,,1993,NULL,NULL,Robinette et al. 1993,NULL,NULL,Rich,UT,Ring-billed Gull,NULL,005403362,NULL,,2008,NULL,NULL,Paul 2010,NULL,NULL,Rich,UT,California Gull,NULL,005303363,NULL,,2008,NULL,NULL,Paul 2010,NULL,NULL,Rich,UT,Double-crested Cormorant,NULL,012003364,NULL,,2008,NULL,NULL,Paul 2010,NULL,NULL,Rich,UT,Ring-billed Gull,NULL,005403365,NULL,,2008,NULL,NULL,Paul 2010,NULL,NULL,Rich,UT,NULL,"Multiple species:  Snowy Egret, Cattle Egret, and Black-crowned Night-Heron",NULL3366,NULL,,1985,NULL,NULL,NULL,NULL,NULL,Weber,UT,White-faced Ibis,NULL,018703367,NULL,,1989,NULL,NULL,NULL,NULL,NULL,Weber,UT,White-faced Ibis,NULL,018703368,7/15/1998,00:00.0,1998,7,15,Paul,NULL,NULL,Weber,UT,White-faced Ibis,NULL,018703369,6/9/1999,00:00.0,1999,6,9,NULL,NULL,NULL,Weber,UT,Snowy Egret,NULL,019703370,7/19/1999,00:00.0,1999,7,19,NULL,NULL,NULL,Weber,UT,Eared Grebe,NULL,000403371,7/19/1999,00:00.0,1999,7,19,NULL,NULL,NULL,Weber,UT,Forster's Tern,NULL,006903372,NULL,,1982,NULL,NULL,Robinette et al. 1998,NULL,NULL,Davis,UT,California Gull,NULL,005303373,NULL,,1983,NULL,NULL,Robinette et al. 1998,NULL,NULL,Davis,UT,California Gull,NULL,005303374,NULL,,1982,NULL,NULL,Robinette et al. 1993,NULL,NULL,Box Elder,UT,California Gull,NULL,005303375,NULL,,1983,NULL,NULL,Robinette et al. 1993,NULL,NULL,Box Elder,UT,California Gull,NULL,005303376,NULL,,1986,NULL,NULL,Robinette et al. 1993,NULL,NULL,Box Elder,UT,California Gull,NULL,005303377,NULL,,1987,NULL,NULL,Robinette et al. 1993,NULL,NULL,Box Elder,UT,California Gull,NULL,005303378,6/13/2000,00:00.0,2000,6,13,NULL,NULL,NULL,Davis,UT,Black-crowned Night-Heron,NULL,020203379,6/13/2000,00:00.0,2000,6,13,NULL,NULL,NULL,Davis,UT,Forster's Tern,NULL,006903380,6/13/2000,00:00.0,2000,6,13,NULL,NULL,NULL,Davis,UT,Franklin's Gull,NULL,005903381,6/13/2000,00:00.0,2000,6,13,NULL,NULL,NULL,Davis,UT,Great Blue Heron,NULL,019403382,6/13/2000,00:00.0,2000,6,13,NULL,NULL,NULL,Davis,UT,Great Egret,NULL,019603383,6/13/2000,00:00.0,2000,6,13,NULL,NULL,NULL,Davis,UT,Snowy Egret,NULL,019703384,6/13/2000,00:00.0,2000,6,13,NULL,NULL,NULL,Davis,UT,Western Grebe,NULL,000102257,NULL,,1991,NULL,NULL,NULL,NULL,NULL,Sheridan,MT,American White Pelican,NULL,012502258,NULL,,1992,NULL,NULL,NULL,NULL,NULL,Sheridan,MT,American White Pelican,NULL,012502259,NULL,,1993,NULL,NULL,NULL,NULL,NULL,Sheridan,MT,American White Pelican,NULL,012502260,NULL,,1994,NULL,NULL,NULL,NULL,NULL,Sheridan,MT,American White Pelican,NULL,012502261,NULL,,1995,NULL,NULL,NULL,NULL,NULL,Sheridan,MT,American White Pelican,NULL,012502262,NULL,,1996,NULL,NULL,NULL,NULL,NULL,Sheridan,MT,American White Pelican,NULL,012502263,NULL,,1997,NULL,NULL,NULL,NULL,NULL,Sheridan,MT,American White Pelican,NULL,012502264,NULL,,1998,NULL,NULL,NULL,NULL,NULL,Sheridan,MT,American White Pelican,NULL,012502265,NULL,,1999,NULL,NULL,NULL,NULL,NULL,Sheridan,MT,American White Pelican,NULL,012502266,NULL,,2000,NULL,NULL,NULL,NULL,NULL,Sheridan,MT,American White Pelican,NULL,012502267,NULL,,2001,NULL,NULL,NULL,NULL,NULL,Sheridan,MT,American White Pelican,NULL,012502268,NULL,,2002,NULL,NULL,NULL,NULL,NULL,Sheridan,MT,American White Pelican,NULL,012502269,NULL,,2003,NULL,NULL,NULL,NULL,NULL,Sheridan,MT,American White Pelican,NULL,012502270,NULL,,2004,NULL,NULL,NULL,NULL,NULL,Sheridan,MT,American White Pelican,NULL,012502271,NULL,,2005,NULL,NULL,NULL,NULL,NULL,Sheridan,MT,American White Pelican,NULL,012502272,NULL,,2006,NULL,NULL,NULL,NULL,NULL,Sheridan,MT,American White Pelican,NULL,012502273,NULL,,2007,NULL,NULL,NULL,NULL,NULL,Sheridan,MT,American White Pelican,NULL,012502274,NULL,,2008,NULL,NULL,NULL,NULL,NULL,Sheridan,MT,American White Pelican,NULL,012502275,NULL,,1969,NULL,NULL,Marble,NULL,NULL,Hill,MT,Great Blue Heron,NULL,019402276,NULL,,1996,NULL,NULL,NULL,NULL,NULL,Phillips,MT,Black Tern,NULL,007702277,NULL,,1968,NULL,NULL,Hadden,NULL,NULL,Fergus,MT,Great Blue Heron,NULL,019402278,NULL,,1979,NULL,NULL,Hadden,NULL,NULL,Fergus,MT,Great Blue Heron,NULL,019402279,NULL,,1977,NULL,NULL,Hadden,NULL,NULL,Fergus,MT,Great Blue Heron,NULL,019402280,NULL,,1976,NULL,NULL,Hook,NULL,NULL,Chouteau,MT,Great Blue Heron,NULL,019402281,NULL,,1979,NULL,NULL,Hook,NULL,NULL,Chouteau,MT,Great Blue Heron,NULL,019402282,NULL,,1980,NULL,NULL,Billings,NULL,NULL,Phillips,MT,Great Blue Heron,NULL,019402283,NULL,,1988,NULL,NULL,Prellwitz,NULL,NULL,Phillips,MT,Common Tern,NULL,007002284,NULL,,1970,NULL,NULL,Moos,NULL,NULL,Blaine,MT,Double-crested Cormorant,NULL,012002285,NULL,,1981,NULL,NULL,Moos,NULL,NULL,Blaine,MT,Great Blue Heron,NULL,019402286,NULL,,1996,NULL,NULL,NULL,NULL,NULL,Blaine,MT,California Gull,NULL,005302287,NULL,,1996,NULL,NULL,NULL,NULL,NULL,Blaine,MT,Forster's Tern,NULL,006902288,NULL,,1996,NULL,NULL,NULL,NULL,NULL,Blaine,MT,Ring-billed Gull,NULL,005402289,NULL,,1996,NULL,NULL,NULL,NULL,NULL,Teton,MT,Black Tern,NULL,007702290,NULL,,1983,NULL,NULL,NULL,NULL,NULL,Phillips,MT,Eared Grebe,NULL,000402291,NULL,,1996,NULL,NULL,NULL,NULL,NULL,Hill,MT,Forster's Tern,NULL,006902292,NULL,,1975,NULL,NULL,Hook,NULL,NULL,Park,MT,Great Blue Heron,NULL,019402293,NULL,,1979,NULL,NULL,Hills,NULL,NULL,Meagher,MT,Great Blue Heron,NULL,019402294,NULL,,1980,NULL,NULL,Ellis,NULL,NULL,Cascade,MT,Great Blue Heron,NULL,019402295,NULL,,1977,NULL,NULL,Fries,NULL,NULL,Garfield,MT,Double-crested Cormorant,NULL,012002296,NULL,,1978,NULL,NULL,Fries,NULL,NULL,Garfield,MT,Double-crested Cormorant,NULL,012002297,NULL,,1976,NULL,NULL,Thompson,NULL,NULL,Lewis & Clark,MT,Double-crested Cormorant,NULL,012002298,NULL,,1976,NULL,NULL,Thompson,NULL,NULL,Lewis & Clark,MT,Great Blue Heron,NULL,019402299,NULL,,1979,NULL,NULL,Marble,NULL,NULL,Liberty,MT,Double-crested Cormorant,NULL,012002300,NULL,,NULL,NULL,NULL,NULL,NULL,NULL,NULL,MT,Double-crested Cormorant,NULL,012002301,NULL,,1996,NULL,NULL,NULL,NULL,NULL,Blaine,MT,Forster's Tern,NULL,006902302,NULL,,1996,NULL,NULL,NULL,NULL,NULL,Valley,MT,Common Tern,NULL,007002303,NULL,,1996,NULL,NULL,NULL,NULL,NULL,Blaine,MT,Black Tern,NULL,007702304,NULL,,1979,NULL,NULL,Hadden,NULL,NULL,Chouteau,MT,Great Blue Heron,NULL,019402305,NULL,,1996,NULL,NULL,NULL,NULL,NULL,Valley,MT,Common Tern,NULL,007002306,NULL,,1996,NULL,NULL,NULL,NULL,NULL,Valley,MT,Common Tern,NULL,007002307,5/24/2010,00:00.0,2010,5,24,Watson,NULL,NULL,Rio Arriba,NM,Double-crested Cormorant,NULL,012002308,6/9/2010,00:00.0,2010,6,9,Joseph,NULL,NULL,Bernalillo,NM,Black-crowned Night-Heron,NULL,020202309,6/12/2010,00:00.0,2010,6,12,Neely/Liddell,NULL,NULL,Bernalillo,NM,Cattle Egret,NULL,020012310,6/12/2010,00:00.0,2010,6,12,Neely/Liddell,NULL,NULL,Bernalillo,NM,Snowy Egret,(NAD83),019702311,5/20/2010,00:00.0,2010,5,20,Williams III,NULL,NULL,Catron,NM,Great Blue Heron,NULL,019402312,4/17/2011,00:00.0,2011,4,17,Newman,NULL,NULL,San Juan,NM,Great Blue Heron,(NAD83),019402313,6/10/2010,00:00.0,2010,6,10,Liddell,NULL,NULL,Valencia,NM,Black-crowned Night-Heron,NULL,020202314,6/10/2010,00:00.0,2010,6,10,Liddell,NULL,NULL,Valencia,NM,Cattle Egret,NULL,020012315,6/10/2010,00:00.0,2010,6,10,Liddell,NULL,NULL,Valencia,NM,Snowy Egret,NULL,019702316,3/18/2011,00:00.0,2011,3,18,Chopp,NULL,NULL,Eddy,NM,Great Blue Heron,NULL,019402317,5/13/2011,00:00.0,2011,5,13,Howe,NULL,NULL,Rio Arriba,NM,Great Blue Heron,NULL,019402318,4/5/2011,00:00.0,2011,4,5,Howe,NULL,NULL,Mora,NM,Great Blue Heron,NULL,019402319,4/27/2010,00:00.0,2010,4,27,Howe,NULL,NULL,Curry,NM,Double-crested Cormorant,NULL,012002320,5/19/2010,00:00.0,2010,5,19,Watson,NULL,NULL,Socorro,NM,Double-crested or Neotropic Cormorant,,NULL2321,6/20/2010,00:00.0,2010,6,20,Murphy,NULL,NULL,Socorro,NM,Black-crowned Night-Heron,NULL,020202322,6/20/2010,00:00.0,2010,6,20,Murphy,NULL,NULL,Socorro,NM,Great Blue Heron,NULL,019402323,6/20/2010,00:00.0,2010,6,20,Murphy,NULL,NULL,Socorro,NM,Snowy Egret,NULL,019702324,6/20/2010,00:00.0,2010,6,20,Murphy,NULL,NULL,Socorro,NM,Double-crested or Neotropic Cormorant,,NULL2325,6/20/2010,00:00.0,2010,6,20,Murphy,NULL,NULL,Socorro,NM,Great Egret,NULL,019602326,6/20/2010,00:00.0,2010,6,20,Murphy,NULL,NULL,Socorro,NM,Snowy Egret,NULL,019702327,5/19/2010,00:00.0,2010,5,19,Watson,NULL,NULL,Socorro,NM,Double-crested or Neotropic Cormorant,,NULL2328,6/20/2010,00:00.0,2010,6,20,Murphy,NULL,NULL,Socorro,NM,Double-crested Cormorant,NULL,012002329,6/20/2010,00:00.0,2010,6,20,Murphy,NULL,NULL,Socorro,NM,Great Blue Heron,(NAD27),019402330,6/20/2010,00:00.0,2010,6,20,Murphy,NULL,NULL,Sierra,NM,Black-crowned Night-Heron,NULL,020202331,6/20/2010,00:00.0,2010,6,20,Murphy,NULL,NULL,Sierra,NM,Cattle Egret,NULL,020012332,6/20/2010,00:00.0,2010,6,20,Murphy,NULL,NULL,Sierra,NM,Double-crested Cormorant,NULL,012002333,6/20/2010,00:00.0,2010,6,20,Murphy,NULL,NULL,Sierra,NM,Great Blue Heron,(NAD83),019402334,6/20/2010,00:00.0,2010,6,20,Murphy,NULL,NULL,Sierra,NM,Great Egret,NULL,019602335,6/20/2010,00:00.0,2010,6,20,Murphy,NULL,NULL,Sierra,NM,Snowy Egret,NULL,019702336,5/19/2010,00:00.0,2010,5,19,Watson,NULL,NULL,Sierra,NM,Double-crested or Neotropic Cormorant,,NULL2337,3/4/2011,00:00.0,2011,3,4,Walkup,NULL,NULL,Grant,NM,Great Blue Heron,NULL,019402338,6/22/2010,00:00.0,2010,6,22,Williams III,NULL,NULL,Grant,NM,Great Blue Heron,NULL,019402339,7/19/2010,00:00.0,2010,7,19,Stahlecker,NULL,NULL,Rio Arriba,NM,Eared Grebe,NULL,000402340,7/19/2010,00:00.0,2010,7,19,Stahlecker,NULL,NULL,Rio Arriba,NM,Western Grebe,NULL,000102341,3/22/2011,00:00.0,2011,3,22,Chopp,NULL,NULL,Eddy,NM,Great Blue Heron,NULL,019402342,7/15/2010,00:00.0,2010,7,15,Roper,NULL,NULL,Doa Ana,NM,Cattle Egret,NULL,020012343,6/3/2010,00:00.0,2010,6,3,Griffin,NULL,NULL,Doa Ana,NM,Black-crowned Night-Heron,(NAD83),020202344,5/25/2010,00:00.0,2010,5,25,Watson,NULL,NULL,San Juan,NM,Great Blue Heron,NULL,019402345,6/21/2011,00:00.0,2011,6,21,Reeves,NULL,NULL,San Juan,NM,Great Blue Heron,NULL,019402346,NULL,,2009,NULL,NULL,Reeves,NULL,NULL,San Juan,NM,Great Blue Heron,SurveyDate: Summer 2009,019402347,5/22/2010,00:00.0,2010,5,22,Williams III,NULL,NULL,Grant,NM,Great Blue Heron,NULL,019402348,5/2/2011,00:00.0,2011,5,2,Chopp,NULL,NULL,Eddy,NM,Great Blue Heron,NULL,019402349,5/20/2010,00:00.0,2010,5,20,Williams III,NULL,NULL,Catron,NM,Great Blue Heron,(NAD83),019402350,NULL,,2009,8,NULL,West,NULL,NULL,San Miguel,NM,Clark's Grebe,NULL,000112351,6/10/2009,00:00.0,2009,6,10,Mumford,NULL,NULL,Guadalupe,NM,Double-crested Cormorant,NULL,012002352,5/31/2010,00:00.0,2010,5,31,Howe,NULL,NULL,Guadalupe,NM,Double-crested Cormorant,NULL,012002353,5/21/2010,00:00.0,2010,5,21,Williams III,NULL,NULL,Catron,NM,Great Blue Heron,NULL,019402354,5/20/2010,00:00.0,2010,5,20,Stahlecker,NULL,NULL,Rio Arriba,NM,Western Grebe,NULL,000102355,7/19/2010,00:00.0,2010,7,19,Stahlecker,NULL,NULL,Rio Arriba,NM,Eared Grebe,NULL,000402356,8/10/2010,00:00.0,2010,8,10,Watson,NULL,NULL,Colfax,NM,Western or Clark's Grebe,,NULL2357,9/22/2010,00:00.0,2010,9,22,Howe,NULL,NULL,Colfax,NM,Clark's Grebe,NULL,000112358,9/22/2010,00:00.0,2010,9,22,Howe,NULL,NULL,Colfax,NM,Western Grebe,NULL,000102359,5/26/2010,00:00.0,2010,5,26,Watson,NULL,NULL,Mora,NM,Great Blue Heron,NULL,019402360,4/5/2011,00:00.0,2011,4,5,Howe,NULL,NULL,Mora,NM,Double-crested Cormorant,NULL,012002361,4/5/2011,00:00.0,2011,4,5,Howe,NULL,NULL,Mora,NM,Great Blue Heron,(NAD83),019402362,NULL,,1986,NULL,NULL,Downer,NULL,NULL,San Juan,NM,Great Blue Heron,SurveyDate: 4/10-5/10/1986,019402363,6/28/1980,00:00.0,1980,6,28,Peterson et al.,NULL,NULL,Rio Arriba,NM,Double-crested Cormorant,NULL,012002364,6/26/1981,00:00.0,1981,6,26,Hundertmark,NULL,NULL,Rio Arriba,NM,Double-crested Cormorant,NULL,012002365,6/24/1984,00:00.0,1984,6,24,Vaught,NULL,NULL,Rio Arriba,NM,Double-crested Cormorant,NULL,012002366,3/25/1985,00:00.0,1985,3,25,Domenici,NULL,NULL,Rio Arriba,NM,Double-crested Cormorant,NULL,012002367,6/7/1987,00:00.0,1987,6,7,Insley,NULL,NULL,Rio Arriba,NM,Double-crested Cormorant,NULL,012002368,5/23/1991,00:00.0,1991,5,23,Hubbard,NULL,NULL,Rio Arriba,NM,Double-crested Cormorant,NULL,012002369,6/19/2987,00:00.0,2987,6,19,Rustay,NULL,NULL,Rio Arriba,NM,Great Blue Heron,SurveyDate: 6/2 and 7/2/1993,019402370,NULL,,1993,NULL,NULL,Hubbard/Rustay,NULL,NULL,Rio Arriba,NM,Double-crested Cormorant,NULL,012002371,4/8/1984,00:00.0,1984,4,8,Hubbard,NULL,NULL,Catron,NM,Great Blue Heron,NULL,019402372,NULL,,1981,NULL,NULL,Fisher,NULL,NULL,Catron,NM,Great Blue Heron,SurveyDate: summer 1981,019402373,8/19/1995,00:00.0,1995,8,19,Zimmer,NULL,NULL,Dona Ana,NM,Cattle Egret,NULL,020012374,4/27/1997,00:00.0,1997,4,27,Paton,NULL,NULL,Dona Ana,NM,Black-crowned Night-Heron,NULL,020202375,4/27/1997,00:00.0,1997,4,27,Paton,NULL,NULL,Dona Ana,NM,Cattle Egret,NULL,020012376,4/27/1997,00:00.0,1997,4,27,Paton,NULL,NULL,Dona Ana,NM,Snowy Egret,NULL,019702377,5/28/1998,00:00.0,1998,5,28,Ewing,NULL,NULL,Dona Ana,NM,Cattle Egret,NULL,020012378,5/1/2007,00:00.0,2007,5,1,Lewis,NULL,NULL,Catron,NM,Great Blue Heron,NAD 83,019402379,NULL,,1987,NULL,NULL,Cook,NULL,NULL,Union,NM,Great Blue Heron,SurveyDate: summer 1987,019402380,NULL,,1988,NULL,NULL,Cook,NULL,NULL,Union,NM,Great Blue Heron,SurveyDate: summer 1988,019402381,5/5/1980,00:00.0,1980,5,5,Howe,NULL,NULL,Eddy,NM,Black-crowned Night-Heron,NULL,020202382,5/24/1980,00:00.0,1980,5,24,Howe,NULL,NULL,Eddy,NM,Black-crowned Night-Heron,NULL,020202383,5/24/1980,00:00.0,1980,5,24,Howe,NULL,NULL,Eddy,NM,Snowy Egret,NULL,019702384,3/29/1981,00:00.0,1981,3,29,Hunter,NULL,NULL,Eddy,NM,Snowy Egret,NULL,019702385,6/17/1988,00:00.0,1988,6,17,West,NULL,NULL,Eddy,NM,Cattle Egret,NULL,020012386,6/19/1991,00:00.0,1991,6,19,Williams,NULL,NULL,Eddy,NM,Black-crowned Night-Heron,NULL,020202387,6/19/1991,00:00.0,1991,6,19,Williams,NULL,NULL,Eddy,NM,Cattle Egret,NULL,020012388,6/19/1991,00:00.0,1991,6,19,Williams,NULL,NULL,Eddy,NM,Little Blue Heron,NULL,020002389,6/19/1991,00:00.0,1991,6,19,Williams,NULL,NULL,Eddy,NM,Snowy Egret,NULL,019702390,7/4/1994,00:00.0,1994,7,4,Livingston,NULL,NULL,Eddy,NM,Black-crowned Night-Heron,NULL,020202391,7/4/1994,00:00.0,1994,7,4,Livingston,NULL,NULL,Eddy,NM,Cattle Egret,NULL,020012392,7/4/1994,00:00.0,1994,7,4,Livingston,NULL,NULL,Eddy,NM,Snowy Egret,NULL,019702393,NULL,,1988,NULL,NULL,fide Williams,NULL,NULL,Eddy,NM,Snowy Egret,SurveyDate: summer 1988,019702394,NULL,,1995,NULL,NULL,fide Williams,NULL,NULL,Eddy,NM,Snowy Egret,SurveyDate: summer 1995,019702395,6/10/1983,00:00.0,1983,6,10,Howe,NULL,NULL,Valencia,NM,Cattle Egret,NULL,020012396,NULL,,1982,NULL,NULL,Howe/Hundertmark,NULL,NULL,Valencia,NM,Black-crowned Night-Heron,SurveyDate: spring 1982,020202397,NULL,,1982,NULL,NULL,Howe/Hundertmark,NULL,NULL,Valencia,NM,Snowy Egret,SurveyDate: spring 1982,019702398,NULL,,1984,NULL,NULL,Howe,NULL,NULL,Valencia,NM,Cattle Egret,SurveyDate: summer 1984,020012399,NULL,,1984,NULL,NULL,Howe,NULL,NULL,Valencia,NM,Little Blue Heron,SurveyDate: summer 1984,020002400,6/16/1972,00:00.0,1972,6,16,Boggs/Corrie,NULL,NULL,Chaves,NM,Black-crowned Night-Heron,NULL,020202401,NULL,,1970,NULL,NULL,fide Williams,NULL,NULL,Chaves,NM,Snowy Egret,SurveyDate: summer 1970,019702402,NULL,,1971,NULL,NULL,Boggs,NULL,NULL,Chaves,NM,Black-crowned Night-Heron,SurveyDate: summer 1971,020202403,NULL,,1992,NULL,NULL,Marlatt/Williams,NULL,NULL,Chaves,NM,Forster's Tern,SurveyDate: 5/25-6/24/1992,006902404,NULL,,NULL,NULL,NULL,NULL,NULL,NULL,Chaves,NM,Least Tern,SurveyDate: summers,007402405,8/17/1999,00:00.0,1999,8,17,Williams/Mehlhop,NULL,NULL,Colfax,NM,Eared Grebe,NULL,000402406,7/27/1987,00:00.0,1987,7,27,Cleary,NULL,NULL,McKinley,NM,Eared Grebe,NULL,000402407,7/27/1995,00:00.0,1995,7,27,Cleary/Albert,NULL,NULL,McKinley,NM,Eared Grebe,NULL,000402408,7/2/2004,00:00.0,2004,7,2,Tanner fide Reeves,NULL,NULL,San Juan,NM,Great Blue Heron,NAD 83,019402409,9/3/1988,00:00.0,1988,9,3,Cleary,NULL,NULL,Cibola/McKinley,NM,Eared Grebe,NULL,000402410,8/25/1997,00:00.0,1997,8,25,Snider/West,NULL,NULL,Socorro,NM,Clark's Grebe,NULL,000112411,7/9/2005,00:00.0,2005,7,9,NULL,NULL,NULL,Socorro,NM,Clark's Grebe,NULL,000112412,7/19/2005,00:00.0,2005,7,19,Rustay,NULL,NULL,Socorro,NM,Western Grebe,NULL,000102413,8/1/2006,00:00.0,2006,8,1,Lundblad,NULL,NULL,Socorro,NM,Clark's Grebe,NULL,000112414,7/30/2000,00:00.0,2000,7,30,Rustay,NULL,NULL,Socorro,NM,Great Blue Heron,NULL,019402415,5/29/2003,00:00.0,2003,5,29,Ewing,NULL,NULL,Socorro,NM,Great Blue Heron,NULL,019402416,4/11/2004,00:00.0,2004,4,11,Neville/Shipman,NULL,NULL,Socorro,NM,Great Blue Heron,NULL,019402417,3/26/2005,00:00.0,2005,3,26,Rustay,NULL,NULL,Socorro,NM,Great Blue Heron,NULL,019402418,7/12/1994,00:00.0,1994,7,12,Leal et al.,NULL,NULL,Socorro,NM,Black-crowned Night-Heron,NULL,020202419,7/12/1994,00:00.0,1994,7,12,Leal et al.,NULL,NULL,Socorro,NM,Cattle Egret,NULL,020012420,7/12/1994,00:00.0,1994,7,12,Leal et al.,NULL,NULL,Socorro,NM,Great Egret,NULL,019602421,7/12/1994,00:00.0,1994,7,12,Leal et al.,NULL,NULL,Socorro,NM,Snowy Egret,NULL,019702422,7/18/1994,00:00.0,1994,7,18,Leal,NULL,NULL,Socorro,NM,White-faced Ibis,NULL,018702423,4/27/1996,00:00.0,1996,4,27,Rustay,NULL,NULL,Socorro,NM,Great Egret,NULL,019602424,7/19/1996,00:00.0,1996,7,19,Rustay,NULL,NULL,Socorro,NM,Neotropic Cormorant,NULL,012102425,NULL,,1994,7,NULL,Leal et al.,NULL,NULL,Socorro,NM,Neotropic Cormorant,SurveyDate: 7/12 & 18/1994,012102426,NULL,,1996,7,NULL,Rustay and Ewing,NULL,NULL,Socorro,NM,Great Egret,SurveyDate: 7/9 & 19/1996,019602427,NULL,,1997,6,NULL,Howe,NULL,NULL,Valencia,NM,Black-crowned Night-Heron,SurveyDate: 6/1997,020202428,NULL,,1997,6,NULL,Howe,NULL,NULL,Valencia,NM,Snowy Egret,SurveyDate: 6/1997,019702429,NULL,,1998,6,NULL,"USDA Wildlife Services, fide Howe",NULL,NULL,Valencia,NM,Black-crowned Night-Heron,SurveyDate: 6/1998,020202430,NULL,,1998,6,NULL,"USDA Wildlife Services, fide Howe",NULL,NULL,Valencia,NM,Snowy Egret,SurveyDate:  6/1998,019702431,NULL,,2004,NULL,NULL,Howe et al.,NULL,NULL,Eddy,NM,Least Tern,SurveyDate: summer 2004,007402432,NULL,,1968,6,NULL,Hubbard,NULL,NULL,Grant,NM,Black-crowned Night-Heron,SurveyDate: 6/22 & 25/1968,020202433,6/29/1974,00:00.0,1974,6,29,Hundertmark,NULL,NULL,Rio Arriba,NM,Eared Grebe,NULL,000402434,7/5/1975,00:00.0,1975,7,5,Hundertmark,NULL,NULL,Rio Arriba,NM,Eared Grebe,NULL,000402435,7/5/1975,00:00.0,1975,7,5,Hundertmark,NULL,NULL,Rio Arriba,NM,Western Grebe,NULL,000102436,NULL,,1987,6,NULL,Stahlecker,NULL,NULL,Rio Arriba,NM,Western Grebe,NULL,000102437,7/15/1989,00:00.0,1989,7,15,Lewis,NULL,NULL,Rio Arriba,NM,Eared Grebe,NULL,000402438,7/15/1990,00:00.0,1990,7,15,Stahlecker,NULL,NULL,Rio Arriba,NM,White-faced Ibis,NULL,018702439,6/13/1992,00:00.0,1992,6,13,Stahlecker,NULL,NULL,Rio Arriba,NM,Black-crowned Night-Heron,NULL,020202440,6/13/1992,00:00.0,1992,6,13,Stahlecker,NULL,NULL,Rio Arriba,NM,White-faced Ibis,NULL,018702441,7/10/1993,00:00.0,1993,7,10,Stahlecker,NULL,NULL,Rio Arriba,NM,Eared Grebe,NULL,000402442,6/11/1994,00:00.0,1994,6,11,Stahlecker,NULL,NULL,Rio Arriba,NM,Eared Grebe,NULL,000402443,6/11/1994,00:00.0,1994,6,11,Stahlecker,NULL,NULL,Rio Arriba,NM,Western Grebe,NULL,000102444,6/28/1994,00:00.0,1994,6,28,Stahlecker,NULL,NULL,Rio Arriba,NM,White-faced Ibis,NULL,018701317,5/14/2010,00:00.0,2010,5,14,Spicer,NULL,NULL,Kootenai,ID,Great Blue Heron,NULL,019401318,4/21/2009,00:00.0,2009,4,21,Sauder/Gray,NULL,NULL,Nez Perce,ID,Great Blue Heron,NULL,019401319,4/21/2009,00:00.0,2009,4,21,Gray/Sauder,NULL,NULL,Idaho,ID,Great Blue Heron,NULL,019401320,4/21/2009,00:00.0,2009,4,21,Sauder/Gray,NULL,NULL,Nez Perce,ID,Great Blue Heron,NULL,019401321,4/21/2009,00:00.0,2009,4,21,Sauder/Gray,NULL,NULL,Nez Perce,ID,Great Blue Heron,NULL,019401322,4/21/2009,00:00.0,2009,4,21,Sauder/Gray,NULL,NULL,Nez Perce,ID,Great Blue Heron,NULL,019401323,5/19/2009,00:00.0,2009,5,19,Nielson et al.,NULL,NULL,Kootenai,ID,Great Blue Heron,NULL,019401324,5/12/2010,00:00.0,2010,5,12,Spicer,NULL,NULL,Kootenai,ID,Great Blue Heron,NULL,019401325,5/19/2009,00:00.0,2009,5,19,Nielson et al.,NULL,NULL,Kootenai,ID,Great Blue Heron,NULL,019401326,6/4/2009,00:00.0,2009,6,4,Biesen,NULL,NULL,Oneida,ID,Great Blue Heron,NULL,019401327,5/13/2009,00:00.0,2009,5,13,Wakkinen,NULL,NULL,Boundary,ID,Great Blue Heron,NULL,019401328,7/24/2010,00:00.0,2010,7,24,N/A,NULL,NULL,Canyon,ID,Western Grebe,NULL,000101329,8/2/2010,00:00.0,2010,8,2,N/A,NULL,NULL,Canyon,ID,Western Grebe,NULL,000101330,8/10/2010,00:00.0,2010,8,10,N/A,NULL,NULL,Canyon,ID,Western Grebe,NULL,000101331,5/15/2009,00:00.0,2009,5,15,Zerigue,NULL,NULL,Canyon,ID,Great Egret,NULL,019601332,5/15/2009,00:00.0,2009,5,15,Zerigue,NULL,NULL,Canyon,ID,Great Blue Heron,NULL,019401333,7/15/2010,00:00.0,2010,7,15,Ehlers/Runco,NULL,NULL,Owyhee,ID,White-faced Ibis,NULL,018701334,7/15/2010,00:00.0,2010,7,15,Ehlers/Runco,NULL,NULL,Owyhee,ID,Snowy Egret,NULL,019701335,7/15/2010,00:00.0,2010,7,15,Ehlers/Runco,NULL,NULL,Owyhee,ID,Heron or Egret Species,NULL,019451336,7/15/2010,00:00.0,2010,7,15,Ehlers/Runco,NULL,NULL,Owyhee,ID,Great Egret,NULL,019601337,7/15/2010,00:00.0,2010,7,15,Ehlers/Runco,NULL,NULL,Owyhee,ID,Forster's Tern,NULL,006901338,7/15/2010,00:00.0,2010,7,15,Ehlers/Runco,NULL,NULL,Owyhee,ID,Black Tern,NULL,007701339,4/28/2010,00:00.0,2010,4,28,Ehlers/Runco,NULL,NULL,Owyhee,ID,Great Blue Heron,NULL,019401340,4/10/2009,00:00.0,2009,4,10,McCarthy,NULL,NULL,Ada,ID,Great Blue Heron,NULL,019401341,5/10/2009,00:00.0,2009,5,10,McCarthy,NULL,NULL,Canyon,ID,Great Blue Heron,NULL,019401342,5/31/2009,00:00.0,2009,5,31,Sturts,NULL,NULL,Kootenai,ID,Great Blue Heron,NULL,019401343,6/22/2010,00:00.0,2010,6,22,Moulton et al.,NULL,NULL,Bonneville,ID,White-faced Ibis,NULL,018701344,6/22/2010,00:00.0,2010,6,22,Moulton et al.,NULL,NULL,Bonneville,ID,Franklin's Gull,NULL,005901345,4/29/2009,00:00.0,2009,4,29,Cavallaro,NULL,NULL,Fremont,ID,Great Blue Heron,NULL,019401346,6/5/2009,00:00.0,2009,6,5,Robison/Nielson,NULL,NULL,Fremont,ID,Ring-billed Gull,NULL,005401347,6/5/2009,00:00.0,2009,6,5,Robison/Nielson,NULL,NULL,Fremont,ID,Great Blue Heron,NULL,019401348,6/5/2009,00:00.0,2009,6,5,Robison/Nielson,NULL,NULL,Fremont,ID,Double-crested Cormorant,NULL,012001349,6/5/2009,00:00.0,2009,6,5,Robison/Nielson,NULL,NULL,Fremont,ID,Caspian Tern,NULL,006401350,6/5/2009,00:00.0,2009,6,5,Robison/Nielson,NULL,NULL,Fremont,ID,California Gull,NULL,005301351,6/5/2009,00:00.0,2009,6,5,Robison/Nielson,NULL,NULL,Fremont,ID,Black-crowned Night-Heron,NULL,020201352,7/2/2010,00:00.0,2010,7,2,Lucid,NULL,NULL,Boundary,ID,Black Tern,NULL,007701353,5/21/2009,00:00.0,2009,5,21,Wakkinen,NULL,NULL,Boundary,ID,Great Blue Heron,NULL,019401354,6/25/2010,00:00.0,2010,6,25,Evans-Mack,NULL,NULL,Valley,ID,Western Grebe,NULL,000101355,4/29/2009,00:00.0,2009,4,29,Derrig,NULL,NULL,Bonner,ID,Great Blue Heron,NULL,019401356,4/29/2009,00:00.0,2009,4,29,Derrig,NULL,NULL,Bonner,ID,Great Blue Heron,NULL,019401357,7/12/2010,00:00.0,2010,7,12,Wakkinen/Wakkinen,NULL,NULL,Bonner,ID,Western Grebe,NULL,000101358,4/27/2009,00:00.0,2009,4,27,Waterbury/Gadwa,NULL,NULL,Lehmi,ID,Great Blue Heron,NULL,019401359,6/3/2009,00:00.0,2009,6,3,Moulton et al.,NULL,NULL,Blaine,ID,Ring-billed Gull,NULL,005401360,6/3/2009,00:00.0,2009,6,3,Moulton et al.,NULL,NULL,Blaine,ID,Caspian Tern,NULL,006401361,6/3/2009,00:00.0,2009,6,3,Moulton et al.,NULL,NULL,Blaine,ID,California Gull,NULL,005301362,6/1/2010,00:00.0,2010,6,1,Moulton et al.,NULL,NULL,Jefferson,ID,White-faced Ibis,NULL,018701363,6/1/2010,00:00.0,2010,6,1,Moulton et al.,NULL,NULL,Jefferson,ID,Franklin's Gull,NULL,005901364,6/9/2009,00:00.0,2009,6,9,Nielson/Robison,NULL,NULL,Jefferson,ID,Ring-billed Gull,NULL,005401437,6/15/1993,00:00.0,1993,6,15,Trost,NULL,NULL,Bingham,ID,Great Egret,NULL,019601365,4/22/2009,00:00.0,2009,4,22,France et al.,NULL,NULL,Boundary,ID,Great Blue Heron,NULL,019401366,5/12/2009,00:00.0,2009,5,12,Biesen,NULL,NULL,Bannock,ID,Great Blue Heron,NULL,019401367,5/10/2009,00:00.0,2009,5,10,Cavallaro,NULL,NULL,Teton,ID,Great Blue Heron,NULL,019401368,6/3/2009,00:00.0,2009,6,3,Moulton et al.,NULL,NULL,Cassia,ID,Double-crested Cormorant,NULL,012001369,6/3/2009,00:00.0,2009,6,3,Moulton et al.,NULL,NULL,Cassia,ID,California Gull,NULL,005301370,6/3/2009,00:00.0,2009,6,3,Moulton et al.,NULL,NULL,Cassia,ID,American White Pelican,NULL,012501371,6/4/2010,00:00.0,2010,6,4,Moulton et al.,NULL,NULL,Cassia,ID,Double-crested Cormorant,NULL,012001372,6/4/2010,00:00.0,2010,6,4,Moulton et al.,NULL,NULL,Cassia,ID,American White Pelican,NULL,012501373,6/2/2011,00:00.0,2011,6,2,Wackenhut/Lonsinger,NULL,NULL,Cassia,ID,Double-crested Cormorant,NULL,012001374,6/2/2011,00:00.0,2011,6,2,Wackenhut/Lonsinger,NULL,NULL,Cassia,ID,Black-crowned Night-Heron,NULL,020201375,6/2/2011,00:00.0,2011,6,2,Wackenhut/Lonsinger,NULL,NULL,Cassia,ID,American White Pelican,NULL,012501376,6/3/2009,00:00.0,2009,6,3,Moulton et al.,NULL,NULL,Cassia,ID,Snowy Egret,NULL,019701377,6/3/2009,00:00.0,2009,6,3,Moulton et al.,NULL,NULL,Cassia,ID,Double-crested Cormorant,NULL,012001378,6/3/2009,00:00.0,2009,6,3,Moulton et al.,NULL,NULL,Cassia,ID,California Gull,NULL,005301379,6/3/2009,00:00.0,2009,6,3,Moulton et al.,NULL,NULL,Cassia,ID,American White Pelican,NULL,012501380,6/4/2010,00:00.0,2010,6,4,Moulton et al.,NULL,NULL,Cassia,ID,Double-crested Cormorant,NULL,012001381,6/4/2010,00:00.0,2010,6,4,Moulton et al.,NULL,NULL,Cassia,ID,American White Pelican,NULL,012501382,6/2/2011,00:00.0,2011,6,2,Wackenhut/Lonsinger,NULL,NULL,Cassia,ID,Snowy Egret,NULL,019701383,6/2/2011,00:00.0,2011,6,2,Wackenhut/Lonsinger,NULL,NULL,Cassia,ID,Great Blue Heron,NULL,019401384,6/2/2011,00:00.0,2011,6,2,Wackenhut/Lonsinger,NULL,NULL,Cassia,ID,Double-crested Cormorant,NULL,012001385,6/2/2011,00:00.0,2011,6,2,Wackenhut/Lonsinger,NULL,NULL,Cassia,ID,American White Pelican,NULL,012501386,6/3/2009,00:00.0,2009,6,3,Moulton/Fisher,NULL,NULL,Cassia,ID,American White Pelican,NULL,012501387,6/3/2009,00:00.0,2009,6,3,Moulton et al.,NULL,NULL,Cassia,ID,Great Blue Heron,NULL,019401388,6/3/2009,00:00.0,2009,6,3,Moulton/Nielson,NULL,NULL,Cassia,ID,Caspian Tern,NULL,006401389,6/3/2009,00:00.0,2009,6,3,Moulton/Nielson,NULL,NULL,Cassia,ID,California Gull,NULL,005301390,6/3/2009,00:00.0,2009,6,3,Moulton/Nielson,NULL,NULL,Cassia,ID,American White Pelican,NULL,012501391,6/4/2010,00:00.0,2010,6,4,Moulton,NULL,NULL,Cassia,ID,American White Pelican,NULL,012501392,6/2/2011,00:00.0,2011,6,2,Wackenhut/Lonsinger,NULL,NULL,Cassia,ID,American White Pelican,NULL,012501393,4/27/2009,00:00.0,2009,4,27,Nielson/Robison,NULL,NULL,Jefferson,ID,Great Blue Heron,NULL,019401394,4/27/2009,00:00.0,2009,4,27,Trost,NULL,NULL,Jefferson,ID,Double-crested Cormorant,NULL,012001395,7/2/2010,00:00.0,2010,7,2,Ehlers/Runco,NULL,NULL,Jefferson,ID,Western Grebe,NULL,000101396,6/2/2010,00:00.0,2010,6,2,Moulton et al.,NULL,NULL,Jefferson,ID,White-faced Ibis,NULL,018701397,6/2/2010,00:00.0,2010,6,2,Moulton et al.,NULL,NULL,Jefferson,ID,Franklin's Gull,NULL,005901398,4/26/2011,00:00.0,2011,4,26,Ward,NULL,NULL,Ada,ID,Great Blue Heron,NULL,019401399,4/26/2011,00:00.0,2011,4,26,Ward,NULL,NULL,Ada,ID,Double-crested Cormorant,NULL,012001400,6/8/2010,00:00.0,2010,6,8,Ehlers/Runco,NULL,NULL,Franklin,ID,White-faced Ibis,NULL,018701401,6/8/2010,00:00.0,2010,6,8,Ehlers/Runco,NULL,NULL,Franklin,ID,Franklin's Gull,NULL,005901402,4/7/2009,00:00.0,2009,4,7,Schoeberl/Potter,NULL,NULL,Payette,ID,Great Blue Heron,NULL,019401403,4/7/2009,00:00.0,2009,4,7,Schoeberl/Potter,NULL,NULL,Gem,ID,Great Blue Heron,NULL,019401404,4/7/2009,00:00.0,2009,4,7,Schoeberl/Potter,NULL,NULL,Gem,ID,Double-crested Cormorant,NULL,012001405,4/7/2009,00:00.0,2009,4,7,Schoeberl/Potter,NULL,NULL,Gem,ID,Great Blue Heron,NULL,019401406,4/7/2009,00:00.0,2009,4,7,Schoeberl/Potter,NULL,NULL,Gem,ID,Great Blue Heron,NULL,019401407,4/7/2009,00:00.0,2009,4,7,Schoeberl/Potter,NULL,NULL,Gem,ID,Great Egret,NULL,019601408,4/7/2009,00:00.0,2009,4,7,Schoeberl/Potter,NULL,NULL,Gem,ID,Great Blue Heron,NULL,019401409,4/7/2009,00:00.0,2009,4,7,Schoeberl/Potter,NULL,NULL,Gem,ID,Black-crowned Night-Heron,NULL,020201410,6/18/2009,00:00.0,2009,6,18,Robinson/Robinson,NULL,NULL,Bonner,ID,Great Blue Heron,NULL,019401411,5/25/2010,00:00.0,2010,5,25,Robinson/Robinson,NULL,NULL,Bonner,ID,Great Blue Heron,NULL,019401412,4/23/2009,00:00.0,2009,4,23,Waterbury et al.,NULL,NULL,Lehmi,ID,Great Blue Heron,NULL,019401413,5/6/2009,00:00.0,2009,5,6,Sauder,NULL,NULL,Idaho,ID,Great Blue Heron,NULL,019401414,4/22/2009,00:00.0,2009,4,22,Major/Painter,NULL,NULL,Custer,ID,Great Blue Heron,NULL,019401415,4/23/2009,00:00.0,2009,4,23,Waterbury et al.,NULL,NULL,Lehmi,ID,Great Blue Heron,NULL,019401416,4/22/2009,00:00.0,2009,4,22,Major/Painter,NULL,NULL,Custer,ID,Great Blue Heron,NULL,019401417,4/22/2009,00:00.0,2009,4,22,Major/Painter,NULL,NULL,Custer,ID,Great Blue Heron,NULL,019401418,4/22/2009,00:00.0,2009,4,22,Waterbury et al.,NULL,NULL,Lehmi,ID,Great Blue Heron,NULL,019401419,5/5/2009,00:00.0,2009,5,5,Seymour,NULL,NULL,Blaine,ID,Great Blue Heron,NULL,019401420,4/26/2009,00:00.0,2009,4,26,Moulton/Stiefel,NULL,NULL,Owyhee,ID,Snowy Egret,NULL,019701421,4/26/2009,00:00.0,2009,4,26,Moulton/Stiefel,NULL,NULL,Owyhee,ID,Great Egret,NULL,019601422,4/26/2009,00:00.0,2009,4,26,Moulton/Stiefel,NULL,NULL,Owyhee,ID,Great Blue Heron,NULL,019401423,4/26/2009,00:00.0,2009,4,26,Moulton/Stiefel,NULL,NULL,Owyhee,ID,Black-crowned Night-Heron,NULL,020201424,5/8/2009,00:00.0,2009,5,8,Wackenhut et al.,NULL,NULL,Bingham,ID,Great Blue Heron,NULL,019401425,4/8/2009,00:00.0,2009,4,8,Moulton/Runco,NULL,NULL,Canyon,ID,Double-crested Cormorant,NULL,012001426,6/5/2009,00:00.0,2009,6,5,Moulton/Kemner,NULL,NULL,Washington,ID,Ring-billed Gull,NULL,005401427,6/5/2009,00:00.0,2009,6,5,Moulton/Kemner,NULL,NULL,Washington,ID,California Gull,NULL,005301428,5/8/2009,00:00.0,2009,5,8,Wackenhut et al.,NULL,NULL,Bingham,ID,Great Blue Heron,NULL,019401429,4/21/2010,00:00.0,2010,4,21,Ehlers/Runco,NULL,NULL,Twin Falls,ID,Great Blue Heron,NULL,019401430,4/20/2009,00:00.0,2009,4,20,Cavallaro,NULL,NULL,Teton,ID,Great Blue Heron,NULL,019401431,5/1/2009,00:00.0,2009,5,1,Cavallaro,NULL,NULL,Teton,ID,Great Blue Heron,NULL,019401432,4/8/2009,00:00.0,2009,4,8,Evans-Mack,NULL,NULL,Washington,ID,Great Blue Heron,NULL,019401433,5/5/2009,00:00.0,2009,5,5,Seymour,NULL,NULL,Blaine,ID,Great Blue Heron,NULL,019401434,6/28/2010,00:00.0,2010,6,28,Moore,NULL,NULL,Bonner,ID,Black Tern,NULL,007701435,7/2/1993,00:00.0,1993,7,2,Trost,NULL,NULL,Caribou,ID,Clark's Grebe,NULL,000111436,7/4/1993,00:00.0,1993,7,4,Trost,NULL,NULL,Caribou,ID,Western Grebe,NULL,000101438,7/5/1993,00:00.0,1993,7,5,Trost,NULL,NULL,Bingham,ID,Ring-billed Gull,NULL,005401439,7/5/1993,00:00.0,1993,7,5,Trost,NULL,NULL,Bingham,ID,Ring-billed Gull,NULL,005401440,7/14/1993,00:00.0,1993,7,14,Trost,NULL,NULL,Bingham,ID,California Gull,NULL,005301441,5/16/2006,00:00.0,2006,5,16,Moulton,NULL,NULL,Bingham,ID,California Gull,NULL,005301442,5/16/2006,00:00.0,2006,5,16,Moulton,NULL,NULL,Bingham,ID,Ring-billed Gull,NULL,005401443,6/8/1993,00:00.0,1993,6,8,Trost,NULL,NULL,Bingham,ID,Black-crowned Night-Heron,NULL,020201444,6/8/1993,00:00.0,1993,6,8,Trost,NULL,NULL,Bingham,ID,Clark's Grebe,NULL,000111445,6/8/1993,00:00.0,1993,6,8,Trost,NULL,NULL,Bingham,ID,Snowy Egret,NULL,019701446,6/8/1993,00:00.0,1993,6,8,Trost,NULL,NULL,Bingham,ID,White-faced Ibis,NULL,018701447,6/15/1993,00:00.0,1993,6,15,Trost,NULL,NULL,Bingham,ID,White-faced Ibis,NULL,018701448,7/11/1993,00:00.0,1993,7,11,Trost,NULL,NULL,Bingham,ID,White-faced Ibis,NULL,018701449,7/2/1993,00:00.0,1993,7,2,Trost,NULL,NULL,Bannock,ID,Snowy Egret,NULL,019701450,7/1/1993,00:00.0,1993,7,1,Trost,NULL,NULL,Power,ID,Clark's Grebe,NULL,000111451,7/2/1993,00:00.0,1993,7,2,Trost,NULL,NULL,NULL,ID,Clark's Grebe,NULL,000111452,7/1/1993,00:00.0,1993,7,1,Trost,NULL,NULL,NULL,ID,Western Grebe,NULL,000101453,7/2/1993,00:00.0,1993,7,2,Trost,NULL,NULL,Bingham,ID,Black-crowned Night-Heron,NULL,020201454,7/10/1994,00:00.0,1994,7,10,Trost,NULL,NULL,Elmore,ID,Forster's Tern,NULL,006901455,6/11/1993,00:00.0,1993,6,11,Trost,NULL,NULL,Bannock,ID,Great Egret,NULL,019601456,7/11/1993,00:00.0,1993,7,11,Trost,NULL,NULL,Bannock,ID,Cattle Egret,NULL,020011457,6/19/1993,00:00.0,1993,6,19,Trost,NULL,NULL,Bear Lake,ID,Western Grebe,NULL,000101458,6/26/1993,00:00.0,1993,6,26,Trost,NULL,NULL,Bear Lake,ID,White-faced Ibis,NULL,018701459,7/8/1993,00:00.0,1993,7,8,Sjostrom,NULL,NULL,Bear Lake,ID,Black-crowned Night-Heron,NULL,020201460,7/8/1993,00:00.0,1993,7,8,Sjostrom,NULL,NULL,Bear Lake,ID,Cattle Egret,NULL,020011461,7/8/1993,00:00.0,1993,7,8,Sjostrom,NULL,NULL,Bear Lake,ID,Franklin's Gull,NULL,005901462,7/8/1993,00:00.0,1993,7,8,Sjostrom,NULL,NULL,Bear Lake,ID,Snowy Egret,NULL,019701463,7/8/1993,00:00.0,1993,7,8,Sjostrom,NULL,NULL,Bear Lake,ID,Western Grebe,NULL,000101464,7/8/1993,00:00.0,1993,7,8,Sjostrom,NULL,NULL,Bear Lake,ID,White-faced Ibis,NULL,018701465,7/10/1993,00:00.0,1993,7,10,Trost,NULL,NULL,Bear Lake,ID,Western Grebe,NULL,000101466,7/10/1993,00:00.0,1993,7,10,Trost,NULL,NULL,Bear Lake,ID,White-faced Ibis,NULL,018701467,6/26/1993,00:00.0,1993,6,26,Trost,NULL,NULL,Caribou,ID,White-faced Ibis,NULL,018701468,7/8/1993,00:00.0,1993,7,8,Sjostrom,NULL,NULL,Bear Lake,ID,California Gull,NULL,005301469,5/31/2006,00:00.0,2006,5,31,Moulton,NULL,NULL,Bear Lake,ID,California Gull,NULL,005301470,5/31/2006,00:00.0,2006,5,31,Moulton,NULL,NULL,Bear Lake,ID,Double-crested Cormorant,NULL,012001471,5/31/2006,00:00.0,2006,5,31,Moulton,NULL,NULL,Bear Lake,ID,Ring-billed Gull,NULL,005401472,5/30/2007,00:00.0,2007,5,30,Bjork/Heist,NULL,NULL,Bear Lake,ID,California Gull,NULL,005301473,5/30/2007,00:00.0,2007,5,30,Bjork/Heist,NULL,NULL,Bear Lake,ID,Double-crested Cormorant,Number of young = 56,012001474,5/30/2007,00:00.0,2007,5,30,Bjork/Heist,NULL,NULL,Bear Lake,ID,Ring-billed Gull,NULL,005401475,6/9/1993,00:00.0,1993,6,9,Hlavaty,NULL,NULL,Caribou,ID,Western Grebe,NULL,000101476,7/4/1993,00:00.0,1993,7,4,Trost,NULL,NULL,Caribou,ID,Black Tern,NULL,007701477,6/19/1993,00:00.0,1993,6,19,Hlavaty,NULL,NULL,Caribou,ID,American White Pelican,NULL,012501478,6/19/1993,00:00.0,1993,6,19,Hlavaty,NULL,NULL,Caribou,ID,Black-crowned Night-Heron,NULL,020201479,6/19/1993,00:00.0,1993,6,19,Hlavaty,NULL,NULL,NULL,ID,California Gull,NULL,005301480,6/19/1993,00:00.0,1993,6,19,Hlavaty,NULL,NULL,Caribou,ID,Cattle Egret,NULL,020011481,6/19/1993,00:00.0,1993,6,19,Hlavaty,NULL,NULL,Caribou,ID,Snowy Egret,NULL,019701482,7/4/1993,00:00.0,1993,7,4,Trost,NULL,NULL,Caribou,ID,California Gull,NULL,005301483,7/4/1993,00:00.0,1993,7,4,Trost,NULL,NULL,Caribou,ID,Caspian Tern,NULL,006401484,8/11/1993,00:00.0,1993,8,11,Trost,NULL,NULL,Caribou,ID,Snowy Egret,NULL,019701485,6/1/2006,00:00.0,2006,6,1,Moulton,NULL,NULL,Caribou,ID,American White Pelican,NULL,012501486,6/1/2006,00:00.0,2006,6,1,Moulton,NULL,NULL,Caribou,ID,Black-crowned Night-Heron,NULL,020201487,6/1/2006,00:00.0,2006,6,1,Moulton,NULL,NULL,Caribou,ID,California Gull,NULL,005301488,6/1/2006,00:00.0,2006,6,1,Moulton,NULL,NULL,Caribou,ID,Caspian Tern,NULL,006401489,6/1/2006,00:00.0,2006,6,1,Moulton,NULL,NULL,Caribou,ID,Double-crested Cormorant,NULL,012001490,6/1/2006,00:00.0,2006,6,1,Moulton,NULL,NULL,Caribou,ID,Great Blue Heron,NULL,019401491,6/1/2006,00:00.0,2006,6,1,Moulton,NULL,NULL,Caribou,ID,Ring-billed Gull,NULL,005401492,6/1/2006,00:00.0,2006,6,1,Moulton,NULL,NULL,Caribou,ID,Snowy Egret,NULL,019701493,5/30/2007,00:00.0,2007,5,30,Moulton/Leist,NULL,NULL,Caribou,ID,American White Pelican,NULL,012501494,5/30/2007,00:00.0,2007,5,30,Moulton/Leist,NULL,NULL,Caribou,ID,Caspian Tern,NULL,006401495,5/30/2007,00:00.0,2007,5,30,Moulton/Leist,NULL,NULL,Caribou,ID,Double-crested Cormorant,NULL,012001496,6/3/2008,00:00.0,2008,6,3,Moulton,NULL,NULL,Caribou,ID,American White Pelican,NULL,012501497,6/3/2008,00:00.0,2008,6,3,Moulton,NULL,NULL,Caribou,ID,Caspian Tern,NULL,006401498,6/3/2008,00:00.0,2008,6,3,Moulton,NULL,NULL,Caribou,ID,Double-crested Cormorant,NULL,012001499,6/3/2008,00:00.0,2008,6,3,Moulton,NULL,NULL,Caribou,ID,Heron or Egret species,NULL,019451500,6/18/2008,00:00.0,2008,6,18,Wackenhut/Grunder,NULL,NULL,Caribou,ID,American White Pelican,NULL,012501501,5/30/2007,00:00.0,2007,5,30,Wackenhut/Nelson,NULL,NULL,Caribou,ID,American White Pelican,NULL,012501502,6/3/2008,00:00.0,2008,6,3,Moulton,NULL,NULL,Caribou,ID,American White Pelican,NULL,012501503,6/3/2008,00:00.0,2008,6,3,Moulton,NULL,NULL,Caribou,ID,Heron or Egret species,NULL,NULL1504,6/18/2008,00:00.0,2008,6,18,Moulton/Weinandt,NULL,NULL,Caribou,ID,American White Pelican,NULL,01250377,6/4/2010,00:00.0,2010,6,4,Klute,NULL,NULL,Adams,CO,Double-crested Cormorant,NULL,01200378,6/4/2010,00:00.0,2010,6,4,Klute,NULL,NULL,Adams,CO,Great Blue Heron,NULL,01940379,6/4/2010,00:00.0,2010,6,4,Klute,NULL,NULL,Adams,CO,Black-crowned Night-Heron,NULL,02020380,7/10/2009,00:00.0,2009,7,10,Luke,NULL,NULL,Moffat,CO,Great Blue Heron,NULL,01940381,4/20/2009,00:00.0,2009,4,20,Huwer,NULL,NULL,Larimer,CO,Great Blue Heron,NULL,01940382,4/21/2010,00:00.0,2010,4,21,Huwer,NULL,NULL,Larimer,CO,Great Blue Heron,NULL,01940383,4/24/2009,00:00.0,2009,4,24,Beason,NULL,NULL,Delta,CO,Great Blue Heron,NULL,01940384,4/30/2009,00:00.0,2009,4,30,George,NULL,NULL,Boulder,CO,Great Blue Heron,NULL,01940385,4/25/2010,00:00.0,2010,4,25,George,NULL,NULL,Boulder,CO,Great Blue Heron,NULL,01940386,4/30/2009,00:00.0,2009,4,30,George,NULL,NULL,Boulder,CO,Great Blue Heron,NULL,01940387,4/24/2010,00:00.0,2010,4,24,George,NULL,NULL,Boulder,CO,Great Blue Heron,NULL,01940388,4/30/2009,00:00.0,2009,4,30,George,NULL,NULL,Boulder,CO,Great Blue Heron,NULL,01940389,4/24/2010,00:00.0,2010,4,24,George,NULL,NULL,Boulder,CO,Great Blue Heron,NULL,01940390,5/15/2009,00:00.0,2009,5,15,Hundertmark,NULL,NULL,Jackson,CO,Western Grebe,NULL,00010391,7/10/2009,00:00.0,2009,7,10,Hundertmark,NULL,NULL,Jackson,CO,Double-crested Cormorant,NULL,01200392,7/10/2009,00:00.0,2009,7,10,Hundertmark,NULL,NULL,Jackson,CO,Forster's Tern,NULL,00690393,8/1/2009,00:00.0,2009,8,1,Hundertmark,NULL,NULL,Jackson,CO,Eared Grebe,NULL,00040394,8/1/2009,00:00.0,2009,8,1,Hundertmark,NULL,NULL,Jackson,CO,California Gull,NULL,00530395,8/1/2009,00:00.0,2009,8,1,Hundertmark,NULL,NULL,Jackson,CO,American White Pelican,NULL,01250396,5/14/2010,00:00.0,2010,5,14,Hundertmark,NULL,NULL,Jackson,CO,California Gull,NULL,00530397,6/11/2010,00:00.0,2010,6,11,Hundertmark,NULL,NULL,Jackson,CO,Black-crowned Night-Heron,NULL,02020398,6/11/2010,00:00.0,2010,6,11,Hundertmark,NULL,NULL,Jackson,CO,Double-crested Cormorant,NULL,01200399,6/11/2010,00:00.0,2010,6,11,Hundertmark,NULL,NULL,Jackson,CO,Franklin's Gull,NULL,00590400,6/11/2010,00:00.0,2010,6,11,Hundertmark,NULL,NULL,Jackson,CO,Black Tern,NULL,00770401,7/9/2010,00:00.0,2010,7,9,Hundertmark,NULL,NULL,Jackson,CO,Western Grebe,NULL,00010402,8/6/2010,00:00.0,2010,8,6,Hundertmark,NULL,NULL,Jackson,CO,Eared Grebe,NULL,00040403,8/6/2010,00:00.0,2010,8,6,Hundertmark,NULL,NULL,Jackson,CO,American White Pelican,NULL,01250404,8/19/2009,00:00.0,2009,8,19,Jones,NULL,NULL,Teller,CO,Black-crowned Night-Heron,NULL,02020405,4/22/2009,00:00.0,2009,4,22,Ommeren,NULL,NULL,Jefferson,CO,Double-crested Cormorant,NULL,01200406,4/22/2009,00:00.0,2009,4,22,Ommeren,NULL,NULL,Jefferson,CO,Great Blue Heron,NULL,01940407,4/22/2009,00:00.0,2009,4,22,Ommeren,NULL,NULL,Jefferson,CO,Black-crowned Night-Heron,NULL,02020408,4/4/2010,00:00.0,2010,4,4,Ommeren,NULL,NULL,Jefferson,CO,Double-crested Cormorant,NULL,01200409,4/4/2010,00:00.0,2010,4,4,Ommeren,NULL,NULL,Jefferson,CO,Great Blue Heron,NULL,01940410,5/25/2011,00:00.0,2011,5,25,Rawinski,NULL,NULL,Conejos,CO,Great Blue Heron,NULL,01940411,4/18/2009,00:00.0,2009,4,18,Pals,NULL,NULL,El Paso,CO,Great Blue Heron,NULL,01940412,5/31/2009,00:00.0,2009,5,31,Hilkey,NULL,NULL,Rio Blanco,CO,Great Blue Heron,NULL,01940413,5/10/2010,00:00.0,2010,5,10,HIlkey,NULL,NULL,Rio Blanco,CO,Great Blue Heron,NULL,01940414,5/2/2010,00:00.0,2010,5,2,Hilkey,NULL,NULL,Rio Blanco,CO,Great Blue Heron,NULL,01940415,4/25/2009,00:00.0,2009,4,25,Olson,NULL,NULL,Weld,CO,Great Blue Heron,NULL,01940416,4/25/2009,00:00.0,2009,4,25,Olson,NULL,NULL,Weld,CO,Double-crested Cormorant,NULL,01200417,4/25/2009,00:00.0,2009,4,25,Olson,NULL,NULL,Weld,CO,Black-crowned Night-Heron,NULL,02020418,4/17/2010,00:00.0,2010,4,17,Olson,NULL,NULL,Weld,CO,Great Blue Heron,NULL,01940419,4/17/2010,00:00.0,2010,4,17,Olson,NULL,NULL,Weld,CO,Double-crested Cormorant,NULL,01200420,4/25/2009,00:00.0,2009,4,25,Olson,NULL,NULL,Weld,CO,Double-crested Cormorant,NULL,01200421,4/25/2009,00:00.0,2009,4,25,Olson,NULL,NULL,Weld,CO,Great Blue Heron,NULL,01940422,4/25/2009,00:00.0,2009,4,25,Olson,NULL,NULL,Weld,CO,Black-crowned Night-Heron,NULL,02020423,4/25/2009,00:00.0,2009,4,25,Olson,NULL,NULL,Weld,CO,Great Egret,NULL,01960424,4/17/2010,00:00.0,2010,4,17,Olson,NULL,NULL,Weld,CO,American White Pelican,NULL,01250425,4/17/2010,00:00.0,2010,4,17,Olson,NULL,NULL,Weld,CO,Double-crested Cormorant,NULL,01200426,4/17/2010,00:00.0,2010,4,17,Olson,NULL,NULL,Weld,CO,Great Blue Heron,NULL,01940427,NULL,,2010,NULL,NULL,Miller,NULL,NULL,Rio Grande,CO,White-faced Ibis,NULL,01870428,NULL,,2010,NULL,NULL,Miller,NULL,NULL,Rio Grande,CO,Snowy Egret,NULL,01970429,NULL,,2010,NULL,NULL,Miller,NULL,NULL,Rio Grande,CO,Black-crowned Night-Heron,NULL,02020430,5/24/2011,00:00.0,2011,5,24,Rawinski,NULL,NULL,Rio Grande,CO,White-faced Ibis,NULL,01870431,5/31/2011,00:00.0,2011,5,31,Rawinski,NULL,NULL,Rio Grande,CO,White-faced Ibis,NULL,01870432,5/31/2011,00:00.0,2011,5,31,Rawinski,NULL,NULL,Rio Grande,CO,Snowy Egret,NULL,01970433,5/31/2011,00:00.0,2011,5,31,Rawinski,NULL,NULL,Rio Grande,CO,Black-crowned Night-Heron,NULL,02020434,5/31/2011,00:00.0,2011,5,31,Rawinski,NULL,NULL,Rio Grande,CO,Eared Grebe,NULL,00040435,5/24/2011,00:00.0,2011,5,24,Rawinski,NULL,NULL,Conejos,CO,Snowy Egret,NULL,01970436,5/24/2011,00:00.0,2011,5,24,Rawinski,NULL,NULL,Rio Grande,CO,Eared Grebe,NULL,00040437,6/6/2011,00:00.0,2011,6,6,Rawinski,NULL,NULL,Rio Grande,CO,Black-crowned Night-Heron,NULL,02020438,6/6/2011,00:00.0,2011,6,6,Rawinski,NULL,NULL,Rio Grande,CO,White-faced Ibis,NULL,01870439,6/27/2010,00:00.0,2010,6,27,Beason,NULL,NULL,Archuleta,CO,Western Grebe,NULL,00010440,7/13/2009,00:00.0,2009,7,13,Hundertmark,NULL,NULL,Jackson,CO,Great Blue Heron,NULL,01940441,5/16/2010,00:00.0,2010,5,16,Hundertmark,NULL,NULL,Jackson,CO,Great Blue Heron,NULL,01940442,6/13/2009,00:00.0,2009,6,13,Vidal,NULL,NULL,Pitkin,CO,Great Blue Heron,NULL,01940443,5/18/2010,00:00.0,2010,5,18,Hopton,NULL,NULL,Pitkin,CO,Great Blue Heron,NULL,01940444,5/18/2010,00:00.0,2010,5,18,Hopton,NULL,NULL,Boulder,CO,Great Blue Heron,NULL,01940445,NULL,,2009,NULL,NULL,NULL,NULL,NULL,Delta,CO,Great Blue Heron,NULL,01940446,6/9/2010,00:00.0,2010,6,9,Garrison,NULL,NULL,Delta,CO,Great Blue Heron,NULL,01940447,NULL,,2009,NULL,NULL,Dahl,NULL,NULL,Garfield,CO,Great Blue Heron,NULL,01940448,5/8/2010,00:00.0,2010,5,8,Dahl,NULL,NULL,Garfield,CO,Great Blue Heron,NULL,01940449,6/19/2009,00:00.0,2009,6,19,Burger,NULL,NULL,Douglas,CO,Great Blue Heron,NULL,01940450,5/21/2009,00:00.0,2009,5,21,Brummer,NULL,NULL,Gunnison,CO,Great Blue Heron,NULL,01940451,4/10/2010,00:00.0,2010,4,10,Fisher,NULL,NULL,Gunnison,CO,Great Blue Heron,NULL,01940452,8/1/2009,00:00.0,2009,8,1,Hundertmark,NULL,NULL,Jackson,CO,Eared Grebe,NULL,00040453,7/11/2010,00:00.0,2010,7,11,Hundertmark,NULL,NULL,Jackson,CO,Eared Grebe,NULL,00040454,5/3/2009,00:00.0,2009,5,3,Lefko,NULL,NULL,Weld,CO,Great Blue Heron,NULL,01940455,5/3/2009,00:00.0,2009,5,3,Lefko,NULL,NULL,Weld,CO,Double-crested Cormorant,NULL,01200456,5/6/2009,00:00.0,2009,5,6,Hilkey,NULL,NULL,Rio Blanco,CO,Great Blue Heron,NULL,01940457,5/10/2010,00:00.0,2010,5,10,HIlkey,NULL,NULL,Rio Blanco,CO,Great Blue Heron,NULL,01940458,6/1/2009,00:00.0,2009,6,1,Figueroa,NULL,NULL,Washington,CO,Great Blue Heron,NULL,01940459,7/31/2010,00:00.0,2010,7,31,Wild/eBird,NULL,NULL,Washington,CO,Black Tern,NULL,00770460,6/21/2009,00:00.0,2009,6,21,Bell,NULL,NULL,Jefferson,CO,Double-crested Cormorant,NULL,01200461,6/21/2009,00:00.0,2009,6,21,Bell,NULL,NULL,Jefferson,CO,Great Blue Heron,NULL,01940462,5/16/2010,00:00.0,2010,5,16,Bell,NULL,NULL,Jefferson,CO,Double-crested Cormorant,NULL,01200463,5/16/2010,00:00.0,2010,5,16,Bell,NULL,NULL,Jefferson,CO,Great Blue Heron,NULL,01940464,4/29/2009,00:00.0,2009,4,29,Nelson,NULL,NULL,Otero,CO,Great Blue Heron,NULL,01940465,4/10/2010,00:00.0,2010,4,10,Nelson,NULL,NULL,Otero,CO,Great Blue Heron,NULL,01940466,5/14/2009,00:00.0,2009,5,14,Beason,NULL,NULL,Ouray,CO,Great Blue Heron,NULL,01940467,5/12/2010,00:00.0,2010,5,12,Beason,NULL,NULL,Ouray,CO,Great Blue Heron,NULL,01940468,5/8/2009,00:00.0,2009,5,8,Patrick,NULL,NULL,Garfield,CO,Great Blue Heron,NULL,01940469,5/2/2010,00:00.0,2010,5,2,Patrick,NULL,NULL,Garfield,CO,Great Blue Heron,NULL,01940470,5/21/2009,00:00.0,2009,5,21,Hilkey,NULL,NULL,Rio Blanco,CO,Great Blue Heron,NULL,01940471,5/3/2010,00:00.0,2010,5,3,Hilkey,NULL,NULL,Rio Blanco,CO,Great Blue Heron,NULL,01940472,4/13/2009,00:00.0,2009,4,13,Bond,NULL,NULL,La Plata,CO,Great Blue Heron,NULL,01940473,4/14/2009,00:00.0,2009,4,14,Lowsky,NULL,NULL,Eagle,CO,Great Blue Heron,NULL,01940474,5/28/2010,00:00.0,2010,5,28,Bieble,NULL,NULL,Eagle,CO,Great Blue Heron,NULL,01940475,5/25/2009,00:00.0,2009,5,25,Beason,NULL,NULL,Delta,CO,Great Blue Heron,NULL,01940476,5/12/2010,00:00.0,2010,5,12,Beason,NULL,NULL,Delta,CO,Great Blue Heron,NULL,01940477,6/4/2011,00:00.0,2011,6,4,Rawinski,NULL,NULL,Saguache,CO,Eared Grebe,NULL,00040478,6/4/2011,00:00.0,2011,6,4,Rawinski,NULL,NULL,Saguache,CO,White-faced Ibis,NULL,01870479,6/4/2011,00:00.0,2011,6,4,Rawinski,NULL,NULL,Saguache,CO,American White Pelican,NULL,01250480,5/20/2009,00:00.0,2009,5,20,Brummer,NULL,NULL,Gunnison,CO,Great Blue Heron,NULL,01940481,5/8/2010,00:00.0,2010,5,8,Fisher,NULL,NULL,Gunnison,CO,Great Blue Heron,NULL,01940482,6/7/2011,00:00.0,2011,6,7,Rawinski,NULL,NULL,Alamosa,CO,Western Grebe,NULL,00010483,6/7/2011,00:00.0,2011,6,7,Rawinski,NULL,NULL,Alamosa,CO,Eared Grebe,NULL,00040484,4/5/2009,00:00.0,2009,4,5,Woodward,NULL,NULL,Mesa,CO,Great Blue Heron,NULL,01940485,4/18/2010,00:00.0,2010,4,18,Woodward,NULL,NULL,Mesa,CO,Great Blue Heron,NULL,01940486,8/21/2010,00:00.0,2010,8,21,Rawinski,NULL,NULL,Costilla,CO,Eared Grebe,NULL,00040487,8/21/2010,00:00.0,2010,8,21,Rawinski,NULL,NULL,Costilla,CO,Western Grebe,NULL,00010488,6/8/2011,00:00.0,2011,6,8,Rawinski,NULL,NULL,Costilla,CO,Eared Grebe,NULL,00040489,6/8/2011,00:00.0,2011,6,8,Rawinski,NULL,NULL,Costilla,CO,Western Grebe,NULL,00010490,6/8/2011,00:00.0,2011,6,8,Rawinski,NULL,NULL,Costilla,CO,Snowy Egret,NULL,01970491,6/7/2011,00:00.0,2011,6,7,Rawinski,NULL,NULL,Conejos,CO,Black Tern,NULL,00770492,4/24/2009,00:00.0,2009,4,24,George,NULL,NULL,Weld,CO,Great Blue Heron,NULL,01940493,4/24/2009,00:00.0,2009,4,24,George,NULL,NULL,Weld,CO,Black-crowned Night-Heron,NULL,02020494,4/26/2010,00:00.0,2010,4,26,George,NULL,NULL,Weld,CO,Great Blue Heron,NULL,01940495,4/26/2010,00:00.0,2010,4,26,George,NULL,NULL,Weld,CO,Black-crowned Night-Heron,NULL,02020496,7/14/2009,00:00.0,2009,7,14,Litteral,NULL,NULL,Routt,CO,Western Grebe,NULL,00010497,4/28/2009,00:00.0,2009,4,28,Gano,NULL,NULL,Larimer,CO,Great Blue Heron,NULL,01940498,4/8/2010,00:00.0,2010,4,8,Gano,NULL,NULL,Larimer,CO,Great Blue Heron,NULL,01940499,6/25/2009,00:00.0,2009,6,25,Beason,NULL,NULL,Delta,CO,Western Grebe,NULL,00010500,7/12/2009,00:00.0,2009,7,12,Leatherman,NULL,NULL,Prowers,CO,Black Tern,NULL,00770501,NULL,,2010,NULL,NULL,Maeda,NULL,NULL,Larimer,CO,Western Grebe,NULL,00010502,NULL,,2010,NULL,NULL,Maeda,NULL,NULL,Larimer,CO,Double-crested Cormorant,NULL,01200503,5/16/2009,00:00.0,2009,5,16,Maeda,NULL,NULL,Larimer,CO,Double-crested Cormorant,NULL,01200504,7/6/2009,00:00.0,2009,7,6,Maeda,NULL,NULL,Larimer,CO,Western Grebe,NULL,00010505,6/7/2011,00:00.0,2011,6,7,Rawinski,NULL,NULL,Saguache,CO,Black Tern,NULL,00770506,7/25/2010,00:00.0,2010,7,25,Miller,NULL,NULL,Weld,CO,Western Grebe,NULL,00010507,7/25/2010,00:00.0,2010,7,25,Miller,NULL,NULL,Weld,CO,Clark's Grebe,NULL,00011508,NULL,,2009,NULL,NULL,Dexter,NULL,NULL,Montrose,CO,Great Blue Heron,NULL,01940509,4/25/2010,00:00.0,2010,4,25,Dexter,NULL,NULL,Montrose,CO,Great Blue Heron,NULL,01940510,7/25/2010,00:00.0,2010,7,25,Bradley,NULL,NULL,Mesa,CO,Western Grebe,NULL,00010511,3/29/2009,00:00.0,2009,3,29,Takamine,NULL,NULL,Boulder,CO,Great Blue Heron,NULL,01940512,4/24/2010,00:00.0,2010,4,24,Cannon,NULL,NULL,Boulder,CO,Great Blue Heron,NULL,01940513,6/15/2009,00:00.0,2009,6,15,Hundertmark,NULL,NULL,Jackson,CO,California Gull,NULL,00530514,6/15/2009,00:00.0,2009,6,15,Hundertmark,NULL,NULL,Jackson,CO,Franklin's Gull,NULL,00590515,7/12/2009,00:00.0,2009,7,12,Hundertmark,NULL,NULL,Jackson,CO,Double-crested Cormorant,NULL,01200516,8/2/2009,00:00.0,2009,8,2,Hundertmark,NULL,NULL,Jackson,CO,Eared Grebe,NULL,00040517,8/2/2009,00:00.0,2009,8,2,Hundertmark,NULL,NULL,Jackson,CO,Snowy Egret,NULL,01970518,8/2/2009,00:00.0,2009,8,2,Hundertmark,NULL,NULL,Jackson,CO,Western Grebe,NULL,00010519,5/16/2010,00:00.0,2010,5,16,Hundertmark,NULL,NULL,Jackson,CO,Franklin's Gull,NULL,00590520,6/12/2010,00:00.0,2010,6,12,Hundertmark,NULL,NULL,Jackson,CO,California Gull,NULL,00530521,6/12/2010,00:00.0,2010,6,12,Hundertmark,NULL,NULL,Jackson,CO,Double-crested Cormorant,NULL,01200522,6/12/2010,00:00.0,2010,6,12,Hundertmark,NULL,NULL,Jackson,CO,Western Grebe,NULL,00010523,7/10/2010,00:00.0,2010,7,10,Hundertmark,NULL,NULL,Jackson,CO,Eared Grebe,NULL,00040524,7/10/2010,00:00.0,2010,7,10,Hundertmark,NULL,NULL,Jackson,CO,Forster's Tern,NULL,00690525,7/10/2010,00:00.0,2010,7,10,Hundertmark,NULL,NULL,Jackson,CO,Snowy Egret,NULL,01970526,7/12/2009,00:00.0,2009,7,12,Hundertmark,NULL,NULL,Jackson,CO,American White Pelican,NULL,01250527,8/7/2010,00:00.0,2010,8,7,Hundertmark,NULL,NULL,Jackson,CO,American White Pelican,NULL,01250528,NULL,,2010,NULL,NULL,Lynch,NULL,NULL,Jefferson,CO,Great Blue Heron,NULL,01940529,4/10/2009,00:00.0,2009,4,10,Neubaum,NULL,NULL,Mesa,CO,Great Blue Heron,NULL,01940530,4/22/2010,00:00.0,2010,4,22,Neubaum,NULL,NULL,Mesa,CO,Great Blue Heron,NULL,01940531,4/19/2009,00:00.0,2009,4,19,Hilkey,NULL,NULL,Routt,CO,Great Blue Heron,NULL,01940532,4/15/2010,00:00.0,2010,4,15,Glabach,NULL,NULL,Larimer,CO,Great Blue Heron,NULL,01940533,4/8/2009,00:00.0,2009,4,8,Lowsky,NULL,NULL,Pitkin,CO,Great Blue Heron,NULL,01940534,8/1/2010,00:00.0,2010,8,1,Lowsky,NULL,NULL,Pitkin,CO,Great Blue Heron,NULL,01940535,5/29/2003,00:00.0,2003,5,29,NULL,NULL,NULL,Kiowa,CO,White-faced Ibis,NULL,01870536,6/27/2003,00:00.0,2003,6,27,Wilson,NULL,NULL,Kiowa,CO,White-faced Ibis,NULL,01870537,NULL,,2001,NULL,NULL,Johnson,NULL,NULL,Jackson,CO,Eared Grebe,NULL,00040538,NULL,,2005,NULL,NULL,NULL,NULL,NULL,Jackson,CO,Eared Grebe,NULL,00040539,7/23/2002,00:00.0,2002,7,23,NULL,NULL,NULL,Jackson,CO,Eared Grebe,NULL,00040540,NULL,,2005,NULL,NULL,NULL,NULL,NULL,Jackson,CO,Eared Grebe,NULL,00040541,7/10/2004,00:00.0,2004,7,10,NULL,NULL,NULL,Jackson,CO,Eared Grebe,NULL,00040542,NULL,,2005,NULL,NULL,NULL,NULL,NULL,Jackson,CO,Black-crowned Night-Heron,NULL,02020543,NULL,,2005,NULL,NULL,NULL,NULL,NULL,Jackson,CO,Eared Grebe,NULL,00040544,7/13/1999,00:00.0,1999,7,13,NULL,NULL,NULL,Jackson,CO,Eared Grebe,NULL,00040545,7/15/2000,00:00.0,2000,7,15,NULL,NULL,NULL,Jackson,CO,Eared Grebe,NULL,00040546,NULL,,1987,NULL,NULL,Colonial Bird Register,NULL,NULL,Jackson,CO,Black-crowned Night-Heron,NULL,02020547,NULL,,1988,NULL,NULL,Colonial Bird Register,NULL,NULL,Jackson,CO,Black-crowned Night-Heron,NULL,02020548,6/26/1989,00:00.0,1989,6,26,NULL,NULL,NULL,Jackson,CO,Black-crowned Night-Heron,NULL,02020549,7/14/1999,00:00.0,1999,7,14,NULL,NULL,NULL,Jackson,CO,Black-crowned Night-Heron,NULL,02020550,7/15/2000,00:00.0,2000,7,15,NULL,NULL,NULL,Jackson,CO,Black-crowned Night-Heron,NULL,02020551,7/17/2001,00:00.0,2001,7,17,NULL,NULL,NULL,Jackson,CO,Black-crowned Night-Heron,NULL,02020552,NULL,,2007,NULL,NULL,Miksh,NULL,NULL,Larimer,CO,Great Blue Heron,NULL,01940553,4/6/2004,00:00.0,2004,4,6,NULL,NULL,NULL,Larimer,CO,Great Blue Heron,NULL,01940554,4/11/2005,00:00.0,2005,4,11,NULL,NULL,NULL,Larimer,CO,Great Blue Heron,NULL,01940555,NULL,,2000,NULL,NULL,NULL,NULL,NULL,Larimer,CO,Great Blue Heron,NULL,01940556,NULL,,2008,NULL,NULL,District Wildlife Manager,NULL,NULL,Weld,CO,Great Blue Heron,NULL,01940557,NULL,,2005,NULL,NULL,NULL,NULL,NULL,Delta,CO,Great Blue Heron,NULL,01940558,NULL,,1999,NULL,NULL,NULL,NULL,NULL,Douglas,CO,Great Blue Heron,NULL,01940559,NULL,,2003,NULL,NULL,NULL,NULL,NULL,Douglas,CO,Great Blue Heron,NULL,01940560,NULL,,2006,NULL,NULL,Metz,NULL,NULL,Douglas,CO,Great Blue Heron,NULL,01940561,NULL,,2007,NULL,NULL,NULL,NULL,NULL,Douglas,CO,Great Blue Heron,NULL,01940562,5/22/2005,00:00.0,2005,5,22,NULL,NULL,NULL,Douglas,CO,Great Blue Heron,NULL,01940563,7/22/1998,00:00.0,1998,7,22,NULL,NULL,NULL,Mesa,CO,Eared Grebe,NULL,00040564,8/12/1999,00:00.0,1999,8,12,NULL,NULL,NULL,Mesa,CO,Eared Grebe,NULL,000403385,5/15/1905,00:00.0,1905,5,15,Behle 1958,NULL,NULL,Davis,UT,California Gull,NULL,005303386,5/15/1905,00:00.0,1905,5,15,Behle 1958,NULL,NULL,Davis,UT,Great Blue Heron,NULL,019403387,NULL,,1983,NULL,NULL,Robinette et al. 1993,NULL,NULL,Davis,UT,California Gull,NULL,005303388,NULL,,1986,NULL,NULL,Robinette et al. 1993,NULL,NULL,Davis,UT,California Gull,NULL,005303389,NULL,,1987,NULL,NULL,Robinette et al. 1993,NULL,NULL,Davis,UT,California Gull,NULL,005303390,NULL,,1989,NULL,NULL,Robinette et al. 1993,NULL,NULL,Davis,UT,California Gull,NULL,005303391,NULL,,1990,NULL,NULL,Robinette et al. 1993,NULL,NULL,Davis,UT,California Gull,NULL,005303392,NULL,,1991,NULL,NULL,Robinette et al. 1993,NULL,NULL,Davis,UT,California Gull,NULL,005303393,NULL,,1993,NULL,NULL,Robinette et al. 1993,NULL,NULL,Davis,UT,California Gull,NULL,005303394,5/10/1906,00:00.0,1906,5,10,Behle 1958,NULL,NULL,Davis,UT,Great Blue Heron,NULL,019403395,6/25/1934,00:00.0,1934,6,25,Behle 1958,NULL,NULL,Davis,UT,California Gull,NULL,005303396,4/10/1935,00:00.0,1935,4,10,Behle 1958,NULL,NULL,Davis,UT,Great Blue Heron,NULL,019403397,5/7/1937,00:00.0,1937,5,7,Behle 1958,NULL,NULL,Davis,UT,California Gull,NULL,005303398,NULL,,1907,5,NULL,Behle 1958,NULL,NULL,Davis,UT,California Gull,SurveyDate: 5/-/1907,005303399,NULL,,1907,5,NULL,Behle 1958,NULL,NULL,Davis,UT,Great Blue Heron,SurveyDate:5/-/1907,019403400,6/26/2009,00:00.0,2009,6,26,NULL,NULL,NULL,Teton,WY,Great Blue Heron,NULL,019403401,6/26/2010,00:00.0,2010,6,26,NULL,NULL,NULL,Teton,WY,Great Blue Heron,NULL,019403402,6/22/2011,00:00.0,2011,6,22,NULL,NULL,NULL,Teton,WY,Great Blue Heron,NULL,019403403,6/30/2009,00:00.0,2009,6,30,Kilpatrick,NULL,NULL,Albany,WY,American White Pelican,NULL,012503404,6/30/2010,00:00.0,2010,6,30,Shill,NULL,NULL,Albany,WY,American White Pelican,NULL,012503405,7/7/2011,00:00.0,2011,7,7,NULL,NULL,NULL,Crook,WY,Great Blue Heron,NULL,019403406,7/7/2011,00:00.0,2011,7,7,NULL,NULL,NULL,Crook,WY,Great Blue Heron,NULL,019403407,5/20/2010,00:00.0,2010,5,20,NULL,NULL,NULL,Sublette,WY,Great Blue Heron,NULL,019403408,6/30/2011,00:00.0,2011,6,30,NULL,NULL,NULL,Sublette,WY,Great Blue Heron,NULL,019403409,4/16/2010,00:00.0,2010,4,16,NULL,NULL,NULL,Sublette,WY,Great Blue Heron,NULL,019403410,7/11/2010,00:00.0,2010,7,11,Shill,NULL,NULL,Carbon,WY,Western Grebe,NULL,000103411,7/11/2010,00:00.0,2010,7,11,Shill,NULL,NULL,Carbon,WY,Black-crowned Night-Heron,NULL,020203412,7/15/2009,00:00.0,2009,7,15,NULL,NULL,NULL,Teton,WY,Great Blue Heron,NULL,019403413,7/14/2010,00:00.0,2010,7,14,NULL,NULL,NULL,Teton,WY,Great Blue Heron,NULL,019403414,6/23/2011,00:00.0,2011,6,23,NULL,NULL,NULL,Teton,WY,Great Blue Heron,NULL,019403415,7/1/2010,00:00.0,2010,7,1,Shill,NULL,NULL,Albany,WY,Western Grebe,NULL,000103416,7/1/2010,00:00.0,2010,7,1,Shill,NULL,NULL,Albany,WY,Forster's Tern,NULL,006903417,7/1/2010,00:00.0,2010,7,1,Shill,NULL,NULL,Albany,WY,Black-crowned Night-Heron,NULL,020203418,6/23/2011,00:00.0,2011,6,23,Orabona,NULL,NULL,Sheridan,WY,Great Blue Heron,NULL,019403419,6/23/2011,00:00.0,2011,6,23,Orabona,NULL,NULL,Sheridan,WY,Great Blue Heron,NULL,019403420,5/20/2010,00:00.0,2010,5,20,NULL,NULL,NULL,Sublette,WY,Great Blue Heron,NULL,019403421,6/30/2011,00:00.0,2011,6,30,NULL,NULL,NULL,Sublette,WY,Great Blue Heron,NULL,019403422,5/20/2010,00:00.0,2010,5,20,Orabona,NULL,NULL,Lincoln,WY,Great Blue Heron,NULL,019403423,6/28/2011,00:00.0,2011,6,28,Orabona,NULL,NULL,Lincoln,WY,Great Blue Heron,NULL,019403424,5/5/2010,00:00.0,2010,5,5,NULL,NULL,NULL,Fremont,WY,Great Blue Heron,NULL,019403425,6/3/2011,00:00.0,2011,6,3,Orabona,NULL,NULL,Sublette,WY,Great Blue Heron,NULL,019403426,4/28/2011,00:00.0,2011,4,28,NULL,NULL,NULL,Platte,WY,Great Blue Heron,NULL,019403427,6/3/2011,00:00.0,2011,6,3,Orabona,NULL,NULL,Sweetwater,WY,Great Blue Heron,NULL,019403428,6/3/2011,00:00.0,2011,6,3,NULL,NULL,NULL,Sublette,WY,Great Blue Heron,NULL,019403429,6/3/2011,00:00.0,2011,6,3,NULL,NULL,NULL,Sublette,WY,Great Blue Heron,NULL,019403430,6/3/2011,00:00.0,2011,6,3,Orabona,NULL,NULL,Sublette,WY,Great Blue Heron,NULL,019403431,5/19/2010,00:00.0,2010,5,19,NULL,NULL,NULL,Lincoln,WY,Great Blue Heron,NULL,019403432,6/30/2011,00:00.0,2011,6,30,NULL,NULL,NULL,Lincoln,WY,Great Blue Heron,NULL,019403433,6/2/2011,00:00.0,2011,6,2,NULL,NULL,NULL,Sweetwater,WY,Great Blue Heron,NULL,019403434,4/22/2009,00:00.0,2009,4,22,Lebsack,NULL,NULL,Laramie,WY,Black-crowned Night-Heron,NULL,020203435,5/18/2010,00:00.0,2010,5,18,Gorges,NULL,NULL,Laramie,WY,Black-crowned Night-Heron,NULL,020203436,6/30/2009,00:00.0,2009,6,30,Orabona/Kilpatrick,NULL,NULL,Albany,WY,White-faced Ibis,NULL,018703437,6/30/2009,00:00.0,2009,6,30,Orabona/Kilpatrick,NULL,NULL,Albany,WY,Forster's Tern,NULL,006903438,6/30/2009,00:00.0,2009,6,30,Orabona/Kilpatrick,NULL,NULL,Albany,WY,Black-crowned Night-Heron,NULL,020203439,7/1/2009,00:00.0,2009,7,1,NULL,NULL,NULL,Carbon,WY,Great Blue Heron,NULL,019403440,6/30/2009,00:00.0,2009,6,30,Orabona/Kilpatrick,NULL,NULL,Albany,WY,Forster's Tern,NULL,006903441,4/29/2009,00:00.0,2009,4,29,Knox,NULL,NULL,Femont,WY,Great Blue Heron,NULL,019403442,5/26/2010,00:00.0,2010,5,26,Shill,NULL,NULL,Fremont,WY,Great Blue Heron,NULL,019403443,5/25/2011,00:00.0,2011,5,25,Rudd,NULL,NULL,Fremont,WY,Great Blue Heron,NULL,019403444,5/14/2011,00:00.0,2011,5,14,Orabona,NULL,NULL,Sheridan,WY,Great Blue Heron,NULL,019403445,6/23/2011,00:00.0,2011,6,23,Orabona,NULL,NULL,Johnson,WY,Great Blue Heron,NULL,019403446,7/7/2011,00:00.0,2011,7,7,NULL,NULL,NULL,Campbell,WY,Great Blue Heron,NULL,019403447,6/17/2009,00:00.0,2009,6,17,Kilpatrick,NULL,NULL,Big Horn,WY,Western or Clark's Grebe,,NULL3448,4/13/2009,00:00.0,2009,4,13,Oakleaf,NULL,NULL,Carbon,WY,Great Blue Heron,NULL,019403449,5/18/2011,00:00.0,2011,5,18,NULL,NULL,NULL,Fremont,WY,Great Blue Heron,NULL,019403450,5/4/2010,00:00.0,2010,5,4,NULL,NULL,NULL,Fremont,WY,Great Blue Heron,NULL,019403451,5/4/2010,00:00.0,2010,5,4,NULL,NULL,NULL,Fremont,WY,Great Blue Heron,NULL,019403452,4/28/2011,00:00.0,2011,4,28,Orabona,NULL,NULL,Converse,WY,Great Blue Heron,NULL,019403453,4/28/2011,00:00.0,2011,4,28,Orabona,NULL,NULL,Converse,WY,Great Blue Heron,NULL,019403454,5/24/2011,00:00.0,2011,5,24,NULL,NULL,NULL,Big Horn,WY,Great Blue Heron,NULL,019403455,6/3/2010,00:00.0,2010,6,3,NULL,NULL,NULL,Lincoln,WY,Great Blue Heron,NULL,019403456,4/26/2010,00:00.0,2010,4,26,NULL,NULL,NULL,Lincoln,WY,Great Blue Heron,NULL,019403457,4/26/2010,00:00.0,2010,4,26,NULL,NULL,NULL,Lincoln,WY,Great Blue Heron,NULL,019403458,4/26/2010,00:00.0,2010,4,26,NULL,NULL,NULL,Lincoln,WY,Great Blue Heron,NULL,019403459,6/2/2010,00:00.0,2010,6,2,NULL,NULL,NULL,Sweetwater,WY,Great Blue Heron,NULL,019403460,7/11/2010,00:00.0,2010,7,11,Shill,NULL,NULL,Carbon,WY,Double-crested Cormorant,NULL,012003461,7/11/2010,00:00.0,2010,7,11,Shill,NULL,NULL,Carbon,WY,California Gull,NULL,005303462,7/11/2010,00:00.0,2010,7,11,Shill,NULL,NULL,Carbon,WY,American White Pelican,NULL,012503463,6/29/2011,00:00.0,2011,6,29,Orabona,NULL,NULL,Carbon,WY,Double-crested Cormorant,NULL,012003464,6/29/2011,00:00.0,2011,6,29,Orabona,NULL,NULL,Carbon,WY,Black-crowned Night-Heron,NULL,020203465,6/29/2011,00:00.0,2011,6,29,Orabona,NULL,NULL,Carbon,WY,American White Pelican,NULL,012503466,6/30/2011,00:00.0,2011,6,30,Orabona,NULL,NULL,Carbon,WY,California Gull,NULL,005303467,6/30/2009,00:00.0,2009,6,30,Orabona/Kilpatrick,NULL,NULL,Albany,WY,Forster's Tern,NULL,006903468,4/13/2009,00:00.0,2009,4,13,Oakleaf,NULL,NULL,Carbon,WY,Great Blue Heron,NULL,019403469,6/23/2011,00:00.0,2011,6,23,Orabona,NULL,NULL,Sheridan,WY,Great Blue Heron,NULL,019403470,4/13/2009,00:00.0,2009,4,13,Oakleaf,NULL,NULL,Carbon,WY,Great Blue Heron,NULL,019403471,7/7/2011,00:00.0,2011,7,7,Orabona,NULL,NULL,Crook,WY,Great Blue Heron,NULL,019403472,7/7/2011,00:00.0,2011,7,7,Orabona,NULL,NULL,Crook,WY,Double-crested Cormorant,NULL,012003473,3/29/2011,00:00.0,2011,3,29,NULL,NULL,NULL,Teton,WY,Great Blue Heron,NULL,019403474,7/11/2009,00:00.0,2009,7,11,Orabona/Kilpatrick,NULL,NULL,Natrona,WY,Snowy Egret,NULL,019703475,7/11/2009,00:00.0,2009,7,11,Orabona/Kilpatrick,NULL,NULL,Natrona,WY,Double-crested Cormorant,NULL,012003476,7/11/2009,00:00.0,2009,7,11,Orabona/Kilpatrick,NULL,NULL,Natrona,WY,California Gull,NULL,005303477,7/11/2009,00:00.0,2009,7,11,Orabona/Kilpatrick,NULL,NULL,Natrona,WY,Black-crowned Night-Heron,NULL,020203478,6/12/2009,00:00.0,2009,6,12,NULL,NULL,NULL,Teton,WY,Great Blue Heron,NULL,019403479,4/13/2009,00:00.0,2009,4,13,Oakleaf,NULL,NULL,Carbon,WY,Great Blue Heron,NULL,019403480,5/14/2011,00:00.0,2011,5,14,Orabona,NULL,NULL,Sheridan,WY,Great Blue Heron,NULL,019403481,6/23/2011,00:00.0,2011,6,23,Orabona,NULL,NULL,Sheridan,WY,Great Blue Heron,NULL,019403482,5/5/2011,00:00.0,2011,5,5,Orabona,NULL,NULL,Weston,WY,Great Blue Heron,NULL,019403483,5/18/2011,00:00.0,2011,5,18,NULL,NULL,NULL,Fremont,WY,Great Blue Heron,NULL,019403484,5/18/2011,00:00.0,2011,5,18,NULL,NULL,NULL,Fremont,WY,Great Blue Heron,NULL,019403485,8/2/2009,00:00.0,2009,8,2,Baril,NULL,NULL,Teton,WY,Double-crested Cormorant,NULL,012003486,8/2/2009,00:00.0,2009,8,2,Baril,NULL,NULL,Teton,WY,American White Pelican,NULL,012503487,NULL,,2010,NULL,NULL,Baril,NULL,NULL,Teton,WY,Double-crested Cormorant,SurveyDate: 5:8/-/ 2010,012003488,NULL,,2010,NULL,NULL,Baril,NULL,NULL,Teton,WY,California Gull,SurveyDate: 5:8/-/ 2010,005303489,NULL,,2010,NULL,NULL,Baril,NULL,NULL,Teton,WY,American White Pelican,SurveyDate: 5:8/-/ 2010,012503490,NULL,,1990,NULL,NULL,NULL,NULL,NULL,Carbon,WY,Snowy Egret,NULL,019703491,NULL,,1990,NULL,NULL,NULL,NULL,NULL,Carbon,WY,Forster's Tern,NULL,006903492,NULL,,1990,NULL,NULL,NULL,NULL,NULL,Carbon,WY,Black-crowned Night-Heron,NULL,020203493,NULL,,1994,NULL,NULL,NULL,NULL,NULL,Carbon,WY,Forster's Tern,NULL,006903494,NULL,,1994,NULL,NULL,NULL,NULL,NULL,Carbon,WY,Black-crowned Night-Heron,NULL,020203495,NULL,,1995,NULL,NULL,NULL,NULL,NULL,Carbon,WY,Forster's Tern,NULL,006903496,NULL,,1995,NULL,NULL,NULL,NULL,NULL,Carbon,WY,Black-crowned Night-Heron,NULL,020203497,NULL,,1996,NULL,NULL,NULL,NULL,NULL,Carbon,WY,White-faced Ibis,NULL,018703498,NULL,,1996,NULL,NULL,NULL,NULL,NULL,Carbon,WY,Snowy Egret,NULL,019703499,NULL,,1996,NULL,NULL,NULL,NULL,NULL,Carbon,WY,Forster's Tern,NULL,006903500,NULL,,1996,NULL,NULL,NULL,NULL,NULL,Carbon,WY,Black-crowned Night-Heron,NULL,020203501,NULL,,1997,NULL,NULL,NULL,NULL,NULL,Carbon,WY,White-faced Ibis,NULL,018703502,NULL,,1997,NULL,NULL,NULL,NULL,NULL,Carbon,WY,Snowy Egret,NULL,019703503,NULL,,1997,NULL,NULL,NULL,NULL,NULL,Carbon,WY,Forster's Tern,NULL,006903504,NULL,,1997,NULL,NULL,NULL,NULL,NULL,Carbon,WY,Black-crowned Night-Heron,NULL,020203505,NULL,,1998,NULL,NULL,NULL,NULL,NULL,Carbon,WY,White-faced Ibis,NULL,018703506,NULL,,1998,NULL,NULL,NULL,NULL,NULL,Carbon,WY,Snowy Egret,NULL,019703507,NULL,,1998,NULL,NULL,NULL,NULL,NULL,Carbon,WY,Forster's Tern,NULL,006903508,NULL,,1998,NULL,NULL,NULL,NULL,NULL,Carbon,WY,Black-crowned Night-Heron,NULL,020203509,NULL,,1999,NULL,NULL,NULL,NULL,NULL,Carbon,WY,White-faced Ibis,NULL,018703510,NULL,,1999,NULL,NULL,NULL,NULL,NULL,Carbon,WY,Snowy Egret,NULL,019703511,NULL,,1999,NULL,NULL,NULL,NULL,NULL,Carbon,WY,Forster's Tern,NULL,006903512,NULL,,1999,NULL,NULL,NULL,NULL,NULL,Carbon,WY,Black-crowned Night-Heron,NULL,020203513,NULL,,2000,NULL,NULL,NULL,NULL,NULL,Carbon,WY,White-faced Ibis,NULL,018703514,NULL,,2000,NULL,NULL,NULL,NULL,NULL,Carbon,WY,Snowy Egret,NULL,019703515,NULL,,2000,NULL,NULL,NULL,NULL,NULL,Carbon,WY,Forster's Tern,NULL,006903516,NULL,,2000,NULL,NULL,NULL,NULL,NULL,Carbon,WY,Black-crowned Night-Heron,NULL,020203517,NULL,,2001,NULL,NULL,NULL,NULL,NULL,Carbon,WY,White-faced Ibis,NULL,018703518,NULL,,2001,NULL,NULL,NULL,NULL,NULL,Carbon,WY,Snowy Egret,NULL,019703519,NULL,,2001,NULL,NULL,NULL,NULL,NULL,Carbon,WY,Forster's Tern,NULL,006903520,NULL,,2002,NULL,NULL,NULL,NULL,NULL,Carbon,WY,White-faced Ibis,NULL,018703521,NULL,,2002,NULL,NULL,NULL,NULL,NULL,Carbon,WY,Snowy Egret,NULL,019703522,NULL,,2002,NULL,NULL,NULL,NULL,NULL,Carbon,WY,Forster's Tern,NULL,006903523,NULL,,2002,NULL,NULL,NULL,NULL,NULL,Carbon,WY,Black-crowned Night-Heron,NULL,020203524,NULL,,2003,NULL,NULL,NULL,NULL,NULL,Carbon,WY,White-faced Ibis,NULL,018703525,NULL,,2003,NULL,NULL,NULL,NULL,NULL,Carbon,WY,Snowy Egret,NULL,019703526,NULL,,2003,NULL,NULL,NULL,NULL,NULL,Carbon,WY,Forster's Tern,NULL,006903527,NULL,,2003,NULL,NULL,NULL,NULL,NULL,Carbon,WY,Black-crowned Night-Heron,NULL,020203528,NULL,,2004,NULL,NULL,NULL,NULL,NULL,Carbon,WY,White-faced Ibis,NULL,018703529,NULL,,2004,NULL,NULL,NULL,NULL,NULL,Carbon,WY,Forster's Tern,NULL,006903530,NULL,,2004,NULL,NULL,NULL,NULL,NULL,Carbon,WY,Black-crowned Night-Heron,NULL,020203531,NULL,,2005,NULL,NULL,NULL,NULL,NULL,Albany,WY,White-faced Ibis,NULL,018703532,NULL,,2005,NULL,NULL,NULL,NULL,NULL,Albany,WY,Forster's Tern,NULL,006903533,NULL,,2006,NULL,NULL,NULL,NULL,NULL,Albany,WY,White-faced Ibis,NULL,018703534,NULL,,2006,NULL,NULL,NULL,NULL,NULL,Albany,WY,Forster's Tern,NULL,006903535,NULL,,2006,NULL,NULL,NULL,NULL,NULL,Albany,WY,Black-crowned Night-Heron,NULL,020203536,NULL,,1982,NULL,NULL,NULL,NULL,NULL,Albany,WY,Snowy Egret,NULL,019703537,NULL,,1982,NULL,NULL,NULL,NULL,NULL,Albany,WY,Double-crested Cormorant,Adults present,012003538,NULL,,1982,NULL,NULL,NULL,NULL,NULL,Albany,WY,Caspian Tern,NULL,006403539,NULL,,1983,NULL,NULL,NULL,NULL,NULL,Albany,WY,Snowy Egret,NULL,019703540,NULL,,1983,NULL,NULL,NULL,NULL,NULL,Albany,WY,Double-crested Cormorant,NULL,012003541,NULL,,1984,NULL,NULL,NULL,NULL,NULL,Albany,WY,Snowy Egret,NULL,019703542,NULL,,1984,NULL,NULL,NULL,NULL,NULL,Albany,WY,Double-crested Cormorant,NULL,012003543,NULL,,1984,NULL,NULL,NULL,NULL,NULL,Albany,WY,Black-crowned Night-Heron,NULL,020203544,NULL,,1985,NULL,NULL,NULL,NULL,NULL,Albany,WY,Double-crested Cormorant,Adults present,012003545,NULL,,1986,NULL,NULL,NULL,NULL,NULL,Albany,WY,Snowy Egret,NULL,019703546,NULL,,1986,NULL,NULL,NULL,NULL,NULL,Albany,WY,Double-crested Cormorant,NULL,012003547,NULL,,1986,NULL,NULL,NULL,NULL,NULL,Albany,WY,Black-crowned Night-Heron,NULL,020203548,NULL,,1986,NULL,NULL,NULL,NULL,NULL,Albany,WY,American White Pelican,NULL,012503549,NULL,,1987,NULL,NULL,NULL,NULL,NULL,Albany,WY,Snowy Egret,NULL,019703550,NULL,,1987,NULL,NULL,NULL,NULL,NULL,Albany,WY,Double-crested Cormorant,Adults present,012003551,NULL,,1987,NULL,NULL,NULL,NULL,NULL,Albany,WY,American White Pelican,NULL,012503552,NULL,,1988,NULL,NULL,NULL,NULL,NULL,Albany,WY,White-faced Ibis,NULL,018703553,NULL,,1988,NULL,NULL,NULL,NULL,NULL,Albany,WY,Snowy Egret,NULL,019703554,NULL,,1988,NULL,NULL,NULL,NULL,NULL,Albany,WY,Double-crested Cormorant,Adults present,012003555,NULL,,1988,NULL,NULL,NULL,NULL,NULL,Albany,WY,Black-crowned Night-Heron,Young present,020203556,NULL,,1988,NULL,NULL,NULL,NULL,NULL,Albany,WY,American White Pelican,NULL,012503557,NULL,,1989,NULL,NULL,NULL,NULL,NULL,Albany,WY,Snowy Egret,NULL,019703558,NULL,,1989,NULL,NULL,NULL,NULL,NULL,Albany,WY,Double-crested Cormorant,Adults present,012003559,NULL,,1989,NULL,NULL,NULL,NULL,NULL,Albany,WY,Caspian Tern,NULL,006403560,NULL,,1989,NULL,NULL,NULL,NULL,NULL,Albany,WY,Black-crowned Night-Heron,Young present,020203561,NULL,,1989,NULL,NULL,NULL,NULL,NULL,Albany,WY,American White Pelican,NULL,012503562,NULL,,1990,NULL,NULL,NULL,NULL,NULL,Albany,WY,Snowy Egret,NULL,019703563,NULL,,1990,NULL,NULL,NULL,NULL,NULL,Albany,WY,Double-crested Cormorant,Adults present,012003564,NULL,,1990,NULL,NULL,NULL,NULL,NULL,Albany,WY,Black-crowned Night-Heron,Young present,020203565,NULL,,1990,NULL,NULL,NULL,NULL,NULL,Albany,WY,American White Pelican,NULL,012503566,NULL,,1991,NULL,NULL,NULL,NULL,NULL,Albany,WY,Snowy Egret,NULL,019703567,NULL,,1991,NULL,NULL,NULL,NULL,NULL,Albany,WY,Double-crested Cormorant,NULL,012003568,NULL,,1991,NULL,NULL,NULL,NULL,NULL,Albany,WY,Caspian Tern,NULL,006403569,NULL,,1991,NULL,NULL,NULL,NULL,NULL,Albany,WY,Black-crowned Night-Heron,NULL,020203570,NULL,,1991,NULL,NULL,NULL,NULL,NULL,Albany,WY,American White Pelican,NULL,012503571,NULL,,1992,NULL,NULL,NULL,NULL,NULL,Albany,WY,Snowy Egret,NULL,019703572,NULL,,1992,NULL,NULL,NULL,NULL,NULL,Albany,WY,Double-crested Cormorant,Active nests,012002445,NULL,,1995,6,8,Stahlecker,NULL,NULL,Rio Arriba,NM,White-faced Ibis,NULL,018702446,NULL,,1995,8,NULL,Stahlecker,NULL,NULL,Rio Arriba,NM,Eared Grebe,SurveyDate: Jul 1995,000402447,6/8/1996,00:00.0,1996,6,8,Stahlecker,NULL,NULL,Rio Arriba,NM,White-faced Ibis,NULL,018702448,7/12/1996,00:00.0,1996,7,12,Stahlecker,NULL,NULL,Rio Arriba,NM,Eared Grebe,NULL,000402449,6/11/1997,00:00.0,1997,6,11,Stahlecker,NULL,NULL,Rio Arriba,NM,White-faced Ibis,NULL,018702450,7/9/1997,00:00.0,1997,7,9,Stahlecker,NULL,NULL,Rio Arriba,NM,Eared Grebe,NULL,000402451,6/18/2004,00:00.0,2004,6,18,Stahlecker,NULL,NULL,Rio Arriba,NM,Eared Grebe,NULL,000402452,6/27/2005,00:00.0,2005,6,27,Stahlecker,NULL,NULL,Rio Arriba,NM,Eared Grebe,NULL,000402453,7/12/2007,00:00.0,2007,7,12,Stahlecker,NULL,NULL,Rio Arriba,NM,Eared Grebe,NULL,000402454,7/13/2008,00:00.0,2008,7,13,Stahlecker,NULL,NULL,Rio Arriba,NM,Eared Grebe,NULL,000402455,NULL,,1993,6,0,Stahlecker,NULL,NULL,Rio Arriba,NM,Western Grebe,SurveyDate:6/13-14/1993,000102456,NULL,,1988,NULL,NULL,Stahlecker,NULL,NULL,Rio Arriba,NM,White-faced Ibis,SurveyDate:6/25-7/24/1988,018702457,NULL,,1976,NULL,NULL,Hundertmark,NULL,NULL,Rio Arriba,NM,Eared Grebe,SurveyDate:summer 1976,000402458,NULL,,1987,NULL,NULL,Stahlecker,NULL,NULL,Rio Arriba,NM,Black-crowned Night-Heron,SurveyDate:summer 1987,020202459,NULL,,1987,NULL,NULL,Stahlecker,NULL,NULL,Rio Arriba,NM,Eared Grebe,SurveyDate:summer 1987,000402460,NULL,,1988,NULL,NULL,Stahlecker,NULL,NULL,Rio Arriba,NM,Black-crowned Night-Heron,SurveyDate: summer 1988,020202461,NULL,,1988,NULL,NULL,Stahlecker,NULL,NULL,Rio Arriba,NM,Western Grebe,SurveyDate: summer 1988,000102462,NULL,,1990,NULL,NULL,Stahlecker,NULL,NULL,Rio Arriba,NM,Eared Grebe,SurveyDate: summer 1990,000402463,NULL,,1993,NULL,NULL,Stahlecker,NULL,NULL,Rio Arriba,NM,Black-crowned Night-Heron,SurveyDate:summer 1993,020202464,NULL,,1993,NULL,NULL,Stahlecker,NULL,NULL,Rio Arriba,NM,White-faced Ibis,SurveyDate:summer 1993,018702465,6/26/1977,00:00.0,1977,6,26,Baltosser,NULL,NULL,Sierra,NM,Western or Clark's Grebe,NULL,NULL2466,7/17/1986,00:00.0,1986,7,17,Hubbard,NULL,NULL,Sierra,NM,NULL,MultipleSpecies: Cormorants and Egrets,NULL2467,9/28/1986,00:00.0,1986,9,28,Zimmer et al.,NULL,NULL,Sierra,NM,Western Grebe,NULL,000102468,4/13/1990,00:00.0,1990,4,13,Cleary,NULL,NULL,Sierra,NM,Clark's Grebe,NULL,000112469,6/17/1990,00:00.0,1990,6,17,Sandell,NULL,NULL,Sierra,NM,Double-crested Cormorant,NULL,012002470,6/17/1990,00:00.0,1990,6,17,Sandell,NULL,NULL,Sierra,NM,Great Blue Heron,NULL,019402471,6/17/1990,00:00.0,1990,6,17,Sandell,NULL,NULL,Sierra,NM,Great Egret,NULL,019602472,7/6/1991,00:00.0,1991,7,6,Sandell,NULL,NULL,Sierra,NM,Double-crested Cormorant,NULL,012002473,7/6/1991,00:00.0,1991,7,6,Sandell,NULL,NULL,Sierra,NM,Great Blue Heron,NULL,019402474,5/28/1998,00:00.0,1998,5,28,Howe/White,NULL,NULL,Sierra,NM,Double-crested Cormorant,NULL,012002475,5/28/1998,00:00.0,1998,5,28,Howe/White,NULL,NULL,Sierra,NM,Double-crested or Neotropic Cormorant,,NULL2476,5/28/1998,00:00.0,1998,5,28,Howe/White,NULL,NULL,Sierra,NM,Great Blue Heron,NULL,019402477,6/10/1999,00:00.0,1999,6,10,Williams/White,NULL,NULL,Sierra,NM,Double-crested or Neotropic Cormorant,,NULL2478,6/12/2007,00:00.0,2007,6,12,Stahlecker,NULL,NULL,Sierra,NM,Double-crested Cormorant,NULL,012002479,NULL,,1989,NULL,NULL,fide Pulich,NULL,NULL,Sierra,NM,Double-crested or Neotropic Cormorant,SurveyDate:spring 1989,NULL2480,NULL,,1989,NULL,NULL,fide Pulich,NULL,NULL,Sierra,NM,Great Blue Heron,SurveyDate:spring 1989,019402481,NULL,,1979,NULL,NULL,fide Williams,NULL,NULL,Sierra,NM,Snowy Egret,SurveyDate:summer 1979,019702482,5/30/2009,00:00.0,2009,5,30,Stahlecker,NULL,NULL,Quay,NM,Great Blue Heron,NULL,019402483,3/4/1973,00:00.0,1973,3,4,Fisher,NULL,NULL,Grant,NM,Great Blue Heron,"4-6 sites, exact locations unknown",019402484,6/20/1982,00:00.0,1982,6,20,Fisher,NULL,NULL,Grant,NM,Great Blue Heron,"4-6 sites, exact locations unknown",019402485,5/9/1991,00:00.0,1991,5,9,Fisher,NULL,NULL,Grant,NM,Great Blue Heron,"4-6 sites, exact locations unknown",019402486,6/12/2003,00:00.0,2003,6,12,Brodhead,NULL,NULL,Grant,NM,Great Blue Heron,NULL,019402487,5/22/2008,00:00.0,2008,5,22,Shook,NULL,NULL,Grant,NM,Great Blue Heron,NULL,019402488,6/9/2008,00:00.0,2008,6,9,Shook,NULL,NULL,Grant,NM,Great Blue Heron,NULL,019402489,NULL,,1969,NULL,NULL,Fisher,NULL,NULL,Grant,NM,Great Blue Heron,"4-6 sites, exact locations unknown ; SurveryDate: 3/9 - 5/25/1969",019402527,5/23/1972,00:00.0,1972,5,23,Hubbard,NULL,NULL,Sierra,NM,Neotropic Cormorant,NULL,012102490,NULL,,1972,NULL,NULL,Fisher,NULL,NULL,Grant,NM,Great Blue Heron,"4-6 sites, exact locations unknown ; SurveryDate: spring 1972",019402491,NULL,,1975,NULL,NULL,Fisher,NULL,NULL,Grant,NM,Great Blue Heron,"4-6 sites, exact locations unknown ; SurveryDate: spring 1975",019402492,NULL,,1986,NULL,NULL,Fisher,NULL,NULL,Grant,NM,Great Blue Heron,"4-6 sites, exact locations unknown ; SurveryDate: spring 1986",019402493,NULL,,1994,NULL,NULL,Fisher,NULL,NULL,Grant,NM,Great Blue Heron,SurveyDate: spring 1994,019402494,NULL,,1974,NULL,NULL,Fisher,NULL,NULL,Grant,NM,Great Blue Heron,"4-6 sites, exact locations unknown ; SurveryDate: summer 1974",019402495,NULL,,1981,NULL,NULL,Fisher,NULL,NULL,Grant,NM,Great Blue Heron,"4-6 sites, exact locations unknown ; SurveryDate: summer 1981",019402496,8/21/2005,00:00.0,2005,8,21,West,NULL,NULL,Curry,NM,Eared Grebe,NULL,000402497,5/27/2006,00:00.0,2006,5,27,Rustay,NULL,NULL,Curry,NM,Double-crested Cormorant,NULL,012002498,8/28/2006,00:00.0,2006,8,28,West,NULL,NULL,Curry,NM,Eared Grebe,NULL,000402499,5/25/2007,00:00.0,2007,5,25,Oldenettel,NULL,NULL,Curry,NM,Double-crested Cormorant,NULL,012002500,8/8/2008,00:00.0,2008,8,8,Hilchey,NULL,NULL,Curry,NM,Eared Grebe,NULL,000402501,5/26/2004,00:00.0,2004,5,26,Hendershot,NULL,NULL,Curry,NM,Black-crowned Night-Heron,NULL,020202502,5/23/1989,00:00.0,1989,5,23,Hubbard,NULL,NULL,Socorro,NM,Double-crested Cormorant,NULL,012002503,5/28/1998,00:00.0,1998,5,28,Howe/White,NULL,NULL,Socorro,NM,Black-crowned Night-Heron,NULL,020202504,5/28/1998,00:00.0,1998,5,28,Howe/White,NULL,NULL,Socorro,NM,Double-crested or Neotropic Cormorant,,NULL2505,5/28/1998,00:00.0,1998,5,28,Howe/White,NULL,NULL,Socorro,NM,Great Blue Heron,NULL,019402506,5/28/1998,00:00.0,1998,5,28,Howe/White,NULL,NULL,Socorro,NM,Neotropic Cormorant,NULL,012102507,5/28/1998,00:00.0,1998,5,28,Howe/White,NULL,NULL,Socorro,NM,Snowy Egret,NULL,019702508,6/10/1999,00:00.0,1999,6,10,Williams/White,NULL,NULL,Socorro,NM,Black-crowned Night-Heron,NULL,020202509,6/10/1999,00:00.0,1999,6,10,Williams/White,NULL,NULL,Socorro,NM,Double-crested or Neotropic Cormorant,,NULL2510,6/10/1999,00:00.0,1999,6,10,Williams/White,NULL,NULL,Socorro,NM,Great Blue Heron,NULL,019402511,6/10/1999,00:00.0,1999,6,10,Williams/White,NULL,NULL,Socorro,NM,Great Egret,NULL,019602512,6/10/1999,00:00.0,1999,6,10,Williams/White,NULL,NULL,Socorro,NM,Snowy Egret,NULL,019702513,5/2/2006,00:00.0,2006,5,2,Doster,NULL,NULL,Socorro,NM,Double-crested Cormorant,NULL,012002514,5/2/2006,00:00.0,2006,5,2,Doster,NULL,NULL,Socorro,NM,Great Blue Heron,NULL,019402515,5/9/2007,00:00.0,2007,5,9,Doster,NULL,NULL,Socorro,NM,Double-crested Cormorant,NULL,012002516,6/13/2007,00:00.0,2007,6,13,Doster/Stahlecker,NULL,NULL,Socorro,NM,Black-crowned Night-Heron,NULL,020202517,6/13/2007,00:00.0,2007,6,13,Doster/Stahlecker,NULL,NULL,Socorro,NM,Great Blue Heron,NULL,019402518,6/13/2007,00:00.0,2007,6,13,Doster/Stahlecker,NULL,NULL,Socorro,NM,Great Egret,NULL,019602519,6/13/2007,00:00.0,2007,6,13,Doster,NULL,NULL,Socorro,NM,Neotropic Cormorant,NULL,012102520,7/23/2008,00:00.0,2008,7,23,Cleary,NULL,NULL,Socorro,NM,Great Blue Heron,NULL,019402521,5/5/2009,00:00.0,2009,5,5,Doster,NULL,NULL,Socorro,NM,Black-crowned Night-Heron,NULL,020202522,5/5/2009,00:00.0,2009,5,5,Doster,NULL,NULL,Socorro,NM,Great Blue Heron,NULL,019402523,5/5/2009,00:00.0,2009,5,5,Doster,NULL,NULL,Socorro,NM,Great Egret,NULL,019602524,5/5/2009,00:00.0,2009,5,5,Doster,NULL,NULL,Socorro,NM,Snowy Egret,NULL,019702525,NULL,,1987,NULL,NULL,Uihlein,NULL,NULL,Quay,NM,Eared Grebe,SurveyDate: 6/1987,000402526,7/1/2006,00:00.0,2006,7,1,Cleary,NULL,NULL,Colfax,NM,Western Grebe,NULL,000102528,6/16/1972,00:00.0,1972,6,16,Hubbard,NULL,NULL,Sierra,NM,Double-crested Cormorant,NULL,012002529,4/27/1974,00:00.0,1974,4,27,Hundertmark,NULL,NULL,Sierra,NM,Double-crested Cormorant,NULL,012002530,4/27/1974,00:00.0,1974,4,27,Hundertmark,NULL,NULL,Sierra,NM,Great Egret,NULL,019602531,5/11/1974,00:00.0,1974,5,11,Hundertmark,NULL,NULL,Sierra,NM,Neotropic Cormorant,NULL,012102532,5/18/1974,00:00.0,1974,5,18,Hundertmark,NULL,NULL,Sierra,NM,Great Egret,NULL,019602533,7/9/1974,00:00.0,1974,7,9,Hundertmark,NULL,NULL,Sierra,NM,Great Egret,NULL,019602534,7/9/1974,00:00.0,1974,7,9,Hundertmark,NULL,NULL,Sierra,NM,Neotropic Cormorant,NULL,012102535,5/11/1975,00:00.0,1975,5,11,Hundertmark,NULL,NULL,Sierra,NM,Black-crowned Night-Heron,NULL,020202536,5/11/1975,00:00.0,1975,5,11,Hundertmark,NULL,NULL,Sierra,NM,Great Egret,NULL,019602537,7/1/1975,00:00.0,1975,7,1,Hundertmark,NULL,NULL,Sierra,NM,Cattle Egret,NULL,020012538,7/1/1975,00:00.0,1975,7,1,Hundertmark,NULL,NULL,Sierra,NM,Little Blue Heron,NULL,020002539,6/8/1986,00:00.0,1986,6,8,Mitchessun,NULL,NULL,Sierra,NM,Neotropic Cormorant,NULL,012102540,6/1/1990,00:00.0,1990,6,1,Paynter,NULL,NULL,Sierra,NM,Double-crested or Neotropic Cormorant,,NULL2541,3/22/1997,00:00.0,1997,3,22,Williams,NULL,NULL,Sierra,NM,Great Blue Heron,NULL,019402542,5/28/1998,00:00.0,1998,5,28,Howe/White,NULL,NULL,Sierra,NM,Double-crested or Neotropic Cormorant,,NULL2543,6/10/1999,00:00.0,1999,6,10,Williams/White,NULL,NULL,Sierra,NM,Double-crested or Neotropic Cormorant,,NULL2544,NULL,,1972,3,NULL,Hundertmark,NULL,NULL,Sierra,NM,Double-crested Cormorant,3/10-12/1972,012002545,NULL,,1986,3,NULL,Kotinek,NULL,NULL,Sierra,NM,Double-crested Cormorant,3/10-13/1986,012002546,NULL,,1974,NULL,NULL,Hundertmark,NULL,NULL,Sierra,NM,Black-crowned Night-Heron,4/27 - 7/9/1974,020202547,NULL,,1973,NULL,NULL,Hundertmark,NULL,NULL,Sierra,NM,Double-crested Cormorant,5/5&24/1973,012002548,NULL,,1974,NULL,NULL,Hundertmark,NULL,NULL,Sierra,NM,Snowy Egret,6/5 & 7/9/1974,019702549,NULL,,1972,5,NULL,Hundertmark,NULL,NULL,Sierra,NM,Neotropic Cormorant,mid-May 1972,012102550,NULL,,1971,NULL,NULL,Hundertmark,NULL,NULL,Sierra,NM,Black-crowned Night-Heron,summer 1971,020202551,NULL,,1971,NULL,NULL,Hundertmark,NULL,NULL,Sierra,NM,Double-crested Cormorant,summer 1971,012002552,NULL,,1975,NULL,NULL,Hundertmark,NULL,NULL,Sierra,NM,Double-crested Cormorant,summer 1975,012002553,NULL,,1975,NULL,NULL,Hundertmark,NULL,NULL,Sierra,NM,Snowy Egret,summer 1975,019702554,NULL,,1979,NULL,NULL,fide Williams,NULL,NULL,Sierra,NM,Snowy Egret,summer 1979,019702555,NULL,,1980,NULL,NULL,fide Williams,NULL,NULL,Sierra,NM,Snowy Egret,summer 1980,019702556,7/15/2005,00:00.0,2005,7,15,Stahlecker,NULL,NULL,Rio Arriba,NM,Eared Grebe,NULL,000402557,7/13/2006,00:00.0,2006,7,13,Stahlecker,NULL,NULL,Rio Arriba,NM,Western Grebe,NULL,000102558,NULL,,1999,NULL,NULL,Stahlecker,NULL,NULL,Rio Arriba,NM,Western Grebe,6/13 - 7/12/1999,000102559,7/10/1988,00:00.0,1988,7,10,Espinosa,NULL,NULL,Mora,NM,Eared Grebe,NULL,000402560,6/26/1991,00:00.0,1991,6,26,Paxton/Plimpton,NULL,NULL,Mora,NM,Eared Grebe,NULL,000402561,8/29/1985,00:00.0,1985,8,29,Cleary,NULL,NULL,Sierra,NM,Clark's Grebe,locations change with water levels,000112562,5/10/1986,00:00.0,1986,5,10,Domenici,NULL,NULL,Sierra,NM,Clark's Grebe,locations change with water levels,000112563,6/8/1986,00:00.0,1986,6,8,Mitchessun,NULL,NULL,Sierra,NM,Western Grebe,locations change with water levels,000102564,8/22/1986,00:00.0,1986,8,22,Mitchessun,NULL,NULL,Sierra,NM,Clark's Grebe,locations change with water levels,000112565,8/10/1992,00:00.0,1992,8,10,Hubbard,NULL,NULL,Sierra,NM,Western or Clark's Grebe,"locations change with water levels , Multiple Species: Western or Clark's Grebe",NULL2566,6/10/1999,00:00.0,1999,6,10,Williams/White,NULL,NULL,Sierra,NM,Great Blue Heron,locations change with water levels,019402567,6/10/1999,00:00.0,1999,6,10,Williams/White,NULL,NULL,Sierra,NM,Snowy Egret,locations change with water levels,019702568,6/5/2006,00:00.0,2006,6,5,West,NULL,NULL,Sierra,NM,Western or Clark's Grebe,locations change with water levels,NULL2569,9/24/2006,00:00.0,2006,9,24,Rustay,NULL,NULL,Sierra,NM,Western Grebe,locations change with water levels,000102570,5/21/2007,00:00.0,2007,5,21,Stahlecker,NULL,NULL,Sierra,NM,Western or Clark's Grebe,locations change with water levels,NULL2571,6/13/2007,00:00.0,2007,6,13,Stahlecker,NULL,NULL,Sierra,NM,Double-crested Cormorant,locations change with water levels,012002572,6/13/2007,00:00.0,2007,6,13,Stahlecker,NULL,NULL,Sierra,NM,Neotropic Cormorant,locations change with water levels,012102573,5/8/2008,00:00.0,2008,5,8,Cleary,NULL,NULL,Sierra,NM,Western or Clark's Grebe,locations change with water levels,NULL2574,NULL,,1985,3,NULL,Hubbard,NULL,NULL,Sierra,NM,Double-crested Cormorant,locations change with water levels ; SurveryDate: 3/23 - 24/1985,012002575,6/20/1982,00:00.0,1982,6,20,Fisher,NULL,NULL,Grant,NM,Great Blue Heron,WGS84,019402576,NULL,,2006,6,NULL,Yoder fide Beatty,NULL,NULL,Grant,NM,Great Blue Heron,SurveryDate: late Jun 2006,019402577,NULL,,1975,NULL,NULL,Fisher,NULL,NULL,Grant,NM,Great Blue Heron,NAD 83 ; SurveryDate: spring 1975,019402578,NULL,,1981,NULL,NULL,Fisher,NULL,NULL,Grant,NM,Great Blue Heron,NAD 83 ; SurveryDate: spring 1981,019402579,NULL,,1987,NULL,NULL,Fisher,NULL,NULL,Grant,NM,Great Blue Heron,NAD 83 ; SurveryDate: spring 1987,019402580,NULL,,1994,NULL,NULL,Fisher,NULL,NULL,Grant,NM,Great Blue Heron,NAD 83 ; SurveryDate: spring 1994,019402581,NULL,,1974,NULL,NULL,Fisher,NULL,NULL,Grant,NM,Great Blue Heron,NAD 83 ; SurveryDate: summer 1974,019402582,6/6/1987,00:00.0,1987,6,6,Fisher,NULL,NULL,Catron,NM,Great Blue Heron,NULL,019402583,6/1/1989,00:00.0,1989,6,1,Hubbard/Fisher,NULL,NULL,Catron,NM,Great Blue Heron,NULL,019402584,3/29/1995,00:00.0,1995,3,29,Hubbard,NULL,NULL,Catron,NM,Great Blue Heron,NULL,019402585,NULL,,1988,NULL,NULL,Hubbard/Fisher,NULL,NULL,Catron,NM,Great Blue Heron,SurveyDate: 3/12-16/1988,019402586,NULL,,1986,NULL,NULL,Fisher,NULL,NULL,Catron,NM,Great Blue Heron,SurveyDate: 3/23 - 6/27/1986,019402587,NULL,,1986,NULL,NULL,Fisher,NULL,NULL,Catron,NM,Great Blue Heron,SurveyDate: spring 1986,019402588,NULL,,1994,NULL,NULL,Fisher,NULL,NULL,Catron,NM,Great Blue Heron,SurveyDate: spring 1994,019402589,NULL,,2000,NULL,NULL,fide Reiser,NULL,NULL,Otero,NM,Snowy Egret,SurveyDate: summer 2000,019702590,6/28/1993,00:00.0,1993,6,28,Stahlecker,NULL,NULL,Rio Arriba,NM,Eared Grebe,NULL,000402591,6/28/1993,00:00.0,1993,6,28,Stahlecker,NULL,NULL,Rio Arriba,NM,Western Grebe,NULL,000102592,6/17/1996,00:00.0,1996,6,17,Stahlecker,NULL,NULL,Rio Arriba,NM,Western Grebe,NULL,000102593,6/23/2000,00:00.0,2000,6,23,Stahlecker,NULL,NULL,Rio Arriba,NM,Eared Grebe,NULL,000402594,7/21/2000,00:00.0,2000,7,21,Stahlecker,NULL,NULL,Rio Arriba,NM,Western Grebe,NULL,000102595,7/6/2003,00:00.0,2003,7,6,Stahlecker,NULL,NULL,Rio Arriba,NM,Eared Grebe,NULL,000402596,7/6/2003,00:00.0,2003,7,6,Stahlecker,NULL,NULL,Rio Arriba,NM,Western Grebe,NULL,000102597,6/20/2004,00:00.0,2004,6,20,Stahlecker,NULL,NULL,Rio Arriba,NM,Eared Grebe,NULL,000402598,7/15/2005,00:00.0,2005,7,15,Stahlecker,NULL,NULL,Rio Arriba,NM,Eared Grebe,NULL,000402599,7/13/2006,00:00.0,2006,7,13,Stahlecker,NULL,NULL,Rio Arriba,NM,Eared Grebe,NULL,000402600,6/29/2007,00:00.0,2007,6,29,Stahlecker,NULL,NULL,Rio Arriba,NM,Eared Grebe,NULL,000402601,7/17/1986,00:00.0,1986,7,17,Hubbard,NULL,NULL,Sandoval,NM,Double-crested Cormorant,NULL,012002602,7/17/1986,00:00.0,1986,7,17,Hubbard,NULL,NULL,Sandoval,NM,Snowy Egret,NULL,019702603,NULL,,1985,NULL,NULL,Howe and Hill,NULL,NULL,Sandoval,NM,Double-crested Cormorant,SurveyDate: spring/summer 1985,012002604,5/7/1988,00:00.0,1988,5,7,Williams,NULL,NULL,Grant,NM,Great Blue Heron,NULL,019402605,NULL,,1987,NULL,NULL,Fisher,NULL,NULL,Grant,NM,Great Blue Heron,SurveyDate: spring 1987,019402606,4/28/1968,00:00.0,1968,4,28,Schooley,NULL,NULL,Mora,NM,Great Blue Heron,NULL,019402607,6/25/1990,00:00.0,1990,6,25,Stahlecker,NULL,NULL,Rio Arriba,NM,Western Grebe,NULL,000102608,9/15/1993,00:00.0,1993,9,15,Burton,NULL,NULL,Socorro,NM,Western or Clark's Grebe,NULL,NULL2609,5/14/1988,00:00.0,1988,5,14,Rustay,NULL,NULL,Rio Arriba,NM,Black-crowned Night-Heron,NULL,020202610,6/3/2005,00:00.0,2005,6,3,Cleary,NULL,NULL,Colfax,NM,White-faced Ibis,NULL,018702611,6/4/2006,00:00.0,2006,6,4,Howe,NULL,NULL,De Baca,NM,Clark's Grebe,NULL,000112612,NULL,,2003,6,NULL,Scott et al.,NULL,NULL,Dona Ana,NM,Yellow-crowned Night-Heron,SurveyDate: 6/28-30/2003,020302613,5/11/2002,00:00.0,2002,5,11,Rustay,NULL,NULL,San Miguel,NM,Black-crowned Night-Heron,NULL,020202614,5/20/2007,00:00.0,2007,5,20,West et al.,NULL,NULL,San Miguel,NM,Yellow-crowned Night-Heron,NULL,020302615,5/28/1988,00:00.0,1988,5,28,Rustay,NULL,NULL,San Miguel,NM,Black-crowned Night-Heron,NULL,020202616,9/14/1993,00:00.0,1993,9,14,Morrison,NULL,NULL,San Miguel,NM,Western Grebe,NULL,000102617,9/20/1994,00:00.0,1994,9,20,Nistico,NULL,NULL,San Miguel,NM,Clark's Grebe,NULL,000112618,11/6/1994,00:00.0,1994,11,6,Foy,NULL,NULL,San Miguel,NM,Clark's Grebe,NULL,000112619,NULL,,1992,8,NULL,Rustay,NULL,NULL,San Miguel,NM,Clark's Grebe,SurveyDate: 8/15 + 24/1992,000112620,NULL,,1992,8,NULL,Rustay,NULL,NULL,San Miguel,NM,Western Grebe,SurveyDate: 8/15 + 24/1992,000102621,NULL,,1992,8,NULL,Rustay,NULL,NULL,San Miguel,NM,Western or Clark's Grebe,SurveyDate: 8/15 + 24/1992,NULL2622,7/21/1995,00:00.0,1995,7,21,Cleary,NULL,NULL,San Juan,NM,Eared Grebe,NULL,000402623,7/25/1996,00:00.0,1996,7,25,Cleary,NULL,NULL,San Juan,NM,Eared Grebe,NULL,000402624,5/28/1979,00:00.0,1979,5,28,West,NULL,NULL,Eddy,NM,Black-crowned Night-Heron,NULL,020202625,5/28/1979,00:00.0,1979,5,28,West,NULL,NULL,Eddy,NM,Snowy Egret,NULL,019702626,NULL,,1980,6,NULL,Howe,NULL,NULL,Eddy,NM,Black-crowned Night-Heron,SurveyDate: 6/1980,020202627,NULL,,1980,6,NULL,Howe,NULL,NULL,Eddy,NM,Snowy Egret,SurveyDate: 6/1980,019702628,NULL,,1981,5,NULL,West,NULL,NULL,Eddy,NM,Snowy Egret,SurveyDate: 5/1981,019702629,5/25/1981,00:00.0,1981,5,25,West,NULL,NULL,Eddy,NM,Little Blue Heron,NULL,020002630,7/2/1981,00:00.0,1981,7,2,West,NULL,NULL,Eddy,NM,Tricolored Heron,NULL,019902631,5/26/1982,00:00.0,1982,5,26,West,NULL,NULL,Eddy,NM,Black-crowned Night-Heron,NULL,020202632,5/26/1982,00:00.0,1982,5,26,West,NULL,NULL,Eddy,NM,Snowy Egret,NULL,019701505,3/25/2008,00:00.0,2008,3,25,Moulton,NULL,NULL,Canyon,ID,Great Blue Heron,NULL,019401506,3/25/2008,00:00.0,2008,3,25,Moulton,NULL,NULL,Canyon,ID,Double-crested Cormorant,NULL,012001507,3/25/2008,00:00.0,2008,3,25,Moulton,NULL,NULL,Canyon,ID,Great Blue Heron,NULL,019401508,3/25/2008,00:00.0,2008,3,25,Moulton,NULL,NULL,Canyon,ID,Great Egret,NULL,019601509,3/31/2008,00:00.0,2008,3,31,Sweeney,NULL,NULL,Canyon,ID,Great Egret,NULL,019601510,3/25/2008,00:00.0,2008,3,25,Moulton,NULL,NULL,Canyon,ID,Great Blue Heron,NULL,019401511,3/25/2008,00:00.0,2008,3,25,Moulton,NULL,NULL,Canyon,ID,Great Blue Heron,NULL,019401512,3/25/2008,00:00.0,2008,3,25,Moulton,NULL,NULL,Canyon,ID,Double-crested Cormorant,NULL,012001513,3/25/2008,00:00.0,2008,3,25,McCarthy/Malhas,NULL,NULL,Canyon,ID,Great Blue Heron,NULL,019401514,3/16/2007,00:00.0,2007,3,16,Moulton,NULL,NULL,Ada,ID,Great Blue Heron,NULL,019401515,NULL,,1992,7,NULL,Klott,NULL,NULL,Owyhee,ID,Clark's Grebe,NULL,000111516,5/28/1993,00:00.0,1993,5,28,Trost,NULL,NULL,Elmore,ID,Black-crowned Night-Heron,NULL,020201517,5/28/1993,00:00.0,1993,5,28,Trost,NULL,NULL,Elmore,ID,Great Egret,NULL,019601518,7/8/1993,00:00.0,1993,7,8,Trost,NULL,NULL,Jefferson,ID,White-faced Ibis,NULL,018701519,6/16/1993,00:00.0,1993,6,16,Deutscher,NULL,NULL,Jefferson,ID,White-faced Ibis,NULL,018701520,6/29/1993,00:00.0,1993,6,29,Deutscher,NULL,NULL,Jefferson,ID,Black-crowned Night-Heron,NULL,020201521,6/29/1993,00:00.0,1993,6,29,Deutscher,NULL,NULL,Jefferson,ID,Cattle Egret,NULL,020011522,6/29/1993,00:00.0,1993,6,29,Deutscher,NULL,NULL,Jefferson,ID,Great Egret,NULL,019601523,6/29/1993,00:00.0,1993,6,29,Deutscher,NULL,NULL,Jefferson,ID,Snowy Egret,NULL,019701524,7/5/1993,00:00.0,1993,7,5,Trost,NULL,NULL,Jefferson,ID,Black-crowned Night-Heron,NULL,020201525,7/5/1993,00:00.0,1993,7,5,Trost,NULL,NULL,Jefferson,ID,Black-crowned Night-Heron,NULL,020201526,7/8/1993,00:00.0,1993,7,8,Trost,NULL,NULL,Jefferson,ID,Cattle Egret,NULL,020011527,7/8/1993,00:00.0,1993,7,8,Deutscher,NULL,NULL,Jefferson,ID,Great Egret,NULL,019601528,7/5/1993,00:00.0,1993,7,5,Trost,NULL,NULL,Jefferson,ID,White-faced Ibis,NULL,018701529,7/8/1993,00:00.0,1993,7,8,Trost,NULL,NULL,Jefferson,ID,Black Tern,NULL,007701530,6/9/1993,00:00.0,1993,6,9,Trost,NULL,NULL,Blaine,ID,Black Tern,NULL,007701531,6/8/1993,00:00.0,1993,6,8,Trost,NULL,NULL,Bonner,ID,Black Tern,NULL,007701532,5/2/2008,00:00.0,2008,5,2,Gray/Sauder,NULL,NULL,Nez Perce,ID,Great Blue Heron,NULL,019401533,3/31/2008,00:00.0,2008,3,31,Gray/de La Rue,NULL,NULL,Nez Perce,ID,Great Blue Heron,NULL,019401534,5/2/2008,00:00.0,2008,5,2,Gray/Sauder,NULL,NULL,Idaho,ID,Great Blue Heron,NULL,019401535,3/31/2008,00:00.0,2008,3,31,Gray/de La Rue,NULL,NULL,Nez Perce,ID,Great Blue Heron,NULL,019401536,3/31/2008,00:00.0,2008,3,31,Gray/de La Rue,NULL,NULL,Nez Perce,ID,Great Blue Heron,NULL,019401537,5/2/2008,00:00.0,2008,5,2,Sauder/Gray,NULL,NULL,Clearwater,ID,Great Blue Heron,NULL,019401538,5/25/1994,00:00.0,1994,5,25,Trost,NULL,NULL,Kootenai,ID,Clark's Grebe,NULL,000111539,5/26/1994,00:00.0,1994,5,26,Trost,NULL,NULL,Kootenai,ID,Western Grebe,NULL,000101540,6/1/2007,00:00.0,2007,6,1,Weinandt/Pfaff,NULL,NULL,Kootenai,ID,Western Grebe,NULL,000101541,6/14/2007,00:00.0,2007,6,14,Weinandt/Pfaff,NULL,NULL,Kootenai,ID,Western Grebe,NULL,000101542,6/20/2007,00:00.0,2007,6,20,Weinandt/Pfaff,NULL,NULL,Kootenai,ID,Western Grebe,NULL,000101543,6/23/2007,00:00.0,2007,6,23,Hugo,NULL,NULL,Kootenai,ID,Western Grebe,NULL,000101544,6/28/2007,00:00.0,2007,6,28,Weinandt/Pfaff,NULL,NULL,Kootenai,ID,Western Grebe,NULL,000101545,6/28/2007,00:00.0,2007,6,28,Weinandt/Pfaff,NULL,NULL,Kootenai,ID,Western Grebe,NULL,000101546,7/12/2007,00:00.0,2007,7,12,Weinandt/Pfaff,NULL,NULL,Kootenai,ID,Western Grebe,NULL,000101547,7/19/2007,00:00.0,2007,7,19,Pfaff/Weinandt,NULL,NULL,Kootenai,ID,Western Grebe,NULL,000101548,5/26/1994,00:00.0,1994,5,26,Trost,NULL,NULL,Kootenai,ID,Black Tern,NULL,007701549,5/26/1994,00:00.0,1994,5,26,Trost,NULL,NULL,Kootenai,ID,Black Tern,NULL,007701550,5/26/1994,00:00.0,1994,5,26,Trost,NULL,NULL,Kootenai,ID,Black Tern,NULL,007701551,5/26/1993,00:00.0,1993,5,26,Stanley,NULL,NULL,Canyon,ID,Black-crowned Night-Heron,NULL,020201552,6/3/1993,00:00.0,1993,6,3,Trost,NULL,NULL,Canyon,ID,Black-crowned Night-Heron,NULL,020201553,5/26/1993,00:00.0,1993,5,26,Stanley,NULL,NULL,Canyon,ID,Western Grebe,NULL,000101554,5/26/1993,00:00.0,1993,5,26,Stanley,NULL,NULL,Payette,ID,Clark's Grebe,NULL,000111555,5/28/1993,00:00.0,1993,5,28,Trost,NULL,NULL,Owyhee,ID,Black-crowned Night-Heron,NULL,020201556,5/28/1993,00:00.0,1993,5,28,Trost,NULL,NULL,Owyhee,ID,Snowy Egret,NULL,019701557,5/28/1993,00:00.0,1993,5,28,Trost,NULL,NULL,Owyhee,ID,White-faced Ibis,NULL,018701558,6/28/1993,00:00.0,1993,6,28,Trost,NULL,NULL,Owyhee,ID,Great Egret,NULL,019601559,6/28/1993,00:00.0,1993,6,28,Hlavaty,NULL,NULL,Owyhee,ID,Snowy Egret,NULL,019701560,6/28/1993,00:00.0,1993,6,28,Trost,NULL,NULL,Owyhee,ID,White-faced Ibis,NULL,018701561,6/6/2008,00:00.0,2008,6,6,Sturts,NULL,NULL,Kootenai,ID,Great Blue Heron,NULL,019401562,5/26/1993,00:00.0,1993,5,26,Trost,NULL,NULL,Bonneville,ID,Black Tern,NULL,007701563,5/26/1993,00:00.0,1993,5,26,Trost,NULL,NULL,Bonneville,ID,Franklin's Gull,NULL,005901564,5/26/1993,00:00.0,1993,5,26,Trost,NULL,NULL,Bonneville,ID,White-faced Ibis,NULL,018701565,6/29/1994,00:00.0,1994,6,29,Trost,NULL,NULL,Bonneville,ID,Forster's Tern,NULL,006901566,7/3/1994,00:00.0,1994,7,3,Trost,NULL,NULL,Fremont,ID,Black Tern,NULL,007701567,7/17/1993,00:00.0,1993,7,17,Trost,NULL,NULL,Fremont,ID,Western Grebe,NULL,000101568,6/20/2007,00:00.0,2007,6,20,Weinandt/Pfaff,NULL,NULL,Fremont,ID,Franklin's Gull,NULL,005901569,7/17/1993,00:00.0,1993,7,17,Trost,NULL,NULL,Fremont,ID,Black-crowned Night-Heron,NULL,020201570,7/13/2006,00:00.0,2006,7,13,Moulton,NULL,NULL,Fremont,ID,Black-crowned Night-Heron,NULL,020201571,7/13/2006,00:00.0,2006,7,13,Moulton,NULL,NULL,Fremont,ID,California Gull,NULL,005301572,7/13/2006,00:00.0,2006,7,13,Moulton,NULL,NULL,Fremont,ID,Caspian Tern,NULL,006401573,7/13/2006,00:00.0,2006,7,13,Moulton,NULL,NULL,Fremont,ID,Double-crested Cormorant,NULL,012001574,7/13/2006,00:00.0,2006,7,13,Moulton,NULL,NULL,Fremont,ID,Great Blue Heron,NULL,019401575,7/13/2006,00:00.0,2006,7,13,Moulton,NULL,NULL,Fremont,ID,Ring-billed Gull,NULL,005401576,6/29/2007,00:00.0,2007,6,29,Leist/Nelson,NULL,NULL,Fremont,ID,Caspian Tern,NULL,006401577,6/27/2008,00:00.0,2008,6,27,Alexander/Weinandt,NULL,NULL,Fremont,ID,Caspian Tern,NULL,006401578,6/27/2008,00:00.0,2008,6,27,Alexander/Weinandt,NULL,NULL,Fremont,ID,Double-crested Cormorant,NULL,012001579,6/29/1993,00:00.0,1993,6,29,Reynolds,NULL,NULL,NULL,ID,Black Tern,NULL,007701580,7/7/1994,00:00.0,1994,7,7,Trost,NULL,NULL,Valley,ID,Western Grebe,NULL,000101581,7/2/2007,00:00.0,2007,7,2,Weinandt/Pfaff,NULL,NULL,Bonner,ID,Western Grebe,NULL,000101582,7/9/2007,00:00.0,2007,7,9,Weinandt/Pfaff,NULL,NULL,Bonner,ID,Western Grebe,NULL,000101583,7/17/2007,00:00.0,2007,7,17,Weinandt/Pfaff,NULL,NULL,Bonner,ID,Western Grebe,NULL,000101584,7/21/2007,00:00.0,2007,7,21,Weinandt/Pfaff,NULL,NULL,Bonner,ID,Western Grebe,NULL,000101585,6/13/1993,00:00.0,1993,6,13,Trost,NULL,NULL,Camas or Blaine,ID,California Gull,NULL,005301586,6/13/1993,00:00.0,1993,6,13,Trost,NULL,NULL,Camas or Blaine,ID,Caspian Tern,NULL,006401587,6/13/1993,00:00.0,1993,6,13,Trost,NULL,NULL,Camas or Blaine,ID,Ring-billed Gull,NULL,005401588,6/12/2006,00:00.0,2006,6,12,Moulton,NULL,NULL,Camas or Blaine,ID,California Gull,NULL,005301589,6/12/2006,00:00.0,2006,6,12,Moulton,NULL,NULL,Camas or Blaine,ID,Double-crested Cormorant,NULL,012001590,6/12/2007,00:00.0,2007,6,12,Moulton/Bjork,NULL,NULL,Camas or Blaine,ID,Caspian Tern,NULL,006401591,6/12/2007,00:00.0,2007,6,12,Moulton/Bjork,NULL,NULL,Camas or Blaine,ID,Double-crested Cormorant,NULL,012001592,6/12/2006,00:00.0,2006,6,12,Moulton,NULL,NULL,Blaine,ID,California Gull,NULL,005301593,6/12/2006,00:00.0,2006,6,12,Moulton,NULL,NULL,Blaine,ID,Caspian Tern,NULL,006401594,6/12/2006,00:00.0,2006,6,12,Moulton,NULL,NULL,Blaine,ID,Ring-billed Gull,NULL,005401595,6/12/2006,00:00.0,2006,6,12,Moulton,NULL,NULL,Blaine,ID,Ring-billed Gull,NULL,005401596,7/21/1993,00:00.0,1993,7,21,Trost,NULL,NULL,Jefferson,ID,Black Tern,NULL,007701597,6/7/1993,00:00.0,1993,6,7,Trost,NULL,NULL,Jefferson,ID,Franklin's Gull,NULL,005901598,6/7/1993,00:00.0,1993,6,7,Trost,NULL,NULL,Jefferson,ID,Franklin's Gull,NULL,005901599,6/7/1993,00:00.0,1993,6,7,Trost,NULL,NULL,Jefferson,ID,Great Egret,NULL,019601600,6/7/1993,00:00.0,1993,6,7,Trost,NULL,NULL,Jefferson,ID,White-faced Ibis,NULL,018701601,6/10/1993,00:00.0,1993,6,10,Kemner,NULL,NULL,Jefferson,ID,Cattle Egret,NULL,020011602,6/15/1993,00:00.0,1993,6,15,Trost,NULL,NULL,Jefferson,ID,Snowy Egret,NULL,019701603,6/24/1993,00:00.0,1993,6,24,Trost,NULL,NULL,Jefferson,ID,Black-crowned Night-Heron,NULL,020201604,6/24/1993,00:00.0,1993,6,24,Trost,NULL,NULL,Jefferson,ID,White-faced Ibis,NULL,018701605,7/3/1993,00:00.0,1993,7,3,Trost,NULL,NULL,Jefferson,ID,Franklin's Gull,NULL,005901606,7/3/1993,00:00.0,1993,7,3,Trost,NULL,NULL,Jefferson,ID,Ring-billed Gull,NULL,005401607,7/2/1994,00:00.0,1994,7,2,Trost,NULL,NULL,Jefferson,ID,Forster's Tern,NULL,006901608,5/26/1994,00:00.0,1994,5,26,Trost,NULL,NULL,NULL,ID,Black Tern,NULL,007701609,5/26/1994,00:00.0,1994,5,26,Trost,NULL,NULL,NULL,ID,Black Tern,NULL,007701610,7/17/1993,00:00.0,1993,7,17,Trost,NULL,NULL,Fremont,ID,Western Grebe,NULL,000101611,8/20/1993,00:00.0,1993,8,20,Trost,NULL,NULL,Power,ID,Clark's Grebe,NULL,000111612,8/20/1993,00:00.0,1993,8,20,Trost,NULL,NULL,Power,ID,Western Grebe,NULL,000101613,6/22/1993,00:00.0,1993,6,22,Trost,NULL,NULL,Cassia,ID,Black-crowned Night-Heron,NULL,020201614,6/22/1993,00:00.0,1993,6,22,Trost,NULL,NULL,Cassia,ID,California Gull,NULL,005301615,6/24/1993,00:00.0,1993,6,24,Trost,NULL,NULL,Cassia,ID,Black-crowned Night-Heron,NULL,020201616,8/19/1993,00:00.0,1993,8,19,Trost,NULL,NULL,Cassia,ID,American White Pelican,NULL,012501617,8/19/1993,00:00.0,1993,8,19,Trost,NULL,NULL,Cassia,ID,Caspian Tern,NULL,006401618,6/2/2006,00:00.0,2006,6,2,Moulton,NULL,NULL,Cassia,ID,American White Pelican,NULL,012501619,6/2/2006,00:00.0,2006,6,2,Moulton,NULL,NULL,Cassia,ID,Black-crowned Night-Heron,NULL,020201620,6/2/2006,00:00.0,2006,6,2,Moulton,NULL,NULL,Cassia,ID,California Gull,NULL,005301621,6/2/2006,00:00.0,2006,6,2,Moulton,NULL,NULL,Cassia,ID,Double-crested Cormorant,NULL,012001622,5/31/2007,00:00.0,2007,5,31,Moulton/Bouffard,NULL,NULL,Cassia,ID,American White Pelican,NULL,012501623,5/31/2007,00:00.0,2007,5,31,Moulton/Bouffard,NULL,NULL,Cassia,ID,Black-crowned Night-Heron,NULL,020201624,5/31/2007,00:00.0,2007,5,31,Moulton/Bouffard,NULL,NULL,Cassia,ID,California Gull,NULL,005301625,5/31/2007,00:00.0,2007,5,31,Moulton/Bouffard,NULL,NULL,Cassia,ID,Double-crested Cormorant,NULL,012001626,6/4/2008,00:00.0,2008,6,4,Moulton,NULL,NULL,Cassia,ID,American White Pelican,NULL,012501627,6/4/2008,00:00.0,2008,6,4,Moulton,NULL,NULL,Cassia,ID,Double-crested Cormorant,NULL,012001628,6/2/2006,00:00.0,2006,6,2,Moulton,NULL,NULL,Cassia,ID,American White Pelican,NULL,012501629,6/2/2006,00:00.0,2006,6,2,Moulton,NULL,NULL,Cassia,ID,Black-crowned Night-Heron,NULL,020201630,6/2/2006,00:00.0,2006,6,2,Moulton,NULL,NULL,Cassia,ID,California Gull,NULL,005301631,6/2/2006,00:00.0,2006,6,2,Moulton,NULL,NULL,Cassia,ID,Cattle Egret,NULL,020011632,6/2/2006,00:00.0,2006,6,2,Moulton,NULL,NULL,Cassia,ID,Double-crested Cormorant,NULL,012001633,6/2/2006,00:00.0,2006,6,2,Moulton,NULL,NULL,Cassia,ID,Snowy Egret,NULL,019701634,5/31/2007,00:00.0,2007,5,31,Moulton/Bouffard,NULL,NULL,Cassia,ID,American White Pelican,NULL,012501635,5/31/2007,00:00.0,2007,5,31,Moulton/Bouffard,NULL,NULL,Cassia,ID,Black-crowned Night-Heron,NULL,020201636,5/31/2007,00:00.0,2007,5,31,Moulton/Bouffard,NULL,NULL,Cassia,ID,California Gull,NULL,005301637,5/31/2007,00:00.0,2007,5,31,Moulton/Bouffard,NULL,NULL,Cassia,ID,Cattle Egret,NULL,020011638,5/31/2007,00:00.0,2007,5,31,Moulton/Bouffard,NULL,NULL,Cassia,ID,Double-crested Cormorant,NULL,012001639,5/31/2007,00:00.0,2007,5,31,Moulton/Bouffard,NULL,NULL,Cassia,ID,Snowy Egret,NULL,019701640,6/4/2008,00:00.0,2008,6,4,Moulton,NULL,NULL,Cassia,ID,American White Pelican,NULL,012501641,6/4/2008,00:00.0,2008,6,4,Moulton,NULL,NULL,Cassia,ID,Double-crested Cormorant,NULL,012001642,6/22/1993,00:00.0,1993,6,22,Trost,NULL,NULL,Cassia,ID,Snowy Egret,NULL,019701643,6/22/1993,00:00.0,1993,6,22,Trost,NULL,NULL,Cassia,ID,Snowy Egret,NULL,019701644,6/2/2006,00:00.0,2006,6,2,Moulton,NULL,NULL,Cassia,ID,Great Blue Heron,NULL,019401645,6/2/2006,00:00.0,2006,6,2,Moulton,NULL,NULL,Cassia,ID,American White Pelican,NULL,012501646,6/2/2006,00:00.0,2006,6,2,Moulton,NULL,NULL,Cassia,ID,California Gull,NULL,005301647,6/2/2006,00:00.0,2006,6,2,Moulton,NULL,NULL,Cassia,ID,Caspian Tern,NULL,006401648,5/31/2007,00:00.0,2007,5,31,Moulton/Bjork,NULL,NULL,Cassia,ID,American White Pelican,NULL,012501649,5/31/2007,00:00.0,2007,5,31,Moulton/Bjork,NULL,NULL,Cassia,ID,California Gull,NULL,005301650,5/31/2007,00:00.0,2007,5,31,Moulton/Bjork,NULL,NULL,Cassia,ID,Caspian Tern,NULL,006401651,6/4/2008,00:00.0,2008,6,4,Moulton/Weinandt,NULL,NULL,Cassia,ID,American White Pelican,NULL,012501652,6/4/2008,00:00.0,2008,6,4,Moulton/Weinandt,NULL,NULL,Cassia,ID,California Gull,NULL,005301653,6/4/2008,00:00.0,2008,6,4,Moulton/Weinandt,NULL,NULL,Cassia,ID,Caspian Tern,NULL,006401654,6/13/1993,00:00.0,1993,6,13,Trost,NULL,NULL,Camas,ID,Black-crowned Night-Heron,NULL,020201655,6/13/1993,00:00.0,1993,6,13,Trost,NULL,NULL,Camas,ID,California Gull,NULL,005301656,6/13/1993,00:00.0,1993,6,13,Trost,NULL,NULL,Camas,ID,Caspian Tern,NULL,006401657,6/13/1993,00:00.0,1993,6,13,Trost,NULL,NULL,Camas,ID,Ring-billed Gull,NULL,005401658,6/16/2006,00:00.0,2006,6,16,Moulton,NULL,NULL,Camas,ID,California Gull,NULL,005301659,6/16/2006,00:00.0,2006,6,16,Moulton,NULL,NULL,Camas,ID,Caspian Tern,NULL,006401660,6/16/2006,00:00.0,2006,6,16,Moulton,NULL,NULL,Camas,ID,Double-crested Cormorant,NULL,012001661,6/16/2006,00:00.0,2006,6,16,Moulton,NULL,NULL,Camas,ID,Ring-billed Gull,NULL,005401662,6/12/2007,00:00.0,2007,6,12,Moulton/Bjork,NULL,NULL,Camas,ID,Black-crowned Night-Heron,NULL,020201663,6/12/2007,00:00.0,2007,6,12,Moulton/Bjork,NULL,NULL,Camas,ID,Caspian Tern,NULL,006401664,6/12/2007,00:00.0,2007,6,12,Moulton/Bjork,NULL,NULL,Camas,ID,Double-crested Cormorant,NULL,012001665,6/12/2008,00:00.0,2008,6,12,Weinandt/Alexander,NULL,NULL,Camas,ID,California Gull,NULL,005301666,7/6/1994,00:00.0,1994,7,6,Trost,NULL,NULL,Owyhee,ID,Western or Clark's Grebe,NULL,NULL1667,7/6/1994,00:00.0,1994,7,6,Trost,NULL,NULL,Owyhee,ID,Black Tern,NULL,007701668,7/6/1994,00:00.0,1994,7,6,Trost,NULL,NULL,Owyhee,ID,Forster's Tern,NULL,006901669,7/6/1994,00:00.0,1994,7,6,Trost,NULL,NULL,NULL,ID,Forster's Tern,NULL,006901670,6/10/1993,00:00.0,1993,6,10,Kemner,NULL,NULL,Jefferson,ID,Cattle Egret,NULL,020011671,6/25/1993,00:00.0,1993,6,25,Trost,NULL,NULL,Jefferson,ID,Great Egret,NULL,019601672,7/21/1993,00:00.0,1993,7,21,Trost,NULL,NULL,Jefferson,ID,Snowy Egret,NULL,019701673,6/14/1993,00:00.0,1993,6,14,Trost,NULL,NULL,Jefferson,ID,Black-crowned Night-Heron,NULL,020201674,6/14/1993,00:00.0,1993,6,14,Trost,NULL,NULL,Jefferson,ID,Clark's Grebe,NULL,000111675,6/14/1993,00:00.0,1993,6,14,Trost,NULL,NULL,Jefferson,ID,White-faced Ibis,NULL,018701676,7/9/1993,00:00.0,1993,7,9,Trost,NULL,NULL,Jefferson,ID,Franklin's Gull,NULL,005901677,7/9/1993,00:00.0,1993,7,9,Trost,NULL,NULL,Jefferson,ID,White-faced Ibis,NULL,018701678,8/4/1993,00:00.0,1993,8,4,Trost,NULL,NULL,Jefferson,ID,Western Grebe,NULL,000101679,6/5/1993,00:00.0,1993,6,5,Trost,NULL,NULL,Franklin,ID,White-faced Ibis,NULL,018701680,6/22/1993,00:00.0,1993,6,22,Trost,NULL,NULL,Franklin,ID,White-faced Ibis,NULL,018701681,6/23/1993,00:00.0,1993,6,23,Trost,NULL,NULL,Franklin,ID,Black-crowned Night-Heron,NULL,020201682,6/23/1993,00:00.0,1993,6,23,Trost,NULL,NULL,Franklin,ID,Cattle Egret,NULL,020011683,6/23/1993,00:00.0,1993,6,23,Trost,NULL,NULL,Franklin,ID,Franklin's Gull,NULL,005901684,6/23/1993,00:00.0,1993,6,23,Trost,NULL,NULL,Franklin,ID,Snowy Egret,NULL,019701685,6/23/1993,00:00.0,1993,6,23,Trost,NULL,NULL,Franklin,ID,White-faced Ibis,NULL,018701686,6/23/1993,00:00.0,1993,6,23,Trost,NULL,NULL,Franklin,ID,White-faced Ibis,NULL,018701687,4/29/2007,00:00.0,2007,4,29,Manwaring/Manwaring,NULL,NULL,Payette,ID,Great Blue Heron,NULL,019401688,4/23/2007,00:00.0,2007,4,23,Manwaring/Smith,NULL,NULL,Gem,ID,Double-crested Cormorant,NULL,012001689,4/23/2007,00:00.0,2007,4,23,Manwaring/Smith,NULL,NULL,Gem,ID,Great Blue Heron,NULL,019401690,4/29/2007,00:00.0,2007,4,29,Manwaring/Manwaring,NULL,NULL,Gem,ID,Great Blue Heron,NULL,019401691,4/27/2007,00:00.0,2007,4,27,Manwaring/Manwaring,NULL,NULL,Gem,ID,Black-crowned Night-Heron,NULL,020201692,4/27/2007,00:00.0,2007,4,27,Manwaring/Manwaring,NULL,NULL,Gem,ID,Great Blue Heron,NULL,01940565,6/15/2001,00:00.0,2001,6,15,NULL,NULL,NULL,Mesa,CO,Eared Grebe,NULL,00040566,8/18/2001,00:00.0,2001,8,18,NULL,NULL,NULL,Mesa,CO,Eared Grebe,NULL,00040567,7/8/2002,00:00.0,2002,7,8,NULL,NULL,NULL,Mesa,CO,Eared Grebe,NULL,00040568,NULL,,1999,NULL,NULL,NULL,NULL,NULL,Montrose,CO,Great Blue Heron,NULL,01940569,NULL,,2000,NULL,NULL,NULL,NULL,NULL,Montrose,CO,Great Blue Heron,NULL,01940570,NULL,,2001,NULL,NULL,NULL,NULL,NULL,Montrose,CO,Great Blue Heron,NULL,01940571,NULL,,2002,NULL,NULL,NULL,NULL,NULL,Montrose,CO,Great Blue Heron,NULL,01940572,NULL,,2003,NULL,NULL,NULL,NULL,NULL,Montrose,CO,Great Blue Heron,NULL,01940573,NULL,,2004,NULL,NULL,NULL,NULL,NULL,Montrose,CO,Great Blue Heron,NULL,01940574,NULL,,2005,NULL,NULL,NULL,NULL,NULL,Montrose,CO,Great Blue Heron,NULL,01940575,NULL,,2005,NULL,NULL,NULL,NULL,NULL,Mesa,CO,Great Blue Heron,NULL,01940576,NULL,,2006,NULL,NULL,NULL,NULL,NULL,Kiowa,CO,Great Blue Heron,NULL,01940577,NULL,,2004,NULL,NULL,NULL,NULL,NULL,Morgan,CO,Great Blue Heron,NULL,01940578,4/28/2005,00:00.0,2005,4,28,NULL,NULL,NULL,Morgan,CO,Great Blue Heron,NULL,01940579,NULL,,2000,NULL,NULL,NULL,NULL,NULL,Moffat,CO,Great Blue Heron,NULL,01940580,NULL,,2001,NULL,NULL,NULL,NULL,NULL,Moffat,CO,Great Blue Heron,NULL,01940581,NULL,,2002,NULL,NULL,NULL,NULL,NULL,Moffat,CO,Great Blue Heron,NULL,01940582,NULL,,2003,NULL,NULL,NULL,NULL,NULL,Moffat,CO,Great Blue Heron,NULL,01940583,NULL,,2004,NULL,NULL,NULL,NULL,NULL,Moffat,CO,Great Blue Heron,NULL,01940584,NULL,,2005,NULL,NULL,NULL,NULL,NULL,Moffat,CO,Great Blue Heron,NULL,01940585,NULL,,2006,NULL,NULL,NULL,NULL,NULL,Moffat,CO,Great Blue Heron,NULL,01940586,NULL,,2002,NULL,NULL,NULL,NULL,NULL,Gunnison,CO,Great Blue Heron,NULL,01940587,NULL,,2003,NULL,NULL,NULL,NULL,NULL,Gunnison,CO,Great Blue Heron,NULL,01940588,NULL,,2004,NULL,NULL,NULL,NULL,NULL,Gunnison,CO,Great Blue Heron,NULL,01940589,NULL,,2002,NULL,NULL,NULL,NULL,NULL,Delta,CO,Great Blue Heron,NULL,01940590,NULL,,2004,NULL,NULL,NULL,NULL,NULL,Delta,CO,Great Blue Heron,NULL,01940591,NULL,,2005,NULL,NULL,NULL,NULL,NULL,Delta,CO,Great Blue Heron,NULL,01940592,NULL,,2006,NULL,NULL,NULL,NULL,NULL,Delta,CO,Great Blue Heron,NULL,01940593,3/21/2003,00:00.0,2003,3,21,NULL,NULL,NULL,Delta,CO,Great Blue Heron,NULL,01940594,NULL,,2002,NULL,NULL,NULL,NULL,NULL,Boulder,CO,Great Blue Heron,NULL,01940595,NULL,,2003,NULL,NULL,NULL,NULL,NULL,Boulder,CO,Great Blue Heron,NULL,01940596,5/28/2005,00:00.0,2005,5,28,NULL,NULL,NULL,Dolores,CO,Eared Grebe,NULL,00040597,NULL,,2000,NULL,NULL,NULL,NULL,NULL,El Paso,CO,Great Blue Heron,NULL,01940598,NULL,,2001,NULL,NULL,NULL,NULL,NULL,El Paso,CO,Great Blue Heron,NULL,01940599,NULL,,2002,NULL,NULL,NULL,NULL,NULL,El Paso,CO,Great Blue Heron,NULL,01940600,NULL,,2003,NULL,NULL,NULL,NULL,NULL,El Paso,CO,Great Blue Heron,NULL,01940601,5/2/2004,00:00.0,2004,5,2,Elwonger,NULL,NULL,El Paso,CO,Great Blue Heron,NULL,01940602,4/21/2005,00:00.0,2005,4,21,NULL,NULL,NULL,El Paso,CO,Great Blue Heron,NULL,01940603,NULL,,2000,NULL,NULL,NULL,NULL,NULL,Delta,CO,Great Blue Heron,NULL,01940604,NULL,,2001,NULL,NULL,NULL,NULL,NULL,Delta,CO,Great Blue Heron,NULL,01940605,NULL,,2002,NULL,NULL,NULL,NULL,NULL,Delta,CO,Great Blue Heron,NULL,01940606,NULL,,2003,NULL,NULL,NULL,NULL,NULL,Delta,CO,Great Blue Heron,NULL,01940607,NULL,,2004,NULL,NULL,NULL,NULL,NULL,Delta,CO,Great Blue Heron,NULL,01940608,NULL,,2005,NULL,NULL,NULL,NULL,NULL,Delta,CO,Great Blue Heron,NULL,01940609,NULL,,2006,NULL,NULL,Galinate,NULL,NULL,Delta,CO,Clark's Grebe,NULL,00011610,NULL,,2006,NULL,NULL,NULL,NULL,NULL,Delta,CO,Western Grebe,NULL,00010611,7/23/1998,00:00.0,1998,7,23,NULL,NULL,NULL,Delta,CO,Western Grebe,NULL,00010612,7/13/1999,00:00.0,1999,7,13,NULL,NULL,NULL,Delta,CO,Clark's Grebe,NULL,00011613,7/13/1999,00:00.0,1999,7,13,NULL,NULL,NULL,Delta,CO,Western Grebe,NULL,00010614,6/11/2000,00:00.0,2000,6,11,NULL,NULL,NULL,Delta,CO,Western Grebe,NULL,00010615,6/6/2001,00:00.0,2001,6,6,NULL,NULL,NULL,Delta,CO,Clark's Grebe,NULL,00011616,6/27/2001,00:00.0,2001,6,27,NULL,NULL,NULL,Delta,CO,Western Grebe,NULL,00010617,4/30/2002,00:00.0,2002,4,30,Galinate,NULL,NULL,Delta,CO,Double-crested Cormorant,NULL,01200618,4/24/2003,00:00.0,2003,4,24,NULL,NULL,NULL,Delta,CO,Double-crested Cormorant,NULL,01200619,6/6/2003,00:00.0,2003,6,6,NULL,NULL,NULL,Delta,CO,Clark's Grebe,NULL,00011620,6/15/2003,00:00.0,2003,6,15,NULL,NULL,NULL,Delta,CO,Western Grebe,NULL,00010621,4/25/2004,00:00.0,2004,4,25,NULL,NULL,NULL,Delta,CO,Double-crested Cormorant,NULL,01200622,6/6/2004,00:00.0,2004,6,6,NULL,NULL,NULL,Delta,CO,Western Grebe,NULL,00010623,6/6/2005,00:00.0,2005,6,6,NULL,NULL,NULL,Delta,CO,Western Grebe,NULL,00010624,4/13/2003,00:00.0,2003,4,13,NULL,NULL,NULL,Mesa,CO,Great Blue Heron,NULL,01940625,7/24/1999,00:00.0,1999,7,24,Beason,NULL,NULL,Dolores,CO,Eared Grebe,NULL,00040626,NULL,,1998,NULL,NULL,Maxfield,NULL,NULL,Weld,CO,Black-crowned Night-Heron,NULL,02020627,NULL,,2000,NULL,NULL,Kippes,NULL,NULL,Weld,CO,Black-crowned Night-Heron,NULL,02020628,NULL,,2001,NULL,NULL,Kamal,NULL,NULL,Weld,CO,Black-crowned Night-Heron,NULL,02020629,NULL,,2002,NULL,NULL,Kamal,NULL,NULL,Weld,CO,Black-crowned Night-Heron,NULL,02020630,NULL,,2003,NULL,NULL,Kamal,NULL,NULL,Weld,CO,Black-crowned Night-Heron,NULL,02020631,7/26/2008,00:00.0,2008,7,26,Lefko,NULL,NULL,Weld,CO,Cattle Egret,NULL,02001632,7/26/2008,00:00.0,2008,7,26,Lefko,NULL,NULL,Weld,CO,Snowy Egret,NULL,01970633,NULL,,1998,NULL,NULL,NULL,NULL,NULL,Jackson,CO,Eared Grebe,NULL,00040634,NULL,,2005,NULL,NULL,NULL,NULL,NULL,Jackson,CO,Forster's Tern,NULL,00690635,7/11/2000,00:00.0,2000,7,11,NULL,NULL,NULL,Jackson,CO,Eared Grebe,NULL,00040636,7/5/2001,00:00.0,2001,7,5,NULL,NULL,NULL,Jackson,CO,Eared Grebe,NULL,00040637,7/18/2003,00:00.0,2003,7,18,NULL,NULL,NULL,Jackson,CO,Eared Grebe,NULL,00040638,7/13/2004,00:00.0,2004,7,13,NULL,NULL,NULL,Jackson,CO,Eared Grebe,NULL,00040639,NULL,,2003,NULL,NULL,NULL,NULL,NULL,Boulder,CO,Great Blue Heron,NULL,01940640,NULL,,2004,NULL,NULL,NULL,NULL,NULL,Boulder,CO,Great Blue Heron,NULL,01940641,NULL,,2004,NULL,NULL,NULL,NULL,NULL,Grand,CO,Western Grebe,NULL,00010642,5/12/2001,00:00.0,2001,5,12,NULL,NULL,NULL,Grand,CO,White-faced Ibis,NULL,01870643,7/15/2003,00:00.0,2003,7,15,NULL,NULL,NULL,Grand,CO,Western Grebe,NULL,00010644,NULL,,2001,NULL,NULL,NULL,NULL,NULL,Delta,CO,Great Blue Heron,NULL,01940645,NULL,,2006,NULL,NULL,NULL,NULL,NULL,Rio Blanco,CO,Great Blue Heron,NULL,01940646,4/3/2004,00:00.0,2004,4,3,NULL,NULL,NULL,Bent,CO,Great Blue Heron,NULL,01940647,NULL,,2004,NULL,NULL,NULL,NULL,NULL,Grand,CO,Great Blue Heron,NULL,01940648,NULL,,2005,NULL,NULL,NULL,NULL,NULL,Grand,CO,Great Blue Heron,NULL,01940649,6/11/2004,00:00.0,2004,6,11,NULL,NULL,NULL,Jackson,CO,Western Grebe,NULL,00010650,NULL,,1977,NULL,NULL,NULL,NULL,NULL,Jackson,CO,Forster's Tern,NULL,00690651,NULL,,2002,NULL,NULL,NULL,NULL,NULL,Jackson,CO,Forster's Tern,NULL,00690652,6/30/1977,00:00.0,1977,6,30,NULL,NULL,NULL,Jackson,CO,Eared Grebe,NULL,00040653,7/20/1999,00:00.0,1999,7,20,NULL,NULL,NULL,Jackson,CO,Eared Grebe,NULL,00040654,7/20/1999,00:00.0,1999,7,20,NULL,NULL,NULL,Jackson,CO,Forster's Tern,NULL,00690655,7/20/1999,00:00.0,1999,7,20,NULL,NULL,NULL,Jackson,CO,Franklin's Gull,NULL,00590656,7/11/2000,00:00.0,2000,7,11,NULL,NULL,NULL,Jackson,CO,Forster's Tern,NULL,00690657,7/6/2001,00:00.0,2001,7,6,NULL,NULL,NULL,Jackson,CO,Eared Grebe,NULL,00040658,7/6/2001,00:00.0,2001,7,6,NULL,NULL,NULL,Jackson,CO,Western Grebe,NULL,00010659,7/7/2001,00:00.0,2001,7,7,NULL,NULL,NULL,Jackson,CO,Forster's Tern,NULL,00690660,7/23/2002,00:00.0,2002,7,23,NULL,NULL,NULL,Jackson,CO,Eared Grebe,NULL,00040661,7/23/2002,00:00.0,2002,7,23,NULL,NULL,NULL,Jackson,CO,Franklin's Gull,NULL,00590662,7/23/2002,00:00.0,2002,7,23,NULL,NULL,NULL,Jackson,CO,Western Grebe,NULL,00010663,6/15/2003,00:00.0,2003,6,15,NULL,NULL,NULL,Jackson,CO,Franklin's Gull,NULL,00590664,7/18/2003,00:00.0,2003,7,18,NULL,NULL,NULL,Jackson,CO,Eared Grebe,NULL,00040665,7/18/2003,00:00.0,2003,7,18,NULL,NULL,NULL,Jackson,CO,Forster's Tern,NULL,00690666,6/11/2004,00:00.0,2004,6,11,NULL,NULL,NULL,Jackson,CO,Eared Grebe,NULL,00040667,6/11/2004,00:00.0,2004,6,11,NULL,NULL,NULL,Jackson,CO,Forster's Tern,NULL,00690668,6/11/2004,00:00.0,2004,6,11,NULL,NULL,NULL,Jackson,CO,Franklin's Gull,NULL,00590669,6/23/2005,00:00.0,2005,6,23,NULL,NULL,NULL,Jackson,CO,Forster's Tern,NULL,00690670,6/23/2005,00:00.0,2005,6,23,NULL,NULL,NULL,Jackson,CO,Franklin's Gull,NULL,00590671,7/26/2005,00:00.0,2005,7,26,NULL,NULL,NULL,Jackson,CO,Eared Grebe,NULL,00040672,7/10/2006,00:00.0,2006,7,10,NULL,NULL,NULL,Jackson,CO,Eared Grebe,NULL,00040673,7/10/2006,00:00.0,2006,7,10,NULL,NULL,NULL,Jackson,CO,Forster's Tern,NULL,00690674,7/10/2006,00:00.0,2006,7,10,Slingsby,NULL,NULL,Jackson,CO,Western Grebe,NULL,00010675,NULL,,2005,NULL,NULL,NULL,NULL,NULL,Hinsdale,CO,Black-crowned Night-Heron,NULL,02020676,NULL,,2000,NULL,NULL,NULL,NULL,NULL,Adams,CO,Great Blue Heron,NULL,01940677,NULL,,2000,NULL,NULL,NULL,NULL,NULL,Adams,CO,Snowy Egret,NULL,01970678,NULL,,2001,NULL,NULL,NULL,NULL,NULL,Adams,CO,Great Blue Heron,NULL,01940679,NULL,,2002,NULL,NULL,NULL,NULL,NULL,Adams,CO,Great Blue Heron,NULL,01940680,NULL,,2003,NULL,NULL,NULL,NULL,NULL,Adams,CO,Black-crowned Night-Heron,NULL,02020681,NULL,,2003,NULL,NULL,NULL,NULL,NULL,Adams,CO,Great Blue Heron,NULL,01940682,NULL,,2004,NULL,NULL,NULL,NULL,NULL,Adams,CO,Great Blue Heron,NULL,01940683,NULL,,2002,NULL,NULL,NULL,NULL,NULL,Moffat,CO,Great Blue Heron,NULL,01940684,NULL,,2004,NULL,NULL,NULL,NULL,NULL,Moffat,CO,Great Blue Heron,NULL,01940685,NULL,,2004,NULL,NULL,NULL,NULL,NULL,Moffat,CO,Great Blue Heron,NULL,01940686,NULL,,2000,NULL,NULL,NULL,NULL,NULL,Larimer,CO,Great Blue Heron,NULL,01940687,NULL,,2001,NULL,NULL,NULL,NULL,NULL,Larimer,CO,Great Blue Heron,NULL,01940688,NULL,,2002,NULL,NULL,NULL,NULL,NULL,Larimer,CO,Great Blue Heron,NULL,01940689,NULL,,2003,NULL,NULL,NULL,NULL,NULL,Larimer,CO,Great Blue Heron,NULL,01940690,NULL,,2004,NULL,NULL,NULL,NULL,NULL,Larimer,CO,Great Blue Heron,NULL,01940691,NULL,,2005,NULL,NULL,NULL,NULL,NULL,Larimer,CO,Great Blue Heron,NULL,01940692,NULL,,1970,NULL,NULL,Stamper,NULL,NULL,Weld,CO,White-faced Ibis,NULL,01870693,NULL,,1976,NULL,NULL,NULL,NULL,NULL,Weld,CO,White-faced Ibis,NULL,01870694,NULL,,2003,NULL,NULL,NULL,NULL,NULL,Delta,CO,Great Blue Heron,NULL,01940695,NULL,,2004,NULL,NULL,NULL,NULL,NULL,Delta,CO,Great Blue Heron,NULL,01940696,NULL,,2005,NULL,NULL,NULL,NULL,NULL,Boulder,CO,Great Blue Heron,NULL,01940697,NULL,,2003,NULL,NULL,NULL,NULL,NULL,Boulder,CO,Great Blue Heron,NULL,01940698,NULL,,2005,NULL,NULL,NULL,NULL,NULL,Boulder,CO,Great Blue Heron,NULL,01940699,NULL,,2003,NULL,NULL,NULL,NULL,NULL,Boulder,CO,Great Blue Heron,NULL,01940700,NULL,,2004,NULL,NULL,NULL,NULL,NULL,Boulder,CO,Great Blue Heron,NULL,01940701,7/18/1998,00:00.0,1998,7,18,NULL,NULL,NULL,Jackson,CO,Eared Grebe,NULL,00040702,7/21/1999,00:00.0,1999,7,21,NULL,NULL,NULL,Jackson,CO,Double-crested Cormorant,NULL,01200703,7/21/1999,00:00.0,1999,7,21,NULL,NULL,NULL,Jackson,CO,Eared Grebe,NULL,00040704,7/22/1999,00:00.0,1999,7,22,NULL,NULL,NULL,Jackson,CO,American White Pelican,NULL,01250705,7/13/2000,00:00.0,2000,7,13,NULL,NULL,NULL,Jackson,CO,California Gull,NULL,00530706,7/13/2000,00:00.0,2000,7,13,NULL,NULL,NULL,Jackson,CO,Double-crested Cormorant,NULL,01200707,7/13/2000,00:00.0,2000,7,13,NULL,NULL,NULL,Jackson,CO,Eared Grebe,NULL,00040708,7/24/2000,00:00.0,2000,7,24,NULL,NULL,NULL,Jackson,CO,American White Pelican,NULL,01250709,7/7/2001,00:00.0,2001,7,7,NULL,NULL,NULL,Jackson,CO,American White Pelican,NULL,01250710,7/7/2001,00:00.0,2001,7,7,NULL,NULL,NULL,Jackson,CO,California Gull,NULL,00530711,7/7/2001,00:00.0,2001,7,7,NULL,NULL,NULL,Jackson,CO,Double-crested Cormorant,NULL,01200712,6/5/2002,00:00.0,2002,6,5,NULL,NULL,NULL,Jackson,CO,American White Pelican,NULL,01250713,6/5/2002,00:00.0,2002,6,5,NULL,NULL,NULL,Jackson,CO,California Gull,NULL,00530714,6/5/2002,00:00.0,2002,6,5,NULL,NULL,NULL,Jackson,CO,Double-crested Cormorant,NULL,01200715,7/23/2002,00:00.0,2002,7,23,NULL,NULL,NULL,Jackson,CO,Double-crested Cormorant,NULL,01200716,7/23/2002,00:00.0,2002,7,23,NULL,NULL,NULL,Jackson,CO,Eared Grebe,NULL,00040717,6/16/2003,00:00.0,2003,6,16,NULL,NULL,NULL,Jackson,CO,California Gull,NULL,00530718,6/16/2003,00:00.0,2003,6,16,NULL,NULL,NULL,Jackson,CO,Double-crested Cormorant,NULL,01200719,6/18/2003,00:00.0,2003,6,18,NULL,NULL,NULL,Jackson,CO,American White Pelican,NULL,01250720,6/12/2004,00:00.0,2004,6,12,NULL,NULL,NULL,Jackson,CO,Double-crested Cormorant,NULL,01200721,7/13/2004,00:00.0,2004,7,13,NULL,NULL,NULL,Jackson,CO,American White Pelican,NULL,01250722,7/13/2004,00:00.0,2004,7,13,NULL,NULL,NULL,Jackson,CO,California Gull,NULL,00530723,7/13/2004,00:00.0,2004,7,13,NULL,NULL,NULL,Jackson,CO,Eared Grebe,NULL,00040724,6/23/2005,00:00.0,2005,6,23,NULL,NULL,NULL,Jackson,CO,American White Pelican,NULL,01250725,6/23/2005,00:00.0,2005,6,23,NULL,NULL,NULL,Jackson,CO,Double-crested Cormorant,NULL,01200726,7/11/2006,00:00.0,2006,7,11,NULL,NULL,NULL,Jackson,CO,American White Pelican,NULL,01250727,7/11/2006,00:00.0,2006,7,11,NULL,NULL,NULL,Jackson,CO,Eared Grebe,NULL,00040728,NULL,,2001,NULL,NULL,NULL,NULL,NULL,Jefferson,CO,Double-crested Cormorant,NULL,01200729,NULL,,2001,NULL,NULL,Faulkner,NULL,NULL,Jefferson,CO,Great Blue Heron,NULL,01940730,NULL,,2002,NULL,NULL,NULL,NULL,NULL,Jefferson,CO,Double-crested Cormorant,NULL,01200731,4/19/2002,00:00.0,2002,4,19,NULL,NULL,NULL,Jefferson,CO,Great Blue Heron,NULL,01940732,4/24/2003,00:00.0,2003,4,24,NULL,NULL,NULL,Jefferson,CO,Double-crested Cormorant,NULL,01200733,4/27/2003,00:00.0,2003,4,27,NULL,NULL,NULL,Jefferson,CO,Great Blue Heron,NULL,01940734,4/9/2004,00:00.0,2004,4,9,NULL,NULL,NULL,Jefferson,CO,Double-crested Cormorant,NULL,01200735,4/9/2004,00:00.0,2004,4,9,NULL,NULL,NULL,Jefferson,CO,Great Blue Heron,NULL,01940736,4/16/2005,00:00.0,2005,4,16,NULL,NULL,NULL,Jefferson,CO,Double-crested Cormorant,NULL,01200737,4/16/2005,00:00.0,2005,4,16,NULL,NULL,NULL,Jefferson,CO,Great Blue Heron,NULL,01940738,NULL,,2001,NULL,NULL,NULL,NULL,NULL,El Paso,CO,Great Blue Heron,NULL,01940739,NULL,,2002,NULL,NULL,NULL,NULL,NULL,El Paso,CO,Great Blue Heron,NULL,01940740,4/18/2005,00:00.0,2005,4,18,NULL,NULL,NULL,El Paso,CO,Great Blue Heron,NULL,019403638,NULL,,1994,NULL,NULL,NULL,NULL,NULL,Albany,WY,Forster's Tern,NULL,00690741,4/29/2005,00:00.0,2005,4,29,NULL,NULL,NULL,Rio Blanco,CO,Great Blue Heron,NULL,01940742,NULL,,1978,NULL,NULL,NULL,NULL,NULL,Weld,CO,Great Blue Heron,NULL,01940743,NULL,,1981,NULL,NULL,Colonial Bird Register,NULL,NULL,Weld,CO,Black-crowned Night-Heron,NULL,02020744,NULL,,1981,NULL,NULL,NULL,NULL,NULL,Weld,CO,Great Blue Heron,NULL,01940745,NULL,,1999,NULL,NULL,NULL,NULL,NULL,Weld,CO,Great Blue Heron,NULL,01940746,NULL,,2000,NULL,NULL,NULL,NULL,NULL,Weld,CO,Black-crowned Night-Heron,NULL,02020747,NULL,,2000,NULL,NULL,NULL,NULL,NULL,Weld,CO,Great Blue Heron,NULL,01940748,4/22/2000,00:00.0,2000,4,22,NULL,NULL,NULL,Weld,CO,Double-crested Cormorant,NULL,01200749,4/13/2001,00:00.0,2001,4,13,NULL,NULL,NULL,Weld,CO,Double-crested Cormorant,NULL,01200750,4/28/2002,00:00.0,2002,4,28,NULL,NULL,NULL,Weld,CO,Black-crowned Night-Heron,NULL,02020751,4/28/2002,00:00.0,2002,4,28,NULL,NULL,NULL,Weld,CO,Double-crested Cormorant,NULL,01200752,4/28/2002,00:00.0,2002,4,28,NULL,NULL,NULL,Weld,CO,Great Blue Heron,NULL,019403573,NULL,,1992,NULL,NULL,NULL,NULL,NULL,Albany,WY,Caspian Tern,NULL,006403574,NULL,,1992,NULL,NULL,NULL,NULL,NULL,Albany,WY,Black-crowned Night-Heron,NULL,020203575,NULL,,1992,NULL,NULL,NULL,NULL,NULL,Albany,WY,American White Pelican,NULL,012503576,NULL,,1993,NULL,NULL,NULL,NULL,NULL,Albany,WY,Snowy Egret,NULL,019703577,NULL,,1993,NULL,NULL,NULL,NULL,NULL,Albany,WY,Double-crested Cormorant,NULL,012003578,NULL,,1993,NULL,NULL,NULL,NULL,NULL,Albany,WY,Caspian Tern,NULL,006403579,NULL,,1993,NULL,NULL,NULL,NULL,NULL,Albany,WY,Black-crowned Night-Heron,NULL,020203580,NULL,,1993,NULL,NULL,NULL,NULL,NULL,Albany,WY,American White Pelican,NULL,012503581,NULL,,1994,NULL,NULL,NULL,NULL,NULL,Albany,WY,Snowy Egret,NULL,019703582,NULL,,1994,NULL,NULL,NULL,NULL,NULL,Albany,WY,Double-crested Cormorant,NULL,012003583,NULL,,1994,NULL,NULL,NULL,NULL,NULL,Albany,WY,American White Pelican,NULL,012503584,NULL,,1995,NULL,NULL,NULL,NULL,NULL,Albany,WY,Snowy Egret,NULL,019703585,NULL,,1995,NULL,NULL,NULL,NULL,NULL,Albany,WY,Double-crested Cormorant,NULL,012003586,NULL,,1995,NULL,NULL,NULL,NULL,NULL,Albany,WY,Black-crowned Night-Heron,NULL,020203587,NULL,,1995,NULL,NULL,NULL,NULL,NULL,Albany,WY,American White Pelican,NULL,012503588,NULL,,1997,NULL,NULL,NULL,NULL,NULL,Albany,WY,Double-crested Cormorant,Adults present,012003589,NULL,,1997,NULL,NULL,NULL,NULL,NULL,Albany,WY,American White Pelican,NULL,012503590,NULL,,1999,NULL,NULL,NULL,NULL,NULL,Albany,WY,American White Pelican,Active nests,012503591,NULL,,2000,NULL,NULL,NULL,NULL,NULL,Albany,WY,American White Pelican,NULL,012503592,NULL,,2001,NULL,NULL,NULL,NULL,NULL,Albany,WY,Double-crested Cormorant,Adults present,012003593,NULL,,2001,NULL,NULL,NULL,NULL,NULL,Albany,WY,American White Pelican,NULL,012503594,NULL,,2003,NULL,NULL,NULL,NULL,NULL,Albany,WY,Double-crested Cormorant,NULL,012003595,NULL,,2003,NULL,NULL,NULL,NULL,NULL,Albany,WY,American White Pelican,NULL,012503596,NULL,,2004,NULL,NULL,NULL,NULL,NULL,Albany,WY,Double-crested Cormorant,Adults present,012003597,NULL,,2004,NULL,NULL,NULL,NULL,NULL,Albany,WY,American White Pelican,NULL,012503598,NULL,,2005,NULL,NULL,NULL,NULL,NULL,Albany,WY,Double-crested Cormorant,Active nests,012003599,NULL,,2005,NULL,NULL,NULL,NULL,NULL,Albany,WY,American White Pelican,NULL,012503600,NULL,,1983,NULL,NULL,NULL,NULL,NULL,Carbon,WY,Double-crested Cormorant,NULL,012003601,NULL,,1986,NULL,NULL,NULL,NULL,NULL,Carbon,WY,Double-crested Cormorant,NULL,012003602,NULL,,1986,NULL,NULL,NULL,NULL,NULL,Carbon,WY,Black-crowned Night-Heron,NULL,020203603,NULL,,1990,NULL,NULL,NULL,NULL,NULL,Carbon,WY,Double-crested Cormorant,NULL,012003604,NULL,,1990,NULL,NULL,NULL,NULL,NULL,Park,WY,Western or Clark's Grebe,,NULL3605,NULL,,1991,NULL,NULL,NULL,NULL,NULL,Park,WY,Western or Clark's Grebe,NAD 83,NULL3606,NULL,,1992,NULL,NULL,NULL,NULL,NULL,Park,WY,Western or Clark's Grebe,NAD 83,NULL3607,NULL,,1995,NULL,NULL,NULL,NULL,NULL,Park,WY,Western or Clark's Grebe,NAD 83,NULL3608,NULL,,1984,NULL,NULL,NULL,NULL,NULL,Bighorn,WY,Double-crested Cormorant,NULL,012003609,NULL,,1985,NULL,NULL,NULL,NULL,NULL,Bighorn,WY,Double-crested Cormorant,NULL,012003610,NULL,,1986,NULL,NULL,NULL,NULL,NULL,Bighorn,WY,Double-crested Cormorant,NULL,012003611,NULL,,1986,NULL,NULL,NULL,NULL,NULL,Carbon,WY,Black-crowned Night-Heron,NULL,020203612,NULL,,1990,NULL,NULL,NULL,NULL,NULL,Carbon,WY,Black-crowned Night-Heron,NULL,020203613,NULL,,1994,NULL,NULL,NULL,NULL,NULL,Carbon,WY,Black-crowned Night-Heron,NULL,020203614,NULL,,1996,NULL,NULL,NULL,NULL,NULL,Carbon,WY,Black-crowned Night-Heron,NULL,020203615,NULL,,1997,NULL,NULL,NULL,NULL,NULL,Carbon,WY,Black-crowned Night-Heron,NAD 83,020203616,NULL,,1998,NULL,NULL,NULL,NULL,NULL,Carbon,WY,Western Grebe,NAD 83,000103617,NULL,,1998,NULL,NULL,NULL,NULL,NULL,Carbon,WY,Clark's Grebe,NAD 83,000113618,NULL,,1998,NULL,NULL,NULL,NULL,NULL,Carbon,WY,Black-crowned Night-Heron,NULL,020203619,NULL,,1999,NULL,NULL,NULL,NULL,NULL,Carbon,WY,Western Grebe,NULL,000103620,NULL,,2000,NULL,NULL,NULL,NULL,NULL,Carbon,WY,Western Grebe,NULL,000103621,NULL,,2000,NULL,NULL,NULL,NULL,NULL,Carbon,WY,Black-crowned Night-Heron,NULL,020203622,NULL,,2002,NULL,NULL,NULL,NULL,NULL,Carbon,WY,Black-crowned Night-Heron,NULL,020203623,NULL,,1994,NULL,NULL,NULL,NULL,NULL,Park,WY,Double-crested Cormorant,NULL,012003624,NULL,,1995,NULL,NULL,NULL,NULL,NULL,Park,WY,Double-crested Cormorant,NULL,012003625,NULL,,1997,NULL,NULL,NULL,NULL,NULL,Park,WY,Double-crested Cormorant,NULL,012003626,NULL,,1986,NULL,NULL,NULL,NULL,NULL,Albany,WY,White-faced Ibis,NULL,018703627,NULL,,1986,NULL,NULL,NULL,NULL,NULL,Albany,WY,Forster's Tern,NULL,006903628,NULL,,1986,NULL,NULL,NULL,NULL,NULL,Albany,WY,Black-crowned Night-Heron,NULL,020203629,NULL,,1986,NULL,NULL,NULL,NULL,NULL,Albany,WY,Black Tern,NULL,007703630,NULL,,1987,NULL,NULL,NULL,NULL,NULL,Albany,WY,White-faced Ibis,NULL,018703631,NULL,,1987,NULL,NULL,NULL,NULL,NULL,Albany,WY,Forster's Tern,NULL,006903632,NULL,,1987,NULL,NULL,NULL,NULL,NULL,Albany,WY,Black-crowned Night-Heron,NULL,020203633,NULL,,1987,NULL,NULL,NULL,NULL,NULL,Albany,WY,Black Tern,NULL,007703634,NULL,,1990,NULL,NULL,NULL,NULL,NULL,Albany,WY,White-faced Ibis,NULL,018703635,NULL,,1990,NULL,NULL,NULL,NULL,NULL,Albany,WY,Forster's Tern,NULL,006903636,NULL,,1990,NULL,NULL,NULL,NULL,NULL,Albany,WY,Black-crowned Night-Heron,NULL,020203637,NULL,,1994,NULL,NULL,NULL,NULL,NULL,Albany,WY,White-faced Ibis,NULL,018703639,NULL,,1994,NULL,NULL,NULL,NULL,NULL,Albany,WY,Black-crowned Night-Heron,NULL,020203640,NULL,,1994,NULL,NULL,NULL,NULL,NULL,Albany,WY,Black Tern,NULL,007703641,NULL,,1995,NULL,NULL,NULL,NULL,NULL,Albany,WY,Forster's Tern,NULL,006903642,NULL,,1995,NULL,NULL,NULL,NULL,NULL,Albany,WY,Caspian Tern,NULL,006403643,NULL,,1995,NULL,NULL,NULL,NULL,NULL,Albany,WY,Black-crowned Night-Heron,NULL,020203644,NULL,,1995,NULL,NULL,NULL,NULL,NULL,Albany,WY,Black Tern,NULL,007703645,NULL,,1996,NULL,NULL,NULL,NULL,NULL,Albany,WY,White-faced Ibis,NULL,018703646,NULL,,1996,NULL,NULL,NULL,NULL,NULL,Albany,WY,Forster's Tern,NULL,006903647,NULL,,1996,NULL,NULL,NULL,NULL,NULL,Albany,WY,Black-crowned Night-Heron,NULL,020203648,NULL,,1996,NULL,NULL,NULL,NULL,NULL,Albany,WY,Black Tern,NULL,007703649,NULL,,1997,NULL,NULL,NULL,NULL,NULL,Albany,WY,Forster's Tern,NULL,006903650,NULL,,1998,NULL,NULL,NULL,NULL,NULL,Albany,WY,White-faced Ibis,NULL,018703651,NULL,,1998,NULL,NULL,NULL,NULL,NULL,Albany,WY,Forster's Tern,NULL,006903652,NULL,,1998,NULL,NULL,NULL,NULL,NULL,Albany,WY,Black-crowned Night-Heron,NULL,020203653,NULL,,1998,NULL,NULL,NULL,NULL,NULL,Albany,WY,Black Tern,NULL,007703654,NULL,,2001,NULL,NULL,NULL,NULL,NULL,Albany,WY,White-faced Ibis,NULL,018703655,NULL,,2001,NULL,NULL,NULL,NULL,NULL,Albany,WY,Snowy Egret,NULL,019703656,NULL,,2001,NULL,NULL,NULL,NULL,NULL,Albany,WY,Forster's Tern,NULL,006903657,NULL,,2001,NULL,NULL,NULL,NULL,NULL,Albany,WY,Black-crowned Night-Heron,NULL,020203658,NULL,,2003,NULL,NULL,NULL,NULL,NULL,Albany,WY,White-faced Ibis,NULL,018703659,NULL,,2003,NULL,NULL,NULL,NULL,NULL,Albany,WY,Black-crowned Night-Heron,NULL,020203660,NULL,,2003,NULL,NULL,NULL,NULL,NULL,Albany,WY,Black Tern,NULL,007703661,NULL,,2004,NULL,NULL,NULL,NULL,NULL,Albany,WY,White-faced Ibis,NULL,018703662,NULL,,2004,NULL,NULL,NULL,NULL,NULL,Albany,WY,Forster's Tern,NULL,006903663,NULL,,2004,NULL,NULL,NULL,NULL,NULL,Albany,WY,Black-crowned Night-Heron,NULL,020203664,NULL,,2004,NULL,NULL,NULL,NULL,NULL,Albany,WY,Black Tern,NULL,007703665,NULL,,2005,NULL,NULL,NULL,NULL,NULL,Albany,WY,Forster's Tern,NULL,006903666,NULL,,2005,NULL,NULL,NULL,NULL,NULL,Albany,WY,Black Tern,NULL,007703667,NULL,,2006,NULL,NULL,NULL,NULL,NULL,Albany,WY,Forster's Tern,NULL,006903668,NULL,,2006,NULL,NULL,NULL,NULL,NULL,Albany,WY,Black Tern,NULL,007703669,NULL,,1985,NULL,NULL,NULL,NULL,NULL,Albany,WY,Snowy Egret,NULL,019703670,NULL,,1985,NULL,NULL,NULL,NULL,NULL,Albany,WY,Forster's Tern,NULL,006903671,NULL,,1985,NULL,NULL,NULL,NULL,NULL,Albany,WY,Black-crowned Night-Heron,NULL,020203672,NULL,,1986,NULL,NULL,NULL,NULL,NULL,Albany,WY,Forster's Tern,NULL,006903673,NULL,,1986,NULL,NULL,NULL,NULL,NULL,Albany,WY,Black-crowned Night-Heron,NULL,020203674,NULL,,1986,NULL,NULL,NULL,NULL,NULL,Albany,WY,Black Tern,NULL,007703675,NULL,,1987,NULL,NULL,NULL,NULL,NULL,Albany,WY,White-faced Ibis,NULL,018703676,NULL,,1987,NULL,NULL,NULL,NULL,NULL,Albany,WY,Snowy Egret,NULL,019703677,NULL,,1987,NULL,NULL,NULL,NULL,NULL,Albany,WY,Forster's Tern,NULL,006903678,NULL,,1987,NULL,NULL,NULL,NULL,NULL,Albany,WY,Black-crowned Night-Heron,NULL,020203679,NULL,,1982,NULL,NULL,NULL,NULL,NULL,Lincoln,WY,Snowy Egret,NULL,019703680,NULL,,1982,NULL,NULL,NULL,NULL,NULL,Lincoln,WY,Black Tern,NULL,007703681,NULL,,1983,NULL,NULL,NULL,NULL,NULL,Lincoln,WY,Black Tern,NULL,007703682,NULL,,1984,NULL,NULL,Findholt,NULL,NULL,Lincoln,WY,White-faced Ibis,NULL,018703683,NULL,,1984,NULL,NULL,NULL,NULL,NULL,Lincoln,WY,Forster's Tern,NULL,006903684,NULL,,1986,NULL,NULL,NULL,NULL,NULL,Lincoln,WY,White-faced Ibis,NULL,018703685,NULL,,1986,NULL,NULL,NULL,NULL,NULL,Lincoln,WY,Snowy Egret,NAD 83,019703686,NULL,,1986,NULL,NULL,NULL,NULL,NULL,Lincoln,WY,Forster's Tern,NAD 83,006903687,NULL,,1986,NULL,NULL,NULL,NULL,NULL,Lincoln,WY,Caspian Tern,NULL,006403688,NULL,,1986,NULL,NULL,NULL,NULL,NULL,Lincoln,WY,Black-crowned Night-Heron,NULL,020203689,NULL,,1986,NULL,NULL,NULL,NULL,NULL,Lincoln,WY,Black Tern,NULL,007703690,NULL,,1987,NULL,NULL,NULL,NULL,NULL,Lincoln,WY,White-faced Ibis,NULL,018703691,NULL,,1987,NULL,NULL,NULL,NULL,NULL,Lincoln,WY,Black-crowned Night-Heron,NULL,020203692,NULL,,1987,NULL,NULL,NULL,NULL,NULL,Lincoln,WY,Black Tern,NULL,007703693,NULL,,1990,NULL,NULL,NULL,NULL,NULL,Lincoln,WY,White-faced Ibis,NULL,018703694,NULL,,1990,NULL,NULL,NULL,NULL,NULL,Lincoln,WY,Forster's Tern,NULL,006903695,NULL,,1990,NULL,NULL,NULL,NULL,NULL,Lincoln,WY,Black-crowned Night-Heron,NULL,020203696,NULL,,1990,NULL,NULL,NULL,NULL,NULL,Lincoln,WY,Black Tern,NULL,007703697,NULL,,1994,NULL,NULL,NULL,NULL,NULL,Lincoln,WY,White-faced Ibis,NAD 83,018703698,NULL,,1995,NULL,NULL,NULL,NULL,NULL,Lincoln,WY,White-faced Ibis,NULL,018703699,NULL,,1995,NULL,NULL,NULL,NULL,NULL,Lincoln,WY,Snowy Egret,NULL,019703700,NULL,,1995,NULL,NULL,NULL,NULL,NULL,Lincoln,WY,Forster's Tern,NULL,006903701,NULL,,1995,NULL,NULL,NULL,NULL,NULL,Lincoln,WY,Black Tern,NULL,007703702,NULL,,1996,NULL,NULL,NULL,NULL,NULL,Lincoln,WY,White-faced Ibis,NULL,018703703,NULL,,1996,NULL,NULL,NULL,NULL,NULL,Lincoln,WY,Forster's Tern,NULL,006903704,NULL,,1996,NULL,NULL,NULL,NULL,NULL,Lincoln,WY,Black Tern,NULL,007703705,NULL,,1997,NULL,NULL,NULL,NULL,NULL,Lincoln,WY,Black Tern,NULL,007703706,NULL,,1998,NULL,NULL,NULL,NULL,NULL,Lincoln,WY,Black Tern,NULL,007703707,NULL,,1999,NULL,NULL,NULL,NULL,NULL,Lincoln,WY,White-faced Ibis,NULL,018703708,NULL,,1999,NULL,NULL,NULL,NULL,NULL,Lincoln,WY,Forster's Tern,NULL,006903709,NULL,,1999,NULL,NULL,NULL,NULL,NULL,Lincoln,WY,Black Tern,NULL,007703710,NULL,,2000,NULL,NULL,NULL,NULL,NULL,Lincoln,WY,White-faced Ibis,NULL,018703711,NULL,,2000,NULL,NULL,NULL,NULL,NULL,Lincoln,WY,Forster's Tern,NULL,006903712,NULL,,2000,NULL,NULL,NULL,NULL,NULL,Lincoln,WY,Black Tern,NULL,007703713,NULL,,2001,NULL,NULL,NULL,NULL,NULL,Lincoln,WY,Black Tern,NULL,007703714,NULL,,2002,NULL,NULL,NULL,NULL,NULL,Lincoln,WY,Forster's Tern,NULL,006903715,NULL,,2002,NULL,NULL,NULL,NULL,NULL,Lincoln,WY,Black Tern,NULL,007703716,NULL,,2003,NULL,NULL,NULL,NULL,NULL,Lincoln,WY,Forster's Tern,NULL,006903717,NULL,,2003,NULL,NULL,NULL,NULL,NULL,Lincoln,WY,Black Tern,NULL,007703718,NULL,,2006,NULL,NULL,NULL,NULL,NULL,Lincoln,WY,White-faced Ibis,NAD 83,018703719,NULL,,2006,NULL,NULL,NULL,NULL,NULL,Lincoln,WY,Forster's Tern,NAD 83,006903720,NULL,,2006,NULL,NULL,NULL,NULL,NULL,Lincoln,WY,Black Tern,NULL,007703721,NULL,,1986,NULL,NULL,NULL,NULL,NULL,Albany,WY,Double-crested Cormorant,NULL,012003722,NULL,,1986,NULL,NULL,NULL,NULL,NULL,Albany,WY,American White Pelican,NULL,012503723,NULL,,1984,NULL,NULL,NULL,NULL,NULL,Carbon,WY,Double-crested Cormorant,NULL,012003724,NULL,,1984,NULL,NULL,NULL,NULL,NULL,Carbon,WY,Double-crested Cormorant,NULL,012003725,NULL,,1986,NULL,NULL,NULL,NULL,NULL,Carbon,WY,Double-crested Cormorant,NULL,012003726,NULL,,1986,NULL,NULL,NULL,NULL,NULL,Goshen,WY,Double-crested Cormorant,NULL,012003727,NULL,,1991,NULL,NULL,NULL,NULL,NULL,Goshen,WY,Double-crested Cormorant,NAD 83,012003728,NULL,,1991,NULL,NULL,NULL,NULL,NULL,Goshen,WY,Black-crowned Night-Heron,NAD 83,020203729,NULL,,1992,NULL,NULL,NULL,NULL,NULL,Goshen,WY,Double-crested Cormorant,NULL,012003730,NULL,,1992,NULL,NULL,NULL,NULL,NULL,Goshen,WY,Black-crowned Night-Heron,NULL,020203731,NULL,,1994,NULL,NULL,NULL,NULL,NULL,Goshen,WY,Double-crested Cormorant,NULL,012003732,NULL,,1994,NULL,NULL,NULL,NULL,NULL,Goshen,WY,Black-crowned Night-Heron,NULL,020203733,NULL,,1995,NULL,NULL,NULL,NULL,NULL,Goshen,WY,Double-crested Cormorant,NULL,012003734,NULL,,1995,NULL,NULL,NULL,NULL,NULL,Goshen,WY,Black-crowned Night-Heron,NULL,020203735,NULL,,2002,NULL,NULL,NULL,NULL,NULL,Goshen,WY,Black-crowned Night-Heron,NULL,020203736,NULL,,1993,NULL,NULL,NULL,NULL,NULL,Laramie,WY,Black-crowned Night-Heron,NAD 83,020203737,NULL,,1994,NULL,NULL,NULL,NULL,NULL,Laramie,WY,Black-crowned Night-Heron,NAD 83,020203738,NULL,,1995,NULL,NULL,NULL,NULL,NULL,Laramie,WY,Black-crowned Night-Heron,NULL,020203739,NULL,,1982,NULL,NULL,NULL,NULL,NULL,Albany,WY,White-faced Ibis,NULL,018703740,NULL,,1982,NULL,NULL,NULL,NULL,NULL,Albany,WY,Black-crowned Night-Heron,NULL,020203741,NULL,,1983,NULL,NULL,NULL,NULL,NULL,Albany,WY,Black-crowned Night-Heron,NULL,020203742,NULL,,1984,NULL,NULL,NULL,NULL,NULL,Albany,WY,Black Tern,NULL,007703743,NULL,,1985,NULL,NULL,NULL,NULL,NULL,Albany,WY,Forster's Tern,NULL,006903744,NULL,,1985,NULL,NULL,NULL,NULL,NULL,Albany,WY,Black Tern,NULL,007703745,NULL,,1986,NULL,NULL,NULL,NULL,NULL,Albany,WY,Forster's Tern,NULL,006903746,NULL,,1986,NULL,NULL,NULL,NULL,NULL,Albany,WY,Black Tern,NULL,007703747,NULL,,1990,NULL,NULL,NULL,NULL,NULL,Albany,WY,Forster's Tern,NULL,006903748,NULL,,1990,NULL,NULL,NULL,NULL,NULL,Albany,WY,Black-crowned Night-Heron,NULL,020203749,NULL,,1994,NULL,NULL,NULL,NULL,NULL,Albany,WY,Forster's Tern,NULL,006903750,NULL,,1994,NULL,NULL,NULL,NULL,NULL,Albany,WY,Black Tern,NULL,007703751,NULL,,1996,NULL,NULL,NULL,NULL,NULL,Albany,WY,White-faced Ibis,NULL,018703752,NULL,,1996,NULL,NULL,NULL,NULL,NULL,Albany,WY,Forster's Tern,NULL,006903753,NULL,,1996,NULL,NULL,NULL,NULL,NULL,Albany,WY,Cattle Egret,NULL,020013754,NULL,,1996,NULL,NULL,NULL,NULL,NULL,Albany,WY,Black-crowned Night-Heron,NULL,020203755,NULL,,1997,NULL,NULL,NULL,NULL,NULL,Albany,WY,White-faced Ibis,NULL,018703756,NULL,,1997,NULL,NULL,NULL,NULL,NULL,Albany,WY,Snowy Egret,NULL,019703757,NULL,,1997,NULL,NULL,NULL,NULL,NULL,Albany,WY,Forster's Tern,NULL,006903758,NULL,,1997,NULL,NULL,NULL,NULL,NULL,Albany,WY,Cattle Egret,NULL,020013759,NULL,,1997,NULL,NULL,NULL,NULL,NULL,Albany,WY,Black-crowned Night-Heron,NULL,020203760,NULL,,1997,NULL,NULL,NULL,NULL,NULL,Albany,WY,Black Tern,NULL,007702633,NULL,,1986,6,NULL,West,NULL,NULL,Eddy,NM,Black-crowned Night-Heron,SurveyDate: 6/1986,020202634,NULL,,1986,6,NULL,West,NULL,NULL,Eddy,NM,Snowy Egret,SurveyDate: 6/1986,019702635,5/25/1988,00:00.0,1988,5,25,West,NULL,NULL,Eddy,NM,Black-crowned Night-Heron,NULL,020202636,6/10/1991,00:00.0,1991,6,10,West,NULL,NULL,Eddy,NM,Black-crowned Night-Heron,NULL,020202637,6/10/1991,00:00.0,1991,6,10,West,NULL,NULL,Eddy,NM,Snowy Egret,NULL,019702638,NULL,,1992,6,NULL,West,NULL,NULL,Eddy,NM,Black-crowned Night-Heron,SurveyDate: 6/1992,020202639,NULL,,1981,NULL,NULL,West,NULL,NULL,Eddy,NM,Black-crowned Night-Heron,SurveyDate: spring 1981,020202640,NULL,,1989,NULL,NULL,West,NULL,NULL,Eddy,NM,Black-crowned Night-Heron,SurveyDate: spring 1989,020202641,NULL,,1989,NULL,NULL,West,NULL,NULL,Eddy,NM,Snowy Egret,SurveyDate: spring 1989,019702642,NULL,,1988,NULL,NULL,West,NULL,NULL,Eddy,NM,Black-crowned Night-Heron,SurveyDate: summer 1988,020202643,NULL,,1988,NULL,NULL,West,NULL,NULL,Eddy,NM,Snowy Egret,SurveyDate: summer 1988,019702644,NULL,,1992,NULL,NULL,fide Williams,NULL,NULL,Eddy,NM,Snowy Egret,SurveyDate: summer 1992,019702645,6/10/1999,00:00.0,1999,6,10,Williams/White,NULL,NULL,Sierra,NM,Great Blue Heron,NULL,019402646,9/25/1980,00:00.0,1980,9,25,Hubbard/Schmitt,NULL,NULL,Colfax,NM,Western Grebe,NULL,000102647,8/6/1986,00:00.0,1986,8,6,Steel,NULL,NULL,Colfax,NM,Western Grebe,NULL,000102648,8/5/1989,00:00.0,1989,8,5,Cleary,NULL,NULL,Colfax,NM,Eared Grebe,NULL,000402649,7/27/1996,00:00.0,1996,7,27,Rustay,NULL,NULL,Colfax,NM,Eared Grebe,NULL,000402650,6/18/2000,00:00.0,2000,6,18,Cleary,NULL,NULL,Colfax,NM,Eared Grebe,NULL,000402651,7/7/2004,00:00.0,2004,7,7,Cleary,NULL,NULL,Colfax,NM,Eared Grebe,NULL,000402652,8/3/2006,00:00.0,2006,8,3,Cleary,NULL,NULL,Colfax,NM,Eared Grebe,NULL,000402653,9/11/1999,00:00.0,1999,9,11,Schwarz/Vaughn,NULL,NULL,San Miguel,NM,Clark's Grebe,NULL,000112654,NULL,,1973,8,NULL,Hawk,NULL,NULL,San Miguel,NM,Eared Grebe,SurveyDate: 8/11 + 14/1973,000402655,6/10/1999,00:00.0,1999,6,10,Williams/White,NULL,NULL,Sierra,NM,Black-crowned Night-Heron,NULL,020202716,7/3/1999,00:00.0,1999,7,3,Stahlecker,NULL,NULL,Rio Arriba,NM,Eared Grebe,NULL,000402656,6/10/1999,00:00.0,1999,6,10,Williams/White,NULL,NULL,Sierra,NM,Double-crested or Neotropic Cormorant,,NULL2657,6/10/1999,00:00.0,1999,6,10,Williams/White,NULL,NULL,Sierra,NM,Snowy Egret,NULL,019702658,5/28/2003,00:00.0,2003,5,28,Howe/Dieni,NULL,NULL,Sierra,NM,Black-crowned Night-Heron,NULL,020202659,5/28/2003,00:00.0,2003,5,28,Howe/Dieni,NULL,NULL,Sierra,NM,Cattle Egret,NULL,020012660,5/28/2003,00:00.0,2003,5,28,Howe/Dieni,NULL,NULL,Sierra,NM,Double-crested Cormorant,NULL,012002661,5/28/2003,00:00.0,2003,5,28,Howe/Dieni,NULL,NULL,Sierra,NM,Snowy Egret,NULL,019702662,5/3/1995,00:00.0,1995,5,3,Reeves,NULL,NULL,San Juan,NM,Black-crowned Night-Heron,NULL,020202663,4/8/1997,00:00.0,1997,4,8,Reeves,NULL,NULL,San Juan,NM,Black-crowned Night-Heron,NULL,020202664,4/30/2004,00:00.0,2004,4,30,Nelson,NULL,NULL,San Juan,NM,Great Blue Heron,NULL,019402665,4/22/2005,00:00.0,2005,4,22,Nelson,NULL,NULL,San Juan,NM,Great Blue Heron,NULL,019402666,6/24/2006,00:00.0,2006,6,24,Nelson,NULL,NULL,San Juan,NM,Western or Clark's Grebe,NULL,NULL2667,5/11/2007,00:00.0,2007,5,11,Reeves,NULL,NULL,San Juan,NM,Great Blue Heron,NULL,019402668,NULL,,2008,5,NULL,Reeves,NULL,NULL,San Juan,NM,Great Blue Heron,SurveyDate: 5/2008,019402669,NULL,,2009,6,NULL,Reeves,NULL,NULL,San Juan,NM,Great Blue Heron,SurveyDate: 6/2009,019402670,6/15/1974,00:00.0,1974,6,15,Fisher,NULL,NULL,Grant,NM,Great Blue Heron,WGS84,019402671,5/13/2006,00:00.0,2006,5,13,Lewis,NULL,NULL,Grant,NM,Great Blue Heron,WGS84,019402672,NULL,,1973,NULL,NULL,Fisher,NULL,NULL,Grant,NM,Great Blue Heron,WGS84 ; SurveyDate: summer 1973,019402673,NULL,,2007,NULL,NULL,Lewis,NULL,NULL,Grant,NM,Great Blue Heron,WGS84 ; SurveyDate: summer 2007,019402674,6/22/2000,00:00.0,2000,6,22,Stahlecker,NULL,NULL,Rio Arriba,NM,Western Grebe,NULL,000102675,7/6/2003,00:00.0,2003,7,6,Stahlecker,NULL,NULL,Rio Arriba,NM,Western Grebe,NULL,000102676,NULL,,1999,NULL,NULL,Stahlecker,NULL,NULL,Rio Arriba,NM,Western Grebe,SurveyDate: 6/13 - 7/12/1999,000102677,6/25/2007,00:00.0,2007,6,25,fide Howe,NULL,NULL,Santa Fe,NM,Black-crowned Night-Heron,NULL,020202678,6/13/2006,00:00.0,2006,6,13,Stahlecker,NULL,NULL,Rio Arriba,NM,Great Blue Heron,NULL,019402679,7/13/2006,00:00.0,2006,7,13,Stahlecker,NULL,NULL,Rio Arriba,NM,Great Blue Heron,NULL,019402680,5/9/2007,00:00.0,2007,5,9,Stahlecker,NULL,NULL,Rio Arriba,NM,Great Blue Heron,NULL,019402681,7/14/1973,00:00.0,1973,7,14,Hickman,NULL,NULL,Dona Ana,NM,Black-crowned Night-Heron,"Location approximate: ""on Rio Grande near Rincon""",020202682,5/25/1989,00:00.0,1989,5,25,Rustay,NULL,NULL,Rio Arriba,NM,Black-crowned Night-Heron,NULL,020202683,6/1/1992,00:00.0,1992,6,1,Trochet,NULL,NULL,McKinley,NM,White-faced Ibis,NULL,018702684,6/7/1995,00:00.0,1995,6,7,Albert,NULL,NULL,McKinley,NM,White-faced Ibis,NULL,018702685,NULL,,1995,NULL,NULL,Cleary,NULL,NULL,McKinley,NM,Western Grebe,SurveyDate: 7/14-26/1995,000102686,NULL,,1995,NULL,NULL,Howe et al.,NULL,NULL,Eddy,NM,Black-crowned Night-Heron,SurveyDate: 4/29-30/1995,020202687,5/28/1988,00:00.0,1988,5,28,West,NULL,NULL,Eddy,NM,Great Blue Heron,NULL,019402688,NULL,,1989,3,NULL,West,NULL,NULL,Eddy,NM,Great Blue Heron,SurveyDate: early March 1989,019402689,4/23/2004,00:00.0,2004,4,23,Stahlecker,NULL,NULL,Catron,NM,Great Blue Heron,NAD 83,019402690,6/4/2009,00:00.0,2009,6,4,Walker,NULL,NULL,Catron,NM,Great Blue Heron,NAD 83,019402691,NULL,,2005,5,NULL,Williams,NULL,NULL,Catron,NM,Great Blue Heron,NAD 83 ; SurveryDate: 5/27-28/2005,019402692,4/7/1974,00:00.0,1974,4,7,Fisher,NULL,NULL,Grant,NM,Great Blue Heron,NULL,019402693,NULL,,1975,NULL,NULL,Fisher,NULL,NULL,Grant,NM,Great Blue Heron,SurveyDate: spring 1975,019402694,NULL,,1973,NULL,NULL,Fisher,NULL,NULL,Grant,NM,Great Blue Heron,SurveyDate: summer 1973,019402695,NULL,,1981,NULL,NULL,Hill,NULL,NULL,Grant,NM,Great Blue Heron,SurveyDate: summer 1981,019402696,NULL,,NULL,NULL,NULL,fide Howe,NULL,NULL,Sandoval,NM,Black-crowned Night-Heron,SurveyDate: 6/1/2002,020202697,NULL,,1994,NULL,NULL,Fisher,NULL,NULL,Grant,NM,Great Blue Heron,SurveyDate: spring 1994,019402698,6/12/2007,00:00.0,2007,6,12,Stahlecker,NULL,NULL,Socorro,NM,Cattle Egret,NULL,020012699,6/12/2007,00:00.0,2007,6,12,Stahlecker,NULL,NULL,Socorro,NM,Snowy Egret,NULL,019702700,6/12/2007,00:00.0,2007,6,12,Stahlecker,NULL,NULL,Socorro,NM,Snowy Egret,NULL,019702701,6/12/1991,00:00.0,1991,6,12,Williams,NULL,NULL,Guadalupe,NM,Double-crested Cormorant,NULL,012002702,5/23/1994,00:00.0,1994,5,23,Stahlecker,NULL,NULL,Guadalupe,NM,Double-crested Cormorant,NULL,012002703,4/25/1995,00:00.0,1995,4,25,Stahlecker,NULL,NULL,Guadalupe,NM,Double-crested Cormorant,NULL,012002704,NULL,,1985,NULL,NULL,Hayes,NULL,NULL,Guadalupe,NM,Double-crested Cormorant,SurveyDate: spring 1985,012002705,NULL,,1996,NULL,NULL,fide Williams,NULL,NULL,Eddy,NM,Snowy Egret,SurveyDate: summer 1996,019702706,5/4/1986,00:00.0,1986,5,4,Steel,NULL,NULL,Catron,NM,Great Blue Heron,NAD 83,019402707,6/23/2009,00:00.0,2009,6,23,Hayes,NULL,NULL,Catron,NM,Great Blue Heron,NAD 83,019402708,4/4/2007,00:00.0,2007,4,4,Stahlecker,NULL,NULL,Rio Arriba,NM,Great Blue Heron,NULL,019402709,NULL,,NULL,NULL,NULL,Hubbard,NULL,NULL,Bernalillo,NM,Black-crowned Night-Heron,SurveyDate: 6/1977,020202710,NULL,,NULL,NULL,NULL,Hubbard,NULL,NULL,Bernalillo,NM,Snowy Egret,SurveyDate: 6/1977,019702711,NULL,,NULL,NULL,NULL,Howe,NULL,NULL,Bernalillo,NM,Black-crowned Night-Heron,SurveyDate: 6/1997,020202712,6/27/2007,00:00.0,2007,6,27,Cleary,NULL,NULL,Colfax,NM,Black-crowned Night-Heron,NULL,020202713,NULL,,2006,6,NULL,Cleary,NULL,NULL,Colfax,NM,Black-crowned Night-Heron,SurveyDate: 6/12 & 16/2006,020202714,6/18/1980,00:00.0,1980,6,18,Nelson,NULL,NULL,Rio Arriba,NM,Western Grebe,NULL,000102715,6/14/1992,00:00.0,1992,6,14,Stahlecker,NULL,NULL,Rio Arriba,NM,Western Grebe,NULL,000102717,7/6/2003,00:00.0,2003,7,6,Stahlecker,NULL,NULL,Rio Arriba,NM,Western Grebe,NULL,000102718,6/20/2004,00:00.0,2004,6,20,Stahlecker,NULL,NULL,Rio Arriba,NM,Western Grebe,NULL,000102719,8/10/2004,00:00.0,2004,8,10,Stahlecker,NULL,NULL,Rio Arriba,NM,Eared Grebe,NULL,000402720,7/15/2005,00:00.0,2005,7,15,Stahlecker,NULL,NULL,Rio Arriba,NM,Eared Grebe,NULL,000402721,7/13/2006,00:00.0,2006,7,13,Stahlecker,NULL,NULL,Rio Arriba,NM,Western Grebe,NULL,000102722,5/9/2008,00:00.0,2008,5,9,Stahlecker,NULL,NULL,Rio Arriba,NM,Clark's Grebe,NULL,000112723,5/9/2008,00:00.0,2008,5,9,Stahlecker,NULL,NULL,Rio Arriba,NM,Western Grebe,NULL,000102724,NULL,,1999,NULL,NULL,Stahlecker,NULL,NULL,Rio Arriba,NM,Western Grebe,SurveyDate: 6/13 - 7/12/1999,000102725,NULL,,2007,NULL,NULL,Stahlecker,NULL,NULL,Rio Arriba,NM,Eared Grebe,SurveyDate: summer 2007,000402726,8/6/1986,00:00.0,1986,8,6,Steel,NULL,NULL,Colfax,NM,Clark's Grebe,NULL,000112727,7/16/2000,00:00.0,2000,7,16,Rustay,NULL,NULL,Colfax,NM,Clark's Grebe,NULL,000112728,7/6/2004,00:00.0,2004,7,6,Cleary,NULL,NULL,Colfax,NM,Western Grebe,NULL,000102729,7/23/2004,00:00.0,2004,7,23,Cleary,NULL,NULL,Colfax,NM,Clark's Grebe,NULL,000112730,7/24/2004,00:00.0,2004,7,24,Cleary,NULL,NULL,Colfax,NM,Eared Grebe,NULL,000402731,8/7/2004,00:00.0,2004,8,7,Cleary,NULL,NULL,Colfax,NM,Clark's Grebe,NULL,000112732,8/7/2004,00:00.0,2004,8,7,Cleary,NULL,NULL,Colfax,NM,Eared Grebe,NULL,000402733,8/17/2004,00:00.0,2004,8,17,Cleary/Parmeter,NULL,NULL,Colfax,NM,Western Grebe,NULL,000102734,6/9/2005,00:00.0,2005,6,9,Cleary,NULL,NULL,Colfax,NM,Western Grebe,NULL,000102735,7/20/2005,00:00.0,2005,7,20,Cleary,NULL,NULL,Colfax,NM,Eared Grebe,NULL,000402736,8/8/2005,00:00.0,2005,8,8,Cleary,NULL,NULL,Colfax,NM,Eared Grebe,NULL,000402737,6/27/2006,00:00.0,2006,6,27,Cleary,NULL,NULL,Colfax,NM,Clark's Grebe,NULL,000112738,6/27/2006,00:00.0,2006,6,27,Cleary,NULL,NULL,Colfax,NM,Western Grebe,NULL,000102739,7/13/2006,00:00.0,2006,7,13,Cleary,NULL,NULL,Colfax,NM,Clark's Grebe,NULL,000112740,7/13/2006,00:00.0,2006,7,13,Cleary,NULL,NULL,Colfax,NM,Western Grebe,NULL,000102741,7/19/2006,00:00.0,2006,7,19,Cleary,NULL,NULL,Colfax,NM,Eared Grebe,NULL,000402742,8/7/2006,00:00.0,2006,8,7,Cleary,NULL,NULL,Colfax,NM,Eared Grebe,NULL,000402743,5/21/2007,00:00.0,2007,5,21,Cleary,NULL,NULL,Colfax,NM,Clark's Grebe,NULL,000112744,7/7/2007,00:00.0,2007,7,7,Cleary,NULL,NULL,Colfax,NM,Eared Grebe,NULL,000402745,7/13/2007,00:00.0,2007,7,13,Cleary,NULL,NULL,Colfax,NM,Clark's Grebe,NULL,000112746,7/13/2007,00:00.0,2007,7,13,Cleary,NULL,NULL,Colfax,NM,Western Grebe,NULL,000102747,NULL,,2004,NULL,NULL,Cleary,NULL,NULL,Colfax,NM,Clark's Grebe,SurveyDate: 10/9 & 28/2004,000112748,NULL,,2000,NULL,NULL,Cleary,NULL,NULL,Colfax,NM,Clark's Grebe,SurveyDate: 6/20-21/2000,000112749,NULL,,2005,NULL,NULL,Cleary,NULL,NULL,Colfax,NM,Clark's Grebe,SurveyDate: 6/9 to 7/20/2005,000112750,NULL,,2007,NULL,NULL,Cleary,NULL,NULL,Colfax,NM,White-faced Ibis,SurveyDate: 7/16 & 24/2007,018702751,6/4/2006,00:00.0,2006,6,4,Howe,NULL,NULL,De Baca,NM,Clark's Grebe,NULL,000112752,7/11/1997,00:00.0,1997,7,11,Fedorko,NULL,NULL,San Juan,NM,Eared Grebe,NULL,000402753,9/20/1998,00:00.0,1998,9,20,Reeves,NULL,NULL,San Juan,NM,Eared Grebe,NULL,000402754,6/16/1973,00:00.0,1973,6,16,Hundertmark,NULL,NULL,Quay,NM,White-faced Ibis,NULL,018702755,6/16/1974,00:00.0,1974,6,16,Hundertmark,NULL,NULL,Quay,NM,Black-crowned Night-Heron,NULL,020202756,NULL,,1973,NULL,NULL,Hundertmark,NULL,NULL,Quay,NM,Black-crowned Night-Heron,SurveyDate: 4/28 & 5/28/1973,020202757,6/14/1997,00:00.0,1997,6,14,Ewing,NULL,NULL,Sierra,NM,Great Blue Heron,NULL,019402758,5/28/1998,00:00.0,1998,5,28,Howe/White,NULL,NULL,Sierra,NM,Great Blue Heron,NULL,019402759,6/10/1999,00:00.0,1999,6,10,Williams/White,NULL,NULL,Sierra,NM,Great Blue Heron,NULL,019402760,9/21/1980,00:00.0,1980,9,21,Williams,NULL,NULL,Colfax,NM,Eared Grebe,NULL,000402761,3/25/1994,00:00.0,1994,3,25,Lewis,NULL,NULL,Hidalgo,NM,Great Blue Heron,Location approximate,019402762,4/27/1968,00:00.0,1968,4,27,Hawk,NULL,NULL,Mora,NM,Great Blue Heron,NULL,019402763,4/20/1969,00:00.0,1969,4,20,Schooley,NULL,NULL,Mora,NM,Great Blue Heron,NULL,019402764,6/18/1978,00:00.0,1978,6,18,Hawk,NULL,NULL,Mora,NM,Great Blue Heron,NULL,019402765,4/1/2004,00:00.0,2004,4,1,Stahlecker,NULL,NULL,Mora,NM,Great Blue Heron,NULL,019402766,7/9/2007,00:00.0,2007,7,9,Stahlecker,NULL,NULL,Mora,NM,Great Blue Heron,NULL,019402767,6/1/2008,00:00.0,2008,6,1,Stahlecker,NULL,NULL,Mora,NM,Great Blue Heron,NULL,019402768,NULL,,1975,NULL,NULL,Hawk,NULL,NULL,Mora,NM,Great Blue Heron,SurveyDate: spring 1975,019402769,NULL,,1970,NULL,NULL,Hawk,NULL,NULL,Mora,NM,Great Blue Heron,SurveyDate: summer 1970,019402770,NULL,,1971,NULL,NULL,Hawk,NULL,NULL,Mora,NM,Great Blue Heron,SurveyDate: Summer 1971,019402771,NULL,,1972,NULL,NULL,Hawk,NULL,NULL,Mora,NM,Great Blue Heron,SurveyDate: Summer 1972,019402772,NULL,,1974,NULL,NULL,Hawk,NULL,NULL,Mora,NM,Great Blue Heron,SurveyDate: summer 1974,019402773,6/28/1989,00:00.0,1989,6,28,Cleary,NULL,NULL,McKinley,NM,Eared Grebe,NULL,000402774,8/4/1991,00:00.0,1991,8,4,Cleary,NULL,NULL,McKinley,NM,Eared Grebe,NULL,000402775,6/21/1992,00:00.0,1992,6,21,Cleary,NULL,NULL,McKinley,NM,Eared Grebe,NULL,000402776,NULL,,1993,NULL,NULL,Cleary,NULL,NULL,McKinley,NM,Eared Grebe,SurveyDate: 6/19 - 7/31/1993,000402777,NULL,,1998,8,NULL,Cleary,NULL,NULL,McKinley,NM,Eared Grebe,SurveyDate: 8/12 & 15/1998,000402778,NULL,,1993,NULL,NULL,Cleary,NULL,NULL,McKinley,NM,White-faced Ibis,SurveyDate: summer 1993,018702779,NULL,,1994,NULL,NULL,Cleary,NULL,NULL,McKinley,NM,Eared Grebe,SurveyDate: summer 1994,000402780,6/11/2009,00:00.0,2009,6,11,Kelly,NULL,NULL,Salt Lake,UT,Forster's Tern,NULL,006902781,6/2/2009,00:00.0,2009,6,2,Rackham,NULL,NULL,Box Elder,UT,Black-crowned Night-Heron,GSL,020202782,6/2/2009,00:00.0,2009,6,2,Bankhead,NULL,NULL,Box Elder,UT,Cattle Egret,GSL,020012783,6/2/2009,00:00.0,2009,6,2,Shreve,NULL,NULL,Box Elder,UT,Franklin's Gull,GSL,005902784,6/2/2009,00:00.0,2009,6,2,Bankhead,NULL,NULL,Box Elder,UT,Great Egret,GSL,019602785,6/2/2009,00:00.0,2009,6,2,Bankhead,NULL,NULL,Box Elder,UT,Snowy Egret,GSL,019702786,6/2/2009,00:00.0,2009,6,2,Shreve,NULL,NULL,Box Elder,UT,Western Grebe,GSL,000102787,6/2/2009,00:00.0,2009,6,2,Neill,NULL,NULL,Box Elder,UT,White-faced Ibis,GSL,018702788,6/18/2009,00:00.0,2009,6,18,Neill/Mathis,NULL,NULL,Box Elder,UT,Franklin's Gull,GSL,005902789,6/18/2009,00:00.0,2009,6,18,Neill/Mathis,NULL,NULL,Box Elder,UT,Franklin's Gull,GSL,005902790,6/18/2009,00:00.0,2009,6,18,Neill/Mathis,NULL,NULL,Box Elder,UT,Snowy Egret,GSL,019702791,6/18/2009,00:00.0,2009,6,18,Neill/Mathis,NULL,NULL,Box Elder,UT,White-faced Ibis,GSL,018702792,6/18/2009,00:00.0,2009,6,18,Neill/Mathis,NULL,NULL,Box Elder,UT,Snowy Egret,GSL,019702793,6/18/2009,00:00.0,2009,6,18,Neill/Mathis,NULL,NULL,Box Elder,UT,Snowy Egret,GSL,019702794,6/18/2009,00:00.0,2009,6,18,Neill/Mathis,NULL,NULL,Box Elder,UT,White-faced Ibis,GSL,018702795,6/18/2009,00:00.0,2009,6,18,Neill/Mathis,NULL,NULL,Box Elder,UT,White-faced Ibis,GSL,018702796,5/25/2010,00:00.0,2010,5,25,Neill/Bartosz,NULL,NULL,Box Elder,UT,California Gull,GSL,005302797,5/25/2010,00:00.0,2010,5,25,Neill/Bartosz,NULL,NULL,Box Elder,UT,California Gull,GSL,005302798,5/25/2010,00:00.0,2010,5,25,Neill/Bartosz,NULL,NULL,Box Elder,UT,California Gull,GSL,005302799,5/31/2010,00:00.0,2010,5,31,Cavitt,NULL,NULL,Box Elder,UT,California Gull,GSL,005302800,5/31/2010,00:00.0,2010,5,31,Cavitt,NULL,NULL,Box Elder,UT,Great Blue Heron,GSL,019402801,5/31/2010,00:00.0,2010,5,31,Cavitt,NULL,NULL,Box Elder,UT,Ring-billed Gull,GSL,005402802,6/5/2009,00:00.0,2009,6,5,Olson/Ferguson,NULL,NULL,Box Elder,UT,Black-crowned Night-Heron,GSL,020202803,6/5/2009,00:00.0,2009,6,5,Olson/Ferguson,NULL,NULL,Box Elder,UT,Cattle Egret,GSL,020012804,6/5/2009,00:00.0,2009,6,5,Olson/Ferguson,NULL,NULL,Box Elder,UT,Franklin's Gull,GSL,005902805,6/5/2009,00:00.0,2009,6,5,Olson/Ferguson,NULL,NULL,Box Elder,UT,Great Egret,GSL,019602806,6/5/2009,00:00.0,2009,6,5,Olson/Ferguson,NULL,NULL,Box Elder,UT,Snowy Egret,GSL,019702807,6/5/2009,00:00.0,2009,6,5,Olson/Ferguson,NULL,NULL,Box Elder,UT,White-faced Ibis,GSL,018702808,5/25/2010,00:00.0,2010,5,25,Neill/Bartosz,NULL,NULL,Box Elder,UT,California Gull,GSL,005302809,5/25/2010,00:00.0,2010,5,25,Neill/Bartosz,NULL,NULL,Box Elder,UT,Double-crested Cormorant,GSL,012002810,5/25/2010,00:00.0,2010,5,25,Neill/Bartosz,NULL,NULL,Box Elder,UT,Great Blue Heron,GSL,019402811,5/25/2010,00:00.0,2010,5,25,Neill/Bartosz,NULL,NULL,Box Elder,UT,California Gull,GSL,005302812,5/25/2010,00:00.0,2010,5,25,Neill/Bartosz,NULL,NULL,Box Elder,UT,Great Blue Heron,GSL,019402813,5/25/2010,00:00.0,2010,5,25,Neill/Bartosz,NULL,NULL,Box Elder,UT,California Gull,GSL,005302814,5/25/2010,00:00.0,2010,5,25,Neill/Bartosz,NULL,NULL,Box Elder,UT,Great Blue Heron,GSL,019402815,6/18/2009,00:00.0,2009,6,18,Neill/Mathis,NULL,NULL,Box Elder,UT,Western or Clark's Grebe,GSL,NULL2816,7/1/2009,00:00.0,2009,7,1,Neill et al.,NULL,NULL,Box Elder,UT,Eared Grebe,GSL,000402817,7/1/2009,00:00.0,2009,7,1,Bankhead,NULL,NULL,Box Elder,UT,Forster's Tern,GSL,006902818,7/1/2009,00:00.0,2009,7,1,Neill,NULL,NULL,Box Elder,UT,Western Grebe,GSL,000102819,6/2/2009,00:00.0,2009,6,2,Shreve,NULL,NULL,Box Elder,UT,Franklin's Gull,GSL,005902820,6/2/2009,00:00.0,2009,6,2,Bankhead,NULL,NULL,Box Elder,UT,Snowy Egret,GSL,019701693,4/27/2007,00:00.0,2007,4,27,Manwaring/Manwaring,NULL,NULL,Gem,ID,Great Egret,NULL,019601694,4/27/2007,00:00.0,2007,4,27,Manwaring/Manwaring,NULL,NULL,Gem,ID,Snowy Egret,NULL,019701695,5/26/1993,00:00.0,1993,5,26,Stanley,NULL,NULL,Canyon,ID,Black-crowned Night-Heron,NULL,020201696,6/3/1993,00:00.0,1993,6,3,Klott,NULL,NULL,Elmore,ID,American White Pelican,NULL,012501697,6/3/1993,00:00.0,1993,6,3,Klott,NULL,NULL,Elmore,ID,Clark's Grebe,NULL,000111698,6/28/1993,00:00.0,1993,6,28,Trost,NULL,NULL,Elmore,ID,Western Grebe,NULL,000101699,5/26/1993,00:00.0,1993,5,26,Stanley,NULL,NULL,Washington,ID,California Gull,NULL,005301700,6/30/1993,00:00.0,1993,6,30,Trost,NULL,NULL,Washington,ID,California Gull,NULL,005301701,6/22/2006,00:00.0,2006,6,22,Moulton,NULL,NULL,Washington,ID,California Gull,NULL,005301702,6/22/2006,00:00.0,2006,6,22,Moulton,NULL,NULL,Washington,ID,Ring-billed Gull,NULL,005401703,6/1/1993,00:00.0,1993,6,1,Doremus,NULL,NULL,Elmore,ID,Black-crowned Night-Heron,NULL,020201704,5/30/1993,00:00.0,1993,5,30,Trost,NULL,NULL,Twin Falls,ID,Black-crowned Night-Heron,NULL,020201705,5/30/1993,00:00.0,1993,5,30,Trost,NULL,NULL,Twin Falls,ID,Snowy Egret,NULL,019701706,6/6/2008,00:00.0,2008,6,6,Gray,NULL,NULL,Latah,ID,Great Blue Heron,NULL,019401707,7/27/1993,00:00.0,1993,7,27,Trost,NULL,NULL,Bingham,ID,Black Tern,NULL,007701708,6/29/1993,00:00.0,1993,6,29,Trost,NULL,NULL,NULL,ID,Black Tern,NULL,007701709,5/28/1993,00:00.0,1993,5,28,Doremus,NULL,NULL,Elmore,ID,Ring-billed Gull,NULL,005401710,6/10/1993,00:00.0,1993,6,10,Trost,NULL,NULL,Elmore,ID,California Gull,NULL,005301711,6/10/1993,00:00.0,1993,6,10,Trost,NULL,NULL,Elmore,ID,Ring-billed Gull,NULL,005401712,5/25/1994,00:00.0,1994,5,25,Trost,NULL,NULL,Bonner,ID,Black Tern,NULL,007701713,6/10/2009,00:00.0,2009,6,10,Fields/McCue,NULL,NULL,Teton,MT,American White Pelican,NULL,012501714,6/10/2009,00:00.0,2009,6,10,Fields/McCue,NULL,NULL,Teton,MT,California Gull,NULL,005301715,6/10/2009,00:00.0,2009,6,10,Fields/McCue,NULL,NULL,Teton,MT,Common Tern,NULL,007001716,6/10/2009,00:00.0,2009,6,10,Fields/McCue,NULL,NULL,Teton,MT,Double-crested Cormorant,NULL,012001717,6/15/2010,00:00.0,2010,6,15,Krage,NULL,NULL,Teton,MT,American White Pelican,NULL,012501718,6/15/2010,00:00.0,2010,6,15,Krage,NULL,NULL,Teton,MT,California Gull,NULL,005301719,6/15/2010,00:00.0,2010,6,15,Krage,NULL,NULL,Teton,MT,Double-crested Cormorant,NULL,012001720,6/15/2010,00:00.0,2010,6,15,Krage,NULL,NULL,Teton,MT,Ring-billed or California Gull,NULL,NULL1721,6/14/2011,00:00.0,2011,6,14,Koffman/Valentine,NULL,NULL,Teton,MT,American White Pelican,NULL,012501722,6/14/2011,00:00.0,2011,6,14,Koffman/Valentine,NULL,NULL,Teton,MT,Double-crested Cormorant,NULL,012001723,7/7/2010,00:00.0,2010,7,7,Stutzman,NULL,NULL,Flathead,MT,Black Tern,NULL,007701724,5/6/2011,00:00.0,2011,5,6,Doney,NULL,NULL,Madison,MT,Great Blue Heron,NULL,019401725,6/18/2010,00:00.0,2010,6,18,Doney,NULL,NULL,Beaverhead,MT,Great Blue Heron,NULL,019401726,5/6/2011,00:00.0,2011,5,6,Doney,NULL,NULL,Beaverhead,MT,Great Blue Heron,NULL,019401727,6/17/2009,00:00.0,2009,6,17,Fields et al.,NULL,NULL,Cascade,MT,Franklin's Gull,NULL,005901728,6/17/2009,00:00.0,2009,6,17,Fields et al.,NULL,NULL,Cascade,MT,Ring-billed Gull,NULL,005401729,6/22/2010,00:00.0,2010,6,22,Fields et al.,NULL,NULL,Cascade,MT,White-faced Ibis,NULL,018701730,8/24/2010,00:00.0,2010,8,24,Fields et al.,NULL,NULL,Cascade,MT,Franklin's Gull,NULL,005901731,7/5/2011,00:00.0,2011,7,5,Tilly,NULL,NULL,Cascade,MT,Franklin's Gull,NULL,005901732,NULL,,2011,7,5,Tilly,NULL,NULL,Cascade,MT,White-faced Ibis,NULL,018701733,NULL,,2009,6,NULL,Fields et al.,NULL,NULL,Cascade,MT,Black-crowned Night-Heron,NULL,020201734,NULL,,2009,6,NULL,Fields et al.,NULL,NULL,Cascade,MT,California Gull,NULL,005301735,NULL,,2009,6,NULL,Fields et al.,NULL,NULL,Cascade,MT,Eared Grebe,NULL,000401736,NULL,,2009,6,NULL,Fields et al.,NULL,NULL,Cascade,MT,White-faced Ibis,NULL,018701737,NULL,,2010,6,NULL,Fields et al.,NULL,NULL,Cascade,MT,Black-crowned Night-Heron,NULL,020201738,NULL,,2010,6,NULL,Fields et al.,NULL,NULL,Cascade,MT,Common Tern,NULL,007001739,NULL,,2010,6,NULL,Fields et al.,NULL,NULL,Cascade,MT,Forster's Tern,NULL,006901740,5/4/2011,00:00.0,2011,5,4,Doney,NULL,NULL,Madison,MT,Great Blue Heron,NULL,019401741,NULL,,2011,4,26,Cyrus/Beyer,NULL,NULL,Rosebud,MT,Great Blue Heron,NULL,019401742,4/28/2011,00:00.0,2011,4,28,Begley,NULL,NULL,Bighorn,MT,Great Blue Heron,NULL,019401743,5/11/2011,00:00.0,2011,5,11,DuBois/Mamutich,NULL,NULL,Ravalli,MT,Great Blue Heron,NULL,019401744,6/25/2009,00:00.0,2009,6,25,DuBois,NULL,NULL,Ravalli,MT,Great Blue Heron,NULL,019401745,5/12/2011,00:00.0,2011,5,12,DuBois/Mamutich,NULL,NULL,Ravalli,MT,Great Blue Heron,NULL,019401746,5/12/2011,00:00.0,2011,5,12,DuBois/Mamutich,NULL,NULL,Ravalli,MT,Great Blue Heron,NULL,019401747,5/11/2011,00:00.0,2011,5,11,DuBois/Mamutich,NULL,NULL,Ravalli,MT,Great Blue Heron,NULL,019401748,6/25/2009,00:00.0,2009,6,25,DuBois,NULL,NULL,Ravalli,MT,Great Blue Heron,NULL,019401749,5/11/2011,00:00.0,2011,5,11,DuBois/Mamutich,NULL,NULL,Ravalli,MT,Great Blue Heron,NULL,019401750,5/12/2011,00:00.0,2011,5,12,DuBois/Mamutich,NULL,NULL,Ravalli,MT,Great Blue Heron,NULL,019401751,6/25/2009,00:00.0,2009,6,25,DuBois,NULL,NULL,Ravalli,MT,Great Blue Heron,NULL,019401752,5/11/2011,00:00.0,2011,5,11,DuBois/Mamutich,NULL,NULL,Ravalli,MT,Great Blue Heron,NULL,019401753,6/25/2009,00:00.0,2009,6,25,DuBois,NULL,NULL,Ravalli,MT,Great Blue Heron,NULL,019401754,5/11/2011,00:00.0,2011,5,11,DuBois/Mamutich,NULL,NULL,Ravalli,MT,Great Blue Heron,NULL,019401755,6/12/2011,00:00.0,2011,6,12,DuBois/Throop,NULL,NULL,Ravalli,MT,Great Blue Heron,NULL,019401756,6/25/2009,00:00.0,2009,6,25,DuBois,NULL,NULL,Ravalli,MT,Great Blue Heron,NULL,019401757,5/11/2011,00:00.0,2011,5,11,DuBois/Mamutich,NULL,NULL,Ravalli,MT,Great Blue Heron,NULL,019401758,6/17/2009,00:00.0,2009,6,17,Paige,NULL,NULL,Glacier,MT,Black Tern,NULL,007701759,5/29/2009,00:00.0,2009,5,29,DuBois,NULL,NULL,Powell,MT,Great Blue Heron,NULL,019401760,5/13/2011,00:00.0,2011,5,13,DuBois,NULL,NULL,Powell,MT,Great Blue Heron,NULL,019401761,6/9/2009,00:00.0,2009,6,9,Paige,NULL,NULL,Powell,MT,Black Tern,NULL,007701762,6/9/2009,00:00.0,2009,6,9,Paige,NULL,NULL,Powell,MT,Eared Grebe,NULL,000401763,7/14/2010,00:00.0,2010,7,14,Doney,NULL,NULL,Powell,MT,Black Tern,NULL,007701764,6/27/2011,00:00.0,2011,6,27,Wightman,NULL,NULL,Powell,MT,Black Tern,NULL,007701765,6/28/2009,00:00.0,2009,6,28,Tilly,NULL,NULL,Hill/Jefferson,MT,Great Blue Heron,NULL,019401766,6/22/2010,00:00.0,2010,6,22,Tilly et al.,NULL,NULL,Phillips,MT,Eared Grebe,NULL,000401767,7/22/2010,00:00.0,2010,7,22,Tilly/McWilliams,NULL,NULL,Phillips,MT,Black Tern,NULL,007701768,7/22/2010,00:00.0,2010,7,22,Tilly/McWilliams,NULL,NULL,Phillips,MT,Forster's Tern,NULL,006901769,6/15/2011,00:00.0,2011,6,15,Tilly et al.,NULL,NULL,Phillips,MT,Common Tern,NULL,007001770,7/2/1905,00:00.0,2010,NULL,NULL,Waltee,NULL,NULL,Carter,MT,Great Blue Heron,NULL,019401771,6/21/2009,00:00.0,2009,6,21,Paige/Kelly,NULL,NULL,Powell,MT,Black Tern,NULL,007701772,6/21/2009,00:00.0,2009,6,21,Paige/Kelly,NULL,NULL,Powell,MT,Western Grebe,NULL,000101773,7/15/2010,00:00.0,2010,7,15,Doney,NULL,NULL,Powell,MT,Black Tern,NULL,007701774,6/27/2011,00:00.0,2011,6,27,Wightman,NULL,NULL,Powell,MT,Black Tern,NULL,007701775,5/22/2009,00:00.0,2009,5,22,Jakubowski et al.,NULL,NULL,Broadwater,MT,American White Pelican,NULL,012501776,5/22/2009,00:00.0,2009,5,22,Jakubowski et al.,NULL,NULL,Broadwater,MT,Caspian Tern,NULL,006401777,5/22/2009,00:00.0,2009,5,22,Jakubowski et al.,NULL,NULL,Broadwater,MT,Double-crested Cormorant,NULL,012001778,5/26/2010,00:00.0,2010,5,26,Jakubowski et al.,NULL,NULL,Broadwater,MT,American White Pelican,NULL,012501779,5/26/2010,00:00.0,2010,5,26,Jakubowski et al.,NULL,NULL,Broadwater,MT,California Gull,NULL,005301780,5/26/2010,00:00.0,2010,5,26,Jakubowski et al.,NULL,NULL,Broadwater,MT,Caspian Tern,NULL,006401781,5/26/2010,00:00.0,2010,5,26,Jakubowski et al.,NULL,NULL,Broadwater,MT,Double-crested Cormorant,NULL,012001782,NULL,,2011,5,31,Wightman,NULL,NULL,Broadwater,MT,American White Pelican,NULL,012501783,NULL,,2011,5,31,Wightman,NULL,NULL,Broadwater,MT,Caspian Tern,NULL,006401784,NULL,,2011,5,31,Wightman,NULL,NULL,Broadwater,MT,Double-crested Cormorant,NULL,012001785,5/31/2011,00:00.0,2011,5,31,Wightman,NULL,NULL,Broadwater,MT,Ring-billed or California Gull,NULL,NULL1786,6/28/2009,00:00.0,2009,6,28,Tilly,NULL,NULL,Hill,MT,Eared Grebe,NULL,000401787,5/28/2009,00:00.0,2009,5,28,DuBois,NULL,NULL,Powell,MT,Great Blue Heron,NULL,019401788,5/22/2011,00:00.0,2011,5,22,DuBois/Throop,NULL,NULL,Granite,MT,Great Blue Heron,NULL,019401789,5/19/2011,00:00.0,2011,5,19,DuBois/Throop,NULL,NULL,Missoula,MT,Great Blue Heron,NULL,019401790,4/22/2011,00:00.0,2011,4,22,Sterling,NULL,NULL,Sanders,MT,Great Blue Heron,NULL,019401791,5/19/2011,00:00.0,2011,5,19,DuBois/Throop,NULL,NULL,Missoula,MT,Great Blue Heron,NULL,019401792,5/19/2011,00:00.0,2011,5,19,DuBois/Throop,NULL,NULL,Missoula,MT,Great Blue Heron,NULL,019401793,5/19/2011,00:00.0,2011,5,19,DuBois/Throop,NULL,NULL,Missoula,MT,Great Blue Heron,NULL,019401794,3/30/2011,00:00.0,2011,3,30,DuBois/Hudson,NULL,NULL,Missoula,MT,Great Blue Heron,NULL,019401795,6/30/2009,00:00.0,2009,6,30,DuBois,NULL,NULL,Missoula,MT,Great Blue Heron,NULL,019401796,5/13/2011,00:00.0,2011,5,13,DuBois/Mamutich,NULL,NULL,Missoula,MT,Great Blue Heron,NULL,019401797,6/4/2009,00:00.0,2009,6,4,DuBois,NULL,NULL,Missoula,MT,Great Blue Heron,NULL,019401798,5/29/2009,00:00.0,2009,5,29,DuBois,NULL,NULL,Missoula,MT,Great Blue Heron,NULL,019401799,5/12/2011,00:00.0,2011,5,12,DuBois/Mamutich,NULL,NULL,Missoula,MT,Great Blue Heron,NULL,019401800,7/24/2009,00:00.0,2009,7,24,DuBois/Swant,NULL,NULL,Powell,MT,Great Blue Heron,NULL,019401801,5/22/2011,00:00.0,2011,5,22,DuBois/Throop,NULL,NULL,Powell,MT,Great Blue Heron,NULL,019401802,NULL,,2011,4,27,Stewart,NULL,NULL,Stillwater,MT,Great Blue Heron,NULL,019401803,NULL,,2011,4,21,Taylor,NULL,NULL,Lewis & Clark,MT,Great Blue Heron,NULL,019401804,NULL,,2009,6,NULL,Cozzens,NULL,NULL,Phillips,MT,Black-crowned Night-Heron,NULL,020201805,6/26/2009,00:00.0,2009,6,26,Prellwitz,NULL,NULL,Phillips,MT,Black-crowned Night-Heron,NULL,020201806,6/26/2009,00:00.0,2009,6,26,Prellwitz,NULL,NULL,Phillips,MT,Double-crested Cormorant,NULL,012001807,7/4/2010,00:00.0,2010,7,4,Tilly/Prellwitz,NULL,NULL,Phillips,MT,Black-crowned Night-Heron,NULL,020201808,7/4/2010,00:00.0,2010,7,4,Tilly/Prellwitz,NULL,NULL,Phillips,MT,Double-crested Cormorant,NULL,012001809,7/4/2010,00:00.0,2010,7,4,Tilly/Prellwitz,NULL,NULL,Phillips,MT,Great Blue Heron,NULL,019401810,7/4/2011,00:00.0,2011,7,4,Tilly,NULL,NULL,Phillips,MT,Black-crowned Night-Heron,NULL,020201811,7/4/2011,00:00.0,2011,7,4,Tilly,NULL,NULL,Phillips,MT,Double-crested Cormorant,NULL,012001812,7/4/2011,00:00.0,2011,7,4,Tilly,NULL,NULL,Phillips,MT,Great Blue Heron,NULL,019401813,5/13/2011,00:00.0,2011,5,13,Vore/Hammond,NULL,NULL,Flathead,MT,Great Blue Heron,NULL,019401814,5/28/2009,00:00.0,2009,5,28,DuBois,NULL,NULL,Granite,MT,Great Blue Heron,NULL,019401815,7/12/2011,00:00.0,2011,7,12,DuBois et al.,NULL,NULL,Granite,MT,Great Blue Heron,NULL,019401816,6/1/2009,00:00.0,2009,6,1,Mulligan,NULL,NULL,Valley,MT,Double-crested Cormorant,NULL,012001817,6/26/2009,00:00.0,2009,6,26,Tilly,NULL,NULL,Valley,MT,California Gull,NULL,005301818,6/26/2009,00:00.0,2009,6,26,Tilly,NULL,NULL,Valley,MT,Caspian Tern,NULL,006401819,6/26/2009,00:00.0,2009,6,26,Tilly,NULL,NULL,Valley,MT,Double-crested Cormorant,NULL,012001820,7/6/2010,00:00.0,2010,7,6,Tilly/Johnson,NULL,NULL,Valley,MT,California Gull,NULL,005301821,7/6/2010,00:00.0,2010,7,6,Tilly/Johnson,NULL,NULL,Valley,MT,Caspian Tern,NULL,006401822,7/6/2010,00:00.0,2010,7,6,Tilly/Johnson,NULL,NULL,Valley,MT,Double-crested Cormorant,NULL,012001823,7/6/2010,00:00.0,2010,7,6,Tilly/Johnson,NULL,NULL,Valley,MT,Ring-billed Gull,NULL,005401824,6/21/2011,00:00.0,2011,6,21,Tilly,NULL,NULL,Garfield,MT,Double-crested Cormorant,NULL,012001825,6/21/2011,00:00.0,2011,6,21,Tilly,NULL,NULL,Garfield,MT,Ring-billed Gull,NULL,005401826,6/22/2011,00:00.0,2011,6,22,Tilly,NULL,NULL,Garfield,MT,California Gull,NULL,005301827,6/23/2011,00:00.0,2011,6,23,Tilly,NULL,NULL,Garfield,MT,Caspian Tern,NULL,006401828,7/20/2009,00:00.0,2009,7,20,Amestoy/Donahey,NULL,NULL,Phillips,MT,Eared Grebe,NULL,000401829,7/1/2010,00:00.0,2010,7,1,Amestoy/George,NULL,NULL,Phillips,MT,Eared Grebe,NULL,000401830,6/10/2009,00:00.0,2009,6,10,Paige/Wightman,NULL,NULL,Teton,MT,Western or Clark's Grebe,NULL,NULL1831,6/4/2010,00:00.0,2010,6,4,Doney,NULL,NULL,Teton,MT,Clark's Grebe,NULL,000111832,6/4/2010,00:00.0,2010,6,4,Doney,NULL,NULL,Teton,MT,Forster's Tern,NULL,006901833,6/24/2010,00:00.0,2010,6,24,Doney,NULL,NULL,Teton,MT,Western Grebe,NULL,000101834,6/21/2011,00:00.0,2011,6,21,Wightman/Lonner,NULL,NULL,Teton,MT,Common Tern,NULL,007001835,6/21/2011,00:00.0,2011,6,21,Wightman,NULL,NULL,Teton,MT,Forster's Tern,NULL,006901836,6/21/2011,00:00.0,2011,6,21,Wightman/Lonner,NULL,NULL,Teton,MT,Ring-billed or California Gull,NULL,NULL1837,6/21/2011,00:00.0,2011,6,21,Wightman,NULL,NULL,Teton,MT,Western Grebe,NULL,000101838,6/21/2011,00:00.0,2011,6,21,Wightman,NULL,NULL,Teton,MT,Western or Clark's Grebe,NULL,NULL1839,6/11/2009,00:00.0,2009,6,11,Paige/Wightman,NULL,NULL,Teton,MT,Common Tern,NULL,007001840,6/4/2010,00:00.0,2010,6,4,Doney,NULL,NULL,Teton,MT,Forster's Tern,NULL,006901841,6/24/2010,00:00.0,2010,6,24,Doney,NULL,NULL,Teton,MT,Common Tern,NULL,007001842,6/21/2011,00:00.0,2011,6,21,Wightman/Lonner,NULL,NULL,Teton,MT,Double-crested Cormorant,NULL,012001843,6/10/2009,00:00.0,2009,6,10,Paige/Wightman,NULL,NULL,Teton,MT,California Gull,NULL,005301844,6/10/2009,00:00.0,2009,6,10,Paige/Wightman,NULL,NULL,Teton,MT,Common Tern,NULL,007001845,6/10/2009,00:00.0,2009,6,10,Paige/Wightman,NULL,NULL,Teton,MT,Forster's Tern,NULL,006901846,6/21/2011,00:00.0,2011,6,21,Wightman,NULL,NULL,Teton,MT,Forster's Tern,NULL,006901847,6/11/2009,00:00.0,2009,6,11,Paige/Wightman,NULL,NULL,Teton,MT,Black-crowned Night-Heron,NULL,020201848,6/11/2009,00:00.0,2009,6,11,Paige/Wightman,NULL,NULL,Teton,MT,Forster's Tern,NULL,006901849,6/11/2009,00:00.0,2009,6,11,Paige/Wightman,NULL,NULL,Teton,MT,Western or Clark's Grebe,NULL,NULL1850,6/4/2010,00:00.0,2010,6,4,Doney,NULL,NULL,Teton,MT,Double-crested Cormorant,NULL,012001851,6/24/2010,00:00.0,2010,6,24,Doney,NULL,NULL,Teton,MT,Black-crowned Night-Heron,NULL,020201852,6/24/2010,00:00.0,2010,6,24,Doney,NULL,NULL,Teton,MT,Forster's Tern,NULL,006901853,6/24/2010,00:00.0,2010,6,24,Doney,NULL,NULL,Teton,MT,Western Grebe,NULL,000101854,6/21/2011,00:00.0,2011,6,21,Wightman,NULL,NULL,Teton,MT,Black-crowned Night-Heron,NULL,020201855,6/21/2011,00:00.0,2011,6,21,Wightman/Lonner,NULL,NULL,Teton,MT,Double-crested Cormorant,NULL,012001856,6/21/2011,00:00.0,2011,6,21,Wightman/Lonner,NULL,NULL,Teton,MT,Eared Grebe,NULL,000401857,6/21/2011,00:00.0,2011,6,21,Wightman,NULL,NULL,Teton,MT,Forster's Tern,NULL,006901858,6/21/2011,00:00.0,2011,6,21,Wightman,NULL,NULL,Teton,MT,Western Grebe,NULL,000101859,7/13/2009,00:00.0,2009,7,13,Prellwitz,NULL,NULL,Phillips,MT,Double-crested Cormorant,NULL,012001860,7/13/2009,00:00.0,2009,7,13,Prellwitz,NULL,NULL,Phillips,MT,Great Blue Heron,NULL,019401861,7/9/2010,00:00.0,2010,7,9,Prellwitz,NULL,NULL,Phillips,MT,Double-crested Cormorant,NULL,012001862,7/9/2010,00:00.0,2010,7,9,Prellwitz,NULL,NULL,Phillips,MT,Great Blue Heron,NULL,019401863,7/7/2011,00:00.0,2011,7,7,Prellwitz,NULL,NULL,Phillips,MT,Double-crested Cormorant,NULL,012001864,7/7/2011,00:00.0,2011,7,7,Prellwitz,NULL,NULL,Phillips,MT,Great Blue Heron,NULL,019401865,5/6/2011,00:00.0,2011,5,6,Doney,NULL,NULL,Gallatin,MT,Great Blue Heron,NULL,019401866,5/6/2011,00:00.0,2011,5,6,Doney,NULL,NULL,Beaverhead,MT,Great Blue Heron,NULL,019401867,NULL,,2011,4,25,Stewart,NULL,NULL,Stillwater,MT,Great Blue Heron,NULL,019401868,6/9/2010,00:00.0,2010,6,9,Wightman/Doney,NULL,NULL,Lewis & Clark,MT,Great Blue Heron,NULL,019401869,NULL,,2011,4,27,Wightman,NULL,NULL,Lewis & Clark,MT,Great Blue Heron,NULL,019401870,6/13/2009,00:00.0,2009,6,13,Tilly,NULL,NULL,Sheridan,MT,Forster's Tern,NULL,006901871,6/21/2010,00:00.0,2010,6,21,Tilly,NULL,NULL,Sheridan,MT,Forster's Tern,NULL,006901872,6/21/2010,00:00.0,2010,6,21,Tilly,NULL,NULL,Sheridan,MT,Franklin's Gull,NULL,005901873,7/14/2010,00:00.0,2010,7,14,Jamison/Spaur,NULL,NULL,Sheridan,MT,White-faced Ibis,NULL,018701874,6/18/2011,00:00.0,2011,6,18,Tilly,NULL,NULL,Sheridan,MT,Common Tern,NULL,007001875,6/18/2011,00:00.0,2011,6,18,Tilly,NULL,NULL,Sheridan,MT,Franklin's Gull,NULL,005901876,7/10/2009,00:00.0,2009,7,10,Prellwitz,NULL,NULL,Phillips,MT,Black-crowned Night-Heron,NULL,020201877,7/27/2010,00:00.0,2010,7,27,Prellwitz,NULL,NULL,Phillips,MT,Black-crowned Night-Heron,NULL,020201878,7/11/2011,00:00.0,2011,7,11,Amestoy et al.,NULL,NULL,Phillips,MT,Black-crowned Night-Heron,NULL,020201879,5/4/2011,00:00.0,2011,5,4,Doney,NULL,NULL,Madison,MT,Great Blue Heron,NULL,019401880,4/13/2011,00:00.0,2011,4,13,DuBois,NULL,NULL,Madison,MT,Great Blue Heron,NULL,01940753,4/20/2004,00:00.0,2004,4,20,NULL,NULL,NULL,Weld,CO,Great Blue Heron,NULL,01940754,4/27/2005,00:00.0,2005,4,27,NULL,NULL,NULL,Weld,CO,Great Blue Heron,NULL,01940755,NULL,,1978,NULL,NULL,Graul/Miller,NULL,NULL,Weld,CO,Great Blue Heron,NULL,01940756,NULL,,1981,NULL,NULL,NULL,NULL,NULL,Weld,CO,Great Blue Heron,NULL,01940757,NULL,,1999,NULL,NULL,NULL,NULL,NULL,Weld,CO,Great Blue Heron,NULL,01940758,NULL,,2000,NULL,NULL,NULL,NULL,NULL,Weld,CO,Great Blue Heron,NULL,01940759,NULL,,2001,NULL,NULL,NULL,NULL,NULL,Weld,CO,Great Blue Heron,NULL,01940760,NULL,,2008,NULL,NULL,NULL,NULL,NULL,Weld,CO,Black-crowned Night-Heron,NULL,02020761,NULL,,2008,NULL,NULL,NULL,NULL,NULL,Weld,CO,Double-crested Cormorant,NULL,01200762,NULL,,2008,NULL,NULL,NULL,NULL,NULL,Weld,CO,Great Blue Heron,NULL,01940763,4/22/2000,00:00.0,2000,4,22,NULL,NULL,NULL,Weld,CO,Double-crested Cormorant,NULL,01200764,4/13/2001,00:00.0,2001,4,13,NULL,NULL,NULL,Weld,CO,Double-crested Cormorant,NULL,01200765,4/28/2002,00:00.0,2002,4,28,NULL,NULL,NULL,Weld,CO,Black-crowned Night-Heron,NULL,02020766,4/28/2002,00:00.0,2002,4,28,NULL,NULL,NULL,Weld,CO,Double-crested Cormorant,NULL,01200767,4/28/2002,00:00.0,2002,4,28,NULL,NULL,NULL,Weld,CO,Great Blue Heron,NULL,01940768,4/28/2002,00:00.0,2002,4,28,NULL,NULL,NULL,Weld,CO,Great Egret,NULL,01960769,4/28/2002,00:00.0,2002,4,28,NULL,NULL,NULL,Weld,CO,Snowy Egret,NULL,01970770,4/18/2003,00:00.0,2003,4,18,NULL,NULL,NULL,Weld,CO,Double-crested Cormorant,NULL,01200771,4/20/2003,00:00.0,2003,4,20,NULL,NULL,NULL,Weld,CO,Great Blue Heron,NULL,01940772,4/20/2004,00:00.0,2004,4,20,NULL,NULL,NULL,Weld,CO,Double-crested Cormorant,NULL,01200773,4/20/2004,00:00.0,2004,4,20,NULL,NULL,NULL,Weld,CO,Great Blue Heron,NULL,01940774,4/28/2004,00:00.0,2004,4,28,NULL,NULL,NULL,Weld,CO,Black-crowned Night-Heron,NULL,02020775,4/27/2005,00:00.0,2005,4,27,NULL,NULL,NULL,Weld,CO,Black-crowned Night-Heron,NULL,02020776,4/27/2005,00:00.0,2005,4,27,NULL,NULL,NULL,Weld,CO,Double-crested Cormorant,NULL,01200777,4/27/2005,00:00.0,2005,4,27,NULL,NULL,NULL,Weld,CO,Great Blue Heron,NULL,01940778,7/8/1994,00:00.0,1994,7,8,NULL,NULL,NULL,Jackson,CO,Great Blue Heron,NULL,01940779,NULL,,1999,NULL,NULL,NULL,NULL,NULL,Pitkin,CO,Great Blue Heron,NULL,01940780,NULL,,2000,NULL,NULL,NULL,NULL,NULL,Pitkin,CO,Great Blue Heron,NULL,01940781,NULL,,2001,NULL,NULL,NULL,NULL,NULL,Pitkin,CO,Great Blue Heron,NULL,01940782,NULL,,2002,NULL,NULL,NULL,NULL,NULL,Pitkin,CO,Great Blue Heron,NULL,01940783,NULL,,2003,NULL,NULL,NULL,NULL,NULL,Pitkin,CO,Great Blue Heron,NULL,01940784,NULL,,2004,NULL,NULL,NULL,NULL,NULL,Pitkin,CO,Great Blue Heron,NULL,01940785,NULL,,2005,NULL,NULL,NULL,NULL,NULL,Pitkin,CO,Great Blue Heron,NULL,01940786,NULL,,1999,NULL,NULL,NULL,NULL,NULL,Boulder,CO,Great Blue Heron,NULL,01940787,9/18/2004,00:00.0,2004,9,18,NULL,NULL,NULL,Garfield,CO,Great Blue Heron,NULL,01940788,5/1/2005,00:00.0,2005,5,1,NULL,NULL,NULL,Garfield,CO,Great Blue Heron,NULL,01940789,4/23/2006,00:00.0,2006,4,23,NULL,NULL,NULL,Garfield,CO,Great Blue Heron,NULL,01940790,4/14/2007,00:00.0,2007,4,14,NULL,NULL,NULL,Garfield,CO,Great Blue Heron,NULL,01940791,NULL,,2004,NULL,NULL,NULL,NULL,NULL,Gunnison,CO,Great Blue Heron,NULL,01940792,7/11/2000,00:00.0,2000,7,11,NULL,NULL,NULL,Jackson,CO,Great Blue Heron,NULL,01940793,7/23/2002,00:00.0,2002,7,23,NULL,NULL,NULL,Jackson,CO,Eared Grebe,NULL,00040794,7/9/2006,00:00.0,2006,7,9,NULL,NULL,NULL,Jackson,CO,Eared Grebe,NULL,00040795,NULL,,1979,NULL,NULL,NULL,NULL,NULL,Rio Blanco,CO,Great Blue Heron,NULL,01940796,NULL,,1982,NULL,NULL,NULL,NULL,NULL,Rio Blanco,CO,Great Blue Heron,NULL,01940797,NULL,,1999,NULL,NULL,NULL,NULL,NULL,Rio Blanco,CO,Great Blue Heron,NULL,01940798,NULL,,2000,NULL,NULL,NULL,NULL,NULL,Rio Blanco,CO,Great Blue Heron,NULL,01940799,NULL,,2001,NULL,NULL,NULL,NULL,NULL,Rio Blanco,CO,Great Blue Heron,NULL,01940800,5/1/2002,00:00.0,2002,5,1,NULL,NULL,NULL,Rio Blanco,CO,Great Blue Heron,NULL,01940801,4/21/2003,00:00.0,2003,4,21,NULL,NULL,NULL,Rio Blanco,CO,Great Blue Heron,NULL,01940802,5/5/2004,00:00.0,2004,5,5,NULL,NULL,NULL,Rio Blanco,CO,Great Blue Heron,NULL,01940803,NULL,,2001,NULL,NULL,NULL,NULL,NULL,Washington,CO,Great Blue Heron,NULL,01940804,NULL,,2002,NULL,NULL,NULL,NULL,NULL,Washington,CO,Great Blue Heron,NULL,01940805,NULL,,2004,NULL,NULL,NULL,NULL,NULL,Washington,CO,Great Blue Heron,NULL,01940806,NULL,,2001,NULL,NULL,NULL,NULL,NULL,Jefferson,CO,Double-crested Cormorant,NULL,01200807,NULL,,2001,NULL,NULL,NULL,NULL,NULL,Jefferson,CO,Great Blue Heron,NULL,01940808,NULL,,2002,NULL,NULL,NULL,NULL,NULL,Jefferson,CO,Great Blue Heron,NULL,01940809,NULL,,2003,NULL,NULL,NULL,NULL,NULL,Jefferson,CO,Double-crested Cormorant,NULL,01200810,NULL,,2003,NULL,NULL,NULL,NULL,NULL,Jefferson,CO,Great Blue Heron,NULL,01940811,NULL,,2004,NULL,NULL,NULL,NULL,NULL,Jefferson,CO,Double-crested Cormorant,NULL,01200812,NULL,,2004,NULL,NULL,NULL,NULL,NULL,Jefferson,CO,Great Blue Heron,NULL,01940813,NULL,,2005,NULL,NULL,NULL,NULL,NULL,Jefferson,CO,Double-crested Cormorant,NULL,01200814,NULL,,2005,NULL,NULL,NULL,NULL,NULL,Jefferson,CO,Great Blue Heron,NULL,01940815,5/22/2003,00:00.0,2003,5,22,NULL,NULL,NULL,Otero,CO,Great Blue Heron,NULL,01940816,5/25/2005,00:00.0,2005,5,25,NULL,NULL,NULL,Otero,CO,Great Blue Heron,NULL,01940817,NULL,,2005,NULL,NULL,NULL,NULL,NULL,Ouray,CO,Great Blue Heron,NULL,01940818,NULL,,2007,NULL,NULL,NULL,NULL,NULL,Garfield,CO,Great Blue Heron,NULL,01940819,5/3/2003,00:00.0,2003,5,3,NULL,NULL,NULL,Garfield,CO,Great Blue Heron,NULL,01940820,5/5/2004,00:00.0,2004,5,5,NULL,NULL,NULL,Garfield,CO,Great Blue Heron,NULL,01940821,4/14/2005,00:00.0,2005,4,14,NULL,NULL,NULL,Garfield,CO,Great Blue Heron,NULL,01940822,NULL,,1979,NULL,NULL,Graul/Miller,NULL,NULL,Rio Blanco,CO,Great Blue Heron,NULL,01940823,NULL,,1982,NULL,NULL,Graul/Miller,NULL,NULL,Rio Blanco,CO,Great Blue Heron,NULL,01940824,NULL,,1988,NULL,NULL,NULL,NULL,NULL,Rio Blanco,CO,Great Blue Heron,NULL,01940825,NULL,,2000,NULL,NULL,NULL,NULL,NULL,Rio Blanco,CO,Great Blue Heron,NULL,01940826,4/26/2001,00:00.0,2001,4,26,NULL,NULL,NULL,Rio Blanco,CO,Great Blue Heron,NULL,01940827,5/1/2002,00:00.0,2002,5,1,NULL,NULL,NULL,Rio Blanco,CO,Great Blue Heron,NULL,01940828,4/13/2003,00:00.0,2003,4,13,NULL,NULL,NULL,Rio Blanco,CO,Great Blue Heron,NULL,01940829,5/5/2004,00:00.0,2004,5,5,NULL,NULL,NULL,Rio Blanco,CO,Great Blue Heron,NULL,01940830,5/2/2005,00:00.0,2005,5,2,NULL,NULL,NULL,Rio Blanco,CO,Great Blue Heron,NULL,01940831,NULL,,2000,NULL,NULL,NULL,NULL,NULL,Eagle,CO,Great Blue Heron,NULL,01940832,NULL,,2001,NULL,NULL,NULL,NULL,NULL,Eagle,CO,Great Blue Heron,NULL,01940833,NULL,,2002,NULL,NULL,NULL,NULL,NULL,Eagle,CO,Great Blue Heron,NULL,01940834,NULL,,2004,NULL,NULL,NULL,NULL,NULL,Eagle,CO,Great Blue Heron,NULL,01940835,NULL,,2005,NULL,NULL,NULL,NULL,NULL,Eagle,CO,Great Blue Heron,NULL,01940836,5/1/2003,00:00.0,2003,5,1,NULL,NULL,NULL,Eagle,CO,Great Blue Heron,NULL,01940837,NULL,,2004,NULL,NULL,NULL,NULL,NULL,Delta,CO,Great Blue Heron,NULL,01940838,NULL,,2005,NULL,NULL,NULL,NULL,NULL,Delta,CO,Great Blue Heron,NULL,01940839,NULL,,2002,NULL,NULL,NULL,NULL,NULL,Gunnison,CO,Great Blue Heron,NULL,01940840,NULL,,2004,NULL,NULL,NULL,NULL,NULL,Gunnison,CO,Great Blue Heron,NULL,01940841,NULL,,1999,NULL,NULL,NULL,NULL,NULL,Mesa,CO,Great Blue Heron,NULL,01940842,NULL,,2000,NULL,NULL,NULL,NULL,NULL,Mesa,CO,Great Blue Heron,NULL,01940843,NULL,,2001,NULL,NULL,NULL,NULL,NULL,Mesa,CO,Great Blue Heron,NULL,01940844,4/30/2002,00:00.0,2002,4,30,NULL,NULL,NULL,Mesa,CO,Great Blue Heron,NULL,01940845,4/14/2007,00:00.0,2007,4,14,NULL,NULL,NULL,Mesa,CO,Great Blue Heron,NULL,01940846,NULL,,1999,NULL,NULL,NULL,NULL,NULL,Weld,CO,Great Blue Heron,NULL,01940847,NULL,,2000,NULL,NULL,NULL,NULL,NULL,Weld,CO,Black-crowned Night-Heron,NULL,02020848,NULL,,2000,NULL,NULL,NULL,NULL,NULL,Weld,CO,Great Blue Heron,NULL,01940849,NULL,,2000,NULL,NULL,NULL,NULL,NULL,Weld,CO,Great Egret,NULL,01960850,NULL,,2001,NULL,NULL,NULL,NULL,NULL,Weld,CO,Great Blue Heron,NULL,01940851,NULL,,2001,NULL,NULL,NULL,NULL,NULL,Weld,CO,Great Egret,NULL,01960852,NULL,,2002,NULL,NULL,NULL,NULL,NULL,Weld,CO,Black-crowned Night-Heron,NULL,02020853,NULL,,2002,NULL,NULL,NULL,NULL,NULL,Weld,CO,Great Blue Heron,NULL,01940854,NULL,,2002,NULL,NULL,NULL,NULL,NULL,Weld,CO,Great Egret,NULL,01960855,NULL,,2003,NULL,NULL,NULL,NULL,NULL,Weld,CO,Black-crowned Night-Heron,NULL,02020856,NULL,,2003,NULL,NULL,NULL,NULL,NULL,Weld,CO,Great Blue Heron,NULL,01940857,NULL,,2003,NULL,NULL,NULL,NULL,NULL,Weld,CO,Great Egret,NULL,01960858,NULL,,2004,NULL,NULL,NULL,NULL,NULL,Weld,CO,Great Egret,NULL,01960859,NULL,,2005,NULL,NULL,NULL,NULL,NULL,Weld,CO,Great Egret,NULL,01960860,NULL,,2003,NULL,NULL,NULL,NULL,NULL,Larimer,CO,Great Blue Heron,NULL,01940861,NULL,,2004,NULL,NULL,NULL,NULL,NULL,Larimer,CO,Great Blue Heron,NULL,01940862,NULL,,2005,NULL,NULL,NULL,NULL,NULL,Larimer,CO,Great Blue Heron,NULL,01940863,6/3/2002,00:00.0,2002,6,3,NULL,NULL,NULL,Delta,CO,Western Grebe,NULL,00010864,6/11/2003,00:00.0,2003,6,11,NULL,NULL,NULL,Delta,CO,Western Grebe,NULL,00010865,NULL,,2001,NULL,NULL,NULL,NULL,NULL,Larimer,CO,Double-crested Cormorant,NULL,01200866,NULL,,2001,NULL,NULL,NULL,NULL,NULL,Montrose,CO,Great Blue Heron,NULL,01940867,NULL,,2002,NULL,NULL,NULL,NULL,NULL,Montrose,CO,Great Blue Heron,NULL,01940868,NULL,,2003,NULL,NULL,NULL,NULL,NULL,Montrose,CO,Great Blue Heron,NULL,01940869,NULL,,2004,NULL,NULL,NULL,NULL,NULL,Montrose,CO,Great Blue Heron,NULL,01940870,NULL,,2005,NULL,NULL,NULL,NULL,NULL,Montrose,CO,Great Blue Heron,NULL,01940871,NULL,,1990,NULL,NULL,Howe,NULL,NULL,Jackson,CO,California Gull,NULL,00530872,NULL,,1991,NULL,NULL,Ryder,NULL,NULL,Jackson,CO,California Gull,NULL,00530873,NULL,,1993,NULL,NULL,NULL,NULL,NULL,Jackson,CO,Forster's Tern,NULL,00690874,7/9/1993,00:00.0,1993,7,9,NULL,NULL,NULL,Jackson,CO,California Gull,NULL,00530875,7/17/1998,00:00.0,1998,7,17,NULL,NULL,NULL,Jackson,CO,Eared Grebe,NULL,00040876,7/28/1998,00:00.0,1998,7,28,NULL,NULL,NULL,Jackson,CO,Franklin's Gull,NULL,00590877,7/20/1999,00:00.0,1999,7,20,NULL,NULL,NULL,Jackson,CO,Forster's Tern,NULL,00690878,7/21/1999,00:00.0,1999,7,21,NULL,NULL,NULL,Jackson,CO,California Gull,NULL,00530879,7/21/1999,00:00.0,1999,7,21,NULL,NULL,NULL,Jackson,CO,Eared Grebe,NULL,00040880,7/12/2000,00:00.0,2000,7,12,NULL,NULL,NULL,Jackson,CO,California Gull,NULL,00530881,7/12/2000,00:00.0,2000,7,12,NULL,NULL,NULL,Jackson,CO,Double-crested Cormorant,NULL,01200882,7/12/2000,00:00.0,2000,7,12,NULL,NULL,NULL,Jackson,CO,Eared Grebe,NULL,00040883,7/12/2000,00:00.0,2000,7,12,NULL,NULL,NULL,Jackson,CO,Forster's Tern,NULL,00690884,7/12/2000,00:00.0,2000,7,12,NULL,NULL,NULL,Jackson,CO,Franklin's Gull,NULL,00590885,4/26/2001,00:00.0,2001,4,26,NULL,NULL,NULL,Jackson,CO,Double-crested Cormorant,NULL,01200886,7/7/2001,00:00.0,2001,7,7,NULL,NULL,NULL,Jackson,CO,California Gull,NULL,00530887,7/7/2001,00:00.0,2001,7,7,NULL,NULL,NULL,Jackson,CO,Eared Grebe,NULL,00040888,7/7/2001,00:00.0,2001,7,7,NULL,NULL,NULL,Jackson,CO,Forster's Tern,NULL,00690889,7/7/2001,00:00.0,2001,7,7,NULL,NULL,NULL,Jackson,CO,Franklin's Gull,NULL,00590890,6/5/2002,00:00.0,2002,6,5,NULL,NULL,NULL,Jackson,CO,California Gull,NULL,00530891,7/23/2002,00:00.0,2002,7,23,NULL,NULL,NULL,Jackson,CO,Eared Grebe,NULL,00040892,6/16/2003,00:00.0,2003,6,16,NULL,NULL,NULL,Jackson,CO,Eared Grebe,NULL,00040893,6/18/2003,00:00.0,2003,6,18,NULL,NULL,NULL,Jackson,CO,California Gull,NULL,00530894,6/18/2003,00:00.0,2003,6,18,NULL,NULL,NULL,Jackson,CO,Forster's Tern,NULL,00690895,6/18/2003,00:00.0,2003,6,18,NULL,NULL,NULL,Jackson,CO,Western Grebe,NULL,00010896,6/19/2003,00:00.0,2003,6,19,NULL,NULL,NULL,Jackson,CO,Double-crested Cormorant,NULL,01200897,6/13/2004,00:00.0,2004,6,13,NULL,NULL,NULL,Jackson,CO,California Gull,NULL,00530898,6/13/2004,00:00.0,2004,6,13,NULL,NULL,NULL,Jackson,CO,Double-crested Cormorant,NULL,01200899,6/13/2004,00:00.0,2004,6,13,NULL,NULL,NULL,Jackson,CO,Western Grebe,NULL,00010900,7/11/2004,00:00.0,2004,7,11,NULL,NULL,NULL,Jackson,CO,Eared Grebe,NULL,00040901,7/11/2004,00:00.0,2004,7,11,NULL,NULL,NULL,Jackson,CO,Forster's Tern,NULL,00690902,7/11/2004,00:00.0,2004,7,11,NULL,NULL,NULL,Jackson,CO,Franklin's Gull,NULL,00590903,6/23/2005,00:00.0,2005,6,23,NULL,NULL,NULL,Jackson,CO,Eared Grebe,NULL,00040904,6/23/2005,00:00.0,2005,6,23,NULL,NULL,NULL,Jackson,CO,Western Grebe,NULL,00010905,6/25/2005,00:00.0,2005,6,25,NULL,NULL,NULL,Jackson,CO,California Gull,NULL,00530906,6/25/2005,00:00.0,2005,6,25,NULL,NULL,NULL,Jackson,CO,Double-crested Cormorant,NULL,01200907,6/25/2005,00:00.0,2005,6,25,NULL,NULL,NULL,Jackson,CO,Forster's Tern,NULL,00690908,6/25/2005,00:00.0,2005,6,25,NULL,NULL,NULL,Jackson,CO,Franklin's Gull,NULL,00590909,7/11/2006,00:00.0,2006,7,11,NULL,NULL,NULL,Jackson,CO,Eared Grebe,NULL,00040910,7/11/2006,00:00.0,2006,7,11,NULL,NULL,NULL,Jackson,CO,Forster's Tern,NULL,00690911,4/28/2011,00:00.0,2011,4,28,Piest,NULL,NULL,Mohave,AZ,Great Blue Heron,NULL,01940912,4/23/2010,00:00.0,2010,4,23,Liese,NULL,NULL,Pinal,AZ,Great Blue Heron,NULL,01940913,4/13/2011,00:00.0,2011,4,13,Andresen,NULL,NULL,Pinal,AZ,Great Blue Heron,NULL,01940914,5/28/2009,00:00.0,2009,5,28,MacVean,NULL,NULL,Coconino,AZ,Great Blue Heron,NULL,01940915,5/20/2010,00:00.0,2010,5,20,Morrall,NULL,NULL,Coconino,AZ,Great Blue Heron,NULL,01940916,7/13/2011,00:00.0,2011,7,13,Morrall,NULL,NULL,Coconino,AZ,Great Blue Heron,NULL,01940917,2/10/2009,00:00.0,2009,2,10,Barnes,NULL,NULL,Mohave,AZ,Double-crested Cormorant,NULL,01200918,3/29/2009,00:00.0,2009,3,29,Spilker,NULL,NULL,Maricopa,AZ,Great Blue Heron,NULL,01940919,2/9/2010,00:00.0,2010,2,9,Willard,NULL,NULL,Maricopa,AZ,Great Blue Heron,NULL,01940920,3/4/2010,00:00.0,2010,3,4,Silva,NULL,NULL,Maricopa,AZ,Great Blue Heron,NULL,01940921,3/15/2010,00:00.0,2010,3,15,Silva,NULL,NULL,Maricopa,AZ,Great Blue Heron,NULL,01940922,2/24/2011,00:00.0,2011,2,24,Henne/Long,NULL,NULL,Maricopa,AZ,Great Blue Heron,NULL,01940923,4/25/2011,00:00.0,2011,4,25,Silva,NULL,NULL,Maricopa,AZ,Great Blue Heron,NULL,01940924,5/6/2009,00:00.0,2009,5,6,Hildebrandt,NULL,NULL,Maricopa,AZ,Great Blue Heron,NULL,01940925,5/5/2009,00:00.0,2009,5,5,Corman,NULL,NULL,Mohave,AZ,Great Blue Heron,NULL,01940926,4/21/2011,00:00.0,2011,4,21,Hough,NULL,NULL,Coconino,AZ,Great Blue Heron,NULL,01940927,6/12/2011,00:00.0,2011,6,12,Morrall,NULL,NULL,Coconino,AZ,Great Blue Heron,NULL,01940928,5/9/2011,00:00.0,2011,5,9,Corman,NULL,NULL,Maricopa,AZ,Great Blue Heron,NULL,01940929,4/16/2009,00:00.0,2009,4,16,Corman,NULL,NULL,Maricopa,AZ,Great Blue Heron,NULL,01940930,4/27/2010,00:00.0,2010,4,27,Corman,NULL,NULL,Maricopa,AZ,Great Blue Heron,NULL,01940931,5/3/2011,00:00.0,2011,5,3,Troy Corman,NULL,NULL,Maricopa,AZ,Great Blue Heron,NULL,01940932,1/16/2010,00:00.0,2010,1,16,Corman,NULL,NULL,Maricopa,AZ,Great Blue Heron,NULL,01940933,4/29/2011,00:00.0,2011,4,29,Corman/Lewis,NULL,NULL,Maricopa,AZ,Great Blue Heron,NULL,01940934,4/2/2009,00:00.0,2009,4,2,Snow,NULL,NULL,Pima,AZ,Great Blue Heron,NULL,01940935,3/17/2010,00:00.0,2010,3,17,Snow,NULL,NULL,Pima,AZ,Great Blue Heron,NULL,01940936,3/11/2011,00:00.0,2011,3,11,Snow,NULL,NULL,Pima,AZ,Great Blue Heron,NULL,01940937,4/4/2011,00:00.0,2011,4,4,Stevenson/Core,NULL,NULL,Pima,AZ,Great Blue Heron,NULL,01940938,4/4/2011,00:00.0,2011,4,4,Stevenson/Core,NULL,NULL,Pima,AZ,Neotropic Cormorant,NULL,01210939,5/14/2009,00:00.0,2009,5,14,Barrett,NULL,NULL,La Paz,AZ,Great Blue Heron,NULL,01940940,3/29/2010,00:00.0,2010,3,29,Zaun,NULL,NULL,La Paz,AZ,Great Blue Heron,NULL,019403761,NULL,,1998,NULL,NULL,NULL,NULL,NULL,Albany,WY,White-faced Ibis,NULL,018703762,NULL,,1998,NULL,NULL,NULL,NULL,NULL,Albany,WY,Snowy Egret,NULL,019703763,NULL,,1998,NULL,NULL,NULL,NULL,NULL,Albany,WY,Forster's Tern,NULL,006903764,NULL,,1998,NULL,NULL,NULL,NULL,NULL,Albany,WY,Cattle Egret,NULL,020013765,NULL,,1998,NULL,NULL,NULL,NULL,NULL,Albany,WY,Black-crowned Night-Heron,NULL,020203766,NULL,,1999,NULL,NULL,NULL,NULL,NULL,Albany,WY,White-faced Ibis,NULL,018703767,NULL,,1999,NULL,NULL,NULL,NULL,NULL,Albany,WY,Forster's Tern,NULL,006903768,NULL,,1999,NULL,NULL,NULL,NULL,NULL,Albany,WY,Black-crowned Night-Heron,NULL,020203769,NULL,,2000,NULL,NULL,NULL,NULL,NULL,Albany,WY,White-faced Ibis,NULL,018703770,NULL,,2000,NULL,NULL,NULL,NULL,NULL,Albany,WY,Black-crowned Night-Heron,NULL,020203771,NULL,,2001,NULL,NULL,NULL,NULL,NULL,Albany,WY,White-faced Ibis,NULL,018703772,NULL,,2001,NULL,NULL,NULL,NULL,NULL,Albany,WY,Forster's Tern,NULL,006903773,NULL,,2001,NULL,NULL,NULL,NULL,NULL,Albany,WY,Black-crowned Night-Heron,NULL,020203774,NULL,,2003,NULL,NULL,NULL,NULL,NULL,Albany,WY,White-faced Ibis,NULL,018703775,NULL,,2003,NULL,NULL,NULL,NULL,NULL,Albany,WY,Forster's Tern,NULL,006903776,NULL,,2003,NULL,NULL,NULL,NULL,NULL,Albany,WY,Black-crowned Night-Heron,NULL,020203777,NULL,,2004,NULL,NULL,NULL,NULL,NULL,Albany,WY,White-faced Ibis,NULL,018703778,NULL,,2004,NULL,NULL,NULL,NULL,NULL,Albany,WY,Forster's Tern,NULL,006903779,NULL,,2004,NULL,NULL,NULL,NULL,NULL,Albany,WY,Black-crowned Night-Heron,NULL,020203780,NULL,,2005,NULL,NULL,NULL,NULL,NULL,Albany,WY,White-faced Ibis,NULL,018703781,NULL,,2005,NULL,NULL,NULL,NULL,NULL,Albany,WY,Snowy Egret,NULL,019703782,NULL,,2005,NULL,NULL,NULL,NULL,NULL,Albany,WY,Franklin's Gull,NULL,005903783,NULL,,2005,NULL,NULL,NULL,NULL,NULL,Albany,WY,Forster's Tern,NULL,006903784,NULL,,2005,NULL,NULL,NULL,NULL,NULL,Albany,WY,Black-crowned Night-Heron,NULL,020203785,NULL,,2005,NULL,NULL,NULL,NULL,NULL,Albany,WY,Black Tern,NULL,007703786,NULL,,2006,NULL,NULL,NULL,NULL,NULL,Albany,WY,White-faced Ibis,NULL,018703787,NULL,,2006,NULL,NULL,NULL,NULL,NULL,Albany,WY,Forster's Tern,NULL,006903788,NULL,,2006,NULL,NULL,NULL,NULL,NULL,Albany,WY,Black-crowned Night-Heron,NULL,020203789,NULL,,1982,NULL,NULL,NULL,NULL,NULL,Albany,WY,Black-crowned Night-Heron,NULL,020203790,NULL,,1982,NULL,NULL,NULL,NULL,NULL,Albany,WY,Black Tern,NULL,007703791,NULL,,1983,NULL,NULL,NULL,NULL,NULL,Albany,WY,Forster's Tern,NULL,006903792,NULL,,1983,NULL,NULL,NULL,NULL,NULL,Albany,WY,Black-crowned Night-Heron,NULL,020203793,NULL,,1984,NULL,NULL,NULL,NULL,NULL,Albany,WY,Black-crowned Night-Heron,NULL,020203794,NULL,,1985,NULL,NULL,NULL,NULL,NULL,Albany,WY,Black-crowned Night-Heron,NULL,020203795,NULL,,1986,NULL,NULL,NULL,NULL,NULL,Albany,WY,Black-crowned Night-Heron,NULL,020203796,NULL,,1987,NULL,NULL,NULL,NULL,NULL,Albany,WY,Forster's Tern,NULL,006903797,NULL,,1987,NULL,NULL,NULL,NULL,NULL,Albany,WY,Black-crowned Night-Heron,NULL,020203798,NULL,,1987,NULL,NULL,NULL,NULL,NULL,Albany,WY,Black Tern,NULL,007703799,NULL,,1994,NULL,NULL,NULL,NULL,NULL,Albany,WY,Black-crowned Night-Heron,NULL,020203800,NULL,,1997,NULL,NULL,NULL,NULL,NULL,Albany,WY,Forster's Tern,NULL,006903801,NULL,,1997,NULL,NULL,NULL,NULL,NULL,Albany,WY,Black-crowned Night-Heron,NULL,020203802,NULL,,1998,NULL,NULL,NULL,NULL,NULL,Albany,WY,Black-crowned Night-Heron,NULL,020203803,NULL,,2001,NULL,NULL,NULL,NULL,NULL,Albany,WY,Black-crowned Night-Heron,NULL,020203804,NULL,,2003,NULL,NULL,NULL,NULL,NULL,Albany,WY,Forster's Tern,NULL,006903805,NULL,,2006,NULL,NULL,NULL,NULL,NULL,Albany,WY,Forster's Tern,NULL,006903806,NULL,,1992,NULL,NULL,NULL,NULL,NULL,Crook,WY,Double-crested Cormorant,NULL,012003807,NULL,,1993,NULL,NULL,NULL,NULL,NULL,Crook,WY,Double-crested Cormorant,NULL,012003808,NULL,,1994,NULL,NULL,NULL,NULL,NULL,Crook,WY,Double-crested Cormorant,NULL,012003809,NULL,,1995,NULL,NULL,NULL,NULL,NULL,Crook,WY,Double-crested Cormorant,NULL,012003810,NULL,,1983,NULL,NULL,NULL,NULL,NULL,Hot Springs,WY,Double-crested Cormorant,NULL,012003811,NULL,,1986,NULL,NULL,NULL,NULL,NULL,Hot Springs,WY,Double-crested Cormorant,NULL,012003812,NULL,,1983,NULL,NULL,NULL,NULL,NULL,Johnson,WY,Double-crested Cormorant,NULL,012003813,NULL,,1984,NULL,NULL,NULL,NULL,NULL,Johnson,WY,Double-crested Cormorant,NULL,012003814,NULL,,1985,NULL,NULL,NULL,NULL,NULL,Johnson,WY,Double-crested Cormorant,NULL,012003815,NULL,,1986,NULL,NULL,NULL,NULL,NULL,Johnson,WY,Double-crested Cormorant,NULL,012003816,NULL,,1987,NULL,NULL,NULL,NULL,NULL,Johnson,WY,Double-crested Cormorant,NULL,012003817,NULL,,1988,NULL,NULL,NULL,NULL,NULL,Johnson,WY,Double-crested Cormorant,NULL,012003818,NULL,,1989,NULL,NULL,NULL,NULL,NULL,Johnson,WY,Double-crested Cormorant,NULL,012003819,NULL,,1990,NULL,NULL,NULL,NULL,NULL,Johnson,WY,Double-crested Cormorant,NULL,012003820,NULL,,1991,NULL,NULL,NULL,NULL,NULL,Johnson,WY,Double-crested Cormorant,NULL,012003821,NULL,,1992,NULL,NULL,NULL,NULL,NULL,Johnson,WY,Double-crested Cormorant,NULL,012003822,NULL,,1993,NULL,NULL,NULL,NULL,NULL,Johnson,WY,Double-crested Cormorant,NULL,012003823,NULL,,1994,NULL,NULL,NULL,NULL,NULL,Johnson,WY,Double-crested Cormorant,NULL,012003824,NULL,,1995,NULL,NULL,NULL,NULL,NULL,Johnson,WY,Double-crested Cormorant,NULL,012003825,NULL,,1996,NULL,NULL,NULL,NULL,NULL,Johnson,WY,Double-crested Cormorant,NAD 83,012003826,NULL,,1999,NULL,NULL,NULL,NULL,NULL,Johnson,WY,Double-crested Cormorant,NULL,012003827,NULL,,1984,NULL,NULL,NULL,NULL,NULL,Crook,WY,Double-crested Cormorant,NULL,012003828,NULL,,1986,NULL,NULL,NULL,NULL,NULL,Crook,WY,Double-crested Cormorant,NULL,012003829,NULL,,1984,NULL,NULL,NULL,NULL,NULL,Bighorn,WY,Western Grebe,NULL,000103830,NULL,,1987,NULL,NULL,NULL,NULL,NULL,Bighorn,WY,Western Grebe,NULL,000103831,NULL,,1987,NULL,NULL,NULL,NULL,NULL,Bighorn,WY,Clark's Grebe,NULL,000113832,NULL,,1988,NULL,NULL,NULL,NULL,NULL,Bighorn,WY,NULL,NULL,NULL3833,NULL,,1990,NULL,NULL,NULL,NULL,NULL,Bighorn,WY,Western Grebe,NULL,000103834,NULL,,1990,NULL,NULL,NULL,NULL,NULL,Campbell,WY,Black-crowned Night-Heron,NULL,020203835,NULL,,1994,NULL,NULL,NULL,NULL,NULL,Campbell,WY,Black-crowned Night-Heron,NULL,020203836,NULL,,1984,NULL,NULL,NULL,NULL,NULL,Niobrara,WY,Double-crested Cormorant,NULL,012003837,NULL,,1993,NULL,NULL,NULL,NULL,NULL,Crook,WY,Double-crested Cormorant,NULL,012003838,NULL,,1984,NULL,NULL,NULL,NULL,NULL,Johnson,WY,Double-crested Cormorant,NULL,012003839,NULL,,1986,NULL,NULL,NULL,NULL,NULL,Crook,WY,Double-crested Cormorant,NULL,012003840,NULL,,1993,NULL,NULL,NULL,NULL,NULL,Crook,WY,Double-crested Cormorant,NULL,012003841,NULL,,1994,NULL,NULL,NULL,NULL,NULL,Crook,WY,Double-crested Cormorant,NULL,012003842,NULL,,1995,NULL,NULL,NULL,NULL,NULL,Crook,WY,Double-crested Cormorant,NULL,012003843,NULL,,1983,NULL,NULL,NULL,NULL,NULL,Fremont,WY,Double-crested Cormorant,NULL,012003844,NULL,,1984,NULL,NULL,NULL,NULL,NULL,Fremont,WY,Western Grebe,NULL,000103845,NULL,,1984,NULL,NULL,NULL,NULL,NULL,Fremont,WY,Forster's Tern,NULL,006903846,NULL,,1984,NULL,NULL,NULL,NULL,NULL,Fremont,WY,Double-crested Cormorant,NULL,012003847,NULL,,1985,NULL,NULL,NULL,NULL,NULL,Fremont,WY,Forster's Tern,NULL,006903848,NULL,,1985,NULL,NULL,NULL,NULL,NULL,Fremont,WY,Double-crested Cormorant,NAD 83,012003849,NULL,,1986,NULL,NULL,NULL,NULL,NULL,Fremont,WY,Forster's Tern,NULL,006903850,NULL,,1986,NULL,NULL,NULL,NULL,NULL,Fremont,WY,Double-crested Cormorant,NULL,012003851,NULL,,1987,NULL,NULL,NULL,NULL,NULL,Fremont,WY,Forster's Tern,NULL,006903852,NULL,,1987,NULL,NULL,NULL,NULL,NULL,Fremont,WY,Double-crested Cormorant,NAD 83,012003853,NULL,,1990,NULL,NULL,NULL,NULL,NULL,Fremont,WY,Western Grebe,NULL,000103854,NULL,,1990,NULL,NULL,NULL,NULL,NULL,Fremont,WY,Double-crested Cormorant,NAD 83,012003855,NULL,,1991,NULL,NULL,NULL,NULL,NULL,Fremont,WY,Double-crested Cormorant,NAD 83,012003856,NULL,,1992,NULL,NULL,NULL,NULL,NULL,Fremont,WY,Western Grebe,NULL,000103857,NULL,,1992,NULL,NULL,NULL,NULL,NULL,Fremont,WY,Forster's Tern,NULL,006903858,NULL,,1992,NULL,NULL,NULL,NULL,NULL,Fremont,WY,Double-crested Cormorant,NAD 83,012003859,NULL,,1994,NULL,NULL,NULL,NULL,NULL,Fremont,WY,Western Grebe,NAD 83,000103860,NULL,,1994,NULL,NULL,NULL,NULL,NULL,Fremont,WY,Forster's Tern,NULL,006903861,NULL,,1994,NULL,NULL,NULL,NULL,NULL,Fremont,WY,Clark's Grebe,NAD 83,000113862,NULL,,1995,NULL,NULL,NULL,NULL,NULL,Fremont,WY,Western Grebe,NAD 83,000103863,NULL,,1995,NULL,NULL,NULL,NULL,NULL,Fremont,WY,Forster's Tern,NULL,006903864,NULL,,1995,NULL,NULL,NULL,NULL,NULL,Fremont,WY,Double-crested Cormorant,NULL,012003865,NULL,,1995,NULL,NULL,NULL,NULL,NULL,Fremont,WY,Clark's Grebe,NAD 83,000113866,NULL,,1998,NULL,NULL,NULL,NULL,NULL,Fremont,WY,Western Grebe,NAD 83,000103867,NULL,,1998,NULL,NULL,NULL,NULL,NULL,Fremont,WY,Clark's Grebe,NAD 83,000113868,NULL,,2003,NULL,NULL,NULL,NULL,NULL,Fremont,WY,Western Grebe,NULL,000103869,NULL,,2003,NULL,NULL,NULL,NULL,NULL,Fremont,WY,Franklin's Gull,NULL,005903870,NULL,,2003,NULL,NULL,NULL,NULL,NULL,Fremont,WY,Forster's Tern,NULL,006903871,NULL,,2003,NULL,NULL,NULL,NULL,NULL,Fremont,WY,Double-crested Cormorant,NAD 83,012003872,NULL,,2003,NULL,NULL,NULL,NULL,NULL,Fremont,WY,Clark's Grebe,NULL,000113873,NULL,,2004,NULL,NULL,NULL,NULL,NULL,Fremont,WY,Western Grebe,NAD 83,000103874,NULL,,2004,NULL,NULL,NULL,NULL,NULL,Fremont,WY,Forster's Tern,NULL,006903875,NULL,,2004,NULL,NULL,NULL,NULL,NULL,Fremont,WY,Double-crested Cormorant,NULL,012003876,NULL,,2004,NULL,NULL,NULL,NULL,NULL,Fremont,WY,Clark's Grebe,NAD 83,000113877,NULL,,2005,NULL,NULL,NULL,NULL,NULL,Fremont,WY,Double-crested Cormorant,NULL,012003878,NULL,,2005,NULL,NULL,NULL,NULL,NULL,Fremont,WY,Clark's Grebe,NULL,000113879,NULL,,2006,NULL,NULL,NULL,NULL,NULL,Fremont,WY,Western Grebe,NAD 83,000103880,NULL,,2006,NULL,NULL,NULL,NULL,NULL,Fremont,WY,Double-crested Cormorant,NULL,012003881,NULL,,2006,NULL,NULL,NULL,NULL,NULL,Fremont,WY,Clark's Grebe,NAD 83,000113882,NULL,,NULL,NULL,NULL,NULL,NULL,NULL,Fremont,WY,Snowy Egret,NULL,019703883,NULL,,1986,NULL,NULL,NULL,NULL,NULL,Sweetwater,WY,White-faced Ibis,NULL,018703884,NULL,,1986,NULL,NULL,NULL,NULL,NULL,Sweetwater,WY,Snowy Egret,NULL,019703885,NULL,,1986,NULL,NULL,NULL,NULL,NULL,Sweetwater,WY,Black-crowned Night-Heron,NULL,020203886,NULL,,1987,NULL,NULL,NULL,NULL,NULL,Sweetwater,WY,White-faced Ibis,NULL,018703887,NULL,,1987,NULL,NULL,NULL,NULL,NULL,Sweetwater,WY,Black-crowned Night-Heron,NULL,020203888,NULL,,1990,NULL,NULL,NULL,NULL,NULL,Sweetwater,WY,Black-crowned Night-Heron,NULL,020203889,NULL,,1993,NULL,NULL,NULL,NULL,NULL,Sweetwater,WY,White-faced Ibis,NULL,018703890,NULL,,1993,NULL,NULL,NULL,NULL,NULL,Sweetwater,WY,Black-crowned Night-Heron,NULL,020203891,NULL,,1994,NULL,NULL,NULL,NULL,NULL,Sweetwater,WY,Black-crowned Night-Heron,NULL,020203892,NULL,,1995,NULL,NULL,NULL,NULL,NULL,Sweetwater,WY,Black-crowned Night-Heron,NULL,020203893,NULL,,1996,NULL,NULL,NULL,NULL,NULL,Sweetwater,WY,White-faced Ibis,NULL,018703894,NULL,,1996,NULL,NULL,NULL,NULL,NULL,Sweetwater,WY,Black-crowned Night-Heron,NULL,020203895,NULL,,1997,NULL,NULL,NULL,NULL,NULL,Sweetwater,WY,White-faced Ibis,NULL,018703896,NULL,,1997,NULL,NULL,NULL,NULL,NULL,Sweetwater,WY,Black-crowned Night-Heron,NULL,020203897,NULL,,1998,NULL,NULL,NULL,NULL,NULL,Sweetwater,WY,White-faced Ibis,NULL,018703898,NULL,,1998,NULL,NULL,NULL,NULL,NULL,Sweetwater,WY,Snowy Egret,NULL,019703899,NULL,,1998,NULL,NULL,NULL,NULL,NULL,Sweetwater,WY,Black-crowned Night-Heron,NULL,020203900,NULL,,1999,NULL,NULL,NULL,NULL,NULL,Sweetwater,WY,White-faced Ibis,NULL,018703901,NULL,,1999,NULL,NULL,NULL,NULL,NULL,Sweetwater,WY,Snowy Egret,NULL,019703902,NULL,,1999,NULL,NULL,NULL,NULL,NULL,Sweetwater,WY,Black-crowned Night-Heron,NULL,020203903,NULL,,2000,NULL,NULL,NULL,NULL,NULL,Sweetwater,WY,White-faced Ibis,NULL,018703904,NULL,,2000,NULL,NULL,NULL,NULL,NULL,Sweetwater,WY,Black-crowned Night-Heron,NULL,020203905,NULL,,1984,NULL,NULL,NULL,NULL,NULL,Sheridan,WY,Double-crested Cormorant,NULL,012003906,NULL,,1986,NULL,NULL,NULL,NULL,NULL,Sheridan,WY,Double-crested Cormorant,NULL,012003907,NULL,,1993,NULL,NULL,NULL,NULL,NULL,Sheridan,WY,Double-crested Cormorant,NULL,012003908,NULL,,1994,NULL,NULL,NULL,NULL,NULL,Sheridan,WY,Double-crested Cormorant,NULL,012003909,NULL,,1984,NULL,NULL,NULL,NULL,NULL,Carbon,WY,Double-crested Cormorant,NULL,012003910,NULL,,1984,NULL,NULL,NULL,NULL,NULL,Carbon,WY,Caspian Tern,NULL,006403911,NULL,,1984,NULL,NULL,NULL,NULL,NULL,Carbon,WY,American White Pelican,NULL,012503912,NULL,,1986,NULL,NULL,NULL,NULL,NULL,Carbon,WY,Double-crested Cormorant,NULL,012003913,NULL,,1986,NULL,NULL,NULL,NULL,NULL,Carbon,WY,Caspian Tern,NULL,006403914,NULL,,1987,NULL,NULL,NULL,NULL,NULL,Carbon,WY,Double-crested Cormorant,NULL,012003915,NULL,,1987,NULL,NULL,NULL,NULL,NULL,Carbon,WY,Caspian Tern,NULL,006403916,NULL,,1987,NULL,NULL,NULL,NULL,NULL,Carbon,WY,American White Pelican,NULL,012503917,NULL,,1988,NULL,NULL,NULL,NULL,NULL,Carbon,WY,Caspian Tern,NULL,006403918,NULL,,1988,NULL,NULL,NULL,NULL,NULL,Carbon,WY,American White Pelican,NULL,012503919,NULL,,1989,NULL,NULL,NULL,NULL,NULL,Carbon,WY,Caspian Tern,NULL,006403920,NULL,,1990,NULL,NULL,NULL,NULL,NULL,Carbon,WY,Double-crested Cormorant,NULL,012003921,NULL,,1990,NULL,NULL,NULL,NULL,NULL,Carbon,WY,American White Pelican,NULL,012503922,NULL,,1991,NULL,NULL,NULL,NULL,NULL,Carbon,WY,Double-crested Cormorant,NULL,012003923,NULL,,1991,NULL,NULL,NULL,NULL,NULL,Carbon,WY,American White Pelican,NULL,012503924,NULL,,1996,NULL,NULL,NULL,NULL,NULL,Carbon,WY,Double-crested Cormorant,NULL,012003925,NULL,,1996,NULL,NULL,NULL,NULL,NULL,Carbon,WY,American White Pelican,NULL,012503926,NULL,,1997,NULL,NULL,NULL,NULL,NULL,Carbon,WY,American White Pelican,NULL,012503927,NULL,,1998,NULL,NULL,NULL,NULL,NULL,Carbon,WY,American White Pelican,NULL,012503928,NULL,,1999,NULL,NULL,NULL,NULL,NULL,Carbon,WY,American White Pelican,NULL,012503929,NULL,,2000,NULL,NULL,NULL,NULL,NULL,Carbon,WY,American White Pelican,NULL,012503930,NULL,,2001,NULL,NULL,NULL,NULL,NULL,Carbon,WY,American White Pelican,NULL,012503931,NULL,,2003,NULL,NULL,NULL,NULL,NULL,Carbon,WY,Double-crested Cormorant,NULL,012003932,NULL,,2003,NULL,NULL,NULL,NULL,NULL,Carbon,WY,American White Pelican,NULL,012503933,NULL,,2004,NULL,NULL,NULL,NULL,NULL,Carbon,WY,Double-crested Cormorant,NULL,012003934,NULL,,2004,NULL,NULL,NULL,NULL,NULL,Carbon,WY,American White Pelican,NULL,012503935,NULL,,2005,NULL,NULL,NULL,NULL,NULL,Carbon,WY,Double-crested Cormorant,NULL,012003936,NULL,,2005,NULL,NULL,NULL,NULL,NULL,Carbon,WY,American White Pelican,NULL,012503937,NULL,,2006,NULL,NULL,NULL,NULL,NULL,Carbon,WY,American White Pelican,NULL,012503938,NULL,,1986,NULL,NULL,NULL,NULL,NULL,Albany,WY,Forster's Tern,NULL,006903939,NULL,,1986,NULL,NULL,NULL,NULL,NULL,Albany,WY,Black-crowned Night-Heron,NULL,020203940,NULL,,1987,NULL,NULL,NULL,NULL,NULL,Albany,WY,Forster's Tern,NULL,006903941,NULL,,1987,NULL,NULL,NULL,NULL,NULL,Albany,WY,Black Tern,NULL,007703942,NULL,,1990,NULL,NULL,NULL,NULL,NULL,Albany,WY,Forster's Tern,NULL,006903943,NULL,,1990,NULL,NULL,NULL,NULL,NULL,Albany,WY,Black-crowned Night-Heron,NULL,020203944,NULL,,1994,NULL,NULL,NULL,NULL,NULL,Albany,WY,Forster's Tern,NULL,006903945,NULL,,1996,NULL,NULL,NULL,NULL,NULL,Albany,WY,White-faced Ibis,NULL,018703946,NULL,,1996,NULL,NULL,NULL,NULL,NULL,Albany,WY,Forster's Tern,NULL,006903947,NULL,,1996,NULL,NULL,NULL,NULL,NULL,Albany,WY,Black-crowned Night-Heron,NULL,020203948,NULL,,1997,NULL,NULL,NULL,NULL,NULL,Albany,WY,Forster's Tern,NULL,006902821,6/2/2009,00:00.0,2009,6,2,Neill,NULL,NULL,Box Elder,UT,White-faced Ibis,GSL,018702822,6/18/2009,00:00.0,2009,6,18,Neill/Mathis,NULL,NULL,Box Elder,UT,Franklin's Gull,GSL,005902823,6/18/2009,00:00.0,2009,6,18,Neill/Mathis,NULL,NULL,Box Elder,UT,Franklin's Gull,GSL,005902824,6/18/2009,00:00.0,2009,6,18,Neill/Mathis,NULL,NULL,Box Elder,UT,White-faced Ibis,GSL,018702825,6/18/2009,00:00.0,2009,6,18,Neill/Mathis,NULL,NULL,Box Elder,UT,White-faced Ibis,GSL,018702826,7/1/2009,00:00.0,2009,7,1,Bankhead,NULL,NULL,Box Elder,UT,Franklin's Gull,GSL,005902827,7/1/2009,00:00.0,2009,7,1,Neill,NULL,NULL,Box Elder,UT,White-faced Ibis,GSL,018702828,6/24/2010,00:00.0,2010,6,24,Parker/Frokjer,NULL,NULL,Rich,UT,Black Tern,NULL,007702829,5/19/2010,00:00.0,2010,5,19,Parker/Frokjer,NULL,NULL,Beaver,UT,Great Blue Heron,NULL,019402830,6/17/2009,00:00.0,2009,6,17,Parker/Frokjer,NULL,NULL,Uintah,UT,Western Grebe,NULL,000102831,5/18/2010,00:00.0,2010,5,18,Parker/Frokjer,NULL,NULL,Millard,UT,Black-crowned Night-Heron,NULL,020202832,5/18/2010,00:00.0,2010,5,18,Parker/Frokjer,NULL,NULL,Millard,UT,Great Blue Heron,NULL,019402833,6/1/2010,00:00.0,2010,6,1,Osmundson/Fraser,NULL,NULL,Wayne,UT,Great Blue Heron,NULL,019402834,6/1/2010,00:00.0,2010,6,1,Osmundson/Fraser,NULL,NULL,Wayne,UT,Great Blue Heron,NULL,019402835,6/1/2010,00:00.0,2010,6,1,Osmundson/Fraser,NULL,NULL,Wayne,UT,Great Blue Heron,NULL,019402836,6/2/2010,00:00.0,2010,6,2,Osmundson/Fraser,NULL,NULL,Wayne,UT,Great Blue Heron,NULL,019402837,5/27/2010,00:00.0,2010,5,27,Parker/Frokjer,NULL,NULL,Grand,UT,Great Blue Heron,NULL,019402838,5/27/2010,00:00.0,2010,5,27,Parker/Frokjer,NULL,NULL,Grand,UT,Great Blue Heron,NULL,019402839,6/4/2010,00:00.0,2010,6,4,Osmundson/Fraser,NULL,NULL,Wayne,UT,Great Blue Heron,NULL,019402840,5/27/2010,00:00.0,2010,5,27,Parker et al.,NULL,NULL,Grand,UT,Great Blue Heron,NULL,019402841,6/1/2010,00:00.0,2010,6,1,Osmundson/Fraser,NULL,NULL,Wayne,UT,Great Blue Heron,NULL,019402842,6/12/2009,00:00.0,2009,6,12,Parker/Frokjer,NULL,NULL,Cache,UT,Western Grebe,NULL,000102843,6/12/2009,00:00.0,2009,6,12,Parker/Frokjer,NULL,NULL,Cache,UT,Clark's Grebe,NULL,000112844,6/12/2009,00:00.0,2009,6,12,Parker/Frokjer,NULL,NULL,Cache,UT,Western Grebe,NULL,000102845,6/9/2009,00:00.0,2009,6,9,Parker/Frokjer,NULL,NULL,Cache,UT,American White Pelican,NULL,012502846,6/9/2009,00:00.0,2009,6,9,Parker/Frokjer,NULL,NULL,Cache,UT,Black-crowned Night-Heron,NULL,020202847,6/9/2009,00:00.0,2009,6,9,Parker/Frokjer,NULL,NULL,Cache,UT,Franklin's Gull,NULL,005902848,6/9/2009,00:00.0,2009,6,9,Parker/Frokjer,NULL,NULL,Cache,UT,Snowy Egret,NULL,019702849,6/9/2009,00:00.0,2009,6,9,Parker/Frokjer,NULL,NULL,Cache,UT,White-faced Ibis,NULL,018702850,5/12/2009,00:00.0,2009,5,12,Dixon,NULL,NULL,Cache,UT,White-faced Ibis,NULL,018702851,6/12/2009,00:00.0,2009,6,12,Parker/Frokjer,NULL,NULL,Cache,UT,Black-crowned Night-Heron,NULL,020202852,6/12/2009,00:00.0,2009,6,12,Parker/Frokjer,NULL,NULL,Cache,UT,Snowy Egret,NULL,019702853,6/12/2009,00:00.0,2009,6,12,Parker/Frokjer,NULL,NULL,Cache,UT,Clark's Grebe,NULL,000112854,5/8/2009,00:00.0,2009,5,8,Parker/Frokjer,NULL,NULL,Cache,UT,Great Blue Heron,NULL,019402855,6/12/2009,00:00.0,2009,6,12,Parker/Frokjer,NULL,NULL,Cache,UT,Clark's Grebe,NULL,000112856,5/25/2010,00:00.0,2010,5,25,Neill/Bartosz,NULL,NULL,Davis,UT,California Gull,GSL,005302857,5/25/2010,00:00.0,2010,5,25,Neill/Bartosz,NULL,NULL,Davis,UT,Double-crested Cormorant,GSL,012002858,5/25/2010,00:00.0,2010,5,25,Neill/Bartosz,NULL,NULL,Davis,UT,Great Blue Heron,GSL,019402859,7/1/2010,00:00.0,2010,7,1,Neill et al.,NULL,NULL,Davis,UT,California Gull,GSL,005302860,7/1/2010,00:00.0,2010,7,1,Neill et al.,NULL,NULL,Davis,UT,Double-crested Cormorant,GSL,012002861,7/1/2010,00:00.0,2010,7,1,Neill et al.,NULL,NULL,Davis,UT,Great Blue Heron,GSL,019402862,5/19/2010,00:00.0,2010,5,19,Parker/Frokjer,NULL,NULL,Washington,UT,Western Grebe,NULL,000102863,6/16/2009,00:00.0,2009,6,16,Neill,NULL,NULL,Davis,UT,Great Blue Heron,GSL,019402864,5/7/2009,00:00.0,2009,5,7,Neill,NULL,NULL,Salt Lake,UT,Black-crowned Night-Heron,GSL,020202865,6/16/2009,00:00.0,2009,6,16,Shreve,NULL,NULL,Salt Lake,UT,Black-crowned Night-Heron,GSL,020202866,6/16/2009,00:00.0,2009,6,16,Shreve,NULL,NULL,Salt Lake,UT,Forster's Tern,GSL,006902867,6/16/2009,00:00.0,2009,6,16,Shreve,NULL,NULL,Salt Lake,UT,Great Blue Heron,GSL,019402868,6/16/2009,00:00.0,2009,6,16,Shreve,NULL,NULL,Salt Lake,UT,Great Egret,GSL,019602869,6/16/2009,00:00.0,2009,6,16,Shreve,NULL,NULL,Salt Lake,UT,Snowy Egret,GSL,019702870,6/16/2009,00:00.0,2009,6,16,Shreve/Bankhead,NULL,NULL,Salt Lake,UT,Black-crowned Night-Heron,GSL,020202871,6/16/2009,00:00.0,2009,6,16,Shreve/Bankhead,NULL,NULL,Salt Lake,UT,Great Blue Heron,GSL,019402872,6/16/2009,00:00.0,2009,6,16,Shreve,NULL,NULL,Salt Lake,UT,Great Egret,GSL,019602873,6/16/2009,00:00.0,2009,6,16,Shreve/Bankhead,NULL,NULL,Salt Lake,UT,Snowy Egret,GSL,019702874,6/16/2009,00:00.0,2009,6,16,Bankhead/Shreve,NULL,NULL,Salt Lake,UT,White-faced Ibis,GSL,018702875,6/17/2009,00:00.0,2009,6,17,Neill/Dalton,NULL,NULL,Salt Lake,UT,Black-crowned Night-Heron,GSL,020202876,6/17/2009,00:00.0,2009,6,17,Neill/Dalton,NULL,NULL,Salt Lake,UT,Great Blue Heron,GSL,019402877,6/17/2009,00:00.0,2009,6,17,Neill/Dalton,NULL,NULL,Salt Lake,UT,Snowy Egret,GSL,019702878,6/17/2009,00:00.0,2009,6,17,Neill/Dalton,NULL,NULL,Salt Lake,UT,White-faced Ibis,GSL,018702879,6/18/2009,00:00.0,2009,6,18,Neill/Mathis,NULL,NULL,Salt Lake,UT,Black-crowned Night-Heron,GSL,020202880,6/18/2009,00:00.0,2009,6,18,Neill/Mathis,NULL,NULL,Salt Lake,UT,Great Egret,GSL,019602881,6/18/2009,00:00.0,2009,6,18,Neill/Mathis,NULL,NULL,Salt Lake,UT,Snowy Egret,GSL,019702882,6/18/2009,00:00.0,2009,6,18,Neill/Mathis,NULL,NULL,Salt Lake,UT,Snowy Egret,GSL,019702883,6/18/2009,00:00.0,2009,6,18,Neill/Mathis,NULL,NULL,Salt Lake,UT,White-faced Ibis,GSL,018702884,6/18/2009,00:00.0,2009,6,18,Neill/Mathis,NULL,NULL,Salt Lake,UT,White-faced Ibis,GSL,018702885,5/5/2010,00:00.0,2010,5,5,Neill/Mathis,NULL,NULL,Salt Lake,UT,Great Blue Heron,GSL,019402886,6/16/2009,00:00.0,2009,6,16,Shreve,NULL,NULL,Davis,UT,Clark's Grebe,GSL,000112887,6/16/2009,00:00.0,2009,6,16,Shreve,NULL,NULL,Davis,UT,Eared Grebe,GSL,000402888,6/16/2009,00:00.0,2009,6,16,Bankhead,NULL,NULL,Davis,UT,Forster's Tern,GSL,006902889,6/16/2009,00:00.0,2009,6,16,Shreve,NULL,NULL,Davis,UT,Western Grebe,GSL,000102890,6/16/2009,00:00.0,2009,6,16,Shreve,NULL,NULL,Davis,UT,Western or Clark's Grebe,GSL,NULL2891,6/16/2009,00:00.0,2009,6,16,Shreve,NULL,NULL,Davis,UT,Eared Grebe,GSL,000402892,6/16/2009,00:00.0,2009,6,16,Shreve,NULL,NULL,Davis,UT,Forster's Tern,GSL,006902893,6/16/2009,00:00.0,2009,6,16,Shreve,NULL,NULL,Davis,UT,Western or Clark's Grebe,GSL,NULL2894,6/16/2009,00:00.0,2009,6,16,Shreve,NULL,NULL,Davis,UT,Eared Grebe,GSL,000402895,6/16/2009,00:00.0,2009,6,16,Neill,NULL,NULL,Davis,UT,Great Blue Heron,GSL,019402896,6/19/2009,00:00.0,2009,6,19,Shreve,NULL,NULL,Davis,UT,Eared Grebe,GSL,000402897,6/16/2009,00:00.0,2009,6,16,Neill,NULL,NULL,Davis,UT,Forster's Tern,GSL,006902898,6/16/2009,00:00.0,2009,6,16,Neill,NULL,NULL,Davis,UT,Western Grebe,GSL,000102899,6/10/2010,00:00.0,2010,6,10,Parker/Frokjer,NULL,NULL,Sevier,UT,Black-crowned Night-Heron,NULL,020202900,6/10/2010,00:00.0,2010,6,10,Parker/Frokjer,NULL,NULL,Sevier,UT,Black-crowned Night-Heron,NULL,020202901,6/4/2009,00:00.0,2009,6,4,Parker/Frokjer,NULL,NULL,Juab,UT,Great Blue Heron,NULL,019402902,6/4/2009,00:00.0,2009,6,4,Parker/Frokjer,NULL,NULL,Juab,UT,Black-crowned Night-Heron,NULL,020202903,6/4/2009,00:00.0,2009,6,4,Parker/Frokjer,NULL,NULL,Juab,UT,Double-crested Cormorant,NULL,012002904,6/4/2009,00:00.0,2009,6,4,Parker/Frokjer,NULL,NULL,Juab,UT,Forster's Tern,NULL,006902905,6/4/2009,00:00.0,2009,6,4,Parker/Frokjer,NULL,NULL,Juab,UT,Great Blue Heron,NULL,019402906,6/4/2009,00:00.0,2009,6,4,Parker/Frokjer,NULL,NULL,Juab,UT,Snowy Egret,NULL,019702907,6/4/2009,00:00.0,2009,6,4,Parker/Frokjer,NULL,NULL,Juab,UT,White-faced Ibis,NULL,018702908,6/4/2009,00:00.0,2009,6,4,Parker/Frokjer,NULL,NULL,Juab,UT,Black-crowned Night-Heron,NULL,020202909,6/4/2009,00:00.0,2009,6,4,Parker/Frokjer,NULL,NULL,Juab,UT,Black-crowned Night-Heron,NULL,020202910,6/15/2009,00:00.0,2009,6,15,Parker/Frokjer,NULL,NULL,Uintah,UT,Western Grebe,NULL,000102911,5/21/2009,00:00.0,2009,5,21,Parker/Frokjer,NULL,NULL,Utah,UT,Great Blue Heron,NULL,019402912,6/9/2010,00:00.0,2010,6,9,Parker/Frokjer,NULL,NULL,Grand,UT,Great Blue Heron,NULL,019402913,6/16/2009,00:00.0,2009,6,16,Parker/Frokjer,NULL,NULL,Uintah,UT,Double-crested Cormorant,NULL,012002914,6/16/2009,00:00.0,2009,6,16,Parker/Frokjer,NULL,NULL,Uintah,UT,Great Blue Heron,NULL,019402915,5/25/2010,00:00.0,2010,5,25,Neill/Bartosz,NULL,NULL,Box Elder,UT,California Gull,GSL,005302916,6/15/2010,00:00.0,2010,6,15,Neill et al.,NULL,NULL,Box Elder,UT,California Gull,GSL,005302917,5/20/2009,00:00.0,2009,5,20,Neill/Dalton,NULL,NULL,Box Elder,UT,American White Pelican,GSL,012502918,5/25/2010,00:00.0,2010,5,25,Neill/Bartosz,NULL,NULL,Box Elder,UT,American White Pelican,GSL,012502919,5/25/2010,00:00.0,2010,5,25,Neill/Bartosz,NULL,NULL,Box Elder,UT,California Gull,GSL,005302920,6/16/2010,00:00.0,2010,6,16,Neill et al.,NULL,NULL,Box Elder,UT,California Gull,GSL,005302921,6/17/2010,00:00.0,2010,6,17,Neill/Stone/Brown,NULL,NULL,Box Elder,UT,Great Blue Heron,GSL,019402922,5/24/2010,00:00.0,2010,5,24,Parker/Frokjer,NULL,NULL,Sanpete,UT,California Gull,NULL,005302923,5/25/2010,00:00.0,2010,5,25,Neill/Bartosz,NULL,NULL,Box Elder,UT,California Gull,GSL,005302924,6/22/2010,00:00.0,2010,6,22,Neill/Mathis,NULL,NULL,Box Elder,UT,Black-crowned Night-Heron,GSL,020202925,6/22/2010,00:00.0,2010,6,22,Neill/Mathis,NULL,NULL,Box Elder,UT,California Gull,GSL,005302926,6/10/2010,00:00.0,2010,6,10,Parker/Frokjer,NULL,NULL,Sevier,UT,Eared Grebe,NULL,000402927,6/10/2010,00:00.0,2010,6,10,Parker/Frokjer,NULL,NULL,Sevier,UT,Western Grebe,NULL,000102928,6/4/2009,00:00.0,2009,6,4,Neville/Johnson,NULL,NULL,Salt Lake,UT,Great Blue Heron,NULL,019402929,5/26/2010,00:00.0,2010,5,26,Parker/Frokjer,NULL,NULL,Kane,UT,Great Blue Heron,NULL,019402930,5/26/2010,00:00.0,2010,5,26,Parker/Frokjer,NULL,NULL,Kane,UT,Western Grebe,NULL,000102931,6/5/2009,00:00.0,2009,6,5,Parker/Frokjer,NULL,NULL,Salt Lake,UT,California Gull,NULL,005302932,6/8/2009,00:00.0,2009,6,8,Parker/Frokjer,NULL,NULL,Box Elder,UT,Western Grebe,NULL,000102933,7/7/2010,00:00.0,2010,7,7,Paul,NULL,NULL,Box Elder,UT,Western Grebe,NULL,000102934,6/12/2009,00:00.0,2009,6,12,Bradley,NULL,NULL,Uintah,UT,Eared Grebe,NULL,000402935,6/12/2009,00:00.0,2009,6,12,Bradley,NULL,NULL,Uintah,UT,Western Grebe,NULL,000102936,5/19/2010,00:00.0,2010,5,19,Parker/Frokjer,NULL,NULL,Beaver,UT,Eared Grebe,NULL,000402937,5/19/2010,00:00.0,2010,5,19,Parker/Frokjer,NULL,NULL,Beaver,UT,Western Grebe,NULL,000102938,5/19/2010,00:00.0,2010,5,19,Parker/Frokjer,NULL,NULL,Beaver,UT,Eared Grebe,NULL,000402939,5/19/2010,00:00.0,2010,5,19,Parker/Frokjer,NULL,NULL,Beaver,UT,Western Grebe,NULL,000102940,6/23/2009,00:00.0,2009,6,23,Parker/Frokjer,NULL,NULL,Juab,UT,Double-crested Cormorant,NULL,012002941,6/23/2009,00:00.0,2009,6,23,Parker/Frokjer,NULL,NULL,Juab,UT,Great Blue Heron,NULL,019402942,6/23/2009,00:00.0,2009,6,23,Parker/Frokjer,NULL,NULL,Carbon,UT,California Gull,NULL,005302943,6/2/2010,00:00.0,2010,6,2,Paul/Neill,NULL,NULL,Rich,UT,American White Pelican,NULL,012502944,6/2/2010,00:00.0,2010,6,2,Paul/Neill,NULL,NULL,Rich,UT,California Gull,NULL,005302945,6/2/2010,00:00.0,2010,6,2,Paul/Neill,NULL,NULL,Rich,UT,Caspian Tern,NULL,006402946,6/2/2010,00:00.0,2010,6,2,Paul/Neill,NULL,NULL,Rich,UT,Double-crested Cormorant,NULL,012002947,6/2/2010,00:00.0,2010,6,2,Paul/Neill,NULL,NULL,Rich,UT,Ring-billed Gull,NULL,005402948,6/2/2010,00:00.0,2010,6,2,Paul/Neill,NULL,NULL,Rich,UT,NULL,"Multiple species: Snowy Egret, Cattle Egret, and Black-crowned Night-Heron",NULL2949,6/23/2011,00:00.0,2011,6,23,Paul/Neill,NULL,NULL,Rich,UT,American White Pelican,NULL,012502950,6/23/2011,00:00.0,2011,6,23,Paul/Neill,NULL,NULL,Rich,UT,California Gull,NULL,005302951,6/23/2011,00:00.0,2011,6,23,Paul/Neill,NULL,NULL,Rich,UT,Double-crested Cormorant,NULL,012002952,6/23/2011,00:00.0,2011,6,23,Paul/Neill,NULL,NULL,Rich,UT,Ring-billed Gull,NULL,005402953,6/23/2011,00:00.0,2011,6,23,Paul/Neill,NULL,NULL,Rich,UT,NULL,"Multiple species: Snowy Egret, Cattle Egret, and Black-crowned Night-Heron",NULL2954,7/28/2009,00:00.0,2009,7,28,Neill et al.,NULL,NULL,Salt Lake,UT,Great Blue Heron,GSL,019402955,6/22/2009,00:00.0,2009,6,22,Parker/Frokjer,NULL,NULL,Sanpete,UT,Clark's Grebe,NULL,000112956,6/22/2009,00:00.0,2009,6,22,Parker/Frokjer,NULL,NULL,Sanpete,UT,Western Grebe,NULL,000102957,6/8/2009,00:00.0,2009,6,8,Neill,NULL,NULL,Salt Lake,UT,California Gull,NULL,005302958,6/8/2009,00:00.0,2009,6,8,Neill,NULL,NULL,Salt Lake,UT,California Gull,NULL,005302959,6/8/2009,00:00.0,2009,6,8,Neill,NULL,NULL,Salt Lake,UT,California Gull,NULL,005302960,6/8/2009,00:00.0,2009,6,8,Neill,NULL,NULL,Salt Lake,UT,Double-crested Cormorant,NULL,012002961,6/8/2009,00:00.0,2009,6,8,Neill,NULL,NULL,Salt Lake,UT,California Gull,NULL,005302962,6/8/2009,00:00.0,2009,6,8,Neill,NULL,NULL,Salt Lake,UT,Double-crested Cormorant,NULL,012002963,6/8/2009,00:00.0,2009,6,8,Neill,NULL,NULL,Salt Lake,UT,California Gull,NULL,005302964,6/8/2009,00:00.0,2009,6,8,Neill,NULL,NULL,Salt Lake,UT,California Gull,NULL,005302965,6/8/2009,00:00.0,2009,6,8,Neill,NULL,NULL,Salt Lake,UT,Caspian Tern,NULL,006402966,6/17/2009,00:00.0,2009,6,17,Neill/Dalton,NULL,NULL,Weber,UT,Snowy Egret,GSL,019702967,6/17/2009,00:00.0,2009,6,17,Neill/Mathis,NULL,NULL,Weber,UT,Snowy Egret,GSL,019702968,6/17/2009,00:00.0,2009,6,17,Neill/Dalton,NULL,NULL,Weber,UT,White-faced Ibis,GSL,018702969,6/17/2009,00:00.0,2009,6,17,Neill/Mathis,NULL,NULL,Weber,UT,White-faced Ibis,GSL,018702970,6/18/2009,00:00.0,2009,6,18,Neill/Mathis,NULL,NULL,Weber,UT,Snowy Egret,GSL,019702971,6/18/2009,00:00.0,2009,6,18,Neill/Mathis,NULL,NULL,Weber,UT,White-faced Ibis,GSL,018702972,6/18/2009,00:00.0,2009,6,18,Bankhead,NULL,NULL,Weber,UT,Forster's Tern,GSL,006902973,6/18/2009,00:00.0,2009,6,18,Bankhead,NULL,NULL,Weber,UT,Forster's Tern,GSL,006902974,6/18/2009,00:00.0,2009,6,18,Bankhead,NULL,NULL,Weber,UT,Forster's Tern,GSL,006902975,6/18/2009,00:00.0,2009,6,18,Dalton,NULL,NULL,Weber,UT,Franklin's Gull,GSL,005902976,6/18/2009,00:00.0,2009,6,18,Neill,NULL,NULL,Weber,UT,Western Grebe,GSL,000102977,6/18/2009,00:00.0,2009,6,18,Neill,NULL,NULL,Weber,UT,White-faced Ibis,GSL,018702978,6/18/2009,00:00.0,2009,6,18,Neill,NULL,NULL,Weber,UT,Black-crowned Night-Heron,GSL,020202979,6/18/2009,00:00.0,2009,6,18,Neill,NULL,NULL,Weber,UT,Snowy Egret,GSL,019702980,6/18/2009,00:00.0,2009,6,18,Neill,NULL,NULL,Weber,UT,White-faced Ibis,GSL,018702981,6/17/2009,00:00.0,2009,6,17,Neill/Dalton,NULL,NULL,Salt Lake,UT,Forster's Tern,GSL,006902982,6/17/2009,00:00.0,2009,6,17,Neill/Mathis,NULL,NULL,Weber,UT,Snowy Egret,GSL,019702983,6/17/2009,00:00.0,2009,6,17,Neill/Mathis,NULL,NULL,Weber,UT,White-faced Ibis,GSL,018702984,6/17/2009,00:00.0,2009,6,17,Neill/Dalton,NULL,NULL,Weber,UT,White-faced Ibis,GSL,018702985,6/18/2009,00:00.0,2009,6,18,Neill,NULL,NULL,Weber,UT,Black-crowned Night-Heron,GSL,020202986,6/18/2009,00:00.0,2009,6,18,Neill/Dalton,NULL,NULL,Salt Lake,UT,Franklin's Gull,GSL,005902987,6/18/2009,00:00.0,2009,6,18,Neill/Dalton,NULL,NULL,Weber,UT,Franklin's Gull,GSL,005902988,6/18/2009,00:00.0,2009,6,18,Bankhead,NULL,NULL,Weber,UT,Great Blue Heron,GSL,019402989,6/18/2009,00:00.0,2009,6,18,Bankhead,NULL,NULL,Weber,UT,Snowy Egret,GSL,019702990,6/18/2009,00:00.0,2009,6,18,Neill,NULL,NULL,Weber,UT,White-faced Ibis,GSL,018702991,NULL,,2009,6,NULL,Bankhead,NULL,NULL,Weber,UT,Forster's Tern,GSL ; SuveryDate: 6/18/-6/17/2009,006902992,8/5/2009,00:00.0,2009,8,5,Neill,NULL,NULL,Weber,UT,Eared Grebe,GSL,000402993,6/25/2009,00:00.0,2009,6,25,Penttila,NULL,NULL,Uintah,UT,Great Blue Heron,NULL,019402994,5/20/2009,00:00.0,2009,5,20,Penttila,NULL,NULL,Uintah,UT,Double-crested Cormorant,NULL,012002995,6/4/2009,00:00.0,2009,6,4,Penttila,NULL,NULL,Uintah,UT,Eared Grebe,NULL,000402996,4/22/2009,00:00.0,2009,4,22,Penttila,NULL,NULL,Uintah,UT,Great Blue Heron,NULL,019402997,6/4/2009,00:00.0,2009,6,4,Penttila,NULL,NULL,Uintah,UT,Double-crested Cormorant,NULL,012002998,4/22/2009,00:00.0,2009,4,22,Penttila,NULL,NULL,Uintah,UT,Great Blue Heron,NULL,019402999,5/6/2009,00:00.0,2009,5,6,Penttila,NULL,NULL,Uintah,UT,Double-crested Cormorant,NULL,012003000,6/16/2009,00:00.0,2009,6,16,Parker/Frokjer,NULL,NULL,Uintah,UT,Great Blue Heron,NULL,019403001,6/16/2009,00:00.0,2009,6,16,Parker/Frokjer,NULL,NULL,Uintah,UT,Great Egret,NULL,019603002,6/16/2009,00:00.0,2009,6,16,Parker/Frokjer,NULL,NULL,Uintah,UT,Double-crested Cormorant,NULL,012003003,6/16/2009,00:00.0,2009,6,16,Parker/Frokjer,NULL,NULL,Uintah,UT,Great Blue Heron,NULL,019403004,6/16/2009,00:00.0,2009,6,16,Parker/Frokjer,NULL,NULL,Uintah,UT,Western Grebe,NULL,000103005,6/16/2009,00:00.0,2009,6,16,Parker/Frokjer,NULL,NULL,Uintah,UT,Eared Grebe,NULL,000403006,6/16/2009,00:00.0,2009,6,16,Parker/Frokjer,NULL,NULL,Uintah,UT,Western Grebe,NULL,000103007,4/30/2009,00:00.0,2009,4,30,Parker,NULL,NULL,Weber,UT,Great Blue Heron,NULL,019403008,6/24/2009,00:00.0,2009,6,24,Parker/Frokjer,NULL,NULL,Weber,UT,Western Grebe,NULL,000101881,5/4/2011,00:00.0,2011,5,4,Doney,NULL,NULL,Madison,MT,Great Blue Heron,NULL,019401882,6/20/2010,00:00.0,2010,6,20,Tilly,NULL,NULL,Sheridan,MT,Forster's Tern,NULL,006901883,6/19/2011,00:00.0,2011,6,19,Tilly,NULL,NULL,Sheridan,MT,Common Tern,NULL,007001884,6/19/2011,00:00.0,2011,6,19,Tilly,NULL,NULL,Sheridan,MT,Ring-billed Gull,NULL,005401885,6/23/2010,00:00.0,2010,6,23,Doney,NULL,NULL,Gallatin,MT,Great Blue Heron,NULL,019401886,6/17/2011,00:00.0,2011,6,17,Wightman/Litchtenberg,NULL,NULL,Lake,MT,Common Tern,NULL,007001887,6/10/2010,00:00.0,2010,6,10,Stutzman,NULL,NULL,Flathead,MT,Great Blue Heron,NULL,019401888,6/21/2009,00:00.0,2009,6,21,Paige/Kelly,NULL,NULL,Powell,MT,Black Tern,NULL,007701889,7/18/2010,00:00.0,2010,7,18,Doney,NULL,NULL,Powell,MT,Black Tern,NULL,007701890,7/18/2010,00:00.0,2010,7,18,Doney,NULL,NULL,Powell,MT,Eared Grebe,NULL,000401891,7/18/2010,00:00.0,2010,7,18,Doney,NULL,NULL,Powell,MT,Western Grebe,NULL,000101892,5/12/2011,00:00.0,2011,5,12,Hammond/Cascaddan,NULL,NULL,Lincoln,MT,Great Blue Heron,NULL,019401893,5/12/2011,00:00.0,2011,5,12,Hammond/Cascaddan,NULL,NULL,Lincoln,MT,Great Blue Heron,NULL,019401894,6/16/2009,00:00.0,2009,6,16,Tilly,NULL,NULL,Phillips,MT,Eared Grebe,NULL,000401895,6/16/2009,00:00.0,2009,6,16,Tilly,NULL,NULL,Phillips,MT,Forster's Tern,NULL,006901896,6/16/2009,00:00.0,2009,6,16,Tilly,NULL,NULL,Phillips,MT,Franklin's Gull,NULL,005901897,NULL,,2011,6,0,Tilly et al.,NULL,NULL,Phillips,MT,Eared Grebe,NULL,000401898,NULL,,2011,6,0,Tilly,NULL,NULL,Phillips,MT,Forster's Tern,NULL,006901899,NULL,,2011,6,0,Tilly et al.,NULL,NULL,Phillips,MT,Franklin's Gull,NULL,005901900,6/9/2009,00:00.0,2009,6,9,Tribby et al.,NULL,NULL,Phillips,MT,American White Pelican,NULL,012501901,6/9/2009,00:00.0,2009,6,9,Tribby et al.,NULL,NULL,Phillips,MT,California Gull,NULL,005301902,6/9/2009,00:00.0,2009,6,9,Tribby et al.,NULL,NULL,Phillips,MT,Double-crested Cormorant,NULL,012001903,6/9/2009,00:00.0,2009,6,9,Tribby et al.,NULL,NULL,Phillips,MT,Ring-billed Gull,NULL,005401904,6/15/2010,00:00.0,2010,6,15,McWilliams/Score,NULL,NULL,Phillips,MT,American White Pelican,NULL,012501905,6/15/2010,00:00.0,2010,6,15,McWilliams/Score,NULL,NULL,Phillips,MT,Ring-billed Gull,NULL,005401906,6/14/2011,00:00.0,2011,6,14,Tilly et al.,NULL,NULL,Phillips,MT,American White Pelican,NULL,012501907,6/14/2011,00:00.0,2011,6,14,Tilly et al.,NULL,NULL,Phillips,MT,California Gull,NULL,005301908,6/14/2011,00:00.0,2011,6,14,Tilly et al.,NULL,NULL,Phillips,MT,Double-crested Cormorant,NULL,012001909,6/14/2011,00:00.0,2011,6,14,Tilly et al.,NULL,NULL,Phillips,MT,Great Blue Heron,NULL,019401910,6/14/2011,00:00.0,2011,6,14,Tilly et al.,NULL,NULL,Phillips,MT,Ring-billed Gull,NULL,005401911,6/16/2009,00:00.0,2009,6,16,Tilly,NULL,NULL,Phillips,MT,Black-crowned Night-Heron,NULL,020201912,6/16/2009,00:00.0,2009,6,16,Tilly,NULL,NULL,Phillips,MT,Franklin's Gull,NULL,005901913,6/16/2009,00:00.0,2009,6,16,Tilly,NULL,NULL,Phillips,MT,White-faced Ibis,NULL,018701914,6/16/2010,00:00.0,2010,6,16,Tilly,NULL,NULL,Phillips,MT,Black-crowned Night-Heron,NULL,020201915,6/16/2010,00:00.0,2010,6,16,Tilly,NULL,NULL,Phillips,MT,Eared Grebe,NULL,000401916,6/16/2010,00:00.0,2010,6,16,Tilly,NULL,NULL,Phillips,MT,Franklin's Gull,NULL,005901917,6/16/2010,00:00.0,2010,6,16,Tilly,NULL,NULL,Phillips,MT,White-faced Ibis,NULL,018701918,7/23/2010,00:00.0,2010,7,23,Tilly,NULL,NULL,Phillips,MT,Western Grebe,NULL,000101919,6/15/2011,00:00.0,2011,6,15,Tilly,NULL,NULL,Phillips,MT,Black-crowned Night-Heron,NULL,020201920,6/15/2011,00:00.0,2011,6,15,Tilly,NULL,NULL,Phillips,MT,Forster's Tern,NULL,006901921,6/15/2011,00:00.0,2011,6,15,Tilly,NULL,NULL,Phillips,MT,White-faced Ibis,NULL,018701922,NULL,,2011,6,0,Tilly et al.,NULL,NULL,Phillips,MT,Eared Grebe,NULL,000401923,NULL,,2011,6,0,Tilly et al.,NULL,NULL,Phillips,MT,Franklin's Gull,NULL,005901924,6/15/2009,00:00.0,2009,6,15,Tilly,NULL,NULL,Phillips,MT,Black-crowned Night-Heron,NULL,020201925,6/15/2009,00:00.0,2009,6,15,Tilly,NULL,NULL,Phillips,MT,Franklin's Gull,NULL,005901926,6/15/2009,00:00.0,2009,6,15,Tilly,NULL,NULL,Phillips,MT,White-faced Ibis,NULL,018701927,6/15/2010,00:00.0,2010,6,15,Tilly,NULL,NULL,Phillips,MT,Black-crowned Night-Heron,NULL,020201928,6/15/2010,00:00.0,2010,6,15,Tilly,NULL,NULL,Phillips,MT,Eared Grebe,NULL,000401929,6/15/2010,00:00.0,2010,6,15,Tilly,NULL,NULL,Phillips,MT,Franklin's Gull,NULL,005901930,6/15/2010,00:00.0,2010,6,15,Tilly,NULL,NULL,Phillips,MT,White-faced Ibis,NULL,018701931,NULL,,2011,6,0,Tilly et al.,NULL,NULL,Phillips,MT,Eared Grebe,NULL,000401932,NULL,,2011,6,0,Tilly et al.,NULL,NULL,Phillips,MT,Franklin's Gull,NULL,005901933,6/9/2009,00:00.0,2009,6,9,Tribby et al.,NULL,NULL,Phillips,MT,California Gull,NULL,005301934,6/15/2011,00:00.0,2011,6,15,Tilly,NULL,NULL,Phillips,MT,Caspian Tern,NULL,006401935,6/15/2011,00:00.0,2011,6,15,Tilly,NULL,NULL,Phillips,MT,Ring-billed or California Gull,NULL,NULL1936,6/9/2009,00:00.0,2009,6,9,Tribby et al.,NULL,NULL,Phillips,MT,American White Pelican,NULL,012501937,6/9/2009,00:00.0,2009,6,9,Tribby et al.,NULL,NULL,Phillips,MT,California Gull,NULL,005301938,6/9/2009,00:00.0,2009,6,9,Tribby et al.,NULL,NULL,Phillips,MT,Double-crested Cormorant,NULL,012001939,6/9/2009,00:00.0,2009,6,9,Tribby et al.,NULL,NULL,Phillips,MT,Great Blue Heron,NULL,019401940,6/15/2010,00:00.0,2010,6,15,McWilliams/Score,NULL,NULL,Phillips,MT,California Gull,NULL,005301941,6/15/2010,00:00.0,2010,6,15,McWilliams/Score,NULL,NULL,Phillips,MT,Double-crested Cormorant,NULL,012001942,6/15/2010,00:00.0,2010,6,15,McWilliams/Score,NULL,NULL,Phillips,MT,Great Blue Heron,NULL,019401943,6/9/2009,00:00.0,2009,6,9,Tribby et al.,NULL,NULL,Phillips,MT,Great Blue Heron,NULL,019401944,6/9/2009,00:00.0,2009,6,9,Tribby et al.,NULL,NULL,Phillips,MT,Ring-billed Gull,NULL,005401945,6/15/2010,00:00.0,2010,6,15,McWilliams/Score,NULL,NULL,Phillips,MT,Caspian Tern,NULL,006401946,6/15/2010,00:00.0,2010,6,15,McWilliams/Score,NULL,NULL,Phillips,MT,Common Tern,NULL,007001947,6/21/2009,00:00.0,2009,6,21,DuBois,NULL,NULL,Missoula,MT,Great Blue Heron,NULL,019401948,5/20/2011,00:00.0,2011,5,20,DuBois/Throop,NULL,NULL,Missoula,MT,Great Blue Heron,NULL,019401949,6/3/2009,00:00.0,2009,6,3,Paige/Goslin,NULL,NULL,Ravalli,MT,Double-crested Cormorant,NULL,012001950,6/3/2009,00:00.0,2009,6,3,Paige/Goslin,NULL,NULL,Ravalli,MT,Great Blue Heron,NULL,019401951,5/11/2011,00:00.0,2011,5,11,DuBois/Mamutich,NULL,NULL,Ravalli,MT,Great Blue Heron,NULL,019401952,4/22/2009,00:00.0,2009,4,22,DuBois,NULL,NULL,Powell,MT,Great Blue Heron,NULL,019401953,4/16/2011,00:00.0,2011,4,16,DuBois,NULL,NULL,Powell,MT,Great Blue Heron,NULL,019401954,6/30/2009,00:00.0,2009,6,30,DuBois,NULL,NULL,Powell,MT,Great Blue Heron,NULL,019401955,5/22/2011,00:00.0,2011,5,22,DuBois/Throop,NULL,NULL,Powell,MT,Great Blue Heron,NULL,019401956,NULL,,2010,NULL,NULL,Waltee,NULL,NULL,Carter,MT,Great Blue Heron,NULL,019401957,NULL,,2010,NULL,NULL,Waltee,NULL,NULL,Carter,MT,Great Blue Heron,NULL,019401958,NULL,,2010,NULL,NULL,Waltee,NULL,NULL,Carter,MT,Great Blue Heron,NULL,019401959,4/24/2010,00:00.0,2010,4,24,Waltee,NULL,NULL,Powder River,MT,Great Blue Heron,NULL,019401960,6/20/2010,00:00.0,2010,6,20,Tilly,NULL,NULL,Sheridan,MT,Eared Grebe,NULL,000401961,NULL,,2009,4,25,Waltee,NULL,NULL,Custer,MT,Great Blue Heron,NULL,019401962,NULL,,2009,4,25,Waltee,NULL,NULL,Dawson,MT,Great Blue Heron,NULL,019401963,NULL,,2009,4,25,Waltee,NULL,NULL,Richland,MT,Great Blue Heron,NULL,019401964,NULL,,2009,4,24,Waltee,NULL,NULL,Rosebud,MT,Great Blue Heron,NULL,019401965,NULL,,2009,4,24,Waltee,NULL,NULL,Rosebud,MT,Great Blue Heron,NULL,019401,5/21/2013,00:00.0,2013,5,21,"Davis, Allen",39.3977,-74.4708,Atlantic,NJ,LAGU,NULL,005802,5/21/2013,00:00.0,2013,5,21,"Davis, Allen",39.4003,-74.4673,Atlantic,NJ,LAGU,NULL,005803,6/14/2013,00:00.0,2013,6,14,"Davis, Allen",39.399,-74.4574,Atlantic,NJ,COTE,NULL,007004,5/21/2013,00:00.0,2013,5,21,"Davis, Allen",39.399,-74.4574,Atlantic,NJ,FOTE,NULL,006905,5/21/2013,00:00.0,2013,5,21,"Davis, Allen",39.399,-74.4574,Atlantic,NJ,LAGU,NULL,005806,5/21/2013,00:00.0,2013,5,21,"Davis, Allen",39.3661,-74.5163,Atlantic,NJ,FOTE,NULL,006907,5/21/2013,00:00.0,2013,5,21,"Davis, Allen",39.3655,-74.5122,Atlantic,NJ,FOTE,NULL,006908,5/21/2013,00:00.0,2013,5,21,"Davis, Allen",39.3655,-74.5122,Atlantic,NJ,GBBG,NULL,004709,5/21/2013,00:00.0,2013,5,21,"Davis, Allen",39.3655,-74.5122,Atlantic,NJ,HERG,NULL,0051010,5/21/2013,00:00.0,2013,5,21,"Davis, Allen",39.3655,-74.5122,Atlantic,NJ,LAGU,NULL,0058011,5/21/2013,00:00.0,2013,5,21,"Davis, Allen",39.3661,-74.5163,Atlantic,NJ,GBBG,NULL,0047012,5/21/2013,00:00.0,2013,5,21,"Davis, Allen",39.3661,-74.5163,Atlantic,NJ,LAGU,NULL,0058013,5/22/2013,00:00.0,2013,5,22,"Davis, Allen",39.0132,-74.8037,Cape May,NJ,FOTE,NULL,0069014,5/22/2013,00:00.0,2013,5,22,"Davis, Allen",39.0132,-74.8037,Cape May,NJ,LAGU,NULL,0058015,5/29/2013,00:00.0,2013,5,29,Gensler,39.079,-74.7323,Cape May,NJ,LETE,NULL,0074016,5/23/2013,00:00.0,2013,5,23,"Davis, Allen",39.0944,-74.7285,Cape May,NJ,YCNH,NULL,0203017,5/22/2013,00:00.0,2013,5,22,"Davis, Allen",39.1108,-74.7303,Cape May,NJ,COTE,NULL,0070018,5/20/2013,00:00.0,2013,5,20,"Davis, Allen",39.7773,-74.1122,Ocean,NJ,GLIB,NULL,0186019,5/20/2013,00:00.0,2013,5,20,"Davis, Allen",39.7773,-74.1122,Ocean,NJ,GREG,NULL,0196020,5/20/2013,00:00.0,2013,5,20,"Davis, Allen",39.5574,-74.2749,Ocean,NJ,BCNH,NULL,0202021,5/20/2013,00:00.0,2013,5,20,"Davis, Allen",39.5574,-74.2749,Ocean,NJ,GBBG,NULL,0047022,5/20/2013,00:00.0,2013,5,20,"Davis, Allen",39.5574,-74.2749,Ocean,NJ,GLIB,NULL,0186023,5/20/2013,00:00.0,2013,5,20,"Davis, Allen",39.5574,-74.2749,Ocean,NJ,GREG,NULL,0196024,5/20/2013,00:00.0,2013,5,20,"Davis, Allen",39.5574,-74.2749,Ocean,NJ,HERG,NULL,0051025,5/20/2013,00:00.0,2013,5,20,"Davis, Allen",39.5574,-74.2749,Ocean,NJ,LBHE,NULL,0200026,5/20/2013,00:00.0,2013,5,20,"Davis, Allen",39.5574,-74.2749,Ocean,NJ,SNEG,NULL,0197027,5/20/2013,00:00.0,2013,5,20,"Davis, Allen",39.5574,-74.2749,Ocean,NJ,TRHE,NULL,0199028,5/20/2013,00:00.0,2013,5,20,"Davis, Allen",39.5574,-74.2749,Ocean,NJ,YCNH,NULL,0203029,5/22/2013,00:00.0,2013,5,22,"Davis, Allen",39.2809,-74.5978,Cape May,NJ,LAGU,NULL,0058030,6/23/2013,00:00.0,2013,6,23,Pritchard,40.1861,-74.0091,Monmouth,NJ,LETE,NULL,0074031,5/21/2013,00:00.0,2013,5,21,"Davis, Allen",39.4386,-74.3701,Atlantic,NJ,FOTE,NULL,0069032,5/21/2013,00:00.0,2013,5,21,"Davis, Allen",39.4386,-74.3701,Atlantic,NJ,LAGU,NULL,0058033,5/20/2013,00:00.0,2013,5,20,"Davis, Allen",39.5456,-74.3674,Ocean,NJ,FOTE,NULL,0069034,5/23/2013,00:00.0,2013,5,23,"Davis, Allen",39.2879,-74.5921,Cape May,NJ,GLIB,NULL,0186035,5/23/2013,00:00.0,2013,5,23,"Davis, Allen",39.2879,-74.5921,Cape May,NJ,GREG,NULL,0196036,5/23/2013,00:00.0,2013,5,23,"Davis, Allen",39.2879,-74.5921,Cape May,NJ,SNEG,NULL,0197037,5/23/2013,00:00.0,2013,5,23,"Davis, Allen",39.2879,-74.5921,Cape May,NJ,TRHE,NULL,0199038,5/22/2013,00:00.0,2013,5,22,"Davis, Allen",39.2874,-74.5927,Cape May,NJ,GBBG,NULL,0047039,5/22/2013,00:00.0,2013,5,22,"Davis, Allen",39.2874,-74.5927,Cape May,NJ,HERG,NULL,0051040,5/22/2013,00:00.0,2013,5,22,"Davis, Allen",39.2873,-74.5998,Cape May,NJ,GBBG,NULL,0047041,5/21/2013,00:00.0,2013,5,21,"Davis, Allen",39.3989,-74.4084,Ocean,NJ,BCNH,NULL,0202042,5/21/2013,00:00.0,2013,5,21,"Davis, Allen",39.3989,-74.4084,Atlantic,NJ,GBBG,NULL,0047043,5/21/2013,00:00.0,2013,5,21,"Davis, Allen",39.3989,-74.4084,Atlantic,NJ,HERG,NULL,0051044,5/21/2013,00:00.0,2013,5,21,"Davis, Allen",39.441,-74.3765,Atlantic,NJ,FOTE,NULL,0069045,5/21/2013,00:00.0,2013,5,21,"Davis, Allen",39.441,-74.3765,Atlantic,NJ,HERG,NULL,0051046,5/21/2013,00:00.0,2013,5,21,"Davis, Allen",39.441,-74.3765,Atlantic,NJ,LAGU,NULL,0058047,5/21/2013,00:00.0,2013,5,21,"Davis, Allen",39.441,-74.3765,Atlantic,NJ,LAGU,NULL,0058048,5/21/2013,00:00.0,2013,5,21,"Davis, Allen",39.334,-74.5589,Atlantic,NJ,HERG,NULL,0051049,5/22/2013,00:00.0,2013,5,22,"Davis, Allen",39.2706,-74.6113,Cape May,NJ,FOTE,NULL,0069050,6/14/2013,00:00.0,2013,6,14,"Davis, Allen",39.5516,-74.2759,Ocean,NJ,FOTE,NULL,0069051,6/14/2013,00:00.0,2013,6,14,"Davis, Allen",39.5509,-74.28,Ocean,NJ,COTE,NULL,0070052,6/14/2013,00:00.0,2013,6,14,"Davis, Allen",39.5509,-74.28,Ocean,NJ,FOTE,NULL,0069053,5/20/2013,00:00.0,2013,5,20,"Davis, Allen",39.5509,-74.28,Ocean,NJ,HERG,NULL,0051054,5/20/2013,00:00.0,2013,5,20,"Davis, Allen",39.5509,-74.28,Ocean,NJ,LAGU,NULL,0058055,7/10/2013,00:00.0,2013,7,10,Wehman,38.9376,-74.8924,Cape May,NJ,LETE,NULL,0074056,6/9/2013,00:00.0,2013,6,9,Wehman,38.9317,-74.9531,Cape May,NJ,BLSK,NULL,0080057,5/24/2013,00:00.0,2013,5,24,Wehman,38.9318,-74.9488,Cape May,NJ,LETE,NULL,0074058,5/21/2013,00:00.0,2013,5,21,"Davis, Allen",39.6855,-74.1672,Ocean,NJ,BCNH,NULL,0202059,5/20/2013,00:00.0,2013,5,20,"Davis, Allen",39.6855,-74.1672,Ocean,NJ,GBBG,NULL,0047060,5/21/2013,00:00.0,2013,5,21,"Davis, Allen",39.6855,-74.1672,Ocean,NJ,GREG,NULL,0196061,5/20/2013,00:00.0,2013,5,20,"Davis, Allen",39.6855,-74.1672,Ocean,NJ,HERG,NULL,0051062,5/21/2013,00:00.0,2013,5,21,"Davis, Allen",39.6855,-74.1672,Ocean,NJ,LBHE,NULL,0200063,5/21/2013,00:00.0,2013,5,21,"Davis, Allen",39.6855,-74.1672,Ocean,NJ,SNEG,NULL,0197064,5/20/2013,00:00.0,2013,5,20,"Davis, Allen",39.6892,-74.17,Ocean,NJ,GBBG,NULL,0047065,5/20/2013,00:00.0,2013,5,20,"Davis, Allen",39.6892,-74.17,Ocean,NJ,HERG,NULL,0051066,6/14/2013,00:00.0,2013,6,14,"Davis, Allen",39.7635,-74.1394,Ocean,NJ,COTE,NULL,0070067,6/14/2013,00:00.0,2013,6,14,"Davis, Allen",39.7635,-74.1394,Ocean,NJ,FOTE,NULL,0069068,5/20/2013,00:00.0,2013,5,20,"Davis, Allen",39.7685,-74.1356,Ocean,NJ,GBBG,NULL,0047069,5/20/2013,00:00.0,2013,5,20,"Davis, Allen",39.7685,-74.1356,Ocean,NJ,HERG,NULL,0051070,5/20/2013,00:00.0,2013,5,20,"Davis, Allen",39.7685,-74.1356,Ocean,NJ,LAGU,NULL,0058071,6/14/2013,00:00.0,2013,6,14,"Davis, Allen",39.7685,-74.1356,Ocean,NJ,COTE,NULL,0070072,5/20/2013,00:00.0,2013,5,20,"Davis, Allen",39.7685,-74.1356,Ocean,NJ,FOTE,NULL,0069073,5/20/2013,00:00.0,2013,5,20,"Davis, Allen",39.7685,-74.1356,Ocean,NJ,GBBG,NULL,0047074,5/20/2013,00:00.0,2013,5,20,"Davis, Allen",39.7685,-74.1356,Ocean,NJ,HERG,NULL,0051075,5/20/2013,00:00.0,2013,5,20,"Davis, Allen",39.7685,-74.1356,Ocean,NJ,LAGU,NULL,0058076,5/20/2013,00:00.0,2013,5,20,"Davis, Allen",39.761,-74.1365,Ocean,NJ,FOTE,NULL,0069077,5/21/2013,00:00.0,2013,5,21,"Davis, Allen",39.3866,-74.4344,Atlantic,NJ,FOTE,NULL,0069078,5/21/2013,00:00.0,2013,5,21,"Davis, Allen",39.3866,-74.4344,Atlantic,NJ,LAGU,NULL,0058079,5/22/2013,00:00.0,2013,5,22,"Davis, Allen",39.1414,-74.73,Cape May,NJ,FOTE,NULL,0069080,5/22/2013,00:00.0,2013,5,22,"Davis, Allen",39.1414,-74.73,Cape May,NJ,LAGU,NULL,0058081,5/21/2013,00:00.0,2013,5,21,"Davis, Allen",39.4288,-74.444,Atlantic,NJ,FOTE,NULL,0069082,5/21/2013,00:00.0,2013,5,21,"Davis, Allen",39.4288,-74.444,Atlantic,NJ,LAGU,NULL,0058083,5/21/2013,00:00.0,2013,5,21,"Davis, Allen",39.4323,-74.4493,Atlantic,NJ,LAGU,NULL,0058084,5/23/2013,00:00.0,2013,5,23,"Davis, Allen",39.2842,-74.5876,Cape May,NJ,BCNH,NULL,0202085,5/23/2013,00:00.0,2013,5,23,"Davis, Allen",39.2842,-74.5876,Cape May,NJ,GLIB,NULL,0186086,5/23/2013,00:00.0,2013,5,23,"Davis, Allen",39.2842,-74.5876,Cape May,NJ,GREG,NULL,0196087,5/23/2013,00:00.0,2013,5,23,"Davis, Allen",39.2842,-74.5876,Cape May,NJ,LBHE,NULL,0200088,5/23/2013,00:00.0,2013,5,23,"Davis, Allen",39.2842,-74.5876,Cape May,NJ,SNEG,NULL,0197089,5/23/2013,00:00.0,2013,5,23,"Davis, Allen",39.2842,-74.5876,Cape May,NJ,TRHE,NULL,0199090,5/23/2013,00:00.0,2013,5,23,"Davis, Allen",39.2842,-74.5876,Cape May,NJ,YCNH,NULL,0203091,5/22/2013,00:00.0,2013,5,22,"Davis, Allen",39.2842,-74.5876,Cape May,NJ,GBBG,NULL,0047092,5/22/2013,00:00.0,2013,5,22,"Davis, Allen",39.2842,-74.5876,Cape May,NJ,HERG,NULL,0051093,5/22/2013,00:00.0,2013,5,22,"Davis, Allen",39.0358,-74.8025,Cape May,NJ,LAGU,NULL,0058094,5/22/2014,00:00.0,2013,5,21,"Davis, Allen",39.2248,-74.6591,Cape May,NJ,FOTE,NULL,0069095,5/22/2013,00:00.0,2013,5,22,"Davis, Allen",39.2187,-74.6581,Cape May,NJ,FOTE,NULL,0069096,5/21/2013,00:00.0,2013,5,21,"Davis, Allen",39.3232,-74.5281,Atlantic,NJ,BCNH,NULL,0202097,5/21/2013,00:00.0,2013,5,21,"Davis, Allen",39.3232,-74.5281,Atlantic,NJ,GREG,NULL,0196098,5/21/2013,00:00.0,2013,5,21,"Davis, Allen",39.3232,-74.5281,Atlantic,NJ,SNEG,NULL,0197099,5/21/2013,00:00.0,2013,5,21,"Davis, Allen",39.403,-74.4106,Atlantic,NJ,COTE,NULL,00700100,6/14/2013,00:00.0,2013,6,14,"Davis, Allen",39.403,-74.4106,Atlantic,NJ,FOTE,NULL,00690101,6/14/2013,00:00.0,2013,6,14,"Davis, Allen",39.403,-74.4106,Atlantic,NJ,GBTE,NULL,00630102,5/21/2013,00:00.0,2013,5,21,"Davis, Allen",39.403,-74.4106,Ocean,NJ,GREG,NULL,01960103,5/21/2013,00:00.0,2013,5,21,"Davis, Allen",39.403,-74.4106,Ocean,NJ,SNEG,NULL,01970104,5/21/2013,00:00.0,2013,5,21,"Davis, Allen",39.403,-74.4106,Atlantic,NJ,GBBG,NULL,00470105,5/21/2013,00:00.0,2013,5,21,"Davis, Allen",39.403,-74.4106,Atlantic,NJ,HERG,NULL,00510106,5/21/2013,00:00.0,2013,5,21,"Davis, Allen",39.403,-74.4106,Atlantic,NJ,LAGU,NULL,00580107,5/21/2013,00:00.0,2013,5,21,"Davis, Allen",39.4311,-74.4368,Atlantic,NJ,FOTE,NULL,00690108,5/21/2013,00:00.0,2013,5,21,"Davis, Allen",39.4311,-74.4368,Atlantic,NJ,HERG,NULL,00510109,5/21/2013,00:00.0,2013,5,21,"Davis, Allen",39.4311,-74.4368,Atlantic,NJ,LAGU,NULL,00580110,5/21/2013,00:00.0,2013,5,21,"Davis, Allen",39.4256,-74.4362,Atlantic,NJ,LAGU,NULL,00580111,5/21/2013,00:00.0,2013,5,21,"Davis, Allen",39.4307,-74.4399,Atlantic,NJ,FOTE,NULL,00690205,5/28/2013,00:00.0,2013,5,28,"Chalfant, Jordan",43.7523,-69.8907,Cumberland,ME,GBBG,GBBG Corecction factor = 1.004; HEGU correction factor = 0.9882.Location comm:,00470206,5/28/2013,00:00.0,2013,5,28,"Chalfant, Jordan",43.7523,-69.8907,Cumberland,ME,HERG,GBBG Corecction factor = 1.004; HEGU correction factor = 0.9882. 52 GBHE/CAGO/OtherLocation comm:,00510207,5/28/2013,00:00.0,2013,5,28,"Chalfant, Jordan",43.7523,-69.8907,Cumberland,ME,DCCO,GBBG Corecction factor = 1.004; HEGU correction factor = 0.9882. 52 GBHE/CAGO/OtherLocation comm:,01200208,5/30/2013,00:00.0,2013,5,30,"Langlois, Michael",44.3169,-68.9322,Waldo,ME,GBBG,GBBG correction factor = 1.004; HEGU correction factor = 0.9882.Location comm:,00470209,5/30/2013,00:00.0,2013,5,30,"Langlois, Michael",44.3169,-68.9322,Waldo,ME,HERG,GBBG correction factor = 1.004; HEGU correction factor = 0.9882.Location comm:,00510210,5/30/2013,00:00.0,2013,5,30,"Langlois, Michael",44.3169,-68.9322,Waldo,ME,DCCO,GBBG correction factor = 1.004; HEGU correction factor = 0.9882.Location comm:,01200211,5/31/2013,00:00.0,2013,5,31,"Chalfant, Jordan",44.4597,-67.7067,Washington,ME,GBBG,GBBG correction factor = 1.004; HEGU correction factor = 0.9882.  28 CAGO.Location comm:,00470212,5/31/2013,00:00.0,2013,5,31,"Chalfant, Jordan",44.4597,-67.7067,Washington,ME,HERG,GBBG correction factor = 1.004; HEGU correction factor = 0.9882.  28 CAGO.Location comm:,00510213,5/31/2013,00:00.0,2013,5,31,"Chalfant, Jordan",44.4597,-67.7067,Washington,ME,DCCO,GBBG correction factor = 1.004; HEGU correction factor = 0.9882.  28 CAGO.Location comm:,01200214,5/31/2013,00:00.0,2013,5,31,"Chalfant, Jordan",44.4597,-67.7067,Washington,ME,CANG,GBBG correction factor = 1.004; HEGU correction factor = 0.9882.  28 CAGO.Location comm:,01720215,5/30/2013,00:00.0,2013,5,30,"Mittelhauser, Glen",44.1017,-68.5702,Knox,ME,GBBG,GBBG correction factor = 1.004; HEGU correction factor = 0.9882.Location comm:,00470216,5/30/2013,00:00.0,2013,5,30,"Mittelhauser, Glen",44.1017,-68.5702,Knox,ME,HERG,GBBG correction factor = 1.004; HEGU correction factor = 0.9882.Location comm:,00510217,5/30/2013,00:00.0,2013,5,30,"Mittelhauser, Glen",44.1017,-68.5702,Knox,ME,DCCO,GBBG correction factor = 1.004; HEGU correction factor = 0.9882.Location comm:,01200218,5/31/2013,00:00.0,2013,5,31,"Chalfant, Jordan",43.3558,-70.4288,York,ME,GBBG,GBBG correction factor = 1.004; HEGU correction factor = 0.9882.Location comm:,00470219,5/31/2013,00:00.0,2013,5,31,"Chalfant, Jordan",43.3558,-70.4288,York,ME,HERG,GBBG correction factor = 1.004; HEGU correction factor = 0.9882.Location comm:,00510220,5/31/2013,00:00.0,2013,5,31,"Chalfant, Jordan",43.3558,-70.4288,York,ME,DCCO,GBBG correction factor = 1.004; HEGU correction factor = 0.9882.Location comm:,01200221,5/30/2013,00:00.0,2013,5,30,"Mittelhauser, Glen",44.5866,-67.3953,Washington,ME,GBBG,GBBG correction factor = 1.004; HEGU correction factor = 0.9882.  23 individual CAGO.Location comm:,00470222,5/30/2013,00:00.0,2013,5,30,"Mittelhauser, Glen",44.5866,-67.3953,Washington,ME,HERG,GBBG correction factor = 1.004; HEGU correction factor = 0.9882.  23 individual CAGO.Location comm:,00510223,5/30/2013,00:00.0,2013,5,30,"Mittelhauser, Glen",44.5866,-67.3953,Washington,ME,DCCO,GBBG correction factor = 1.004; HEGU correction factor = 0.9882.  23 individual CAGO.Location comm:,01200224,5/30/2013,00:00.0,2013,5,30,"Mittelhauser, Glen",44.5866,-67.3953,Washington,ME,CANG,GBBG correction factor = 1.004; HEGU correction factor = 0.9882.  23 individual CAGO.Location comm:,01720225,5/28/2013,00:00.0,2013,5,28,"Chalfant, Jordan",43.7285,-69.7941,Sagadahoc,ME,GBBG,GBBG correction factor = 1.004; HEGU correction factor = 0.9882. 1 COEI nesting.Location comm:,00470226,5/28/2013,00:00.0,2013,5,28,"Chalfant, Jordan",43.7285,-69.7941,Sagadahoc,ME,HERG,GBBG correction factor = 1.004; HEGU correction factor = 0.9882. 1 COEI nesting.Location comm:,00510227,5/28/2013,00:00.0,2013,5,28,"Chalfant, Jordan",43.7285,-69.7941,Sagadahoc,ME,DCCO,GBBG correction factor = 1.004; HEGU correction factor = 0.9882. 1 COEI nesting.Location comm:,01200228,5/28/2013,00:00.0,2013,5,28,"Chalfant, Jordan",43.7285,-69.7941,Sagadahoc,ME,COEI,GBBG correction factor = 1.004; HEGU correction factor = 0.9882. 1 COEI nesting.Location comm:,01590229,5/31/2013,00:00.0,2013,5,31,"Mittelhauser, Glen",44.4632,-67.5478,Washington,ME,GBBG,GBBG correction factor = 1.004; HEGU correction factor = 0.9882.Location comm:,00470230,5/31/2013,00:00.0,2013,5,31,"Mittelhauser, Glen",44.4632,-67.5478,Washington,ME,HERG,GBBG correction factor = 1.004; HEGU correction factor = 0.9882.Location comm:,00510231,5/31/2013,00:00.0,2013,5,31,"Mittelhauser, Glen",44.4632,-67.5478,Washington,ME,DCCO,GBBG correction factor = 1.004; HEGU correction factor = 0.9882.Location comm:,01200232,5/28/2013,00:00.0,2013,5,28,"Mittelhauser, Glen",43.6957,-69.8337,Sagadahoc,ME,GBBG,GBBG correction factor = 1.004; HEGU correction factor = 0.9882.Location comm:,00470233,5/28/2013,00:00.0,2013,5,28,"Mittelhauser, Glen",43.6957,-69.8337,Sagadahoc,ME,HERG,GBBG correction factor = 1.004; HEGU correction factor = 0.9882.Location comm:,00510234,5/28/2013,00:00.0,2013,5,28,"Mittelhauser, Glen",43.6957,-69.8337,Sagadahoc,ME,DCCO,GBBG correction factor = 1.004; HEGU correction factor = 0.9882.Location comm:,01200235,5/30/2013,00:00.0,2013,5,30,"Chalfant, Jordan",44.0109,-69.1032,Knox,ME,GBBG,GBBG correction factor = 1.004; HEGU correction factor = 0.9882.  19 CAGO/COEILocation comm:,00470236,5/30/2013,00:00.0,2013,5,30,"Chalfant, Jordan",44.0109,-69.1032,Knox,ME,HERG,GBBG correction factor = 1.004; HEGU correction factor = 0.9882.  19 CAGO/COEILocation comm:,00510237,5/30/2013,00:00.0,2013,5,30,"Chalfant, Jordan",44.0109,-69.1032,Knox,ME,DCCO,GBBG correction factor = 1.004; HEGU correction factor = 0.9882.  19 CAGO/COEILocation comm:,01200238,5/30/2013,00:00.0,2013,5,30,"Chalfant, Jordan",44.0109,-69.1032,Knox,ME,CANG,GBBG correction factor = 1.004; HEGU correction factor = 0.9882.  19 CAGO/COEILocation comm:,01720239,5/30/2013,00:00.0,2013,5,30,"Welch, Linda",44.1848,-68.9507,Knox,ME,GBBG,GBBG correction factor = 1.004; HEGU correction factor = 0.9882.Location comm:,00470240,5/30/2013,00:00.0,2013,5,30,"Welch, Linda",44.1848,-68.9507,Knox,ME,HERG,GBBG correction factor = 1.004; HEGU correction factor = 0.9882.Location comm:,00510241,5/30/2013,00:00.0,2013,5,30,"Welch, Linda",44.1848,-68.9507,Knox,ME,DCCO,GBBG correction factor = 1.004; HEGU correction factor = 0.9882.Location comm:,01200242,5/30/2013,00:00.0,2013,5,30,"Mittelhauser, Glen",44.914,-67.0399,Washington,ME,GBBG,GBBG correction factor = 1.004; HEGU correction factor = 0.9882.Location comm:,00470243,5/30/2013,00:00.0,2013,5,30,"Mittelhauser, Glen",44.914,-67.0399,Washington,ME,HERG,GBBG correction factor = 1.004; HEGU correction factor = 0.9882.Location comm:,00510244,5/30/2013,00:00.0,2013,5,30,"Mittelhauser, Glen",44.914,-67.0399,Washington,ME,DCCO,GBBG correction factor = 1.004; HEGU correction factor = 0.9882.Location comm:,01200245,5/21/2013,00:00.0,2013,5,21,"Houston, Bob",43.7431,-70.0883,Cumberland,ME,COEI,No correction noted.Location comm:,01590246,5/21/2013,00:00.0,2013,5,21,"Houston, Bob",43.7431,-70.0883,Cumberland,ME,GBBG,No correction noted.Location comm:,00470247,5/21/2013,00:00.0,2013,5,21,"Houston, Bob",43.7431,-70.0883,Cumberland,ME,HERG,No correction noted.Location comm:,00510248,5/28/2013,00:00.0,2013,5,28,"Chalfant, Jordan",43.7431,-70.0883,Cumberland,ME,GBBG,GBBG Corecction factor = 1.004; HEGU correction factor = 0.9882.Location comm:,00470249,5/28/2013,00:00.0,2013,5,28,"Chalfant, Jordan",43.7431,-70.0883,Cumberland,ME,HERG,GBBG Corecction factor = 1.004; HEGU correction factor = 0.9882.Location comm:,00510250,5/28/2013,00:00.0,2013,5,28,"Chalfant, Jordan",43.7431,-70.0883,Cumberland,ME,DCCO,GBBG Corecction factor = 1.004; HEGU correction factor = 0.9882.Location comm:,01200251,5/30/2013,00:00.0,2013,5,30,"Welch, Linda",44.1837,-68.9795,Knox,ME,GBBG,GBBG correction factor = 1.004; HEGU correction factor = 0.9882.Location comm:,00470252,5/30/2013,00:00.0,2013,5,30,"Welch, Linda",44.1837,-68.9795,Knox,ME,HERG,GBBG correction factor = 1.004; HEGU correction factor = 0.9882.Location comm:,00510253,5/30/2013,00:00.0,2013,5,30,"Welch, Linda",44.1837,-68.9795,Knox,ME,DCCO,GBBG correction factor = 1.004; HEGU correction factor = 0.9882.Location comm:,01200254,6/7/2013,00:00.0,2013,6,7,"Swann, Scott",44.1322,-68.4615,Hancock,ME,HERG,"Signs of mammalian predators present.  Did a mapture recapture, didn't find any nests that I felt certain were not marked.Location comm:",00510255,6/7/2013,00:00.0,2013,6,7,"Swann, Scott",44.1322,-68.4615,Hancock,ME,GBBG,"Signs of mammalian predators present.  Did a mapture recapture, didn't find any nests that I felt certain were not marked.Location comm:",00470256,6/7/2013,00:00.0,2013,6,7,"Swann, Scott",44.1322,-68.4615,Hancock,ME,COEI,"Signs of mammalian predators present.  Did a mapture recapture, didn't find any nests that I felt certain were not marked.Location comm:",01590257,5/30/2013,00:00.0,2013,5,30,"Williams, Sarah",44.1322,-68.4615,Hancock,ME,GBBG,GBBG correction factor = 1.004; HEGU correction factor = 0.9882.Location comm:,00470258,5/30/2013,00:00.0,2013,5,30,"Williams, Sarah",44.1322,-68.4615,Hancock,ME,HERG,GBBG correction factor = 1.004; HEGU correction factor = 0.9882.Location comm:,00510259,5/30/2013,00:00.0,2013,5,30,"Williams, Sarah",44.1322,-68.4615,Hancock,ME,DCCO,GBBG correction factor = 1.004; HEGU correction factor = 0.9882.Location comm:,01200260,5/28/2013,00:00.0,2013,5,28,"Chalfant, Jordan",43.452,-70.3349,York,ME,GBBG,GBBG correction factor = 1.004; HEGU correction factor = 0.9882.Location comm:,00470261,5/28/2013,00:00.0,2013,5,28,"Chalfant, Jordan",43.452,-70.3349,York,ME,HERG,GBBG correction factor = 1.004; HEGU correction factor = 0.9882.Location comm:,00510262,5/28/2013,00:00.0,2013,5,28,"Chalfant, Jordan",43.452,-70.3349,York,ME,DCCO,GBBG correction factor = 1.004; HEGU correction factor = 0.9882.Location comm:,01200263,6/10/2013,00:00.0,2013,6,10,"Allen, Brad",44.1951,-68.7952,Hancock,ME,COEI,2 days early for terns - they abandoned to island this year for unknown reasons.  Note of four empty nests.Location comm:,01590264,6/10/2013,00:00.0,2013,6,10,"Allen, Brad",44.1951,-68.7952,Hancock,ME,GBBG,2 days early for terns - they abandoned to island this year for unknown reasons.  Note of four empty nests.Location comm:,00470265,6/10/2013,00:00.0,2013,6,10,"Allen, Brad",44.1951,-68.7952,Hancock,ME,DCCO,2 days early for terns - they abandoned to island this year for unknown reasons.  Note of four empty nests.Location comm:,01200266,6/10/2013,00:00.0,2013,6,10,"Allen, Brad",44.1951,-68.7952,Hancock,ME,COTE,2 days early for terns - they abandoned to island this year for unknown reasons.  Note of four empty nests.Location comm:,00700267,5/30/2013,00:00.0,2013,5,30,"Langlois, Michael",44.1951,-68.7952,Hancock,ME,GBBG,GBBG correction factor = 1.004; HEGU correction factor = 0.9882.Location comm:,00470268,5/30/2013,00:00.0,2013,5,30,"Langlois, Michael",44.1951,-68.7952,Hancock,ME,HERG,GBBG correction factor = 1.004; HEGU correction factor = 0.9882.Location comm:,00510269,5/30/2013,00:00.0,2013,5,30,"Langlois, Michael",44.1951,-68.7952,Hancock,ME,DCCO,GBBG correction factor = 1.004; HEGU correction factor = 0.9882.Location comm:,01200270,6/10/2013,00:00.0,2013,6,10,"Allen, Brad",44.2186,-68.8492,Hancock,ME,GBBG,"1 GBBG nest, 2 hatched GBBG nests. No correction noted.Location comm:",00470271,6/10/2013,00:00.0,2013,6,10,"Allen, Brad",44.2186,-68.8492,Hancock,ME,DCCO,"1 GBBG nest, 2 hatched GBBG nests. No correction noted.Location comm:",01200272,6/10/2013,00:00.0,2013,6,10,"Allen, Brad",44.2186,-68.8492,Hancock,ME,COEI,"1 GBBG nest, 2 hatched GBBG nests. No correction noted.Location comm:",01590273,5/30/2013,00:00.0,2013,5,30,"Langlois, Michael",44.2186,-68.8492,Hancock,ME,GBBG,GBBG correction factor = 1.004; HEGU correction factor = 0.9882.Location comm:,00470274,5/30/2013,00:00.0,2013,5,30,"Langlois, Michael",44.2186,-68.8492,Hancock,ME,HERG,GBBG correction factor = 1.004; HEGU correction factor = 0.9882.Location comm:,00510275,5/30/2013,00:00.0,2013,5,30,"Langlois, Michael",44.2186,-68.8492,Hancock,ME,DCCO,GBBG correction factor = 1.004; HEGU correction factor = 0.9882.Location comm:,01200276,6/19/2013,00:00.0,2013,6,19,"Houston, Bob",43.7922,-70.0329,Cumberland,ME,COTE,No correction noted.Location comm:,00700277,6/19/2013,00:00.0,2013,6,19,"Houston, Bob",43.7922,-70.0329,Cumberland,ME,ROST,No correction noted.Location comm:,00720278,6/19/2013,00:00.0,2013,6,19,"Houston, Bob",43.7922,-70.0329,Cumberland,ME,ARTE,No correction noted.Location comm:,00710279,6/1/2013,00:00.0,2013,6,1,"Anderson, John",44.1502,-68.2484,Hancock,ME,HERG,GBBG reliability = 3 because parts of colony difficult to precisely survey.  HEGU corrected = (count) divided by 0.85 to account for missed nests on a large island.Location comm:,00510280,6/1/2013,00:00.0,2013,6,1,"Anderson, John",44.1502,-68.2484,Hancock,ME,GBBG,GBBG reliability = 3 because parts of colony difficult to precisely survey.  HEGU corrected = (count) divided by 0.85 to account for missed nests on a large island.Location comm:,00470281,6/1/2013,00:00.0,2013,6,1,"Anderson, John",44.1502,-68.2484,Hancock,ME,COEI,GBBG reliability = 3 because parts of colony difficult to precisely survey.  HEGU corrected = (count) divided by 0.85 to account for missed nests on a large island.Location comm:,01590282,5/30/2013,00:00.0,2013,5,30,"Langlois, Michael",44.1502,-68.2484,Hancock,ME,GBBG,GBBG correction factor = 1.004; HEGU correction factor = 0.9882.Location comm:,00470283,5/30/2013,00:00.0,2013,5,30,"Langlois, Michael",44.1502,-68.2484,Hancock,ME,HERG,GBBG correction factor = 1.004; HEGU correction factor = 0.9882.Location comm:,00510284,5/30/2013,00:00.0,2013,5,30,"Langlois, Michael",44.1502,-68.2484,Hancock,ME,DCCO,GBBG correction factor = 1.004; HEGU correction factor = 0.9882.Location comm:,01200285,6/15/2013,00:00.0,2013,6,15,"Anderson, John",44.0426,-68.5571,Knox,ME,HERG,Circled island in boat and could see 161 nearly all gulls were concentrated in annex ahere we did ground nest count.  Added nests for correct column based on best estimate from boat.Location comm: Onl,00510368,5/28/2013,00:00.0,2013,5,28,"Schauffler, Rick",43.9087,-69.2519,Knox,ME,CANG,GBBG correction factor = 1.004; HEGU correction factor = 0.9882. 2 CAGO???Location comm:,01720286,6/15/2013,00:00.0,2013,6,15,"Anderson, John",44.0426,-68.5571,Knox,ME,GBBG,Circled island in boat and could see 161 nearly all gulls were concentrated in annex ahere we did ground nest count.  Added nests for correct column based on best estimate from boat.Location comm: Onl,00470287,6/15/2013,00:00.0,2013,6,15,"Anderson, John",44.0426,-68.5571,Knox,ME,COTE,Circled island in boat and could see 161 nearly all gulls were concentrated in annex ahere we did ground nest count.  Added nests for correct column based on best estimate from boat.Location comm: Onl,00700288,6/15/2013,00:00.0,2013,6,15,"Anderson, John",44.0426,-68.5571,Knox,ME,COEI,Circled island in boat and could see 161 nearly all gulls were concentrated in annex ahere we did ground nest count.  Added nests for correct column based on best estimate from boat.Location comm: Onl,01590289,5/30/2013,00:00.0,2013,5,30,"Langlois, Michael",44.0426,-68.5571,Knox,ME,GBBG,GBBG correction factor = 1.004; HEGU correction factor = 0.9882.Location comm:,00470290,5/30/2013,00:00.0,2013,5,30,"Langlois, Michael",44.0426,-68.5571,Knox,ME,HERG,GBBG correction factor = 1.004; HEGU correction factor = 0.9882.Location comm:,00510291,5/30/2013,00:00.0,2013,5,30,"Langlois, Michael",44.0426,-68.5571,Knox,ME,DCCO,GBBG correction factor = 1.004; HEGU correction factor = 0.9882.Location comm:,01200292,6/4/2013,00:00.0,2013,6,4,"Williams, Sarah",44.3732,-67.8739,Washington,ME,HERG,"Obsucred by vegetation: 39 HERG nests, 2 GBBG.  Empty gull nests = 145, empty eider nests = 30, 18 eider carcasses found (1 male), owl  pellet, 1 dead AD BLGU, 4 dead AD HERG, and 1 predated eider duc",00510293,6/4/2013,00:00.0,2013,6,4,"Williams, Sarah",44.3732,-67.8739,Washington,ME,GBBG,"Obsucred by vegetation: 39 HERG nests, 2 GBBG.  Empty gull nests = 145, empty eider nests = 30, 18 eider carcasses found (1 male), owl  pellet, 1 dead AD BLGU, 4 dead AD HERG, and 1 predated eider duc",00470294,6/4/2013,00:00.0,2013,6,4,"Williams, Sarah",44.3732,-67.8739,Washington,ME,COEI,"Obsucred by vegetation: 39 HERG nests, 2 GBBG.  Empty gull nests = 145, empty eider nests = 30, 18 eider carcasses found (1 male), owl  pellet, 1 dead AD BLGU, 4 dead AD HERG, and 1 predated eider duc",01590295,6/4/2013,00:00.0,2013,6,4,"Williams, Sarah",44.3732,-67.8739,Washington,ME,CANG,"Obsucred by vegetation: 39 HERG nests, 2 GBBG.  Empty gull nests = 145, empty eider nests = 30, 18 eider carcasses found (1 male), owl  pellet, 1 dead AD BLGU, 4 dead AD HERG, and 1 predated eider duc",01720296,6/6/2013,00:00.0,2013,6,6,"Mittelhauser, Glen",44.4865,-67.7072,Washington,ME,HERG,No nesting seabirds noted from skiff.Location comm:,00510297,6/6/2013,00:00.0,2013,6,6,"Mittelhauser, Glen",44.4865,-67.7072,Washington,ME,GBBG,No nesting seabirds noted from skiff.Location comm:,00470298,6/10/2013,00:00.0,2013,6,10,"Swann, Scott",44.1143,-68.447,Hancock,ME,HERG,No nesting sea birds encountered.  On  JUN 6th did a boat count and determined no seabirds were nesting on the island.  June 10- we landed and confirmed.Location comm:,00510299,6/10/2013,00:00.0,2013,6,10,"Swann, Scott",44.1143,-68.447,Hancock,ME,GBBG,No nesting sea birds encountered.  On  JUN 6th did a boat count and determined no seabirds were nesting on the island.  June 10- we landed and confirmed.Location comm:,00470300,6/15/2013,00:00.0,2013,6,15,"Anderson, John",44.1569,-68.3404,Hancock,ME,HERG,"An additional 20 empty nests and 2 empty COEI nests and 2 predated mature COEI and 1 predated mature HEGU.  COEI not systematically surveyed, just noted during gull counts.  Correction: gulls: N/0.85",00510301,6/15/2013,00:00.0,2013,6,15,"Anderson, John",44.1569,-68.3404,Hancock,ME,GBBG,"An additional 20 empty nests and 2 empty COEI nests and 2 predated mature COEI and 1 predated mature HEGU.  COEI not systematically surveyed, just noted during gull counts.  Correction: gulls: N/0.85",00470302,6/15/2013,00:00.0,2013,6,15,"Anderson, John",44.1569,-68.3404,Hancock,ME,COEI,"An additional 20 empty nests and 2 empty COEI nests and 2 predated mature COEI and 1 predated mature HEGU.  COEI not systematically surveyed, just noted during gull counts.  Correction: gulls: N/0.85",01590369,5/30/2013,00:00.0,2013,5,30,"Chalfant, Jordan",43.8878,-69.4397,Lincoln,ME,GBBG,GBBG correction factor = 1.004; HEGU correction factor = 0.9882.Location comm:,00470303,6/15/2013,00:00.0,2013,6,15,"Anderson, John",44.1569,-68.3404,Hancock,ME,DCCO,"An additional 20 empty nests and 2 empty COEI nests and 2 predated mature COEI and 1 predated mature HEGU.  COEI not systematically surveyed, just noted during gull counts.  Correction: gulls: N/0.85",01200304,5/30/2013,00:00.0,2013,5,30,"Welch, Linda",44.1569,-68.3404,Hancock,ME,GBBG,GBBG correction factor = 1.004; HEGU correction factor = 0.9882.Location comm:,00470305,5/30/2013,00:00.0,2013,5,30,"Welch, Linda",44.1569,-68.3404,Hancock,ME,HERG,GBBG correction factor = 1.004; HEGU correction factor = 0.9882.Location comm:,00510306,5/30/2013,00:00.0,2013,5,30,"Welch, Linda",44.1569,-68.3404,Hancock,ME,DCCO,GBBG correction factor = 1.004; HEGU correction factor = 0.9882.Location comm:,01200307,5/30/2013,00:00.0,2013,5,30,"Langlois, Michael",44.1143,-68.447,Hancock,ME,GBBG,GBBG correction factor = 1.004; HEGU correction factor = 0.9882.Location comm:,00470308,5/30/2013,00:00.0,2013,5,30,"Langlois, Michael",44.1143,-68.447,Hancock,ME,HERG,GBBG correction factor = 1.004; HEGU correction factor = 0.9882.Location comm:,00510309,5/30/2013,00:00.0,2013,5,30,"Langlois, Michael",44.1143,-68.447,Hancock,ME,DCCO,GBBG correction factor = 1.004; HEGU correction factor = 0.9882.Location comm:,01200310,5/30/2013,00:00.0,2013,5,30,"Allen, Brad",44.0734,-68.9151,Knox,ME,GBBG,GBBG correction factor = 1.004; HEGU correction factor = 0.9882.Location comm:,00470311,5/30/2013,00:00.0,2013,5,30,"Allen, Brad",44.0734,-68.9151,Knox,ME,HERG,GBBG correction factor = 1.004; HEGU correction factor = 0.9882.Location comm:,00510312,5/30/2013,00:00.0,2013,5,30,"Allen, Brad",44.0734,-68.9151,Knox,ME,DCCO,GBBG correction factor = 1.004; HEGU correction factor = 0.9882.Location comm:,01200313,5/30/2013,00:00.0,2013,5,30,"Welch, Linda",44.5623,-67.4437,Washington,ME,GBBG,GBBG correction factor = 1.004; HEGU correction factor = 0.9882.Location comm:,00470314,5/30/2013,00:00.0,2013,5,30,"Welch, Linda",44.5623,-67.4437,Washington,ME,HERG,GBBG correction factor = 1.004; HEGU correction factor = 0.9882.Location comm:,00510315,5/30/2013,00:00.0,2013,5,30,"Welch, Linda",44.5623,-67.4437,Washington,ME,DCCO,GBBG correction factor = 1.004; HEGU correction factor = 0.9882.Location comm:,01200316,5/31/2013,00:00.0,2013,5,31,"Welch, Linda",44.3732,-67.8739,Washington,ME,GBBG,GBBG correction factor = 1.004; HEGU correction factor = 0.9882. 9 CAGOLocation comm:,00470317,5/31/2013,00:00.0,2013,5,31,"Welch, Linda",44.3732,-67.8739,Washington,ME,HERG,GBBG correction factor = 1.004; HEGU correction factor = 0.9882. 9 CAGOLocation comm:,00510318,5/31/2013,00:00.0,2013,5,31,"Welch, Linda",44.3732,-67.8739,Washington,ME,DCCO,GBBG correction factor = 1.004; HEGU correction factor = 0.9882.  9 CAGOLocation comm:,01200319,5/31/2013,00:00.0,2013,5,31,"Chalfant, Jordan",43.3559,-70.4329,York,ME,GBBG,GBBG correction factor = 1.004; HEGU correction factor = 0.9882.Location comm:,00470320,5/31/2013,00:00.0,2013,5,31,"Chalfant, Jordan",43.3559,-70.4329,York,ME,HERG,GBBG correction factor = 1.004; HEGU correction factor = 0.9882.Location comm:,00510321,5/31/2013,00:00.0,2013,5,31,"Chalfant, Jordan",43.3559,-70.4329,York,ME,DCCO,GBBG correction factor = 1.004; HEGU correction factor = 0.9882.Location comm:,01200322,5/30/2013,00:00.0,2013,5,30,"Williams, Sarah",44.5623,-67.4437,Washington,ME,HERG,"No nests were obscured by vegetation.  One egg GBBG nests were corrected a nd counted as HEGU nests.   Nest clutch by size HEGU 1 egg:2, 2 eggs:1, 3 eggs:1; GBBG 1 egg:4, 2 eggs:10, 3 eggs:2; COEI 1 e",00510323,5/30/2013,00:00.0,2013,5,30,"Williams, Sarah",44.5623,-67.4437,Washington,ME,GBBG,"No nests were obscured by vegetation.  One egg GBBG nests were corrected a nd counted as HEGU nests.   Nest clutch by size HEGU 1 egg:2, 2 eggs:1, 3 eggs:1; GBBG 1 egg:4, 2 eggs:10, 3 eggs:2; COEI 1 e",00470324,5/30/2013,00:00.0,2013,5,30,"Williams, Sarah",44.5623,-67.4437,Washington,ME,COEI,"No nests were obscured by vegetation.  One egg GBBG nests were corrected a nd counted as HEGU nests.   Nest clutch by size HEGU 1 egg:2, 2 eggs:1, 3 eggs:1; GBBG 1 egg:4, 2 eggs:10, 3 eggs:2; COEI 1 e",01590325,5/31/2013,00:00.0,2013,5,31,"Welch, Linda",44.3732,-67.8739,Washington,ME,CANG,GBBG correction factor = 1.004; HEGU correction factor = 0.9882.  9 CAGOLocation comm:,01720326,6/10/2013,00:00.0,2013,6,10,"Allen, Brad",44.2902,-68.8283,Hancock,ME,COTE,A little late for COEI survey; and 2 days prior to official tern census window - only 2 birds there on early August visit.Location comm:,00700327,6/10/2013,00:00.0,2013,6,10,"Allen, Brad",44.2902,-68.8283,Hancock,ME,COEI,A little late for COEI survey; and 2 days prior to official tern census window - only 2 birds there on early August visit.Location comm:,01590328,6/10/2013,00:00.0,2013,6,10,US Fish and Wildlife Service,44.1893,-68.5471,Hancock,ME,COTE,Unknown correction.Location comm:,00700329,5/30/2013,00:00.0,2013,5,30,"Langlois, Michael",44.2902,-68.8283,Hancock,ME,GBBG,GBBG correction factor = 1.004; HEGU correction factor = 0.9882.Location comm:,00470330,5/30/2013,00:00.0,2013,5,30,"Langlois, Michael",44.2902,-68.8283,Hancock,ME,HERG,GBBG correction factor = 1.004; HEGU correction factor = 0.9882.Location comm:,00510331,5/30/2013,00:00.0,2013,5,30,"Langlois, Michael",44.2902,-68.8283,Hancock,ME,DCCO,GBBG correction factor = 1.004; HEGU correction factor = 0.9882.Location comm:,01200332,5/30/2013,00:00.0,2013,5,30,"Gettle, Beth",44.1893,-68.5471,Hancock,ME,GBBG,GBBG correction factor = 1.004; HEGU correction factor = 0.9882.Location comm:,00470333,5/30/2013,00:00.0,2013,5,30,"Gettle, Beth",44.1893,-68.5471,Hancock,ME,HERG,GBBG correction factor = 1.004; HEGU correction factor = 0.9882.Location comm:,00510334,5/30/2013,00:00.0,2013,5,30,"Gettle, Beth",44.1893,-68.5471,Hancock,ME,DCCO,GBBG correction factor = 1.004; HEGU correction factor = 0.9882.Location comm:,01200335,5/30/2013,00:00.0,2013,5,30,"Gettle, Beth",44.1893,-68.5471,Hancock,ME,GBBG,GBBG correction factor = 1.004; HEGU correction factor = 0.9882.  1 eagleLocation comm:,00470336,5/30/2013,00:00.0,2013,5,30,"Gettle, Beth",44.1893,-68.5471,Hancock,ME,HERG,GBBG correction factor = 1.004; HEGU correction factor = 0.9882.  1 eagleLocation comm:,00510337,5/30/2013,00:00.0,2013,5,30,"Gettle, Beth",44.1893,-68.5471,Hancock,ME,DCCO,GBBG correction factor = 1.004; HEGU correction factor = 0.9882.  1 eagleLocation comm:,01200338,5/30/2013,00:00.0,2013,5,30,"Williams, Sarah",44.0931,-68.5652,Knox,ME,GBBG,GBBG correction factor = 1.004; HEGU correction factor = 0.9882.Location comm:,00470339,5/30/2013,00:00.0,2013,5,30,"Williams, Sarah",44.0931,-68.5652,Knox,ME,HERG,GBBG correction factor = 1.004; HEGU correction factor = 0.9882.Location comm:,00510340,5/30/2013,00:00.0,2013,5,30,"Williams, Sarah",44.0931,-68.5652,Knox,ME,DCCO,GBBG correction factor = 1.004; HEGU correction factor = 0.9882.Location comm:,01200341,5/30/2013,00:00.0,2013,5,30,"Allen, Brad",44.0661,-68.9197,Knox,ME,GBBG,GBBG correction factor = 1.004; HEGU correction factor = 0.9882.Location comm:,00470342,5/30/2013,00:00.0,2013,5,30,"Allen, Brad",44.0661,-68.9197,Knox,ME,HERG,GBBG correction factor = 1.004; HEGU correction factor = 0.9882.Location comm:,00510343,5/30/2013,00:00.0,2013,5,30,"Allen, Brad",44.0661,-68.9197,Knox,ME,DCCO,GBBG correction factor = 1.004; HEGU correction factor = 0.9882.Location comm:,01200344,5/30/2013,00:00.0,2013,5,30,"Mittelhauser, Glen",43.8276,-68.8774,Knox,ME,GBBG,GBBG correction factor = 1.004; HEGU correction factor = 0.9882.Location comm:,00470345,5/30/2013,00:00.0,2013,5,30,"Mittelhauser, Glen",43.8276,-68.8774,Knox,ME,HERG,GBBG correction factor = 1.004; HEGU correction factor = 0.9882.Location comm:,00510346,5/30/2013,00:00.0,2013,5,30,"Mittelhauser, Glen",43.8276,-68.8774,Knox,ME,DCCO,GBBG correction factor = 1.004; HEGU correction factor = 0.9882.Location comm:,01200347,6/6/2013,00:00.0,2013,6,6,"Mittelhauser, Glen",44.4399,-67.6089,Washington,ME,GBBG,Landed and checked island visually.  3 eggs in nest.  No correction needed.Location comm:,00470348,6/6/2013,00:00.0,2013,6,6,"Mittelhauser, Glen",44.4399,-67.6089,Washington,ME,HERG,Landed and checked island visually.  3 eggs in nest.  No correction needed.Location comm:,00510349,6/13/2013,00:00.0,2013,6,13,"Langlois, Michael",43.9576,-69.3716,Knox,ME,HERG,"Majority of nests were not obscured by vegetation.  No correction applied.  Nest count by clutch size HERG; 2 eggs:9, 3 eggs:16; GBBG: 1 egg:2; 2 eggs:1; 3 eggs:3.Location comm:",00510350,6/13/2013,00:00.0,2013,6,13,"Langlois, Michael",43.9576,-69.3716,Knox,ME,GBBG,"Majority of nests were not obscured by vegetation.  No correction applied.  Nest count by clutch size HERG; 2 eggs:9, 3 eggs:16; GBBG: 1 egg:2; 2 eggs:1; 3 eggs:3.Location comm:",00470351,5/30/2013,00:00.0,2013,5,30,"Chalfant, Jordan",43.9576,-69.3716,Knox,ME,GBBG,GBBG correction factor = 1.004; HEGU correction factor = 0.9882.Location comm:,00470352,5/30/2013,00:00.0,2013,5,30,"Chalfant, Jordan",43.9576,-69.3716,Knox,ME,HERG,GBBG correction factor = 1.004; HEGU correction factor = 0.9882.Location comm:,00510353,5/30/2013,00:00.0,2013,5,30,"Chalfant, Jordan",43.9576,-69.3716,Knox,ME,DCCO,GBBG correction factor = 1.004; HEGU correction factor = 0.9882.Location comm:,01200354,5/28/2013,00:00.0,2013,5,28,"Langlois, Michael",43.9108,-69.249,Knox,ME,HERG,"Few nests if any obscured by vegetation.  Actual count adjusted to reflect visual observation of approx. 10 GBBG over island.  Nest Count by clutch size HERG 1 egg:16, 2 eggs:18, 3 eggs:39; GBBG 1 egg",00510355,5/28/2013,00:00.0,2013,5,28,"Langlois, Michael",43.9108,-69.249,Knox,ME,GBBG,"Few nests if any obscured by vegetation.  Actual count adjusted to reflect visual observation of approx. 10 GBBG over island.  Nest Count by clutch size HERG 1 egg:16, 2 eggs:18, 3 eggs:39; GBBG 1 egg",00470356,5/28/2013,00:00.0,2013,5,28,"Langlois, Michael",43.9108,-69.249,Knox,ME,DCCO,"Few nests if any obscured by vegetation.  Actual count adjusted to reflect visual observation of approx. 10 GBBG over island.  Nest Count by clutch size HERG 1 egg:16, 2 eggs:18, 3 eggs:39; GBBG 1 egg",01200357,5/28/2013,00:00.0,2013,5,28,"Langlois, Michael",43.9108,-69.249,Knox,ME,COEI,"Few nests if any obscured by vegetation.  Actual count adjusted to reflect visual observation of approx. 10 GBBG over island.  Nest Count by clutch size HERG 1 egg:16, 2 eggs:18, 3 eggs:39; GBBG 1 egg",01590358,5/28/2013,00:00.0,2013,5,28,"Schauffler, Rick",43.9108,-69.249,Knox,ME,GBBG,GBBG correction factor = 1.004; HEGU correction factor = 0.9882.Location comm:,00470359,5/28/2013,00:00.0,2013,5,28,"Schauffler, Rick",43.9108,-69.249,Knox,ME,HERG,GBBG correction factor = 1.004; HEGU correction factor = 0.9882.Location comm:,00510360,5/28/2013,00:00.0,2013,5,28,"Schauffler, Rick",43.9108,-69.249,Knox,ME,DCCO,GBBG correction factor = 1.004; HEGU correction factor = 0.9882.Location comm:,01200361,5/28/2013,00:00.0,2013,5,28,"Langlois, Michael",43.9087,-69.2519,Knox,ME,HERG,Few nests if any obscured by vegetation.  Actual count adjusted to reflect visual observation of 6-8 GBBG on/over island.  Interior island veg. doninated by stinging nettle and grasses.  Nest Count by,00510362,5/28/2013,00:00.0,2013,5,28,"Langlois, Michael",43.9087,-69.2519,Knox,ME,GBBG,Few nests if any obscured by vegetation.  Actual count adjusted to reflect visual observation of 6-8 GBBG on/over island.  Interior island veg. doninated by stinging nettle and grasses.  Nest Count by,00470363,5/28/2013,00:00.0,2013,5,28,"Langlois, Michael",43.9087,-69.2519,Knox,ME,DCCO,Few nests if any obscured by vegetation.  Actual count adjusted to reflect visual observation of 6-8 GBBG on/over island.  Interior island veg. doninated by stinging nettle and grasses.  Nest Count by,01200364,5/28/2013,00:00.0,2013,5,28,"Langlois, Michael",43.9087,-69.2519,Knox,ME,COEI,Few nests if any obscured by vegetation.  Actual count adjusted to reflect visual observation of 6-8 GBBG on/over island.  Interior island veg. doninated by stinging nettle and grasses.  Nest Count by,01590365,5/28/2013,00:00.0,2013,5,28,"Schauffler, Rick",43.9087,-69.2519,Knox,ME,GBBG,GBBG correction factor = 1.004; HEGU correction factor = 0.9882.  2 CAGO???Location comm:,00470366,5/28/2013,00:00.0,2013,5,28,"Schauffler, Rick",43.9087,-69.2519,Knox,ME,HERG,GBBG correction factor = 1.004; HEGU correction factor = 0.9882. 2 CAGO???Location comm:,00510367,5/28/2013,00:00.0,2013,5,28,"Schauffler, Rick",43.9087,-69.2519,Knox,ME,DCCO,GBBG correction factor = 1.004; HEGU correction factor = 0.9882. 2 CAGO???Location comm:,01200370,5/30/2013,00:00.0,2013,5,30,"Chalfant, Jordan",43.8878,-69.4397,Lincoln,ME,HERG,GBBG correction factor = 1.004; HEGU correction factor = 0.9882.Location comm:,00510371,5/30/2013,00:00.0,2013,5,30,"Chalfant, Jordan",43.8878,-69.4397,Lincoln,ME,DCCO,GBBG correction factor = 1.004; HEGU correction factor = 0.9882.Location comm:,01200372,5/28/2013,00:00.0,2013,5,28,"Mittelhauser, Glen",43.7125,-70.0422,Cumberland,ME,GBBG,GBBG Corecction factor = 1.004; HEGU correction factor = 0.9882.Location comm:,00470373,5/28/2013,00:00.0,2013,5,28,"Mittelhauser, Glen",43.7125,-70.0422,Cumberland,ME,HERG,GBBG Corecction factor = 1.004; HEGU correction factor = 0.9882.Location comm:,00510374,5/28/2013,00:00.0,2013,5,28,"Mittelhauser, Glen",43.7125,-70.0422,Cumberland,ME,DCCO,GBBG Corecction factor = 1.004; HEGU correction factor = 0.9882.Location comm:,01200375,5/30/2013,00:00.0,2013,5,30,"Williams, Sarah",44.1338,-68.5254,Hancock,ME,GBBG,GBBG correction factor = 1.004; HEGU correction factor = 0.9882.Location comm:,00470376,5/30/2013,00:00.0,2013,5,30,"Williams, Sarah",44.1338,-68.5254,Hancock,ME,HERG,GBBG correction factor = 1.004; HEGU correction factor = 0.9882.Location comm:,00510377,5/30/2013,00:00.0,2013,5,30,"Williams, Sarah",44.1338,-68.5254,Hancock,ME,DCCO,GBBG correction factor = 1.004; HEGU correction factor = 0.9882.Location comm:,01200378,5/30/2013,00:00.0,2013,5,30,"Welch, Linda",44.5725,-67.4595,Washington,ME,GBBG,GBBG correction factor = 1.004; HEGU correction factor = 0.9882.Location comm:,00470379,5/30/2013,00:00.0,2013,5,30,"Welch, Linda",44.5725,-67.4595,Washington,ME,HERG,GBBG correction factor = 1.004; HEGU correction factor = 0.9882.Location comm:,00510380,5/30/2013,00:00.0,2013,5,30,"Welch, Linda",44.5725,-67.4595,Washington,ME,DCCO,GBBG correction factor = 1.004; HEGU correction factor = 0.9882.Location comm:,01200381,5/30/2013,00:00.0,2013,5,30,"Langlois, Michael",44.2244,-68.7543,Hancock,ME,GBBG,GBBG correction factor = 1.004; HEGU correction factor = 0.9882.Location comm:,00470382,5/30/2013,00:00.0,2013,5,30,"Langlois, Michael",44.2244,-68.7543,Hancock,ME,HERG,GBBG correction factor = 1.004; HEGU correction factor = 0.9882.Location comm:,00510383,5/30/2013,00:00.0,2013,5,30,"Langlois, Michael",44.2244,-68.7543,Hancock,ME,DCCO,GBBG correction factor = 1.004; HEGU correction factor = 0.9882.Location comm:,01200384,5/28/2013,00:00.0,2013,5,28,"Langlois, Michael",43.9046,-69.2657,Knox,ME,HERG,Large number of Eiders in thick interior veg. not counted tall cow parsnip in interior of island - handfull of gull nests will not be seen in photos.  Interior of island wasn't surveyed. No info provi,00510385,5/28/2013,00:00.0,2013,5,28,"Langlois, Michael",43.9046,-69.2657,Knox,ME,GBBG,Large number of Eiders in thick interior veg. not counted tall cow parsnip in interior of island - handfull of gull nests will not be seen in photos.  Interior of island wasn't surveyed. No info provi,00470386,5/28/2013,00:00.0,2013,5,28,"Langlois, Michael",43.9046,-69.2657,Knox,ME,COEI,Large number of Eiders in thick interior veg. not counted tall cow parsnip in interior of island - handfull of gull nests will not be seen in photos.  Interior of island wasn't surveyed. No info provi,01590387,5/28/2013,00:00.0,2013,5,28,"Schauffler, Rick",43.9046,-69.2657,Knox,ME,GBBG,GBBG correction factor = 1.004; HEGU correction factor = 0.9882.Location comm:,00470388,5/28/2013,00:00.0,2013,5,28,"Schauffler, Rick",43.9046,-69.2657,Knox,ME,HERG,GBBG correction factor = 1.004; HEGU correction factor = 0.9882.Location comm:,00510389,5/28/2013,00:00.0,2013,5,28,"Schauffler, Rick",43.9046,-69.2657,Knox,ME,DCCO,GBBG correction factor = 1.004; HEGU correction factor = 0.9882.Location comm:,01200390,5/30/2013,00:00.0,2013,5,30,"Schauffler, Rick",44.0155,-68.7939,Knox,ME,GBBG,GBBG correction factor = 1.004; HEGU correction factor = 0.9882.Location comm:,00470391,5/30/2013,00:00.0,2013,5,30,"Schauffler, Rick",44.0155,-68.7939,Knox,ME,HERG,GBBG correction factor = 1.004; HEGU correction factor = 0.9882.Location comm:,00510392,5/30/2013,00:00.0,2013,5,30,"Schauffler, Rick",44.0155,-68.7939,Knox,ME,DCCO,GBBG correction factor = 1.004; HEGU correction factor = 0.9882.Location comm:,01200393,5/28/2013,00:00.0,2013,5,28,"Schauffler, Rick",43.9088,-69.2332,Knox,ME,GBBG,GBBG correction factor = 1.004; HEGU correction factor = 0.9882.  2 CAGO.Location comm:,00470394,5/28/2013,00:00.0,2013,5,28,"Schauffler, Rick",43.9088,-69.2332,Knox,ME,HERG,GBBG correction factor = 1.004; HEGU correction factor = 0.9882.  2 CAGO.Location comm:,00510395,5/28/2013,00:00.0,2013,5,28,"Schauffler, Rick",43.9088,-69.2332,Knox,ME,DCCO,GBBG correction factor = 1.004; HEGU correction factor = 0.9882.  2 CAGO.Location comm:,01200396,5/28/2013,00:00.0,2013,5,28,"Schauffler, Rick",43.9088,-69.2332,Knox,ME,CANG,GBBG correction factor = 1.004; HEGU correction factor = 0.9882.  2 CAGO.Location comm:,01720397,5/30/2013,00:00.0,2013,5,30,"Williams, Sarah",44.1006,-68.4739,Hancock,ME,GBBG,GBBG correction factor = 1.004; HEGU correction factor = 0.9882.Location comm:,00470398,5/30/2013,00:00.0,2013,5,30,"Williams, Sarah",44.1006,-68.4739,Hancock,ME,HERG,GBBG correction factor = 1.004; HEGU correction factor = 0.9882.Location comm:,00510399,5/30/2013,00:00.0,2013,5,30,"Williams, Sarah",44.1006,-68.4739,Hancock,ME,DCCO,GBBG correction factor = 1.004; HEGU correction factor = 0.9882.Location comm:,01200400,5/28/2013,00:00.0,2013,5,28,"Chalfant, Jordan",43.7225,-69.8048,Sagadahoc,ME,GBBG,GBBG correction factor = 1.004; HEGU correction factor = 0.9882.  2 CAGO.Location comm:,00470401,5/28/2013,00:00.0,2013,5,28,"Chalfant, Jordan",43.7225,-69.8048,Sagadahoc,ME,HERG,GBBG correction factor = 1.004; HEGU correction factor = 0.9882.  2 CAGO.Location comm:,00510402,5/28/2013,00:00.0,2013,5,28,"Chalfant, Jordan",43.7225,-69.8048,Sagadahoc,ME,DCCO,GBBG correction factor = 1.004; HEGU correction factor = 0.9882.  2 CAGO.Location comm:,01200403,5/28/2013,00:00.0,2013,5,28,"Chalfant, Jordan",43.7225,-69.8048,Sagadahoc,ME,CANG,GBBG correction factor = 1.004; HEGU correction factor = 0.9882.  2 CAGO.Location comm:,01720404,5/28/2013,00:00.0,2013,5,28,"Chalfant, Jordan",43.7237,-69.8053,Sagadahoc,ME,GBBG,GBBG correction factor = 1.004; HEGU correction factor = 0.9882.Location comm:,00470405,5/28/2013,00:00.0,2013,5,28,"Chalfant, Jordan",43.7237,-69.8053,Sagadahoc,ME,HERG,GBBG correction factor = 1.004; HEGU correction factor = 0.9882.Location comm:,00510406,5/28/2013,00:00.0,2013,5,28,"Chalfant, Jordan",43.7237,-69.8053,Sagadahoc,ME,DCCO,GBBG correction factor = 1.004; HEGU correction factor = 0.9882.Location comm:,01200407,5/28/2013,00:00.0,2013,5,28,"Chalfant, Jordan",43.7236,-69.8045,Sagadahoc,ME,HERG,GBBG correction factor = 1.004; HEGU correction factor = 0.9882.Location comm:,00510408,5/28/2013,00:00.0,2013,5,28,"Chalfant, Jordan",43.7236,-69.8045,Sagadahoc,ME,DCCO,GBBG correction factor = 1.004; HEGU correction factor = 0.9882.Location comm:,01200409,5/28/2013,00:00.0,2013,5,28,"Chalfant, Jordan",43.7214,-69.8046,Sagadahoc,ME,GBBG,GBBG correction factor = 1.004; HEGU correction factor = 0.9882. 2 CAGO.Location comm:,00470410,5/28/2013,00:00.0,2013,5,28,"Chalfant, Jordan",43.7214,-69.8046,Sagadahoc,ME,HERG,GBBG correction factor = 1.004; HEGU correction factor = 0.9882. 2 CAGO.Location comm:,00510411,5/28/2013,00:00.0,2013,5,28,"Chalfant, Jordan",43.7214,-69.8046,Sagadahoc,ME,DCCO,GBBG correction factor = 1.004; HEGU correction factor = 0.9882. 2 CAGO.Location comm:,01200412,5/28/2013,00:00.0,2013,5,28,"Chalfant, Jordan",43.7214,-69.8046,Sagadahoc,ME,CANG,GBBG correction factor = 1.004; HEGU correction factor = 0.9882. 2 CAGO.Location comm:,01720413,5/30/2013,00:00.0,2013,5,30,"Chalfant, Jordan",43.8711,-69.1235,Knox,ME,GBBG,GBBG correction factor = 1.004; HEGU correction factor = 0.9882. 8 COEI/CAGO/Unknown.Location comm:,00470414,5/30/2013,00:00.0,2013,5,30,"Chalfant, Jordan",43.8711,-69.1235,Knox,ME,HERG,GBBG correction factor = 1.004; HEGU correction factor = 0.9882. 8 COEI/CAGO/Unknown.Location comm:,00510415,5/30/2013,00:00.0,2013,5,30,"Chalfant, Jordan",43.8711,-69.1235,Knox,ME,DCCO,GBBG correction factor = 1.004; HEGU correction factor = 0.9882. 8 COEI/CAGO/Unknown.Location comm:,01200416,5/30/2013,00:00.0,2013,5,30,"Chalfant, Jordan",43.8711,-69.1235,Knox,ME,COEI,GBBG correction factor = 1.004; HEGU correction factor = 0.9882. 8 COEI/CAGO/Unknown.Location comm:,01590417,6/13/2013,00:00.0,2013,6,13,"Langlois, Michael",43.7686,-69.3198,Lincoln,ME,HERG,Cormorant colony on island - boat survey to prevent disturbanceLocation comm: Near Monhegan,00510418,6/13/2013,00:00.0,2013,6,13,"Langlois, Michael",43.7686,-69.3198,Lincoln,ME,GBBG,Cormorant colony on island - boat survey to prevent disturbanceLocation comm: Near Monhegan,00470419,6/13/2013,00:00.0,2013,6,13,"Langlois, Michael",43.7686,-69.3198,Lincoln,ME,COEI,Cormorant colony on island - boat survey to prevent disturbanceLocation comm: Near Monhegan,01590420,5/28/2013,00:00.0,2013,5,28,"Houston, Bob",43.7114,-70.0007,Cumberland,ME,COEI,No correction noted.Location comm:,01590421,5/28/2013,00:00.0,2013,5,28,"Houston, Bob",43.7114,-70.0007,Cumberland,ME,GBBG,No correction noted.Location comm:,00470422,5/28/2013,00:00.0,2013,5,28,"Houston, Bob",43.7114,-70.0007,Cumberland,ME,HERG,No correction noted.Location comm:,00510423,5/28/2013,00:00.0,2013,5,28,"Houston, Bob",43.7114,-70.0007,Cumberland,ME,DCCO,No correction noted.Location comm:,01200424,6/15/2013,00:00.0,2013,6,15,"Walsh, Halley",43.765,-69.9086,Cumberland,ME,COTE,A toal of 829 nests were counted with a correction of 1.083 and then the productivity plot nests were added (48) to equal the 946.  Two mink and one Black Crowned Night-Heron present. One mink capture,00700425,6/15/2013,00:00.0,2013,6,15,"Walsh, Halley",43.765,-69.9086,Cumberland,ME,ROST,"No correction noted. Two mink and one Black Crowned Night-Heron present.  One mink captured and theother left, and Heron removed.Location comm:",00720426,6/15/2013,00:00.0,2013,6,15,"Walsh, Halley",43.765,-69.9086,Cumberland,ME,LAGU,"LAGU NESTS REMOVED. No correction noted. Two mink and one Black Crowned Night-Heron present.  One mink captured and theother left, and Heron removed.  Other gulls, HEGU and GBBG were seen predating an",00580427,6/7/2013,00:00.0,2013,6,7,"Swann, Scott",44.1098,-68.4052,Hancock,ME,HERG,"Sights of mammalian, avian predators - found predated adult gulls.  Marked nests with colored popsicle sticks.  No correction.  Did not go through all the pucker brush for Eiders.Location comm:",00510428,6/7/2013,00:00.0,2013,6,7,"Swann, Scott",44.1098,-68.4052,Hancock,ME,GBBG,"Sights of mammalian, avian predators - found predated adult gulls.  Marked nests with colored popsicle sticks.  No correction.  Did not go through all the pucker brush for Eiders.Location comm:",00470429,6/7/2013,00:00.0,2013,6,7,"Swann, Scott",44.1098,-68.4052,Hancock,ME,COEI,"Sights of mammalian, avian predators - found predated adult gulls.  Marked nests with colored popsicle sticks.  No correction.  Did not go through all the pucker brush for Eiders.Location comm:",01590430,5/30/2013,00:00.0,2013,5,30,"Williams, Sarah",44.1098,-68.4052,Hancock,ME,GBBG,GBBG correction factor = 1.004; HEGU correction factor = 0.9882.Location comm:,00470431,5/30/2013,00:00.0,2013,5,30,"Williams, Sarah",44.1098,-68.4052,Hancock,ME,HERG,GBBG correction factor = 1.004; HEGU correction factor = 0.9882.Location comm:,00510432,5/30/2013,00:00.0,2013,5,30,"Williams, Sarah",44.1098,-68.4052,Hancock,ME,DCCO,GBBG correction factor = 1.004; HEGU correction factor = 0.9882.Location comm:,01200433,5/30/2013,00:00.0,2013,5,30,"Chalfant, Jordan",43.93,-69.3883,Lincoln,ME,GBBG,GBBG correction factor = 1.004; HEGU correction factor = 0.9882.  6 CAGO.Location comm:,00470434,5/30/2013,00:00.0,2013,5,30,"Chalfant, Jordan",43.93,-69.3883,Lincoln,ME,HERG,GBBG correction factor = 1.004; HEGU correction factor = 0.9882. 6 CAGO.Location comm:,00510435,5/30/2013,00:00.0,2013,5,30,"Chalfant, Jordan",43.93,-69.3883,Lincoln,ME,DCCO,GBBG correction factor = 1.004; HEGU correction factor = 0.9882. 6 CAGO.Location comm:,01200436,5/30/2013,00:00.0,2013,5,30,"Chalfant, Jordan",43.93,-69.3883,Lincoln,ME,CANG,GBBG correction factor = 1.004; HEGU correction factor = 0.9882. 6 CAGO.Location comm:,01720437,5/31/2013,00:00.0,2013,5,31,"Chalfant, Jordan",44.4437,-67.8233,Washington,ME,GBBG,GBBG correction factor = 1.004; HEGU correction factor = 0.9882.Location comm:,00470438,5/31/2013,00:00.0,2013,5,31,"Chalfant, Jordan",44.4437,-67.8233,Washington,ME,HERG,GBBG correction factor = 1.004; HEGU correction factor = 0.9882.Location comm:,00510439,5/31/2013,00:00.0,2013,5,31,"Chalfant, Jordan",44.4437,-67.8233,Washington,ME,DCCO,GBBG correction factor = 1.004; HEGU correction factor = 0.9882.Location comm:,01200440,5/28/2013,00:00.0,2013,5,28,"Chalfant, Jordan",43.648,-70.1223,Cumberland,ME,GBBG,GBBG Corecction factor = 1.004; HEGU correction factor = 0.9882.Location comm:,00470441,5/28/2013,00:00.0,2013,5,28,"Chalfant, Jordan",43.648,-70.1223,Cumberland,ME,HERG,GBBG Corecction factor = 1.004; HEGU correction factor = 0.9882.Location comm:,00510442,5/28/2013,00:00.0,2013,5,28,"Chalfant, Jordan",43.648,-70.1223,Cumberland,ME,DCCO,GBBG Corecction factor = 1.004; HEGU correction factor = 0.9882.Location comm:,01200443,5/30/2013,00:00.0,2013,5,30,"Chalfant, Jordan",43.9041,-69.0093,Knox,ME,GBBG,GBBG correction factor = 1.004; HEGU correction factor = 0.9882.Location comm:,00470444,5/30/2013,00:00.0,2013,5,30,"Chalfant, Jordan",43.9041,-69.0093,Knox,ME,HERG,GBBG correction factor = 1.004; HEGU correction factor = 0.9882.Location comm:,00510445,5/30/2013,00:00.0,2013,5,30,"Chalfant, Jordan",43.9041,-69.0093,Knox,ME,DCCO,GBBG correction factor = 1.004; HEGU correction factor = 0.9882.Location comm:,01200446,5/31/2013,00:00.0,2013,5,31,"Benedict, Brian",44.5807,-67.3554,Washington,ME,GBBG,GBBG correction factor = 1.004; HEGU correction factor = 0.9882.  22 PARIS OF GEESE.Location comm:,00470447,5/31/2013,00:00.0,2013,5,31,"Benedict, Brian",44.5807,-67.3554,Washington,ME,HERG,GBBG correction factor = 1.004; HEGU correction factor = 0.9882.  22 PARIS OF GEESE.Location comm:,00510448,5/31/2013,00:00.0,2013,5,31,"Benedict, Brian",44.5807,-67.3554,Washington,ME,DCCO,GBBG correction factor = 1.004; HEGU correction factor = 0.9882.  22 PARIS OF GEESE.Location comm:,01200449,5/31/2013,00:00.0,2013,5,31,"Benedict, Brian",44.5807,-67.3554,Washington,ME,CANG,GBBG correction factor = 1.004; HEGU correction factor = 0.9882.  22 PARIS OF GEESE.Location comm:,01720450,6/6/2013,00:00.0,2013,6,6,"Williams, Sarah",44.5704,-67.3655,Washington,ME,HERG,"8 gull nests obscured by vegetation.  Partial island count 15/33 acres surveyed (55% of isalnd).  Found 71 empty gill nests, 3 predated.  Mink seen on island.  Visual count of adults in unserveyed por",00510451,6/6/2013,00:00.0,2013,6,6,"Williams, Sarah",44.5704,-67.3655,Washington,ME,GBBG,"8 gull nests obscured by vegetation.  Partial island count 15/33 acres surveyed (55% of isalnd).  Found 71 empty gill nests, 3 predated.  Mink seen on island.  Visual count of adults in unserveyed por",00470452,5/31/2013,00:00.0,2013,5,31,"Schauffler, Rick",44.5704,-67.3655,Washington,ME,GBBG,GBBG correction factor = 1.004; HEGU correction factor = 0.9882.Location comm:,00470453,5/31/2013,00:00.0,2013,5,31,"Schauffler, Rick",44.5704,-67.3655,Washington,ME,HERG,GBBG correction factor = 1.004; HEGU correction factor = 0.9882.Location comm:,00510454,5/31/2013,00:00.0,2013,5,31,"Schauffler, Rick",44.5704,-67.3655,Washington,ME,DCCO,GBBG correction factor = 1.004; HEGU correction factor = 0.9882.Location comm:,01200455,5/28/2013,00:00.0,2013,5,28,"Houston, Bob",43.7328,-70.0509,Cumberland,ME,COEI,No correction noted.Location comm:,01590456,5/28/2013,00:00.0,2013,5,28,"Houston, Bob",43.7328,-70.0509,Cumberland,ME,GBBG,No correction noted.Location comm:,00470457,5/28/2013,00:00.0,2013,5,28,"Houston, Bob",43.7328,-70.0509,Cumberland,ME,HERG,No correction noted.Location comm:,00510458,5/28/2013,00:00.0,2013,5,28,"Houston, Bob",43.7328,-70.0509,Cumberland,ME,DCCO,No correction noted.Location comm:,01200459,5/28/2013,00:00.0,2013,5,28,"Chalfant, Jordan",43.7328,-70.0509,Cumberland,ME,GBBG,GBBG Corecction factor = 1.004; HEGU correction factor = 0.9882.  22 CAGOLocation comm:,00470460,5/28/2013,00:00.0,2013,5,28,"Chalfant, Jordan",43.7328,-70.0509,Cumberland,ME,HERG,GBBG Corecction factor = 1.004; HEGU correction factor = 0.9882.  22 CAGOLocation comm:,00510461,5/28/2013,00:00.0,2013,5,28,"Chalfant, Jordan",43.7328,-70.0509,Cumberland,ME,DCCO,GBBG Corecction factor = 1.004; HEGU correction factor = 0.9882.  22 CAGOLocation comm:,01200462,5/28/2013,00:00.0,2013,5,28,"Chalfant, Jordan",43.7328,-70.0509,Cumberland,ME,CANG,GBBG Corecction factor = 1.004; HEGU correction factor = 0.9882.  22 CAGOLocation comm:,01720463,5/30/2013,00:00.0,2013,5,30,"Schauffler, Rick",44.0077,-68.773,Knox,ME,GBBG,GBBG correction factor = 1.004; HEGU correction factor = 0.9882.Location comm:,00470464,5/30/2013,00:00.0,2013,5,30,"Schauffler, Rick",44.0077,-68.773,Knox,ME,HERG,GBBG correction factor = 1.004; HEGU correction factor = 0.9882.Location comm:,00510465,5/30/2013,00:00.0,2013,5,30,"Schauffler, Rick",44.0077,-68.773,Knox,ME,DCCO,GBBG correction factor = 1.004; HEGU correction factor = 0.9882.Location comm:,01200466,6/19/2013,00:00.0,2013,6,19,"Anderson, John",44.1742,-68.2446,Hancock,ME,HERG,"reliability code of three because lot of chicks hatched out already.  31 empty gull nests additionally, pluss 1 predated mature COEI + 1 predated mature HEGU.  COEI only recorded as we stumbled across",00510467,6/19/2013,00:00.0,2013,6,19,"Anderson, John",44.1742,-68.2446,Hancock,ME,GBBG,"reliability code of three because lot of chicks hatched out already.  31 empty gull nests additionally, pluss 1 predated mature COEI + 1 predated mature HEGU.  COEI only recorded as we stumbled across",00470468,6/19/2013,00:00.0,2013,6,19,"Anderson, John",44.1742,-68.2446,Hancock,ME,COEI,"reliability code of three because lot of chicks hatched out already.  31 empty gull nests additionally, pluss 1 predated mature COEI + 1 predated mature HEGU.  COEI only recorded as we stumbled across",01590469,6/19/2013,00:00.0,2013,6,19,"Anderson, John",44.1742,-68.2446,Hancock,ME,DCCO,"reliability code of three because lot of chicks hatched out already.  31 empty gull nests additionally, pluss 1 predated mature COEI + 1 predated mature HEGU.  COEI only recorded as we stumbled across",01200470,5/30/2013,00:00.0,2013,5,30,"Langlois, Michael",44.1742,-68.2446,Hancock,ME,GBBG,GBBG correction factor = 1.004; HEGU correction factor = 0.9882.Location comm:,00470471,5/30/2013,00:00.0,2013,5,30,"Langlois, Michael",44.1742,-68.2446,Hancock,ME,HERG,GBBG correction factor = 1.004; HEGU correction factor = 0.9882.Location comm:,00510472,5/30/2013,00:00.0,2013,5,30,"Langlois, Michael",44.1742,-68.2446,Hancock,ME,DCCO,GBBG correction factor = 1.004; HEGU correction factor = 0.9882.Location comm:,01200473,5/28/2013,00:00.0,2013,5,28,"Schauffler, Rick",43.8548,-69.3404,Knox,ME,GBBG,GBBG correction factor = 1.004; HEGU correction factor = 0.9882.Location comm:,00470474,5/28/2013,00:00.0,2013,5,28,"Schauffler, Rick",43.8548,-69.3404,Knox,ME,HERG,GBBG correction factor = 1.004; HEGU correction factor = 0.9882.Location comm:,00510475,5/28/2013,00:00.0,2013,5,28,"Schauffler, Rick",43.8548,-69.3404,Knox,ME,DCCO,GBBG correction factor = 1.004; HEGU correction factor = 0.9882.Location comm:,01200476,5/30/2013,00:00.0,2013,5,30,"Chalfant, Jordan",43.9143,-69.0346,Knox,ME,GBBG,GBBG correction factor = 1.004; HEGU correction factor = 0.9882.Location comm:,00470477,5/30/2013,00:00.0,2013,5,30,"Chalfant, Jordan",43.9143,-69.0346,Knox,ME,HERG,GBBG correction factor = 1.004; HEGU correction factor = 0.9882.Location comm:,00510478,5/30/2013,00:00.0,2013,5,30,"Chalfant, Jordan",43.9143,-69.0346,Knox,ME,DCCO,GBBG correction factor = 1.004; HEGU correction factor = 0.9882.Location comm:,01200479,5/30/2013,00:00.0,2013,5,30,"Chalfant, Jordan",43.8716,-69.1215,Knox,ME,GBBG,GBBG correction factor = 1.004; HEGU correction factor = 0.9882.Location comm:,00470480,5/30/2013,00:00.0,2013,5,30,"Chalfant, Jordan",43.8716,-69.1215,Knox,ME,HERG,GBBG correction factor = 1.004; HEGU correction factor = 0.9882.Location comm:,00510481,5/30/2013,00:00.0,2013,5,30,"Chalfant, Jordan",43.8716,-69.1215,Knox,ME,DCCO,GBBG correction factor = 1.004; HEGU correction factor = 0.9882.Location comm:,01200482,5/28/2013,00:00.0,2013,5,28,"Chalfant, Jordan",43.7092,-70.0314,Cumberland,ME,GBBG,GBBG Corecction factor = 1.004; HEGU correction factor = 0.9882.Location comm:,00470483,5/28/2013,00:00.0,2013,5,28,"Chalfant, Jordan",43.7092,-70.0314,Cumberland,ME,HERG,GBBG Corecction factor = 1.004; HEGU correction factor = 0.9882.Location comm:,00510484,5/28/2013,00:00.0,2013,5,28,"Chalfant, Jordan",43.7092,-70.0314,Cumberland,ME,DCCO,GBBG Corecction factor = 1.004; HEGU correction factor = 0.9882.Location comm:,01200485,6/15/2013,00:00.0,2013,6,15,"Anderson, John",44.0373,-68.5724,Knox,ME,HERG,"Additional 54 empty gull nests, 4 empty COEI, 13 Empty DCCO.  Predated: 1 adult COEI, 1 mature HEGU, 1 Mature BLGU.  BLGU + COEI recorded within gull count.  Totoal should be considered  minimums.  Gu",00510486,6/15/2013,00:00.0,2013,6,15,"Anderson, John",44.0373,-68.5724,Knox,ME,GBBG,"Additional 54 empty gull nests, 4 empty COEI, 13 Empty DCCO.  Predated: 1 adult COEI, 1 mature HEGU, 1 Mature BLGU.  BLGU + COEI recorded within gull count.  Totoal should be considered  minimums.  Gu",00470487,6/15/2013,00:00.0,2013,6,15,"Anderson, John",44.0373,-68.5724,Knox,ME,COEI,"Additional 54 empty gull nests, 4 empty COEI, 13 Empty DCCO.  Predated: 1 adult COEI, 1 mature HEGU, 1 Mature BLGU.  BLGU + COEI recorded within gull count.  Totoal should be considered  minimums.  Gu",01590488,6/15/2013,00:00.0,2013,6,15,"Anderson, John",44.0373,-68.5724,Knox,ME,DCCO,"Additional 54 empty gull nests, 4 empty COEI, 13 Empty DCCO.  Predated: 1 adult COEI, 1 mature HEGU, 1 Mature BLGU.  BLGU + COEI recorded within gull count.  Totoal should be considered  minimums.  Gu",01200489,6/15/2013,00:00.0,2013,6,15,"Anderson, John",44.0373,-68.5724,Knox,ME,BLGU,"Additional 54 empty gull nests, 4 empty COEI, 13 Empty DCCO.  Predated: 1 adult COEI, 1 mature HEGU, 1 Mature BLGU.  BLGU + COEI recorded within gull count.  Totoal should be considered  minimums.  Gu",00270490,5/30/2013,00:00.0,2013,5,30,"Chalfant, Jordan",44.0373,-68.5724,Knox,ME,GBBG,GBBG correction factor = 1.004; HEGU correction factor = 0.9882.Location comm:,00470491,5/30/2013,00:00.0,2013,5,30,"Chalfant, Jordan",44.0373,-68.5724,Knox,ME,HERG,GBBG correction factor = 1.004; HEGU correction factor = 0.9882.Location comm:,00510492,5/30/2013,00:00.0,2013,5,30,"Chalfant, Jordan",44.0373,-68.5724,Knox,ME,DCCO,GBBG correction factor = 1.004; HEGU correction factor = 0.9882.Location comm:,01200493,5/30/2013,00:00.0,2013,5,30,"Mittelhauser, Glen",43.9651,-69.0782,Knox,ME,GBBG,GBBG correction factor = 1.004; HEGU correction factor = 0.9882.Location comm:,00470494,5/30/2013,00:00.0,2013,5,30,"Mittelhauser, Glen",43.9651,-69.0782,Knox,ME,HERG,GBBG correction factor = 1.004; HEGU correction factor = 0.9882.Location comm:,00510495,5/30/2013,00:00.0,2013,5,30,"Mittelhauser, Glen",43.9651,-69.0782,Knox,ME,DCCO,GBBG correction factor = 1.004; HEGU correction factor = 0.9882.Location comm:,01200496,5/28/2013,00:00.0,2013,5,28,"Chalfant, Jordan",43.7584,-69.8996,Cumberland,ME,GBBG,GBBG Corecction factor = 1.004; HEGU correction factor = 0.9882.Location comm:,00470497,5/28/2013,00:00.0,2013,5,28,"Chalfant, Jordan",43.7584,-69.8996,Cumberland,ME,HERG,GBBG Corecction factor = 1.004; HEGU correction factor = 0.9882.Location comm:,00510498,5/28/2013,00:00.0,2013,5,28,"Houston, Bob",43.7584,-69.8996,Cumberland,ME,COEI,No correction noted.  Didn't count from ground because of DCCO colony.Location comm:,01590499,5/28/2013,00:00.0,2013,5,28,"Houston, Bob",43.7584,-69.8996,Cumberland,ME,GBBG,No correction noted.  Didn't count from ground because of DCCO colony.Location comm:,00470500,5/28/2013,00:00.0,2013,5,28,"Houston, Bob",43.7584,-69.8996,Cumberland,ME,HERG,No correction noted.  Didn't count from ground because of DCCO colony.Location comm:,00510501,5/28/2013,00:00.0,2013,5,28,"Houston, Bob",43.7584,-69.8996,Cumberland,ME,DCCO,No correction noted.  Didn't count from ground because of DCCO colony.Location comm:,01200502,5/28/2013,00:00.0,2013,5,28,"Chalfant, Jordan",43.7584,-69.8996,Cumberland,ME,DCCO,GBBG Corecction factor = 1.004; HEGU correction factor = 0.9882.Location comm:,01200503,5/28/2013,00:00.0,2013,5,28,"Chalfant, Jordan",43.7549,-69.9009,Cumberland,ME,GBBG,GBBG Corecction factor = 1.004; HEGU correction factor = 0.9882.Location comm:,00470504,5/28/2013,00:00.0,2013,5,28,"Chalfant, Jordan",43.7549,-69.9009,Cumberland,ME,HERG,GBBG Corecction factor = 1.004; HEGU correction factor = 0.9882.Location comm:,00510505,5/28/2013,00:00.0,2013,5,28,"Chalfant, Jordan",43.7549,-69.9009,Cumberland,ME,DCCO,GBBG Corecction factor = 1.004; HEGU correction factor = 0.9882.Location comm:,01200506,5/30/2013,00:00.0,2013,5,30,"Chalfant, Jordan",43.7928,-69.6758,Lincoln,ME,GBBG,GBBG correction factor = 1.004; HEGU correction factor = 0.9882.Location comm:,00470507,5/30/2013,00:00.0,2013,5,30,"Chalfant, Jordan",43.7928,-69.6758,Lincoln,ME,HERG,GBBG correction factor = 1.004; HEGU correction factor = 0.9882.Location comm:,00510508,5/30/2013,00:00.0,2013,5,30,"Chalfant, Jordan",43.7928,-69.6758,Lincoln,ME,DCCO,GBBG correction factor = 1.004; HEGU correction factor = 0.9882.Location comm:,01200509,5/31/2013,00:00.0,2013,5,31,"Mittelhauser, Glen",42.9823,-70.6123,York,ME,GBBG,GBBG correction factor = 1.004; HEGU correction factor = 0.9882.Location comm:,00470510,5/31/2013,00:00.0,2013,5,31,"Mittelhauser, Glen",42.9823,-70.6123,York,ME,HERG,GBBG correction factor = 1.004; HEGU correction factor = 0.9882.Location comm:,00510511,5/31/2013,00:00.0,2013,5,31,"Mittelhauser, Glen",42.9823,-70.6123,York,ME,DCCO,GBBG correction factor = 1.004; HEGU correction factor = 0.9882.Location comm:,01200512,5/30/2013,00:00.0,2013,5,30,"Benedict, Brian",44.1093,-68.6935,Knox,ME,GBBG,GBBG correction factor = 1.004; HEGU correction factor = 0.9882.Location comm:,00470513,5/30/2013,00:00.0,2013,5,30,"Benedict, Brian",44.1093,-68.6935,Knox,ME,HERG,GBBG correction factor = 1.004; HEGU correction factor = 0.9882.Location comm:,00510514,5/30/2013,00:00.0,2013,5,30,"Benedict, Brian",44.1093,-68.6935,Knox,ME,DCCO,GBBG correction factor = 1.004; HEGU correction factor = 0.9882.Location comm:,01200515,6/6/2013,00:00.0,2013,6,6,"Mittelhauser, Glen",44.4462,-67.6029,Washington,ME,GBBG,2 roosting GBBs' - no nesting suspected.Location comm:,00470516,6/6/2013,00:00.0,2013,6,6,"Mittelhauser, Glen",44.4462,-67.6029,Washington,ME,HERG,2 roosting GBBs' - no nesting suspected.Location comm:,00510517,5/30/2013,00:00.0,2013,5,30,"Allen, Brad",44.0363,-69.0417,Knox,ME,GBBG,GBBG correction factor = 1.004; HEGU correction factor = 0.9882.Location comm:,00470518,5/30/2013,00:00.0,2013,5,30,"Allen, Brad",44.0363,-69.0417,Knox,ME,HERG,GBBG correction factor = 1.004; HEGU correction factor = 0.9882.Location comm:,00510519,5/30/2013,00:00.0,2013,5,30,"Allen, Brad",44.0363,-69.0417,Knox,ME,DCCO,GBBG correction factor = 1.004; HEGU correction factor = 0.9882.Location comm:,01200520,6/15/2013,00:00.0,2013,6,15,"Anderson, John",44.1201,-68.5723,Knox,ME,HERG,cannot extrapolate number of nests from single bird count in boat.Location comm:,00510521,6/15/2013,00:00.0,2013,6,15,"Anderson, John",44.1201,-68.5723,Knox,ME,GBBG,cannot extrapolate number of nests from single bird count in boat.Location comm:,00470522,6/15/2013,00:00.0,2013,6,15,"Anderson, John",44.1201,-68.5723,Knox,ME,DCCO,cannot extrapolate number of nests from single bird count in boat.Location comm:,01200523,5/30/2013,00:00.0,2013,5,30,"Williams, Sarah",44.1201,-68.5723,Knox,ME,GBBG,GBBG correction factor = 1.004; HEGU correction factor = 0.9882.Location comm:,00470524,5/30/2013,00:00.0,2013,5,30,"Williams, Sarah",44.1201,-68.5723,Knox,ME,HERG,GBBG correction factor = 1.004; HEGU correction factor = 0.9882.Location comm:,00510525,5/30/2013,00:00.0,2013,5,30,"Williams, Sarah",44.1201,-68.5723,Knox,ME,DCCO,GBBG correction factor = 1.004; HEGU correction factor = 0.9882.Location comm:,01200526,6/15/2013,00:00.0,2013,6,15,"Anderson, John",44.0979,-68.4875,Hancock,ME,HERG,Additional 27 empty gull nests + 2 COEI nests.  COEI counted within gull survey.  Gulls: N/0.85 for missed nests.Location comm:,00510527,6/15/2013,00:00.0,2013,6,15,"Anderson, John",44.0979,-68.4875,Hancock,ME,GBBG,Additional 27 empty gull nests + 2 COEI nests.  COEI counted within gull survey.  Gulls: N/0.85 for missed nests.Location comm:,00470528,6/15/2013,00:00.0,2013,6,15,"Anderson, John",44.0979,-68.4875,Hancock,ME,COEI,Additional 27 empty gull nests + 2 COEI nests.  COEI counted within gull survey.  Gulls: N/0.85 for missed nests.Location comm:,01590529,6/15/2013,00:00.0,2013,6,15,"Anderson, John",44.0979,-68.4875,Hancock,ME,DCCO,Additional 27 empty gull nests + 2 COEI nests.  COEI counted within gull survey.  Gulls: N/0.85 for missed nests.Location comm:,01200530,5/30/2013,00:00.0,2013,5,30,"Williams, Sarah",44.0979,-68.4875,Hancock,ME,GBBG,GBBG correction factor = 1.004; HEGU correction factor = 0.9882.Location comm:,00470531,5/30/2013,00:00.0,2013,5,30,"Williams, Sarah",44.0979,-68.4875,Hancock,ME,HERG,GBBG correction factor = 1.004; HEGU correction factor = 0.9882.Location comm:,00510532,5/30/2013,00:00.0,2013,5,30,"Williams, Sarah",44.0979,-68.4875,Hancock,ME,DCCO,GBBG correction factor = 1.004; HEGU correction factor = 0.9882.Location comm:,01200533,6/17/2013,00:00.0,2013,6,17,"Mayer, Frank",43.7851,-68.8542,Knox,ME,ARTE,The sampling period was for three days from JUN 15-17.  Lincoln index factor was 1.027.Location comm:,00710534,6/17/2013,00:00.0,2013,6,17,"Mayer, Frank",43.7851,-68.8542,Knox,ME,COTE,The sampling period was for three days from JUN 15-17.  Lincoln index factor was 1.027.Location comm:,00700535,6/17/2013,00:00.0,2013,6,17,"Mayer, Frank",43.7851,-68.8542,Knox,ME,LAGU,"We destroyed 114 LAGU nests prior to censusin areas where they nested close to terns.  All eggs destroyed to prevent hatching bringing total number of nests destroyed to  693, and an additional 99 re-",00580536,6/17/2013,00:00.0,2013,6,17,"Mayer, Frank",43.7851,-68.8542,Knox,ME,HERG,6 HEGUand 2 GBBG were killed.Location comm:,00510537,6/17/2013,00:00.0,2013,6,17,"Mayer, Frank",43.7851,-68.8542,Knox,ME,GBBG,6 HEGUand 2 GBBG were killed.Location comm:,00470538,NULL,,2013,NULL,NULL,"Mayer, Frank",43.7851,-68.8542,Knox,ME,ATPU,"Poor productivity noted and the nest number docuemented are for the study nests, not population.Location comm:",00130539,NULL,,2013,NULL,NULL,"Mayer, Frank",43.7851,-68.8542,Knox,ME,RAZO,"The nest number docuemented are for the productivity study nests, not population.Location comm:",00320540,NULL,,2013,NULL,NULL,"Mayer, Frank",43.7851,-68.8542,Knox,ME,LESP,"The nest number docuemented are for the productivity study nests, not population.Location comm:",01060541,5/30/2013,00:00.0,2013,5,30,"Allen, Brad",44.0631,-68.9315,Knox,ME,GBBG,GBBG correction factor = 1.004; HEGU correction factor = 0.9882.Location comm:,00470542,5/30/2013,00:00.0,2013,5,30,"Allen, Brad",44.0631,-68.9315,Knox,ME,HERG,GBBG correction factor = 1.004; HEGU correction factor = 0.9882.Location comm:,00510543,5/30/2013,00:00.0,2013,5,30,"Allen, Brad",44.0631,-68.9315,Knox,ME,DCCO,GBBG correction factor = 1.004; HEGU correction factor = 0.9882.Location comm:,01200544,5/30/2013,00:00.0,2013,5,30,"Chalfant, Jordan",43.8616,-69.1336,Knox,ME,GBBG,GBBG correction factor = 1.004; HEGU correction factor = 0.9882.Location comm:,00470545,5/30/2013,00:00.0,2013,5,30,"Chalfant, Jordan",43.8616,-69.1336,Knox,ME,HERG,GBBG correction factor = 1.004; HEGU correction factor = 0.9882.Location comm:,00510546,5/30/2013,00:00.0,2013,5,30,"Chalfant, Jordan",43.8616,-69.1336,Knox,ME,DCCO,GBBG correction factor = 1.004; HEGU correction factor = 0.9882.Location comm:,01200547,6/19/2013,00:00.0,2013,6,19,"Langlois, Michael",43.8849,-69.1259,Knox,ME,COTE,"20 ARTE nested in South cove.  Birds from South end of Metinic not reported here. COTE/ARTE species ratio determined via subsample of colony.  Visual identif. of adults tending nests (64% COTE, 37% AR",00700548,6/19/2013,00:00.0,2013,6,19,"Langlois, Michael",43.8849,-69.1259,Knox,ME,ARTE,"20 ARTE nested in South cove.  Birds from South end of Metinic not reported here. COTE/ARTE species ratio determined via subsample of colony.  Visual identif. of adults tending nests (64% COTE, 37% AR",00710549,8/23/2013,00:00.0,2013,8,23,"Mittelhauser, Glen",43.8849,-69.1259,Knox,ME,BLGU,Slowly followed shoreline to find burrows.  Less than 1/2 had chicks in them although all were loaded with guano suggesting chick was recently fledged.Location comm: Only the southern private portion,00270550,6/4/2013,00:00.0,2013,6,4,"Mittelhauser, Glen",43.8849,-69.1259,Knox,ME,HERG,Note: there were 86 gull nests found that may have been active later in the year.  Thus 400 HEGU may be better estimate.  Relied first on observation- second on egg ring if we weren't 100% sure.  Corr,00510551,6/4/2013,00:00.0,2013,6,4,"Mittelhauser, Glen",43.8849,-69.1259,Knox,ME,GBBG,Note: there were 86 gull nests found that may have been active later in the year.  Thus 400 HEGU may be better estimate.  Relied first on observation- second on egg ring if we weren't 100% sure.  Corr,00470552,6/4/2013,00:00.0,2013,6,4,"Mittelhauser, Glen",43.8849,-69.1259,Knox,ME,COEI,Note: there were 86 gull nests found that may have been active later in the year.  Thus 400 HEGU may be better estimate.  Relied first on observation- second on egg ring if we weren't 100% sure.  Corr,01590553,6/4/2013,00:00.0,2013,6,4,"Mittelhauser, Glen",43.8849,-69.1259,Knox,ME,MALL,Note: there were 86 gull nests found that may have been active later in the year.  Thus 400 HEGU may be better estimate. Relied first on observation- second on egg ring if we weren't 100% sure.  Corre,01320554,6/19/2013,00:00.0,2013,6,19,"Beich, Amy",43.8849,-69.1259,Knox,ME,COTE,No correction noted that made sense.Location comm:,00700555,6/19/2013,00:00.0,2013,6,19,"Beich, Amy",43.8849,-69.1259,Knox,ME,ARTE,No correction noted that made sense.Location comm:,00710556,6/19/2013,00:00.0,2013,6,19,"Beich, Amy",43.8849,-69.1259,Knox,ME,HERG,No correction noted.  138 HEGU and 2 GBBG nests were found on the North End of the island and destroyed.  A total of 5 HEGU and 1 GBBG were killed.  38 garter snaked were removed.  Blad Eagles success,00510557,NULL,,2013,NULL,NULL,"Beich, Amy",43.8849,-69.1259,Knox,ME,GBBG,No correction noted.  138 HEGU and 2 GBBG nests were found on the North End of the island and destroyed.  A total of 5 HEGU and 1 GBBG were killed.  38 garter snaked were removed.  Blad Eagles success,00470558,NULL,,2013,NULL,NULL,"Beich, Amy",43.8849,-69.1259,Knox,ME,BLGU,"No correction noted.  ""We monitored 42 Guillemot nests..""; therefore, this is an incomplete count and the nuber presented are for the study conducted.Location comm:",00270710,5/30/2013,00:00.0,2013,5,30,"Mittelhauser, Glen",44.1624,-68.9787,Knox,ME,HERG,GBBG correction factor = 1.004; HEGU correction factor = 0.9882.Location comm:,00510559,NULL,,2013,NULL,NULL,"Beich, Amy",43.8849,-69.1259,Knox,ME,LESP,"No correction noted. ""We marked 69 Leache's Storm-petrel burrows early in the season based on calls.  However, we were only able to fins 6 active burrows (containing an adult, egg or chick) during our",01060560,5/30/2013,00:00.0,2013,5,30,"Chalfant, Jordan",43.8849,-69.1259,Knox,ME,GBBG,GBBG correction factor = 1.004; HEGU correction factor = 0.9882.  5 COEI/CAGO/Unknown; plus 1 BAEA on next in the forest.Location comm:,00470561,5/30/2013,00:00.0,2013,5,30,"Chalfant, Jordan",43.8849,-69.1259,Knox,ME,HERG,GBBG correction factor = 1.004; HEGU correction factor = 0.9882.  5 COEI/CAGO/Unknown; plus 1 BAEA on next in the forest.Location comm:,00510562,5/30/2013,00:00.0,2013,5,30,"Chalfant, Jordan",43.8849,-69.1259,Knox,ME,DCCO,GBBG correction factor = 1.004; HEGU correction factor = 0.9882.  5 COEI/CAGO/Unknown; plus 1 BAEA on next in the forest.Location comm:,01200563,5/30/2013,00:00.0,2013,5,30,"Chalfant, Jordan",43.8849,-69.1259,Knox,ME,COEI,GBBG correction factor = 1.004; HEGU correction factor = 0.9882.  5 COEI/CAGO/Unknown; plus 1 BAEA on next in the forest.Location comm:,01590564,5/28/2013,00:00.0,2013,5,28,"Chalfant, Jordan",43.8467,-69.6959,Sagadahoc,ME,GBBG,GBBG correction factor = 1.004; HEGU correction factor = 0.9882.  2 loafing terns and 5 eiders roosting.Location comm:,00470565,5/30/2013,00:00.0,2013,5,30,"Chalfant, Jordan",43.8467,-69.6959,Sagadahoc,ME,HERG,GBBG correction factor = 1.004; HEGU correction factor = 0.9882.  2 loafing terns and 5 eiders roosting.Location comm:,00510566,5/30/2013,00:00.0,2013,5,30,"Chalfant, Jordan",43.8467,-69.6959,Sagadahoc,ME,DCCO,GBBG correction factor = 1.004; HEGU correction factor = 0.9882.  2 loafing terns and 5 eiders roosting.Location comm:,01200567,5/30/2013,00:00.0,2013,5,30,"Chalfant, Jordan",43.8467,-69.6959,Sagadahoc,ME,COEI,GBBG correction factor = 1.004; HEGU correction factor = 0.9882.  2 loafing terns and 5 eiders roosting.Location comm:,01590568,5/30/2013,00:00.0,2013,5,30,"Chalfant, Jordan",44.1989,-68.9424,Knox,ME,GBBG,GBBG correction factor = 1.004; HEGU correction factor = 0.9882.Location comm:,00470569,5/30/2013,00:00.0,2013,5,30,"Chalfant, Jordan",44.1989,-68.9424,Knox,ME,HERG,GBBG correction factor = 1.004; HEGU correction factor = 0.9882.Location comm:,00510570,5/30/2013,00:00.0,2013,5,30,"Chalfant, Jordan",44.1989,-68.9424,Knox,ME,DCCO,GBBG correction factor = 1.004; HEGU correction factor = 0.9882.Location comm:,01200571,5/30/2013,00:00.0,2013,5,30,"Mittelhauser, Glen",44.0952,-68.6234,Knox,ME,GBBG,GBBG correction factor = 1.004; HEGU correction factor = 0.9882.Location comm:,00470572,5/30/2013,00:00.0,2013,5,30,"Mittelhauser, Glen",44.0952,-68.6234,Knox,ME,HERG,GBBG correction factor = 1.004; HEGU correction factor = 0.9882.Location comm:,00510573,5/30/2013,00:00.0,2013,5,30,"Mittelhauser, Glen",44.0952,-68.6234,Knox,ME,DCCO,GBBG correction factor = 1.004; HEGU correction factor = 0.9882.Location comm:,01200574,6/14/2013,00:00.0,2013,6,14,"Anderson, John",43.9736,-68.1276,uncertain,ME,HERG,No correction needed with confirmation via followup work in colony.Location comm: approx. 18nm south of southern Mount Desert Island.,00510575,6/14/2013,00:00.0,2013,6,14,"Anderson, John",43.9736,-68.1276,uncertain,ME,GBBG,No correction needed with confirmation via followup work in colony.Location comm: approx. 18nm south of southern Mount Desert Island.,00470576,6/14/2013,00:00.0,2013,6,14,"Anderson, John",43.9736,-68.1276,uncertain,ME,COEI,No correction needed with confirmation via followup work in colony.Location comm: approx. 18nm south of southern Mount Desert Island.,01590711,5/30/2013,00:00.0,2013,5,30,"Mittelhauser, Glen",44.1624,-68.9787,Knox,ME,DCCO,GBBG correction factor = 1.004; HEGU correction factor = 0.9882.Location comm:,01200577,6/5/2013,00:00.0,2013,6,5,"Williams, Sarah",44.4641,-67.7455,Washington,ME,HERG,"Sheep grazed island no nests obscured by vegetation, 59 empty gull nests,2 eider nests predated, 8 eider carcasses found.  No correctioin.Location comm:",00510578,6/5/2013,00:00.0,2013,6,5,"Williams, Sarah",44.4641,-67.7455,Washington,ME,GBBG,"Sheep grazed island no nests obscured by vegetation, 59 empty gull nests,2 eider nests predated, 8 eider carcasses found.  No correctioin.Location comm:",00470579,6/5/2013,00:00.0,2013,6,5,"Williams, Sarah",44.4641,-67.7455,Washington,ME,COEI,"Sheep grazed island no nests obscured by vegetation, 59 empty gull nests,2 eider nests predated, 8 eider carcasses found.  No correctioin.Location comm:",01590580,5/31/2013,00:00.0,2013,5,31,"Chalfant, Jordan",44.4641,-67.7455,Washington,ME,GBBG,GBBG correction factor = 1.004; HEGU correction factor = 0.9882.  19 CANADA GEESE.Location comm:,00470581,5/31/2013,00:00.0,2013,5,31,"Chalfant, Jordan",44.4641,-67.7455,Washington,ME,HERG,GBBG correction factor = 1.004; HEGU correction factor = 0.9882.  19 CANADA GEESE.Location comm:,00510582,5/31/2013,00:00.0,2013,5,31,"Chalfant, Jordan",44.4641,-67.7455,Washington,ME,DCCO,GBBG correction factor = 1.004; HEGU correction factor = 0.9882.  19 CANADA GEESE.Location comm:,01200583,5/31/2013,00:00.0,2013,5,31,"Chalfant, Jordan",44.4641,-67.7455,Washington,ME,CANG,GBBG correction factor = 1.004; HEGU correction factor = 0.9882.  19 CANADA GEESE.Location comm:,01720584,5/28/2013,00:00.0,2013,5,28,"Mittelhauser, Glen",43.4572,-70.3416,York,ME,GBBG,GBBG correction factor = 1.004; HEGU correction factor = 0.9882.Location comm:,00470585,5/28/2013,00:00.0,2013,5,28,"Mittelhauser, Glen",43.4572,-70.3416,York,ME,GBBG,GBBG correction factor = 1.004; HEGU correction factor = 0.9882.Location comm:,00470586,5/28/2013,00:00.0,2013,5,28,"Mittelhauser, Glen",43.4572,-70.3416,York,ME,HERG,GBBG correction factor = 1.004; HEGU correction factor = 0.9882.Location comm:,00510587,5/28/2013,00:00.0,2013,5,28,"Mittelhauser, Glen",43.4572,-70.3416,York,ME,DCCO,GBBG correction factor = 1.004; HEGU correction factor = 0.9882.Location comm:,01200588,5/30/2013,00:00.0,2013,5,30,"Mittelhauser, Glen",43.8656,-69.4824,Lincoln,ME,GBBG,GBBG correction factor = 1.004; HEGU correction factor = 0.9882.Location comm:,00470589,5/30/2013,00:00.0,2013,5,30,"Mittelhauser, Glen",43.8656,-69.4824,Lincoln,ME,HERG,GBBG correction factor = 1.004; HEGU correction factor = 0.9882.Location comm:,00510590,5/30/2013,00:00.0,2013,5,30,"Mittelhauser, Glen",43.8656,-69.4824,Lincoln,ME,DCCO,GBBG correction factor = 1.004; HEGU correction factor = 0.9882.Location comm:,01200591,5/31/2013,00:00.0,2013,5,31,"Chalfant, Jordan",44.5198,-67.7593,Washington,ME,GBBG,GBBG correction factor = 1.004; HEGU correction factor = 0.9882.Location comm:,00470592,5/31/2013,00:00.0,2013,5,31,"Chalfant, Jordan",44.5198,-67.7593,Washington,ME,HERG,GBBG correction factor = 1.004; HEGU correction factor = 0.9882.Location comm:,00510593,5/31/2013,00:00.0,2013,5,31,"Chalfant, Jordan",44.5198,-67.7593,Washington,ME,DCCO,GBBG correction factor = 1.004; HEGU correction factor = 0.9882.Location comm:,01200594,5/30/2013,00:00.0,2013,5,30,"Mittelhauser, Glen",43.8841,-68.8708,Knox,ME,GBBG,GBBG correction factor = 1.004; HEGU correction factor = 0.9882.  6 large brown birds.Location comm:,00470595,5/30/2013,00:00.0,2013,5,30,"Mittelhauser, Glen",43.8841,-68.8708,Knox,ME,HERG,GBBG correction factor = 1.004; HEGU correction factor = 0.9882.  6 large brown birds.Location comm:,00510596,5/30/2013,00:00.0,2013,5,30,"Mittelhauser, Glen",43.8841,-68.8708,Knox,ME,DCCO,GBBG correction factor = 1.004; HEGU correction factor = 0.9882.  6 large brown birds.Location comm:,01200597,5/30/2013,00:00.0,2013,5,30,"Chalfant, Jordan",44.0139,-69.0766,Knox,ME,GBBG,GBBG correction factor = 1.004; HEGU correction factor = 0.9882.Location comm:,00470598,5/30/2013,00:00.0,2013,5,30,"Chalfant, Jordan",44.0139,-69.0766,Knox,ME,HERG,GBBG correction factor = 1.004; HEGU correction factor = 0.9882.Location comm:,00510599,5/30/2013,00:00.0,2013,5,30,"Chalfant, Jordan",44.0139,-69.0766,Knox,ME,DCCO,GBBG correction factor = 1.004; HEGU correction factor = 0.9882.Location comm:,01200600,5/28/2013,00:00.0,2013,5,28,"Mittelhauser, Glen",43.8782,-69.3552,Knox,ME,GBBG,GBBG correction factor = 1.004; HEGU correction factor = 0.9882.Location comm:,00470601,5/28/2013,00:00.0,2013,5,28,"Mittelhauser, Glen",43.8782,-69.3552,Knox,ME,HERG,GBBG correction factor = 1.004; HEGU correction factor = 0.9882.Location comm:,00510602,5/28/2013,00:00.0,2013,5,28,"Mittelhauser, Glen",43.8782,-69.3552,Knox,ME,DCCO,GBBG correction factor = 1.004; HEGU correction factor = 0.9882.Location comm:,01200603,5/30/2013,00:00.0,2013,5,30,"Chalfant, Jordan",43.8771,-69.356,Knox,ME,GBBG,GBBG correction factor = 1.004; HEGU correction factor = 0.9882.Location comm:,00470604,5/30/2013,00:00.0,2013,5,30,"Chalfant, Jordan",43.8771,-69.356,Knox,ME,HERG,GBBG correction factor = 1.004; HEGU correction factor = 0.9882.Location comm:,00510605,5/30/2013,00:00.0,2013,5,30,"Chalfant, Jordan",43.8771,-69.356,Knox,ME,DCCO,GBBG correction factor = 1.004; HEGU correction factor = 0.9882.Location comm:,01200606,5/31/2013,00:00.0,2013,5,31,"Benedict, Brian",44.6193,-67.2366,Washington,ME,GBBG,GBBG correction factor = 1.004; HEGU correction factor = 0.9882.  23 RAZO.Location comm:,00470607,5/31/2013,00:00.0,2013,5,31,"Benedict, Brian",44.6193,-67.2366,Washington,ME,HERG,GBBG correction factor = 1.004; HEGU correction factor = 0.9882. 23 RAZO.Location comm:,00510608,5/31/2013,00:00.0,2013,5,31,"Benedict, Brian",44.6193,-67.2366,Washington,ME,DCCO,GBBG correction factor = 1.004; HEGU correction factor = 0.9882. 23 RAZO.Location comm:,01200609,5/31/2013,00:00.0,2013,5,31,"Benedict, Brian",44.6193,-67.2366,Washington,ME,RAZO,GBBG correction factor = 1.004; HEGU correction factor = 0.9882. 23 RAZO.Location comm:,00320610,5/30/2013,00:00.0,2013,5,30,"Schauffler, Rick",44.0074,-68.7988,Knox,ME,GBBG,GBBG correction factor = 1.004; HEGU correction factor = 0.9882.Location comm:,00470611,5/30/2013,00:00.0,2013,5,30,"Schauffler, Rick",44.0074,-68.7988,Knox,ME,HERG,GBBG correction factor = 1.004; HEGU correction factor = 0.9882.Location comm:,00510612,5/30/2013,00:00.0,2013,5,30,"Schauffler, Rick",44.0074,-68.7988,Knox,ME,DCCO,GBBG correction factor = 1.004; HEGU correction factor = 0.9882.Location comm:,01200613,5/30/2013,00:00.0,2013,5,30,"Chalfant, Jordan",44.0217,-69.0718,Knox,ME,GBBG,GBBG correction factor = 1.004; HEGU correction factor = 0.9882.Location comm:,00470614,5/30/2013,00:00.0,2013,5,30,"Chalfant, Jordan",44.0217,-69.0718,Knox,ME,HERG,GBBG correction factor = 1.004; HEGU correction factor = 0.9882.Location comm:,00510615,5/30/2013,00:00.0,2013,5,30,"Chalfant, Jordan",44.0217,-69.0718,Knox,ME,DCCO,GBBG correction factor = 1.004; HEGU correction factor = 0.9882.Location comm:,01200616,6/17/2013,00:00.0,2013,6,17,"Pham, Catherine",43.6499,-70.1238,Cumberland,ME,COTE,Correction index of1.02.  Common Tern population may be at or near its carrying capacity for this island.Location comm:,00700617,6/17/2013,00:00.0,2013,6,17,"Pham, Catherine",43.6499,-70.1238,Cumberland,ME,ROST,"One pair of Roseate Terns appeared to be prospecting for nesting sites in early July, but no known nesting followed.Location comm:",00720618,6/17/2013,00:00.0,2013,6,17,"Pham, Catherine",43.6499,-70.1238,Cumberland,ME,ARTE,NULL,00710619,6/17/2013,00:00.0,2013,6,17,"Pham, Catherine",43.6499,-70.1238,Cumberland,ME,BLGU,"Due to the lateness of the season, total BLGU productivity for the island couldnot be determined.  Of the ten active burrows, five hatched, three failed, andatleast one was still incubating at the clo",00270620,6/17/2013,00:00.0,2013,6,17,"Pham, Catherine",43.6499,-70.1238,Cumberland,ME,COEI,NULL,01590621,5/28/2013,00:00.0,2013,5,28,"Mittelhauser, Glen",43.6499,-70.1238,Cumberland,ME,GBBG,GBBG Corecction factor = 1.004; HEGU correction factor = 0.9882.Location comm:,00470622,5/28/2013,00:00.0,2013,5,28,"Mittelhauser, Glen",43.6499,-70.1238,Cumberland,ME,HERG,GBBG Corecction factor = 1.004; HEGU correction factor = 0.9882.Location comm:,00510623,5/28/2013,00:00.0,2013,5,28,"Mittelhauser, Glen",43.6499,-70.1238,Cumberland,ME,DCCO,GBBG Corecction factor = 1.004; HEGU correction factor = 0.9882.Location comm:,01200624,6/19/2013,00:00.0,2013,6,19,"Houston, Bob",43.7828,-69.7184,Sagadahoc,ME,COTE,No correction noted.Location comm:,00700625,6/19/2013,00:00.0,2013,6,19,"Houston, Bob",43.7828,-69.7184,Sagadahoc,ME,ROST,No correction noted.Location comm:,00720626,6/19/2013,00:00.0,2013,6,19,"Houston, Bob",43.7828,-69.7184,Sagadahoc,ME,ARTE,No correction noted.Location comm:,00710627,6/19/2013,00:00.0,2013,6,19,"Houston, Bob",43.7756,-69.5855,Lincoln,ME,COTE,"No correction noted.  Also looked at 65-281, 65-282 - no terns seen.  Yellow morring ball seen high in tree snag on SE end.Location comm:",00700628,6/19/2013,00:00.0,2013,6,19,"Houston, Bob",43.7756,-69.5855,Lincoln,ME,ROST,"No correction noted.  Also looked at 65-281, 65-282 - no terns seen.  Yellow morring ball seen high in tree snag on SE end.Location comm:",00720629,6/19/2013,00:00.0,2013,6,19,"Houston, Bob",43.7756,-69.5855,Lincoln,ME,ARTE,"No correction noted.  Also looked at 65-281, 65-282 - no terns seen.  Yellow morring ball seen high in tree snag on SE end.Location comm:",00710630,5/30/2013,00:00.0,2013,5,30,"Chalfant, Jordan",43.7756,-69.5855,Lincoln,ME,GBBG,GBBG correction factor = 1.004; HEGU correction factor = 0.9882.Location comm:,00470631,5/30/2013,00:00.0,2013,5,30,"Chalfant, Jordan",43.7756,-69.5855,Lincoln,ME,HERG,GBBG correction factor = 1.004; HEGU correction factor = 0.9882.Location comm:,00510632,5/30/2013,00:00.0,2013,5,30,"Chalfant, Jordan",43.7756,-69.5855,Lincoln,ME,DCCO,GBBG correction factor = 1.004; HEGU correction factor = 0.9882.Location comm:,01200633,5/28/2013,00:00.0,2013,5,28,"Chalfant, Jordan",43.7211,-69.899,Cumberland,ME,GBBG,GBBG Corecction factor = 1.004; HEGU correction factor = 0.9882.  1 BAEALocation comm:,00470634,5/28/2013,00:00.0,2013,5,28,"Chalfant, Jordan",43.7211,-69.899,Cumberland,ME,HERG,GBBG Corecction factor = 1.004; HEGU correction factor = 0.9882.  1 BAEALocation comm:,00510712,5/30/2013,00:00.0,2013,5,30,"Welch, Linda",44.1603,-68.9781,Knox,ME,GBBG,GBBG correction factor = 1.004; HEGU correction factor = 0.9882.Location comm:,00470635,5/28/2013,00:00.0,2013,5,28,"Chalfant, Jordan",43.7211,-69.899,Cumberland,ME,DCCO,GBBG Corecction factor = 1.004; HEGU correction factor = 0.9882.  1 BAEALocation comm:,01200636,6/20/2013,00:00.0,2013,6,20,"Welch, Linda",44.3674,-67.8656,Washington,ME,LAGU,"This was a two day sample for JUN 19-20 at same time frame each day, line sweep method.  Assumed Lincoln index correction.Location comm:",00580637,6/20/2013,00:00.0,2013,6,20,"Welch, Linda",44.3674,-67.8656,Washington,ME,COEI,"This was a two day sampling period for JUN 19-20 same time frame each day, line sweep method.  Assumed Lincoln Index correction.Location comm:",01590638,6/20/2013,00:00.0,2013,6,20,"Welch, Linda",44.3674,-67.8656,Washington,ME,ROST,"This was a two day sampling period for JUN 19-20 same time frame each day, line sweep method.  Assumed Lincoln Index correction.Location comm:",00720639,6/20/2013,00:00.0,2013,6,20,"Welch, Linda",44.3674,-67.8656,Washington,ME,ATPU,"This was a two day sampling period for JUN 19-20 same time frame each day, line sweep method.  Assumed Lincoln Index correction.Location comm:",00130640,6/20/2013,00:00.0,2013,6,20,"Welch, Linda",44.3674,-67.8656,Washington,ME,BLGU,"This was a two day sampling period for JUN 19-20 same time frame each day, line sweep method.  Assumed Lincoln Index correction.Location comm:",00270641,6/20/2013,00:00.0,2013,6,20,"Welch, Linda",44.3674,-67.8656,Washington,ME,COTE,"This was a two day sampling period for JUN 19-20 same time frame each day, line sweep method.  Assumed Lincoln Index correction. COTE/ARTE spp. ratio determined via subsample visual IF of adults (57%",00700642,6/20/2013,00:00.0,2013,6,20,"Welch, Linda",44.3674,-67.8656,Washington,ME,ARTE,"This was a two day sampling period for JUN 19-20 same time frame each day, line sweep method.  Assumed Lincoln Index correction. COTE/ARTE spp. ratio determined via subsample visual IF of adults (57%",00710643,6/20/2013,00:00.0,2013,6,20,"Chalfant, Jordan",44.3674,-67.8656,Washington,ME,COTE,Sampling is noted to of occuredover two days JUN 19-20.  Lincoln index correction factor for terns is 1.05.Location comm:,00700644,6/20/2013,00:00.0,2013,6,20,"Chalfant, Jordan",44.3674,-67.8656,Washington,ME,ARTE,Sampling is noted to of occuredover two days JUN 19-20.  Lincoln index correction factor for terns is 1.05.Location comm:,00710645,6/20/2013,00:00.0,2013,6,20,"Chalfant, Jordan",44.3674,-67.8656,Washington,ME,ROST,Sampling is noted to of occuredover two days JUN 19-20.  Lincoln index correction factor for terns is 1.05.Location comm:,00720646,6/20/2013,00:00.0,2013,6,20,"Chalfant, Jordan",44.3674,-67.8656,Washington,ME,LAGU,7.5 %correction factor applied to LAGU nest counts.Location comm:,00580647,6/20/2013,00:00.0,2013,6,20,"Chalfant, Jordan",44.3674,-67.8656,Washington,ME,ATPU,No correction noted.Location comm:,00130648,6/20/2013,00:00.0,2013,6,20,"Chalfant, Jordan",44.3674,-67.8656,Washington,ME,COEI,No correction noted.Location comm:,01590649,6/20/2013,00:00.0,2013,6,20,"Chalfant, Jordan",44.3674,-67.8656,Washington,ME,RAZO,No correction noted.Location comm:,00320650,6/20/2013,00:00.0,2013,6,20,"Chalfant, Jordan",44.3674,-67.8656,Washington,ME,BLGU,No correction noted.Location comm:,00270651,5/16/2013,00:00.0,2013,5,16,"McOmber, Kristina",43.7394,-69.7707,Sagadahoc,ME,COTE,"COTE nest countwas 612 with a correction of 1.07 (655) with the addtion of study nests of 37 equal the total 692.  Predators include GBBG, HEGU, LAGU, GHOW, Peregrine.Location comm:",00700652,5/16/2013,00:00.0,2013,5,16,"McOmber, Kristina",43.7394,-69.7707,Sagadahoc,ME,ARTE,"Predators include GBBG, HEGU, LAGU, GHOW, Peregrine.  Arctic Tern nests reported to have failed. ROST had presence daily no nests recorded.Location comm:",00710653,5/16/2013,00:00.0,2013,5,16,"McOmber, Kristina",43.7394,-69.7707,Sagadahoc,ME,GBBG,"Predators include GBBG, HEGU, LAGU, GHOW, Peregrine.  GBBGnest reported to be destroyed.  Four GBBG were shot, one LAGU shot, not HEGU succesfully shot.Location comm:",00470654,5/28/2013,00:00.0,2013,5,28,"Chalfant, Jordan",43.7337,-69.9712,Cumberland,ME,GBBG,GBBG Corecction factor = 1.004; HEGU correction factor = 0.9882.  6 CAGO.Location comm:,00470655,5/28/2013,00:00.0,2013,5,28,"Chalfant, Jordan",43.7337,-69.9712,Cumberland,ME,HERG,GBBG Corecction factor = 1.004; HEGU correction factor = 0.9882.  6 CAGO.Location comm:,00510656,5/28/2013,00:00.0,2013,5,28,"Chalfant, Jordan",43.7337,-69.9712,Cumberland,ME,DCCO,GBBG Corecction factor = 1.004; HEGU correction factor = 0.9882.  6 CAGO.Location comm:,01200657,5/28/2013,00:00.0,2013,5,28,"Chalfant, Jordan",43.7337,-69.9712,Cumberland,ME,CANG,GBBG Corecction factor = 1.004; HEGU correction factor = 0.9882.  6 CAGO.Location comm:,01720658,5/30/2013,00:00.0,2013,5,30,"Mittelhauser, Glen",44.0977,-68.5678,Knox,ME,GBBG,GBBG correction factor = 1.004; HEGU correction factor = 0.9882.Location comm:,00470659,5/30/2013,00:00.0,2013,5,30,"Mittelhauser, Glen",44.0977,-68.5678,Knox,ME,HERG,GBBG correction factor = 1.004; HEGU correction factor = 0.9882.Location comm:,00510660,5/30/2013,00:00.0,2013,5,30,"Mittelhauser, Glen",44.0977,-68.5678,Knox,ME,DCCO,GBBG correction factor = 1.004; HEGU correction factor = 0.9882.Location comm:,01200661,5/30/2013,00:00.0,2013,5,30,"Mittelhauser, Glen",43.8401,-68.8826,Knox,ME,GBBG,GBBG correction factor = 1.004; HEGU correction factor = 0.9882.Location comm:,00470662,5/30/2013,00:00.0,2013,5,30,"Mittelhauser, Glen",43.8401,-68.8826,Knox,ME,HERG,GBBG correction factor = 1.004; HEGU correction factor = 0.9882.Location comm:,00510663,5/30/2013,00:00.0,2013,5,30,"Mittelhauser, Glen",43.8401,-68.8826,Knox,ME,DCCO,GBBG correction factor = 1.004; HEGU correction factor = 0.9882.Location comm:,01200664,5/30/2013,00:00.0,2013,5,30,"Welch, Linda",44.554,-67.4676,Washington,ME,GBBG,GBBG correction factor = 1.004; HEGU correction factor = 0.9882. 4 individual canada geese.Location comm:,00470665,5/30/2013,00:00.0,2013,5,30,"Welch, Linda",44.554,-67.4676,Washington,ME,HERG,GBBG correction factor = 1.004; HEGU correction factor = 0.9882. 4 individual canada geese.Location comm:,00510666,5/30/2013,00:00.0,2013,5,30,"Welch, Linda",44.554,-67.4676,Washington,ME,DCCO,GBBG correction factor = 1.004; HEGU correction factor = 0.9882. 4 individual canada geese.Location comm:,01200667,5/30/2013,00:00.0,2013,5,30,"Welch, Linda",44.554,-67.4676,Washington,ME,CANG,GBBG correction factor = 1.004; HEGU correction factor = 0.9882. 4 individual canada geese.Location comm:,01720668,6/19/2013,00:00.0,2013,6,19,"Houston, Bob",43.7532,-69.5827,Lincoln,ME,COTE,No correction noted.  Herring gulls observed nesting but did not attempt to count.  Canada geese on S end.Location comm:,00700669,6/19/2013,00:00.0,2013,6,19,"Houston, Bob",43.7532,-69.5827,Lincoln,ME,ROST,No correction noted.  Herring gulls observed nesting but did not attempt to count.  Canada geese on S end.Location comm:,00720670,6/19/2013,00:00.0,2013,6,19,"Houston, Bob",43.7532,-69.5827,Lincoln,ME,ARTE,No correction noted.  Herring gulls observed nesting but did not attempt to count.  Canada geese on S end.Location comm:,00710671,6/19/2013,00:00.0,2013,6,19,"Houston, Bob",43.7532,-69.5827,Lincoln,ME,HERG,No correction noted.  Herring gulls observed nesting but did not attempt to count.  Canada geese on S end.Location comm:,00510672,5/30/2013,00:00.0,2013,5,30,"Chalfant, Jordan",43.7532,-69.5827,Lincoln,ME,GBBG,GBBG correction factor = 1.004; HEGU correction factor = 0.9882.  2 pairs CAGO.Location comm:,00470673,5/30/2013,00:00.0,2013,5,30,"Chalfant, Jordan",43.7532,-69.5827,Lincoln,ME,HERG,GBBG correction factor = 1.004; HEGU correction factor = 0.9882.  2 pairs CAGO.Location comm:,00510674,5/30/2013,00:00.0,2013,5,30,"Chalfant, Jordan",43.7532,-69.5827,Lincoln,ME,DCCO,GBBG correction factor = 1.004; HEGU correction factor = 0.9882.  2 pairs CAGO.Location comm:,01200675,5/30/2013,00:00.0,2013,5,30,"Chalfant, Jordan",43.7532,-69.5827,Lincoln,ME,CANG,GBBG correction factor = 1.004; HEGU correction factor = 0.9882.  2 pairs CAGO.Location comm:,01720676,5/28/2013,00:00.0,2013,5,28,"Chalfant, Jordan",43.7271,-69.9378,Cumberland,ME,GBBG,GBBG Corecction factor = 1.004; HEGU correction factor = 0.9882.  21 other (CAGO and GBHE).Location comm:,00470677,5/28/2013,00:00.0,2013,5,28,"Chalfant, Jordan",43.7271,-69.9378,Cumberland,ME,HERG,GBBG Corecction factor = 1.004; HEGU correction factor = 0.9882.  21 other (CAGO and GBHE).Location comm:,00510678,5/28/2013,00:00.0,2013,5,28,"Chalfant, Jordan",43.7271,-69.9378,Cumberland,ME,DCCO,GBBG Corecction factor = 1.004; HEGU correction factor = 0.9882.  21 other (CAGO and GBHE).Location comm:,01200679,5/30/2013,00:00.0,2013,5,30,"Mittelhauser, Glen",43.8262,-68.8933,Knox,ME,GBBG,GBBG correction factor = 1.004; HEGU correction factor = 0.9882.Location comm:,00470680,5/30/2013,00:00.0,2013,5,30,"Mittelhauser, Glen",43.8262,-68.8933,Knox,ME,HERG,GBBG correction factor = 1.004; HEGU correction factor = 0.9882.Location comm:,00510681,5/30/2013,00:00.0,2013,5,30,"Mittelhauser, Glen",43.8262,-68.8933,Knox,ME,DCCO,GBBG correction factor = 1.004; HEGU correction factor = 0.9882.Location comm:,01200682,5/28/2013,00:00.0,2013,5,28,"Chalfant, Jordan",43.6371,-70.1869,Cumberland,ME,GBBG,GBBG Corecction factor = 1.004; HEGU correction factor = 0.9882.  5 other species.Location comm:,00470683,5/28/2013,00:00.0,2013,5,28,"Chalfant, Jordan",43.6371,-70.1869,Cumberland,ME,HERG,GBBG Corecction factor = 1.004; HEGU correction factor = 0.9882.  5 other species.Location comm:,00510684,5/28/2013,00:00.0,2013,5,28,"Chalfant, Jordan",43.6371,-70.1869,Cumberland,ME,DCCO,GBBG Corecction factor = 1.004; HEGU correction factor = 0.9882.  5 other species.Location comm:,01200685,5/28/2013,00:00.0,2013,5,28,"Chalfant, Jordan",43.5502,-70.2599,Cumberland,ME,GBBG,GBBG Corecction factor = 1.004; HEGU correction factor = 0.9882.Location comm:,00470686,5/28/2013,00:00.0,2013,5,28,"Chalfant, Jordan",43.5502,-70.2599,Cumberland,ME,HERG,GBBG Corecction factor = 1.004; HEGU correction factor = 0.9882.Location comm:,00510687,5/28/2013,00:00.0,2013,5,28,"Chalfant, Jordan",43.5502,-70.2599,Cumberland,ME,DCCO,GBBG Corecction factor = 1.004; HEGU correction factor = 0.9882.Location comm:,01200688,5/28/2013,00:00.0,2013,5,28,"Chalfant, Jordan",43.7472,-69.9646,Cumberland,ME,GBBG,GBBG Corecction factor = 1.004; HEGU correction factor = 0.9882.  7 CAGO.Location comm:,00470689,5/28/2013,00:00.0,2013,5,28,"Chalfant, Jordan",43.7472,-69.9646,Cumberland,ME,HERG,GBBG Corecction factor = 1.004; HEGU correction factor = 0.9882.  7 CAGO.Location comm:,00510690,5/28/2013,00:00.0,2013,5,28,"Chalfant, Jordan",43.7472,-69.9646,Cumberland,ME,DCCO,GBBG Corecction factor = 1.004; HEGU correction factor = 0.9882.  7 CAGO.Location comm:,01200691,5/30/2013,00:00.0,2013,5,30,"Chalfant, Jordan",44.1371,-69.0733,Knox,ME,GBBG,GBBG correction factor = 1.004; HEGU correction factor = 0.9882.  3CAGO/COEILocation comm:,00470692,5/30/2013,00:00.0,2013,5,30,"Chalfant, Jordan",44.1371,-69.0733,Knox,ME,HERG,GBBG correction factor = 1.004; HEGU correction factor = 0.9882.  3CAGO/COEILocation comm:,00510693,5/30/2013,00:00.0,2013,5,30,"Chalfant, Jordan",44.1371,-69.0733,Knox,ME,CANG,GBBG correction factor = 1.004; HEGU correction factor = 0.9882.  3CAGO/COEILocation comm:,01720694,5/30/2013,00:00.0,2013,5,30,"Welch, Linda",44.5747,-67.3947,Washington,ME,GBBG,GBBG correction factor = 1.004; HEGU correction factor = 0.9882. 2 individual CAGO.Location comm:,00470695,5/30/2013,00:00.0,2013,5,30,"Welch, Linda",44.5747,-67.3947,Washington,ME,HERG,GBBG correction factor = 1.004; HEGU correction factor = 0.9882. 2 individual CAGO.Location comm:,00510696,5/30/2013,00:00.0,2013,5,30,"Welch, Linda",44.5747,-67.3947,Washington,ME,DCCO,GBBG correction factor = 1.004; HEGU correction factor = 0.9882. 2 individual CAGO.Location comm:,01200697,5/28/2013,00:00.0,2013,5,28,"Chalfant, Jordan",43.467,-70.3568,York,ME,GBBG,GBBG correction factor = 1.004; HEGU correction factor = 0.9882.Location comm:,00470698,5/28/2013,00:00.0,2013,5,28,"Chalfant, Jordan",43.467,-70.3568,York,ME,HERG,GBBG correction factor = 1.004; HEGU correction factor = 0.9882.Location comm:,00510699,5/28/2013,00:00.0,2013,5,28,"Chalfant, Jordan",43.467,-70.3568,York,ME,DCCO,GBBG correction factor = 1.004; HEGU correction factor = 0.9882.Location comm:,01200700,5/30/2013,00:00.0,2013,5,30,"Welch, Linda",44.5747,-67.3947,Washington,ME,CANG,GBBG correction factor = 1.004; HEGU correction factor = 0.9882. 2 individual CAGO.Location comm:,01720701,5/28/2013,00:00.0,2013,5,28,"Chalfant, Jordan",43.7472,-69.9646,Cumberland,ME,CANG,GBBG Corecction factor = 1.004; HEGU correction factor = 0.9882.  7 CAGO.Location comm:,01720702,5/30/2013,00:00.0,2013,5,30,"Schauffler, Rick",44.0121,-68.8059,Knox,ME,GBBG,GBBG correction factor = 1.004; HEGU correction factor = 0.9882.Location comm:,00470703,5/30/2013,00:00.0,2013,5,30,"Schauffler, Rick",44.0121,-68.8059,Knox,ME,HERG,GBBG correction factor = 1.004; HEGU correction factor = 0.9882.Location comm:,00510704,5/30/2013,00:00.0,2013,5,30,"Schauffler, Rick",44.0121,-68.8059,Knox,ME,DCCO,GBBG correction factor = 1.004; HEGU correction factor = 0.9882.Location comm:,01200705,5/30/2013,00:00.0,2013,5,30,"Schauffler, Rick",44.0104,-68.81,Knox,ME,GBBG,GBBG correction factor = 1.004; HEGU correction factor = 0.9882.  14 GREAT CORMORANTS.Location comm:,00470706,5/30/2013,00:00.0,2013,5,30,"Schauffler, Rick",44.0104,-68.81,Knox,ME,HERG,GBBG correction factor = 1.004; HEGU correction factor = 0.9882.  14 GREAT CORMORANTS.Location comm:,00510707,5/30/2013,00:00.0,2013,5,30,"Schauffler, Rick",44.0104,-68.81,Knox,ME,DCCO,GBBG correction factor = 1.004; HEGU correction factor = 0.9882.  14 GREAT CORMORANTS.Location comm:,01200708,5/30/2013,00:00.0,2013,5,30,"Schauffler, Rick",44.0104,-68.81,Knox,ME,GRCO,GBBG correction factor = 1.004; HEGU correction factor = 0.9882.  14 GREAT CORMORANTS.Location comm:,01190709,5/30/2013,00:00.0,2013,5,30,"Mittelhauser, Glen",44.1624,-68.9787,Knox,ME,GBBG,GBBG correction factor = 1.004; HEGU correction factor = 0.9882.Location comm:,00470713,5/30/2013,00:00.0,2013,5,30,"Welch, Linda",44.1603,-68.9781,Knox,ME,HERG,GBBG correction factor = 1.004; HEGU correction factor = 0.9882.Location comm:,00510714,5/30/2013,00:00.0,2013,5,30,"Welch, Linda",44.1603,-68.9781,Knox,ME,DCCO,GBBG correction factor = 1.004; HEGU correction factor = 0.9882.Location comm:,01200715,5/30/2013,00:00.0,2013,5,30,"Chalfant, Jordan",43.8978,-69.4345,Lincoln,ME,GBBG,"GBBG correction factor = 1.004; HEGU correction factor = 0.9882. 1 BAEA, 17 canada geeseLocation comm:",00470716,5/30/2013,00:00.0,2013,5,30,"Chalfant, Jordan",43.8978,-69.4345,Lincoln,ME,HERG,"GBBG correction factor = 1.004; HEGU correction factor = 0.9882. 1 BAEA, 17 canada geeseLocation comm:",00510717,5/30/2013,00:00.0,2013,5,30,"Chalfant, Jordan",43.8978,-69.4345,Lincoln,ME,DCCO,"GBBG correction factor = 1.004; HEGU correction factor = 0.9882. 1 BAEA, 17 canada geeseLocation comm:",01200718,5/30/2013,00:00.0,2013,5,30,"Chalfant, Jordan",43.8978,-69.4345,Lincoln,ME,CANG,"GBBG correction factor = 1.004; HEGU correction factor = 0.9882. 1 BAEA, 17 canada geeseLocation comm:",01720719,5/30/2013,00:00.0,2013,5,30,"Williams, Sarah",44.1122,-68.5384,Hancock,ME,GBBG,GBBG correction factor = 1.004; HEGU correction factor = 0.9882.Location comm:,00470720,5/30/2013,00:00.0,2013,5,30,"Williams, Sarah",44.1122,-68.5384,Hancock,ME,HERG,GBBG correction factor = 1.004; HEGU correction factor = 0.9882.Location comm:,00510721,5/30/2013,00:00.0,2013,5,30,"Williams, Sarah",44.1122,-68.5384,Hancock,ME,DCCO,GBBG correction factor = 1.004; HEGU correction factor = 0.9882.Location comm:,01200722,5/30/2013,00:00.0,2013,5,30,"Langlois, Michael",44.266,-68.7183,Hancock,ME,GBBG,GBBG correction factor = 1.004; HEGU correction factor = 0.9882.Location comm:,00470723,5