"localID","SurveyDate","X","Year","Month","Day","Observer","Latitude","Longitude","County","State","common_name","Comments","AOU_code","EnglishFull","Genus","Species","isodate","state_name"
"1","5/13/2010","00:00.0","2010","5","13","Lundblad","NULL","NULL","Nye","NV","Eared Grebe","NULL","00040","Eared Grebe","Podiceps","nigricollis",2010-05-13,"Nevada"
"2","5/4/2010","00:00.0","2010","5","4","Lundblad","NULL","NULL","Nye","NV","Eared Grebe","NULL","00040","Eared Grebe","Podiceps","nigricollis",2010-05-04,"Nevada"
"3","5/4/2010","00:00.0","2010","5","4","Lundblad","NULL","NULL","Nye","NV","White-faced Ibis","NULL","01870","White-faced Ibis","Plegadis","chihi",2010-05-04,"Nevada"
"4","5/19/2010","00:00.0","2010","5","19","Lundblad","NULL","NULL","Nye","NV","Eared Grebe","NULL","00040","Eared Grebe","Podiceps","nigricollis",2010-05-19,"Nevada"
"5","5/19/2010","00:00.0","2010","5","19","Lundblad","NULL","NULL","Nye","NV","White-faced Ibis","NULL","01870","White-faced Ibis","Plegadis","chihi",2010-05-19,"Nevada"
"6","6/22/2010","00:00.0","2010","6","22","Lundblad","NULL","NULL","Nye","NV","Eared Grebe","NULL","00040","Eared Grebe","Podiceps","nigricollis",2010-06-22,"Nevada"
"7","6/22/2010","00:00.0","2010","6","22","Lundblad","NULL","NULL","Nye","NV","White-faced Ibis","NULL","01870","White-faced Ibis","Plegadis","chihi",2010-06-22,"Nevada"
"8","7/22/2010","00:00.0","2010","7","22","Lundblad","NULL","NULL","Nye","NV","Eared Grebe","NULL","00040","Eared Grebe","Podiceps","nigricollis",2010-07-22,"Nevada"
"9","7/22/2010","00:00.0","2010","7","22","Lundblad","NULL","NULL","Nye","NV","White-faced Ibis","NULL","01870","White-faced Ibis","Plegadis","chihi",2010-07-22,"Nevada"
"10","5/5/2010","00:00.0","2010","5","5","Lundblad","NULL","NULL","Nye","NV","Eared Grebe","NULL","00040","Eared Grebe","Podiceps","nigricollis",2010-05-05,"Nevada"
"11","5/5/2010","00:00.0","2010","5","5","Lundblad","NULL","NULL","Nye","NV","White-faced Ibis","NULL","01870","White-faced Ibis","Plegadis","chihi",2010-05-05,"Nevada"
"12","5/20/2010","00:00.0","2010","5","20","Lundblad","NULL","NULL","Nye","NV","Eared Grebe","NULL","00040","Eared Grebe","Podiceps","nigricollis",2010-05-20,"Nevada"
"13","5/20/2010","00:00.0","2010","5","20","Lundblad","NULL","NULL","Nye","NV","White-faced Ibis","NULL","01870","White-faced Ibis","Plegadis","chihi",2010-05-20,"Nevada"
"14","7/22/2010","00:00.0","2010","7","22","Lundblad","NULL","NULL","Nye","NV","Eared Grebe","NULL","00040","Eared Grebe","Podiceps","nigricollis",2010-07-22,"Nevada"
"15","7/22/2010","00:00.0","2010","7","22","Lundblad","NULL","NULL","Nye","NV","White-faced Ibis","NULL","01870","White-faced Ibis","Plegadis","chihi",2010-07-22,"Nevada"
"16","6/12/2009","00:00.0","2009","6","12","Jeffers","NULL","NULL","Churchill","NV","Black-crowned Night-Heron","NULL","02020","Black-crowned Night-Heron","Nycticorax","nycticorax",2009-06-12,"Nevada"
"17","5/24/2011","00:00.0","2011","5","24","Jeffers","NULL","NULL","Churchill","NV","Great Egret","NULL","01960","Great Egret","Ardea","alba",2011-05-24,"Nevada"
"18","5/24/2011","00:00.0","2011","5","24","Jeffers","NULL","NULL","Churchill","NV","Snowy Egret","NULL","01970","Snowy Egret","Egretta","thula",2011-05-24,"Nevada"
"19","5/24/2011","00:00.0","2011","5","24","Jeffers","NULL","NULL","Churchill","NV","White-faced Ibis","NULL","01870","White-faced Ibis","Plegadis","chihi",2011-05-24,"Nevada"
"20","5/24/2011","00:00.0","2011","5","24","Jeffers","NULL","NULL","Churchill","NV","White-faced Ibis","NULL","01870","White-faced Ibis","Plegadis","chihi",2011-05-24,"Nevada"
"21","5/15/2009","00:00.0","2009","5","15","Jeffers","NULL","NULL","Churchill","NV","Black-crowned Night-Heron","NULL","02020","Black-crowned Night-Heron","Nycticorax","nycticorax",2009-05-15,"Nevada"
"22","5/15/2009","00:00.0","2009","5","15","Jeffers","NULL","NULL","Churchill","NV","Great Blue Heron","NULL","01940","Great Blue Heron","Ardea","herodias",2009-05-15,"Nevada"
"23","5/15/2009","00:00.0","2009","5","15","Jeffers","NULL","NULL","Churchill","NV","Great Egret","NULL","01960","Great Egret","Ardea","alba",2009-05-15,"Nevada"
"24","5/24/2011","00:00.0","2011","5","24","Jeffers","NULL","NULL","Churchill","NV","Black-crowned Night-Heron","NULL","02020","Black-crowned Night-Heron","Nycticorax","nycticorax",2011-05-24,"Nevada"
"25","5/24/2011","00:00.0","2011","5","24","Jeffers","NULL","NULL","Churchill","NV","Great Egret","NULL","01960","Great Egret","Ardea","alba",2011-05-24,"Nevada"
"26","5/24/2011","00:00.0","2011","5","24","Jeffers","NULL","NULL","Churchill","NV","Snowy Egret","NULL","01970","Snowy Egret","Egretta","thula",2011-05-24,"Nevada"
"27","5/24/2011","00:00.0","2011","5","24","Jeffers","NULL","NULL","Churchill","NV","White-faced Ibis","NULL","01870","White-faced Ibis","Plegadis","chihi",2011-05-24,"Nevada"
"28","5/15/2009","00:00.0","2009","5","15","Jeffers","NULL","NULL","Churchill","NV","Great Blue Heron","NULL","01940","Great Blue Heron","Ardea","herodias",2009-05-15,"Nevada"
"29","6/12/2009","00:00.0","2009","6","12","Jeffers","NULL","NULL","Churchill","NV","Great Blue Heron","NULL","01940","Great Blue Heron","Ardea","herodias",2009-06-12,"Nevada"
"30","5/24/2011","00:00.0","2011","5","24","Jeffers","NULL","NULL","Churchill","NV","Great Blue Heron","NULL","01940","Great Blue Heron","Ardea","herodias",2011-05-24,"Nevada"
"31","4/6/2009","00:00.0","2009","4","6","Woods","NULL","NULL","Douglas","NV","Great Blue Heron","NULL","01940","Great Blue Heron","Ardea","herodias",2009-04-06,"Nevada"
"32","4/6/2009","00:00.0","2009","4","6","Woods","NULL","NULL","Douglas","NV","Snowy Egret","NULL","01970","Snowy Egret","Egretta","thula",2009-04-06,"Nevada"
"33","6/27/2009","00:00.0","2009","6","27","Ballard","NULL","NULL","Douglas","NV","Black-crowned Night-Heron","NULL","02020","Black-crowned Night-Heron","Nycticorax","nycticorax",2009-06-27,"Nevada"
"34","NULL","","2009","4","NULL","Cottle","NULL","NULL","Churchill","NV","Great Blue Heron","NULL","01940","Great Blue Heron","Ardea","herodias",NA,"Nevada"
"35","5/19/2010","00:00.0","2010","5","19","Bradley","NULL","NULL","Elko","NV","White-faced Ibis","NULL","01870","White-faced Ibis","Plegadis","chihi",2010-05-19,"Nevada"
"36","6/12/2009","00:00.0","2009","6","12","Jeffers","NULL","NULL","Churchill","NV","Great Blue Heron","NULL","01940","Great Blue Heron","Ardea","herodias",2009-06-12,"Nevada"
"129","6/14/2011","00:00.0","2011","6","14","Ballard","NULL","NULL","Elko","NV","Western Grebe","NULL","00010","Western Grebe","Aechmophorus","occidentalis",2011-06-14,"Nevada"
"37","6/10/2009","00:00.0","2009","6","10","Teske","NULL","NULL","Lander","NV","Black-crowned Night-Heron","NULL","02020","Black-crowned Night-Heron","Nycticorax","nycticorax",2009-06-10,"Nevada"
"38","6/10/2009","00:00.0","2009","6","10","Teske","NULL","NULL","Lander","NV","Snowy Egret","NULL","01970","Snowy Egret","Egretta","thula",2009-06-10,"Nevada"
"39","7/1/2010","00:00.0","2010","7","1","Teske","NULL","NULL","Lander","NV","Black-crowned Night-Heron","NULL","02020","Black-crowned Night-Heron","Nycticorax","nycticorax",2010-07-01,"Nevada"
"40","7/1/2010","00:00.0","2010","7","1","Teske","NULL","NULL","Lander","NV","Great Egret","NULL","01960","Great Egret","Ardea","alba",2010-07-01,"Nevada"
"41","7/1/2010","00:00.0","2010","7","1","Teske","NULL","NULL","Lander","NV","Snowy Egret","NULL","01970","Snowy Egret","Egretta","thula",2010-07-01,"Nevada"
"42","5/26/2010","00:00.0","2010","5","26","Bauman","NULL","NULL","Humboldt","NV","Great Egret","NULL","01960","Great Egret","Ardea","alba",2010-05-26,"Nevada"
"43","5/26/2010","00:00.0","2010","5","26","Bauman","NULL","NULL","Humboldt","NV","White-faced Ibis","NULL","01870","White-faced Ibis","Plegadis","chihi",2010-05-26,"Nevada"
"44","5/26/2010","00:00.0","2010","5","26","Bauman","NULL","NULL","Humboldt","NV","White-faced Ibis","NULL","01870","White-faced Ibis","Plegadis","chihi",2010-05-26,"Nevada"
"45","5/26/2010","00:00.0","2010","5","26","Bauman","NULL","NULL","Humboldt","NV","Great Egret","NULL","01960","Great Egret","Ardea","alba",2010-05-26,"Nevada"
"46","5/26/2010","00:00.0","2010","5","26","Bauman","NULL","NULL","Humboldt","NV","White-faced Ibis","NULL","01870","White-faced Ibis","Plegadis","chihi",2010-05-26,"Nevada"
"47","5/26/2010","00:00.0","2010","5","26","Bauman","NULL","NULL","Humboldt","NV","Great Egret","NULL","01960","Great Egret","Ardea","alba",2010-05-26,"Nevada"
"48","5/26/2010","00:00.0","2010","5","26","Bauman","NULL","NULL","Humboldt","NV","Black-crowned Night-Heron","NULL","02020","Black-crowned Night-Heron","Nycticorax","nycticorax",2010-05-26,"Nevada"
"49","5/26/2010","00:00.0","2010","5","26","Bauman","NULL","NULL","Humboldt","NV","White-faced Ibis","NULL","01870","White-faced Ibis","Plegadis","chihi",2010-05-26,"Nevada"
"50","5/26/2010","00:00.0","2010","5","26","Bauman","NULL","NULL","Humboldt","NV","Snowy Egret","NULL","01970","Snowy Egret","Egretta","thula",2010-05-26,"Nevada"
"51","5/26/2010","00:00.0","2010","5","26","Bauman","NULL","NULL","Humboldt","NV","White-faced Ibis","NULL","01870","White-faced Ibis","Plegadis","chihi",2010-05-26,"Nevada"
"52","5/26/2010","00:00.0","2010","5","26","Bauman","NULL","NULL","Humboldt","NV","White-faced Ibis","NULL","01870","White-faced Ibis","Plegadis","chihi",2010-05-26,"Nevada"
"53","7/16/2010","00:00.0","2010","7","16","Boyd","NULL","NULL","Elko","NV","Black Tern","NULL","00770","Black Tern","Chlidonias","niger",2010-07-16,"Nevada"
"54","5/25/2009","00:00.0","2009","5","25","Teske","NULL","NULL","Lander","NV","Great Blue Heron","NULL","01940","Great Blue Heron","Ardea","herodias",2009-05-25,"Nevada"
"55","5/25/2009","00:00.0","2009","5","25","Teske","NULL","NULL","Lander","NV","Great Egret","NULL","01960","Great Egret","Ardea","alba",2009-05-25,"Nevada"
"56","5/25/2009","00:00.0","2009","5","25","Teske","NULL","NULL","Lander","NV","Snowy Egret","NULL","01970","Snowy Egret","Egretta","thula",2009-05-25,"Nevada"
"57","6/15/2010","00:00.0","2010","6","15","Teske","NULL","NULL","Lander","NV","Black-crowned Night-Heron","NULL","02020","Black-crowned Night-Heron","Nycticorax","nycticorax",2010-06-15,"Nevada"
"58","6/15/2010","00:00.0","2010","6","15","Teske","NULL","NULL","Lander","NV","Great Blue Heron","NULL","01940","Great Blue Heron","Ardea","herodias",2010-06-15,"Nevada"
"59","6/15/2010","00:00.0","2010","6","15","Teske","NULL","NULL","Lander","NV","Great Egret","NULL","01960","Great Egret","Ardea","alba",2010-06-15,"Nevada"
"60","6/15/2010","00:00.0","2010","6","15","Teske","NULL","NULL","Lander","NV","Snowy Egret","NULL","01970","Snowy Egret","Egretta","thula",2010-06-15,"Nevada"
"61","7/13/2010","00:00.0","2010","7","13","Teske","NULL","NULL","Humboldt","NV","Black-crowned Night-Heron","NULL","02020","Black-crowned Night-Heron","Nycticorax","nycticorax",2010-07-13,"Nevada"
"62","7/13/2010","00:00.0","2010","7","13","Teske","NULL","NULL","Humboldt","NV","Cattle Egret","NULL","02001","Cattle Egret","Bubulcus","ibis",2010-07-13,"Nevada"
"63","7/13/2010","00:00.0","2010","7","13","Teske","NULL","NULL","Humboldt","NV","Snowy Egret","NULL","01970","Snowy Egret","Egretta","thula",2010-07-13,"Nevada"
"64","5/19/2010","00:00.0","2010","5","19","Bradley","NULL","NULL","Elko","NV","White-faced Ibis","NULL","01870","White-faced Ibis","Plegadis","chihi",2010-05-19,"Nevada"
"65","7/1/2010","00:00.0","2010","7","1","Teske","NULL","NULL","Lander","NV","Black-crowned Night-Heron","NULL","02020","Black-crowned Night-Heron","Nycticorax","nycticorax",2010-07-01,"Nevada"
"66","7/1/2010","00:00.0","2010","7","1","Teske","NULL","NULL","Lander","NV","Great Blue Heron","NULL","01940","Great Blue Heron","Ardea","herodias",2010-07-01,"Nevada"
"67","7/1/2010","00:00.0","2010","7","1","Teske","NULL","NULL","Lander","NV","Great Egret","NULL","01960","Great Egret","Ardea","alba",2010-07-01,"Nevada"
"68","7/1/2010","00:00.0","2010","7","1","Teske","NULL","NULL","Lander","NV","Snowy Egret","NULL","01970","Snowy Egret","Egretta","thula",2010-07-01,"Nevada"
"69","5/13/2009","00:00.0","2009","5","13","Wong","NULL","NULL","Lincoln","NV","Great Blue Heron","NULL","01940","Great Blue Heron","Ardea","herodias",2009-05-13,"Nevada"
"70","5/30/2009","00:00.0","2009","5","30","Wendland","NULL","NULL","Nye","NV","Caspian Tern","NULL","00640","Caspian Tern","Hydroprogne","caspia",2009-05-30,"Nevada"
"71","5/29/2009","00:00.0","2009","5","29","Jeffers","NULL","NULL","Churchill","NV","California Gull","NULL","00530","California Gull","Larus","californicus",2009-05-29,"Nevada"
"72","5/29/2009","00:00.0","2009","5","29","Jeffers","NULL","NULL","Churchill","NV","Caspian Tern","NULL","00640","Caspian Tern","Hydroprogne","caspia",2009-05-29,"Nevada"
"73","5/29/2009","00:00.0","2009","5","29","Jeffers","NULL","NULL","Churchill","NV","Ring-billed Gull","NULL","00540","Ring-billed Gull","Larus","delawarensis",2009-05-29,"Nevada"
"74","5/29/2009","00:00.0","2009","5","29","Jeffers","NULL","NULL","Churchill","NV","Black-crowned Night-Heron","NULL","02020","Black-crowned Night-Heron","Nycticorax","nycticorax",2009-05-29,"Nevada"
"75","5/29/2009","00:00.0","2009","5","29","Jeffers","NULL","NULL","Churchill","NV","California Gull","NULL","00530","California Gull","Larus","californicus",2009-05-29,"Nevada"
"76","5/29/2009","00:00.0","2009","5","29","Jeffers","NULL","NULL","Churchill","NV","Great Egret","NULL","01960","Great Egret","Ardea","alba",2009-05-29,"Nevada"
"77","5/29/2009","00:00.0","2009","5","29","Jeffers","NULL","NULL","Churchill","NV","Ring-billed Gull","NULL","00540","Ring-billed Gull","Larus","delawarensis",2009-05-29,"Nevada"
"78","5/29/2009","00:00.0","2009","5","29","Jeffers","NULL","NULL","Churchill","NV","Snowy Egret","NULL","01970","Snowy Egret","Egretta","thula",2009-05-29,"Nevada"
"79","4/21/2009","00:00.0","2009","4","21","Barnes","NULL","NULL","Clark","NV","Great Blue Heron","NULL","01940","Great Blue Heron","Ardea","herodias",2009-04-21,"Nevada"
"80","4/10/2009","00:00.0","2009","4","10","Barnes","NULL","NULL","Clark","NV","Great Blue Heron","NULL","01940","Great Blue Heron","Ardea","herodias",2009-04-10,"Nevada"
"81","6/20/2011","00:00.0","2011","6","20","Pietrzak","NULL","NULL","Washoe","NV","California Gull","NULL","00530","California Gull","Larus","californicus",2011-06-20,"Nevada"
"82","5/24/2009","00:00.0","2009","5","24","Withers","NULL","NULL","Washoe","NV","American White Pelican","NULL","01250","American White Pelican","Pelecanus","erythrorhynchos",2009-05-24,"Nevada"
"83","5/24/2009","00:00.0","2009","5","24","Withers","NULL","NULL","Washoe","NV","California Gull","NULL","00530","California Gull","Larus","californicus",2009-05-24,"Nevada"
"84","5/24/2009","00:00.0","2009","5","24","Withers","NULL","NULL","Washoe","NV","Double-crested Cormorant","NULL","01200","Double-crested Cormorant","Phalacrocorax","auritus",2009-05-24,"Nevada"
"85","5/24/2009","00:00.0","2009","5","24","Withers","NULL","NULL","Washoe","NV","Great Blue Heron","NULL","01940","Great Blue Heron","Ardea","herodias",2009-05-24,"Nevada"
"86","5/18/2010","00:00.0","2010","5","18","Withers","NULL","NULL","Washoe","NV","American White Pelican","NULL","01250","American White Pelican","Pelecanus","erythrorhynchos",2010-05-18,"Nevada"
"87","5/18/2010","00:00.0","2010","5","18","Withers","NULL","NULL","Washoe","NV","California Gull","NULL","00530","California Gull","Larus","californicus",2010-05-18,"Nevada"
"88","5/18/2010","00:00.0","2010","5","18","Withers","NULL","NULL","Washoe","NV","Great Blue Heron","NULL","01940","Great Blue Heron","Ardea","herodias",2010-05-18,"Nevada"
"89","6/22/2010","00:00.0","2010","6","22","Withers","NULL","NULL","Washoe","NV","Double-crested Cormorant","NULL","01200","Double-crested Cormorant","Phalacrocorax","auritus",2010-06-22,"Nevada"
"90","5/26/2010","00:00.0","2010","5","26","Bauman","NULL","NULL","Humboldt","NV","Black-crowned Night-Heron","NULL","02020","Black-crowned Night-Heron","Nycticorax","nycticorax",2010-05-26,"Nevada"
"185","NULL","","1983","NULL","NULL","Rawlings","NULL","NULL","Lander","NV","White-faced Ibis","NULL","01870","White-faced Ibis","Plegadis","chihi",NA,"Nevada"
"91","5/26/2010","00:00.0","2010","5","26","Bauman","NULL","NULL","Humboldt","NV","Great Blue Heron","NULL","01940","Great Blue Heron","Ardea","herodias",2010-05-26,"Nevada"
"92","5/26/2010","00:00.0","2010","5","26","Bauman","NULL","NULL","Humboldt","NV","Great Egret","NULL","01960","Great Egret","Ardea","alba",2010-05-26,"Nevada"
"93","5/27/2010","00:00.0","2010","5","27","Bauman","NULL","NULL","Humboldt","NV","White-faced Ibis","NULL","01870","White-faced Ibis","Plegadis","chihi",2010-05-27,"Nevada"
"94","5/27/2010","00:00.0","2010","5","27","Bauman","NULL","NULL","Humboldt","NV","Black-crowned Night-Heron","NULL","02020","Black-crowned Night-Heron","Nycticorax","nycticorax",2010-05-27,"Nevada"
"95","5/27/2010","00:00.0","2010","5","27","Bauman","NULL","NULL","Humboldt","NV","Great Egret","NULL","01960","Great Egret","Ardea","alba",2010-05-27,"Nevada"
"96","5/27/2010","00:00.0","2010","5","27","Bauman","NULL","NULL","Humboldt","NV","White-faced Ibis","NULL","01870","White-faced Ibis","Plegadis","chihi",2010-05-27,"Nevada"
"97","5/27/2010","00:00.0","2010","5","27","Bauman","NULL","NULL","Humboldt","NV","Black-crowned Night-Heron","NULL","02020","Black-crowned Night-Heron","Nycticorax","nycticorax",2010-05-27,"Nevada"
"98","5/27/2010","00:00.0","2010","5","27","Bauman","NULL","NULL","Humboldt","NV","Great Egret","NULL","01960","Great Egret","Ardea","alba",2010-05-27,"Nevada"
"99","5/27/2010","00:00.0","2010","5","27","Bauman","NULL","NULL","Humboldt","NV","White-faced Ibis","NULL","01870","White-faced Ibis","Plegadis","chihi",2010-05-27,"Nevada"
"100","5/26/2010","00:00.0","2010","5","26","Bauman","NULL","NULL","Humboldt","NV","White-faced Ibis","NULL","01870","White-faced Ibis","Plegadis","chihi",2010-05-26,"Nevada"
"101","5/26/2010","00:00.0","2010","5","26","Bauman","NULL","NULL","Humboldt","NV","White-faced Ibis","NULL","01870","White-faced Ibis","Plegadis","chihi",2010-05-26,"Nevada"
"102","6/29/2009","00:00.0","2009","6","29","Maples et. al","NULL","NULL","Nye","NV","White-faced Ibis","NULL","01870","White-faced Ibis","Plegadis","chihi",2009-06-29,"Nevada"
"103","6/16/2010","00:00.0","2010","6","16","Slatauski","NULL","NULL","Nye","NV","White-faced Ibis","NULL","01870","White-faced Ibis","Plegadis","chihi",2010-06-16,"Nevada"
"104","6/13/2011","00:00.0","2011","6","13","Ballard et al.","NULL","NULL","Elko","NV","Double-crested Cormorant","NULL","01200","Double-crested Cormorant","Phalacrocorax","auritus",2011-06-13,"Nevada"
"105","6/13/2011","00:00.0","2011","6","13","Ballard et al.","NULL","NULL","Elko","NV","Forster's Tern","NULL","00690","Forster's Tern","Sterna","forsteri",2011-06-13,"Nevada"
"106","6/13/2011","00:00.0","2011","6","13","Ballard et al.","NULL","NULL","Elko","NV","Black-crowned Night-Heron","NULL","02020","Black-crowned Night-Heron","Nycticorax","nycticorax",2011-06-13,"Nevada"
"107","6/13/2011","00:00.0","2011","6","13","Ballard et al.","NULL","NULL","Elko","NV","Double-crested Cormorant","NULL","01200","Double-crested Cormorant","Phalacrocorax","auritus",2011-06-13,"Nevada"
"108","6/13/2011","00:00.0","2011","6","13","Ballard et al.","NULL","NULL","Elko","NV","Forster's Tern","NULL","00690","Forster's Tern","Sterna","forsteri",2011-06-13,"Nevada"
"109","6/13/2011","00:00.0","2011","6","13","Ballard et al.","NULL","NULL","Elko","NV","White-faced Ibis","NULL","01870","White-faced Ibis","Plegadis","chihi",2011-06-13,"Nevada"
"110","6/13/2011","00:00.0","2011","6","13","Ballard et al.","NULL","NULL","Elko","NV","White-faced Ibis","NULL","01870","White-faced Ibis","Plegadis","chihi",2011-06-13,"Nevada"
"111","6/13/2011","00:00.0","2011","6","13","Ballard et al.","NULL","NULL","Elko","NV","Double-crested Cormorant","NULL","01200","Double-crested Cormorant","Phalacrocorax","auritus",2011-06-13,"Nevada"
"112","6/13/2011","00:00.0","2011","6","13","Ballard et al.","NULL","NULL","Elko","NV","Forster's Tern","NULL","00690","Forster's Tern","Sterna","forsteri",2011-06-13,"Nevada"
"113","6/13/2011","00:00.0","2011","6","13","Ballard et al.","NULL","NULL","Elko","NV","White-faced Ibis","NULL","01870","White-faced Ibis","Plegadis","chihi",2011-06-13,"Nevada"
"114","4/1/2009","00:00.0","2009","4","1","Cottle","NULL","NULL","Churchill","NV","Double-crested Cormorant","NULL","01200","Double-crested Cormorant","Phalacrocorax","auritus",2009-04-01,"Nevada"
"115","5/13/2009","00:00.0","2009","5","13","Jeffers","NULL","NULL","Churchill","NV","Double-crested Cormorant","NULL","01200","Double-crested Cormorant","Phalacrocorax","auritus",2009-05-13,"Nevada"
"116","5/13/2009","00:00.0","2009","5","13","Jeffers","NULL","NULL","Churchill","NV","Great Egret","NULL","01960","Great Egret","Ardea","alba",2009-05-13,"Nevada"
"117","5/13/2009","00:00.0","2009","5","13","Jeffers","NULL","NULL","Churchill","NV","Snowy Egret","NULL","01970","Snowy Egret","Egretta","thula",2009-05-13,"Nevada"
"118","6/12/2009","00:00.0","2009","6","12","Jeffers","NULL","NULL","Churchill","NV","Double-crested Cormorant","NULL","01200","Double-crested Cormorant","Phalacrocorax","auritus",2009-06-12,"Nevada"
"119","6/12/2009","00:00.0","2009","6","12","Jeffers","NULL","NULL","Churchill","NV","Great Egret","NULL","01960","Great Egret","Ardea","alba",2009-06-12,"Nevada"
"120","5/24/2011","00:00.0","2011","5","24","Jeffers","NULL","NULL","Churchill","NV","Great Egret","NULL","01960","Great Egret","Ardea","alba",2011-05-24,"Nevada"
"121","NULL","","2009","4","NULL","Cottle","NULL","NULL","Churchill","NV","Great Egret","NULL","01960","Great Egret","Ardea","alba",NA,"Nevada"
"122","5/19/2010","00:00.0","2010","5","19","Bradley","NULL","NULL","Elko","NV","Great Blue Heron","NULL","01940","Great Blue Heron","Ardea","herodias",2010-05-19,"Nevada"
"123","5/24/2010","00:00.0","2010","5","24","Bradley","NULL","NULL","Elko","NV","Great Blue Heron","NULL","01940","Great Blue Heron","Ardea","herodias",2010-05-24,"Nevada"
"124","7/13/2010","00:00.0","2010","7","13","Ballard","NULL","NULL","Elko","NV","Eared Grebe","NULL","00040","Eared Grebe","Podiceps","nigricollis",2010-07-13,"Nevada"
"125","7/13/2010","00:00.0","2010","7","13","Ballard","NULL","NULL","Elko","NV","Western Grebe","NULL","00010","Western Grebe","Aechmophorus","occidentalis",2010-07-13,"Nevada"
"126","6/14/2011","00:00.0","2011","6","14","Ballard","NULL","NULL","Elko","NV","Caspian Tern","NULL","00640","Caspian Tern","Hydroprogne","caspia",2011-06-14,"Nevada"
"127","6/14/2011","00:00.0","2011","6","14","Ballard","NULL","NULL","Elko","NV","Eared Grebe","NULL","00040","Eared Grebe","Podiceps","nigricollis",2011-06-14,"Nevada"
"128","6/14/2011","00:00.0","2011","6","14","Ballard","NULL","NULL","Elko","NV","Ring-billed Gull","NULL","00540","Ring-billed Gull","Larus","delawarensis",2011-06-14,"Nevada"
"130","5/19/2010","00:00.0","2010","5","19","Bradley","NULL","NULL","White Pine","NV","Black-crowned Night-Heron","NULL","02020","Black-crowned Night-Heron","Nycticorax","nycticorax",2010-05-19,"Nevada"
"131","5/19/2010","00:00.0","2010","5","19","Bradley","NULL","NULL","White Pine","NV","White-faced Ibis","NULL","01870","White-faced Ibis","Plegadis","chihi",2010-05-19,"Nevada"
"132","5/25/2010","00:00.0","2010","5","25","Bradley","NULL","NULL","Elko","NV","White-faced Ibis","NULL","01870","White-faced Ibis","Plegadis","chihi",2010-05-25,"Nevada"
"133","5/25/2010","00:00.0","2010","5","25","Bradley","NULL","NULL","Elko","NV","Black-crowned Night-Heron","NULL","02020","Black-crowned Night-Heron","Nycticorax","nycticorax",2010-05-25,"Nevada"
"134","5/25/2010","00:00.0","2010","5","25","Bradley","NULL","NULL","Elko","NV","Egret species","NULL","NULL",NA,NA,NA,2010-05-25,"Nevada"
"135","6/26/2009","00:00.0","2009","6","26","Dozet","NULL","NULL","White Pine","NV","Eared Grebe","NULL","00040","Eared Grebe","Podiceps","nigricollis",2009-06-26,"Nevada"
"136","5/28/2010","00:00.0","2010","5","28","Conner/Henderson","NULL","NULL","White Pine","NV","Eared Grebe","NULL","00040","Eared Grebe","Podiceps","nigricollis",2010-05-28,"Nevada"
"137","6/12/2009","00:00.0","2009","6","12","Jeffers","NULL","NULL","Churchill","NV","Black-crowned Night-Heron","NULL","02020","Black-crowned Night-Heron","Nycticorax","nycticorax",2009-06-12,"Nevada"
"138","6/12/2009","00:00.0","2009","6","12","Jeffers","NULL","NULL","Churchill","NV","Great Egret","NULL","01960","Great Egret","Ardea","alba",2009-06-12,"Nevada"
"139","6/12/2009","00:00.0","2009","6","12","Jeffers","NULL","NULL","Churchill","NV","White-faced Ibis","NULL","01870","White-faced Ibis","Plegadis","chihi",2009-06-12,"Nevada"
"140","5/24/2011","00:00.0","2011","5","24","Jeffers","NULL","NULL","Churchill","NV","Black-crowned Night-Heron","NULL","02020","Black-crowned Night-Heron","Nycticorax","nycticorax",2011-05-24,"Nevada"
"141","5/24/2011","00:00.0","2011","5","24","Jeffers","NULL","NULL","Churchill","NV","Great Blue Heron","NULL","01940","Great Blue Heron","Ardea","herodias",2011-05-24,"Nevada"
"142","5/24/2011","00:00.0","2011","5","24","Jeffers","NULL","NULL","Churchill","NV","Great Egret","NULL","01960","Great Egret","Ardea","alba",2011-05-24,"Nevada"
"143","5/24/2011","00:00.0","2011","5","24","Jeffers","NULL","NULL","Churchill","NV","White-faced Ibis","NULL","01870","White-faced Ibis","Plegadis","chihi",2011-05-24,"Nevada"
"144","5/24/2011","00:00.0","2011","5","24","Jeffers","NULL","NULL","Churchill","NV","Black-crowned Night-Heron","NULL","02020","Black-crowned Night-Heron","Nycticorax","nycticorax",2011-05-24,"Nevada"
"145","5/24/2011","00:00.0","2011","5","24","Jeffers","NULL","NULL","Churchill","NV","Great Egret","NULL","01960","Great Egret","Ardea","alba",2011-05-24,"Nevada"
"146","5/24/2011","00:00.0","2011","5","24","Jeffers","NULL","NULL","Churchill","NV","White-faced Ibis","NULL","01870","White-faced Ibis","Plegadis","chihi",2011-05-24,"Nevada"
"147","5/24/2011","00:00.0","2011","5","24","Jeffers","NULL","NULL","Churchill","NV","Black-crowned Night-Heron","NULL","02020","Black-crowned Night-Heron","Nycticorax","nycticorax",2011-05-24,"Nevada"
"148","5/24/2011","00:00.0","2011","5","24","Jeffers","NULL","NULL","Churchill","NV","Great Egret","NULL","01960","Great Egret","Ardea","alba",2011-05-24,"Nevada"
"149","5/24/2011","00:00.0","2011","5","24","Jeffers","NULL","NULL","Churchill","NV","White-faced Ibis","NULL","01870","White-faced Ibis","Plegadis","chihi",2011-05-24,"Nevada"
"150","6/12/2009","00:00.0","2009","6","12","Jeffers","NULL","NULL","Churchill","NV","Black-crowned Night-Heron","NULL","02020","Black-crowned Night-Heron","Nycticorax","nycticorax",2009-06-12,"Nevada"
"151","6/12/2009","00:00.0","2009","6","12","Jeffers","NULL","NULL","Churchill","NV","Black-crowned Night-Heron","NULL","02020","Black-crowned Night-Heron","Nycticorax","nycticorax",2009-06-12,"Nevada"
"152","6/12/2009","00:00.0","2009","6","12","Jeffers","NULL","NULL","Churchill","NV","Black-crowned Night-Heron","NULL","02020","Black-crowned Night-Heron","Nycticorax","nycticorax",2009-06-12,"Nevada"
"153","6/12/2009","00:00.0","2009","6","12","Jeffers","NULL","NULL","Churchill","NV","White-faced Ibis","NULL","01870","White-faced Ibis","Plegadis","chihi",2009-06-12,"Nevada"
"154","5/15/2009","00:00.0","2009","5","15","Jeffers","NULL","NULL","Churchill","NV","Great Blue Heron","NULL","01940","Great Blue Heron","Ardea","herodias",2009-05-15,"Nevada"
"155","6/12/2009","00:00.0","2009","6","12","Jeffers","NULL","NULL","Churchill","NV","Great Blue Heron","NULL","01940","Great Blue Heron","Ardea","herodias",2009-06-12,"Nevada"
"156","7/16/2010","00:00.0","2010","7","16","Boyd","NULL","NULL","Elko","NV","Black Tern","NULL","00770","Black Tern","Chlidonias","niger",2010-07-16,"Nevada"
"157","7/5/2010","00:00.0","2010","7","5","Goodman","NULL","NULL","Washoe","NV","Eared Grebe","NULL","00040","Eared Grebe","Podiceps","nigricollis",2010-07-05,"Nevada"
"158","6/5/2011","00:00.0","2011","6","5","Serdehely/Serdehely","NULL","NULL","Washoe","NV","Eared Grebe","NULL","00040","Eared Grebe","Podiceps","nigricollis",2011-06-05,"Nevada"
"159","6/5/2011","00:00.0","2011","6","5","Serdehely/Serdehely","NULL","NULL","Washoe","NV","White-faced Ibis","NULL","01870","White-faced Ibis","Plegadis","chihi",2011-06-05,"Nevada"
"160","6/4/2009","00:00.0","2009","6","4","Dozet","NULL","NULL","Washoe","NV","California Gull","NULL","00530","California Gull","Larus","californicus",2009-06-04,"Nevada"
"161","6/4/2009","00:00.0","2009","6","4","Dozet","NULL","NULL","Washoe","NV","Double-crested Cormorant","NULL","01200","Double-crested Cormorant","Phalacrocorax","auritus",2009-06-04,"Nevada"
"162","6/17/2010","00:00.0","2010","6","17","Ballard","NULL","NULL","Washoe","NV","California Gull","NULL","00530","California Gull","Larus","californicus",2010-06-17,"Nevada"
"163","6/17/2010","00:00.0","2010","6","17","Ballard","NULL","NULL","Washoe","NV","Double-crested Cormorant","NULL","01200","Double-crested Cormorant","Phalacrocorax","auritus",2010-06-17,"Nevada"
"164","6/17/2010","00:00.0","2010","6","17","Ballard","NULL","NULL","Washoe","NV","Snowy Egret","NULL","01970","Snowy Egret","Egretta","thula",2010-06-17,"Nevada"
"165","6/15/2011","00:00.0","2011","6","15","Serdehely/Serdehely","NULL","NULL","Washoe","NV","Black-crowned Night-Heron","NULL","02020","Black-crowned Night-Heron","Nycticorax","nycticorax",2011-06-15,"Nevada"
"166","6/15/2011","00:00.0","2011","6","15","Serdehely/Serdehely","NULL","NULL","Washoe","NV","White-faced Ibis","NULL","01870","White-faced Ibis","Plegadis","chihi",2011-06-15,"Nevada"
"167","6/15/2011","00:00.0","2011","6","15","Serdehely/Serdehely","NULL","NULL","Washoe","NV","Black-crowned Night-Heron","NULL","02020","Black-crowned Night-Heron","Nycticorax","nycticorax",2011-06-15,"Nevada"
"168","6/15/2011","00:00.0","2011","6","15","Serdehely/Serdehely","NULL","NULL","Washoe","NV","Caspian Tern","NULL","00640","Caspian Tern","Hydroprogne","caspia",2011-06-15,"Nevada"
"169","6/15/2011","00:00.0","2011","6","15","Serdehely/Serdehely","NULL","NULL","Washoe","NV","White-faced Ibis","NULL","01870","White-faced Ibis","Plegadis","chihi",2011-06-15,"Nevada"
"170","NULL","","2007","NULL","NULL","Teske","NULL","NULL","Humboldt","NV","Black-crowned Night-Heron","NULL","02020","Black-crowned Night-Heron","Nycticorax","nycticorax",NA,"Nevada"
"171","NULL","","2007","NULL","NULL","Teske","NULL","NULL","Humboldt","NV","Great Egret","NULL","01960","Great Egret","Ardea","alba",NA,"Nevada"
"172","NULL","","2007","NULL","NULL","Teske","NULL","NULL","Humboldt","NV","Snowy Egret","NULL","01970","Snowy Egret","Egretta","thula",NA,"Nevada"
"173","NULL","","1993","NULL","NULL","Teske","NULL","NULL","Eureka","NV","Great Blue Heron","NULL","01940","Great Blue Heron","Ardea","herodias",NA,"Nevada"
"174","NULL","","NULL","NULL","NULL","Teske","NULL","NULL","Elko","NV","Black-crowned Night-Heron","SurveyDate:1982-?","02020","Black-crowned Night-Heron","Nycticorax","nycticorax",NA,"Nevada"
"175","NULL","","NULL","NULL","NULL","Jeffers","NULL","NULL","Churchill","NV","NULL","SurveyDate:1970-2008 ; multiple species: Great Blue Heron, Great Egret, Snowy Egret, Cattle Egret, Black-crowned Night Heron  and White-faced Ibis","NULL",NA,NA,NA,NA,"Nevada"
"176","NULL","","NULL","NULL","NULL","Jeffers","NULL","NULL","Churchill","NV","NULL","SurveyDate:1970-2008 ; multiple species: Great Blue Heron, Great Egret, Snowy Egret, Cattle Egret, and Black-crowned Night Heron","NULL",NA,NA,NA,NA,"Nevada"
"177","NULL","","1998","NULL","NULL","Bradley","NULL","NULL","Elko","NV","American White Pelican","NULL","01250","American White Pelican","Pelecanus","erythrorhynchos",NA,"Nevada"
"178","NULL","","NULL","NULL","NULL","Bradley","NULL","NULL","Elko","NV","Black-crowned Night-Heron","SurveyDate:1983-?","02020","Black-crowned Night-Heron","Nycticorax","nycticorax",NA,"Nevada"
"179","NULL","","NULL","NULL","NULL","Stiver","NULL","NULL","Elko","NV","White-faced Ibis","SurveyDate:1980-?","01870","White-faced Ibis","Plegadis","chihi",NA,"Nevada"
"180","NULL","","1983","NULL","NULL","Rawlings","NULL","NULL","Lander","NV","NULL","Great Egret, Snowy Egret, and Cattle Egret","NULL",NA,NA,NA,NA,"Nevada"
"181","NULL","","NULL","NULL","NULL","Teske/Bradley","NULL","NULL","Elko","NV","NULL","SurveyDate: 1980-2008 ; Multiple specie: Great Egret, Snowy Egret, Cattle Egret, and Black-crowned Night Heron","NULL",NA,NA,NA,NA,"Nevada"
"182","NULL","","NULL","NULL","NULL","Boyd","NULL","NULL","Elko","NV","Black Tern","SurveyDate: 2001-7/16/2010","00770","Black Tern","Chlidonias","niger",NA,"Nevada"
"183","NULL","","NULL","NULL","NULL","Teske","NULL","NULL","Lander","NV","NULL","SurveyDate: 2005-2010 ; Multiple specie: Great Egret, Snowy Egret, Cattle Egret, and Black-crowned Night Heron","NULL",NA,NA,NA,NA,"Nevada"
"184","NULL","","1983","NULL","NULL","Teske","NULL","NULL","Lander","NV","Great Blue Heron","NULL","01940","Great Blue Heron","Ardea","herodias",NA,"Nevada"
"186","NULL","","NULL","NULL","NULL","Bradley","NULL","NULL","Elko","NV","Great Egret","SurveyDate:1993-2008","01960","Great Egret","Ardea","alba",NA,"Nevada"
"187","NULL","","NULL","NULL","NULL","Boyd","NULL","NULL","Elko","NV","Black Tern","SurveyDate:2001-2009","00770","Black Tern","Chlidonias","niger",NA,"Nevada"
"188","NULL","","NULL","NULL","NULL","Boyd","NULL","NULL","Elko","NV","White-faced Ibis","SurveyDate:2001-6/6/2008","01870","White-faced Ibis","Plegadis","chihi",NA,"Nevada"
"2069","5/28/2009","00:00.0","2009","5","28","Warrenet al.","NULL","NULL","Beaverhead","MT","Great Blue Heron","NULL","01940","Great Blue Heron","Ardea","herodias",2009-05-28,"Montana"
"2070","6/1/2009","00:00.0","2009","6","1","Warren et al.","NULL","NULL","Beaverhead","MT","California Gull","NULL","00530","California Gull","Larus","californicus",2009-06-01,"Montana"
"2071","6/16/2009","00:00.0","2009","6","16","Warren et al.","NULL","NULL","Beaverhead","MT","Franklin's Gull","NULL","00590","Franklin's Gull","Larus","pipixcan",2009-06-16,"Montana"
"2072","6/23/2009","00:00.0","2009","6","23","Warren et al.","NULL","NULL","Beaverhead","MT","Forster's Tern","NULL","00690","Forster's Tern","Sterna","forsteri",2009-06-23,"Montana"
"2073","6/23/2009","00:00.0","2009","6","23","Warren et al.","NULL","NULL","Beaverhead","MT","White-faced Ibis","NULL","01870","White-faced Ibis","Plegadis","chihi",2009-06-23,"Montana"
"2074","6/18/2010","00:00.0","2010","6","18","Warren et al.","NULL","NULL","Beaverhead","MT","Franklin's Gull","NULL","00590","Franklin's Gull","Larus","pipixcan",2010-06-18,"Montana"
"2075","6/18/2010","00:00.0","2010","6","18","Warren et al.","NULL","NULL","Beaverhead","MT","White-faced Ibis","NULL","01870","White-faced Ibis","Plegadis","chihi",2010-06-18,"Montana"
"2076","6/22/2010","00:00.0","2010","6","22","Warren et al.","NULL","NULL","Beaverhead","MT","California Gull","NULL","00530","California Gull","Larus","californicus",2010-06-22,"Montana"
"2077","7/21/2010","00:00.0","2010","7","21","Warren et al.","NULL","NULL","Beaverhead","MT","Eared Grebe","NULL","00040","Eared Grebe","Podiceps","nigricollis",2010-07-21,"Montana"
"2078","7/13/2009","00:00.0","2009","7","13","Amestoy/Donahey","NULL","NULL","Phillips","MT","Eared Grebe","NULL","00040","Eared Grebe","Podiceps","nigricollis",2009-07-13,"Montana"
"2079","5/11/2009","00:00.0","2009","5","11","Bissell/Tempel","NULL","NULL","Flathead","MT","Great Blue Heron","NULL","01940","Great Blue Heron","Ardea","herodias",2009-05-11,"Montana"
"2080","7/2/2010","00:00.0","2010","7","2","Stutzman","NULL","NULL","Flathead","MT","Great Blue Heron","NULL","01940","Great Blue Heron","Ardea","herodias",2010-07-02,"Montana"
"2081","5/13/2011","00:00.0","2011","5","13","Vore/Hammond","NULL","NULL","Flathead","MT","Great Blue Heron","NULL","01940","Great Blue Heron","Ardea","herodias",2011-05-13,"Montana"
"2082","NULL","","2011","4","16","Stewart","NULL","NULL","Carbon","MT","Great Blue Heron","NULL","01940","Great Blue Heron","Ardea","herodias",NA,"Montana"
"2083","7/7/2010","00:00.0","2010","7","7","Tilly","NULL","NULL","Chouteau","MT","Black Tern","NULL","00770","Black Tern","Chlidonias","niger",2010-07-07,"Montana"
"2084","6/10/2009","00:00.0","2009","6","10","Tilly","NULL","NULL","Chouteau","MT","Black Tern","NULL","00770","Black Tern","Chlidonias","niger",2009-06-10,"Montana"
"2085","6/10/2009","00:00.0","2009","6","10","Tilly","NULL","NULL","Chouteau","MT","Eared Grebe","NULL","00040","Eared Grebe","Podiceps","nigricollis",2009-06-10,"Montana"
"2086","6/28/2009","00:00.0","2009","6","28","Tilly","NULL","NULL","Hill","MT","Eared Grebe","NULL","00040","Eared Grebe","Podiceps","nigricollis",2009-06-28,"Montana"
"2087","5/12/2011","00:00.0","2011","5","12","Hammond/Cascaddan","NULL","NULL","Lincoln","MT","Great Blue Heron","NULL","01940","Great Blue Heron","Ardea","herodias",2011-05-12,"Montana"
"2088","6/29/2009","00:00.0","2009","6","29","Paige","NULL","NULL","Flathead","MT","Black Tern","NULL","00770","Black Tern","Chlidonias","niger",2009-06-29,"Montana"
"2089","6/30/2009","00:00.0","2009","6","30","Prellwitz","NULL","NULL","Phillips","MT","Common Tern","NULL","00700","Common Tern","Sterna","hirundo",2009-06-30,"Montana"
"2090","NULL","","2010","5","9","Waltee","NULL","NULL","Prairie","MT","Great Blue Heron","NULL","01940","Great Blue Heron","Ardea","herodias",NA,"Montana"
"2091","5/19/2011","00:00.0","2011","5","19","DuBois/Throop","NULL","NULL","Missoula","MT","Great Blue Heron","NULL","01940","Great Blue Heron","Ardea","herodias",2011-05-19,"Montana"
"2092","6/20/2009","00:00.0","2009","6","20","Paige/Kelly","NULL","NULL","Lake","MT","Black Tern","NULL","00770","Black Tern","Chlidonias","niger",2009-06-20,"Montana"
"2093","7/2/2010","00:00.0","2010","7","2","Doney","NULL","NULL","Lake","MT","Black Tern","NULL","00770","Black Tern","Chlidonias","niger",2010-07-02,"Montana"
"2094","7/13/2009","00:00.0","2009","7","13","Amestoy/Donahey","NULL","NULL","Phillips","MT","Eared Grebe","NULL","00040","Eared Grebe","Podiceps","nigricollis",2009-07-13,"Montana"
"2095","7/15/2010","00:00.0","2010","7","15","Amestoy/George","NULL","NULL","Phillips","MT","Eared Grebe","NULL","00040","Eared Grebe","Podiceps","nigricollis",2010-07-15,"Montana"
"2096","NULL","","2011","4","2","Wightman","NULL","NULL","Lewis & Clark","MT","Great Blue Heron","NULL","01940","Great Blue Heron","Ardea","herodias",NA,"Montana"
"2097","4/22/2011","00:00.0","2011","4","22","Sterling","NULL","NULL","Sanders","MT","Great Blue Heron","NULL","01940","Great Blue Heron","Ardea","herodias",2011-04-22,"Montana"
"2098","6/16/2009","00:00.0","2009","6","16","Paige","NULL","NULL","Liberty","MT","Ring-billed Gull","NULL","00540","Ring-billed Gull","Larus","delawarensis",2009-06-16,"Montana"
"2099","5/8/2010","00:00.0","2010","5","8","Waltee","NULL","NULL","Custer","MT","Great Blue Heron","NULL","01940","Great Blue Heron","Ardea","herodias",2010-05-08,"Montana"
"2100","NULL","","2009","4","26","Waltee","NULL","NULL","Custer","MT","Great Blue Heron","NULL","01940","Great Blue Heron","Ardea","herodias",NA,"Montana"
"2101","NULL","","2009","4","26","Waltee","NULL","NULL","Rosebud","MT","Great Blue Heron","NULL","01940","Great Blue Heron","Ardea","herodias",NA,"Montana"
"2102","NULL","","2009","4","26","Waltee","NULL","NULL","Rosebud","MT","Great Blue Heron","NULL","01940","Great Blue Heron","Ardea","herodias",NA,"Montana"
"2103","NULL","","2009","4","26","Waltee","NULL","NULL","Rosebud","MT","Great Blue Heron","NULL","01940","Great Blue Heron","Ardea","herodias",NA,"Montana"
"1966","NULL","","2009","4","24","Waltee","NULL","NULL","Rosebud","MT","Great Blue Heron","NULL","01940","Great Blue Heron","Ardea","herodias",NA,"Montana"
"1967","NULL","","2009","4","24","Waltee","NULL","NULL","Rosebud","MT","Great Blue Heron","NULL","01940","Great Blue Heron","Ardea","herodias",NA,"Montana"
"1968","NULL","","2009","4","24","Waltee","NULL","NULL","Rosebud","MT","Great Blue Heron","NULL","01940","Great Blue Heron","Ardea","herodias",NA,"Montana"
"1","5/27/2013","00:00.0","2013","5","27","Bonter, David","42.9882","-70.6143","York","ME","HERG","1 additional confirmed nest of lesser Black-bakced gull x herring gull pair.  No correction.Location comm: We attempted to count all nests on the island.  Nest locations were marked with chalk to prev","00510","Herring Gull","Larus","argentatus",2013-05-27,"Maine"
"2","6/4/2013","00:00.0","2013","6","4","Bonter, David","42.9882","-70.6143","York","ME","GBBG","Multiday census:  MAY 27- JUN 4, 2013.  1 additional confirmed nest of lesser Black-bakced gull x herring gull pair.  No correction.Location comm: We attempted to count all nests on the island.  Nest","00470","Great Black-backed Gull","Larus","marinus",2013-06-04,"Maine"
"3","5/31/2013","00:00.0","2013","5","31","Chalfant, Jordan","42.9882","-70.6143","York","ME","GBBG","GBBG correction factor = 1.004; HEGU correction factor = 0.9882.Location comm:","00470","Great Black-backed Gull","Larus","marinus",2013-05-31,"Maine"
"4","5/31/2013","00:00.0","2013","5","31","Chalfant, Jordan","42.9882","-70.6143","York","ME","HERG","GBBG correction factor = 1.004; HEGU correction factor = 0.9882.Location comm:","00510","Herring Gull","Larus","argentatus",2013-05-31,"Maine"
"5","5/31/2013","00:00.0","2013","5","31","Chalfant, Jordan","42.9882","-70.6143","York","ME","DCCO","GBBG correction factor = 1.004; HEGU correction factor = 0.9882.Location comm:","01200","Double-crested Cormorant","Phalacrocorax","auritus",2013-05-31,"Maine"
"6","6/6/2013","00:00.0","2013","6","6","Swann, Scott","44.4204","-68.2112","Hancock","ME","HERG","NULL","00510","Herring Gull","Larus","argentatus",2013-06-06,"Maine"
"7","6/6/2013","00:00.0","2013","6","6","Swann, Scott","44.4204","-68.2112","Hancock","ME","GBBG","NULL","00470","Great Black-backed Gull","Larus","marinus",2013-06-06,"Maine"
"8","5/30/2013","00:00.0","2013","5","30","Williams, Sarah","44.561","-67.5529","Washington","ME","HERG","Only two HEGU nests were found in tall/thick vegetation (may not be visible in aerial photo).  One egg GBBG nests were likely HEGU- this represents the only correction made.  Nest clutch by size HEGU","00510","Herring Gull","Larus","argentatus",2013-05-30,"Maine"
"9","5/30/2013","00:00.0","2013","5","30","Williams, Sarah","44.561","-67.5529","Washington","ME","GBBG","Only two HEGU nests were found in tall/thick vegetation (may not be visible in aerial photo).  One egg GBBG nests were likely HEGU- this represents the only correction made.  Nest clutch by size HEGU","00470","Great Black-backed Gull","Larus","marinus",2013-05-30,"Maine"
"10","5/30/2013","00:00.0","2013","5","30","Williams, Sarah","44.561","-67.5529","Washington","ME","LAGU","Only two HEGU nests were found in tall/thick vegetation (may not be visible in aerial photo).  One egg GBBG nests were likely HEGU- this represents the only correction made.  Nest clutch by size HEGU","00580","Laughing Gull","Larus","atricilla",2013-05-30,"Maine"
"11","5/30/2013","00:00.0","2013","5","30","Williams, Sarah","44.561","-67.5529","Washington","ME","DCCO","Only two HEGU nests were found in tall/thick vegetation (may not be visible in aerial photo).  One egg GBBG nests were likely HEGU- this represents the only correction made.  Nest clutch by size HEGU","01200","Double-crested Cormorant","Phalacrocorax","auritus",2013-05-30,"Maine"
"12","5/30/2013","00:00.0","2013","5","30","Williams, Sarah","44.561","-67.5529","Washington","ME","COEI","Only two HEGU nests were found in tall/thick vegetation (may not be visible in aerial photo).  One egg GBBG nests were likely HEGU- this represents the only correction made.  Nest clutch by size HEGU","01590","Common Eider","Somateria","mollissima",2013-05-30,"Maine"
"13","5/28/2013","00:00.0","2013","5","28","Schauffler, Rick","43.9176","-69.2961","Knox","ME","GBBG","GBBG correction factor = 1.004; HEGU correction factor = 0.9882.  2 CAGO???Location comm:","00470","Great Black-backed Gull","Larus","marinus",2013-05-28,"Maine"
"14","5/28/2013","00:00.0","2013","5","28","Schauffler, Rick","43.9176","-69.2961","Knox","ME","HERG","GBBG correction factor = 1.004; HEGU correction factor = 0.9882.  2 CAGO???Location comm:","00510","Herring Gull","Larus","argentatus",2013-05-28,"Maine"
"15","5/28/2013","00:00.0","2013","5","28","Schauffler, Rick","43.9176","-69.2961","Knox","ME","DCCO","GBBG correction factor = 1.004; HEGU correction factor = 0.9882.  2 CAGO???Location comm:","01200","Double-crested Cormorant","Phalacrocorax","auritus",2013-05-28,"Maine"
"16","5/28/2013","00:00.0","2013","5","28","Schauffler, Rick","43.9176","-69.2961","Knox","ME","CANG","GBBG correction factor = 1.004; HEGU correction factor = 0.9882.  2 CAGO???Location comm:","01720","Canada Goose","Branta","canadensis",2013-05-28,"Maine"
"17","5/30/2013","00:00.0","2013","5","30","Langlois, Michael","44.268","-68.7197","Hancock","ME","GBBG","GBBG correction factor = 1.004; HEGU correction factor = 0.9882.Location comm:","00470","Great Black-backed Gull","Larus","marinus",2013-05-30,"Maine"
"18","5/30/2013","00:00.0","2013","5","30","Langlois, Michael","44.268","-68.7197","Hancock","ME","HERG","GBBG correction factor = 1.004; HEGU correction factor = 0.9882.Location comm:","00510","Herring Gull","Larus","argentatus",2013-05-30,"Maine"
"19","5/30/2013","00:00.0","2013","5","30","Langlois, Michael","44.268","-68.7197","Hancock","ME","DCCO","GBBG correction factor = 1.004; HEGU correction factor = 0.9882.Location comm:","01200","Double-crested Cormorant","Phalacrocorax","auritus",2013-05-30,"Maine"
"20","5/30/2013","00:00.0","2013","5","30","Gettle, Beth","44.2312","-68.4407","Hancock","ME","GBBG","GBBG correction factor = 1.004; HEGU correction factor = 0.9882.Location comm:","00470","Great Black-backed Gull","Larus","marinus",2013-05-30,"Maine"
"21","5/30/2013","00:00.0","2013","5","30","Gettle, Beth","44.2312","-68.4407","Hancock","ME","HERG","GBBG correction factor = 1.004; HEGU correction factor = 0.9882.Location comm:","00510","Herring Gull","Larus","argentatus",2013-05-30,"Maine"
"22","5/30/2013","00:00.0","2013","5","30","Gettle, Beth","44.2312","-68.4407","Hancock","ME","DCCO","GBBG correction factor = 1.004; HEGU correction factor = 0.9882.Location comm:","01200","Double-crested Cormorant","Phalacrocorax","auritus",2013-05-30,"Maine"
"23","5/30/2013","00:00.0","2013","5","30","Gettle, Beth","44.2326","-68.4494","Hancock","ME","GBBG","GBBG correction factor = 1.004; HEGU correction factor = 0.9882.Location comm:","00470","Great Black-backed Gull","Larus","marinus",2013-05-30,"Maine"
"24","5/30/2013","00:00.0","2013","5","30","Gettle, Beth","44.2326","-68.4494","Hancock","ME","HERG","GBBG correction factor = 1.004; HEGU correction factor = 0.9882.Location comm:","00510","Herring Gull","Larus","argentatus",2013-05-30,"Maine"
"25","5/30/2013","00:00.0","2013","5","30","Gettle, Beth","44.2326","-68.4494","Hancock","ME","DCCO","GBBG correction factor = 1.004; HEGU correction factor = 0.9882.Location comm:","01200","Double-crested Cormorant","Phalacrocorax","auritus",2013-05-30,"Maine"
"26","6/6/2013","00:00.0","2013","6","6","Mittelhauser, Glen","44.4722","-67.6644","Washington","ME","GBBG","One roosting GBBG and 3 roossting DCCO on island.  No nesting suspected.Location comm:","00470","Great Black-backed Gull","Larus","marinus",2013-06-06,"Maine"
"27","6/6/2013","00:00.0","2013","6","6","Mittelhauser, Glen","44.4722","-67.6644","Washington","ME","HERG","One roosting GBBG and 3 roossting DCCO on island.  No nesting suspected.Location comm:","00510","Herring Gull","Larus","argentatus",2013-06-06,"Maine"
"28","6/6/2013","00:00.0","2013","6","6","Mittelhauser, Glen","44.4722","-67.6644","Washington","ME","DCCO","One roosting GBBG and 3 roossting DCCO on island.  No nesting suspected.Location comm:","01200","Double-crested Cormorant","Phalacrocorax","auritus",2013-06-06,"Maine"
"29","6/6/2013","00:00.0","2013","6","6","Swann, Scott","44.4759","-68.2059","Hancock","ME","HERG","No nesting seabirds encountered.  Eagle nest - not sure if active or not.Location comm:","00510","Herring Gull","Larus","argentatus",2013-06-06,"Maine"
"30","6/6/2013","00:00.0","2013","6","6","Swann, Scott","44.4759","-68.2059","Hancock","ME","GBBG","No nesting seabirds encountered.  Eagle nest - not sure if active or not.Location comm:","00470","Great Black-backed Gull","Larus","marinus",2013-06-06,"Maine"
"31","5/31/2013","00:00.0","2013","5","31","Chalfant, Jordan","44.4673","-67.7374","Washington","ME","GBBG","GBBG correction factor = 1.004; HEGU correction factor = 0.9882.  48 CANADA GEESE.Location comm:","00470","Great Black-backed Gull","Larus","marinus",2013-05-31,"Maine"
"32","5/31/2013","00:00.0","2013","5","31","Chalfant, Jordan","44.4673","-67.7374","Washington","ME","HERG","GBBG correction factor = 1.004; HEGU correction factor = 0.9882.  48 CANADA GEESE.Location comm:","00510","Herring Gull","Larus","argentatus",2013-05-31,"Maine"
"33","5/31/2013","00:00.0","2013","5","31","Chalfant, Jordan","44.4673","-67.7374","Washington","ME","DCCO","GBBG correction factor = 1.004; HEGU correction factor = 0.9882.  48 CANADA GEESE.Location comm:","01200","Double-crested Cormorant","Phalacrocorax","auritus",2013-05-31,"Maine"
"34","5/31/2013","00:00.0","2013","5","31","Chalfant, Jordan","44.4673","-67.7374","Washington","ME","CANG","GBBG correction factor = 1.004; HEGU correction factor = 0.9882.  48 CANADA GEESE.Location comm:","01720","Canada Goose","Branta","canadensis",2013-05-31,"Maine"
"35","6/15/2013","00:00.0","2013","6","15","Anderson, John","44.0272","-68.5757","Knox","ME","HERG","7 HEGU + 2 GBBG (individuals) present with no evidence of nesting at this island.Location comm:","00510","Herring Gull","Larus","argentatus",2013-06-15,"Maine"
"36","6/15/2013","00:00.0","2013","6","15","Anderson, John","44.0272","-68.5757","Knox","ME","GBBG","7 HEGU + 2 GBBG (individuals) present with no evidence of nesting at this island.Location comm:","00470","Great Black-backed Gull","Larus","marinus",2013-06-15,"Maine"
"37","6/15/2013","00:00.0","2013","6","15","Anderson, John","44.0272","-68.5757","Knox","ME","DCCO","7 HEGU + 2 GBBG (individuals) present with no evidence of nesting at this island.Location comm:","01200","Double-crested Cormorant","Phalacrocorax","auritus",2013-06-15,"Maine"
"38","5/28/2013","00:00.0","2013","5","28","Chalfant, Jordan","43.5091","-70.3178","York","ME","GBBG","GBBG correction factor = 1.004; HEGU correction factor = 0.9882.Location comm:","00470","Great Black-backed Gull","Larus","marinus",2013-05-28,"Maine"
"39","5/28/2013","00:00.0","2013","5","28","Chalfant, Jordan","43.5091","-70.3178","York","ME","HERG","GBBG correction factor = 1.004; HEGU correction factor = 0.9882.Location comm:","00510","Herring Gull","Larus","argentatus",2013-05-28,"Maine"
"40","5/28/2013","00:00.0","2013","5","28","Chalfant, Jordan","43.5091","-70.3178","York","ME","DCCO","GBBG correction factor = 1.004; HEGU correction factor = 0.9882.Location comm:","01200","Double-crested Cormorant","Phalacrocorax","auritus",2013-05-28,"Maine"
"41","6/15/2013","00:00.0","2013","6","15","Anderson, John","44.0124","-68.7709","Knox","ME","HERG","cannot extrapolate number of nests from single bird count in boat.Location comm:","00510","Herring Gull","Larus","argentatus",2013-06-15,"Maine"
"42","6/15/2013","00:00.0","2013","6","15","Anderson, John","44.0124","-68.7709","Knox","ME","GBBG","cannot extrapolate number of nests from single bird count in boat.Location comm:","00470","Great Black-backed Gull","Larus","marinus",2013-06-15,"Maine"
"43","6/15/2013","00:00.0","2013","6","15","Anderson, John","44.0124","-68.7709","Knox","ME","DCCO","cannot extrapolate number of nests from single bird count in boat.Location comm:","01200","Double-crested Cormorant","Phalacrocorax","auritus",2013-06-15,"Maine"
"44","5/30/2013","00:00.0","2013","5","30","Williams, Sarah","44.1094","-68.4671","Hancock","ME","GBBG","GBBG correction factor = 1.004; HEGU correction factor = 0.9882.Location comm:","00470","Great Black-backed Gull","Larus","marinus",2013-05-30,"Maine"
"45","5/30/2013","00:00.0","2013","5","30","Williams, Sarah","44.1094","-68.4671","Hancock","ME","HERG","GBBG correction factor = 1.004; HEGU correction factor = 0.9882.Location comm:","00510","Herring Gull","Larus","argentatus",2013-05-30,"Maine"
"46","5/30/2013","00:00.0","2013","5","30","Williams, Sarah","44.1094","-68.4671","Hancock","ME","DCCO","GBBG correction factor = 1.004; HEGU correction factor = 0.9882.Location comm:","01200","Double-crested Cormorant","Phalacrocorax","auritus",2013-05-30,"Maine"
"47","5/30/2013","00:00.0","2013","5","30","Schauffler, Rick","44.0124","-68.7709","Knox","ME","GBBG","GBBG correction factor = 1.004; HEGU correction factor = 0.9882.Location comm:","00470","Great Black-backed Gull","Larus","marinus",2013-05-30,"Maine"
"48","5/30/2013","00:00.0","2013","5","30","Schauffler, Rick","44.0124","-68.7709","Knox","ME","HERG","GBBG correction factor = 1.004; HEGU correction factor = 0.9882.Location comm:","00510","Herring Gull","Larus","argentatus",2013-05-30,"Maine"
"49","5/30/2013","00:00.0","2013","5","30","Schauffler, Rick","44.0124","-68.7709","Knox","ME","DCCO","GBBG correction factor = 1.004; HEGU correction factor = 0.9882.Location comm:","01200","Double-crested Cormorant","Phalacrocorax","auritus",2013-05-30,"Maine"
"50","5/28/2013","00:00.0","2013","5","28","Houston, Bob","43.6982","-70.0676","Cumberland","ME","COEI","No correction noted.Location comm:","01590","Common Eider","Somateria","mollissima",2013-05-28,"Maine"
"51","5/28/2013","00:00.0","2013","5","28","Houston, Bob","43.6982","-70.0676","Cumberland","ME","GBBG","No correction noted.Location comm:","00470","Great Black-backed Gull","Larus","marinus",2013-05-28,"Maine"
"52","5/28/2013","00:00.0","2013","5","28","Houston, Bob","43.6982","-70.0676","Cumberland","ME","HERG","No correction noted.Location comm:","00510","Herring Gull","Larus","argentatus",2013-05-28,"Maine"
"53","5/28/2013","00:00.0","2013","5","28","Houston, Bob","43.6982","-70.0676","Cumberland","ME","DCCO","No correction noted.Location comm:","01200","Double-crested Cormorant","Phalacrocorax","auritus",2013-05-28,"Maine"
"54","5/28/2013","00:00.0","2013","5","28","Houston, Bob","43.7005","-70.0665","Cumberland","ME","COEI","No correction noted.Location comm:","01590","Common Eider","Somateria","mollissima",2013-05-28,"Maine"
"55","5/28/2013","00:00.0","2013","5","28","Houston, Bob","43.7005","-70.0665","Cumberland","ME","GBBG","No correction noted.Location comm:","00470","Great Black-backed Gull","Larus","marinus",2013-05-28,"Maine"
"56","5/28/2013","00:00.0","2013","5","28","Houston, Bob","43.7005","-70.0665","Cumberland","ME","HERG","No correction noted.Location comm:","00510","Herring Gull","Larus","argentatus",2013-05-28,"Maine"
"57","5/28/2013","00:00.0","2013","5","28","Houston, Bob","43.7005","-70.0665","Cumberland","ME","DCCO","No correction noted.Location comm:","01200","Double-crested Cormorant","Phalacrocorax","auritus",2013-05-28,"Maine"
"58","6/19/2013","00:00.0","2013","6","19","Houston, Bob","43.7077","-69.8913","Cumberland","ME","COTE","No correction noted.  DCCO appear to be nesting but couldn't count them accurately.  Gull chicks also seen.Location comm:","00700","Common Tern","Sterna","hirundo",2013-06-19,"Maine"
"59","6/19/2013","00:00.0","2013","6","19","Houston, Bob","43.7077","-69.8913","Cumberland","ME","ROST","No correction noted.  DCCO appear to be nesting but couldn't count them accurately.  Gull chicks also seen.Location comm:","00720","Roseate Tern","Sterna","dougallii",2013-06-19,"Maine"
"60","6/19/2013","00:00.0","2013","6","19","Houston, Bob","43.7077","-69.8913","Cumberland","ME","ARTE","No correction noted.  DCCO appear to be nesting but couldn't count them accurately.  Gull chicks also seen.Location comm:","00710","Arctic Tern","Sterna","paradisaea",2013-06-19,"Maine"
"61","5/28/2013","00:00.0","2013","5","28","Mittelhauser, Glen","43.7077","-69.8913","Cumberland","ME","GBBG","GBBG Corecction factor = 1.004; HEGU correction factor = 0.9882.Location comm:","00470","Great Black-backed Gull","Larus","marinus",2013-05-28,"Maine"
"62","5/28/2013","00:00.0","2013","5","28","Mittelhauser, Glen","43.7077","-69.8913","Cumberland","ME","HERG","GBBG Corecction factor = 1.004; HEGU correction factor = 0.9882.Location comm:","00510","Herring Gull","Larus","argentatus",2013-05-28,"Maine"
"63","5/28/2013","00:00.0","2013","5","28","Mittelhauser, Glen","43.7077","-69.8913","Cumberland","ME","DCCO","GBBG Corecction factor = 1.004; HEGU correction factor = 0.9882.Location comm:","01200","Double-crested Cormorant","Phalacrocorax","auritus",2013-05-28,"Maine"
"64","5/28/2013","00:00.0","2013","5","28","Chalfant, Jordan","43.6954","-70.0722","Cumberland","ME","GBBG","GBBG Corecction factor = 1.004; HEGU correction factor = 0.9882.Location comm:","00470","Great Black-backed Gull","Larus","marinus",2013-05-28,"Maine"
"65","5/28/2013","00:00.0","2013","5","28","Chalfant, Jordan","43.6954","-70.0722","Cumberland","ME","HERG","GBBG Corecction factor = 1.004; HEGU correction factor = 0.9882.Location comm:","00510","Herring Gull","Larus","argentatus",2013-05-28,"Maine"
"66","5/28/2013","00:00.0","2013","5","28","Chalfant, Jordan","43.6954","-70.0722","Cumberland","ME","DCCO","GBBG Corecction factor = 1.004; HEGU correction factor = 0.9882.Location comm:","01200","Double-crested Cormorant","Phalacrocorax","auritus",2013-05-28,"Maine"
"67","5/31/2013","00:00.0","2013","5","31","Mittelhauser, Glen","44.4625","-67.6194","Washington","ME","GBBG","GBBG correction factor = 1.004; HEGU correction factor = 0.9882.Location comm:","00470","Great Black-backed Gull","Larus","marinus",2013-05-31,"Maine"
"68","5/31/2013","00:00.0","2013","5","31","Mittelhauser, Glen","44.4625","-67.6194","Washington","ME","HERG","GBBG correction factor = 1.004; HEGU correction factor = 0.9882.Location comm:","00510","Herring Gull","Larus","argentatus",2013-05-31,"Maine"
"69","5/31/2013","00:00.0","2013","5","31","Mittelhauser, Glen","44.4625","-67.6194","Washington","ME","DCCO","GBBG correction factor = 1.004; HEGU correction factor = 0.9882.Location comm:","01200","Double-crested Cormorant","Phalacrocorax","auritus",2013-05-31,"Maine"
"70","5/31/2013","00:00.0","2013","5","31","Chalfant, Jordan","43.3467","-70.4471","York","ME","GBBG","GBBG correction factor = 1.004; HEGU correction factor = 0.9882.Location comm:","00470","Great Black-backed Gull","Larus","marinus",2013-05-31,"Maine"
"71","5/31/2013","00:00.0","2013","5","31","Chalfant, Jordan","43.3467","-70.4471","York","ME","HERG","GBBG correction factor = 1.004; HEGU correction factor = 0.9882.Location comm:","00510","Herring Gull","Larus","argentatus",2013-05-31,"Maine"
"72","5/31/2013","00:00.0","2013","5","31","Chalfant, Jordan","43.3467","-70.4471","York","ME","DCCO","GBBG correction factor = 1.004; HEGU correction factor = 0.9882.Location comm:","01200","Double-crested Cormorant","Phalacrocorax","auritus",2013-05-31,"Maine"
"73","5/30/2013","00:00.0","2013","5","30","Mittelhauser, Glen","44.8816","-66.9978","Washington","ME","GBBG","GBBG correction factor = 1.004; HEGU correction factor = 0.9882.Location comm:","00470","Great Black-backed Gull","Larus","marinus",2013-05-30,"Maine"
"74","5/30/2013","00:00.0","2013","5","30","Mittelhauser, Glen","44.8816","-66.9978","Washington","ME","HERG","GBBG correction factor = 1.004; HEGU correction factor = 0.9882.Location comm:","00510","Herring Gull","Larus","argentatus",2013-05-30,"Maine"
"75","5/30/2013","00:00.0","2013","5","30","Mittelhauser, Glen","44.8816","-66.9978","Washington","ME","DCCO","GBBG correction factor = 1.004; HEGU correction factor = 0.9882.Location comm:","01200","Double-crested Cormorant","Phalacrocorax","auritus",2013-05-30,"Maine"
"76","5/30/2013","00:00.0","2013","5","30","Schauffler, Rick","44.0239","-68.7982","Knox","ME","GBBG","GBBG correction factor = 1.004; HEGU correction factor = 0.9882.Location comm:","00470","Great Black-backed Gull","Larus","marinus",2013-05-30,"Maine"
"77","5/30/2013","00:00.0","2013","5","30","Schauffler, Rick","44.0239","-68.7982","Knox","ME","HERG","GBBG correction factor = 1.004; HEGU correction factor = 0.9882.Location comm:","00510","Herring Gull","Larus","argentatus",2013-05-30,"Maine"
"78","5/30/2013","00:00.0","2013","5","30","Schauffler, Rick","44.0239","-68.7982","Knox","ME","DCCO","GBBG correction factor = 1.004; HEGU correction factor = 0.9882.Location comm:","01200","Double-crested Cormorant","Phalacrocorax","auritus",2013-05-30,"Maine"
"79","5/31/2013","00:00.0","2013","5","31","Chalfant, Jordan","42.9783","-70.6078","York","ME","GBBG","GBBG correction factor = 1.004; HEGU correction factor = 0.9882.Location comm:","00470","Great Black-backed Gull","Larus","marinus",2013-05-31,"Maine"
"80","5/31/2013","00:00.0","2013","5","31","Chalfant, Jordan","42.9783","-70.6078","York","ME","HERG","GBBG correction factor = 1.004; HEGU correction factor = 0.9882.Location comm:","00510","Herring Gull","Larus","argentatus",2013-05-31,"Maine"
"81","5/31/2013","00:00.0","2013","5","31","Chalfant, Jordan","42.9783","-70.6078","York","ME","DCCO","GBBG correction factor = 1.004; HEGU correction factor = 0.9882.Location comm:","01200","Double-crested Cormorant","Phalacrocorax","auritus",2013-05-31,"Maine"
"82","5/28/2013","00:00.0","2013","5","28","Chalfant, Jordan","43.7512","-69.9483","Cumberland","ME","GBBG","GBBG Corecction factor = 1.004; HEGU correction factor = 0.9882.Location comm:","00470","Great Black-backed Gull","Larus","marinus",2013-05-28,"Maine"
"83","5/28/2013","00:00.0","2013","5","28","Chalfant, Jordan","43.7512","-69.9483","Cumberland","ME","HERG","GBBG Corecction factor = 1.004; HEGU correction factor = 0.9882.Location comm:","00510","Herring Gull","Larus","argentatus",2013-05-28,"Maine"
"84","5/28/2013","00:00.0","2013","5","28","Chalfant, Jordan","43.7512","-69.9483","Cumberland","ME","DCCO","GBBG Corecction factor = 1.004; HEGU correction factor = 0.9882.Location comm:","01200","Double-crested Cormorant","Phalacrocorax","auritus",2013-05-28,"Maine"
"85","5/30/2013","00:00.0","2013","5","30","Langlois, Michael","44.2129","-68.8121","Hancock","ME","GBBG","GBBG correction factor = 1.004; HEGU correction factor = 0.9882.Location comm:","00470","Great Black-backed Gull","Larus","marinus",2013-05-30,"Maine"
"86","5/30/2013","00:00.0","2013","5","30","Langlois, Michael","44.2129","-68.8121","Hancock","ME","HERG","GBBG correction factor = 1.004; HEGU correction factor = 0.9882.Location comm:","00510","Herring Gull","Larus","argentatus",2013-05-30,"Maine"
"87","5/30/2013","00:00.0","2013","5","30","Langlois, Michael","44.2129","-68.8121","Hancock","ME","DCCO","GBBG correction factor = 1.004; HEGU correction factor = 0.9882.Location comm:","01200","Double-crested Cormorant","Phalacrocorax","auritus",2013-05-30,"Maine"
"88","5/20/2013","00:00.0","2013","5","20","Houston, Bob","43.713","-70.1943","Cumberland","ME","COEI","No correction noted.Location comm: Ledge with 2 trees on it.","01590","Common Eider","Somateria","mollissima",2013-05-20,"Maine"
"89","5/20/2013","00:00.0","2013","5","20","Houston, Bob","43.713","-70.1943","Cumberland","ME","GBBG","No correction noted.Location comm: Ledge with 2 trees on it.","00470","Great Black-backed Gull","Larus","marinus",2013-05-20,"Maine"
"90","5/20/2013","00:00.0","2013","5","20","Houston, Bob","43.713","-70.1943","Cumberland","ME","HERG","No correction noted.Location comm: Ledge with 2 trees on it.","00510","Herring Gull","Larus","argentatus",2013-05-20,"Maine"
"91","5/30/2013","00:00.0","2013","5","30","Mittelhauser, Glen","44.2605","-68.8411","Hancock","ME","GBBG","GBBG correction factor = 1.004; HEGU correction factor = 0.9882.Location comm:","00470","Great Black-backed Gull","Larus","marinus",2013-05-30,"Maine"
"92","5/30/2013","00:00.0","2013","5","30","Mittelhauser, Glen","44.2605","-68.8411","Hancock","ME","HERG","GBBG correction factor = 1.004; HEGU correction factor = 0.9882.Location comm:","00510","Herring Gull","Larus","argentatus",2013-05-30,"Maine"
"93","5/30/2013","00:00.0","2013","5","30","Mittelhauser, Glen","44.2605","-68.8411","Hancock","ME","DCCO","GBBG correction factor = 1.004; HEGU correction factor = 0.9882.Location comm:","01200","Double-crested Cormorant","Phalacrocorax","auritus",2013-05-30,"Maine"
"94","5/30/2013","00:00.0","2013","5","30","Mittelhauser, Glen","44.0228","-69.0353","Knox","ME","GBBG","GBBG correction factor = 1.004; HEGU correction factor = 0.9882.Location comm:","00470","Great Black-backed Gull","Larus","marinus",2013-05-30,"Maine"
"95","5/30/2013","00:00.0","2013","5","30","Mittelhauser, Glen","44.0228","-69.0353","Knox","ME","HERG","GBBG correction factor = 1.004; HEGU correction factor = 0.9882.Location comm:","00510","Herring Gull","Larus","argentatus",2013-05-30,"Maine"
"96","5/30/2013","00:00.0","2013","5","30","Mittelhauser, Glen","44.0228","-69.0353","Knox","ME","DCCO","GBBG correction factor = 1.004; HEGU correction factor = 0.9882.Location comm:","01200","Double-crested Cormorant","Phalacrocorax","auritus",2013-05-30,"Maine"
"97","5/21/2013","00:00.0","2013","5","21","Houston, Bob","43.708","-70.1354","Cumberland","ME","COEI","No correction noted.  GBBG seen on nest on northeast edge of island (survey by boat). No other birds seen from boat; light vegetation on island may be hiding other nesters.Location comm: Ledge north o","01590","Common Eider","Somateria","mollissima",2013-05-21,"Maine"
"98","5/21/2013","00:00.0","2013","5","21","Houston, Bob","43.708","-70.1354","Cumberland","ME","GBBG","No correction noted.  GBBG seen on nest on northeast edge of island (survey by boat). No other birds seen from boat; light vegetation on island may be hiding other nesters.Location comm: Ledge north o","00470","Great Black-backed Gull","Larus","marinus",2013-05-21,"Maine"
"99","5/21/2013","00:00.0","2013","5","21","Houston, Bob","43.708","-70.1354","Cumberland","ME","HERG","No correction noted.  GBBG seen on nest on northeast edge of island (survey by boat). No other birds seen from boat; light vegetation on island may be hiding other nesters.Location comm: Ledge north o","00510","Herring Gull","Larus","argentatus",2013-05-21,"Maine"
"100","5/21/2013","00:00.0","2013","5","21","Houston, Bob","43.6867","-70.1868","Cumberland","ME","COEI","No correction noted.  GBBG sen on nest on west edge of island (survey by boat) but couldn't see any gulls on interior of island (if they were there, we probably would have seen them).  Many eiders see","01590","Common Eider","Somateria","mollissima",2013-05-21,"Maine"
"101","5/21/2013","00:00.0","2013","5","21","Houston, Bob","43.6867","-70.1868","Cumberland","ME","GBBG","No correction noted.  GBBG sen on nest on west edge of island (survey by boat) but couldn't see any gulls on interior of island (if they were there, we probably would have seen them).  Many eiders see","00470","Great Black-backed Gull","Larus","marinus",2013-05-21,"Maine"
"102","5/21/2013","00:00.0","2013","5","21","Houston, Bob","43.6867","-70.1868","Cumberland","ME","HERG","No correction noted.  GBBG sen on nest on west edge of island (survey by boat) but couldn't see any gulls on interior of island (if they were there, we probably would have seen them).  Many eiders see","00510","Herring Gull","Larus","argentatus",2013-05-21,"Maine"
"103","5/30/2013","00:00.0","2013","5","30","Gettle, Beth","44.1878","-68.4378","Hancock","ME","GBBG","GBBG correction factor = 1.004; HEGU correction factor = 0.9882. 1 canada goose nest.Location comm:","00470","Great Black-backed Gull","Larus","marinus",2013-05-30,"Maine"
"104","5/30/2013","00:00.0","2013","5","30","Gettle, Beth","44.1878","-68.4378","Hancock","ME","HERG","GBBG correction factor = 1.004; HEGU correction factor = 0.9882. 1 canada goose nest.Location comm:","00510","Herring Gull","Larus","argentatus",2013-05-30,"Maine"
"105","5/30/2013","00:00.0","2013","5","30","Gettle, Beth","44.1878","-68.4378","Hancock","ME","DCCO","GBBG correction factor = 1.004; HEGU correction factor = 0.9882. 1 canada goose nest.Location comm:","01200","Double-crested Cormorant","Phalacrocorax","auritus",2013-05-30,"Maine"
"106","5/30/2013","00:00.0","2013","5","30","Gettle, Beth","44.1878","-68.4378","Hancock","ME","CANG","GBBG correction factor = 1.004; HEGU correction factor = 0.9882. 1 canada goose nest.Location comm:","01720","Canada Goose","Branta","canadensis",2013-05-30,"Maine"
"107","6/6/2013","00:00.0","2013","6","6","Mittelhauser, Glen","44.4432","-67.6012","Washington","ME","HERG","6 eagles on island.Location comm:","00510","Herring Gull","Larus","argentatus",2013-06-06,"Maine"
"108","6/6/2013","00:00.0","2013","6","6","Mittelhauser, Glen","44.4432","-67.6012","Washington","ME","GBBG","6 eagles on island.Location comm:","00470","Great Black-backed Gull","Larus","marinus",2013-06-06,"Maine"
"109","6/6/2013","00:00.0","2013","6","6","Mittelhauser, Glen","44.4409","-67.6064","Washington","ME","GBBG","Landed and checked island visually. 3 eggs in nest.  No correction necessary.Location comm:","00470","Great Black-backed Gull","Larus","marinus",2013-06-06,"Maine"
"110","5/31/2013","00:00.0","2013","5","31","Mittelhauser, Glen","44.4409","-67.6064","Washington","ME","GBBG","GBBG correction factor = 1.004; HEGU correction factor = 0.9882.Location comm:","00470","Great Black-backed Gull","Larus","marinus",2013-05-31,"Maine"
"111","5/31/2013","00:00.0","2013","5","31","Mittelhauser, Glen","44.4409","-67.6064","Washington","ME","HERG","GBBG correction factor = 1.004; HEGU correction factor = 0.9882.Location comm:","00510","Herring Gull","Larus","argentatus",2013-05-31,"Maine"
"112","5/31/2013","00:00.0","2013","5","31","Mittelhauser, Glen","44.4409","-67.6064","Washington","ME","DCCO","GBBG correction factor = 1.004; HEGU correction factor = 0.9882.Location comm:","01200","Double-crested Cormorant","Phalacrocorax","auritus",2013-05-31,"Maine"
"113","5/30/2013","00:00.0","2013","5","30","Chalfant, Jordan","43.7568","-69.6162","Lincoln","ME","GBBG","GBBG correction factor = 1.004; HEGU correction factor = 0.9882. 36 individual CAGO (some may be eiders).Location comm:","00470","Great Black-backed Gull","Larus","marinus",2013-05-30,"Maine"
"114","5/30/2013","00:00.0","2013","5","30","Chalfant, Jordan","43.7568","-69.6162","Lincoln","ME","HERG","GBBG correction factor = 1.004; HEGU correction factor = 0.9882. 36 individual CAGO (some may be eiders).Location comm:","00510","Herring Gull","Larus","argentatus",2013-05-30,"Maine"
"115","5/30/2013","00:00.0","2013","5","30","Chalfant, Jordan","43.7568","-69.6162","Lincoln","ME","DCCO","GBBG correction factor = 1.004; HEGU correction factor = 0.9882. 36 individual CAGO (some may be eiders).Location comm:","01200","Double-crested Cormorant","Phalacrocorax","auritus",2013-05-30,"Maine"
"116","5/30/2013","00:00.0","2013","5","30","Chalfant, Jordan","43.7568","-69.6162","Lincoln","ME","CANG","GBBG correction factor = 1.004; HEGU correction factor = 0.9882. 36 individual CAGO (some may be eiders).Location comm:","01720","Canada Goose","Branta","canadensis",2013-05-30,"Maine"
"117","6/19/2013","00:00.0","2013","6","19","Houston, Bob","43.8065","-69.686","Lincoln","ME","COTE","No correction noted.Location comm:","00700","Common Tern","Sterna","hirundo",2013-06-19,"Maine"
"118","6/19/2013","00:00.0","2013","6","19","Houston, Bob","43.8065","-69.686","Lincoln","ME","ROST","No correction noted.Location comm:","00720","Roseate Tern","Sterna","dougallii",2013-06-19,"Maine"
"119","6/19/2013","00:00.0","2013","6","19","Houston, Bob","43.8065","-69.686","Lincoln","ME","ARTE","No correction noted.Location comm:","00710","Arctic Tern","Sterna","paradisaea",2013-06-19,"Maine"
"120","5/31/2013","00:00.0","2013","5","31","Chalfant, Jordan","43.0049","-70.6046","York","ME","GBBG","GBBG correction factor = 1.004; HEGU correction factor = 0.9882.  5 COEI/CAGO/Unknown.Location comm:","00470","Great Black-backed Gull","Larus","marinus",2013-05-31,"Maine"
"121","5/31/2013","00:00.0","2013","5","31","Chalfant, Jordan","43.0049","-70.6046","York","ME","HERG","GBBG correction factor = 1.004; HEGU correction factor = 0.9882.  5 COEI/CAGO/Unknown.Location comm:","00510","Herring Gull","Larus","argentatus",2013-05-31,"Maine"
"122","5/31/2013","00:00.0","2013","5","31","Chalfant, Jordan","43.0049","-70.6046","York","ME","DCCO","GBBG correction factor = 1.004; HEGU correction factor = 0.9882.  5 COEI/CAGO/Unknown.Location comm:","01200","Double-crested Cormorant","Phalacrocorax","auritus",2013-05-31,"Maine"
"123","5/31/2013","00:00.0","2013","5","31","Chalfant, Jordan","43.0049","-70.6046","York","ME","COEI","GBBG correction factor = 1.004; HEGU correction factor = 0.9882.  5 COEI/CAGO/Unknown.Location comm:","01590","Common Eider","Somateria","mollissima",2013-05-31,"Maine"
"124","5/28/2013","00:00.0","2013","5","28","Chalfant, Jordan","43.7689","-69.9213","Cumberland","ME","GBBG","GBBG Corecction factor = 1.004; HEGU correction factor = 0.9882. 1 CSGOLocation comm:","00470","Great Black-backed Gull","Larus","marinus",2013-05-28,"Maine"
"125","5/28/2013","00:00.0","2013","5","28","Chalfant, Jordan","43.7689","-69.9213","Cumberland","ME","HERG","GBBG Corecction factor = 1.004; HEGU correction factor = 0.9882. 1 CSGOLocation comm:","00510","Herring Gull","Larus","argentatus",2013-05-28,"Maine"
"126","5/28/2013","00:00.0","2013","5","28","Chalfant, Jordan","43.7689","-69.9213","Cumberland","ME","DCCO","GBBG Corecction factor = 1.004; HEGU correction factor = 0.9882. 1 CSGOLocation comm:","01200","Double-crested Cormorant","Phalacrocorax","auritus",2013-05-28,"Maine"
"127","6/13/2013","00:00.0","2013","6","13","Allen, Brad","43.7689","-69.9213","Cumberland","ME","HERG","No correction factors noted.Location comm:","00510","Herring Gull","Larus","argentatus",2013-06-13,"Maine"
"128","6/13/2013","00:00.0","2013","6","13","Allen, Brad","43.7689","-69.9213","Cumberland","ME","GBBG","No correction factors noted.Location comm:","00470","Great Black-backed Gull","Larus","marinus",2013-06-13,"Maine"
"129","6/13/2013","00:00.0","2013","6","13","Allen, Brad","43.7689","-69.9213","Cumberland","ME","DCCO","No correction factors noted.Location comm:","01200","Double-crested Cormorant","Phalacrocorax","auritus",2013-06-13,"Maine"
"130","5/28/2013","00:00.0","2013","5","28","Chalfant, Jordan","43.7689","-69.9213","Cumberland","ME","CANG","GBBG Corecction factor = 1.004; HEGU correction factor = 0.9882. 1 CSGOLocation comm:","01720","Canada Goose","Branta","canadensis",2013-05-28,"Maine"
"131","5/28/2013","00:00.0","2013","5","28","Chalfant, Jordan","43.711","-70.0529","Cumberland","ME","GBBG","GBBG Corecction factor = 1.004; HEGU correction factor = 0.9882.  2 bald eagles.Location comm:","00470","Great Black-backed Gull","Larus","marinus",2013-05-28,"Maine"
"149","5/31/2013","00:00.0","2013","5","31","Welch, Linda","44.4041","-67.9364","Washington","ME","HERG","GBBG correction factor = 1.004; HEGU correction factor = 0.9882.Location comm:","00510","Herring Gull","Larus","argentatus",2013-05-31,"Maine"
"132","5/28/2013","00:00.0","2013","5","28","Chalfant, Jordan","43.711","-70.0529","Cumberland","ME","HERG","GBBG Corecction factor = 1.004; HEGU correction factor = 0.9882.  2 bald eagles.Location comm:","00510","Herring Gull","Larus","argentatus",2013-05-28,"Maine"
"133","5/28/2013","00:00.0","2013","5","28","Chalfant, Jordan","43.711","-70.0529","Cumberland","ME","DCCO","GBBG Corecction factor = 1.004; HEGU correction factor = 0.9882.  2 bald eagles.Location comm:","01200","Double-crested Cormorant","Phalacrocorax","auritus",2013-05-28,"Maine"
"134","5/28/2013","00:00.0","2013","5","28","Chalfant, Jordan","43.4796","-70.3592","York","ME","GBBG","GBBG correction factor = 1.004; HEGU correction factor = 0.9882.Location comm:","00470","Great Black-backed Gull","Larus","marinus",2013-05-28,"Maine"
"135","5/28/2013","00:00.0","2013","5","28","Chalfant, Jordan","43.4796","-70.3592","York","ME","HERG","GBBG correction factor = 1.004; HEGU correction factor = 0.9882.Location comm:","00510","Herring Gull","Larus","argentatus",2013-05-28,"Maine"
"136","5/28/2013","00:00.0","2013","5","28","Chalfant, Jordan","43.4796","-70.3592","York","ME","DCCO","GBBG correction factor = 1.004; HEGU correction factor = 0.9882.Location comm:","01200","Double-crested Cormorant","Phalacrocorax","auritus",2013-05-28,"Maine"
"137","6/5/2013","00:00.0","2013","6","5","Langlois, Michael","43.7779","-69.3102","Lincoln","ME","HERG","vegetation did not obscure nests.  Adjusted actual count to reflect visual observations of a maximum of 3-8 GBBG on/flying over isalnd during ground count.  Nest count by clutch size  HERG 1 egg:13, 2","00510","Herring Gull","Larus","argentatus",2013-06-05,"Maine"
"138","6/5/2013","00:00.0","2013","6","5","Langlois, Michael","43.7779","-69.3102","Lincoln","ME","GBBG","vegetation did not obscure nests.  Adjusted actual count to reflect visual observations of a maximum of 3-8 GBBG on/flying over isalnd during ground count.  Nest count by clutch size  HERG 1 egg:13, 2","00470","Great Black-backed Gull","Larus","marinus",2013-06-05,"Maine"
"139","6/5/2013","00:00.0","2013","6","5","Langlois, Michael","43.7779","-69.3102","Lincoln","ME","COEI","vegetation did not obscure nests.  Adjusted actual count to reflect visual observations of a maximum of 3-8 GBBG on/flying over isalnd during ground count.  Nest count by clutch size  HERG 1 egg:13, 2","01590","Common Eider","Somateria","mollissima",2013-06-05,"Maine"
"140","6/15/2013","00:00.0","2013","6","15","Lee Post, Maggie","43.8608","-69.3823","Knox","ME","COTE","Nests numbers were 708 with 1.032 apllied correction andtehnadding instudy nests (100) to equal 831.Location comm:","00700","Common Tern","Sterna","hirundo",2013-06-15,"Maine"
"141","6/21/2013","00:00.0","2013","6","21","Lee Post, Maggie","43.8608","-69.3823","Knox","ME","ROST","No correction noted.Location comm:","00720","Roseate Tern","Sterna","dougallii",2013-06-21,"Maine"
"142","6/21/2013","00:00.0","2013","6","21","Lee Post, Maggie","43.8608","-69.3823","Knox","ME","ARTE","No correction noted.Location comm:","00710","Arctic Tern","Sterna","paradisaea",2013-06-21,"Maine"
"143","6/15/2013","00:00.0","2013","6","15","Lee Post, Maggie","43.8608","-69.3823","Knox","ME","LAGU","No correction noted.  This nest count could be low due to pre-census nest destruction of over 200 LAGU nests.  This sampling took palce over three says JUN 13-15.  ALL nests were reported to have been","00580","Laughing Gull","Larus","atricilla",2013-06-15,"Maine"
"144","NULL","","2013","NULL","NULL","Lee Post, Maggie","43.8608","-69.3823","Knox","ME","COEI","No correction noted.  Common Eifer nests were identified opportunistically during the census.Location comm:","01590","Common Eider","Somateria","mollissima",NA,"Maine"
"145","NULL","","2013","NULL","NULL","Lee Post, Maggie","43.8608","-69.3823","Knox","ME","ATPU","No correction noted. ""This year 86 active puffin burrows were on the island, not including complexes."" ; therefore, it is uncertain if it is a complete count.Location comm:","00130","Atlantic Puffin","Fratercula","arctica",NA,"Maine"
"146","NULL","","2013","NULL","NULL","Lee Post, Maggie","43.8608","-69.3823","Knox","ME","GBBG","No correction noted.  Nest was destroyed. NineHerring gulls were shot over the island over the courseof the season. LAGU and GBBG appeared to the the predominant predators forterns.Location comm:","00470","Great Black-backed Gull","Larus","marinus",NA,"Maine"
"147","NULL","","2013","NULL","NULL","Lee Post, Maggie","43.8608","-69.3823","Knox","ME","BLGU","No correction noted.  BLGU nests were part of a productivity studyfor the first tme and 23 nests were followed.Location comm:","00270","Black Guillemot","Cepphus","grylle",NA,"Maine"
"148","5/31/2013","00:00.0","2013","5","31","Welch, Linda","44.4041","-67.9364","Washington","ME","GBBG","GBBG correction factor = 1.004; HEGU correction factor = 0.9882.Location comm:","00470","Great Black-backed Gull","Larus","marinus",2013-05-31,"Maine"
"1969","NULL","","2009","4","24","Waltee","NULL","NULL","Custer","MT","Great Blue Heron","NULL","01940","Great Blue Heron","Ardea","herodias",NA,"Montana"
"1970","NULL","","2009","4","25","Waltee","NULL","NULL","Prairie","MT","Great Blue Heron","NULL","01940","Great Blue Heron","Ardea","herodias",NA,"Montana"
"1971","NULL","","2009","4","25","Waltee","NULL","NULL","Dawson","MT","Great Blue Heron","NULL","01940","Great Blue Heron","Ardea","herodias",NA,"Montana"
"1972","NULL","","2009","4","24","Waltee","NULL","NULL","Custer","MT","Great Blue Heron","NULL","01940","Great Blue Heron","Ardea","herodias",NA,"Montana"
"1973","NULL","","2009","4","24","Waltee","NULL","NULL","Rosebud","MT","Great Blue Heron","NULL","01940","Great Blue Heron","Ardea","herodias",NA,"Montana"
"1974","NULL","","2009","4","24","Waltee","NULL","NULL","Treasure","MT","Great Blue Heron","NULL","01940","Great Blue Heron","Ardea","herodias",NA,"Montana"
"1975","NULL","","2009","4","24","Waltee","NULL","NULL","Treasure","MT","Great Blue Heron","NULL","01940","Great Blue Heron","Ardea","herodias",NA,"Montana"
"1976","NULL","","2009","4","24","Waltee","NULL","NULL","Treasure","MT","Great Blue Heron","NULL","01940","Great Blue Heron","Ardea","herodias",NA,"Montana"
"1977","6/18/2009","00:00.0","2009","6","18","Tilly et al.","NULL","NULL","Roosevelt","MT","Black-crowned Night-Heron","NULL","02020","Black-crowned Night-Heron","Nycticorax","nycticorax",2009-06-18,"Montana"
"1978","NULL","","2009","6","18","Tilly et al.","NULL","NULL","Roosevelt","MT","Eared Grebe","NULL","00040","Eared Grebe","Podiceps","nigricollis",NA,"Montana"
"1979","6/18/2009","00:00.0","2009","6","18","Tilly et al.","NULL","NULL","Roosevelt","MT","Forster's Tern","NULL","00690","Forster's Tern","Sterna","forsteri",2009-06-18,"Montana"
"1980","6/18/2009","00:00.0","2009","6","18","Tilly et al.","NULL","NULL","Roosevelt","MT","Franklin's Gull","NULL","00590","Franklin's Gull","Larus","pipixcan",2009-06-18,"Montana"
"1981","6/18/2009","00:00.0","2009","6","18","Tilly et al.","NULL","NULL","Roosevelt","MT","White-faced Ibis","NULL","01870","White-faced Ibis","Plegadis","chihi",2009-06-18,"Montana"
"1982","7/8/2011","00:00.0","2011","7","8","Spaur","NULL","NULL","Roosevelt","MT","Black-crowned Night-Heron","NULL","02020","Black-crowned Night-Heron","Nycticorax","nycticorax",2011-07-08,"Montana"
"1983","7/8/2011","00:00.0","2011","7","8","Spaur","NULL","NULL","Roosevelt","MT","Forster's Tern","NULL","00690","Forster's Tern","Sterna","forsteri",2011-07-08,"Montana"
"1984","7/8/2011","00:00.0","2011","7","8","Spaur","NULL","NULL","Roosevelt","MT","Franklin's Gull","NULL","00590","Franklin's Gull","Larus","pipixcan",2011-07-08,"Montana"
"1985","7/8/2011","00:00.0","2011","7","8","Spaur","NULL","NULL","Roosevelt","MT","White-faced Ibis","NULL","01870","White-faced Ibis","Plegadis","chihi",2011-07-08,"Montana"
"1986","NULL","","2011","5","5","Tilly/Taylor","NULL","NULL","Chouteau","MT","Great Blue Heron","NULL","01940","Great Blue Heron","Ardea","herodias",NA,"Montana"
"1987","6/14/2009","00:00.0","2009","6","14","Tilly","NULL","NULL","Sheridan","MT","Black Tern","NULL","00770","Black Tern","Chlidonias","niger",2009-06-14,"Montana"
"1988","5/29/2009","00:00.0","2009","5","29","Tilly et al.","NULL","NULL","Sheridan","MT","American White Pelican","NULL","01250","American White Pelican","Pelecanus","erythrorhynchos",2009-05-29,"Montana"
"1989","5/29/2009","00:00.0","2009","5","29","Tilly et al.","NULL","NULL","Sheridan","MT","Black-crowned Night-Heron","NULL","02020","Black-crowned Night-Heron","Nycticorax","nycticorax",2009-05-29,"Montana"
"1990","5/29/2009","00:00.0","2009","5","29","Tilly et al.","NULL","NULL","Sheridan","MT","California Gull","NULL","00530","California Gull","Larus","californicus",2009-05-29,"Montana"
"1991","5/29/2009","00:00.0","2009","5","29","Tilly et al.","NULL","NULL","Sheridan","MT","Double-crested Cormorant","NULL","01200","Double-crested Cormorant","Phalacrocorax","auritus",2009-05-29,"Montana"
"1992","5/29/2009","00:00.0","2009","5","29","Tilly et al.","NULL","NULL","Sheridan","MT","Ring-billed Gull","NULL","00540","Ring-billed Gull","Larus","delawarensis",2009-05-29,"Montana"
"1993","6/11/2009","00:00.0","2009","6","11","Tilly","NULL","NULL","Sheridan","MT","Forster's Tern","NULL","00690","Forster's Tern","Sterna","forsteri",2009-06-11,"Montana"
"1994","6/3/2010","00:00.0","2010","6","3","Tilly","NULL","NULL","Sheridan","MT","Ring-billed or California Gull","NULL","NULL",NA,NA,NA,2010-06-03,"Montana"
"1995","6/16/2010","00:00.0","2010","6","16","Jamison/Hale","NULL","NULL","Sheridan","MT","American White Pelican","NULL","01250","American White Pelican","Pelecanus","erythrorhynchos",2010-06-16,"Montana"
"1996","6/20/2010","00:00.0","2010","6","20","Tilly","NULL","NULL","Sheridan","MT","Forster's Tern","NULL","00690","Forster's Tern","Sterna","forsteri",2010-06-20,"Montana"
"1997","6/21/2010","00:00.0","2010","6","21","Tilly/Jamison","NULL","NULL","Sheridan","MT","Black-crowned Night-Heron","NULL","02020","Black-crowned Night-Heron","Nycticorax","nycticorax",2010-06-21,"Montana"
"1998","6/21/2010","00:00.0","2010","6","21","Tilly/Jamison","NULL","NULL","Sheridan","MT","California Gull","NULL","00530","California Gull","Larus","californicus",2010-06-21,"Montana"
"1999","6/21/2010","00:00.0","2010","6","21","Tilly/Jamison","NULL","NULL","Sheridan","MT","Ring-billed Gull","NULL","00540","Ring-billed Gull","Larus","delawarensis",2010-06-21,"Montana"
"2000","6/8/2011","00:00.0","2011","6","8","Jamison et al.","NULL","NULL","Sheridan","MT","American White Pelican","NULL","01250","American White Pelican","Pelecanus","erythrorhynchos",2011-06-08,"Montana"
"2001","6/8/2011","00:00.0","2011","6","8","Jamison et al.","NULL","NULL","Sheridan","MT","Black-crowned Night-Heron","NULL","02020","Black-crowned Night-Heron","Nycticorax","nycticorax",2011-06-08,"Montana"
"2002","6/8/2011","00:00.0","2011","6","8","Jamison et al.","NULL","NULL","Sheridan","MT","California Gull","NULL","00530","California Gull","Larus","californicus",2011-06-08,"Montana"
"2003","6/8/2011","00:00.0","2011","6","8","Jamison et al.","NULL","NULL","Sheridan","MT","Double-crested Cormorant","NULL","01200","Double-crested Cormorant","Phalacrocorax","auritus",2011-06-08,"Montana"
"2004","6/8/2011","00:00.0","2011","6","8","Jamison et al.","NULL","NULL","Sheridan","MT","Ring-billed Gull","NULL","00540","Ring-billed Gull","Larus","delawarensis",2011-06-08,"Montana"
"2005","6/18/2011","00:00.0","2011","6","18","Tilly","NULL","NULL","Sheridan","MT","Ring-billed or California Gull","NULL","NULL",NA,NA,NA,2011-06-18,"Montana"
"2006","NULL","","2010","6","0","Tilly et al.","NULL","NULL","Sheridan","MT","Double-crested Cormorant","NULL","01200","Double-crested Cormorant","Phalacrocorax","auritus",NA,"Montana"
"2007","6/27/2009","00:00.0","2009","6","27","Tilly","NULL","NULL","Phillips","MT","Black Tern","NULL","00770","Black Tern","Chlidonias","niger",2009-06-27,"Montana"
"2008","NULL","","2011","5","5","Tilly","NULL","NULL","Blaine","MT","Great Blue Heron","NULL","01940","Great Blue Heron","Ardea","herodias",NA,"Montana"
"2009","NULL","","2011","5","5","Tilly","NULL","NULL","Blaine","MT","Great Blue Heron","NULL","01940","Great Blue Heron","Ardea","herodias",NA,"Montana"
"2010","NULL","","2011","4","21","Taylor","NULL","NULL","Cascade","MT","Great Blue Heron","NULL","01940","Great Blue Heron","Ardea","herodias",NA,"Montana"
"2011","4/1/2011","00:00.0","2011","4","1","Wightman","NULL","NULL","Broadwater","MT","Great Blue Heron","NULL","01940","Great Blue Heron","Ardea","herodias",2011-04-01,"Montana"
"2012","6/18/2009","00:00.0","2009","6","18","Paige","NULL","NULL","Pondera","MT","Black Tern","NULL","00770","Black Tern","Chlidonias","niger",2009-06-18,"Montana"
"2013","6/20/2011","00:00.0","2011","6","20","DuBois/Throop","NULL","NULL","Powell","MT","Great Blue Heron","NULL","01940","Great Blue Heron","Ardea","herodias",2011-06-20,"Montana"
"2014","NULL","","2011","4","27","Stewart","NULL","NULL","Stillwater","MT","Great Blue Heron","NULL","01940","Great Blue Heron","Ardea","herodias",NA,"Montana"
"2015","6/4/2009","00:00.0","2009","6","4","DuBois","NULL","NULL","Mineral","MT","Great Blue Heron","NULL","01940","Great Blue Heron","Ardea","herodias",2009-06-04,"Montana"
"2016","6/18/2011","00:00.0","2011","6","18","DuBois/Throop","NULL","NULL","Mineral","MT","Great Blue Heron","NULL","01940","Great Blue Heron","Ardea","herodias",2011-06-18,"Montana"
"2017","6/14/2009","00:00.0","2009","6","14","Tilly","NULL","NULL","Sheridan","MT","Black Tern","NULL","00770","Black Tern","Chlidonias","niger",2009-06-14,"Montana"
"2018","6/14/2009","00:00.0","2009","6","14","Tilly","NULL","NULL","Sheridan","MT","Eared Grebe","NULL","00040","Eared Grebe","Podiceps","nigricollis",2009-06-14,"Montana"
"2019","7/14/2009","00:00.0","2009","7","14","Prellwitz","NULL","NULL","Phillips","MT","Eared Grebe","NULL","00040","Eared Grebe","Podiceps","nigricollis",2009-07-14,"Montana"
"2020","6/5/2009","00:00.0","2009","6","5","Paige/Hoyt","NULL","NULL","Lake","MT","Black Tern","NULL","00770","Black Tern","Chlidonias","niger",2009-06-05,"Montana"
"2021","6/5/2009","00:00.0","2009","6","5","Paige/Hoyt","NULL","NULL","Lake","MT","Caspian Tern","NULL","00640","Caspian Tern","Hydroprogne","caspia",2009-06-05,"Montana"
"2022","6/5/2009","00:00.0","2009","6","5","Paige/Hoyt","NULL","NULL","Lake","MT","Double-crested Cormorant","NULL","01200","Double-crested Cormorant","Phalacrocorax","auritus",2009-06-05,"Montana"
"2023","6/5/2009","00:00.0","2009","6","5","Paige/Hoyt","NULL","NULL","Lake","MT","Forster's Tern","NULL","00690","Forster's Tern","Sterna","forsteri",2009-06-05,"Montana"
"2024","6/5/2009","00:00.0","2009","6","5","Paige/Hoyt","NULL","NULL","Lake","MT","Great Blue Heron","NULL","01940","Great Blue Heron","Ardea","herodias",2009-06-05,"Montana"
"2025","6/5/2009","00:00.0","2009","6","5","Paige/Hoyt","NULL","NULL","Lake","MT","Ring-billed or California Gull","NULL","NULL",NA,NA,NA,2009-06-05,"Montana"
"2026","6/14/2010","00:00.0","2010","6","14","Doney et al.","NULL","NULL","Lake","MT","Clark's Grebe","NULL","00011","Clark's Grebe","Aechmophorus","clarkii",2010-06-14,"Montana"
"2027","6/14/2010","00:00.0","2010","6","14","Doney et al.","NULL","NULL","Lake","MT","Forster's Tern","NULL","00690","Forster's Tern","Sterna","forsteri",2010-06-14,"Montana"
"2028","6/14/2010","00:00.0","2010","6","14","Doney et al.","NULL","NULL","Lake","MT","Western Grebe","NULL","00010","Western Grebe","Aechmophorus","occidentalis",2010-06-14,"Montana"
"2029","6/15/2010","00:00.0","2010","6","15","Doney et al.","NULL","NULL","Lake","MT","California Gull","NULL","00530","California Gull","Larus","californicus",2010-06-15,"Montana"
"2030","6/15/2010","00:00.0","2010","6","15","Doney et al.","NULL","NULL","Lake","MT","Double-crested Cormorant","NULL","01200","Double-crested Cormorant","Phalacrocorax","auritus",2010-06-15,"Montana"
"2031","6/15/2010","00:00.0","2010","6","15","Doney et al.","NULL","NULL","Lake","MT","Forster's Tern","NULL","00690","Forster's Tern","Sterna","forsteri",2010-06-15,"Montana"
"2032","6/15/2010","00:00.0","2010","6","15","Doney et al.","NULL","NULL","Lake","MT","Great Blue Heron","NULL","01940","Great Blue Heron","Ardea","herodias",2010-06-15,"Montana"
"2033","6/15/2010","00:00.0","2010","6","15","Doney et al.","NULL","NULL","Lake","MT","Ring-billed Gull","NULL","00540","Ring-billed Gull","Larus","delawarensis",2010-06-15,"Montana"
"2034","6/14/2011","00:00.0","2011","6","14","Wightman/Lichtenberg","NULL","NULL","Lake","MT","California Gull","NULL","00530","California Gull","Larus","californicus",2011-06-14,"Montana"
"2035","6/14/2011","00:00.0","2011","6","14","Wightman/Lichtenberg","NULL","NULL","Lake","MT","Caspian Tern","NULL","00640","Caspian Tern","Hydroprogne","caspia",2011-06-14,"Montana"
"2036","6/14/2011","00:00.0","2011","6","14","Wightman/Lichtenberg","NULL","NULL","Lake","MT","Double-crested Cormorant","NULL","01200","Double-crested Cormorant","Phalacrocorax","auritus",2011-06-14,"Montana"
"2037","6/14/2011","00:00.0","2011","6","14","Wightman/Lichtenberg","NULL","NULL","Lake","MT","Forster's Tern","NULL","00690","Forster's Tern","Sterna","forsteri",2011-06-14,"Montana"
"2038","6/14/2011","00:00.0","2011","6","14","Wightman/Lichtenberg","NULL","NULL","Lake","MT","Great Blue Heron","NULL","01940","Great Blue Heron","Ardea","herodias",2011-06-14,"Montana"
"2039","6/14/2011","00:00.0","2011","6","14","Wightman/Lichtenberg","NULL","NULL","Lake","MT","Ring-billed Gull","NULL","00540","Ring-billed Gull","Larus","delawarensis",2011-06-14,"Montana"
"2040","6/14/2011","00:00.0","2011","6","14","Wightman/Lichtenberg","NULL","NULL","Lake","MT","Western Grebe","NULL","00010","Western Grebe","Aechmophorus","occidentalis",2011-06-14,"Montana"
"2041","6/14/2009","00:00.0","2009","6","14","Tilly","NULL","NULL","Sheridan","MT","Black Tern","NULL","00770","Black Tern","Chlidonias","niger",2009-06-14,"Montana"
"2042","NULL","","2010","5","8","Waltee","NULL","NULL","Prairie","MT","Great Blue Heron","NULL","01940","Great Blue Heron","Ardea","herodias",NA,"Montana"
"2043","5/8/2010","00:00.0","2010","5","8","Waltee","NULL","NULL","Custer","MT","Great Blue Heron","NULL","01940","Great Blue Heron","Ardea","herodias",2010-05-08,"Montana"
"2044","5/8/2010","00:00.0","2010","5","8","Waltee","NULL","NULL","Fallon","MT","Great Blue Heron","NULL","01940","Great Blue Heron","Ardea","herodias",2010-05-08,"Montana"
"2045","5/8/2010","00:00.0","2010","5","8","Waltee","NULL","NULL","Fallon","MT","Great Blue Heron","NULL","01940","Great Blue Heron","Ardea","herodias",2010-05-08,"Montana"
"2046","5/8/2010","00:00.0","2010","5","8","Waltee","NULL","NULL","Fallon","MT","Great Blue Heron","NULL","01940","Great Blue Heron","Ardea","herodias",2010-05-08,"Montana"
"2047","6/14/2010","00:00.0","2010","6","14","Wightman et al.","NULL","NULL","Lake","MT","Double-crested Cormorant","NULL","01200","Double-crested Cormorant","Phalacrocorax","auritus",2010-06-14,"Montana"
"2048","6/14/2010","00:00.0","2010","6","14","Wightman et al.","NULL","NULL","Lake","MT","Double-crested Cormorant","NULL","01200","Double-crested Cormorant","Phalacrocorax","auritus",2010-06-14,"Montana"
"2049","6/14/2010","00:00.0","2010","6","14","Wightman et al.","NULL","NULL","Lake","MT","Great Blue Heron","NULL","01940","Great Blue Heron","Ardea","herodias",2010-06-14,"Montana"
"2050","6/14/2011","00:00.0","2011","6","14","Wightman","NULL","NULL","Lake","MT","Double-crested Cormorant","NULL","01200","Double-crested Cormorant","Phalacrocorax","auritus",2011-06-14,"Montana"
"2051","6/17/2009","00:00.0","2009","6","17","Tilly","NULL","NULL","Phillips","MT","Eared Grebe","NULL","00040","Eared Grebe","Podiceps","nigricollis",2009-06-17,"Montana"
"2052","5/20/2011","00:00.0","2011","5","20","DuBois/Throop","NULL","NULL","Missoula","MT","Great Blue Heron","NULL","01940","Great Blue Heron","Ardea","herodias",2011-05-20,"Montana"
"2053","5/20/2011","00:00.0","2011","5","20","DuBois/Throop","NULL","NULL","Missoula","MT","Great Blue Heron","NULL","01940","Great Blue Heron","Ardea","herodias",2011-05-20,"Montana"
"2054","5/8/2010","00:00.0","2010","5","8","Waltee","NULL","NULL","Custer","MT","Great Blue Heron","NULL","01940","Great Blue Heron","Ardea","herodias",2010-05-08,"Montana"
"2055","5/8/2010","00:00.0","2010","5","8","Waltee","NULL","NULL","Custer","MT","Great Blue Heron","NULL","01940","Great Blue Heron","Ardea","herodias",2010-05-08,"Montana"
"2056","5/1/2009","00:00.0","2009","5","1","Waltee","NULL","NULL","Powder River","MT","Great Blue Heron","NULL","01940","Great Blue Heron","Ardea","herodias",2009-05-01,"Montana"
"2057","5/1/2009","00:00.0","2009","5","1","Waltee","NULL","NULL","Powder River","MT","Great Blue Heron","NULL","01940","Great Blue Heron","Ardea","herodias",2009-05-01,"Montana"
"2058","5/1/2009","00:00.0","2009","5","1","Waltee","NULL","NULL","Custer","MT","Great Blue Heron","NULL","01940","Great Blue Heron","Ardea","herodias",2009-05-01,"Montana"
"2059","5/1/2009","00:00.0","2009","5","1","Waltee","NULL","NULL","Powder River","MT","Great Blue Heron","NULL","01940","Great Blue Heron","Ardea","herodias",2009-05-01,"Montana"
"2060","5/8/2010","00:00.0","2010","5","8","Waltee","NULL","NULL","Custer","MT","Great Blue Heron","NULL","01940","Great Blue Heron","Ardea","herodias",2010-05-08,"Montana"
"2061","5/8/2010","00:00.0","2010","5","8","Waltee","NULL","NULL","Custer","MT","Great Blue Heron","NULL","01940","Great Blue Heron","Ardea","herodias",2010-05-08,"Montana"
"2062","5/1/2009","00:00.0","2009","5","1","Waltee","NULL","NULL","Powder River","MT","Great Blue Heron","NULL","01940","Great Blue Heron","Ardea","herodias",2009-05-01,"Montana"
"2063","7/16/2010","00:00.0","2010","7","16","Amestot/George","NULL","NULL","Phillips","MT","Eared Grebe","NULL","00040","Eared Grebe","Podiceps","nigricollis",2010-07-16,"Montana"
"2064","6/16/2010","00:00.0","2010","6","16","Doney/Lichtenburg","NULL","NULL","Sanders","MT","Black Tern","NULL","00770","Black Tern","Chlidonias","niger",2010-06-16,"Montana"
"2065","4/24/2010","00:00.0","2010","4","24","Waltee","NULL","NULL","Powder River","MT","Great Blue Heron","NULL","01940","Great Blue Heron","Ardea","herodias",2010-04-24,"Montana"
"2066","NULL","","2010","NULL","NULL","Warren et al.","NULL","NULL","Beaverhead","MT","Double-crested Cormorant","NULL","01200","Double-crested Cormorant","Phalacrocorax","auritus",NA,"Montana"
"2067","NULL","","2010","NULL","NULL","Warren et al.","NULL","NULL","Beaverhead","MT","Great Blue Heron","NULL","01940","Great Blue Heron","Ardea","herodias",NA,"Montana"
"2068","5/28/2009","00:00.0","2009","5","28","Warren et al.","NULL","NULL","Beaverhead","MT","Double-crested Cormorant","NULL","01200","Double-crested Cormorant","Phalacrocorax","auritus",2009-05-28,"Montana"
"941","4/26/2010","00:00.0","2010","4","26","Zaun","NULL","NULL","La Paz","AZ","Great Blue Heron","NULL","01940","Great Blue Heron","Ardea","herodias",2010-04-26,"Arizona"
"942","5/11/2010","00:00.0","2010","5","11","Zaun","NULL","NULL","La Paz","AZ","Great Blue Heron","NULL","01940","Great Blue Heron","Ardea","herodias",2010-05-11,"Arizona"
"943","3/24/2011","00:00.0","2011","3","24","Zaun","NULL","NULL","La Paz","AZ","Great Blue Heron","NULL","01940","Great Blue Heron","Ardea","herodias",2011-03-24,"Arizona"
"944","4/18/2011","00:00.0","2011","4","18","Zaun","NULL","NULL","La Paz","AZ","Great Blue Heron","NULL","01940","Great Blue Heron","Ardea","herodias",2011-04-18,"Arizona"
"945","5/14/2011","00:00.0","2011","5","14","Zaun","NULL","NULL","La Paz","AZ","Great Blue Heron","NULL","01940","Great Blue Heron","Ardea","herodias",2011-05-14,"Arizona"
"946","4/26/2010","00:00.0","2010","4","26","Zaun","NULL","NULL","La Paz","AZ","Great Blue Heron","NULL","01940","Great Blue Heron","Ardea","herodias",2010-04-26,"Arizona"
"947","4/16/2011","00:00.0","2011","4","16","Zaun","NULL","NULL","La Paz","AZ","Great Blue Heron","NULL","01940","Great Blue Heron","Ardea","herodias",2011-04-16,"Arizona"
"948","4/27/2010","00:00.0","2010","4","27","Kee","NULL","NULL","Santa Cruz","AZ","Great Blue Heron","NULL","01940","Great Blue Heron","Ardea","herodias",2010-04-27,"Arizona"
"949","5/27/2010","00:00.0","2010","5","27","Corman","NULL","NULL","Santa Cruz","AZ","Great Blue Heron","NULL","01940","Great Blue Heron","Ardea","herodias",2010-05-27,"Arizona"
"950","5/31/2010","00:00.0","2010","5","31","Kee","NULL","NULL","Santa Cruz","AZ","Great Blue Heron","NULL","01940","Great Blue Heron","Ardea","herodias",2010-05-31,"Arizona"
"951","6/9/2010","00:00.0","2010","6","9","Kee","NULL","NULL","Santa Cruz","AZ","Great Blue Heron","NULL","01940","Great Blue Heron","Ardea","herodias",2010-06-09,"Arizona"
"952","7/14/2010","00:00.0","2010","7","14","Kee","NULL","NULL","Santa Cruz","AZ","Great Blue Heron","NULL","01940","Great Blue Heron","Ardea","herodias",2010-07-14,"Arizona"
"953","3/27/2011","00:00.0","2011","3","27","Kee","NULL","NULL","Santa Cruz","AZ","Great Blue Heron","NULL","01940","Great Blue Heron","Ardea","herodias",2011-03-27,"Arizona"
"954","4/8/2009","00:00.0","2009","4","8","Corman","NULL","NULL","Maricopa","AZ","Great Blue Heron","NULL","01940","Great Blue Heron","Ardea","herodias",2009-04-08,"Arizona"
"955","4/7/2010","00:00.0","2010","4","7","Corman","NULL","NULL","Maricopa","AZ","Great Blue Heron","NULL","01940","Great Blue Heron","Ardea","herodias",2010-04-07,"Arizona"
"956","3/6/2011","00:00.0","2011","3","6","Corman","NULL","NULL","Maricopa","AZ","Great Blue Heron","NULL","01940","Great Blue Heron","Ardea","herodias",2011-03-06,"Arizona"
"957","4/8/2009","00:00.0","2009","4","8","Corman","NULL","NULL","Maricopa","AZ","Great Blue Heron","NULL","01940","Great Blue Heron","Ardea","herodias",2009-04-08,"Arizona"
"958","4/25/2009","00:00.0","2009","4","25","Corman","NULL","NULL","La Paz","AZ","Cattle Egret","NULL","02001","Cattle Egret","Bubulcus","ibis",2009-04-25,"Arizona"
"959","4/25/2009","00:00.0","2009","4","25","Corman","NULL","NULL","La Paz","AZ","White-faced Ibis","NULL","01870","White-faced Ibis","Plegadis","chihi",2009-04-25,"Arizona"
"960","7/9/2009","00:00.0","2009","7","9","Piest","NULL","NULL","La Paz","AZ","Cattle Egret","NULL","02001","Cattle Egret","Bubulcus","ibis",2009-07-09,"Arizona"
"961","7/9/2009","00:00.0","2009","7","9","Piest","NULL","NULL","La Paz","AZ","White-faced Ibis","NULL","01870","White-faced Ibis","Plegadis","chihi",2009-07-09,"Arizona"
"962","7/15/2009","00:00.0","2009","7","15","Piest","NULL","NULL","La Paz","AZ","Cattle Egret","NULL","02001","Cattle Egret","Bubulcus","ibis",2009-07-15,"Arizona"
"963","7/15/2009","00:00.0","2009","7","15","Piest","NULL","NULL","La Paz","AZ","Snowy Egret","NULL","01970","Snowy Egret","Egretta","thula",2009-07-15,"Arizona"
"964","7/15/2009","00:00.0","2009","7","15","Piest","NULL","NULL","La Paz","AZ","White-faced Ibis","NULL","01870","White-faced Ibis","Plegadis","chihi",2009-07-15,"Arizona"
"965","5/1/2011","00:00.0","2011","5","1","Harter/Vander Pluym","NULL","NULL","La Paz","AZ","White-faced Ibis","NULL","01870","White-faced Ibis","Plegadis","chihi",2011-05-01,"Arizona"
"966","5/14/2011","00:00.0","2011","5","14","Harter/Vander Pluym","NULL","NULL","La Paz","AZ","White-faced Ibis","NULL","01870","White-faced Ibis","Plegadis","chihi",2011-05-14,"Arizona"
"967","4/24/2011","00:00.0","2011","4","24","Harter/Vander Pluym","NULL","NULL","La Paz","AZ","Cattle Egret","NULL","02001","Cattle Egret","Bubulcus","ibis",2011-04-24,"Arizona"
"968","4/24/2011","00:00.0","2011","4","24","Harter/Vander Pluym","NULL","NULL","La Paz","AZ","White-faced Ibis","NULL","01870","White-faced Ibis","Plegadis","chihi",2011-04-24,"Arizona"
"969","5/9/2011","00:00.0","2011","5","9","Harter/Vander Pluym","NULL","NULL","La Paz","AZ","Black-crowned Night-Heron","NULL","02020","Black-crowned Night-Heron","Nycticorax","nycticorax",2011-05-09,"Arizona"
"970","5/9/2011","00:00.0","2011","5","9","Piest","NULL","NULL","La Paz","AZ","Cattle Egret","NULL","02001","Cattle Egret","Bubulcus","ibis",2011-05-09,"Arizona"
"971","5/9/2011","00:00.0","2011","5","9","Piest","NULL","NULL","La Paz","AZ","White-faced Ibis","NULL","01870","White-faced Ibis","Plegadis","chihi",2011-05-09,"Arizona"
"972","6/3/2011","00:00.0","2011","6","3","Harter/Vander Pluym","NULL","NULL","La Paz","AZ","Snowy Egret","NULL","01970","Snowy Egret","Egretta","thula",2011-06-03,"Arizona"
"973","6/3/2011","00:00.0","2011","6","3","Harter/Vander Pluym","NULL","NULL","La Paz","AZ","White-faced Ibis","NULL","01870","White-faced Ibis","Plegadis","chihi",2011-06-03,"Arizona"
"974","5/1/2011","00:00.0","2011","5","1","Harter/Vander Pluym","NULL","NULL","La Paz","AZ","Great Egret","NULL","01960","Great Egret","Ardea","alba",2011-05-01,"Arizona"
"975","5/9/2011","00:00.0","2011","5","9","Piest","NULL","NULL","La Paz","AZ","Great Egret","NULL","01960","Great Egret","Ardea","alba",2011-05-09,"Arizona"
"976","4/29/2011","00:00.0","2011","4","29","Corman/Lewis","NULL","NULL","Maricopa","AZ","Great Blue Heron","NULL","01940","Great Blue Heron","Ardea","herodias",2011-04-29,"Arizona"
"977","4/29/2011","00:00.0","2011","4","29","Corman/Lewis","NULL","NULL","Maricopa","AZ","Neotropic Cormorant","NULL","01210","Neotropic Cormorant","Phalacrocorax","brasilianus",2011-04-29,"Arizona"
"978","3/24/2011","00:00.0","2011","3","24","Ottinger/Vader","NULL","NULL","Maricopa","AZ","Great Blue Heron","NULL","01940","Great Blue Heron","Ardea","herodias",2011-03-24,"Arizona"
"979","5/10/2009","00:00.0","2009","5","10","Piest","NULL","NULL","Yuma","AZ","Great Blue Heron","NULL","01940","Great Blue Heron","Ardea","herodias",2009-05-10,"Arizona"
"980","5/9/2010","00:00.0","2010","5","9","Piest","NULL","NULL","Yuma","AZ","Great Blue Heron","NULL","01940","Great Blue Heron","Ardea","herodias",2010-05-09,"Arizona"
"981","4/20/2011","00:00.0","2011","4","20","Piest","NULL","NULL","Yuma","AZ","Great Blue Heron","NULL","01940","Great Blue Heron","Ardea","herodias",2011-04-20,"Arizona"
"982","4/12/2009","00:00.0","2009","4","12","Corman","NULL","NULL","Maricopa","AZ","Great Blue Heron","NULL","01940","Great Blue Heron","Ardea","herodias",2009-04-12,"Arizona"
"983","4/7/2010","00:00.0","2010","4","7","Corman","NULL","NULL","Maricopa","AZ","Great Blue Heron","NULL","01940","Great Blue Heron","Ardea","herodias",2010-04-07,"Arizona"
"984","4/28/2011","00:00.0","2011","4","28","Corman","NULL","NULL","Maricopa","AZ","Great Blue Heron","NULL","01940","Great Blue Heron","Ardea","herodias",2011-04-28,"Arizona"
"985","4/15/2010","00:00.0","2010","4","15","Lynn","NULL","NULL","Coconino","AZ","Great Blue Heron","NULL","01940","Great Blue Heron","Ardea","herodias",2010-04-15,"Arizona"
"986","5/31/2011","00:00.0","2011","5","31","Lemon","NULL","NULL","Coconino","AZ","Great Blue Heron","NULL","01940","Great Blue Heron","Ardea","herodias",2011-05-31,"Arizona"
"987","4/2/2010","00:00.0","2010","4","2","Anderson","NULL","NULL","Cochise","AZ","Great Blue Heron","NULL","01940","Great Blue Heron","Ardea","herodias",2010-04-02,"Arizona"
"988","4/27/2010","00:00.0","2010","4","27","Radke","NULL","NULL","Cochise","AZ","Great Blue Heron","NULL","01940","Great Blue Heron","Ardea","herodias",2010-04-27,"Arizona"
"989","1/30/2010","00:00.0","2010","1","30","Paintner/Paintner","NULL","NULL","La Paz","AZ","Great Blue Heron","NULL","01940","Great Blue Heron","Ardea","herodias",2010-01-30,"Arizona"
"990","2/25/2010","00:00.0","2010","2","25","Paintner/Paintner","NULL","NULL","La Paz","AZ","Great Blue Heron","NULL","01940","Great Blue Heron","Ardea","herodias",2010-02-25,"Arizona"
"991","3/30/2010","00:00.0","2010","3","30","Paintner/Paintner","NULL","NULL","La Paz","AZ","Great Blue Heron","NULL","01940","Great Blue Heron","Ardea","herodias",2010-03-30,"Arizona"
"992","3/8/2011","00:00.0","2011","3","8","Paintner/Paintner","NULL","NULL","La Paz","AZ","Great Blue Heron","NULL","01940","Great Blue Heron","Ardea","herodias",2011-03-08,"Arizona"
"993","3/21/2011","00:00.0","2011","3","21","Richmond","NULL","NULL","La Paz","AZ","Great Blue Heron","NULL","01940","Great Blue Heron","Ardea","herodias",2011-03-21,"Arizona"
"994","4/15/2011","00:00.0","2011","4","15","Silva","NULL","NULL","Yavapai","AZ","Double-crested Cormorant","NULL","01200","Double-crested Cormorant","Phalacrocorax","auritus",2011-04-15,"Arizona"
"995","4/7/2010","00:00.0","2010","4","7","Stewart et al.","NULL","NULL","Yavapai","AZ","Double-crested Cormorant","NULL","01200","Double-crested Cormorant","Phalacrocorax","auritus",2010-04-07,"Arizona"
"996","4/15/2011","00:00.0","2011","4","15","Silva","NULL","NULL","Yavapai","AZ","Double-crested Cormorant","NULL","01200","Double-crested Cormorant","Phalacrocorax","auritus",2011-04-15,"Arizona"
"997","5/13/2010","00:00.0","2010","5","13","Morrall","NULL","NULL","Coconino","AZ","Great Blue Heron","NULL","01940","Great Blue Heron","Ardea","herodias",2010-05-13,"Arizona"
"998","6/16/2011","00:00.0","2011","6","16","Morrall","NULL","NULL","Coconino","AZ","Great Blue Heron","NULL","01940","Great Blue Heron","Ardea","herodias",2011-06-16,"Arizona"
"999","5/27/2009","00:00.0","2009","5","27","Corman","NULL","NULL","Santa Cruz","AZ","Great Blue Heron","NULL","01940","Great Blue Heron","Ardea","herodias",2009-05-27,"Arizona"
"1000","5/28/2009","00:00.0","2009","5","28","MacVean/Lamkin","NULL","NULL","Coconino","AZ","Great Blue Heron","NULL","01940","Great Blue Heron","Ardea","herodias",2009-05-28,"Arizona"
"1001","5/4/2010","00:00.0","2010","5","4","Lamkin","NULL","NULL","Coconino","AZ","Great Blue Heron","NULL","01940","Great Blue Heron","Ardea","herodias",2010-05-04,"Arizona"
"1002","4/27/2011","00:00.0","2011","4","27","Lamkin","NULL","NULL","Coconino","AZ","Great Blue Heron","NULL","01940","Great Blue Heron","Ardea","herodias",2011-04-27,"Arizona"
"1003","2/22/2009","00:00.0","2009","2","22","Maikis/Janssen","NULL","NULL","Yavapai","AZ","Double-crested Cormorant","NULL","01200","Double-crested Cormorant","Phalacrocorax","auritus",2009-02-22,"Arizona"
"3975","NULL","","1984","NULL","NULL","NULL","NULL","NULL","Natrona","WY","Caspian Tern","NULL","00640","Caspian Tern","Hydroprogne","caspia",NA,"Wyoming"
"1004","3/25/2009","00:00.0","2009","3","25","Maikis/Janssen","NULL","NULL","Yavapai","AZ","Double-crested Cormorant","NULL","01200","Double-crested Cormorant","Phalacrocorax","auritus",2009-03-25,"Arizona"
"1005","4/20/2009","00:00.0","2009","4","20","Maikis/Janssen","NULL","NULL","Yavapai","AZ","Black-crowned Night-Heron","NULL","02020","Black-crowned Night-Heron","Nycticorax","nycticorax",2009-04-20,"Arizona"
"1006","4/20/2009","00:00.0","2009","4","20","Maikis/Janssen","NULL","NULL","Yavapai","AZ","Double-crested Cormorant","NULL","01200","Double-crested Cormorant","Phalacrocorax","auritus",2009-04-20,"Arizona"
"1007","4/20/2009","00:00.0","2009","4","20","Maikis/Janssen","NULL","NULL","Yavapai","AZ","Great Blue Heron","NULL","01940","Great Blue Heron","Ardea","herodias",2009-04-20,"Arizona"
"1008","2/24/2010","00:00.0","2010","2","24","Maikis/Janssen","NULL","NULL","Yavapai","AZ","Double-crested Cormorant","NULL","01200","Double-crested Cormorant","Phalacrocorax","auritus",2010-02-24,"Arizona"
"1009","2/24/2010","00:00.0","2010","2","24","Maikis/Janssen","NULL","NULL","Yavapai","AZ","Great Blue Heron","NULL","01940","Great Blue Heron","Ardea","herodias",2010-02-24,"Arizona"
"1010","3/22/2010","00:00.0","2010","3","22","Maikis/Janssen","NULL","NULL","Yavapai","AZ","Double-crested Cormorant","NULL","01200","Double-crested Cormorant","Phalacrocorax","auritus",2010-03-22,"Arizona"
"1011","3/22/2010","00:00.0","2010","3","22","Maikis/Janssen","NULL","NULL","Yavapai","AZ","Great Blue Heron","NULL","01940","Great Blue Heron","Ardea","herodias",2010-03-22,"Arizona"
"1012","4/20/2010","00:00.0","2010","4","20","Maikis/Janssen","NULL","NULL","Yavapai","AZ","Great Blue Heron","NULL","01940","Great Blue Heron","Ardea","herodias",2010-04-20,"Arizona"
"1013","4/20/2010","00:00.0","2010","4","20","Maikis/Janssen","NULL","NULL","Yavapai","AZ","Great Egret","NULL","01960","Great Egret","Ardea","alba",2010-04-20,"Arizona"
"1014","4/22/2010","00:00.0","2010","4","22","Maikis/Janssen","NULL","NULL","Yavapai","AZ","Double-crested Cormorant","NULL","01200","Double-crested Cormorant","Phalacrocorax","auritus",2010-04-22,"Arizona"
"1015","2/23/2009","00:00.0","2009","2","23","Maikis/Janssen","NULL","NULL","Yavapai","AZ","Great Blue Heron","NULL","01940","Great Blue Heron","Ardea","herodias",2009-02-23,"Arizona"
"1016","3/25/2009","00:00.0","2009","3","25","Maikis/Janssen","NULL","NULL","Yavapai","AZ","Great Blue Heron","NULL","01940","Great Blue Heron","Ardea","herodias",2009-03-25,"Arizona"
"1017","3/25/2009","00:00.0","2009","3","25","Maikis/Janssen","NULL","NULL","Yavapai","AZ","Great Blue Heron","NULL","01940","Great Blue Heron","Ardea","herodias",2009-03-25,"Arizona"
"1018","4/20/2009","00:00.0","2009","4","20","Maikis/Janssen","NULL","NULL","Yavapai","AZ","Great Blue Heron","NULL","01940","Great Blue Heron","Ardea","herodias",2009-04-20,"Arizona"
"1019","2/24/2010","00:00.0","2010","2","24","Maikis/Janssen","NULL","NULL","Yavapai","AZ","Great Blue Heron","NULL","01940","Great Blue Heron","Ardea","herodias",2010-02-24,"Arizona"
"1020","3/22/2010","00:00.0","2010","3","22","Maikis/Janssen","NULL","NULL","Yavapai","AZ","Great Blue Heron","NULL","01940","Great Blue Heron","Ardea","herodias",2010-03-22,"Arizona"
"1021","4/19/2010","00:00.0","2010","4","19","Maikis/Janssen","NULL","NULL","Yavapai","AZ","Great Blue Heron","NULL","01940","Great Blue Heron","Ardea","herodias",2010-04-19,"Arizona"
"1022","3/28/2010","00:00.0","2010","3","28","Brewster","NULL","NULL","Apache","AZ","Great Blue Heron","NULL","01940","Great Blue Heron","Ardea","herodias",2010-03-28,"Arizona"
"1023","6/17/2010","00:00.0","2010","6","17","Brewster","NULL","NULL","Apache","AZ","Great Blue Heron","NULL","01940","Great Blue Heron","Ardea","herodias",2010-06-17,"Arizona"
"1024","6/27/2011","00:00.0","2011","6","27","Brewster","NULL","NULL","Apache","AZ","Great Blue Heron","NULL","01940","Great Blue Heron","Ardea","herodias",2011-06-27,"Arizona"
"1025","4/29/2010","00:00.0","2010","4","29","Corman","NULL","NULL","Maricopa","AZ","Great Blue Heron","NULL","01940","Great Blue Heron","Ardea","herodias",2010-04-29,"Arizona"
"1026","4/29/2011","00:00.0","2011","4","29","Corman/Lewis","NULL","NULL","Maricopa","AZ","Great Blue Heron","NULL","01940","Great Blue Heron","Ardea","herodias",2011-04-29,"Arizona"
"1027","4/18/2009","00:00.0","2009","4","18","Dockens","NULL","NULL","Maricopa","AZ","Black-crowned Night-Heron","NULL","02020","Black-crowned Night-Heron","Nycticorax","nycticorax",2009-04-18,"Arizona"
"1028","4/18/2009","00:00.0","2009","4","18","Dockens","NULL","NULL","Maricopa","AZ","Great Blue Heron","NULL","01940","Great Blue Heron","Ardea","herodias",2009-04-18,"Arizona"
"1029","4/10/2010","00:00.0","2010","4","10","Dockens","NULL","NULL","Maricopa","AZ","Black-crowned Night-Heron","NULL","02020","Black-crowned Night-Heron","Nycticorax","nycticorax",2010-04-10,"Arizona"
"1030","4/10/2010","00:00.0","2010","4","10","Dockens","NULL","NULL","Maricopa","AZ","Great Blue Heron","NULL","01940","Great Blue Heron","Ardea","herodias",2010-04-10,"Arizona"
"1031","3/22/2011","00:00.0","2011","3","22","Dockens","NULL","NULL","Maricopa","AZ","Black-crowned Night-Heron","NULL","02020","Black-crowned Night-Heron","Nycticorax","nycticorax",2011-03-22,"Arizona"
"1032","3/22/2011","00:00.0","2011","3","22","Dockens","NULL","NULL","Maricopa","AZ","Great Blue Heron","NULL","01940","Great Blue Heron","Ardea","herodias",2011-03-22,"Arizona"
"1033","5/8/2010","00:00.0","2010","5","8","Piest","NULL","NULL","Yuma","AZ","Great Blue Heron","NULL","01940","Great Blue Heron","Ardea","herodias",2010-05-08,"Arizona"
"1034","4/20/2011","00:00.0","2011","4","20","Piest","NULL","NULL","Yuma","AZ","Great Blue Heron","NULL","01940","Great Blue Heron","Ardea","herodias",2011-04-20,"Arizona"
"1035","5/26/2009","00:00.0","2009","5","26","Piest","NULL","NULL","Yuma","AZ","Great Blue Heron","NULL","01940","Great Blue Heron","Ardea","herodias",2009-05-26,"Arizona"
"1036","4/22/2010","00:00.0","2010","4","22","Piest","NULL","NULL","Yuma","AZ","Great Blue Heron","NULL","01940","Great Blue Heron","Ardea","herodias",2010-04-22,"Arizona"
"1037","4/22/2011","00:00.0","2011","4","22","Piest","NULL","NULL","Yuma","AZ","Great Blue Heron","NULL","01940","Great Blue Heron","Ardea","herodias",2011-04-22,"Arizona"
"1038","1/16/2010","00:00.0","2010","1","16","Corman","NULL","NULL","Maricopa","AZ","Great Blue Heron","NULL","01940","Great Blue Heron","Ardea","herodias",2010-01-16,"Arizona"
"1039","4/29/2011","00:00.0","2011","4","29","Corman","NULL","NULL","Maricopa","AZ","Great Blue Heron","NULL","01940","Great Blue Heron","Ardea","herodias",2011-04-29,"Arizona"
"1040","6/7/2010","00:00.0","2010","6","7","Tso et al.","NULL","NULL","Coconino","AZ","Great Blue Heron","NULL","01940","Great Blue Heron","Ardea","herodias",2010-06-07,"Arizona"
"1041","6/20/2011","00:00.0","2011","6","20","Thompson","NULL","NULL","Coconino","AZ","Great Blue Heron","NULL","01940","Great Blue Heron","Ardea","herodias",2011-06-20,"Arizona"
"1042","3/31/2010","00:00.0","2010","3","31","Arnett","NULL","NULL","Maricopa","AZ","Black-crowned Night-Heron","NULL","02020","Black-crowned Night-Heron","Nycticorax","nycticorax",2010-03-31,"Arizona"
"1043","3/31/2010","00:00.0","2010","3","31","Arnett","NULL","NULL","Maricopa","AZ","Cattle Egret","NULL","02001","Cattle Egret","Bubulcus","ibis",2010-03-31,"Arizona"
"1044","3/31/2010","00:00.0","2010","3","31","Arnett","NULL","NULL","Maricopa","AZ","Double-crested Cormorant","NULL","01200","Double-crested Cormorant","Phalacrocorax","auritus",2010-03-31,"Arizona"
"1045","3/31/2010","00:00.0","2010","3","31","Arnett","NULL","NULL","Maricopa","AZ","Great Blue Heron","NULL","01940","Great Blue Heron","Ardea","herodias",2010-03-31,"Arizona"
"1046","3/31/2010","00:00.0","2010","3","31","Arnett","NULL","NULL","Maricopa","AZ","Great Egret","NULL","01960","Great Egret","Ardea","alba",2010-03-31,"Arizona"
"1047","3/31/2010","00:00.0","2010","3","31","Arnett","NULL","NULL","Maricopa","AZ","Snowy Egret","NULL","01970","Snowy Egret","Egretta","thula",2010-03-31,"Arizona"
"1048","5/21/2011","00:00.0","2011","5","21","Harter/Vander Pluym","NULL","NULL","La Paz","AZ","Great Blue Heron","NULL","01940","Great Blue Heron","Ardea","herodias",2011-05-21,"Arizona"
"1049","5/21/2011","00:00.0","2011","5","21","Harter/Vander Pluym","NULL","NULL","La Paz","AZ","Great Egret","NULL","01960","Great Egret","Ardea","alba",2011-05-21,"Arizona"
"1050","4/3/2009","00:00.0","2009","4","3","Hanna","NULL","NULL","Maricopa","AZ","Great Blue Heron","NULL","01940","Great Blue Heron","Ardea","herodias",2009-04-03,"Arizona"
"1051","1/29/2010","00:00.0","2010","1","29","Hanna","NULL","NULL","Maricopa","AZ","Great Blue Heron","NULL","01940","Great Blue Heron","Ardea","herodias",2010-01-29,"Arizona"
"1052","3/30/2011","00:00.0","2011","3","30","Burger","NULL","NULL","Maricopa","AZ","Great Blue Heron","NULL","01940","Great Blue Heron","Ardea","herodias",2011-03-30,"Arizona"
"1053","3/25/2009","00:00.0","2009","3","25","Clark","NULL","NULL","Maricopa","AZ","Great Blue Heron","NULL","01940","Great Blue Heron","Ardea","herodias",2009-03-25,"Arizona"
"1054","3/8/2010","00:00.0","2010","3","8","Clark","NULL","NULL","Maricopa","AZ","Great Blue Heron","NULL","01940","Great Blue Heron","Ardea","herodias",2010-03-08,"Arizona"
"1055","3/20/2011","00:00.0","2011","3","20","Clark","NULL","NULL","Maricopa","AZ","Great Blue Heron","NULL","01940","Great Blue Heron","Ardea","herodias",2011-03-20,"Arizona"
"1056","3/25/2009","00:00.0","2009","3","25","Clark","NULL","NULL","Maricopa","AZ","Great Blue Heron","NULL","01940","Great Blue Heron","Ardea","herodias",2009-03-25,"Arizona"
"1057","3/8/2010","00:00.0","2010","3","8","Clark","NULL","NULL","Maricopa","AZ","Great Blue Heron","NULL","01940","Great Blue Heron","Ardea","herodias",2010-03-08,"Arizona"
"1058","3/20/2011","00:00.0","2011","3","20","Clark","NULL","NULL","Maricopa","AZ","Great Blue Heron","NULL","01940","Great Blue Heron","Ardea","herodias",2011-03-20,"Arizona"
"1059","8/6/2009","00:00.0","2009","8","6","Luedeker","NULL","NULL","Coconino","AZ","Great Blue Heron","NULL","01940","Great Blue Heron","Ardea","herodias",2009-08-06,"Arizona"
"1060","4/21/2010","00:00.0","2010","4","21","Luedeker","NULL","NULL","Coconino","AZ","Great Blue Heron","NULL","01940","Great Blue Heron","Ardea","herodias",2010-04-21,"Arizona"
"1061","4/4/2011","00:00.0","2011","4","4","Luedeker","NULL","NULL","Coconino","AZ","Great Blue Heron","NULL","01940","Great Blue Heron","Ardea","herodias",2011-04-04,"Arizona"
"1062","4/24/2010","00:00.0","2010","4","24","Sitko/Davis","NULL","NULL","Apache","AZ","Double-crested Cormorant","NULL","01200","Double-crested Cormorant","Phalacrocorax","auritus",2010-04-24,"Arizona"
"1063","4/28/2011","00:00.0","2011","4","28","Valencia/Paradzick","NULL","NULL","Yavapai","AZ","Great Blue Heron","NULL","01940","Great Blue Heron","Ardea","herodias",2011-04-28,"Arizona"
"1064","5/10/2009","00:00.0","2009","5","10","Piest","NULL","NULL","Yuma","AZ","Cattle Egret","NULL","02001","Cattle Egret","Bubulcus","ibis",2009-05-10,"Arizona"
"1065","5/10/2009","00:00.0","2009","5","10","Piest","NULL","NULL","Yuma","AZ","Great Blue Heron","NULL","01940","Great Blue Heron","Ardea","herodias",2009-05-10,"Arizona"
"1066","5/10/2009","00:00.0","2009","5","10","Piest","NULL","NULL","Yuma","AZ","Great Egret","NULL","01960","Great Egret","Ardea","alba",2009-05-10,"Arizona"
"1067","5/9/2010","00:00.0","2010","5","9","Piest","NULL","NULL","Yuma","AZ","Cattle Egret","NULL","02001","Cattle Egret","Bubulcus","ibis",2010-05-09,"Arizona"
"1068","5/9/2010","00:00.0","2010","5","9","Piest","NULL","NULL","Yuma","AZ","Great Egret","NULL","01960","Great Egret","Ardea","alba",2010-05-09,"Arizona"
"1069","5/9/2010","00:00.0","2010","5","9","Piest","NULL","NULL","Yuma","AZ","Snowy Egret","NULL","01970","Snowy Egret","Egretta","thula",2010-05-09,"Arizona"
"1070","4/20/2011","00:00.0","2011","4","20","Piest","NULL","NULL","Yuma","AZ","Cattle Egret","NULL","02001","Cattle Egret","Bubulcus","ibis",2011-04-20,"Arizona"
"1071","4/20/2011","00:00.0","2011","4","20","Piest","NULL","NULL","Yuma","AZ","Great Egret","NULL","01960","Great Egret","Ardea","alba",2011-04-20,"Arizona"
"1072","4/20/2011","00:00.0","2011","4","20","Piest","NULL","NULL","Yuma","AZ","Snowy Egret","NULL","01970","Snowy Egret","Egretta","thula",2011-04-20,"Arizona"
"1073","5/9/2009","00:00.0","2009","5","9","Piest","NULL","NULL","Yuma","AZ","Snowy Egret","NULL","01970","Snowy Egret","Egretta","thula",2009-05-09,"Arizona"
"1074","5/6/2011","00:00.0","2011","5","6","Piest","NULL","NULL","Yuma","AZ","Cattle Egret","NULL","02001","Cattle Egret","Bubulcus","ibis",2011-05-06,"Arizona"
"1075","5/14/2011","00:00.0","2011","5","14","Piest","NULL","NULL","Yuma","AZ","Cattle Egret","NULL","02001","Cattle Egret","Bubulcus","ibis",2011-05-14,"Arizona"
"1076","5/14/2011","00:00.0","2011","5","14","Piest","NULL","NULL","Yuma","AZ","Great Egret","NULL","01960","Great Egret","Ardea","alba",2011-05-14,"Arizona"
"1077","5/14/2011","00:00.0","2011","5","14","Piest","NULL","NULL","Yuma","AZ","Snowy Egret","NULL","01970","Snowy Egret","Egretta","thula",2011-05-14,"Arizona"
"1078","4/9/2009","00:00.0","2009","4","9","McFarlin","NULL","NULL","Gila","AZ","Double-crested Cormorant","NULL","01200","Double-crested Cormorant","Phalacrocorax","auritus",2009-04-09,"Arizona"
"1079","4/9/2009","00:00.0","2009","4","9","McFarlin","NULL","NULL","Gila","AZ","Great Blue Heron","NULL","01940","Great Blue Heron","Ardea","herodias",2009-04-09,"Arizona"
"1080","5/6/2010","00:00.0","2010","5","6","McFarlin/Rodriguez","NULL","NULL","Gila","AZ","Double-crested Cormorant","NULL","01200","Double-crested Cormorant","Phalacrocorax","auritus",2010-05-06,"Arizona"
"1081","5/6/2010","00:00.0","2010","5","6","McFarlin/Rodriguez","NULL","NULL","Gila","AZ","Great Blue Heron","NULL","01940","Great Blue Heron","Ardea","herodias",2010-05-06,"Arizona"
"1082","3/15/2011","00:00.0","2011","3","15","Sayer/McFarlin","NULL","NULL","Gila","AZ","Double-crested Cormorant","NULL","01200","Double-crested Cormorant","Phalacrocorax","auritus",2011-03-15,"Arizona"
"1083","3/15/2011","00:00.0","2011","3","15","Sayer/McFarlin","NULL","NULL","Gila","AZ","Great Blue Heron","NULL","01940","Great Blue Heron","Ardea","herodias",2011-03-15,"Arizona"
"1084","2/26/2009","00:00.0","2009","2","26","Stroh","NULL","NULL","Gila","AZ","Double-crested Cormorant","NULL","01200","Double-crested Cormorant","Phalacrocorax","auritus",2009-02-26,"Arizona"
"1085","2/26/2009","00:00.0","2009","2","26","Stroh","NULL","NULL","Gila","AZ","Great Blue Heron","NULL","01940","Great Blue Heron","Ardea","herodias",2009-02-26,"Arizona"
"1086","4/9/2009","00:00.0","2009","4","9","McFarlin","NULL","NULL","Gila","AZ","Double-crested Cormorant","NULL","01200","Double-crested Cormorant","Phalacrocorax","auritus",2009-04-09,"Arizona"
"1087","4/9/2009","00:00.0","2009","4","9","McFarlin","NULL","NULL","Gila","AZ","Great Blue Heron","NULL","01940","Great Blue Heron","Ardea","herodias",2009-04-09,"Arizona"
"1088","5/6/2010","00:00.0","2010","5","6","McFarlin/Rodriguez","NULL","NULL","Gila","AZ","Great Blue Heron","NULL","01940","Great Blue Heron","Ardea","herodias",2010-05-06,"Arizona"
"1089","4/9/2009","00:00.0","2009","4","9","McFarlin","NULL","NULL","Gila","AZ","Great Blue Heron","NULL","01940","Great Blue Heron","Ardea","herodias",2009-04-09,"Arizona"
"1090","5/2/2010","00:00.0","2010","5","2","McFarlin/Rodriguez","NULL","NULL","Gila","AZ","Double-crested Cormorant","NULL","01200","Double-crested Cormorant","Phalacrocorax","auritus",2010-05-02,"Arizona"
"1091","5/2/2010","00:00.0","2010","5","2","McFarlin/Rodriguez","NULL","NULL","Gila","AZ","Great Blue Heron","NULL","01940","Great Blue Heron","Ardea","herodias",2010-05-02,"Arizona"
"1092","3/15/2011","00:00.0","2011","3","15","Sayer/McFarlin","NULL","NULL","Gila","AZ","Great Blue Heron","NULL","01940","Great Blue Heron","Ardea","herodias",2011-03-15,"Arizona"
"1093","4/9/2009","00:00.0","2009","4","9","McFarlin","NULL","NULL","Gila","AZ","Great Blue Heron","NULL","01940","Great Blue Heron","Ardea","herodias",2009-04-09,"Arizona"
"1094","2/25/2009","00:00.0","2009","2","25","O'Brien","NULL","NULL","Gila","AZ","Double-crested Cormorant","NULL","01200","Double-crested Cormorant","Phalacrocorax","auritus",2009-02-25,"Arizona"
"1095","2/25/2009","00:00.0","2009","2","25","O'Brien","NULL","NULL","Gila","AZ","Great Blue Heron","NULL","01940","Great Blue Heron","Ardea","herodias",2009-02-25,"Arizona"
"1096","4/26/2009","00:00.0","2009","4","26","McFarlin","NULL","NULL","Gila","AZ","Double-crested Cormorant","NULL","01200","Double-crested Cormorant","Phalacrocorax","auritus",2009-04-26,"Arizona"
"1097","4/26/2009","00:00.0","2009","4","26","McFarlin","NULL","NULL","Gila","AZ","Great Blue Heron","NULL","01940","Great Blue Heron","Ardea","herodias",2009-04-26,"Arizona"
"1098","5/3/2009","00:00.0","2009","5","3","Wike","NULL","NULL","Gila","AZ","Double-crested Cormorant","NULL","01200","Double-crested Cormorant","Phalacrocorax","auritus",2009-05-03,"Arizona"
"1099","5/3/2009","00:00.0","2009","5","3","Wike","NULL","NULL","Gila","AZ","Great Blue Heron","NULL","01940","Great Blue Heron","Ardea","herodias",2009-05-03,"Arizona"
"1100","2/24/2010","00:00.0","2010","2","24","Wike/Ward","NULL","NULL","Gila","AZ","Double-crested Cormorant","NULL","01200","Double-crested Cormorant","Phalacrocorax","auritus",2010-02-24,"Arizona"
"1101","2/24/2010","00:00.0","2010","2","24","Wike/Ward","NULL","NULL","Gila","AZ","Great Blue Heron","NULL","01940","Great Blue Heron","Ardea","herodias",2010-02-24,"Arizona"
"1102","4/8/2010","00:00.0","2010","4","8","McFarlin/Rodriguez","NULL","NULL","Gila","AZ","Double-crested Cormorant","NULL","01200","Double-crested Cormorant","Phalacrocorax","auritus",2010-04-08,"Arizona"
"1103","4/8/2010","00:00.0","2010","4","8","McFarlin/Rodriguez","NULL","NULL","Gila","AZ","Great Blue Heron","NULL","01940","Great Blue Heron","Ardea","herodias",2010-04-08,"Arizona"
"1104","5/2/2010","00:00.0","2010","5","2","McFarlin/Rodriguez","NULL","NULL","Gila","AZ","Double-crested Cormorant","NULL","01200","Double-crested Cormorant","Phalacrocorax","auritus",2010-05-02,"Arizona"
"1105","5/2/2010","00:00.0","2010","5","2","McFarlin/Rodriguez","NULL","NULL","Gila","AZ","Great Blue Heron","NULL","01940","Great Blue Heron","Ardea","herodias",2010-05-02,"Arizona"
"1106","5/5/2010","00:00.0","2010","5","5","Wike","NULL","NULL","Gila","AZ","Black-crowned Night-Heron","NULL","02020","Black-crowned Night-Heron","Nycticorax","nycticorax",2010-05-05,"Arizona"
"1107","5/5/2010","00:00.0","2010","5","5","Wike","NULL","NULL","Gila","AZ","Snowy Egret","NULL","01970","Snowy Egret","Egretta","thula",2010-05-05,"Arizona"
"1108","3/10/2011","00:00.0","2011","3","10","Joder","NULL","NULL","Gila","AZ","Double-crested Cormorant","NULL","01200","Double-crested Cormorant","Phalacrocorax","auritus",2011-03-10,"Arizona"
"1109","3/10/2011","00:00.0","2011","3","10","Joder","NULL","NULL","Gila","AZ","Great Blue Heron","NULL","01940","Great Blue Heron","Ardea","herodias",2011-03-10,"Arizona"
"1110","5/3/2011","00:00.0","2011","5","3","Joder","NULL","NULL","Gila","AZ","Double-crested Cormorant","NULL","01200","Double-crested Cormorant","Phalacrocorax","auritus",2011-05-03,"Arizona"
"1111","5/3/2011","00:00.0","2011","5","3","Joder","NULL","NULL","Gila","AZ","Great Blue Heron","NULL","01940","Great Blue Heron","Ardea","herodias",2011-05-03,"Arizona"
"1112","4/9/2009","00:00.0","2009","4","9","McFarlin","NULL","NULL","Gila","AZ","Double-crested Cormorant","NULL","01200","Double-crested Cormorant","Phalacrocorax","auritus",2009-04-09,"Arizona"
"1113","5/6/2010","00:00.0","2010","5","6","McFarlin/Rodriguez","NULL","NULL","Gila","AZ","Great Blue Heron","NULL","01940","Great Blue Heron","Ardea","herodias",2010-05-06,"Arizona"
"1114","5/19/2011","00:00.0","2011","5","19","Stejskal/Stevenson","NULL","NULL","Gila","AZ","Black-crowned Night-Heron","NULL","02020","Black-crowned Night-Heron","Nycticorax","nycticorax",2011-05-19,"Arizona"
"1115","5/19/2011","00:00.0","2011","5","19","Stejskal/Stevenson","NULL","NULL","Gila","AZ","Snowy Egret","NULL","01970","Snowy Egret","Egretta","thula",2011-05-19,"Arizona"
"1116","5/29/2009","00:00.0","2009","5","29","Holm et al.","NULL","NULL","Coconino","AZ","Double-crested Cormorant","NULL","01200","Double-crested Cormorant","Phalacrocorax","auritus",2009-05-29,"Arizona"
"1117","5/29/2009","00:00.0","2009","5","29","Holm et al.","NULL","NULL","Coconino","AZ","Great Blue Heron","NULL","01940","Great Blue Heron","Ardea","herodias",2009-05-29,"Arizona"
"1118","5/31/2010","00:00.0","2010","5","31","Holm/Price","NULL","NULL","Coconino","AZ","Double-crested Cormorant","NULL","01200","Double-crested Cormorant","Phalacrocorax","auritus",2010-05-31,"Arizona"
"1119","5/31/2010","00:00.0","2010","5","31","Holm/Price","NULL","NULL","Coconino","AZ","Great Blue Heron","NULL","01940","Great Blue Heron","Ardea","herodias",2010-05-31,"Arizona"
"1120","6/15/2011","00:00.0","2011","6","15","Holm/Price","NULL","NULL","Coconino","AZ","Double-crested Cormorant","NULL","01200","Double-crested Cormorant","Phalacrocorax","auritus",2011-06-15,"Arizona"
"1121","6/15/2011","00:00.0","2011","6","15","Holm/Price","NULL","NULL","Coconino","AZ","Great Blue Heron","NULL","01940","Great Blue Heron","Ardea","herodias",2011-06-15,"Arizona"
"1122","3/25/2011","00:00.0","2011","3","25","Drown/Arndt","NULL","NULL","Yavapai","AZ","Great Blue Heron","NULL","01940","Great Blue Heron","Ardea","herodias",2011-03-25,"Arizona"
"1123","6/3/2011","00:00.0","2011","6","3","McCarty","NULL","NULL","Navajo","AZ","Great Blue Heron","NULL","01940","Great Blue Heron","Ardea","herodias",2011-06-03,"Arizona"
"1124","5/21/2011","00:00.0","2011","5","21","Morrall","NULL","NULL","Coconino","AZ","Great Blue Heron","NULL","01940","Great Blue Heron","Ardea","herodias",2011-05-21,"Arizona"
"1125","5/26/2011","00:00.0","2011","5","26","Cagle","NULL","NULL","Greenlee","AZ","Great Blue Heron","NULL","01940","Great Blue Heron","Ardea","herodias",2011-05-26,"Arizona"
"1126","2/19/2011","00:00.0","2011","2","19","Ford","NULL","NULL","Maricopa","AZ","Great Blue Heron","NULL","01940","Great Blue Heron","Ardea","herodias",2011-02-19,"Arizona"
"1127","3/17/2011","00:00.0","2011","3","17","Ford","NULL","NULL","Maricopa","AZ","Great Blue Heron","NULL","01940","Great Blue Heron","Ardea","herodias",2011-03-17,"Arizona"
"1128","4/20/2009","00:00.0","2009","4","20","Cagle","NULL","NULL","Navajo","AZ","Double-crested Cormorant","NULL","01200","Double-crested Cormorant","Phalacrocorax","auritus",2009-04-20,"Arizona"
"3949","NULL","","1997","NULL","NULL","NULL","NULL","NULL","Albany","WY","Black-crowned Night-Heron","NULL","02020","Black-crowned Night-Heron","Nycticorax","nycticorax",NA,"Wyoming"
"3950","NULL","","1998","NULL","NULL","NULL","NULL","NULL","Albany","WY","Forster's Tern","NULL","00690","Forster's Tern","Sterna","forsteri",NA,"Wyoming"
"3951","NULL","","1998","NULL","NULL","NULL","NULL","NULL","Albany","WY","Black-crowned Night-Heron","NULL","02020","Black-crowned Night-Heron","Nycticorax","nycticorax",NA,"Wyoming"
"3952","NULL","","1999","NULL","NULL","NULL","NULL","NULL","Albany","WY","White-faced Ibis","NULL","01870","White-faced Ibis","Plegadis","chihi",NA,"Wyoming"
"3953","NULL","","1999","NULL","NULL","NULL","NULL","NULL","Albany","WY","Forster's Tern","NULL","00690","Forster's Tern","Sterna","forsteri",NA,"Wyoming"
"3954","NULL","","1999","NULL","NULL","NULL","NULL","NULL","Albany","WY","Black-crowned Night-Heron","NULL","02020","Black-crowned Night-Heron","Nycticorax","nycticorax",NA,"Wyoming"
"3955","NULL","","2001","NULL","NULL","NULL","NULL","NULL","Albany","WY","White-faced Ibis","NULL","01870","White-faced Ibis","Plegadis","chihi",NA,"Wyoming"
"3956","NULL","","2001","NULL","NULL","NULL","NULL","NULL","Albany","WY","Forster's Tern","NULL","00690","Forster's Tern","Sterna","forsteri",NA,"Wyoming"
"3957","NULL","","2001","NULL","NULL","NULL","NULL","NULL","Albany","WY","Black-crowned Night-Heron","NULL","02020","Black-crowned Night-Heron","Nycticorax","nycticorax",NA,"Wyoming"
"3958","NULL","","2002","NULL","NULL","NULL","NULL","NULL","Albany","WY","Black-crowned Night-Heron","NULL","02020","Black-crowned Night-Heron","Nycticorax","nycticorax",NA,"Wyoming"
"3959","NULL","","2003","NULL","NULL","NULL","NULL","NULL","Albany","WY","Forster's Tern","NULL","00690","Forster's Tern","Sterna","forsteri",NA,"Wyoming"
"3960","NULL","","2004","NULL","NULL","NULL","NULL","NULL","Albany","WY","Forster's Tern","NULL","00690","Forster's Tern","Sterna","forsteri",NA,"Wyoming"
"3961","NULL","","2005","NULL","NULL","NULL","NULL","NULL","Albany","WY","Black-crowned Night-Heron","NULL","02020","Black-crowned Night-Heron","Nycticorax","nycticorax",NA,"Wyoming"
"3962","NULL","","2006","NULL","NULL","NULL","NULL","NULL","Albany","WY","White-faced Ibis","NULL","01870","White-faced Ibis","Plegadis","chihi",NA,"Wyoming"
"3963","NULL","","2006","NULL","NULL","NULL","NULL","NULL","Albany","WY","Black-crowned Night-Heron","NULL","02020","Black-crowned Night-Heron","Nycticorax","nycticorax",NA,"Wyoming"
"3964","NULL","","1983","NULL","NULL","NULL","NULL","NULL","Fremont","WY","Double-crested Cormorant","NULL","01200","Double-crested Cormorant","Phalacrocorax","auritus",NA,"Wyoming"
"3965","NULL","","1984","NULL","NULL","NULL","NULL","NULL","Fremont","WY","Double-crested Cormorant","NULL","01200","Double-crested Cormorant","Phalacrocorax","auritus",NA,"Wyoming"
"3966","NULL","","1986","NULL","NULL","NULL","NULL","NULL","Fremont","WY","Double-crested Cormorant","NULL","01200","Double-crested Cormorant","Phalacrocorax","auritus",NA,"Wyoming"
"3967","NULL","","1982","NULL","NULL","NULL","NULL","NULL","Fremont","WY","Snowy Egret","NULL","01970","Snowy Egret","Egretta","thula",NA,"Wyoming"
"3968","NULL","","1983","NULL","NULL","NULL","NULL","NULL","Fremont","WY","Snowy Egret","NULL","01970","Snowy Egret","Egretta","thula",NA,"Wyoming"
"3969","NULL","","1984","NULL","NULL","NULL","NULL","NULL","Fremont","WY","Snowy Egret","NULL","01970","Snowy Egret","Egretta","thula",NA,"Wyoming"
"3970","NULL","","1989","NULL","NULL","NULL","NULL","NULL","Fremont","WY","Black-crowned Night-Heron","NULL","02020","Black-crowned Night-Heron","Nycticorax","nycticorax",NA,"Wyoming"
"3971","NULL","","1983","NULL","NULL","NULL","NULL","NULL","Natrona","WY","Snowy Egret","NULL","01970","Snowy Egret","Egretta","thula",NA,"Wyoming"
"3972","NULL","","1983","NULL","NULL","NULL","NULL","NULL","Natrona","WY","Double-crested Cormorant","NULL","01200","Double-crested Cormorant","Phalacrocorax","auritus",NA,"Wyoming"
"3973","NULL","","1984","NULL","NULL","NULL","NULL","NULL","Natrona","WY","Snowy Egret","NULL","01970","Snowy Egret","Egretta","thula",NA,"Wyoming"
"3974","NULL","","1984","NULL","NULL","NULL","NULL","NULL","Natrona","WY","Double-crested Cormorant","NULL","01200","Double-crested Cormorant","Phalacrocorax","auritus",NA,"Wyoming"
"3976","NULL","","1984","NULL","NULL","NULL","NULL","NULL","Natrona","WY","Black-crowned Night-Heron","NULL","02020","Black-crowned Night-Heron","Nycticorax","nycticorax",NA,"Wyoming"
"3977","NULL","","1985","NULL","NULL","NULL","NULL","NULL","Natrona","WY","Snowy Egret","NULL","01970","Snowy Egret","Egretta","thula",NA,"Wyoming"
"3978","NULL","","1985","NULL","NULL","NULL","NULL","NULL","Natrona","WY","Double-crested Cormorant","NULL","01200","Double-crested Cormorant","Phalacrocorax","auritus",NA,"Wyoming"
"3979","NULL","","1985","NULL","NULL","NULL","NULL","NULL","Natrona","WY","Black-crowned Night-Heron","NULL","02020","Black-crowned Night-Heron","Nycticorax","nycticorax",NA,"Wyoming"
"3980","NULL","","1986","NULL","NULL","NULL","NULL","NULL","Natrona","WY","Snowy Egret","NULL","01970","Snowy Egret","Egretta","thula",NA,"Wyoming"
"3981","NULL","","1986","NULL","NULL","NULL","NULL","NULL","Natrona","WY","Double-crested Cormorant","NULL","01200","Double-crested Cormorant","Phalacrocorax","auritus",NA,"Wyoming"
"3982","NULL","","1986","NULL","NULL","NULL","NULL","NULL","Natrona","WY","Black-crowned Night-Heron","NULL","02020","Black-crowned Night-Heron","Nycticorax","nycticorax",NA,"Wyoming"
"3983","NULL","","1987","NULL","NULL","NULL","NULL","NULL","Natrona","WY","Snowy Egret","NULL","01970","Snowy Egret","Egretta","thula",NA,"Wyoming"
"3984","NULL","","1987","NULL","NULL","NULL","NULL","NULL","Natrona","WY","Double-crested Cormorant","NULL","01200","Double-crested Cormorant","Phalacrocorax","auritus",NA,"Wyoming"
"3985","NULL","","1987","NULL","NULL","NULL","NULL","NULL","Natrona","WY","Black-crowned Night-Heron","NULL","02020","Black-crowned Night-Heron","Nycticorax","nycticorax",NA,"Wyoming"
"3986","NULL","","1988","NULL","NULL","NULL","NULL","NULL","Natrona","WY","Double-crested Cormorant","NULL","01200","Double-crested Cormorant","Phalacrocorax","auritus",NA,"Wyoming"
"3987","NULL","","1988","NULL","NULL","NULL","NULL","NULL","Natrona","WY","Black-crowned Night-Heron","NULL","02020","Black-crowned Night-Heron","Nycticorax","nycticorax",NA,"Wyoming"
"3988","NULL","","1989","NULL","NULL","NULL","NULL","NULL","Natrona","WY","Double-crested Cormorant","NULL","01200","Double-crested Cormorant","Phalacrocorax","auritus",NA,"Wyoming"
"3989","NULL","","1989","NULL","NULL","NULL","NULL","NULL","Natrona","WY","Black-crowned Night-Heron","NULL","02020","Black-crowned Night-Heron","Nycticorax","nycticorax",NA,"Wyoming"
"3990","NULL","","1990","NULL","NULL","NULL","NULL","NULL","Natrona","WY","Double-crested Cormorant","NULL","01200","Double-crested Cormorant","Phalacrocorax","auritus",NA,"Wyoming"
"3991","NULL","","1990","NULL","NULL","NULL","NULL","NULL","Natrona","WY","Caspian Tern","NULL","00640","Caspian Tern","Hydroprogne","caspia",NA,"Wyoming"
"3992","NULL","","1990","NULL","NULL","NULL","NULL","NULL","Natrona","WY","Black-crowned Night-Heron","NULL","02020","Black-crowned Night-Heron","Nycticorax","nycticorax",NA,"Wyoming"
"3993","NULL","","1992","NULL","NULL","NULL","NULL","NULL","Natrona","WY","Double-crested Cormorant","NULL","01200","Double-crested Cormorant","Phalacrocorax","auritus",NA,"Wyoming"
"3994","NULL","","1992","NULL","NULL","NULL","NULL","NULL","Natrona","WY","Caspian Tern","NULL","00640","Caspian Tern","Hydroprogne","caspia",NA,"Wyoming"
"3995","NULL","","1992","NULL","NULL","NULL","NULL","NULL","Natrona","WY","Black-crowned Night-Heron","NULL","02020","Black-crowned Night-Heron","Nycticorax","nycticorax",NA,"Wyoming"
"3996","NULL","","1994","NULL","NULL","NULL","NULL","NULL","Natrona","WY","Double-crested Cormorant","NULL","01200","Double-crested Cormorant","Phalacrocorax","auritus",NA,"Wyoming"
"3997","NULL","","1994","NULL","NULL","NULL","NULL","NULL","Natrona","WY","Caspian Tern","NULL","00640","Caspian Tern","Hydroprogne","caspia",NA,"Wyoming"
"3998","NULL","","1994","NULL","NULL","NULL","NULL","NULL","Natrona","WY","Black-crowned Night-Heron","NULL","02020","Black-crowned Night-Heron","Nycticorax","nycticorax",NA,"Wyoming"
"3999","NULL","","1995","NULL","NULL","NULL","NULL","NULL","Natrona","WY","Double-crested Cormorant","NULL","01200","Double-crested Cormorant","Phalacrocorax","auritus",NA,"Wyoming"
"4000","NULL","","1995","NULL","NULL","NULL","NULL","NULL","Natrona","WY","Black-crowned Night-Heron","NULL","02020","Black-crowned Night-Heron","Nycticorax","nycticorax",NA,"Wyoming"
"4001","NULL","","1996","NULL","NULL","NULL","NULL","NULL","Natrona","WY","Double-crested Cormorant","NULL","01200","Double-crested Cormorant","Phalacrocorax","auritus",NA,"Wyoming"
"4002","NULL","","1996","NULL","NULL","NULL","NULL","NULL","Natrona","WY","Black-crowned Night-Heron","NULL","02020","Black-crowned Night-Heron","Nycticorax","nycticorax",NA,"Wyoming"
"4003","NULL","","1997","NULL","NULL","NULL","NULL","NULL","Natrona","WY","Double-crested Cormorant","NULL","01200","Double-crested Cormorant","Phalacrocorax","auritus",NA,"Wyoming"
"4004","NULL","","1997","NULL","NULL","NULL","NULL","NULL","Natrona","WY","Black-crowned Night-Heron","NULL","02020","Black-crowned Night-Heron","Nycticorax","nycticorax",NA,"Wyoming"
"4005","NULL","","1998","NULL","NULL","NULL","NULL","NULL","Natrona","WY","Double-crested Cormorant","NULL","01200","Double-crested Cormorant","Phalacrocorax","auritus",NA,"Wyoming"
"4006","NULL","","1998","NULL","NULL","NULL","NULL","NULL","Natrona","WY","Black-crowned Night-Heron","NULL","02020","Black-crowned Night-Heron","Nycticorax","nycticorax",NA,"Wyoming"
"4007","NULL","","1999","NULL","NULL","NULL","NULL","NULL","Natrona","WY","Double-crested Cormorant","NULL","01200","Double-crested Cormorant","Phalacrocorax","auritus",NA,"Wyoming"
"4008","NULL","","1999","NULL","NULL","NULL","NULL","NULL","Natrona","WY","Black-crowned Night-Heron","NULL","02020","Black-crowned Night-Heron","Nycticorax","nycticorax",NA,"Wyoming"
"4009","NULL","","2000","NULL","NULL","NULL","NULL","NULL","Natrona","WY","Double-crested Cormorant","NULL","01200","Double-crested Cormorant","Phalacrocorax","auritus",NA,"Wyoming"
"4010","NULL","","2000","NULL","NULL","NULL","NULL","NULL","Natrona","WY","Caspian Tern","NULL","00640","Caspian Tern","Hydroprogne","caspia",NA,"Wyoming"
"4011","NULL","","2000","NULL","NULL","NULL","NULL","NULL","Natrona","WY","Black-crowned Night-Heron","NULL","02020","Black-crowned Night-Heron","Nycticorax","nycticorax",NA,"Wyoming"
"4012","NULL","","2001","NULL","NULL","NULL","NULL","NULL","Natrona","WY","Double-crested Cormorant","NULL","01200","Double-crested Cormorant","Phalacrocorax","auritus",NA,"Wyoming"
"4013","NULL","","2001","NULL","NULL","NULL","NULL","NULL","Natrona","WY","Caspian Tern","NULL","00640","Caspian Tern","Hydroprogne","caspia",NA,"Wyoming"
"4014","NULL","","2001","NULL","NULL","NULL","NULL","NULL","Natrona","WY","Black-crowned Night-Heron","NULL","02020","Black-crowned Night-Heron","Nycticorax","nycticorax",NA,"Wyoming"
"4015","NULL","","2002","NULL","NULL","NULL","NULL","NULL","Natrona","WY","Double-crested Cormorant","NULL","01200","Double-crested Cormorant","Phalacrocorax","auritus",NA,"Wyoming"
"4016","NULL","","2002","NULL","NULL","NULL","NULL","NULL","Natrona","WY","Caspian Tern","NULL","00640","Caspian Tern","Hydroprogne","caspia",NA,"Wyoming"
"4017","NULL","","2002","NULL","NULL","NULL","NULL","NULL","Natrona","WY","Black-crowned Night-Heron","NULL","02020","Black-crowned Night-Heron","Nycticorax","nycticorax",NA,"Wyoming"
"4018","NULL","","2003","NULL","NULL","NULL","NULL","NULL","Natrona","WY","Double-crested Cormorant","NULL","01200","Double-crested Cormorant","Phalacrocorax","auritus",NA,"Wyoming"
"4019","NULL","","2003","NULL","NULL","NULL","NULL","NULL","Natrona","WY","Black-crowned Night-Heron","NULL","02020","Black-crowned Night-Heron","Nycticorax","nycticorax",NA,"Wyoming"
"4020","NULL","","2005","NULL","NULL","NULL","NULL","NULL","Natrona","WY","Double-crested Cormorant","NULL","01200","Double-crested Cormorant","Phalacrocorax","auritus",NA,"Wyoming"
"4021","NULL","","2005","NULL","NULL","NULL","NULL","NULL","Natrona","WY","Caspian Tern","NULL","00640","Caspian Tern","Hydroprogne","caspia",NA,"Wyoming"
"4022","NULL","","2005","NULL","NULL","NULL","NULL","NULL","Natrona","WY","Black-crowned Night-Heron","NULL","02020","Black-crowned Night-Heron","Nycticorax","nycticorax",NA,"Wyoming"
"4023","NULL","","2006","NULL","NULL","NULL","NULL","NULL","Natrona","WY","Caspian Tern","NULL","00640","Caspian Tern","Hydroprogne","caspia",NA,"Wyoming"
"4024","NULL","","2002","NULL","NULL","NULL","NULL","NULL","Goshen","WY","Double-crested Cormorant","NAD 83","01200","Double-crested Cormorant","Phalacrocorax","auritus",NA,"Wyoming"
"4025","NULL","","1988","NULL","NULL","NULL","NULL","NULL","Bighorn","WY","Western Grebe","NULL","00010","Western Grebe","Aechmophorus","occidentalis",NA,"Wyoming"
"4026","NULL","","1988","NULL","NULL","NULL","NULL","NULL","Bighorn","WY","Clark's Grebe","NAD 83","00011","Clark's Grebe","Aechmophorus","clarkii",NA,"Wyoming"
"4027","NULL","","1986","NULL","NULL","NULL","NULL","NULL","Albany","WY","Black-crowned Night-Heron","NULL","02020","Black-crowned Night-Heron","Nycticorax","nycticorax",NA,"Wyoming"
"4028","NULL","","1987","NULL","NULL","NULL","NULL","NULL","Albany","WY","Black-crowned Night-Heron","NULL","02020","Black-crowned Night-Heron","Nycticorax","nycticorax",NA,"Wyoming"
"4029","NULL","","1997","NULL","NULL","NULL","NULL","NULL","Albany","WY","Black-crowned Night-Heron","NULL","02020","Black-crowned Night-Heron","Nycticorax","nycticorax",NA,"Wyoming"
"4030","NULL","","1998","NULL","NULL","NULL","NULL","NULL","Albany","WY","Black-crowned Night-Heron","NULL","02020","Black-crowned Night-Heron","Nycticorax","nycticorax",NA,"Wyoming"
"4031","NULL","","1999","NULL","NULL","NULL","NULL","NULL","Albany","WY","Black-crowned Night-Heron","NULL","02020","Black-crowned Night-Heron","Nycticorax","nycticorax",NA,"Wyoming"
"4032","NULL","","2000","NULL","NULL","NULL","NULL","NULL","Albany","WY","Snowy Egret","NULL","01970","Snowy Egret","Egretta","thula",NA,"Wyoming"
"4033","NULL","","2000","NULL","NULL","NULL","NULL","NULL","Albany","WY","Black-crowned Night-Heron","NULL","02020","Black-crowned Night-Heron","Nycticorax","nycticorax",NA,"Wyoming"
"4034","NULL","","1992","NULL","NULL","NULL","NULL","NULL","Albany","WY","American White Pelican","NULL","01250","American White Pelican","Pelecanus","erythrorhynchos",NA,"Wyoming"
"4035","NULL","","1993","NULL","NULL","NULL","NULL","NULL","Albany","WY","American White Pelican","NULL","01250","American White Pelican","Pelecanus","erythrorhynchos",NA,"Wyoming"
"4036","NULL","","1985","NULL","NULL","NULL","NULL","NULL","Teton","WY","American White Pelican","NULL","01250","American White Pelican","Pelecanus","erythrorhynchos",NA,"Wyoming"
"4037","NULL","","1986","NULL","NULL","NULL","NULL","NULL","Teton","WY","American White Pelican","NULL","01250","American White Pelican","Pelecanus","erythrorhynchos",NA,"Wyoming"
"4038","NULL","","1987","NULL","NULL","NULL","NULL","NULL","Teton","WY","Caspian Tern","NULL","00640","Caspian Tern","Hydroprogne","caspia",NA,"Wyoming"
"4039","NULL","","1987","NULL","NULL","NULL","NULL","NULL","Teton","WY","American White Pelican","NULL","01250","American White Pelican","Pelecanus","erythrorhynchos",NA,"Wyoming"
"4040","NULL","","1988","NULL","NULL","NULL","NULL","NULL","Teton","WY","Caspian Tern","NULL","00640","Caspian Tern","Hydroprogne","caspia",NA,"Wyoming"
"4041","NULL","","1988","NULL","NULL","NULL","NULL","NULL","Teton","WY","American White Pelican","NULL","01250","American White Pelican","Pelecanus","erythrorhynchos",NA,"Wyoming"
"4042","NULL","","1989","NULL","NULL","NULL","NULL","NULL","Teton","WY","Caspian Tern","NULL","00640","Caspian Tern","Hydroprogne","caspia",NA,"Wyoming"
"4043","NULL","","1989","NULL","NULL","NULL","NULL","NULL","Teton","WY","American White Pelican","NULL","01250","American White Pelican","Pelecanus","erythrorhynchos",NA,"Wyoming"
"4044","NULL","","1990","NULL","NULL","NULL","NULL","NULL","Teton","WY","Caspian Tern","NULL","00640","Caspian Tern","Hydroprogne","caspia",NA,"Wyoming"
"4045","NULL","","1990","NULL","NULL","NULL","NULL","NULL","Teton","WY","American White Pelican","NULL","01250","American White Pelican","Pelecanus","erythrorhynchos",NA,"Wyoming"
"4046","NULL","","1991","NULL","NULL","NULL","NULL","NULL","Teton","WY","Caspian Tern","NULL","00640","Caspian Tern","Hydroprogne","caspia",NA,"Wyoming"
"4047","NULL","","1991","NULL","NULL","NULL","NULL","NULL","Teton","WY","American White Pelican","NULL","01250","American White Pelican","Pelecanus","erythrorhynchos",NA,"Wyoming"
"4048","NULL","","1992","NULL","NULL","NULL","NULL","NULL","Teton","WY","Caspian Tern","NULL","00640","Caspian Tern","Hydroprogne","caspia",NA,"Wyoming"
"4049","NULL","","1992","NULL","NULL","NULL","NULL","NULL","Teton","WY","American White Pelican","NULL","01250","American White Pelican","Pelecanus","erythrorhynchos",NA,"Wyoming"
"4050","NULL","","1993","NULL","NULL","NULL","NULL","NULL","Teton","WY","Caspian Tern","NULL","00640","Caspian Tern","Hydroprogne","caspia",NA,"Wyoming"
"4051","NULL","","1993","NULL","NULL","NULL","NULL","NULL","Teton","WY","American White Pelican","NULL","01250","American White Pelican","Pelecanus","erythrorhynchos",NA,"Wyoming"
"4052","NULL","","1994","NULL","NULL","NULL","NULL","NULL","Teton","WY","Caspian Tern","NULL","00640","Caspian Tern","Hydroprogne","caspia",NA,"Wyoming"
"4053","NULL","","1994","NULL","NULL","NULL","NULL","NULL","Teton","WY","American White Pelican","NULL","01250","American White Pelican","Pelecanus","erythrorhynchos",NA,"Wyoming"
"4054","NULL","","1995","NULL","NULL","NULL","NULL","NULL","Teton","WY","Caspian Tern","NULL","00640","Caspian Tern","Hydroprogne","caspia",NA,"Wyoming"
"3096","NULL","","1940","NULL","NULL","Behle 1958","NULL","NULL","Box Elder","UT","Double-crested Cormorant","NULL","01200","Double-crested Cormorant","Phalacrocorax","auritus",NA,"Utah"
"4055","NULL","","1995","NULL","NULL","NULL","NULL","NULL","Teton","WY","American White Pelican","NULL","01250","American White Pelican","Pelecanus","erythrorhynchos",NA,"Wyoming"
"4056","NULL","","1996","NULL","NULL","NULL","NULL","NULL","Teton","WY","Caspian Tern","NULL","00640","Caspian Tern","Hydroprogne","caspia",NA,"Wyoming"
"4057","NULL","","1996","NULL","NULL","NULL","NULL","NULL","Teton","WY","American White Pelican","NULL","01250","American White Pelican","Pelecanus","erythrorhynchos",NA,"Wyoming"
"4058","NULL","","1997","NULL","NULL","NULL","NULL","NULL","Teton","WY","Caspian Tern","NULL","00640","Caspian Tern","Hydroprogne","caspia",NA,"Wyoming"
"4059","NULL","","1997","NULL","NULL","NULL","NULL","NULL","Teton","WY","American White Pelican","NULL","01250","American White Pelican","Pelecanus","erythrorhynchos",NA,"Wyoming"
"4060","NULL","","1998","NULL","NULL","NULL","NULL","NULL","Teton","WY","Caspian Tern","NULL","00640","Caspian Tern","Hydroprogne","caspia",NA,"Wyoming"
"4061","NULL","","1998","NULL","NULL","NULL","NULL","NULL","Teton","WY","American White Pelican","NULL","01250","American White Pelican","Pelecanus","erythrorhynchos",NA,"Wyoming"
"4062","NULL","","1999","NULL","NULL","NULL","NULL","NULL","Teton","WY","Caspian Tern","NULL","00640","Caspian Tern","Hydroprogne","caspia",NA,"Wyoming"
"4063","NULL","","1999","NULL","NULL","NULL","NULL","NULL","Teton","WY","American White Pelican","NULL","01250","American White Pelican","Pelecanus","erythrorhynchos",NA,"Wyoming"
"4064","NULL","","2000","NULL","NULL","NULL","NULL","NULL","Teton","WY","American White Pelican","NULL","01250","American White Pelican","Pelecanus","erythrorhynchos",NA,"Wyoming"
"4065","NULL","","2001","NULL","NULL","NULL","NULL","NULL","Teton","WY","Caspian Tern","NULL","00640","Caspian Tern","Hydroprogne","caspia",NA,"Wyoming"
"4066","NULL","","2001","NULL","NULL","NULL","NULL","NULL","Teton","WY","American White Pelican","NULL","01250","American White Pelican","Pelecanus","erythrorhynchos",NA,"Wyoming"
"4067","NULL","","2002","NULL","NULL","NULL","NULL","NULL","Teton","WY","Caspian Tern","NULL","00640","Caspian Tern","Hydroprogne","caspia",NA,"Wyoming"
"4068","NULL","","2002","NULL","NULL","NULL","NULL","NULL","Teton","WY","American White Pelican","NULL","01250","American White Pelican","Pelecanus","erythrorhynchos",NA,"Wyoming"
"4069","NULL","","2003","NULL","NULL","NULL","NULL","NULL","Teton","WY","Caspian Tern","NULL","00640","Caspian Tern","Hydroprogne","caspia",NA,"Wyoming"
"4070","NULL","","2003","NULL","NULL","NULL","NULL","NULL","Teton","WY","American White Pelican","NULL","01250","American White Pelican","Pelecanus","erythrorhynchos",NA,"Wyoming"
"4071","NULL","","2004","NULL","NULL","NULL","NULL","NULL","Teton","WY","Caspian Tern","NULL","00640","Caspian Tern","Hydroprogne","caspia",NA,"Wyoming"
"4072","NULL","","2004","NULL","NULL","NULL","NULL","NULL","Teton","WY","American White Pelican","NULL","01250","American White Pelican","Pelecanus","erythrorhynchos",NA,"Wyoming"
"3097","NULL","","1941","NULL","NULL","Behle 1958","NULL","NULL","Box Elder","UT","California Gull","NULL","00530","California Gull","Larus","californicus",NA,"Utah"
"4073","NULL","","2005","NULL","NULL","NULL","NULL","NULL","Teton","WY","Double-crested Cormorant","NULL","01200","Double-crested Cormorant","Phalacrocorax","auritus",NA,"Wyoming"
"4074","NULL","","2005","NULL","NULL","NULL","NULL","NULL","Teton","WY","Caspian Tern","NULL","00640","Caspian Tern","Hydroprogne","caspia",NA,"Wyoming"
"4075","NULL","","2005","NULL","NULL","NULL","NULL","NULL","Teton","WY","American White Pelican","NULL","01250","American White Pelican","Pelecanus","erythrorhynchos",NA,"Wyoming"
"4076","NULL","","2006","NULL","NULL","NULL","NULL","NULL","Teton","WY","Double-crested Cormorant","NULL","01200","Double-crested Cormorant","Phalacrocorax","auritus",NA,"Wyoming"
"4077","NULL","","2006","NULL","NULL","NULL","NULL","NULL","Teton","WY","American White Pelican","NULL","01250","American White Pelican","Pelecanus","erythrorhynchos",NA,"Wyoming"
"4078","NULL","","1987","NULL","NULL","NULL","NULL","NULL","Big Horn","WY","Forster's Tern","NULL","00690","Forster's Tern","Sterna","forsteri",NA,"Wyoming"
"3009","6/25/2009","00:00.0","2009","6","25","Parker/Frokjer","NULL","NULL","Weber","UT","Clark's Grebe","NULL","00011","Clark's Grebe","Aechmophorus","clarkii",2009-06-25,"Utah"
"3010","6/15/2009","00:00.0","2009","6","15","Neill","NULL","NULL","Box Elder","UT","Black-crowned Night-Heron","GSL","02020","Black-crowned Night-Heron","Nycticorax","nycticorax",2009-06-15,"Utah"
"3011","6/15/2009","00:00.0","2009","6","15","Neill","NULL","NULL","Box Elder","UT","Clark's Grebe","GSL","00011","Clark's Grebe","Aechmophorus","clarkii",2009-06-15,"Utah"
"3012","6/15/2009","00:00.0","2009","6","15","Neill/Mathis","NULL","NULL","Box Elder","UT","Eared Grebe","GSL","00040","Eared Grebe","Podiceps","nigricollis",2009-06-15,"Utah"
"3013","6/15/2009","00:00.0","2009","6","15","Neill","NULL","NULL","Box Elder","UT","Forster's Tern","GSL","00690","Forster's Tern","Sterna","forsteri",2009-06-15,"Utah"
"3014","6/15/2009","00:00.0","2009","6","15","Neill","NULL","NULL","Box Elder","UT","Great Blue Heron","GSL","01940","Great Blue Heron","Ardea","herodias",2009-06-15,"Utah"
"3015","6/15/2009","00:00.0","2009","6","15","Neill","NULL","NULL","Box Elder","UT","Snowy Egret","GSL","01970","Snowy Egret","Egretta","thula",2009-06-15,"Utah"
"3016","6/15/2009","00:00.0","2009","6","15","Neill","NULL","NULL","Box Elder","UT","Western Grebe","GSL","00010","Western Grebe","Aechmophorus","occidentalis",2009-06-15,"Utah"
"3017","6/15/2009","00:00.0","2009","6","15","Neill","NULL","NULL","Box Elder","UT","White-faced Ibis","GSL","01870","White-faced Ibis","Plegadis","chihi",2009-06-15,"Utah"
"3018","5/24/2010","00:00.0","2010","5","24","Parker/Frokjer","NULL","NULL","Sevier","UT","California Gull","NULL","00530","California Gull","Larus","californicus",2010-05-24,"Utah"
"3019","6/15/2009","00:00.0","2009","6","15","Neill","NULL","NULL","Box Elder","UT","Great Blue Heron","GSL","01940","Great Blue Heron","Ardea","herodias",2009-06-15,"Utah"
"3020","6/10/2010","00:00.0","2010","6","10","Parker/Frokjer","NULL","NULL","Millard","UT","Caspian Tern","NULL","00640","Caspian Tern","Hydroprogne","caspia",2010-06-10,"Utah"
"3021","6/10/2010","00:00.0","2010","6","10","Parker/Frokjer","NULL","NULL","Millard","UT","Eared Grebe","NULL","00040","Eared Grebe","Podiceps","nigricollis",2010-06-10,"Utah"
"3022","6/10/2010","00:00.0","2010","6","10","Parker/Frokjer","NULL","NULL","Millard","UT","Western Grebe","NULL","00010","Western Grebe","Aechmophorus","occidentalis",2010-06-10,"Utah"
"3023","6/2/2010","00:00.0","2010","6","2","Parker/Frokjer","NULL","NULL","Carbon","UT","Great Blue Heron","NULL","01940","Great Blue Heron","Ardea","herodias",2010-06-02,"Utah"
"3024","6/26/2009","00:00.0","2009","6","26","Parker/Frokjer","NULL","NULL","Carbon","UT","Western Grebe","NULL","00010","Western Grebe","Aechmophorus","occidentalis",2009-06-26,"Utah"
"3025","6/22/2009","00:00.0","2009","6","22","Parker/Frokjer","NULL","NULL","Sanpete","UT","Great Blue Heron","NULL","01940","Great Blue Heron","Ardea","herodias",2009-06-22,"Utah"
"3026","6/22/2009","00:00.0","2009","6","22","Parker/Frokjer","NULL","NULL","Sanpete","UT","Great Blue Heron","NULL","01940","Great Blue Heron","Ardea","herodias",2009-06-22,"Utah"
"3027","5/24/2010","00:00.0","2010","5","24","Parker/Frokjer","NULL","NULL","Sanpete","UT","Great Blue Heron","NULL","01940","Great Blue Heron","Ardea","herodias",2010-05-24,"Utah"
"3028","5/18/2010","00:00.0","2010","5","18","Parker/Frokjer","NULL","NULL","Millard","UT","Great Blue Heron","NULL","01940","Great Blue Heron","Ardea","herodias",2010-05-18,"Utah"
"3029","5/24/2010","00:00.0","2010","5","24","Parker/Frokjer","NULL","NULL","Piute","UT","Great Blue Heron","NULL","01940","Great Blue Heron","Ardea","herodias",2010-05-24,"Utah"
"3030","5/24/2010","00:00.0","2010","5","24","Parker/Frokjer","NULL","NULL","Sevier","UT","Great Blue Heron","NULL","01940","Great Blue Heron","Ardea","herodias",2010-05-24,"Utah"
"3031","5/24/2010","00:00.0","2010","5","24","Parker/Frokjer","NULL","NULL","Sevier","UT","Great Egret","NULL","01960","Great Egret","Ardea","alba",2010-05-24,"Utah"
"3032","6/11/2009","00:00.0","2009","6","11","Parker/Frokjer","NULL","NULL","Cache","UT","Great Blue Heron","NULL","01940","Great Blue Heron","Ardea","herodias",2009-06-11,"Utah"
"3033","4/30/2009","00:00.0","2009","4","30","Parker","NULL","NULL","Weber","UT","Great Blue Heron","NULL","01940","Great Blue Heron","Ardea","herodias",2009-04-30,"Utah"
"3034","6/22/2009","00:00.0","2009","6","22","Parker/Frokjer","NULL","NULL","Sanpete","UT","Great Blue Heron","NULL","01940","Great Blue Heron","Ardea","herodias",2009-06-22,"Utah"
"3035","6/22/2009","00:00.0","2009","6","22","Parker/Frokjer","NULL","NULL","Sanpete","UT","Great Egret","NULL","01960","Great Egret","Ardea","alba",2009-06-22,"Utah"
"3036","6/2/2009","00:00.0","2009","6","2","Parker/Frokjer","NULL","NULL","Tooele","UT","Black-crowned Night-Heron","NULL","02020","Black-crowned Night-Heron","Nycticorax","nycticorax",2009-06-02,"Utah"
"3037","6/2/2009","00:00.0","2009","6","2","Parker/Frokjer","NULL","NULL","Tooele","UT","California Gull","NULL","00530","California Gull","Larus","californicus",2009-06-02,"Utah"
"3038","6/2/2009","00:00.0","2009","6","2","Parker/Frokjer","NULL","NULL","Tooele","UT","Caspian Tern","NULL","00640","Caspian Tern","Hydroprogne","caspia",2009-06-02,"Utah"
"3039","6/2/2009","00:00.0","2009","6","2","Parker/Frokjer","NULL","NULL","Tooele","UT","Double-crested Cormorant","NULL","01200","Double-crested Cormorant","Phalacrocorax","auritus",2009-06-02,"Utah"
"3040","6/2/2009","00:00.0","2009","6","2","Parker/Frokjer","NULL","NULL","Tooele","UT","Great Blue Heron","NULL","01940","Great Blue Heron","Ardea","herodias",2009-06-02,"Utah"
"3041","6/2/2009","00:00.0","2009","6","2","Parker/Frokjer","NULL","NULL","Tooele","UT","Snowy Egret","NULL","01970","Snowy Egret","Egretta","thula",2009-06-02,"Utah"
"3042","6/16/2009","00:00.0","2009","6","16","Parker/Frokjer","NULL","NULL","Uintah","UT","Great Blue Heron","NULL","01940","Great Blue Heron","Ardea","herodias",2009-06-16,"Utah"
"3043","6/16/2009","00:00.0","2009","6","16","Parker/Frokjer","NULL","NULL","Uintah","UT","Western Grebe","NULL","00010","Western Grebe","Aechmophorus","occidentalis",2009-06-16,"Utah"
"3044","6/25/2009","00:00.0","2009","6","25","Parker/Frokjer","NULL","NULL","Utah","UT","Black-crowned Night-Heron","NULL","02020","Black-crowned Night-Heron","Nycticorax","nycticorax",2009-06-25,"Utah"
"3045","6/25/2009","00:00.0","2009","6","25","Parker/Frokjer","NULL","NULL","Utah","UT","Cattle Egret","NULL","02001","Cattle Egret","Bubulcus","ibis",2009-06-25,"Utah"
"3046","6/25/2009","00:00.0","2009","6","25","Parker/Frokjer","NULL","NULL","Utah","UT","Franklin's Gull","NULL","00590","Franklin's Gull","Larus","pipixcan",2009-06-25,"Utah"
"3047","6/25/2009","00:00.0","2009","6","25","Parker/Frokjer","NULL","NULL","Utah","UT","Snowy Egret","NULL","01970","Snowy Egret","Egretta","thula",2009-06-25,"Utah"
"3048","6/25/2009","00:00.0","2009","6","25","Parker/Frokjer","NULL","NULL","Utah","UT","White-faced Ibis","NULL","01870","White-faced Ibis","Plegadis","chihi",2009-06-25,"Utah"
"3049","7/14/2010","00:00.0","2010","7","14","Williams","NULL","NULL","Utah","UT","Great Egret","NULL","01960","Great Egret","Ardea","alba",2010-07-14,"Utah"
"3050","5/4/2009","00:00.0","2009","5","4","Parker/Frokjer","NULL","NULL","Utah","UT","Great Blue Heron","NULL","01940","Great Blue Heron","Ardea","herodias",2009-05-04,"Utah"
"3051","5/21/2009","00:00.0","2009","5","21","Parker/Frokjer","NULL","NULL","Utah","UT","Great Blue Heron","NULL","01940","Great Blue Heron","Ardea","herodias",2009-05-21,"Utah"
"3052","6/1/2009","00:00.0","2009","6","1","Parker","NULL","NULL","Utah","UT","Black-crowned Night-Heron","NULL","02020","Black-crowned Night-Heron","Nycticorax","nycticorax",2009-06-01,"Utah"
"3053","6/1/2009","00:00.0","2009","6","1","Parker","NULL","NULL","Utah","UT","Great Blue Heron","NULL","01940","Great Blue Heron","Ardea","herodias",2009-06-01,"Utah"
"3054","6/28/2010","00:00.0","2010","6","28","Parker/Gurr","NULL","NULL","Utah","UT","Clark's Grebe","NULL","00011","Clark's Grebe","Aechmophorus","clarkii",2010-06-28,"Utah"
"3055","6/28/2010","00:00.0","2010","6","28","Parker/Gurr","NULL","NULL","Utah","UT","Western Grebe","NULL","00010","Western Grebe","Aechmophorus","occidentalis",2010-06-28,"Utah"
"3056","6/25/2009","00:00.0","2009","6","25","Parker/Frokjer","NULL","NULL","Utah","UT","Clark's Grebe","NULL","00011","Clark's Grebe","Aechmophorus","clarkii",2009-06-25,"Utah"
"3057","6/25/2009","00:00.0","2009","6","25","Parker/Frokjer","NULL","NULL","Utah","UT","Forster's Tern","NULL","00690","Forster's Tern","Sterna","forsteri",2009-06-25,"Utah"
"3058","6/23/2009","00:00.0","2009","6","23","Parker/Frokjer","NULL","NULL","Sanpete","UT","Eared Grebe","NULL","00040","Eared Grebe","Podiceps","nigricollis",2009-06-23,"Utah"
"3059","6/10/2009","00:00.0","2009","6","10","Parker/Frokjer","NULL","NULL","Summit","UT","Great Blue Heron","NULL","01940","Great Blue Heron","Ardea","herodias",2009-06-10,"Utah"
"3060","4/27/2009","00:00.0","2009","4","27","Parker/Frokjer","NULL","NULL","Summit","UT","Great Blue Heron","NULL","01940","Great Blue Heron","Ardea","herodias",2009-04-27,"Utah"
"3061","4/27/2009","00:00.0","2009","4","27","Parker/Frokjer","NULL","NULL","Morgan","UT","Great Blue Heron","NULL","01940","Great Blue Heron","Ardea","herodias",2009-04-27,"Utah"
"3062","4/27/2009","00:00.0","2009","4","27","Parker/Frokjer","NULL","NULL","Morgan","UT","Great Blue Heron","NULL","01940","Great Blue Heron","Ardea","herodias",2009-04-27,"Utah"
"3063","4/27/2009","00:00.0","2009","4","27","Parker/Frokjer","NULL","NULL","Morgan","UT","Great Blue Heron","NULL","01940","Great Blue Heron","Ardea","herodias",2009-04-27,"Utah"
"3064","6/10/2009","00:00.0","2009","6","10","Parker/Frokjer","NULL","NULL","Summit","UT","Great Blue Heron","NULL","01940","Great Blue Heron","Ardea","herodias",2009-06-10,"Utah"
"3065","6/10/2009","00:00.0","2009","6","10","Parker/Frokjer","NULL","NULL","Summit","UT","Great Blue Heron","NULL","01940","Great Blue Heron","Ardea","herodias",2009-06-10,"Utah"
"3066","6/20/2010","00:00.0","2010","6","20","Parker/Parker","NULL","NULL","Morgan","UT","Great Blue Heron","NULL","01940","Great Blue Heron","Ardea","herodias",2010-06-20,"Utah"
"3067","6/10/2009","00:00.0","2009","6","10","Parker/Frokjer","NULL","NULL","Summit","UT","Great Blue Heron","NULL","01940","Great Blue Heron","Ardea","herodias",2009-06-10,"Utah"
"3068","5/25/2010","00:00.0","2010","5","25","Neill/Bartosz","NULL","NULL","Davis","UT","California Gull","GSL","00530","California Gull","Larus","californicus",2010-05-25,"Utah"
"3069","7/1/2010","00:00.0","2010","7","1","Neill et al.","NULL","NULL","Davis","UT","California Gull","GSL","00530","California Gull","Larus","californicus",2010-07-01,"Utah"
"3070","6/18/2009","00:00.0","2009","6","18","Neill/Mathis","NULL","NULL","Box Elder","UT","Franklin's Gull","GSL","00590","Franklin's Gull","Larus","pipixcan",2009-06-18,"Utah"
"3071","6/18/2009","00:00.0","2009","6","18","Neill/Mathis","NULL","NULL","Box Elder","UT","Franklin's Gull","GSL","00590","Franklin's Gull","Larus","pipixcan",2009-06-18,"Utah"
"3072","6/18/2009","00:00.0","2009","6","18","Neill/Mathis","NULL","NULL","Box Elder","UT","Snowy Egret","GSL","01970","Snowy Egret","Egretta","thula",2009-06-18,"Utah"
"3073","6/18/2009","00:00.0","2009","6","18","Neill/Mathis","NULL","NULL","Box Elder","UT","Snowy Egret","GSL","01970","Snowy Egret","Egretta","thula",2009-06-18,"Utah"
"3074","6/18/2009","00:00.0","2009","6","18","Neill/Mathis","NULL","NULL","Box Elder","UT","White-faced Ibis","GSL","01870","White-faced Ibis","Plegadis","chihi",2009-06-18,"Utah"
"3075","6/18/2009","00:00.0","2009","6","18","Neill/Mathis","NULL","NULL","Box Elder","UT","White-faced Ibis","GSL","01870","White-faced Ibis","Plegadis","chihi",2009-06-18,"Utah"
"3076","7/1/2009","00:00.0","2009","7","1","Neill","NULL","NULL","Box Elder","UT","Black-crowned Night-Heron","GSL","02020","Black-crowned Night-Heron","Nycticorax","nycticorax",2009-07-01,"Utah"
"3077","7/1/2009","00:00.0","2009","7","1","Bankhead","NULL","NULL","Box Elder","UT","Franklin's Gull","GSL","00590","Franklin's Gull","Larus","pipixcan",2009-07-01,"Utah"
"3078","7/1/2009","00:00.0","2009","7","1","Bankhead","NULL","NULL","Box Elder","UT","Snowy Egret","GSL","01970","Snowy Egret","Egretta","thula",2009-07-01,"Utah"
"3079","7/1/2009","00:00.0","2009","7","1","Neill","NULL","NULL","Box Elder","UT","White-faced Ibis","GSL","01870","White-faced Ibis","Plegadis","chihi",2009-07-01,"Utah"
"3080","6/18/2009","00:00.0","2009","6","18","Neill/Mathis","NULL","NULL","Box Elder","UT","Western or Clark's Grebe","GSL","NULL",NA,NA,NA,2009-06-18,"Utah"
"3081","7/1/2009","00:00.0","2009","7","1","Neill","NULL","NULL","Box Elder","UT","Eared Grebe","GSL","00040","Eared Grebe","Podiceps","nigricollis",2009-07-01,"Utah"
"3082","7/1/2009","00:00.0","2009","7","1","Bankhead","NULL","NULL","Box Elder","UT","Forster's Tern","GSL","00690","Forster's Tern","Sterna","forsteri",2009-07-01,"Utah"
"3083","7/1/2009","00:00.0","2009","7","1","Bankhead","NULL","NULL","Box Elder","UT","Forster's Tern","GSL","00690","Forster's Tern","Sterna","forsteri",2009-07-01,"Utah"
"3084","7/7/1999","00:00.0","1999","7","7","NULL","NULL","NULL","Box Elder","UT","Black-crowned Night-Heron","NULL","02020","Black-crowned Night-Heron","Nycticorax","nycticorax",1999-07-07,"Utah"
"3085","7/7/1999","00:00.0","1999","7","7","NULL","NULL","NULL","Box Elder","UT","Great Blue Heron","NULL","01940","Great Blue Heron","Ardea","herodias",1999-07-07,"Utah"
"3086","7/7/1999","00:00.0","1999","7","7","NULL","NULL","NULL","Box Elder","UT","Great Egret","NULL","01960","Great Egret","Ardea","alba",1999-07-07,"Utah"
"3087","7/7/1999","00:00.0","1999","7","7","NULL","NULL","NULL","Box Elder","UT","Snowy Egret","NULL","01970","Snowy Egret","Egretta","thula",1999-07-07,"Utah"
"3088","7/7/1999","00:00.0","1999","7","7","NULL","NULL","NULL","Box Elder","UT","Black Tern","NULL","00770","Black Tern","Chlidonias","niger",1999-07-07,"Utah"
"3089","7/7/1999","00:00.0","1999","7","7","NULL","NULL","NULL","Box Elder","UT","Black-crowned Night-Heron","NULL","02020","Black-crowned Night-Heron","Nycticorax","nycticorax",1999-07-07,"Utah"
"3090","7/7/1999","00:00.0","1999","7","7","NULL","NULL","NULL","Box Elder","UT","Snowy Egret","NULL","01970","Snowy Egret","Egretta","thula",1999-07-07,"Utah"
"3091","NULL","","1935","NULL","NULL","Behle 1958","NULL","NULL","Box Elder","UT","Caspian Tern","NULL","00640","Caspian Tern","Hydroprogne","caspia",NA,"Utah"
"3092","NULL","","1936","NULL","NULL","Behle 1958","NULL","NULL","Box Elder","UT","California Gull","NULL","00530","California Gull","Larus","californicus",NA,"Utah"
"3093","NULL","","1936","NULL","NULL","Behle 1958","NULL","NULL","Box Elder","UT","Double-crested Cormorant","NULL","01200","Double-crested Cormorant","Phalacrocorax","auritus",NA,"Utah"
"3094","NULL","","1939","NULL","NULL","Behle 1958","NULL","NULL","Box Elder","UT","California Gull","NULL","00530","California Gull","Larus","californicus",NA,"Utah"
"3095","NULL","","1939","NULL","NULL","Behle 1958","NULL","NULL","Box Elder","UT","Double-crested Cormorant","NULL","01200","Double-crested Cormorant","Phalacrocorax","auritus",NA,"Utah"
"3098","NULL","","1941","NULL","NULL","Behle 1958","NULL","NULL","Box Elder","UT","Double-crested Cormorant","NULL","01200","Double-crested Cormorant","Phalacrocorax","auritus",NA,"Utah"
"3099","NULL","","1942","NULL","NULL","Behle 1958","NULL","NULL","Box Elder","UT","California Gull","NULL","00530","California Gull","Larus","californicus",NA,"Utah"
"3100","NULL","","1942","NULL","NULL","Behle 1958","NULL","NULL","Box Elder","UT","Double-crested Cormorant","NULL","01200","Double-crested Cormorant","Phalacrocorax","auritus",NA,"Utah"
"3101","NULL","","1943","NULL","NULL","Behle 1958","NULL","NULL","Box Elder","UT","California Gull","NULL","00530","California Gull","Larus","californicus",NA,"Utah"
"3102","NULL","","1943","NULL","NULL","Behle 1958","NULL","NULL","Box Elder","UT","Double-crested Cormorant","NULL","01200","Double-crested Cormorant","Phalacrocorax","auritus",NA,"Utah"
"3103","NULL","","1944","NULL","NULL","Behle 1958","NULL","NULL","Box Elder","UT","California Gull","NULL","00530","California Gull","Larus","californicus",NA,"Utah"
"3104","NULL","","1944","NULL","NULL","Behle 1958","NULL","NULL","Box Elder","UT","Double-crested Cormorant","NULL","01200","Double-crested Cormorant","Phalacrocorax","auritus",NA,"Utah"
"3105","NULL","","1945","NULL","NULL","Behle 1958","NULL","NULL","Box Elder","UT","California Gull","NULL","00530","California Gull","Larus","californicus",NA,"Utah"
"3106","NULL","","1945","NULL","NULL","Behle 1958","NULL","NULL","Box Elder","UT","Double-crested Cormorant","NULL","01200","Double-crested Cormorant","Phalacrocorax","auritus",NA,"Utah"
"3107","NULL","","1946","NULL","NULL","Behle 1958","NULL","NULL","Box Elder","UT","California Gull","NULL","00530","California Gull","Larus","californicus",NA,"Utah"
"3108","NULL","","1946","NULL","NULL","Behle 1958","NULL","NULL","Box Elder","UT","Double-crested Cormorant","NULL","01200","Double-crested Cormorant","Phalacrocorax","auritus",NA,"Utah"
"3109","NULL","","1947","NULL","NULL","Behle 1958","NULL","NULL","Box Elder","UT","California Gull","NULL","00530","California Gull","Larus","californicus",NA,"Utah"
"3110","NULL","","1947","NULL","NULL","Behle 1958","NULL","NULL","Box Elder","UT","Double-crested Cormorant","NULL","01200","Double-crested Cormorant","Phalacrocorax","auritus",NA,"Utah"
"3111","NULL","","1948","NULL","NULL","Behle 1958","NULL","NULL","Box Elder","UT","California Gull","NULL","00530","California Gull","Larus","californicus",NA,"Utah"
"3112","NULL","","1948","NULL","NULL","Behle 1958","NULL","NULL","Box Elder","UT","Double-crested Cormorant","NULL","01200","Double-crested Cormorant","Phalacrocorax","auritus",NA,"Utah"
"3113","NULL","","1949","NULL","NULL","Behle 1958","NULL","NULL","Box Elder","UT","California Gull","NULL","00530","California Gull","Larus","californicus",NA,"Utah"
"3114","NULL","","1949","NULL","NULL","Behle 1958","NULL","NULL","Box Elder","UT","Double-crested Cormorant","NULL","01200","Double-crested Cormorant","Phalacrocorax","auritus",NA,"Utah"
"3115","NULL","","1950","NULL","NULL","Behle 1958","NULL","NULL","Box Elder","UT","California Gull","NULL","00530","California Gull","Larus","californicus",NA,"Utah"
"3116","NULL","","1939","NULL","NULL","Behle 1958","NULL","NULL","Box Elder","UT","Caspian Tern","NULL","00640","Caspian Tern","Hydroprogne","caspia",NA,"Utah"
"3117","5/13/1941","00:00.0","1941","5","13","Behle 1958","NULL","NULL","Box Elder","UT","Caspian Tern","NULL","00640","Caspian Tern","Hydroprogne","caspia",1941-05-13,"Utah"
"3118","5/21/1942","00:00.0","1942","5","21","Behle 1958","NULL","NULL","Box Elder","UT","Caspian Tern","NULL","00640","Caspian Tern","Hydroprogne","caspia",1942-05-21,"Utah"
"3119","5/19/1943","00:00.0","1943","5","19","Behle 1958","NULL","NULL","Box Elder","UT","Caspian Tern","NULL","00640","Caspian Tern","Hydroprogne","caspia",1943-05-19,"Utah"
"3120","5/9/1946","00:00.0","1946","5","9","Behle 1958","NULL","NULL","Box Elder","UT","Caspian Tern","NULL","00640","Caspian Tern","Hydroprogne","caspia",1946-05-09,"Utah"
"3121","6/6/1949","00:00.0","1949","6","6","Behle 1958","NULL","NULL","Box Elder","UT","Caspian Tern","NULL","00640","Caspian Tern","Hydroprogne","caspia",1949-06-06,"Utah"
"3122","NULL","","1947","5","NULL","Behle 1958","NULL","NULL","Box Elder","UT","Caspian Tern","NULL","00640","Caspian Tern","Hydroprogne","caspia",NA,"Utah"
"3123","NULL","","1948","5","NULL","Behle 1958","NULL","NULL","Box Elder","UT","Caspian Tern","NULL","00640","Caspian Tern","Hydroprogne","caspia",NA,"Utah"
"3124","NULL","","1936","NULL","NULL","Behle 1958","NULL","NULL","Box Elder","UT","Caspian Tern","NULL","00640","Caspian Tern","Hydroprogne","caspia",NA,"Utah"
"3125","5/7/2007","00:00.0","2007","5","7","NULL","NULL","NULL","Box Elder","UT","Franklin's Gull","NULL","00590","Franklin's Gull","Larus","pipixcan",2007-05-07,"Utah"
"3126","5/7/2007","00:00.0","2007","5","7","NULL","NULL","NULL","Box Elder","UT","Franklin's Gull","NULL","00590","Franklin's Gull","Larus","pipixcan",2007-05-07,"Utah"
"3127","7/6/1999","00:00.0","1999","7","6","NULL","NULL","NULL","Box Elder","UT","Black-crowned Night-Heron","NULL","02020","Black-crowned Night-Heron","Nycticorax","nycticorax",1999-07-06,"Utah"
"3128","7/6/1999","00:00.0","1999","7","6","NULL","NULL","NULL","Box Elder","UT","Forster's Tern","NULL","00690","Forster's Tern","Sterna","forsteri",1999-07-06,"Utah"
"3129","7/6/1999","00:00.0","1999","7","6","NULL","NULL","NULL","Box Elder","UT","Franklin's Gull","NULL","00590","Franklin's Gull","Larus","pipixcan",1999-07-06,"Utah"
"3130","7/6/1999","00:00.0","1999","7","6","NULL","NULL","NULL","Box Elder","UT","Great Heron","NULL","NULL",NA,NA,NA,1999-07-06,"Utah"
"3131","7/6/1999","00:00.0","1999","7","6","NULL","NULL","NULL","Box Elder","UT","Snowy Egret","NULL","01970","Snowy Egret","Egretta","thula",1999-07-06,"Utah"
"3132","5/27/1999","00:00.0","1999","5","27","NULL","NULL","NULL","Box Elder","UT","Black-crowned Night-Heron","NULL","02020","Black-crowned Night-Heron","Nycticorax","nycticorax",1999-05-27,"Utah"
"3133","7/6/1999","00:00.0","1999","7","6","NULL","NULL","NULL","Box Elder","UT","Forster's Tern","NULL","00690","Forster's Tern","Sterna","forsteri",1999-07-06,"Utah"
"3134","7/6/1999","00:00.0","1999","7","6","NULL","NULL","NULL","Box Elder","UT","Franklin's Gull","NULL","00590","Franklin's Gull","Larus","pipixcan",1999-07-06,"Utah"
"3135","5/7/2007","00:00.0","2007","5","7","NULL","NULL","NULL","Box Elder","UT","Franklin's Gull","NULL","00590","Franklin's Gull","Larus","pipixcan",2007-05-07,"Utah"
"3136","5/27/1999","00:00.0","1999","5","27","NULL","NULL","NULL","Box Elder","UT","Black-crowned Night-Heron","NULL","02020","Black-crowned Night-Heron","Nycticorax","nycticorax",1999-05-27,"Utah"
"3137","5/27/1999","00:00.0","1999","5","27","NULL","NULL","NULL","Box Elder","UT","Great Blue Heron","NULL","01940","Great Blue Heron","Ardea","herodias",1999-05-27,"Utah"
"3138","7/6/1999","00:00.0","1999","7","6","NULL","NULL","NULL","Box Elder","UT","Black-crowned Night-Heron","NULL","02020","Black-crowned Night-Heron","Nycticorax","nycticorax",1999-07-06,"Utah"
"3139","7/6/1999","00:00.0","1999","7","6","NULL","NULL","NULL","Box Elder","UT","Forster's Tern","NULL","00690","Forster's Tern","Sterna","forsteri",1999-07-06,"Utah"
"3140","7/6/1999","00:00.0","1999","7","6","NULL","NULL","NULL","Box Elder","UT","Snowy Egret","NULL","01970","Snowy Egret","Egretta","thula",1999-07-06,"Utah"
"3141","6/16/2000","00:00.0","2000","6","16","NULL","NULL","NULL","Box Elder","UT","Black-crowned Night-Heron","NULL","02020","Black-crowned Night-Heron","Nycticorax","nycticorax",2000-06-16,"Utah"
"3142","6/16/2000","00:00.0","2000","6","16","NULL","NULL","NULL","Box Elder","UT","Franklin's Gull","NULL","00590","Franklin's Gull","Larus","pipixcan",2000-06-16,"Utah"
"3143","6/16/2000","00:00.0","2000","6","16","NULL","NULL","NULL","Box Elder","UT","Great Egret","NULL","01960","Great Egret","Ardea","alba",2000-06-16,"Utah"
"3144","6/16/2000","00:00.0","2000","6","16","NULL","NULL","NULL","Box Elder","UT","Snowy Egret","NULL","01970","Snowy Egret","Egretta","thula",2000-06-16,"Utah"
"3145","6/17/2000","00:00.0","2000","6","17","NULL","NULL","NULL","Box Elder","UT","Black-crowned Night-Heron","NULL","02020","Black-crowned Night-Heron","Nycticorax","nycticorax",2000-06-17,"Utah"
"3146","6/17/2000","00:00.0","2000","6","17","NULL","NULL","NULL","Box Elder","UT","Franklin's Gull","NULL","00590","Franklin's Gull","Larus","pipixcan",2000-06-17,"Utah"
"3147","6/17/2000","00:00.0","2000","6","17","NULL","NULL","NULL","Box Elder","UT","Snowy Egret","NULL","01970","Snowy Egret","Egretta","thula",2000-06-17,"Utah"
"3148","6/17/2000","00:00.0","2000","6","17","NULL","NULL","NULL","Box Elder","UT","White-faced Ibis","NULL","01870","White-faced Ibis","Plegadis","chihi",2000-06-17,"Utah"
"3149","5/7/2007","00:00.0","2007","5","7","NULL","NULL","NULL","Box Elder","UT","Franklin's Gull","NULL","00590","Franklin's Gull","Larus","pipixcan",2007-05-07,"Utah"
"3150","NULL","","1912","NULL","NULL","Behle 1958","NULL","NULL","Davis","UT","Great Blue Heron","NULL","01940","Great Blue Heron","Ardea","herodias",NA,"Utah"
"3151","NULL","","1932","NULL","NULL","Behle 1958","NULL","NULL","Davis","UT","Double-crested Cormorant","NULL","01200","Double-crested Cormorant","Phalacrocorax","auritus",NA,"Utah"
"3152","NULL","","1932","NULL","NULL","Behle 1958","NULL","NULL","Davis","UT","Great Blue Heron","NULL","01940","Great Blue Heron","Ardea","herodias",NA,"Utah"
"3153","NULL","","1941","NULL","NULL","Behle 1958","NULL","NULL","Davis","UT","California Gull","NULL","00530","California Gull","Larus","californicus",NA,"Utah"
"3154","NULL","","1982","NULL","NULL","Robinette et al. 1993","NULL","NULL","Davis","UT","California Gull","NULL","00530","California Gull","Larus","californicus",NA,"Utah"
"3155","NULL","","1983","NULL","NULL","Robinette et al. 1993","NULL","NULL","Davis","UT","California Gull","NULL","00530","California Gull","Larus","californicus",NA,"Utah"
"3156","NULL","","1990","NULL","NULL","Robinette et al. 1993","NULL","NULL","Davis","UT","California Gull","NULL","00530","California Gull","Larus","californicus",NA,"Utah"
"3157","NULL","","1991","NULL","NULL","Robinette et al. 1993","NULL","NULL","Davis","UT","California Gull","NULL","00530","California Gull","Larus","californicus",NA,"Utah"
"3158","NULL","","1993","NULL","NULL","Robinette et al. 1993","NULL","NULL","Davis","UT","California Gull","NULL","00530","California Gull","Larus","californicus",NA,"Utah"
"3159","5/11/1906","00:00.0","1906","5","11","Behle 1958","NULL","NULL","Davis","UT","California Gull","NULL","00530","California Gull","Larus","californicus",1906-05-11,"Utah"
"3160","5/11/1906","00:00.0","1906","5","11","Behle 1958","NULL","NULL","Davis","UT","Double-crested Cormorant","NULL","01200","Double-crested Cormorant","Phalacrocorax","auritus",1906-05-11,"Utah"
"3161","5/11/1906","00:00.0","1906","5","11","Behle 1958","NULL","NULL","Davis","UT","Great Blue Heron","NULL","01940","Great Blue Heron","Ardea","herodias",1906-05-11,"Utah"
"3162","5/16/1907","00:00.0","1907","5","16","Behle 1958","NULL","NULL","Davis","UT","Great Blue Heron","NULL","01940","Great Blue Heron","Ardea","herodias",1907-05-16,"Utah"
"3163","6/25/1934","00:00.0","1934","6","25","Behle 1958","NULL","NULL","Davis","UT","Double-crested Cormorant","NULL","01200","Double-crested Cormorant","Phalacrocorax","auritus",1934-06-25,"Utah"
"3164","6/25/1934","00:00.0","1934","6","25","Behle 1958","NULL","NULL","Davis","UT","Great Blue Heron","NULL","01940","Great Blue Heron","Ardea","herodias",1934-06-25,"Utah"
"3165","4/10/1935","00:00.0","1935","4","10","Behle 1958","NULL","NULL","Davis","UT","California Gull","NULL","00530","California Gull","Larus","californicus",1935-04-10,"Utah"
"3166","4/10/1935","00:00.0","1935","4","10","Behle 1958","NULL","NULL","Davis","UT","Double-crested Cormorant","NULL","01200","Double-crested Cormorant","Phalacrocorax","auritus",1935-04-10,"Utah"
"3167","4/10/1935","00:00.0","1935","4","10","Behle 1958","NULL","NULL","Davis","UT","Great Blue Heron","NULL","01940","Great Blue Heron","Ardea","herodias",1935-04-10,"Utah"
"3168","5/9/1936","00:00.0","1936","5","9","Behle 1958","NULL","NULL","Davis","UT","California Gull","NULL","00530","California Gull","Larus","californicus",1936-05-09,"Utah"
"3169","5/9/1936","00:00.0","1936","5","9","Behle 1958","NULL","NULL","Davis","UT","Double-crested Cormorant","NULL","01200","Double-crested Cormorant","Phalacrocorax","auritus",1936-05-09,"Utah"
"3170","5/9/1936","00:00.0","1936","5","9","Behle 1958","NULL","NULL","Davis","UT","Great Blue Heron","NULL","01940","Great Blue Heron","Ardea","herodias",1936-05-09,"Utah"
"3171","5/7/1937","00:00.0","1937","5","7","Behle 1958","NULL","NULL","Davis","UT","California Gull","NULL","00530","California Gull","Larus","californicus",1937-05-07,"Utah"
"3172","5/7/1937","00:00.0","1937","5","7","Behle 1958","NULL","NULL","Davis","UT","Double-crested Cormorant","NULL","01200","Double-crested Cormorant","Phalacrocorax","auritus",1937-05-07,"Utah"
"3173","5/7/1937","00:00.0","1937","5","7","Behle 1958","NULL","NULL","Davis","UT","Great Blue Heron","NULL","01940","Great Blue Heron","Ardea","herodias",1937-05-07,"Utah"
"3174","5/7/1938","00:00.0","1938","5","7","Behle 1958","NULL","NULL","Davis","UT","Double-crested Cormorant","NULL","01200","Double-crested Cormorant","Phalacrocorax","auritus",1938-05-07,"Utah"
"3175","5/7/1938","00:00.0","1938","5","7","Behle 1958","NULL","NULL","Davis","UT","Great Blue Heron","NULL","01940","Great Blue Heron","Ardea","herodias",1938-05-07,"Utah"
"3176","6/3/1939","00:00.0","1939","6","3","Behle 1958","NULL","NULL","Davis","UT","California Gull","NULL","00530","California Gull","Larus","californicus",1939-06-03,"Utah"
"3177","6/3/1939","00:00.0","1939","6","3","Behle 1958","NULL","NULL","Davis","UT","Double-crested Cormorant","NULL","01200","Double-crested Cormorant","Phalacrocorax","auritus",1939-06-03,"Utah"
"3178","4/21/1940","00:00.0","1940","4","21","Behle 1958","NULL","NULL","Davis","UT","Double-crested Cormorant","NULL","01200","Double-crested Cormorant","Phalacrocorax","auritus",1940-04-21,"Utah"
"3179","6/8/1940","00:00.0","1940","6","8","Behle 1958","NULL","NULL","Davis","UT","California Gull","NULL","00530","California Gull","Larus","californicus",1940-06-08,"Utah"
"3180","5/27/1941","00:00.0","1941","5","27","Behle 1958","NULL","NULL","Davis","UT","Double-crested Cormorant","NULL","01200","Double-crested Cormorant","Phalacrocorax","auritus",1941-05-27,"Utah"
"3181","5/8/1942","00:00.0","1942","5","8","Behle 1958","NULL","NULL","Davis","UT","Double-crested Cormorant","NULL","01200","Double-crested Cormorant","Phalacrocorax","auritus",1942-05-08,"Utah"
"3182","6/6/1942","00:00.0","1942","6","6","Behle 1958","NULL","NULL","Davis","UT","California Gull","NULL","00530","California Gull","Larus","californicus",1942-06-06,"Utah"
"3183","5/13/1944","00:00.0","1944","5","13","Behle 1958","NULL","NULL","Davis","UT","Double-crested Cormorant","NULL","01200","Double-crested Cormorant","Phalacrocorax","auritus",1944-05-13,"Utah"
"3184","6/8/1947","00:00.0","1947","6","8","Behle 1958","NULL","NULL","Davis","UT","California Gull","NULL","00530","California Gull","Larus","californicus",1947-06-08,"Utah"
"3185","6/8/1947","00:00.0","1947","6","8","Behle 1958","NULL","NULL","Davis","UT","Double-crested Cormorant","NULL","01200","Double-crested Cormorant","Phalacrocorax","auritus",1947-06-08,"Utah"
"3186","NULL","","1850","4","19","Behle 1958","NULL","NULL","Davis","UT","Double-crested Cormorant","NULL","01200","Double-crested Cormorant","Phalacrocorax","auritus",NA,"Utah"
"3187","NULL","","1850","4","9","Behle 1958","NULL","NULL","Davis","UT","California Gull","NULL","00530","California Gull","Larus","californicus",NA,"Utah"
"3188","NULL","","1850","4","9","Behle 1958","NULL","NULL","Davis","UT","Great Blue Heron","NULL","01940","Great Blue Heron","Ardea","herodias",NA,"Utah"
"3189","NULL","","1907","5","NULL","Behle 1958","NULL","NULL","Davis","UT","California Gull","NULL","00530","California Gull","Larus","californicus",NA,"Utah"
"3190","NULL","","1908","6","NULL","Behle 1958","NULL","NULL","Davis","UT","California Gull","NULL","00530","California Gull","Larus","californicus",NA,"Utah"
"3191","NULL","","1908","6","NULL","Behle 1958","NULL","NULL","Davis","UT","Great Blue Heron","NULL","01940","Great Blue Heron","Ardea","herodias",NA,"Utah"
"3192","NULL","","1912","NULL","NULL","Behle 1958","NULL","NULL","Davis","UT","California Gull","SurveyDate: Spring 1912","00530","California Gull","Larus","californicus",NA,"Utah"
"3193","7/9/1998","00:00.0","1998","7","9","Paul","NULL","NULL","Davis","UT","Black Tern","NULL","00770","Black Tern","Chlidonias","niger",1998-07-09,"Utah"
"3194","7/9/1998","00:00.0","1998","7","9","Paul","NULL","NULL","Davis","UT","Eared Grebe","NULL","00040","Eared Grebe","Podiceps","nigricollis",1998-07-09,"Utah"
"3195","7/9/1998","00:00.0","1998","7","9","Paul","NULL","NULL","Davis","UT","Forster's Tern","NULL","00690","Forster's Tern","Sterna","forsteri",1998-07-09,"Utah"
"3196","7/9/1998","00:00.0","1998","7","9","Paul","NULL","NULL","Davis","UT","Franklin's Gull","NULL","00590","Franklin's Gull","Larus","pipixcan",1998-07-09,"Utah"
"2104","NULL","","2009","4","26","Waltee","NULL","NULL","Rosebud","MT","Great Blue Heron","NULL","01940","Great Blue Heron","Ardea","herodias",NA,"Montana"
"2105","NULL","","2009","NULL","NULL","Waltee","NULL","NULL","Bighorn","MT","Double-crested Cormorant","NULL","01200","Double-crested Cormorant","Phalacrocorax","auritus",NA,"Montana"
"2106","NULL","","2009","NULL","NULL","Waltee","NULL","NULL","Bighorn","MT","Great Blue Heron","NULL","01940","Great Blue Heron","Ardea","herodias",NA,"Montana"
"2107","5/11/2011","00:00.0","2011","5","11","DuBois/Mamutich","NULL","NULL","Missoula","MT","Great Blue Heron","NULL","01940","Great Blue Heron","Ardea","herodias",2011-05-11,"Montana"
"2108","6/18/2010","00:00.0","2010","6","18","Doney","NULL","NULL","Beaverhead","MT","Great Blue Heron","NULL","01940","Great Blue Heron","Ardea","herodias",2010-06-18,"Montana"
"2109","6/5/2009","00:00.0","2009","6","5","Lipsey/Smith","NULL","NULL","Valley","MT","Eared Grebe","NULL","00040","Eared Grebe","Podiceps","nigricollis",2009-06-05,"Montana"
"2110","6/12/2009","00:00.0","2009","6","12","Paige et al.","NULL","NULL","Deer Lodge","MT","Double-crested Cormorant","NULL","01200","Double-crested Cormorant","Phalacrocorax","auritus",2009-06-12,"Montana"
"2111","6/12/2009","00:00.0","2009","6","12","Paige et al.","NULL","NULL","Deer Lodge","MT","Great Blue Heron","NULL","01940","Great Blue Heron","Ardea","herodias",2009-06-12,"Montana"
"2112","6/12/2009","00:00.0","2009","6","12","Paige et al.","NULL","NULL","Deer Lodge","MT","Ring-billed Gull","NULL","00540","Ring-billed Gull","Larus","delawarensis",2009-06-12,"Montana"
"2113","6/21/2010","00:00.0","2010","6","21","Swant","NULL","NULL","Deer Lodge","MT","Eared Grebe","NULL","00040","Eared Grebe","Podiceps","nigricollis",2010-06-21,"Montana"
"2114","6/29/2010","00:00.0","2010","6","29","Swant","NULL","NULL","Deer Lodge","MT","California Gull","NULL","00530","California Gull","Larus","californicus",2010-06-29,"Montana"
"2115","6/29/2010","00:00.0","2010","6","29","Swant","NULL","NULL","Deer Lodge","MT","Double-crested Cormorant","NULL","01200","Double-crested Cormorant","Phalacrocorax","auritus",2010-06-29,"Montana"
"2116","6/29/2010","00:00.0","2010","6","29","Swant","NULL","NULL","Deer Lodge","MT","Great Blue Heron","NULL","01940","Great Blue Heron","Ardea","herodias",2010-06-29,"Montana"
"2117","6/29/2010","00:00.0","2010","6","29","Swant","NULL","NULL","Deer Lodge","MT","Ring-billed Gull","NULL","00540","Ring-billed Gull","Larus","delawarensis",2010-06-29,"Montana"
"2118","5/22/2011","00:00.0","2011","5","22","DuBois/Throop","NULL","NULL","Deer Lodge","MT","Double-crested Cormorant","NULL","01200","Double-crested Cormorant","Phalacrocorax","auritus",2011-05-22,"Montana"
"2119","5/22/2011","00:00.0","2011","5","22","DuBois/Throop","NULL","NULL","Deer Lodge","MT","Great Blue Heron","NULL","01940","Great Blue Heron","Ardea","herodias",2011-05-22,"Montana"
"2120","7/26/2010","00:00.0","2010","7","26","Prellwitz","NULL","NULL","Phillips","MT","Great Blue Heron","NULL","01940","Great Blue Heron","Ardea","herodias",2010-07-26,"Montana"
"2121","6/19/2009","00:00.0","2009","6","19","Tilly","NULL","NULL","Daniels","MT","Common Tern","NULL","00700","Common Tern","Sterna","hirundo",2009-06-19,"Montana"
"2122","6/27/2009","00:00.0","2009","6","27","Tilly","NULL","NULL","Phillips","MT","Ring-billed Gull","NULL","00540","Ring-billed Gull","Larus","delawarensis",2009-06-27,"Montana"
"2123","6/2/2010","00:00.0","2010","6","2","Tilly","NULL","NULL","Phillips","MT","Ring-billed Gull","NULL","00540","Ring-billed Gull","Larus","delawarensis",2010-06-02,"Montana"
"2124","7/3/2010","00:00.0","2010","7","3","Tilly","NULL","NULL","Phillips","MT","Black Tern","NULL","00770","Black Tern","Chlidonias","niger",2010-07-03,"Montana"
"2125","7/3/2010","00:00.0","2010","7","3","Tilly","NULL","NULL","Phillips","MT","Black-crowned Night-Heron","NULL","02020","Black-crowned Night-Heron","Nycticorax","nycticorax",2010-07-03,"Montana"
"2126","7/3/2010","00:00.0","2010","7","3","Tilly","NULL","NULL","Phillips","MT","Eared Grebe","NULL","00040","Eared Grebe","Podiceps","nigricollis",2010-07-03,"Montana"
"2127","7/4/2011","00:00.0","2011","7","4","Tilly","NULL","NULL","Phillips","MT","Eared Grebe","NULL","00040","Eared Grebe","Podiceps","nigricollis",2011-07-04,"Montana"
"2128","NULL","","2011","NULL","NULL","Tilly","NULL","NULL","Phillips","MT","Ring-billed Gull","NULL","00540","Ring-billed Gull","Larus","delawarensis",NA,"Montana"
"2129","6/27/2009","00:00.0","2009","6","27","Tilly","NULL","NULL","Phillips","MT","Double-crested Cormorant","NULL","01200","Double-crested Cormorant","Phalacrocorax","auritus",2009-06-27,"Montana"
"2130","6/27/2009","00:00.0","2009","6","27","Tilly","NULL","NULL","Phillips","MT","Ring-billed Gull","NULL","00540","Ring-billed Gull","Larus","delawarensis",2009-06-27,"Montana"
"2131","6/27/2009","00:00.0","2009","6","27","Tilly","NULL","NULL","Phillips","MT","Western Grebe","NULL","00010","Western Grebe","Aechmophorus","occidentalis",2009-06-27,"Montana"
"2132","6/2/2010","00:00.0","2010","6","2","Tilly","NULL","NULL","Phillips","MT","Double-crested Cormorant","NULL","01200","Double-crested Cormorant","Phalacrocorax","auritus",2010-06-02,"Montana"
"2133","6/2/2010","00:00.0","2010","6","2","Tilly","NULL","NULL","Phillips","MT","Ring-billed or California Gull","NULL","NULL",NA,NA,NA,2010-06-02,"Montana"
"2134","7/3/2010","00:00.0","2010","7","3","Tilly","NULL","NULL","Phillips","MT","Western Grebe","NULL","00010","Western Grebe","Aechmophorus","occidentalis",2010-07-03,"Montana"
"2135","NULL","","2010","NULL","NULL","Waltee","NULL","NULL","Carter","MT","Great Blue Heron","NULL","01940","Great Blue Heron","Ardea","herodias",NA,"Montana"
"2136","NULL","","2010","4","8","Waltee","NULL","NULL","Custer","MT","Great Blue Heron","NULL","01940","Great Blue Heron","Ardea","herodias",NA,"Montana"
"2137","NULL","","2011","4","16","Stewart","NULL","NULL","Carbon","MT","Great Blue Heron","NULL","01940","Great Blue Heron","Ardea","herodias",NA,"Montana"
"2138","5/23/2011","00:00.0","2011","5","23","Begley","NULL","NULL","Sweet Grass","MT","Double-crested Cormorant","NULL","01200","Double-crested Cormorant","Phalacrocorax","auritus",2011-05-23,"Montana"
"2139","5/23/2011","00:00.0","2011","5","23","Begley","NULL","NULL","Sweet Grass","MT","Great Blue Heron","NULL","01940","Great Blue Heron","Ardea","herodias",2011-05-23,"Montana"
"2140","5/23/2011","00:00.0","2011","5","23","Begley","NULL","NULL","Stillwater","MT","Great Blue Heron","NULL","01940","Great Blue Heron","Ardea","herodias",2011-05-23,"Montana"
"2141","5/23/2011","00:00.0","2011","5","23","Begley","NULL","NULL","Sweet Grass","MT","Great Blue Heron","NULL","01940","Great Blue Heron","Ardea","herodias",2011-05-23,"Montana"
"2142","4/28/2011","00:00.0","2011","4","28","Begley","NULL","NULL","Yellowstone","MT","Great Blue Heron","NULL","01940","Great Blue Heron","Ardea","herodias",2011-04-28,"Montana"
"2143","4/28/2011","00:00.0","2011","4","28","Begley","NULL","NULL","Yellowstone","MT","Great Blue Heron","NULL","01940","Great Blue Heron","Ardea","herodias",2011-04-28,"Montana"
"2144","4/28/2011","00:00.0","2011","4","28","Begley","NULL","NULL","Yellowstone","MT","Great Blue Heron","NULL","01940","Great Blue Heron","Ardea","herodias",2011-04-28,"Montana"
"2145","4/28/2011","00:00.0","2011","4","28","Begley","NULL","NULL","Yellowstone","MT","Great Blue Heron","NULL","01940","Great Blue Heron","Ardea","herodias",2011-04-28,"Montana"
"2146","5/23/2011","00:00.0","2011","5","23","Begley","NULL","NULL","Stillwater","MT","Great Blue Heron","NULL","01940","Great Blue Heron","Ardea","herodias",2011-05-23,"Montana"
"2147","5/23/2011","00:00.0","2011","5","23","Begley","NULL","NULL","Yellowstone","MT","Great Blue Heron","NULL","01940","Great Blue Heron","Ardea","herodias",2011-05-23,"Montana"
"2148","5/23/2011","00:00.0","2011","5","23","Begley","NULL","NULL","Yellowstone","MT","Great Blue Heron","NULL","01940","Great Blue Heron","Ardea","herodias",2011-05-23,"Montana"
"2149","5/23/2011","00:00.0","2011","5","23","Begley","NULL","NULL","Yellowstone","MT","Great Blue Heron","NULL","01940","Great Blue Heron","Ardea","herodias",2011-05-23,"Montana"
"2150","5/23/2011","00:00.0","2011","5","23","Begley","NULL","NULL","Sweet Grass","MT","Double-crested Cormorant","NULL","01200","Double-crested Cormorant","Phalacrocorax","auritus",2011-05-23,"Montana"
"2151","5/23/2011","00:00.0","2011","5","23","Begley","NULL","NULL","Sweet Grass","MT","Great Blue Heron","NULL","01940","Great Blue Heron","Ardea","herodias",2011-05-23,"Montana"
"2152","NULL","","1980","NULL","NULL","Olson","NULL","NULL","Teton","MT","Great Blue Heron","NULL","01940","Great Blue Heron","Ardea","herodias",NA,"Montana"
"2153","NULL","","1990","NULL","NULL","NULL","NULL","NULL","Teton","MT","American White Pelican","NULL","01250","American White Pelican","Pelecanus","erythrorhynchos",NA,"Montana"
"2154","NULL","","1993","NULL","NULL","NULL","NULL","NULL","Teton","MT","American White Pelican","NULL","01250","American White Pelican","Pelecanus","erythrorhynchos",NA,"Montana"
"2155","NULL","","2000","NULL","NULL","NULL","NULL","NULL","Teton","MT","American White Pelican","NULL","01250","American White Pelican","Pelecanus","erythrorhynchos",NA,"Montana"
"2156","NULL","","2001","NULL","NULL","NULL","NULL","NULL","Teton","MT","American White Pelican","NULL","01250","American White Pelican","Pelecanus","erythrorhynchos",NA,"Montana"
"2157","NULL","","1977","NULL","NULL","Billings","NULL","NULL","Fergus","MT","Great Blue Heron","NULL","01940","Great Blue Heron","Ardea","herodias",NA,"Montana"
"2158","NULL","","1978","NULL","NULL","Billings","NULL","NULL","Broadwater","MT","Great Blue Heron","NULL","01940","Great Blue Heron","Ardea","herodias",NA,"Montana"
"2159","NULL","","1979","NULL","NULL","Billings","NULL","NULL","Broadwater","MT","Great Blue Heron","NULL","01940","Great Blue Heron","Ardea","herodias",NA,"Montana"
"2160","NULL","","1989","NULL","NULL","NULL","NULL","NULL","Broadwater","MT","American White Pelican","NULL","01250","American White Pelican","Pelecanus","erythrorhynchos",NA,"Montana"
"2161","NULL","","2000","NULL","NULL","NULL","NULL","NULL","Broadwater","MT","American White Pelican","NULL","01250","American White Pelican","Pelecanus","erythrorhynchos",NA,"Montana"
"2162","NULL","","1996","NULL","NULL","NULL","NULL","NULL","Hill","MT","Ring-billed Gull","NULL","00540","Ring-billed Gull","Larus","delawarensis",NA,"Montana"
"2163","NULL","","1978","NULL","NULL","Parker","NULL","NULL","Flathead","MT","Great Blue Heron","NULL","01940","Great Blue Heron","Ardea","herodias",NA,"Montana"
"2164","NULL","","1979","NULL","NULL","Parker","NULL","NULL","Flathead","MT","Great Blue Heron","NULL","01940","Great Blue Heron","Ardea","herodias",NA,"Montana"
"2165","NULL","","1985","NULL","NULL","Prellwitz","NULL","NULL","Phillips","MT","Black-crowned Night-Heron","NULL","02020","Black-crowned Night-Heron","Nycticorax","nycticorax",NA,"Montana"
"2166","NULL","","1981","NULL","NULL","Prellwitz","NULL","NULL","Phillips","MT","Common Tern","NULL","00700","Common Tern","Sterna","hirundo",NA,"Montana"
"2167","NULL","","1983","NULL","NULL","Prellwitz","NULL","NULL","Phillips","MT","Common Tern","NULL","00700","Common Tern","Sterna","hirundo",NA,"Montana"
"2168","NULL","","1986","NULL","NULL","Prellwitz","NULL","NULL","Phillips","MT","Common Tern","NULL","00700","Common Tern","Sterna","hirundo",NA,"Montana"
"2169","NULL","","1976","NULL","NULL","Shupe","NULL","NULL","Valley","MT","Great Blue Heron","NULL","01940","Great Blue Heron","Ardea","herodias",NA,"Montana"
"2170","NULL","","1977","NULL","NULL","Shupe","NULL","NULL","Valley","MT","Double-crested Cormorant","NULL","01200","Double-crested Cormorant","Phalacrocorax","auritus",NA,"Montana"
"2171","NULL","","1978","NULL","NULL","Shupe","NULL","NULL","Valley","MT","Double-crested Cormorant","NULL","01200","Double-crested Cormorant","Phalacrocorax","auritus",NA,"Montana"
"2172","NULL","","1976","NULL","NULL","Shupe","NULL","NULL","Garfield","MT","Double-crested Cormorant","NULL","01200","Double-crested Cormorant","Phalacrocorax","auritus",NA,"Montana"
"2173","NULL","","1978","NULL","NULL","Shupe","NULL","NULL","Garfield","MT","Double-crested Cormorant","NULL","01200","Double-crested Cormorant","Phalacrocorax","auritus",NA,"Montana"
"2174","NULL","","1976","NULL","NULL","Shupe","NULL","NULL","McCone","MT","Double-crested Cormorant","NULL","01200","Double-crested Cormorant","Phalacrocorax","auritus",NA,"Montana"
"2175","NULL","","1976","NULL","NULL","Shupe","NULL","NULL","McCone","MT","Great Blue Heron","NULL","01940","Great Blue Heron","Ardea","herodias",NA,"Montana"
"2176","NULL","","1976","NULL","NULL","Shupe","NULL","NULL","McCone","MT","Great Blue Heron","NULL","01940","Great Blue Heron","Ardea","herodias",NA,"Montana"
"2177","NULL","","1978","NULL","NULL","Shupe","NULL","NULL","McCone","MT","Double-crested Cormorant","NULL","01200","Double-crested Cormorant","Phalacrocorax","auritus",NA,"Montana"
"2178","NULL","","1978","NULL","NULL","Shupe","NULL","NULL","McCone","MT","Great Blue Heron","NULL","01940","Great Blue Heron","Ardea","herodias",NA,"Montana"
"2179","NULL","","1980","NULL","NULL","Children","NULL","NULL","Teton","MT","Double-crested Cormorant","NULL","01200","Double-crested Cormorant","Phalacrocorax","auritus",NA,"Montana"
"2180","NULL","","1994","NULL","NULL","Schwitters","NULL","NULL","Teton","MT","Caspian Tern","NULL","00640","Caspian Tern","Hydroprogne","caspia",NA,"Montana"
"2181","NULL","","1980","NULL","NULL","Trueblood","NULL","NULL","Phillips","MT","Double-crested Cormorant","NULL","01200","Double-crested Cormorant","Phalacrocorax","auritus",NA,"Montana"
"2182","NULL","","1985","NULL","NULL","Prellwitz","NULL","NULL","Phillips","MT","Black-crowned Night-Heron","NULL","02020","Black-crowned Night-Heron","Nycticorax","nycticorax",NA,"Montana"
"2183","NULL","","1987","NULL","NULL","Prellwitz","NULL","NULL","Phillips","MT","Black-crowned Night-Heron","NULL","02020","Black-crowned Night-Heron","Nycticorax","nycticorax",NA,"Montana"
"2184","NULL","","1996","NULL","NULL","Prellwitz","NULL","NULL","Phillips","MT","Black-crowned Night-Heron","NULL","02020","Black-crowned Night-Heron","Nycticorax","nycticorax",NA,"Montana"
"2185","NULL","","1935","NULL","NULL","NULL","NULL","NULL","Phillips","MT","American White Pelican","NULL","01250","American White Pelican","Pelecanus","erythrorhynchos",NA,"Montana"
"2186","NULL","","1968","NULL","NULL","NULL","NULL","NULL","Phillips","MT","Great Blue Heron","NULL","01940","Great Blue Heron","Ardea","herodias",NA,"Montana"
"2187","NULL","","1972","NULL","NULL","Reichel","NULL","NULL","Phillips","MT","Double-crested Cormorant","NULL","01200","Double-crested Cormorant","Phalacrocorax","auritus",NA,"Montana"
"2188","NULL","","1972","NULL","NULL","NULL","NULL","NULL","Phillips","MT","Great Blue Heron","NULL","01940","Great Blue Heron","Ardea","herodias",NA,"Montana"
"2189","NULL","","1973","NULL","NULL","NULL","NULL","NULL","Phillips","MT","Double-crested Cormorant","NULL","01200","Double-crested Cormorant","Phalacrocorax","auritus",NA,"Montana"
"2190","NULL","","1973","NULL","NULL","NULL","NULL","NULL","Phillips","MT","Great Blue Heron","NULL","01940","Great Blue Heron","Ardea","herodias",NA,"Montana"
"2191","NULL","","1974","NULL","NULL","NULL","NULL","NULL","Phillips","MT","Double-crested Cormorant","NULL","01200","Double-crested Cormorant","Phalacrocorax","auritus",NA,"Montana"
"2192","NULL","","1974","NULL","NULL","NULL","NULL","NULL","Phillips","MT","Great Blue Heron","NULL","01940","Great Blue Heron","Ardea","herodias",NA,"Montana"
"2193","NULL","","1975","NULL","NULL","NULL","NULL","NULL","Phillips","MT","Double-crested Cormorant","NULL","01200","Double-crested Cormorant","Phalacrocorax","auritus",NA,"Montana"
"2194","NULL","","1975","NULL","NULL","NULL","NULL","NULL","Phillips","MT","Great Blue Heron","NULL","01940","Great Blue Heron","Ardea","herodias",NA,"Montana"
"2195","NULL","","1976","NULL","NULL","NULL","NULL","NULL","Phillips","MT","Double-crested Cormorant","NULL","01200","Double-crested Cormorant","Phalacrocorax","auritus",NA,"Montana"
"2196","NULL","","1976","NULL","NULL","NULL","NULL","NULL","Phillips","MT","Great Blue Heron","NULL","01940","Great Blue Heron","Ardea","herodias",NA,"Montana"
"2197","NULL","","1979","NULL","NULL","NULL","NULL","NULL","Phillips","MT","Double-crested Cormorant","NULL","01200","Double-crested Cormorant","Phalacrocorax","auritus",NA,"Montana"
"2198","NULL","","1979","NULL","NULL","NULL","NULL","NULL","Phillips","MT","Great Blue Heron","NULL","01940","Great Blue Heron","Ardea","herodias",NA,"Montana"
"2199","NULL","","1993","NULL","NULL","NULL","NULL","NULL","Phillips","MT","American White Pelican","NULL","01250","American White Pelican","Pelecanus","erythrorhynchos",NA,"Montana"
"2200","NULL","","1998","NULL","NULL","NULL","NULL","NULL","Phillips","MT","Arctic Tern","NULL","00710","Arctic Tern","Sterna","paradisaea",NA,"Montana"
"2201","NULL","","1999","NULL","NULL","NULL","NULL","NULL","Phillips","MT","American White Pelican","NULL","01250","American White Pelican","Pelecanus","erythrorhynchos",NA,"Montana"
"2202","NULL","","1999","NULL","NULL","NULL","NULL","NULL","Phillips","MT","Arctic Tern","NULL","00710","Arctic Tern","Sterna","paradisaea",NA,"Montana"
"2203","NULL","","2000","NULL","NULL","NULL","NULL","NULL","Phillips","MT","American White Pelican","NULL","01250","American White Pelican","Pelecanus","erythrorhynchos",NA,"Montana"
"2204","NULL","","2000","NULL","NULL","Dinsmore","NULL","NULL","Phillips","MT","Arctic Tern","NULL","00710","Arctic Tern","Sterna","paradisaea",NA,"Montana"
"2205","NULL","","1996","NULL","NULL","NULL","NULL","NULL","Petroleum","MT","Common Tern","NULL","00700","Common Tern","Sterna","hirundo",NA,"Montana"
"2206","NULL","","1996","NULL","NULL","NULL","NULL","NULL","Petroleum","MT","Double-crested Cormorant","NULL","01200","Double-crested Cormorant","Phalacrocorax","auritus",NA,"Montana"
"2207","NULL","","1996","NULL","NULL","NULL","NULL","NULL","Petroleum","MT","Forster's Tern","NULL","00690","Forster's Tern","Sterna","forsteri",NA,"Montana"
"2208","NULL","","1979","NULL","NULL","Marble","NULL","NULL","Liberty","MT","Great Blue Heron","NULL","01940","Great Blue Heron","Ardea","herodias",NA,"Montana"
"2209","NULL","","1938","NULL","NULL","NULL","NULL","NULL","Sheridan","MT","American White Pelican","NULL","01250","American White Pelican","Pelecanus","erythrorhynchos",NA,"Montana"
"2210","NULL","","1939","NULL","NULL","NULL","NULL","NULL","Sheridan","MT","American White Pelican","NULL","01250","American White Pelican","Pelecanus","erythrorhynchos",NA,"Montana"
"2211","NULL","","1939","NULL","NULL","NULL","NULL","NULL","Sheridan","MT","American White Pelican","NULL","01250","American White Pelican","Pelecanus","erythrorhynchos",NA,"Montana"
"2212","NULL","","1940","NULL","NULL","NULL","NULL","NULL","Sheridan","MT","American White Pelican","NULL","01250","American White Pelican","Pelecanus","erythrorhynchos",NA,"Montana"
"2213","NULL","","1941","NULL","NULL","NULL","NULL","NULL","Sheridan","MT","American White Pelican","NULL","01250","American White Pelican","Pelecanus","erythrorhynchos",NA,"Montana"
"2214","NULL","","1942","NULL","NULL","NULL","NULL","NULL","Sheridan","MT","American White Pelican","NULL","01250","American White Pelican","Pelecanus","erythrorhynchos",NA,"Montana"
"2215","NULL","","1943","NULL","NULL","NULL","NULL","NULL","Sheridan","MT","American White Pelican","NULL","01250","American White Pelican","Pelecanus","erythrorhynchos",NA,"Montana"
"2216","NULL","","1944","NULL","NULL","NULL","NULL","NULL","Sheridan","MT","American White Pelican","NULL","01250","American White Pelican","Pelecanus","erythrorhynchos",NA,"Montana"
"2217","NULL","","1945","NULL","NULL","NULL","NULL","NULL","Sheridan","MT","American White Pelican","NULL","01250","American White Pelican","Pelecanus","erythrorhynchos",NA,"Montana"
"2218","NULL","","1946","NULL","NULL","NULL","NULL","NULL","Sheridan","MT","American White Pelican","NULL","01250","American White Pelican","Pelecanus","erythrorhynchos",NA,"Montana"
"2219","NULL","","1947","NULL","NULL","NULL","NULL","NULL","Sheridan","MT","American White Pelican","NULL","01250","American White Pelican","Pelecanus","erythrorhynchos",NA,"Montana"
"2220","NULL","","1948","NULL","NULL","NULL","NULL","NULL","Sheridan","MT","American White Pelican","NULL","01250","American White Pelican","Pelecanus","erythrorhynchos",NA,"Montana"
"2221","NULL","","1949","NULL","NULL","NULL","NULL","NULL","Sheridan","MT","American White Pelican","NULL","01250","American White Pelican","Pelecanus","erythrorhynchos",NA,"Montana"
"2222","NULL","","1950","NULL","NULL","NULL","NULL","NULL","Sheridan","MT","American White Pelican","NULL","01250","American White Pelican","Pelecanus","erythrorhynchos",NA,"Montana"
"2223","NULL","","1951","NULL","NULL","NULL","NULL","NULL","Sheridan","MT","American White Pelican","NULL","01250","American White Pelican","Pelecanus","erythrorhynchos",NA,"Montana"
"2224","NULL","","1952","NULL","NULL","NULL","NULL","NULL","Sheridan","MT","American White Pelican","NULL","01250","American White Pelican","Pelecanus","erythrorhynchos",NA,"Montana"
"2225","NULL","","1953","NULL","NULL","NULL","NULL","NULL","Sheridan","MT","American White Pelican","NULL","01250","American White Pelican","Pelecanus","erythrorhynchos",NA,"Montana"
"2226","NULL","","1954","NULL","NULL","NULL","NULL","NULL","Sheridan","MT","American White Pelican","NULL","01250","American White Pelican","Pelecanus","erythrorhynchos",NA,"Montana"
"2227","NULL","","1955","NULL","NULL","NULL","NULL","NULL","Sheridan","MT","American White Pelican","NULL","01250","American White Pelican","Pelecanus","erythrorhynchos",NA,"Montana"
"2228","NULL","","1956","NULL","NULL","NULL","NULL","NULL","Sheridan","MT","American White Pelican","NULL","01250","American White Pelican","Pelecanus","erythrorhynchos",NA,"Montana"
"2229","NULL","","1957","NULL","NULL","NULL","NULL","NULL","Sheridan","MT","American White Pelican","NULL","01250","American White Pelican","Pelecanus","erythrorhynchos",NA,"Montana"
"2230","NULL","","1958","NULL","NULL","NULL","NULL","NULL","Sheridan","MT","American White Pelican","NULL","01250","American White Pelican","Pelecanus","erythrorhynchos",NA,"Montana"
"2231","NULL","","1959","NULL","NULL","NULL","NULL","NULL","Sheridan","MT","American White Pelican","NULL","01250","American White Pelican","Pelecanus","erythrorhynchos",NA,"Montana"
"2232","NULL","","1960","NULL","NULL","NULL","NULL","NULL","Sheridan","MT","American White Pelican","NULL","01250","American White Pelican","Pelecanus","erythrorhynchos",NA,"Montana"
"2233","NULL","","1961","NULL","NULL","NULL","NULL","NULL","Sheridan","MT","American White Pelican","NULL","01250","American White Pelican","Pelecanus","erythrorhynchos",NA,"Montana"
"2234","NULL","","1962","NULL","NULL","NULL","NULL","NULL","Sheridan","MT","American White Pelican","NULL","01250","American White Pelican","Pelecanus","erythrorhynchos",NA,"Montana"
"2235","NULL","","1963","NULL","NULL","NULL","NULL","NULL","Sheridan","MT","American White Pelican","NULL","01250","American White Pelican","Pelecanus","erythrorhynchos",NA,"Montana"
"2236","NULL","","1964","NULL","NULL","NULL","NULL","NULL","Sheridan","MT","American White Pelican","NULL","01250","American White Pelican","Pelecanus","erythrorhynchos",NA,"Montana"
"2237","NULL","","1966","NULL","NULL","NULL","NULL","NULL","Sheridan","MT","American White Pelican","NULL","01250","American White Pelican","Pelecanus","erythrorhynchos",NA,"Montana"
"2238","NULL","","1967","NULL","NULL","NULL","NULL","NULL","Sheridan","MT","American White Pelican","NULL","01250","American White Pelican","Pelecanus","erythrorhynchos",NA,"Montana"
"2239","NULL","","1968","NULL","NULL","NULL","NULL","NULL","Sheridan","MT","American White Pelican","NULL","01250","American White Pelican","Pelecanus","erythrorhynchos",NA,"Montana"
"2240","NULL","","1969","NULL","NULL","NULL","NULL","NULL","Sheridan","MT","American White Pelican","NULL","01250","American White Pelican","Pelecanus","erythrorhynchos",NA,"Montana"
"2241","NULL","","1970","NULL","NULL","NULL","NULL","NULL","Sheridan","MT","American White Pelican","NULL","01250","American White Pelican","Pelecanus","erythrorhynchos",NA,"Montana"
"2242","NULL","","1971","NULL","NULL","NULL","NULL","NULL","Sheridan","MT","American White Pelican","NULL","01250","American White Pelican","Pelecanus","erythrorhynchos",NA,"Montana"
"2243","NULL","","1972","NULL","NULL","NULL","NULL","NULL","Sheridan","MT","American White Pelican","NULL","01250","American White Pelican","Pelecanus","erythrorhynchos",NA,"Montana"
"2244","NULL","","1975","NULL","NULL","NULL","NULL","NULL","Sheridan","MT","American White Pelican","NULL","01250","American White Pelican","Pelecanus","erythrorhynchos",NA,"Montana"
"2245","NULL","","1976","NULL","NULL","NULL","NULL","NULL","Sheridan","MT","American White Pelican","NULL","01250","American White Pelican","Pelecanus","erythrorhynchos",NA,"Montana"
"2246","NULL","","1979","NULL","NULL","NULL","NULL","NULL","Sheridan","MT","American White Pelican","NULL","01250","American White Pelican","Pelecanus","erythrorhynchos",NA,"Montana"
"2247","NULL","","1981","NULL","NULL","NULL","NULL","NULL","Sheridan","MT","American White Pelican","NULL","01250","American White Pelican","Pelecanus","erythrorhynchos",NA,"Montana"
"2248","NULL","","1982","NULL","NULL","NULL","NULL","NULL","Sheridan","MT","American White Pelican","NULL","01250","American White Pelican","Pelecanus","erythrorhynchos",NA,"Montana"
"2249","NULL","","1983","NULL","NULL","NULL","NULL","NULL","Sheridan","MT","American White Pelican","NULL","01250","American White Pelican","Pelecanus","erythrorhynchos",NA,"Montana"
"2250","NULL","","1984","NULL","NULL","NULL","NULL","NULL","Sheridan","MT","American White Pelican","NULL","01250","American White Pelican","Pelecanus","erythrorhynchos",NA,"Montana"
"2251","NULL","","1985","NULL","NULL","NULL","NULL","NULL","Sheridan","MT","American White Pelican","NULL","01250","American White Pelican","Pelecanus","erythrorhynchos",NA,"Montana"
"2252","NULL","","1986","NULL","NULL","NULL","NULL","NULL","Sheridan","MT","American White Pelican","NULL","01250","American White Pelican","Pelecanus","erythrorhynchos",NA,"Montana"
"2253","NULL","","1987","NULL","NULL","NULL","NULL","NULL","Sheridan","MT","American White Pelican","NULL","01250","American White Pelican","Pelecanus","erythrorhynchos",NA,"Montana"
"2254","NULL","","1988","NULL","NULL","NULL","NULL","NULL","Sheridan","MT","American White Pelican","NULL","01250","American White Pelican","Pelecanus","erythrorhynchos",NA,"Montana"
"2255","NULL","","1989","NULL","NULL","NULL","NULL","NULL","Sheridan","MT","American White Pelican","NULL","01250","American White Pelican","Pelecanus","erythrorhynchos",NA,"Montana"
"2256","NULL","","1990","NULL","NULL","NULL","NULL","NULL","Sheridan","MT","American White Pelican","NULL","01250","American White Pelican","Pelecanus","erythrorhynchos",NA,"Montana"
"1129","4/27/2010","00:00.0","2010","4","27","Cagle","NULL","NULL","Navajo","AZ","Double-crested Cormorant","NULL","01200","Double-crested Cormorant","Phalacrocorax","auritus",2010-04-27,"Arizona"
"1130","5/13/2011","00:00.0","2011","5","13","Cagle","NULL","NULL","Navajo","AZ","Double-crested Cormorant","NULL","01200","Double-crested Cormorant","Phalacrocorax","auritus",2011-05-13,"Arizona"
"1131","1/25/2011","00:00.0","2011","1","25","West","NULL","NULL","Mohave","AZ","Double-crested Cormorant","NULL","01200","Double-crested Cormorant","Phalacrocorax","auritus",2011-01-25,"Arizona"
"1132","2/3/2011","00:00.0","2011","2","3","West","NULL","NULL","Mohave","AZ","Double-crested Cormorant","NULL","01200","Double-crested Cormorant","Phalacrocorax","auritus",2011-02-03,"Arizona"
"1133","4/16/2011","00:00.0","2011","4","16","West","NULL","NULL","Mohave","AZ","Double-crested Cormorant","NULL","01200","Double-crested Cormorant","Phalacrocorax","auritus",2011-04-16,"Arizona"
"1134","5/10/2011","00:00.0","2011","5","10","Allen","NULL","NULL","Mohave","AZ","Great Blue Heron","NULL","01940","Great Blue Heron","Ardea","herodias",2011-05-10,"Arizona"
"1135","5/9/2009","00:00.0","2009","5","9","Piest","NULL","NULL","Yuma","AZ","Great Blue Heron","NULL","01940","Great Blue Heron","Ardea","herodias",2009-05-09,"Arizona"
"1136","5/8/2010","00:00.0","2010","5","8","Piest","NULL","NULL","Yuma","AZ","Great Blue Heron","NULL","01940","Great Blue Heron","Ardea","herodias",2010-05-08,"Arizona"
"1137","5/29/2009","00:00.0","2009","5","29","Holm et al.","NULL","NULL","Coconino","AZ","Great Blue Heron","NULL","01940","Great Blue Heron","Ardea","herodias",2009-05-29,"Arizona"
"1138","6/2/2010","00:00.0","2010","6","2","Holm","NULL","NULL","Coconino","AZ","Great Blue Heron","NULL","01940","Great Blue Heron","Ardea","herodias",2010-06-02,"Arizona"
"1139","6/15/2011","00:00.0","2011","6","15","Holm/Price","NULL","NULL","Coconino","AZ","Great Blue Heron","NULL","01940","Great Blue Heron","Ardea","herodias",2011-06-15,"Arizona"
"1140","4/14/2009","00:00.0","2009","4","14","Corman","NULL","NULL","Yavapai","AZ","Double-crested Cormorant","NULL","01200","Double-crested Cormorant","Phalacrocorax","auritus",2009-04-14,"Arizona"
"1141","4/14/2009","00:00.0","2009","4","14","Corman","NULL","NULL","Yavapai","AZ","Great Blue Heron","NULL","01940","Great Blue Heron","Ardea","herodias",2009-04-14,"Arizona"
"1142","2/15/2011","00:00.0","2011","2","15","Tomoff","NULL","NULL","Yavapai","AZ","Double-crested Cormorant","NULL","01200","Double-crested Cormorant","Phalacrocorax","auritus",2011-02-15,"Arizona"
"1143","3/4/2011","00:00.0","2011","3","4","Tomoff","NULL","NULL","Yavapai","AZ","Double-crested Cormorant","NULL","01200","Double-crested Cormorant","Phalacrocorax","auritus",2011-03-04,"Arizona"
"1144","3/4/2011","00:00.0","2011","3","4","Tomoff","NULL","NULL","Yavapai","AZ","Great Blue Heron","NULL","01940","Great Blue Heron","Ardea","herodias",2011-03-04,"Arizona"
"1145","4/9/2011","00:00.0","2011","4","9","Tomoff","NULL","NULL","Yavapai","AZ","Double-crested Cormorant","NULL","01200","Double-crested Cormorant","Phalacrocorax","auritus",2011-04-09,"Arizona"
"1146","4/9/2011","00:00.0","2011","4","9","Tomoff","NULL","NULL","Yavapai","AZ","Great Blue Heron","NULL","01940","Great Blue Heron","Ardea","herodias",2011-04-09,"Arizona"
"1147","4/15/2011","00:00.0","2011","4","15","Tomoff","NULL","NULL","Yavapai","AZ","Double-crested Cormorant","NULL","01200","Double-crested Cormorant","Phalacrocorax","auritus",2011-04-15,"Arizona"
"1148","4/15/2011","00:00.0","2011","4","15","Tomoff","NULL","NULL","Yavapai","AZ","Great Blue Heron","NULL","01940","Great Blue Heron","Ardea","herodias",2011-04-15,"Arizona"
"1149","7/14/2010","00:00.0","2010","7","14","Helgren","NULL","NULL","Coconino","AZ","Great Blue Heron","NULL","01940","Great Blue Heron","Ardea","herodias",2010-07-14,"Arizona"
"1150","7/27/2010","00:00.0","2010","7","27","Helgren","NULL","NULL","Coconino","AZ","Great Blue Heron","NULL","01940","Great Blue Heron","Ardea","herodias",2010-07-27,"Arizona"
"1151","6/16/2011","00:00.0","2011","6","16","Willard","NULL","NULL","Coconino","AZ","Great Blue Heron","NULL","01940","Great Blue Heron","Ardea","herodias",2011-06-16,"Arizona"
"1152","5/4/2006","00:00.0","2006","5","4","Corman","NULL","NULL","LaPaz","AZ","Great Blue Heron","NULL","01940","Great Blue Heron","Ardea","herodias",2006-05-04,"Arizona"
"1153","12/1/2008","00:00.0","2008","12","1","Barnes","NULL","NULL","Mohave","AZ","Double-crested Cormorant","NULL","01200","Double-crested Cormorant","Phalacrocorax","auritus",2008-12-01,"Arizona"
"1154","1/25/2008","00:00.0","2008","1","25","Barnes","NULL","NULL","Mohave","AZ","Double-crested Cormorant","NULL","01200","Double-crested Cormorant","Phalacrocorax","auritus",2008-01-25,"Arizona"
"1155","6/3/2008","00:00.0","2008","6","3","Barnes","NULL","NULL","Mohave","AZ","Double-crested Cormorant","NULL","01200","Double-crested Cormorant","Phalacrocorax","auritus",2008-06-03,"Arizona"
"1156","4/21/2008","00:00.0","2008","4","21","Kaiser","NULL","NULL","Maricopa","AZ","Great Blue Heron","NULL","01940","Great Blue Heron","Ardea","herodias",2008-04-21,"Arizona"
"1157","5/21/2008","00:00.0","2008","5","21","McCarty","NULL","NULL","Maricopa","AZ","Great Blue Heron","NULL","01940","Great Blue Heron","Ardea","herodias",2008-05-21,"Arizona"
"1158","5/16/1997","00:00.0","1997","5","16","Piest","NULL","NULL","Yuma","AZ","Great Blue Heron","NULL","01940","Great Blue Heron","Ardea","herodias",1997-05-16,"Arizona"
"1159","5/16/1997","00:00.0","1997","5","16","Piest","NULL","NULL","Yuma","AZ","Great Egret","NULL","01960","Great Egret","Ardea","alba",1997-05-16,"Arizona"
"1160","2/29/2004","00:00.0","2004","2","29","Corman/Edwards","NULL","NULL","Maricopa","AZ","Neotropic Cormorant","NULL","01210","Neotropic Cormorant","Phalacrocorax","brasilianus",2004-02-29,"Arizona"
"1161","3/29/2007","00:00.0","2007","3","29","O'Callaghan","NULL","NULL","Pima","AZ","Great Blue Heron","NULL","01940","Great Blue Heron","Ardea","herodias",2007-03-29,"Arizona"
"1162","4/4/2008","00:00.0","2008","4","4","Corman","NULL","NULL","Maricopa","AZ","Great Blue Heron","NULL","01940","Great Blue Heron","Ardea","herodias",2008-04-04,"Arizona"
"1163","4/28/2008","00:00.0","2008","4","28","Lehman","NULL","NULL","LaPaz","AZ","Cattle Egret","NULL","02001","Cattle Egret","Bubulcus","ibis",2008-04-28,"Arizona"
"1164","7/12/2008","00:00.0","2008","7","12","Lehman","NULL","NULL","La Paz","AZ","Cattle Egret","NULL","02001","Cattle Egret","Bubulcus","ibis",2008-07-12,"Arizona"
"1165","4/28/2008","00:00.0","2008","4","28","Lehman","NULL","NULL","LaPaz","AZ","Snowy Egret","NULL","01970","Snowy Egret","Egretta","thula",2008-04-28,"Arizona"
"1166","4/28/2008","00:00.0","2008","4","28","Lehman","NULL","NULL","LaPaz","AZ","White-faced Ibis","NULL","01870","White-faced Ibis","Plegadis","chihi",2008-04-28,"Arizona"
"1167","5/17/2008","00:00.0","2008","5","17","Lehman","NULL","NULL","LaPaz","AZ","Great Egret","NULL","01960","Great Egret","Ardea","alba",2008-05-17,"Arizona"
"1168","7/12/2008","00:00.0","2008","7","12","Lehman","NULL","NULL","La Paz","AZ","White-faced Ibis","NULL","01870","White-faced Ibis","Plegadis","chihi",2008-07-12,"Arizona"
"1169","6/22/1999","00:00.0","1999","6","22","Piest","NULL","NULL","Yuma","AZ","Cattle Egret","NULL","02001","Cattle Egret","Bubulcus","ibis",1999-06-22,"Arizona"
"1170","6/22/1999","00:00.0","1999","6","22","Piest","NULL","NULL","Yuma","AZ","Great Blue Heron","NULL","01940","Great Blue Heron","Ardea","herodias",1999-06-22,"Arizona"
"1171","6/22/1999","00:00.0","1999","6","22","Piest","NULL","NULL","Yuma","AZ","Great Egret","NULL","01960","Great Egret","Ardea","alba",1999-06-22,"Arizona"
"1172","6/22/1999","00:00.0","1999","6","22","Piest","NULL","NULL","Yuma","AZ","Snowy Egret","NULL","01970","Snowy Egret","Egretta","thula",1999-06-22,"Arizona"
"1173","6/19/1996","00:00.0","1996","6","19","Piest","NULL","NULL","LaPaz","AZ","Great Egret","NULL","01960","Great Egret","Ardea","alba",1996-06-19,"Arizona"
"1174","6/19/1996","00:00.0","1996","6","19","Piest","NULL","NULL","LaPaz","AZ","Great Egret","NULL","01960","Great Egret","Ardea","alba",1996-06-19,"Arizona"
"1175","6/8/1996","00:00.0","1996","6","8","Piest","NULL","NULL","Yuma","AZ","Great Blue Heron","NULL","01940","Great Blue Heron","Ardea","herodias",1996-06-08,"Arizona"
"1176","4/7/2006","00:00.0","2006","4","7","Corman","NULL","NULL","Maricopa","AZ","Great Blue Heron","NULL","01940","Great Blue Heron","Ardea","herodias",2006-04-07,"Arizona"
"1177","3/22/2007","00:00.0","2007","3","22","Corman","NULL","NULL","Maricopa","AZ","Great Blue Heron","NULL","01940","Great Blue Heron","Ardea","herodias",2007-03-22,"Arizona"
"1178","4/4/2008","00:00.0","2008","4","4","Corman","NULL","NULL","Maricopa","AZ","Great Blue Heron","NULL","01940","Great Blue Heron","Ardea","herodias",2008-04-04,"Arizona"
"1179","3/15/2007","00:00.0","2007","3","15","Driscoll","NULL","NULL","Maricopa","AZ","Great Blue Heron","NULL","01940","Great Blue Heron","Ardea","herodias",2007-03-15,"Arizona"
"1180","4/7/2006","00:00.0","2006","4","7","Corman","NULL","NULL","Maricopa","AZ","Great Blue Heron","NULL","01940","Great Blue Heron","Ardea","herodias",2006-04-07,"Arizona"
"1181","3/22/2007","00:00.0","2007","3","22","Corman","NULL","NULL","Maricopa","AZ","Great Blue Heron","NULL","01940","Great Blue Heron","Ardea","herodias",2007-03-22,"Arizona"
"1182","4/4/2008","00:00.0","2008","4","4","Corman","NULL","NULL","Maricopa","AZ","Great Blue Heron","NULL","01940","Great Blue Heron","Ardea","herodias",2008-04-04,"Arizona"
"1183","2/29/2008","00:00.0","2008","2","29","Paintner/Paintner","NULL","NULL","LaPaz","AZ","Great Blue Heron","NULL","01940","Great Blue Heron","Ardea","herodias",2008-02-29,"Arizona"
"1184","3/12/2008","00:00.0","2008","3","12","Paintner/Paintner","NULL","NULL","La Paz","AZ","Great Blue Heron","NULL","01940","Great Blue Heron","Ardea","herodias",2008-03-12,"Arizona"
"1185","3/24/2008","00:00.0","2008","3","24","Paintner/Paintner","NULL","NULL","La Paz","AZ","Great Blue Heron","NULL","01940","Great Blue Heron","Ardea","herodias",2008-03-24,"Arizona"
"1186","6/9/1996","00:00.0","1996","6","9","Piest","NULL","NULL","Yuma","AZ","Black-crowned Night-Heron","NULL","02020","Black-crowned Night-Heron","Nycticorax","nycticorax",1996-06-09,"Arizona"
"1187","6/12/1997","00:00.0","1997","6","12","Piest","NULL","NULL","Yuma","AZ","Black-crowned Night-Heron","NULL","02020","Black-crowned Night-Heron","Nycticorax","nycticorax",1997-06-12,"Arizona"
"1188","4/8/1996","00:00.0","1996","4","8","Piest","NULL","NULL","Yuma","AZ","Black-crowned Night-Heron","NULL","02020","Black-crowned Night-Heron","Nycticorax","nycticorax",1996-04-08,"Arizona"
"1189","6/9/1996","00:00.0","1996","6","9","Piest","NULL","NULL","Yuma","AZ","Cattle Egret","NULL","02001","Cattle Egret","Bubulcus","ibis",1996-06-09,"Arizona"
"1190","6/12/1997","00:00.0","1997","6","12","Piest","NULL","NULL","Yuma","AZ","Cattle Egret","NULL","02001","Cattle Egret","Bubulcus","ibis",1997-06-12,"Arizona"
"1191","4/8/1996","00:00.0","1996","4","8","Piest","NULL","NULL","Yuma","AZ","Cattle Egret","NULL","02001","Cattle Egret","Bubulcus","ibis",1996-04-08,"Arizona"
"1192","6/9/1996","00:00.0","1996","6","9","Piest","NULL","NULL","Yuma","AZ","Great Egret","NULL","01960","Great Egret","Ardea","alba",1996-06-09,"Arizona"
"1193","6/9/1996","00:00.0","1996","6","9","Piest","NULL","NULL","Yuma","AZ","Snowy Egret","NULL","01970","Snowy Egret","Egretta","thula",1996-06-09,"Arizona"
"1194","6/12/1997","00:00.0","1997","6","12","Piest","NULL","NULL","Yuma","AZ","Snowy Egret","NULL","01970","Snowy Egret","Egretta","thula",1997-06-12,"Arizona"
"1195","4/8/1996","00:00.0","1996","4","8","Piest","NULL","NULL","Yuma","AZ","Snowy Egret","NULL","01970","Snowy Egret","Egretta","thula",1996-04-08,"Arizona"
"1196","4/5/2007","00:00.0","2007","4","5","Maikis/Janssen","NULL","NULL","Yavapai","AZ","Black-crowned Night-Heron","NULL","02020","Black-crowned Night-Heron","Nycticorax","nycticorax",2007-04-05,"Arizona"
"1197","4/5/2007","00:00.0","2007","4","5","Maikis/Janssen","NULL","NULL","Yavapai","AZ","Double-crested Cormorant","NULL","01200","Double-crested Cormorant","Phalacrocorax","auritus",2007-04-05,"Arizona"
"1198","4/2/2008","00:00.0","2008","4","2","Maikis/Janssen","NULL","NULL","Yavapai","AZ","Double-crested Cormorant","NULL","01200","Double-crested Cormorant","Phalacrocorax","auritus",2008-04-02,"Arizona"
"1199","3/17/2008","00:00.0","2008","3","17","Maikis/Janssen","NULL","NULL","Yavapai","AZ","Double-crested Cormorant","NULL","01200","Double-crested Cormorant","Phalacrocorax","auritus",2008-03-17,"Arizona"
"1200","3/17/2008","00:00.0","2008","3","17","Maikis/Janssen","NULL","NULL","Yavapai","AZ","Great Blue Heron","NULL","01940","Great Blue Heron","Ardea","herodias",2008-03-17,"Arizona"
"1201","4/2/2008","00:00.0","2008","4","2","Maikis/Janssen","NULL","NULL","Yavapai","AZ","Great Blue Heron","NULL","01940","Great Blue Heron","Ardea","herodias",2008-04-02,"Arizona"
"1202","4/5/2007","00:00.0","2007","4","5","Janssen","NULL","NULL","Yavapai","AZ","Great Blue Heron","NULL","01940","Great Blue Heron","Ardea","herodias",2007-04-05,"Arizona"
"1203","4/2/2008","00:00.0","2008","4","2","Maikis/Janssen","NULL","NULL","Yavapai","AZ","Great Blue Heron","NULL","01940","Great Blue Heron","Ardea","herodias",2008-04-02,"Arizona"
"1204","3/17/2008","00:00.0","2008","3","17","Maikis/Janssen","NULL","NULL","Yavapai","AZ","Great Blue Heron","NULL","01940","Great Blue Heron","Ardea","herodias",2008-03-17,"Arizona"
"1205","3/25/2008","00:00.0","2008","3","25","Brewster","NULL","NULL","Apache","AZ","Great Blue Heron","NULL","01940","Great Blue Heron","Ardea","herodias",2008-03-25,"Arizona"
"1206","4/14/2008","00:00.0","2008","4","14","Peddie","NULL","NULL","Apache","AZ","Great Blue Heron","NULL","01940","Great Blue Heron","Ardea","herodias",2008-04-14,"Arizona"
"1207","5/28/2008","00:00.0","2008","5","28","White Trifaro/Morris","NULL","NULL","Apache","AZ","Great Blue Heron","NULL","01940","Great Blue Heron","Ardea","herodias",2008-05-28,"Arizona"
"1208","5/20/2008","00:00.0","2008","5","20","Brewster","NULL","NULL","Apache","AZ","Double-crested Cormorant","NULL","01200","Double-crested Cormorant","Phalacrocorax","auritus",2008-05-20,"Arizona"
"1209","4/8/1996","00:00.0","1996","4","8","Piest","NULL","NULL","Yuma","AZ","Great Blue Heron","NULL","01940","Great Blue Heron","Ardea","herodias",1996-04-08,"Arizona"
"1210","4/7/1997","00:00.0","1997","4","7","Piest","NULL","NULL","Yuma","AZ","Great Blue Heron","NULL","01940","Great Blue Heron","Ardea","herodias",1997-04-07,"Arizona"
"1211","6/9/2000","00:00.0","2000","6","9","Piest","NULL","NULL","Yuma","AZ","Great Blue Heron","NULL","01940","Great Blue Heron","Ardea","herodias",2000-06-09,"Arizona"
"1212","6/15/1996","00:00.0","1996","6","15","Piest","NULL","NULL","Yuma","AZ","Great Blue Heron","NULL","01940","Great Blue Heron","Ardea","herodias",1996-06-15,"Arizona"
"1213","4/8/1996","00:00.0","1996","4","8","Piest","NULL","NULL","Yuma","AZ","Great Egret","NULL","01960","Great Egret","Ardea","alba",1996-04-08,"Arizona"
"1214","4/7/1997","00:00.0","1997","4","7","Piest","NULL","NULL","Yuma","AZ","Great Egret","NULL","01960","Great Egret","Ardea","alba",1997-04-07,"Arizona"
"1215","6/9/2000","00:00.0","2000","6","9","Piest","NULL","NULL","Yuma","AZ","Great Egret","NULL","01960","Great Egret","Ardea","alba",2000-06-09,"Arizona"
"1216","6/15/1996","00:00.0","1996","6","15","Piest","NULL","NULL","Yuma","AZ","Great Egret","NULL","01960","Great Egret","Ardea","alba",1996-06-15,"Arizona"
"1217","6/18/1996","00:00.0","1996","6","18","Piest","NULL","NULL","Maricopa","AZ","Cattle Egret","NULL","02001","Cattle Egret","Bubulcus","ibis",1996-06-18,"Arizona"
"1218","6/18/1996","00:00.0","1996","6","18","Piest","NULL","NULL","Maricopa","AZ","Double-crested Cormorant","NULL","01200","Double-crested Cormorant","Phalacrocorax","auritus",1996-06-18,"Arizona"
"1219","6/18/1996","00:00.0","1996","6","18","Piest","NULL","NULL","Maricopa","AZ","Great Blue Heron","NULL","01940","Great Blue Heron","Ardea","herodias",1996-06-18,"Arizona"
"1220","6/18/1996","00:00.0","1996","6","18","Piest","NULL","NULL","Maricopa","AZ","Great Egret","NULL","01960","Great Egret","Ardea","alba",1996-06-18,"Arizona"
"1221","6/14/1996","00:00.0","1996","6","14","Piest","NULL","NULL","Maricopa","AZ","Great Egret","NULL","01960","Great Egret","Ardea","alba",1996-06-14,"Arizona"
"1222","6/14/1996","00:00.0","1996","6","14","Piest","NULL","NULL","Maricopa","AZ","Snowy Egret","NULL","NULL",NA,NA,NA,1996-06-14,"Arizona"
"1223","6/18/1996","00:00.0","1996","6","18","Piest","NULL","NULL","Maricopa","AZ","Snowy Egret","NULL","01970","Snowy Egret","Egretta","thula",1996-06-18,"Arizona"
"1224","7/20/2005","00:00.0","2005","7","20","Piest","NULL","NULL","Maricopa","AZ","White-faced Ibis","NULL","01870","White-faced Ibis","Plegadis","chihi",2005-07-20,"Arizona"
"1225","6/11/1999","00:00.0","1999","6","11","Piest","NULL","NULL","Maricopa","AZ","Cattle Egret","NULL","02001","Cattle Egret","Bubulcus","ibis",1999-06-11,"Arizona"
"1226","6/11/1999","00:00.0","1999","6","11","Piest","NULL","NULL","Maricopa","AZ","Great Egret","NULL","01960","Great Egret","Ardea","alba",1999-06-11,"Arizona"
"1227","6/11/1999","00:00.0","1999","6","11","Piest","NULL","NULL","Maricopa","AZ","Snowy Egret","NULL","01970","Snowy Egret","Egretta","thula",1999-06-11,"Arizona"
"1228","6/1/2008","00:00.0","2008","6","1","Fleming/MacKinnon","NULL","NULL","Santa Cruz","AZ","Great Blue Heron","NULL","01940","Great Blue Heron","Ardea","herodias",2008-06-01,"Arizona"
"1229","4/29/2007","00:00.0","2007","4","29","Corman","NULL","NULL","Graham","AZ","Great Blue Heron","NULL","01940","Great Blue Heron","Ardea","herodias",2007-04-29,"Arizona"
"1230","3/2/2008","00:00.0","2008","3","2","Clark","NULL","NULL","Maricopa","AZ","Great Blue Heron","NULL","01940","Great Blue Heron","Ardea","herodias",2008-03-02,"Arizona"
"1231","3/2/2008","00:00.0","2008","3","2","Clark","NULL","NULL","Maricopa","AZ","Great Blue Heron","NULL","01940","Great Blue Heron","Ardea","herodias",2008-03-02,"Arizona"
"1232","8/6/2008","00:00.0","2008","8","6","Luedeker","NULL","NULL","Coconino","AZ","Great Blue Heron","NULL","01940","Great Blue Heron","Ardea","herodias",2008-08-06,"Arizona"
"1233","4/19/2006","00:00.0","2006","4","19","Corman","NULL","NULL","Apache","AZ","Double-crested Cormorant","NULL","01200","Double-crested Cormorant","Phalacrocorax","auritus",2006-04-19,"Arizona"
"1234","4/19/2006","00:00.0","2006","4","19","Corman","NULL","NULL","Apache","AZ","Great Blue Heron","NULL","01940","Great Blue Heron","Ardea","herodias",2006-04-19,"Arizona"
"1235","5/5/1999","00:00.0","1999","5","5","Piest","NULL","NULL","Yuma","AZ","Great Blue Heron","NULL","01940","Great Blue Heron","Ardea","herodias",1999-05-05,"Arizona"
"1236","5/5/1999","00:00.0","1999","5","5","Piest","NULL","NULL","Yuma","AZ","Great Egret","NULL","01960","Great Egret","Ardea","alba",1999-05-05,"Arizona"
"1237","6/5/1999","00:00.0","1999","6","5","Piest","NULL","NULL","Yuma","AZ","Great Blue Heron","NULL","01940","Great Blue Heron","Ardea","herodias",1999-06-05,"Arizona"
"1238","6/5/1999","00:00.0","1999","6","5","Piest","NULL","NULL","Yuma","AZ","Great Egret","NULL","01960","Great Egret","Ardea","alba",1999-06-05,"Arizona"
"1239","4/13/2006","00:00.0","2006","4","13","Corman","NULL","NULL","Gila","AZ","Double-crested Cormorant","NULL","01200","Double-crested Cormorant","Phalacrocorax","auritus",2006-04-13,"Arizona"
"1240","4/13/2006","00:00.0","2006","4","13","Corman","NULL","NULL","Gila","AZ","Great Blue Heron","NULL","01940","Great Blue Heron","Ardea","herodias",2006-04-13,"Arizona"
"1241","4/17/2007","00:00.0","2007","4","17","Young/Wike","NULL","NULL","Gila","AZ","Great Blue Heron","NULL","01940","Great Blue Heron","Ardea","herodias",2007-04-17,"Arizona"
"1242","4/17/2007","00:00.0","2007","4","17","Young/Wike","NULL","NULL","Gila","AZ","Snowy Egret","NULL","01970","Snowy Egret","Egretta","thula",2007-04-17,"Arizona"
"1243","4/13/2006","00:00.0","2006","4","13","Corman","NULL","NULL","Gila","AZ","Great Blue Heron","NULL","01940","Great Blue Heron","Ardea","herodias",2006-04-13,"Arizona"
"1244","3/2/2008","00:00.0","2008","3","2","Kline","NULL","NULL","Gila","AZ","Double-crested Cormorant","NULL","01200","Double-crested Cormorant","Phalacrocorax","auritus",2008-03-02,"Arizona"
"1245","6/8/1996","00:00.0","1996","6","8","Piest","NULL","NULL","Yuma","AZ","Great Blue Heron","NULL","01940","Great Blue Heron","Ardea","herodias",1996-06-08,"Arizona"
"1246","6/8/1996","00:00.0","1996","6","8","Piest","NULL","NULL","Yuma","AZ","Great Egret","NULL","01960","Great Egret","Ardea","alba",1996-06-08,"Arizona"
"1247","6/8/1996","00:00.0","1996","6","8","Piest","NULL","NULL","Yuma","AZ","Black-crowned Night-Heron","NULL","02020","Black-crowned Night-Heron","Nycticorax","nycticorax",1996-06-08,"Arizona"
"1248","6/8/1996","00:00.0","1996","6","8","Piest","NULL","NULL","Yuma","AZ","Snowy Egret","NULL","01970","Snowy Egret","Egretta","thula",1996-06-08,"Arizona"
"1249","6/12/2008","00:00.0","2008","6","12","Huselton","NULL","NULL","Maricopa","AZ","Great Blue Heron","NULL","01940","Great Blue Heron","Ardea","herodias",2008-06-12,"Arizona"
"1250","3/26/2007","00:00.0","2007","3","26","Jacobsen","NULL","NULL","Yuma","AZ","Great Blue Heron","NULL","01940","Great Blue Heron","Ardea","herodias",2007-03-26,"Arizona"
"1251","5/16/2008","00:00.0","2008","5","16","Cagle","NULL","NULL","Navajo","AZ","Double-crested Cormorant","NULL","01200","Double-crested Cormorant","Phalacrocorax","auritus",2008-05-16,"Arizona"
"1252","4/2/2007","00:00.0","2007","4","2","Jacobsen","NULL","NULL","Yuma","AZ","Great Blue Heron","NULL","01940","Great Blue Heron","Ardea","herodias",2007-04-02,"Arizona"
"1253","5/15/1997","00:00.0","1997","5","15","Piest","NULL","NULL","Yuma","AZ","Great Blue Heron","NULL","01940","Great Blue Heron","Ardea","herodias",1997-05-15,"Arizona"
"1254","6/5/1999","00:00.0","1999","6","5","Piest","NULL","NULL","Yuma","AZ","Great Blue Heron","NULL","01940","Great Blue Heron","Ardea","herodias",1999-06-05,"Arizona"
"1255","5/6/2000","00:00.0","2000","5","6","Piest","NULL","NULL","Yuma","AZ","Great Blue Heron","NULL","01940","Great Blue Heron","Ardea","herodias",2000-05-06,"Arizona"
"1256","6/5/1999","00:00.0","1999","6","5","Piest","NULL","NULL","Yuma","AZ","Great Egret","NULL","01960","Great Egret","Ardea","alba",1999-06-05,"Arizona"
"1257","5/6/2000","00:00.0","2000","5","6","Piest","NULL","NULL","Yuma","AZ","Great Egret","NULL","01960","Great Egret","Ardea","alba",2000-05-06,"Arizona"
"1258","7/9/2007","00:00.0","2007","7","9","DeRosier","NULL","NULL","Coconino","AZ","Great Blue Heron","NULL","01940","Great Blue Heron","Ardea","herodias",2007-07-09,"Arizona"
"1259","4/23/2008","00:00.0","2008","4","23","Divine","NULL","NULL","Coconino","AZ","Great Blue Heron","NULL","01940","Great Blue Heron","Ardea","herodias",2008-04-23,"Arizona"
"1260","4/8/1996","00:00.0","1996","4","8","Piest","NULL","NULL","Yuma","AZ","Great Blue Heron","NULL","01940","Great Blue Heron","Ardea","herodias",1996-04-08,"Arizona"
"1261","5/13/1996","00:00.0","1996","5","13","Piest","NULL","NULL","Yuma","AZ","Great Blue Heron","NULL","01940","Great Blue Heron","Ardea","herodias",1996-05-13,"Arizona"
"1262","4/8/1996","00:00.0","1996","4","8","Piest","NULL","NULL","Yuma","AZ","Great Egret","NULL","01960","Great Egret","Ardea","alba",1996-04-08,"Arizona"
"1263","4/8/1996","00:00.0","1996","4","8","Piest","NULL","NULL","Yuma","AZ","Great Blue Heron","NULL","01940","Great Blue Heron","Ardea","herodias",1996-04-08,"Arizona"
"1264","5/3/1996","00:00.0","1996","5","3","Piest","NULL","NULL","Yuma","AZ","Great Blue Heron","NULL","01940","Great Blue Heron","Ardea","herodias",1996-05-03,"Arizona"
"1265","5/20/1999","00:00.0","1999","5","20","Piest","NULL","NULL","Yuma","AZ","Great Blue Heron","NULL","01940","Great Blue Heron","Ardea","herodias",1999-05-20,"Arizona"
"1266","6/22/1999","00:00.0","1999","6","22","Piest","NULL","NULL","Yuma","AZ","Great Blue Heron","NULL","01940","Great Blue Heron","Ardea","herodias",1999-06-22,"Arizona"
"1267","5/31/2000","00:00.0","2000","5","31","Piest","NULL","NULL","Yuma","AZ","Great Blue Heron","NULL","01940","Great Blue Heron","Ardea","herodias",2000-05-31,"Arizona"
"1268","5/20/1999","00:00.0","1999","5","20","Piest","NULL","NULL","Yuma","AZ","Great Egret","NULL","01960","Great Egret","Ardea","alba",1999-05-20,"Arizona"
"1269","6/22/1999","00:00.0","1999","6","22","Piest","NULL","NULL","Yuma","AZ","Great Egret","NULL","01960","Great Egret","Ardea","alba",1999-06-22,"Arizona"
"1270","5/31/2000","00:00.0","2000","5","31","Piest","NULL","NULL","Yuma","AZ","Great Egret","NULL","01960","Great Egret","Ardea","alba",2000-05-31,"Arizona"
"1271","5/20/1999","00:00.0","1999","5","20","Piest","NULL","NULL","Yuma","AZ","Snowy Egret","NULL","01970","Snowy Egret","Egretta","thula",1999-05-20,"Arizona"
"1272","7/1/2010","00:00.0","2010","7","1","Ehlers/Runco","NULL","NULL","Bingham","ID","Western Grebe","NULL","00010","Western Grebe","Aechmophorus","occidentalis",2010-07-01,"Idaho"
"1273","7/1/2010","00:00.0","2010","7","1","Ehlers/Runco","NULL","NULL","Bingham","ID","Clark's Grebe","NULL","00011","Clark's Grebe","Aechmophorus","clarkii",2010-07-01,"Idaho"
"1274","6/1/2009","00:00.0","2009","6","1","Moulton et al.","NULL","NULL","Bingham","ID","Ring-billed Gull","NULL","00540","Ring-billed Gull","Larus","delawarensis",2009-06-01,"Idaho"
"1275","6/1/2009","00:00.0","2009","6","1","Moulton et al.","NULL","NULL","Bingham","ID","California Gull","NULL","00530","California Gull","Larus","californicus",2009-06-01,"Idaho"
"1276","7/1/2010","00:00.0","2010","7","1","Ehlers/Runco","NULL","NULL","Power","ID","Western Grebe","NULL","00010","Western Grebe","Aechmophorus","occidentalis",2010-07-01,"Idaho"
"1277","6/25/2009","00:00.0","2009","6","25","Wackenhut/Anderson","NULL","NULL","Bannock","ID","Snowy Egret","NULL","01970","Snowy Egret","Egretta","thula",2009-06-25,"Idaho"
"1278","6/25/2009","00:00.0","2009","6","25","Wackenhut/Anderson","NULL","NULL","Bannock","ID","Great Egret","NULL","01960","Great Egret","Ardea","alba",2009-06-25,"Idaho"
"1279","6/25/2009","00:00.0","2009","6","25","Wackenhut/Anderson","NULL","NULL","Bannock","ID","Great Blue Heron","NULL","01940","Great Blue Heron","Ardea","herodias",2009-06-25,"Idaho"
"1280","6/25/2009","00:00.0","2009","6","25","Wackenhut/Anderson","NULL","NULL","Bannock","ID","Double-crested Cormorant","NULL","01200","Double-crested Cormorant","Phalacrocorax","auritus",2009-06-25,"Idaho"
"1281","4/26/2009","00:00.0","2009","4","26","Cavallaro","NULL","NULL","Madison","ID","Great Blue Heron","NULL","01940","Great Blue Heron","Ardea","herodias",2009-04-26,"Idaho"
"1282","5/8/2009","00:00.0","2009","5","8","Wackenhut/Anderson","NULL","NULL","Bear Lake","ID","Great Blue Heron","NULL","01940","Great Blue Heron","Ardea","herodias",2009-05-08,"Idaho"
"1283","6/9/2010","00:00.0","2010","6","9","Moulton et al.","NULL","NULL","Bear Lake","ID","White-faced Ibis","NULL","01870","White-faced Ibis","Plegadis","chihi",2010-06-09,"Idaho"
"1284","6/9/2010","00:00.0","2010","6","9","Moulton et al.","NULL","NULL","Bear Lake","ID","Franklin's Gull","NULL","00590","Franklin's Gull","Larus","pipixcan",2010-06-09,"Idaho"
"1285","6/1/2009","00:00.0","2009","6","1","Moulton et al.","NULL","NULL","Bear Lake","ID","Ring-billed Gull","NULL","00540","Ring-billed Gull","Larus","delawarensis",2009-06-01,"Idaho"
"1286","6/1/2009","00:00.0","2009","6","1","Moulton et al.","NULL","NULL","Bear Lake","ID","Double-crested Cormorant","NULL","01200","Double-crested Cormorant","Phalacrocorax","auritus",2009-06-01,"Idaho"
"1287","6/1/2009","00:00.0","2009","6","1","Moulton et al.","NULL","NULL","Bear Lake","ID","California Gull","NULL","00530","California Gull","Larus","californicus",2009-06-01,"Idaho"
"1288","5/17/2009","00:00.0","2009","5","17","Swift","NULL","NULL","Benewah","ID","Great Blue Heron","NULL","01940","Great Blue Heron","Ardea","herodias",2009-05-17,"Idaho"
"1289","6/2/2009","00:00.0","2009","6","2","Moulton et al.","NULL","NULL","Caribou","ID","Snowy Egret","NULL","01970","Snowy Egret","Egretta","thula",2009-06-02,"Idaho"
"1290","6/2/2009","00:00.0","2009","6","2","Moulton et al.","NULL","NULL","Caribou","ID","Ring-billed Gull","NULL","00540","Ring-billed Gull","Larus","delawarensis",2009-06-02,"Idaho"
"1291","6/2/2009","00:00.0","2009","6","2","Moulton et al.","NULL","NULL","Caribou","ID","Great Blue Heron","NULL","01940","Great Blue Heron","Ardea","herodias",2009-06-02,"Idaho"
"1292","6/2/2009","00:00.0","2009","6","2","Moulton et al.","NULL","NULL","Caribou","ID","Double-crested Cormorant","NULL","01200","Double-crested Cormorant","Phalacrocorax","auritus",2009-06-02,"Idaho"
"1293","6/2/2009","00:00.0","2009","6","2","Moulton et al.","NULL","NULL","Caribou","ID","Caspian Tern","NULL","00640","Caspian Tern","Hydroprogne","caspia",2009-06-02,"Idaho"
"1294","6/2/2009","00:00.0","2009","6","2","Moulton et al.","NULL","NULL","Caribou","ID","California Gull","NULL","00530","California Gull","Larus","californicus",2009-06-02,"Idaho"
"1295","6/2/2009","00:00.0","2009","6","2","Moulton et al.","NULL","NULL","Caribou","ID","American White Pelican","NULL","01250","American White Pelican","Pelecanus","erythrorhynchos",2009-06-02,"Idaho"
"1296","6/3/2010","00:00.0","2010","6","3","Wackenhut/Boudreau","NULL","NULL","Caribou","ID","Double-crested Cormorant","NULL","01200","Double-crested Cormorant","Phalacrocorax","auritus",2010-06-03,"Idaho"
"1297","6/3/2010","00:00.0","2010","6","3","Wackenhut/Boudreau","NULL","NULL","Caribou","ID","American White Pelican","NULL","01250","American White Pelican","Pelecanus","erythrorhynchos",2010-06-03,"Idaho"
"1298","6/1/2011","00:00.0","2011","6","1","Wackenhut","NULL","NULL","Caribou","ID","Double-crested Cormorant","NULL","01200","Double-crested Cormorant","Phalacrocorax","auritus",2011-06-01,"Idaho"
"1299","6/1/2011","00:00.0","2011","6","1","Wackenhut","NULL","NULL","Caribou","ID","American White Pelican","NULL","01250","American White Pelican","Pelecanus","erythrorhynchos",2011-06-01,"Idaho"
"1300","6/2/2009","00:00.0","2009","6","2","Wackenhut et al.","NULL","NULL","Caribou","ID","Snowy Egret","NULL","01970","Snowy Egret","Egretta","thula",2009-06-02,"Idaho"
"1301","6/2/2009","00:00.0","2009","6","2","Wackenhut et al.","NULL","NULL","Caribou","ID","American White Pelican","NULL","01250","American White Pelican","Pelecanus","erythrorhynchos",2009-06-02,"Idaho"
"1302","6/3/2010","00:00.0","2010","6","3","Moulton et al.","NULL","NULL","Caribou","ID","American White Pelican","NULL","01250","American White Pelican","Pelecanus","erythrorhynchos",2010-06-03,"Idaho"
"1303","6/1/2011","00:00.0","2011","6","1","Wackenhut","NULL","NULL","Caribou","ID","American White Pelican","NULL","01250","American White Pelican","Pelecanus","erythrorhynchos",2011-06-01,"Idaho"
"1304","4/7/2009","00:00.0","2009","4","7","McCarthy/Malhas","NULL","NULL","Canyon","ID","Great Blue Heron","NULL","01940","Great Blue Heron","Ardea","herodias",2009-04-07,"Idaho"
"1305","4/7/2009","00:00.0","2009","4","7","McCarthy/Malhas","NULL","NULL","Canyon","ID","Great Blue Heron","NULL","01940","Great Blue Heron","Ardea","herodias",2009-04-07,"Idaho"
"1306","4/7/2009","00:00.0","2009","4","7","McCarthy/Malhas","NULL","NULL","Canyon","ID","Double-crested Cormorant","NULL","01200","Double-crested Cormorant","Phalacrocorax","auritus",2009-04-07,"Idaho"
"1307","4/7/2009","00:00.0","2009","4","7","McCarthy/Malhas","NULL","NULL","Canyon","ID","Great Blue Heron","NULL","01940","Great Blue Heron","Ardea","herodias",2009-04-07,"Idaho"
"1308","4/7/2009","00:00.0","2009","4","7","McCarthy/Malhas","NULL","NULL","Canyon","ID","Great Blue Heron","NULL","01940","Great Blue Heron","Ardea","herodias",2009-04-07,"Idaho"
"1309","4/7/2009","00:00.0","2009","4","7","McCarthy/Malhas","NULL","NULL","Canyon","ID","Great Blue Heron","NULL","01940","Great Blue Heron","Ardea","herodias",2009-04-07,"Idaho"
"1310","4/7/2009","00:00.0","2009","4","7","McCarthy/Malhas","NULL","NULL","Canyon","ID","Double-crested Cormorant","NULL","01200","Double-crested Cormorant","Phalacrocorax","auritus",2009-04-07,"Idaho"
"1311","4/23/2009","00:00.0","2009","4","23","Moulton","NULL","NULL","Ada","ID","Great Blue Heron","NULL","01940","Great Blue Heron","Ardea","herodias",2009-04-23,"Idaho"
"1312","7/13/2010","00:00.0","2010","7","13","Ehlers/Runco","NULL","NULL","Owyhee","ID","Western Grebe","NULL","00010","Western Grebe","Aechmophorus","occidentalis",2010-07-13,"Idaho"
"1313","7/13/2010","00:00.0","2010","7","13","Ehlers/Runco","NULL","NULL","Owyhee","ID","Clark's Grebe","NULL","00011","Clark's Grebe","Aechmophorus","clarkii",2010-07-13,"Idaho"
"1314","6/21/2010","00:00.0","2010","6","21","Moulton","NULL","NULL","Elmore","ID","Great Blue Heron","NULL","01940","Great Blue Heron","Ardea","herodias",2010-06-21,"Idaho"
"1315","6/21/2010","00:00.0","2010","6","21","Moulton","NULL","NULL","Elmore","ID","Great Blue Heron","NULL","01940","Great Blue Heron","Ardea","herodias",2010-06-21,"Idaho"
"1316","5/13/2009","00:00.0","2009","5","13","Cavallaro","NULL","NULL","Fremont","ID","Great Blue Heron","NULL","01940","Great Blue Heron","Ardea","herodias",2009-05-13,"Idaho"
"189","NULL","","NULL","NULL","NULL","Teske","NULL","NULL","Elko","NV","NULL","SurveyDate:1983-? ; Multiple specie: Great Egret, Snowy Egret, Cattle Egret, and Black-crowned Night Heron","NULL",NA,NA,NA,NA,"Nevada"
"190","NULL","","NULL","NULL","NULL","Rawlings","NULL","NULL","Elko","NV","White-faced Ibis","SurveyDate:1983-?","01870","White-faced Ibis","Plegadis","chihi",NA,"Nevada"
"191","NULL","","1997","NULL","NULL","Bradley","NULL","NULL","Humboldt","NV","NULL","Great Egret, Snowy Egret, and Cattle Egret","NULL",NA,NA,NA,NA,"Nevada"
"192","NULL","","2005","NULL","NULL","Bradley","NULL","NULL","Elko","NV","Double-crested Cormorant","NULL","01200","Double-crested Cormorant","Phalacrocorax","auritus",NA,"Nevada"
"193","NULL","","NULL","NULL","NULL","Bradley","NULL","NULL","Elko","NV","White-faced Ibis","NULL","01870","White-faced Ibis","Plegadis","chihi",NA,"Nevada"
"194","NULL","","NULL","NULL","NULL","Bradley","NULL","NULL","Elko","NV","White-faced Ibis","SurveyDate:2001-6/5/2008","01870","White-faced Ibis","Plegadis","chihi",NA,"Nevada"
"195","NULL","","NULL","NULL","NULL","Bradley","NULL","NULL","Elko","NV","Black-crowned Night-Heron","SurveyDate:2005-?","02020","Black-crowned Night-Heron","Nycticorax","nycticorax",NA,"Nevada"
"196","NULL","","2005","NULL","NULL","Bradley","NULL","NULL","Eureka","NV","White-faced Ibis","SurveyDate:2005-?","01870","White-faced Ibis","Plegadis","chihi",NA,"Nevada"
"197","NULL","","NULL","NULL","NULL","Bauman","NULL","NULL","NULL","NV","White-faced Ibis","This mapped outside of NV (in Oregon","01870","White-faced Ibis","Plegadis","chihi",NA,"Nevada"
"198","NULL","","2005","NULL","NULL","Bauman","NULL","NULL","Humboldt","NV","Great Blue Heron","SurveyDate:5/27/2010","01940","Great Blue Heron","Ardea","herodias",NA,"Nevada"
"199","NULL","","2005","NULL","NULL","Bauman","NULL","NULL","Humboldt","NV","Great Blue Heron","NULL","01940","Great Blue Heron","Ardea","herodias",NA,"Nevada"
"200","NULL","","2005","NULL","NULL","Bauman","NULL","NULL","Lander","NV","Black-crowned Night-Heron","NULL","02020","Black-crowned Night-Heron","Nycticorax","nycticorax",NA,"Nevada"
"201","NULL","","NULL","NULL","NULL","Ruby","NULL","NULL","Elko","NV","White-faced Ibis","SurveyDate:1979-?","01870","White-faced Ibis","Plegadis","chihi",NA,"Nevada"
"202","NULL","","1979","NULL","NULL","Ruby","NULL","NULL","White Pine","NV","White-faced Ibis","NULL","01870","White-faced Ibis","Plegadis","chihi",NA,"Nevada"
"203","NULL","","NULL","NULL","NULL","Rawlings","NULL","NULL","Elko","NV","Great Blue Heron","SurveyDate:1983-?","01940","Great Blue Heron","Ardea","herodias",NA,"Nevada"
"204","NULL","","NULL","NULL","NULL","Rawlings","NULL","NULL","Elko","NV","NULL","SurveyDate:1982-? ; Multiple specie: Great Egret, Snowy Egret, Cattle Egret, and Black-crowned Night Heron","NULL",NA,NA,NA,NA,"Nevada"
"205","NULL","","NULL","NULL","NULL","Bradley","NULL","NULL","Elko","NV","Great Blue Heron","SurveyDate:1983-5/24/2010","01940","Great Blue Heron","Ardea","herodias",NA,"Nevada"
"206","NULL","","NULL","NULL","NULL","Teske","NULL","NULL","Elko","NV","Black-crowned Night-Heron","SurveyDate:1982-?","02020","Black-crowned Night-Heron","Nycticorax","nycticorax",NA,"Nevada"
"207","NULL","","2009","NULL","NULL","Jeffers","NULL","NULL","Churchill","NV","NULL","Mutilple species: Double-crested Cormorant, Great Egret, Great Blue Heron, Snowy Egret, and Cattle Egret","NULL",NA,NA,NA,NA,"Nevada"
"208","NULL","","NULL","NULL","NULL","Bradley","NULL","NULL","Elko","NV","Great Blue Heron","SurveyDate:1977-2009","01940","Great Blue Heron","Ardea","herodias",NA,"Nevada"
"209","NULL","","NULL","NULL","NULL","Bradley","NULL","NULL","Elko","NV","Great Blue Heron","SurveyDate:1983-2009","01940","Great Blue Heron","Ardea","herodias",NA,"Nevada"
"210","NULL","","1983","NULL","NULL","Rawlings","NULL","NULL","White Pine","NV","Great Blue Heron","NULL","01940","Great Blue Heron","Ardea","herodias",NA,"Nevada"
"211","NULL","","1983","NULL","NULL","Rawlings","NULL","NULL","White Pine","NV","Black-crowned Night-Heron","NULL","02020","Black-crowned Night-Heron","Nycticorax","nycticorax",NA,"Nevada"
"212","NULL","","1983","NULL","NULL","Rawlings","NULL","NULL","White Pine","NV","Black-crowned Night-Heron","NULL","02020","Black-crowned Night-Heron","Nycticorax","nycticorax",NA,"Nevada"
"213","NULL","","1990","NULL","NULL","Bradley","NULL","NULL","White Pine","NV","White-faced Ibis","NULL","01870","White-faced Ibis","Plegadis","chihi",NA,"Nevada"
"214","NULL","","NULL","NULL","NULL","Jeffers","NULL","NULL","Churchill","NV","White-faced Ibis","SurveyDate:1980-?","01870","White-faced Ibis","Plegadis","chihi",NA,"Nevada"
"215","NULL","","NULL","NULL","NULL","Boyd","NULL","NULL","Elko","NV","Black Tern","SurveyDate:2001-2009","00770","Black Tern","Chlidonias","niger",NA,"Nevada"
"216","NULL","","1983","NULL","NULL","Teske","NULL","NULL","Eureka","NV","NULL","Multiple specie: Great Egret, Snowy Egret, Cattle Egret, and Black-crowned Night Heron","NULL",NA,NA,NA,NA,"Nevada"
"217","6/29/2010","00:00.0","2010","6","29","Beason","NULL","NULL","Conejos","CO","White-faced Ibis","NULL","01870","White-faced Ibis","Plegadis","chihi",2010-06-29,"Colorado"
"218","5/23/2011","00:00.0","2011","5","23","Rawinski","NULL","NULL","Alamosa","CO","White-faced Ibis","NULL","01870","White-faced Ibis","Plegadis","chihi",2011-05-23,"Colorado"
"219","5/23/2011","00:00.0","2011","5","23","Rawinski","NULL","NULL","Alamosa","CO","Western Grebe","NULL","00010","Western Grebe","Aechmophorus","occidentalis",2011-05-23,"Colorado"
"220","4/23/2009","00:00.0","2009","4","23","Nelson","NULL","NULL","Kiowa","CO","Great Blue Heron","NULL","01940","Great Blue Heron","Ardea","herodias",2009-04-23,"Colorado"
"221","4/5/2010","00:00.0","2010","4","5","Nelson","NULL","NULL","Kiowa","CO","Great Blue Heron","NULL","01940","Great Blue Heron","Ardea","herodias",2010-04-05,"Colorado"
"222","5/17/2011","00:00.0","2011","5","17","Rawinski","NULL","NULL","Alamosa","CO","White-faced Ibis","NULL","01870","White-faced Ibis","Plegadis","chihi",2011-05-17,"Colorado"
"223","7/9/2009","00:00.0","2009","7","9","Wilson","NULL","NULL","Kiowa","CO","White-faced Ibis","NULL","01870","White-faced Ibis","Plegadis","chihi",2009-07-09,"Colorado"
"224","6/21/2010","00:00.0","2010","6","21","Hundertmark","NULL","NULL","Park","CO","American White Pelican","NULL","01250","American White Pelican","Pelecanus","erythrorhynchos",2010-06-21,"Colorado"
"225","6/21/2010","00:00.0","2010","6","21","Hundertmark","NULL","NULL","Park","CO","Double-crested Cormorant","NULL","01200","Double-crested Cormorant","Phalacrocorax","auritus",2010-06-21,"Colorado"
"226","8/1/2009","00:00.0","2009","8","1","Hundertmark","NULL","NULL","Jackson","CO","Black-crowned Night-Heron","NULL","02020","Black-crowned Night-Heron","Nycticorax","nycticorax",2009-08-01,"Colorado"
"227","6/12/2010","00:00.0","2010","6","12","Hundertmark","NULL","NULL","Jackson","CO","Eared Grebe","NULL","00040","Eared Grebe","Podiceps","nigricollis",2010-06-12,"Colorado"
"228","8/7/2010","00:00.0","2010","8","7","Hundertmark","NULL","NULL","Jackson","CO","Black-crowned Night-Heron","NULL","02020","Black-crowned Night-Heron","Nycticorax","nycticorax",2010-08-07,"Colorado"
"229","NULL","","2010","NULL","NULL","Johnson","NULL","NULL","Jackson","CO","Eared Grebe","NULL","00040","Eared Grebe","Podiceps","nigricollis",NA,"Colorado"
"230","7/15/2009","00:00.0","2009","7","15","Johnson","NULL","NULL","Jackson","CO","Eared Grebe","NULL","00040","Eared Grebe","Podiceps","nigricollis",2009-07-15,"Colorado"
"231","7/15/2009","00:00.0","2009","7","15","Johnson","NULL","NULL","Jackson","CO","Eared Grebe","NULL","00040","Eared Grebe","Podiceps","nigricollis",2009-07-15,"Colorado"
"232","NULL","","2010","NULL","NULL","Johnson","NULL","NULL","Jackson","CO","Black-crowned Night-Heron","NULL","02020","Black-crowned Night-Heron","Nycticorax","nycticorax",NA,"Colorado"
"233","7/13/2009","00:00.0","2009","7","13","Johnson","NULL","NULL","Jackson","CO","Black-crowned Night-Heron","NULL","02020","Black-crowned Night-Heron","Nycticorax","nycticorax",2009-07-13,"Colorado"
"234","7/15/2009","00:00.0","2009","7","15","Johnson","NULL","NULL","Jackson","CO","Eared Grebe","NULL","00040","Eared Grebe","Podiceps","nigricollis",2009-07-15,"Colorado"
"235","NULL","","2010","NULL","NULL","Johnson","NULL","NULL","Jackson","CO","Black-crowned Night-Heron","NULL","02020","Black-crowned Night-Heron","Nycticorax","nycticorax",NA,"Colorado"
"236","7/13/2009","00:00.0","2009","7","13","Johnson","NULL","NULL","Jackson","CO","Black-crowned Night-Heron","NULL","02020","Black-crowned Night-Heron","Nycticorax","nycticorax",2009-07-13,"Colorado"
"237","4/25/2009","00:00.0","2009","4","25","Gamble","NULL","NULL","Adams","CO","Double-crested Cormorant","NULL","01200","Double-crested Cormorant","Phalacrocorax","auritus",2009-04-25,"Colorado"
"238","4/25/2009","00:00.0","2009","4","25","Gamble","NULL","NULL","Adams","CO","Great Blue Heron","NULL","01940","Great Blue Heron","Ardea","herodias",2009-04-25,"Colorado"
"239","4/25/2009","00:00.0","2009","4","25","Gamble","NULL","NULL","Adams","CO","Black-crowned Night-Heron","NULL","02020","Black-crowned Night-Heron","Nycticorax","nycticorax",2009-04-25,"Colorado"
"240","4/8/2010","00:00.0","2010","4","8","Gamble","NULL","NULL","Adams","CO","Double-crested Cormorant","NULL","01200","Double-crested Cormorant","Phalacrocorax","auritus",2010-04-08,"Colorado"
"241","4/8/2010","00:00.0","2010","4","8","Gamble","NULL","NULL","Adams","CO","Great Blue Heron","NULL","01940","Great Blue Heron","Ardea","herodias",2010-04-08,"Colorado"
"242","7/30/2010","00:00.0","2010","7","30","Hatch/Hatch","NULL","NULL","Adams","CO","Snowy Egret","NULL","01970","Snowy Egret","Egretta","thula",2010-07-30,"Colorado"
"243","9/6/2009","00:00.0","2009","9","6","Beltz","NULL","NULL","Adams","CO","Western Grebe","NULL","00010","Western Grebe","Aechmophorus","occidentalis",2009-09-06,"Colorado"
"244","4/27/2010","00:00.0","2010","4","27","Takamine","NULL","NULL","Weld","CO","Great Blue Heron","NULL","01940","Great Blue Heron","Ardea","herodias",2010-04-27,"Colorado"
"245","7/9/2010","00:00.0","2010","7","9","Goff","NULL","NULL","El Paso","CO","Western Grebe","NULL","00010","Western Grebe","Aechmophorus","occidentalis",2010-07-09,"Colorado"
"246","6/9/2011","00:00.0","2011","6","9","Rawinski","NULL","NULL","Conejos","CO","Eared Grebe","NULL","00040","Eared Grebe","Podiceps","nigricollis",2011-06-09,"Colorado"
"247","4/24/2009","00:00.0","2009","4","24","Kogler","NULL","NULL","Larimer","CO","Great Blue Heron","NULL","01940","Great Blue Heron","Ardea","herodias",2009-04-24,"Colorado"
"248","3/28/2010","00:00.0","2010","3","28","Huwer","NULL","NULL","Larimer","CO","Great Blue Heron","NULL","01940","Great Blue Heron","Ardea","herodias",2010-03-28,"Colorado"
"249","4/18/2009","00:00.0","2009","4","18","Pals","NULL","NULL","El Paso","CO","Great Blue Heron","NULL","01940","Great Blue Heron","Ardea","herodias",2009-04-18,"Colorado"
"250","5/18/2010","00:00.0","2010","5","18","Pals","NULL","NULL","El Paso","CO","Great Blue Heron","NULL","01940","Great Blue Heron","Ardea","herodias",2010-05-18,"Colorado"
"251","5/19/2011","00:00.0","2011","5","19","Rawinski","NULL","NULL","Alamosa","CO","White-faced Ibis","NULL","01870","White-faced Ibis","Plegadis","chihi",2011-05-19,"Colorado"
"252","6/5/2011","00:00.0","2011","6","5","Rawinski","NULL","NULL","Alamosa","CO","White-faced Ibis","NULL","01870","White-faced Ibis","Plegadis","chihi",2011-06-05,"Colorado"
"253","6/5/2011","00:00.0","2011","6","5","Rawinski","NULL","NULL","Alamosa","CO","Black-crowned Night-Heron","NULL","02020","Black-crowned Night-Heron","Nycticorax","nycticorax",2011-06-05,"Colorado"
"254","NULL","","2010","NULL","NULL","Cowardin","NULL","NULL","Summit","CO","Great Blue Heron","NULL","01940","Great Blue Heron","Ardea","herodias",NA,"Colorado"
"255","4/24/2009","00:00.0","2009","4","24","Kogler","NULL","NULL","Larimer","CO","Great Blue Heron","NULL","01940","Great Blue Heron","Ardea","herodias",2009-04-24,"Colorado"
"256","4/21/2010","00:00.0","2010","4","21","Huwer","NULL","NULL","Larimer","CO","Great Blue Heron","NULL","01940","Great Blue Heron","Ardea","herodias",2010-04-21,"Colorado"
"257","7/19/2009","00:00.0","2009","7","19","Sanders","NULL","NULL","Yuma","CO","Black Tern","NULL","00770","Black Tern","Chlidonias","niger",2009-07-19,"Colorado"
"258","4/26/2010","00:00.0","2010","4","26","George","NULL","NULL","Boulder","CO","Great Blue Heron","NULL","01940","Great Blue Heron","Ardea","herodias",2010-04-26,"Colorado"
"259","4/26/2010","00:00.0","2010","4","26","George","NULL","NULL","Boulder","CO","Great Blue Heron","NULL","01940","Great Blue Heron","Ardea","herodias",2010-04-26,"Colorado"
"260","4/24/2009","00:00.0","2009","4","24","George","NULL","NULL","Weld","CO","Great Blue Heron","NULL","01940","Great Blue Heron","Ardea","herodias",2009-04-24,"Colorado"
"261","4/26/2010","00:00.0","2010","4","26","George","NULL","NULL","Weld","CO","Great Blue Heron","NULL","01940","Great Blue Heron","Ardea","herodias",2010-04-26,"Colorado"
"262","5/21/2009","00:00.0","2009","5","21","Beason","NULL","NULL","Delta","CO","Great Blue Heron","NULL","01940","Great Blue Heron","Ardea","herodias",2009-05-21,"Colorado"
"263","4/5/2010","00:00.0","2010","4","5","Riggle","NULL","NULL","Eagle","CO","Great Blue Heron","NULL","01940","Great Blue Heron","Ardea","herodias",2010-04-05,"Colorado"
"264","6/9/2009","00:00.0","2009","6","9","Moore","NULL","NULL","Fremont","CO","White-faced Ibis","NULL","01870","White-faced Ibis","Plegadis","chihi",2009-06-09,"Colorado"
"265","5/1/2009","00:00.0","2009","5","1","Potter","NULL","NULL","Eagle","CO","Great Blue Heron","NULL","01940","Great Blue Heron","Ardea","herodias",2009-05-01,"Colorado"
"266","NULL","","2010","NULL","NULL","McGilvray","NULL","NULL","Douglas","CO","Great Blue Heron","NULL","01940","Great Blue Heron","Ardea","herodias",NA,"Colorado"
"267","5/13/2009","00:00.0","2009","5","13","McGilvray","NULL","NULL","Douglas","CO","Great Blue Heron","NULL","01940","Great Blue Heron","Ardea","herodias",2009-05-13,"Colorado"
"268","6/17/2009","00:00.0","2009","6","17","Beason","NULL","NULL","Mesa","CO","Eared Grebe","NULL","00040","Eared Grebe","Podiceps","nigricollis",2009-06-17,"Colorado"
"269","6/17/2009","00:00.0","2009","6","17","Beason","NULL","NULL","Mesa","CO","Eared Grebe","NULL","00040","Eared Grebe","Podiceps","nigricollis",2009-06-17,"Colorado"
"270","7/9/2010","00:00.0","2010","7","9","Beason","NULL","NULL","Mesa","CO","White-faced Ibis","NULL","01870","White-faced Ibis","Plegadis","chihi",2010-07-09,"Colorado"
"271","7/23/2009","00:00.0","2009","7","23","Beltz","NULL","NULL","Arapahoe","CO","White-faced Ibis","NULL","01870","White-faced Ibis","Plegadis","chihi",2009-07-23,"Colorado"
"272","7/20/2010","00:00.0","2010","7","20","Beltz/eBird","NULL","NULL","Arapahoe","CO","White-faced Ibis","NULL","01870","White-faced Ibis","Plegadis","chihi",2010-07-20,"Colorado"
"273","4/11/2009","00:00.0","2009","4","11","Owen","NULL","NULL","Montrose","CO","Great Blue Heron","NULL","01940","Great Blue Heron","Ardea","herodias",2009-04-11,"Colorado"
"274","8/31/2009","00:00.0","2009","8","31","Ecton","NULL","NULL","Larimer","CO","Black-crowned Night-Heron","NULL","02020","Black-crowned Night-Heron","Nycticorax","nycticorax",2009-08-31,"Colorado"
"275","8/18/2010","00:00.0","2010","8","18","Ecton","NULL","NULL","Larimer","CO","Black-crowned Night-Heron","NULL","02020","Black-crowned Night-Heron","Nycticorax","nycticorax",2010-08-18,"Colorado"
"276","NULL","","2010","NULL","NULL","Cooper","NULL","NULL","Mesa","CO","Great Blue Heron","NULL","01940","Great Blue Heron","Ardea","herodias",NA,"Colorado"
"277","5/9/2009","00:00.0","2009","5","9","Cooper","NULL","NULL","Mesa","CO","Great Blue Heron","NULL","01940","Great Blue Heron","Ardea","herodias",2009-05-09,"Colorado"
"278","4/22/2009","00:00.0","2009","4","22","Nelson","NULL","NULL","Kiowa","CO","Great Blue Heron","NULL","01940","Great Blue Heron","Ardea","herodias",2009-04-22,"Colorado"
"279","4/6/2010","00:00.0","2010","4","6","Nelson","NULL","NULL","Kiowa","CO","Great Blue Heron","NULL","01940","Great Blue Heron","Ardea","herodias",2010-04-06,"Colorado"
"280","4/24/2009","00:00.0","2009","4","24","Beason","NULL","NULL","Delta","CO","Double-crested Cormorant","NULL","01200","Double-crested Cormorant","Phalacrocorax","auritus",2009-04-24,"Colorado"
"281","7/9/2010","00:00.0","2010","7","9","Beason","NULL","NULL","Delta","CO","Double-crested Cormorant","NULL","01200","Double-crested Cormorant","Phalacrocorax","auritus",2010-07-09,"Colorado"
"282","5/23/2011","00:00.0","2011","5","23","Rawinski","NULL","NULL","Alamosa","CO","White-faced Ibis","NULL","01870","White-faced Ibis","Plegadis","chihi",2011-05-23,"Colorado"
"283","6/1/2009","00:00.0","2009","6","1","Figueroa","NULL","NULL","Morgan","CO","Great Blue Heron","NULL","01940","Great Blue Heron","Ardea","herodias",2009-06-01,"Colorado"
"284","5/17/2009","00:00.0","2009","5","17","Hundertmark","NULL","NULL","Jackson","CO","Western Grebe","NULL","00010","Western Grebe","Aechmophorus","occidentalis",2009-05-17,"Colorado"
"285","6/15/2009","00:00.0","2009","6","15","Hundertmark","NULL","NULL","Jackson","CO","Eared Grebe","NULL","00040","Eared Grebe","Podiceps","nigricollis",2009-06-15,"Colorado"
"286","5/10/2010","00:00.0","2010","5","10","Hilkey","NULL","NULL","Rio Blanco","CO","Great Blue Heron","NULL","01940","Great Blue Heron","Ardea","herodias",2010-05-10,"Colorado"
"287","5/26/2009","00:00.0","2009","5","26","Luke","NULL","NULL","Moffat","CO","Great Blue Heron","NULL","01940","Great Blue Heron","Ardea","herodias",2009-05-26,"Colorado"
"288","6/10/2009","00:00.0","2009","6","10","Beason","NULL","NULL","Delta","CO","Western Grebe","NULL","00010","Western Grebe","Aechmophorus","occidentalis",2009-06-10,"Colorado"
"289","6/24/2010","00:00.0","2010","6","24","Beason","NULL","NULL","Delta","CO","Western Grebe","NULL","00010","Western Grebe","Aechmophorus","occidentalis",2010-06-24,"Colorado"
"290","6/21/2009","00:00.0","2009","6","21","Beason","NULL","NULL","Gunnison","CO","Great Blue Heron","NULL","01940","Great Blue Heron","Ardea","herodias",2009-06-21,"Colorado"
"291","6/4/2010","00:00.0","2010","6","4","Fisher","NULL","NULL","Gunnison","CO","Great Blue Heron","NULL","01940","Great Blue Heron","Ardea","herodias",2010-06-04,"Colorado"
"292","5/16/2009","00:00.0","2009","5","16","Hundertmark","NULL","NULL","Jackson","CO","Eared Grebe","NULL","00040","Eared Grebe","Podiceps","nigricollis",2009-05-16,"Colorado"
"293","6/13/2010","00:00.0","2010","6","13","Hundertmark","NULL","NULL","Jackson","CO","Forster's Tern","NULL","00690","Forster's Tern","Sterna","forsteri",2010-06-13,"Colorado"
"294","8/1/2009","00:00.0","2009","8","1","Hundertmark","NULL","NULL","Jackson","CO","Western Grebe","NULL","00010","Western Grebe","Aechmophorus","occidentalis",2009-08-01,"Colorado"
"295","6/13/2010","00:00.0","2010","6","13","Hundertmark","NULL","NULL","Jackson","CO","Western Grebe","NULL","00010","Western Grebe","Aechmophorus","occidentalis",2010-06-13,"Colorado"
"296","5/12/2009","00:00.0","2009","5","12","Parks","NULL","NULL","Denver","CO","Double-crested Cormorant","NULL","01200","Double-crested Cormorant","Phalacrocorax","auritus",2009-05-12,"Colorado"
"297","5/12/2009","00:00.0","2009","5","12","Parks","NULL","NULL","Denver","CO","Black-crowned Night-Heron","NULL","02020","Black-crowned Night-Heron","Nycticorax","nycticorax",2009-05-12,"Colorado"
"298","5/12/2009","00:00.0","2009","5","12","Parks","NULL","NULL","Denver","CO","Snowy Egret","NULL","01970","Snowy Egret","Egretta","thula",2009-05-12,"Colorado"
"299","5/15/2009","00:00.0","2009","5","15","Parks","NULL","NULL","Denver","CO","Black-crowned Night-Heron","NULL","02020","Black-crowned Night-Heron","Nycticorax","nycticorax",2009-05-15,"Colorado"
"300","5/15/2009","00:00.0","2009","5","15","Parks","NULL","NULL","Denver","CO","Snowy Egret","NULL","01970","Snowy Egret","Egretta","thula",2009-05-15,"Colorado"
"301","5/15/2009","00:00.0","2009","5","15","Parks","NULL","NULL","Denver","CO","Double-crested Cormorant","NULL","01200","Double-crested Cormorant","Phalacrocorax","auritus",2009-05-15,"Colorado"
"302","5/27/2009","00:00.0","2009","5","27","Bond","NULL","NULL","La Plata","CO","Great Blue Heron","NULL","01940","Great Blue Heron","Ardea","herodias",2009-05-27,"Colorado"
"303","6/23/2010","00:00.0","2010","6","23","Bond","NULL","NULL","La Plata","CO","Great Blue Heron","NULL","01940","Great Blue Heron","Ardea","herodias",2010-06-23,"Colorado"
"304","4/19/2009","00:00.0","2009","4","19","Zeman","NULL","NULL","Delta","CO","Great Blue Heron","NULL","01940","Great Blue Heron","Ardea","herodias",2009-04-19,"Colorado"
"305","6/21/2010","00:00.0","2010","6","21","Hundertmark","NULL","NULL","Park","CO","California Gull","NULL","00530","California Gull","Larus","californicus",2010-06-21,"Colorado"
"306","6/21/2010","00:00.0","2010","6","21","Hundertmark","NULL","NULL","Park","CO","Double-crested Cormorant","NULL","01200","Double-crested Cormorant","Phalacrocorax","auritus",2010-06-21,"Colorado"
"307","5/18/2010","00:00.0","2010","5","18","Hughes","NULL","NULL","Routt","CO","Great Blue Heron","NULL","01940","Great Blue Heron","Ardea","herodias",2010-05-18,"Colorado"
"308","5/9/2009","00:00.0","2009","5","9","Ecton","NULL","NULL","Larimer","CO","Great Blue Heron","NULL","01940","Great Blue Heron","Ardea","herodias",2009-05-09,"Colorado"
"309","NULL","","2009","NULL","NULL","Mitchell","NULL","NULL","El Paso","CO","Great Blue Heron","NULL","01940","Great Blue Heron","Ardea","herodias",NA,"Colorado"
"310","4/18/2009","00:00.0","2009","4","18","Pals","NULL","NULL","El Paso","CO","Great Blue Heron","NULL","01940","Great Blue Heron","Ardea","herodias",2009-04-18,"Colorado"
"311","5/18/2010","00:00.0","2010","5","18","Pals","NULL","NULL","El Paso","CO","Great Blue Heron","NULL","01940","Great Blue Heron","Ardea","herodias",2010-05-18,"Colorado"
"312","NULL","","2010","NULL","NULL","Beason","NULL","NULL","Delta","CO","White-faced Ibis","NULL","01870","White-faced Ibis","Plegadis","chihi",NA,"Colorado"
"313","5/1/2009","00:00.0","2009","5","1","Garrison","NULL","NULL","Delta","CO","Double-crested Cormorant","NULL","01200","Double-crested Cormorant","Phalacrocorax","auritus",2009-05-01,"Colorado"
"314","5/1/2009","00:00.0","2009","5","1","Garrison","NULL","NULL","Delta","CO","Great Blue Heron","NULL","01940","Great Blue Heron","Ardea","herodias",2009-05-01,"Colorado"
"315","6/11/2009","00:00.0","2009","6","11","Beason","NULL","NULL","Delta","CO","Western Grebe","NULL","00010","Western Grebe","Aechmophorus","occidentalis",2009-06-11,"Colorado"
"316","6/11/2009","00:00.0","2009","6","11","Beason","NULL","NULL","Delta","CO","White-faced Ibis","NULL","01870","White-faced Ibis","Plegadis","chihi",2009-06-11,"Colorado"
"317","6/11/2009","00:00.0","2009","6","11","Beason","NULL","NULL","Delta","CO","Clark's Grebe","NULL","00011","Clark's Grebe","Aechmophorus","clarkii",2009-06-11,"Colorado"
"318","6/11/2009","00:00.0","2009","6","11","Garrison","NULL","NULL","Delta","CO","Clark's Grebe","NULL","00011","Clark's Grebe","Aechmophorus","clarkii",2009-06-11,"Colorado"
"319","4/24/2010","00:00.0","2010","4","24","Beason","NULL","NULL","Delta","CO","Great Blue Heron","NULL","01940","Great Blue Heron","Ardea","herodias",2010-04-24,"Colorado"
"320","4/24/2010","00:00.0","2010","4","24","Beason","NULL","NULL","Delta","CO","Double-crested Cormorant","NULL","01200","Double-crested Cormorant","Phalacrocorax","auritus",2010-04-24,"Colorado"
"321","6/21/2010","00:00.0","2010","6","21","Beason","NULL","NULL","Delta","CO","Western Grebe","NULL","00010","Western Grebe","Aechmophorus","occidentalis",2010-06-21,"Colorado"
"322","6/21/2010","00:00.0","2010","6","21","Beason","NULL","NULL","Delta","CO","American White Pelican","NULL","01250","American White Pelican","Pelecanus","erythrorhynchos",2010-06-21,"Colorado"
"323","6/21/2010","00:00.0","2010","6","21","Beason","NULL","NULL","Delta","CO","Eared Grebe","NULL","00040","Eared Grebe","Podiceps","nigricollis",2010-06-21,"Colorado"
"324","6/21/2010","00:00.0","2010","6","21","Beason","NULL","NULL","Delta","CO","Clark's Grebe","NULL","00011","Clark's Grebe","Aechmophorus","clarkii",2010-06-21,"Colorado"
"325","NULL","","2009","NULL","NULL","Dexter","NULL","NULL","Mesa","CO","Great Blue Heron","NULL","01940","Great Blue Heron","Ardea","herodias",NA,"Colorado"
"326","5/15/2009","00:00.0","2009","5","15","Beason","NULL","NULL","Dolores","CO","Eared Grebe","NULL","00040","Eared Grebe","Podiceps","nigricollis",2009-05-15,"Colorado"
"327","5/3/2009","00:00.0","2009","5","3","Lefko","NULL","NULL","Weld","CO","Black-crowned Night-Heron","NULL","02020","Black-crowned Night-Heron","Nycticorax","nycticorax",2009-05-03,"Colorado"
"328","5/3/2009","00:00.0","2009","5","3","Lefko","NULL","NULL","Weld","CO","Snowy Egret","NULL","01970","Snowy Egret","Egretta","thula",2009-05-03,"Colorado"
"329","7/27/2009","00:00.0","2009","7","27","Lefko","NULL","NULL","Weld","CO","Cattle Egret","NULL","02001","Cattle Egret","Bubulcus","ibis",2009-07-27,"Colorado"
"330","7/4/2010","00:00.0","2010","7","4","Lefko","NULL","NULL","Weld","CO","Snowy Egret","NULL","01970","Snowy Egret","Egretta","thula",2010-07-04,"Colorado"
"331","7/4/2010","00:00.0","2010","7","4","Lefko","NULL","NULL","Weld","CO","Cattle Egret","NULL","02001","Cattle Egret","Bubulcus","ibis",2010-07-04,"Colorado"
"332","7/4/2010","00:00.0","2010","7","4","Lefko","NULL","NULL","Weld","CO","Black-crowned Night-Heron","NULL","02020","Black-crowned Night-Heron","Nycticorax","nycticorax",2010-07-04,"Colorado"
"333","6/24/2010","00:00.0","2010","6","24","Beason","NULL","NULL","Montrose","CO","Eared Grebe","NULL","00040","Eared Grebe","Podiceps","nigricollis",2010-06-24,"Colorado"
"334","6/4/2010","00:00.0","2010","6","4","Fisher","NULL","NULL","Gunnison","CO","Great Blue Heron","NULL","01940","Great Blue Heron","Ardea","herodias",2010-06-04,"Colorado"
"335","NULL","","2009","NULL","NULL","Everman","NULL","NULL","Eagle","CO","Great Blue Heron","NULL","01940","Great Blue Heron","Ardea","herodias",NA,"Colorado"
"336","6/16/2009","00:00.0","2009","6","16","Hundertmark","NULL","NULL","Jackson","CO","Forster's Tern","NULL","00690","Forster's Tern","Sterna","forsteri",2009-06-16,"Colorado"
"337","8/1/2009","00:00.0","2009","8","1","Hundertmark","NULL","NULL","Jackson","CO","Eared Grebe","NULL","00040","Eared Grebe","Podiceps","nigricollis",2009-08-01,"Colorado"
"338","5/16/2010","00:00.0","2010","5","16","Hundertmark","NULL","NULL","Jackson","CO","Eared Grebe","NULL","00040","Eared Grebe","Podiceps","nigricollis",2010-05-16,"Colorado"
"339","5/16/2010","00:00.0","2010","5","16","Hundertmark","NULL","NULL","Jackson","CO","Western Grebe","NULL","00010","Western Grebe","Aechmophorus","occidentalis",2010-05-16,"Colorado"
"340","NULL","","2010","NULL","NULL","Smith","NULL","NULL","Weld","CO","Western Grebe","NULL","00010","Western Grebe","Aechmophorus","occidentalis",NA,"Colorado"
"341","5/25/2009","00:00.0","2009","5","25","Smith","NULL","NULL","Weld","CO","Western Grebe","NULL","00010","Western Grebe","Aechmophorus","occidentalis",2009-05-25,"Colorado"
"342","5/25/2009","00:00.0","2009","5","25","Smith","NULL","NULL","Weld","CO","Double-crested Cormorant","NULL","01200","Double-crested Cormorant","Phalacrocorax","auritus",2009-05-25,"Colorado"
"343","4/30/2009","00:00.0","2009","4","30","George","NULL","NULL","Boulder","CO","Great Blue Heron","NULL","01940","Great Blue Heron","Ardea","herodias",2009-04-30,"Colorado"
"344","NULL","","2009","NULL","NULL","Cowardin","NULL","NULL","Grand","CO","Western Grebe","NULL","00010","Western Grebe","Aechmophorus","occidentalis",NA,"Colorado"
"345","6/5/2011","00:00.0","2011","6","5","Rawinski","NULL","NULL","Rio Grande","CO","Western Grebe","NULL","00010","Western Grebe","Aechmophorus","occidentalis",2011-06-05,"Colorado"
"346","6/5/2011","00:00.0","2011","6","5","Rawinski","NULL","NULL","Rio Grande","CO","Eared Grebe","NULL","00040","Eared Grebe","Podiceps","nigricollis",2011-06-05,"Colorado"
"347","7/6/2009","00:00.0","2009","7","6","Beason","NULL","NULL","Delta","CO","Great Blue Heron","NULL","01940","Great Blue Heron","Ardea","herodias",2009-07-06,"Colorado"
"348","4/28/2010","00:00.0","2010","4","28","Beason","NULL","NULL","Delta","CO","Great Blue Heron","NULL","01940","Great Blue Heron","Ardea","herodias",2010-04-28,"Colorado"
"349","7/19/2009","00:00.0","2009","7","19","Beason","NULL","NULL","Delta","CO","Great Blue Heron","NULL","01940","Great Blue Heron","Ardea","herodias",2009-07-19,"Colorado"
"350","5/21/2009","00:00.0","2009","5","21","Hilkey","NULL","NULL","Rio Blanco","CO","Great Blue Heron","NULL","01940","Great Blue Heron","Ardea","herodias",2009-05-21,"Colorado"
"351","7/30/2010","00:00.0","2010","7","30","Floyd","NULL","NULL","Boulder","CO","Western Grebe","NULL","00010","Western Grebe","Aechmophorus","occidentalis",2010-07-30,"Colorado"
"352","4/15/2009","00:00.0","2009","4","15","Nelson","NULL","NULL","Bent","CO","Great Blue Heron","NULL","01940","Great Blue Heron","Ardea","herodias",2009-04-15,"Colorado"
"353","4/6/2010","00:00.0","2010","4","6","Nelson","NULL","NULL","Bent","CO","Great Blue Heron","NULL","01940","Great Blue Heron","Ardea","herodias",2010-04-06,"Colorado"
"354","7/25/2009","00:00.0","2009","7","25","Cameron","NULL","NULL","Jefferson","CO","Snowy Egret","NULL","01970","Snowy Egret","Egretta","thula",2009-07-25,"Colorado"
"355","NULL","","2010","NULL","NULL","Crosby","NULL","NULL","Grand","CO","Great Blue Heron","NULL","01940","Great Blue Heron","Ardea","herodias",NA,"Colorado"
"356","5/3/2009","00:00.0","2009","5","3","Crosby","NULL","NULL","Grand","CO","Great Blue Heron","NULL","01940","Great Blue Heron","Ardea","herodias",2009-05-03,"Colorado"
"357","6/9/2011","00:00.0","2011","6","9","Rawinski","NULL","NULL","Conejos","CO","Eared Grebe","NULL","00040","Eared Grebe","Podiceps","nigricollis",2011-06-09,"Colorado"
"358","6/9/2011","00:00.0","2011","6","9","Rawinski","NULL","NULL","Conejos","CO","Western Grebe","NULL","00010","Western Grebe","Aechmophorus","occidentalis",2011-06-09,"Colorado"
"359","5/28/2011","00:00.0","2011","5","28","Rawinski","NULL","NULL","Conejos","CO","White-faced Ibis","NULL","01870","White-faced Ibis","Plegadis","chihi",2011-05-28,"Colorado"
"360","7/15/2009","00:00.0","2009","7","15","McCormick","NULL","NULL","Grand","CO","Great Blue Heron","NULL","01940","Great Blue Heron","Ardea","herodias",2009-07-15,"Colorado"
"361","5/28/2010","00:00.0","2010","5","28","McCormick","NULL","NULL","Grand","CO","Great Blue Heron","NULL","01940","Great Blue Heron","Ardea","herodias",2010-05-28,"Colorado"
"362","6/14/2009","00:00.0","2009","6","14","Hundertmark","NULL","NULL","Jackson","CO","Forster's Tern","NULL","00690","Forster's Tern","Sterna","forsteri",2009-06-14,"Colorado"
"363","6/14/2009","00:00.0","2009","6","14","Hundertmark","NULL","NULL","Jackson","CO","Franklin's Gull","NULL","00590","Franklin's Gull","Larus","pipixcan",2009-06-14,"Colorado"
"364","8/2/2009","00:00.0","2009","8","2","Hundertmark","NULL","NULL","Jackson","CO","Eared Grebe","NULL","00040","Eared Grebe","Podiceps","nigricollis",2009-08-02,"Colorado"
"365","8/2/2009","00:00.0","2009","8","2","Hundertmark","NULL","NULL","Jackson","CO","Western Grebe","NULL","00010","Western Grebe","Aechmophorus","occidentalis",2009-08-02,"Colorado"
"366","6/13/2010","00:00.0","2010","6","13","Hundertmark","NULL","NULL","Jackson","CO","Franklin's Gull","NULL","00590","Franklin's Gull","Larus","pipixcan",2010-06-13,"Colorado"
"367","7/10/2010","00:00.0","2010","7","10","Hundertmark","NULL","NULL","Jackson","CO","Eared Grebe","NULL","00040","Eared Grebe","Podiceps","nigricollis",2010-07-10,"Colorado"
"368","8/8/2010","00:00.0","2010","8","8","Hundertmark","NULL","NULL","Jackson","CO","Forster's Tern","NULL","00690","Forster's Tern","Sterna","forsteri",2010-08-08,"Colorado"
"369","8/2/2009","00:00.0","2009","8","2","Hundertmark","NULL","NULL","Jackson","CO","Western Grebe","NULL","00010","Western Grebe","Aechmophorus","occidentalis",2009-08-02,"Colorado"
"370","7/10/2010","00:00.0","2010","7","10","Hundertmark","NULL","NULL","Jackson","CO","Western Grebe","NULL","00010","Western Grebe","Aechmophorus","occidentalis",2010-07-10,"Colorado"
"371","NULL","","2009","NULL","NULL","Mason","NULL","NULL","Hinsdale","CO","Black-crowned Night-Heron","NULL","02020","Black-crowned Night-Heron","Nycticorax","nycticorax",NA,"Colorado"
"372","NULL","","2010","NULL","NULL","Mason","NULL","NULL","Hinsdale","CO","Black-crowned Night-Heron","NULL","02020","Black-crowned Night-Heron","Nycticorax","nycticorax",NA,"Colorado"
"373","5/15/2009","00:00.0","2009","5","15","Klute","NULL","NULL","Adams","CO","Snowy Egret","NULL","01970","Snowy Egret","Egretta","thula",2009-05-15,"Colorado"
"374","5/15/2009","00:00.0","2009","5","15","Klute","NULL","NULL","Adams","CO","Great Blue Heron","NULL","01940","Great Blue Heron","Ardea","herodias",2009-05-15,"Colorado"
"375","5/15/2009","00:00.0","2009","5","15","Klute","NULL","NULL","Adams","CO","Black-crowned Night-Heron","NULL","02020","Black-crowned Night-Heron","Nycticorax","nycticorax",2009-05-15,"Colorado"
"376","6/4/2010","00:00.0","2010","6","4","Klute","NULL","NULL","Adams","CO","Snowy Egret","NULL","01970","Snowy Egret","Egretta","thula",2010-06-04,"Colorado"
"3197","7/9/1998","00:00.0","1998","7","9","Paul","NULL","NULL","Davis","UT","White-faced Ibis","NULL","01870","White-faced Ibis","Plegadis","chihi",1998-07-09,"Utah"
"3198","NULL","","1982","NULL","NULL","Robinette et al. 1993","NULL","NULL","Davis","UT","California Gull","NULL","00530","California Gull","Larus","californicus",NA,"Utah"
"3199","NULL","","1991","NULL","NULL","Robinette et al. 1993","NULL","NULL","Davis","UT","California Gull","NULL","00530","California Gull","Larus","californicus",NA,"Utah"
"3200","NULL","","1992","NULL","NULL","Robinette et al. 1993","NULL","NULL","Davis","UT","California Gull","NULL","00530","California Gull","Larus","californicus",NA,"Utah"
"3201","NULL","","1993","NULL","NULL","Robinette et al. 1993","NULL","NULL","Davis","UT","California Gull","NULL","00530","California Gull","Larus","californicus",NA,"Utah"
"3202","NULL","","1983","NULL","NULL","Robinette et al. 1993","NULL","NULL","Davis","UT","California Gull","NULL","00530","California Gull","Larus","californicus",NA,"Utah"
"3203","NULL","","1990","NULL","NULL","Robinette et al. 1993","NULL","NULL","Davis","UT","California Gull","NULL","00530","California Gull","Larus","californicus",NA,"Utah"
"3204","NULL","","1991","NULL","NULL","Robinette et al. 1993","NULL","NULL","Davis","UT","California Gull","NULL","00530","California Gull","Larus","californicus",NA,"Utah"
"3205","NULL","","1992","NULL","NULL","Robinette et al. 1993","NULL","NULL","Davis","UT","California Gull","NULL","00530","California Gull","Larus","californicus",NA,"Utah"
"3206","NULL","","1993","NULL","NULL","Robinette et al. 1993","NULL","NULL","Davis","UT","California Gull","NULL","00530","California Gull","Larus","californicus",NA,"Utah"
"3207","NULL","","1982","NULL","NULL","Robinette et al. 1993","NULL","NULL","Box Elder","UT","California Gull","NULL","00530","California Gull","Larus","californicus",NA,"Utah"
"3208","NULL","","1989","NULL","NULL","Robinette et al. 1993","NULL","NULL","Box Elder","UT","California Gull","NULL","00530","California Gull","Larus","californicus",NA,"Utah"
"3209","NULL","","1990","NULL","NULL","Robinette et al. 1993","NULL","NULL","Box Elder","UT","California Gull","NULL","00530","California Gull","Larus","californicus",NA,"Utah"
"3210","NULL","","1991","NULL","NULL","Robinette et al. 1993","NULL","NULL","Box Elder","UT","California Gull","NULL","00530","California Gull","Larus","californicus",NA,"Utah"
"3211","NULL","","1992","NULL","NULL","Robinette et al. 1993","NULL","NULL","Box Elder","UT","California Gull","NULL","00530","California Gull","Larus","californicus",NA,"Utah"
"3212","NULL","","1993","NULL","NULL","Robinette et al. 1993","NULL","NULL","Box Elder","UT","California Gull","NULL","00530","California Gull","Larus","californicus",NA,"Utah"
"3213","NULL","","1850","NULL","NULL","Behle 1958","NULL","NULL","Box Elder","UT","American White Pelican","NULL","01250","American White Pelican","Pelecanus","erythrorhynchos",NA,"Utah"
"3214","NULL","","1896","NULL","NULL","Behle 1958","NULL","NULL","Box Elder","UT","American White Pelican","NULL","01250","American White Pelican","Pelecanus","erythrorhynchos",NA,"Utah"
"3215","NULL","","1908","NULL","NULL","Behle 1958","NULL","NULL","Box Elder","UT","California Gull","NULL","00530","California Gull","Larus","californicus",NA,"Utah"
"3216","NULL","","1937","NULL","NULL","Behle 1958","NULL","NULL","Box Elder","UT","California Gull","NULL","00530","California Gull","Larus","californicus",NA,"Utah"
"3217","NULL","","1963","NULL","NULL","Behle 1958","NULL","NULL","Box Elder","UT","American White Pelican","NULL","01250","American White Pelican","Pelecanus","erythrorhynchos",NA,"Utah"
"3218","NULL","","1972","NULL","NULL","Neill et al. 2010","NULL","NULL","Box Elder","UT","American White Pelican","NULL","01250","American White Pelican","Pelecanus","erythrorhynchos",NA,"Utah"
"3343","6/13/2000","00:00.0","2000","6","13","NULL","NULL","NULL","Davis","UT","Snowy Egret","NULL","01970","Snowy Egret","Egretta","thula",2000-06-13,"Utah"
"3219","NULL","","1973","NULL","NULL","Neill et al. 2010","NULL","NULL","Box Elder","UT","American White Pelican","NULL","01250","American White Pelican","Pelecanus","erythrorhynchos",NA,"Utah"
"3220","NULL","","1974","NULL","NULL","Neill et al. 2010","NULL","NULL","Box Elder","UT","American White Pelican","NULL","01250","American White Pelican","Pelecanus","erythrorhynchos",NA,"Utah"
"3221","NULL","","1976","NULL","NULL","Neill et al. 2010","NULL","NULL","Box Elder","UT","American White Pelican","NULL","01250","American White Pelican","Pelecanus","erythrorhynchos",NA,"Utah"
"3222","NULL","","1980","NULL","NULL","Neill et al. 2010","NULL","NULL","Box Elder","UT","American White Pelican","NULL","01250","American White Pelican","Pelecanus","erythrorhynchos",NA,"Utah"
"3223","NULL","","1982","NULL","NULL","Robinette et al. 1993","NULL","NULL","Box Elder","UT","California Gull","NULL","00530","California Gull","Larus","californicus",NA,"Utah"
"3224","NULL","","1983","NULL","NULL","Robinette et al. 1993","NULL","NULL","Box Elder","UT","California Gull","NULL","00530","California Gull","Larus","californicus",NA,"Utah"
"3225","NULL","","1986","NULL","NULL","Neill et al. 2010","NULL","NULL","Box Elder","UT","American White Pelican","NULL","01250","American White Pelican","Pelecanus","erythrorhynchos",NA,"Utah"
"3226","NULL","","1986","NULL","NULL","Robinette et al. 1993","NULL","NULL","Box Elder","UT","California Gull","NULL","00530","California Gull","Larus","californicus",NA,"Utah"
"3227","NULL","","1987","NULL","NULL","Robinette et al. 1993","NULL","NULL","Box Elder","UT","California Gull","NULL","00530","California Gull","Larus","californicus",NA,"Utah"
"3228","NULL","","1989","NULL","NULL","Neill et al. 2010","NULL","NULL","Box Elder","UT","American White Pelican","NULL","01250","American White Pelican","Pelecanus","erythrorhynchos",NA,"Utah"
"3229","NULL","","1989","NULL","NULL","Robinette et al. 1993","NULL","NULL","Box Elder","UT","California Gull","NULL","00530","California Gull","Larus","californicus",NA,"Utah"
"3230","NULL","","1990","NULL","NULL","Robinette et al. 1993","NULL","NULL","Box Elder","UT","California Gull","NULL","00530","California Gull","Larus","californicus",NA,"Utah"
"3231","NULL","","1991","NULL","NULL","Robinette et al. 1993","NULL","NULL","Box Elder","UT","California Gull","NULL","00530","California Gull","Larus","californicus",NA,"Utah"
"3232","NULL","","1992","NULL","NULL","Robinette et al. 1993","NULL","NULL","Box Elder","UT","California Gull","NULL","00530","California Gull","Larus","californicus",NA,"Utah"
"3233","NULL","","1994","NULL","NULL","Neill et al. 2010","NULL","NULL","Box Elder","UT","American White Pelican","NULL","01250","American White Pelican","Pelecanus","erythrorhynchos",NA,"Utah"
"3234","NULL","","2004","NULL","NULL","Neill et al. 2010","NULL","NULL","Box Elder","UT","American White Pelican","NULL","01250","American White Pelican","Pelecanus","erythrorhynchos",NA,"Utah"
"3235","NULL","","2006","NULL","NULL","Neill et al. 2010","NULL","NULL","Box Elder","UT","American White Pelican","NULL","01250","American White Pelican","Pelecanus","erythrorhynchos",NA,"Utah"
"3236","6/29/1932","00:00.0","1932","6","29","Behle 1958","NULL","NULL","Box Elder","UT","American White Pelican","NULL","01250","American White Pelican","Pelecanus","erythrorhynchos",1932-06-29,"Utah"
"3237","6/29/1932","00:00.0","1932","6","29","Behle 1958","NULL","NULL","Box Elder","UT","California Gull","NULL","00530","California Gull","Larus","californicus",1932-06-29,"Utah"
"3238","6/29/1932","00:00.0","1932","6","29","Behle 1958","NULL","NULL","Box Elder","UT","Great Blue Heron","NULL","01940","Great Blue Heron","Ardea","herodias",1932-06-29,"Utah"
"3239","6/4/1936","00:00.0","1936","6","4","Behle 1958","NULL","NULL","Box Elder","UT","American White Pelican","NULL","01250","American White Pelican","Pelecanus","erythrorhynchos",1936-06-04,"Utah"
"3240","6/4/1936","00:00.0","1936","6","4","Behle 1958","NULL","NULL","Box Elder","UT","California Gull","NULL","00530","California Gull","Larus","californicus",1936-06-04,"Utah"
"3241","6/4/1936","00:00.0","1936","6","4","Behle 1958","NULL","NULL","Box Elder","UT","Great Blue Heron","NULL","01940","Great Blue Heron","Ardea","herodias",1936-06-04,"Utah"
"3242","6/23/1937","00:00.0","1937","6","23","Behle 1958","NULL","NULL","Box Elder","UT","American White Pelican","NULL","01250","American White Pelican","Pelecanus","erythrorhynchos",1937-06-23,"Utah"
"3243","6/22/1940","00:00.0","1940","6","22","Behle 1958","NULL","NULL","Box Elder","UT","American White Pelican","NULL","01250","American White Pelican","Pelecanus","erythrorhynchos",1940-06-22,"Utah"
"3244","6/22/1940","00:00.0","1940","6","22","Behle 1958","NULL","NULL","Box Elder","UT","California Gull","NULL","00530","California Gull","Larus","californicus",1940-06-22,"Utah"
"3245","6/22/1940","00:00.0","1940","6","22","Behle 1958","NULL","NULL","Box Elder","UT","Great Blue Heron","NULL","01940","Great Blue Heron","Ardea","herodias",1940-06-22,"Utah"
"3246","6/12/1943","00:00.0","1943","6","12","Behle 1958","NULL","NULL","Box Elder","UT","California Gull","NULL","00530","California Gull","Larus","californicus",1943-06-12,"Utah"
"3247","6/23/1943","00:00.0","1943","6","23","Behle 1958","NULL","NULL","Box Elder","UT","American White Pelican","NULL","01250","American White Pelican","Pelecanus","erythrorhynchos",1943-06-23,"Utah"
"3248","7/3/1946","00:00.0","1946","7","3","Behle 1958","NULL","NULL","Box Elder","UT","American White Pelican","NULL","01250","American White Pelican","Pelecanus","erythrorhynchos",1946-07-03,"Utah"
"3249","7/3/1946","00:00.0","1946","7","3","Behle 1958","NULL","NULL","Box Elder","UT","California Gull","NULL","00530","California Gull","Larus","californicus",1946-07-03,"Utah"
"3250","6/19/1947","00:00.0","1947","6","19","Behle 1958","NULL","NULL","Box Elder","UT","American White Pelican","NULL","01250","American White Pelican","Pelecanus","erythrorhynchos",1947-06-19,"Utah"
"3251","6/11/1948","00:00.0","1948","6","11","Behle 1958","NULL","NULL","Box Elder","UT","American White Pelican","NULL","01250","American White Pelican","Pelecanus","erythrorhynchos",1948-06-11,"Utah"
"3252","7/15/1948","00:00.0","1948","7","15","Behle 1958","NULL","NULL","Box Elder","UT","California Gull","NULL","00530","California Gull","Larus","californicus",1948-07-15,"Utah"
"3253","6/11/1949","00:00.0","1949","6","11","Behle 1958","NULL","NULL","Box Elder","UT","Great Blue Heron","NULL","01940","Great Blue Heron","Ardea","herodias",1949-06-11,"Utah"
"3254","7/9/1964","00:00.0","1964","7","9","Neill et al. 2010","NULL","NULL","Box Elder","UT","American White Pelican","NULL","01250","American White Pelican","Pelecanus","erythrorhynchos",1964-07-09,"Utah"
"3255","5/13/1981","00:00.0","1981","5","13","Neill et al. 2010","NULL","NULL","Box Elder","UT","American White Pelican","NULL","01250","American White Pelican","Pelecanus","erythrorhynchos",1981-05-13,"Utah"
"3256","5/20/1985","00:00.0","1985","5","20","Neill et al. 2010","NULL","NULL","Box Elder","UT","American White Pelican","NULL","01250","American White Pelican","Pelecanus","erythrorhynchos",1985-05-20,"Utah"
"3257","5/20/1988","00:00.0","1988","5","20","Neill et al. 2010","NULL","NULL","Box Elder","UT","American White Pelican","NULL","01250","American White Pelican","Pelecanus","erythrorhynchos",1988-05-20,"Utah"
"3258","5/17/1991","00:00.0","1991","5","17","Neill et al. 2010","NULL","NULL","Box Elder","UT","American White Pelican","NULL","01250","American White Pelican","Pelecanus","erythrorhynchos",1991-05-17,"Utah"
"3259","5/18/1992","00:00.0","1992","5","18","Neill et al. 2010","NULL","NULL","Box Elder","UT","American White Pelican","NULL","01250","American White Pelican","Pelecanus","erythrorhynchos",1992-05-18,"Utah"
"3260","5/19/1993","00:00.0","1993","5","19","Robinette et al. 1993","NULL","NULL","Box Elder","UT","California Gull","NULL","00530","California Gull","Larus","californicus",1993-05-19,"Utah"
"3261","5/20/1997","00:00.0","1997","5","20","Neill et al. 2010","NULL","NULL","Box Elder","UT","American White Pelican","NULL","01250","American White Pelican","Pelecanus","erythrorhynchos",1997-05-20,"Utah"
"3262","5/20/1998","00:00.0","1998","5","20","Neill et al. 2010","NULL","NULL","Box Elder","UT","American White Pelican","NULL","01250","American White Pelican","Pelecanus","erythrorhynchos",1998-05-20,"Utah"
"3263","5/20/1999","00:00.0","1999","5","20","Neill et al. 2010","NULL","NULL","Box Elder","UT","American White Pelican","NULL","01250","American White Pelican","Pelecanus","erythrorhynchos",1999-05-20,"Utah"
"3264","5/20/2002","00:00.0","2002","5","20","Neill et al. 2010","NULL","NULL","Box Elder","UT","American White Pelican","NULL","01250","American White Pelican","Pelecanus","erythrorhynchos",2002-05-20,"Utah"
"3265","NULL","","1983","NULL","NULL","Neill et al. 2010","NULL","NULL","Box Elder","UT","American White Pelican","SurveyDate:5/15:6/15/1983","01250","American White Pelican","Pelecanus","erythrorhynchos",NA,"Utah"
"3266","NULL","","2001","5","NULL","Neill et al. 2010","NULL","NULL","Box Elder","UT","American White Pelican","SurveyDate:5/17:5/18/2001","01250","American White Pelican","Pelecanus","erythrorhynchos",NA,"Utah"
"3267","NULL","","2007","NULL","NULL","Neill et al. 2010","NULL","NULL","Box Elder","UT","American White Pelican","SurveyDate:5/18:6/19:7/27/2007","01250","American White Pelican","Pelecanus","erythrorhynchos",NA,"Utah"
"3268","NULL","","1995","NULL","NULL","Neill et al. 2010","NULL","NULL","Box Elder","UT","American White Pelican","SurveyDate:5/19:6/20/1995","01250","American White Pelican","Pelecanus","erythrorhynchos",NA,"Utah"
"3269","NULL","","1987","NULL","NULL","Neill et al. 2010","NULL","NULL","Box Elder","UT","American White Pelican","SurveyDate:5/19:6/22/1987","01250","American White Pelican","Pelecanus","erythrorhynchos",NA,"Utah"
"3270","NULL","","1993","NULL","NULL","Neill et al. 2010","NULL","NULL","Box Elder","UT","American White Pelican","SurveyDate:5/19:6/22/1993","01250","American White Pelican","Pelecanus","erythrorhynchos",NA,"Utah"
"3271","NULL","","2000","NULL","NULL","Neill et al. 2010","NULL","NULL","Box Elder","UT","American White Pelican","SurveyDate:5/19:6/8/2000","01250","American White Pelican","Pelecanus","erythrorhynchos",NA,"Utah"
"3272","NULL","","1996","NULL","NULL","Neill et al. 2010","NULL","NULL","Box Elder","UT","American White Pelican","SurveyDate:5/20:6/20/1996","01250","American White Pelican","Pelecanus","erythrorhynchos",NA,"Utah"
"3273","NULL","","2008","NULL","NULL","Neill et al. 2010","NULL","NULL","Box Elder","UT","American White Pelican","SurveyDate:5/20:6/20:7/22/2008","01250","American White Pelican","Pelecanus","erythrorhynchos",NA,"Utah"
"3274","NULL","","2003","NULL","NULL","Neill et al. 2010","NULL","NULL","Box Elder","UT","American White Pelican","SurveyDate:5/20:6/26/2003","01250","American White Pelican","Pelecanus","erythrorhynchos",NA,"Utah"
"3275","NULL","","1984","NULL","NULL","Neill et al. 2010","NULL","NULL","Box Elder","UT","American White Pelican","SurveyDate:5/21:6/20/1984","01250","American White Pelican","Pelecanus","erythrorhynchos",NA,"Utah"
"3276","NULL","","1990","NULL","NULL","Neill et al. 2010","NULL","NULL","Box Elder","UT","American White Pelican","SurveyDate:5/21:June/1990","01250","American White Pelican","Pelecanus","erythrorhynchos",NA,"Utah"
"3277","NULL","","2005","NULL","NULL","Neill et al. 2010","NULL","NULL","Box Elder","UT","American White Pelican","SurveyDate:5/23:6/22:7/5/2005","01250","American White Pelican","Pelecanus","erythrorhynchos",NA,"Utah"
"3278","NULL","","1982","NULL","NULL","Neill et al. 2010","NULL","NULL","Box Elder","UT","American White Pelican","SurveyDate:5/24:6/12/1982","01250","American White Pelican","Pelecanus","erythrorhynchos",NA,"Utah"
"3279","NULL","","1850","5","8","Behle 1958","NULL","NULL","Box Elder","UT","California Gull","NULL","00530","California Gull","Larus","californicus",NA,"Utah"
"3280","NULL","","1937","6","NULL","Behle 1958","NULL","NULL","Box Elder","UT","Great Blue Heron","SurveyDate:6/-/1937","01940","Great Blue Heron","Ardea","herodias",NA,"Utah"
"3281","NULL","","1935","6","NULL","Behle 1958","NULL","NULL","Box Elder","UT","American White Pelican","SurveyDate:6/18:19/1935","01250","American White Pelican","Pelecanus","erythrorhynchos",NA,"Utah"
"3282","NULL","","1935","6","NULL","Behle 1958","NULL","NULL","Box Elder","UT","California Gull","SurveyDate:6/18:19/1935","00530","California Gull","Larus","californicus",NA,"Utah"
"3283","NULL","","1935","6","NULL","Behle 1958","NULL","NULL","Box Elder","UT","Great Blue Heron","SurveyDate:6/18:19/1935","01940","Great Blue Heron","Ardea","herodias",NA,"Utah"
"3284","NULL","","1886","7","NULL","Behle 1958","NULL","NULL","Box Elder","UT","American White Pelican","SurveyDate:7/-/1886","01250","American White Pelican","Pelecanus","erythrorhynchos",NA,"Utah"
"3285","NULL","","1886","7","NULL","Behle 1958","NULL","NULL","Box Elder","UT","California Gull","SurveyDate:7/-/1886","00530","California Gull","Larus","californicus",NA,"Utah"
"3286","NULL","","1938","7","NULL","Behle 1958","NULL","NULL","Box Elder","UT","American White Pelican","SurveyDate:7/11:12/1938","01250","American White Pelican","Pelecanus","erythrorhynchos",NA,"Utah"
"3287","NULL","","1938","7","NULL","Behle 1958","NULL","NULL","Box Elder","UT","California Gull","SurveyDate:7/11:12/1938","00530","California Gull","Larus","californicus",NA,"Utah"
"3288","NULL","","1938","7","NULL","Behle 1958","NULL","NULL","Box Elder","UT","Great Blue Heron","SurveyDate:7/11:12/1938","01940","Great Blue Heron","Ardea","herodias",NA,"Utah"
"3289","NULL","","1896","NULL","NULL","Behle 1958","NULL","NULL","Box Elder","UT","California Gull","SurveyDate:Spring 1896","00530","California Gull","Larus","californicus",NA,"Utah"
"3290","NULL","","1885","NULL","NULL","Behle 1958","NULL","NULL","Box Elder","UT","American White Pelican","NULL","01250","American White Pelican","Pelecanus","erythrorhynchos",NA,"Utah"
"3291","NULL","","1885","NULL","NULL","Behle 1958","NULL","NULL","Box Elder","UT","Great Blue Heron","NULL","01940","Great Blue Heron","Ardea","herodias",NA,"Utah"
"3292","NULL","","1896","NULL","NULL","Behle 1958","NULL","NULL","Box Elder","UT","American White Pelican","NULL","01250","American White Pelican","Pelecanus","erythrorhynchos",NA,"Utah"
"3293","NULL","","1912","NULL","NULL","Behle 1958","NULL","NULL","Box Elder","UT","American White Pelican","NULL","01250","American White Pelican","Pelecanus","erythrorhynchos",NA,"Utah"
"3294","NULL","","1912","NULL","NULL","Behle 1958","NULL","NULL","Box Elder","UT","Great Blue Heron","NULL","01940","Great Blue Heron","Ardea","herodias",NA,"Utah"
"3295","NULL","","1932","NULL","NULL","Behle 1958","NULL","NULL","Box Elder","UT","Great Blue Heron","NULL","01940","Great Blue Heron","Ardea","herodias",NA,"Utah"
"3296","NULL","","1943","NULL","NULL","Behle 1958","NULL","NULL","Box Elder","UT","American White Pelican","NULL","01250","American White Pelican","Pelecanus","erythrorhynchos",NA,"Utah"
"3297","NULL","","1982","NULL","NULL","Robinette et al. 1993","NULL","NULL","Box Elder","UT","California Gull","NULL","00530","California Gull","Larus","californicus",NA,"Utah"
"3298","NULL","","1983","NULL","NULL","Robinette et al. 1993","NULL","NULL","Box Elder","UT","California Gull","NULL","00530","California Gull","Larus","californicus",NA,"Utah"
"3299","NULL","","1986","NULL","NULL","Robinette et al. 1993","NULL","NULL","Box Elder","UT","California Gull","NULL","00530","California Gull","Larus","californicus",NA,"Utah"
"3300","NULL","","1987","NULL","NULL","Robinette et al. 1993","NULL","NULL","Box Elder","UT","California Gull","NULL","00530","California Gull","Larus","californicus",NA,"Utah"
"3301","NULL","","1989","NULL","NULL","Robinette et al. 1993","NULL","NULL","Box Elder","UT","California Gull","NULL","00530","California Gull","Larus","californicus",NA,"Utah"
"3302","NULL","","1990","NULL","NULL","Robinette et al. 1993","NULL","NULL","Box Elder","UT","California Gull","NULL","00530","California Gull","Larus","californicus",NA,"Utah"
"3303","NULL","","1991","NULL","NULL","Robinette et al. 1993","NULL","NULL","Box Elder","UT","California Gull","NULL","00530","California Gull","Larus","californicus",NA,"Utah"
"3304","NULL","","1992","NULL","NULL","Robinette et al. 1993","NULL","NULL","Box Elder","UT","California Gull","NULL","00530","California Gull","Larus","californicus",NA,"Utah"
"3305","NULL","","1993","NULL","NULL","Robinette et al. 1993","NULL","NULL","Box Elder","UT","California Gull","NULL","00530","California Gull","Larus","californicus",NA,"Utah"
"3306","5/8/1906","00:00.0","1906","5","8","Behle 1958","NULL","NULL","Box Elder","UT","American White Pelican","NULL","01250","American White Pelican","Pelecanus","erythrorhynchos",1906-05-08,"Utah"
"3307","5/8/1906","00:00.0","1906","5","8","Behle 1958","NULL","NULL","Box Elder","UT","California Gull","NULL","00530","California Gull","Larus","californicus",1906-05-08,"Utah"
"3308","5/8/1906","00:00.0","1906","5","8","Behle 1958","NULL","NULL","Box Elder","UT","Great Blue Heron","NULL","01940","Great Blue Heron","Ardea","herodias",1906-05-08,"Utah"
"3309","5/14/1915","00:00.0","1915","5","14","Behle 1958","NULL","NULL","Box Elder","UT","Caspian Tern","NULL","00640","Caspian Tern","Hydroprogne","caspia",1915-05-14,"Utah"
"3310","6/21/1917","00:00.0","1917","6","21","Behle 1958","NULL","NULL","Box Elder","UT","California Gull","NULL","00530","California Gull","Larus","californicus",1917-06-21,"Utah"
"3311","7/5/1924","00:00.0","1924","7","5","Behle 1958","NULL","NULL","Box Elder","UT","Great Blue Heron","NULL","01940","Great Blue Heron","Ardea","herodias",1924-07-05,"Utah"
"3312","5/17/1925","00:00.0","1925","5","17","Behle 1958","NULL","NULL","Box Elder","UT","American White Pelican","NULL","01250","American White Pelican","Pelecanus","erythrorhynchos",1925-05-17,"Utah"
"3313","5/17/1925","00:00.0","1925","5","17","Behle 1958","NULL","NULL","Box Elder","UT","California Gull","NULL","00530","California Gull","Larus","californicus",1925-05-17,"Utah"
"3314","5/8/1926","00:00.0","1926","5","8","Behle 1958","NULL","NULL","Box Elder","UT","Great Blue Heron","NULL","01940","Great Blue Heron","Ardea","herodias",1926-05-08,"Utah"
"3315","5/21/1926","00:00.0","1926","5","21","Behle 1958","NULL","NULL","Box Elder","UT","American White Pelican","NULL","01250","American White Pelican","Pelecanus","erythrorhynchos",1926-05-21,"Utah"
"3316","5/21/1926","00:00.0","1926","5","21","Behle 1958","NULL","NULL","Box Elder","UT","California Gull","NULL","00530","California Gull","Larus","californicus",1926-05-21,"Utah"
"3317","5/15/1932","00:00.0","1932","5","15","Behle 1958","NULL","NULL","Box Elder","UT","American White Pelican","NULL","01250","American White Pelican","Pelecanus","erythrorhynchos",1932-05-15,"Utah"
"3318","6/1/1935","00:00.0","1935","6","1","Behle 1958","NULL","NULL","Box Elder","UT","California Gull","NULL","00530","California Gull","Larus","californicus",1935-06-01,"Utah"
"3319","6/4/1935","00:00.0","1935","6","4","Behle 1958","NULL","NULL","Box Elder","UT","Great Blue Heron","NULL","01940","Great Blue Heron","Ardea","herodias",1935-06-04,"Utah"
"3320","5/3/1936","00:00.0","1936","5","3","Behle 1958","NULL","NULL","Box Elder","UT","Great Blue Heron","NULL","01940","Great Blue Heron","Ardea","herodias",1936-05-03,"Utah"
"3321","6/22/1937","00:00.0","1937","6","22","Behle 1958","NULL","NULL","Box Elder","UT","American White Pelican","NULL","01250","American White Pelican","Pelecanus","erythrorhynchos",1937-06-22,"Utah"
"3322","7/11/1937","00:00.0","1937","7","11","Behle 1958","NULL","NULL","Box Elder","UT","California Gull","NULL","00530","California Gull","Larus","californicus",1937-07-11,"Utah"
"3323","7/11/1938","00:00.0","1938","7","11","Behle 1958","NULL","NULL","Box Elder","UT","American White Pelican","NULL","01250","American White Pelican","Pelecanus","erythrorhynchos",1938-07-11,"Utah"
"3324","7/11/1938","00:00.0","1938","7","11","Behle 1958","NULL","NULL","Box Elder","UT","California Gull","NULL","00530","California Gull","Larus","californicus",1938-07-11,"Utah"
"3325","NULL","","1907","5","NULL","Behle 1958","NULL","NULL","Box Elder","UT","American White Pelican","NULL","01250","American White Pelican","Pelecanus","erythrorhynchos",NA,"Utah"
"3326","NULL","","1907","5","NULL","Behle 1958","NULL","NULL","Box Elder","UT","Great Blue Heron","NULL","01940","Great Blue Heron","Ardea","herodias",NA,"Utah"
"3327","NULL","","1933","NULL","NULL","Behle 1958","NULL","NULL","Box Elder","UT","American White Pelican","SurveyDate:5/30:6/16/1933","01250","American White Pelican","Pelecanus","erythrorhynchos",NA,"Utah"
"3328","NULL","","1933","6","NULL","Behle 1958","NULL","NULL","Box Elder","UT","California Gull","SurveyDate:6/-/1933","00530","California Gull","Larus","californicus",NA,"Utah"
"3329","NULL","","1886","7","NULL","Behle 1958","NULL","NULL","Box Elder","UT","American White Pelican","SurveyDate:7/-/1886","01250","American White Pelican","Pelecanus","erythrorhynchos",NA,"Utah"
"3330","NULL","","1886","7","NULL","Behle 1958","NULL","NULL","Box Elder","UT","California Gull","SurveyDate:7/-/1886","00530","California Gull","Larus","californicus",NA,"Utah"
"3331","NULL","","1886","7","NULL","Behle 1958","NULL","NULL","Box Elder","UT","Great Blue Heron","SurveyDate:7/-/1886","01940","Great Blue Heron","Ardea","herodias",NA,"Utah"
"3332","NULL","","1907","7","NULL","Behle 1958","NULL","NULL","Box Elder","UT","California Gull","SurveyDate:7/-/1907","00530","California Gull","Larus","californicus",NA,"Utah"
"3333","NULL","","1885","NULL","NULL","Behle 1958","NULL","NULL","Box Elder","UT","California Gull","SurveyDate:Spring 1885","00530","California Gull","Larus","californicus",NA,"Utah"
"3334","NULL","","1912","NULL","NULL","Behle 1958","NULL","NULL","Box Elder","UT","California Gull","SurveyDate:Spring 1912","00530","California Gull","Larus","californicus",NA,"Utah"
"3335","NULL","","1970","NULL","NULL","NULL","NULL","NULL","Davis","UT","White-faced Ibis","NULL","01870","White-faced Ibis","Plegadis","chihi",NA,"Utah"
"3336","NULL","","2000","NULL","NULL","NULL","NULL","NULL","Davis","UT","White-faced Ibis","NULL","01870","White-faced Ibis","Plegadis","chihi",NA,"Utah"
"3337","NULL","","2001","NULL","NULL","NULL","NULL","NULL","Davis","UT","White-faced Ibis","NULL","01870","White-faced Ibis","Plegadis","chihi",NA,"Utah"
"3338","7/10/1999","00:00.0","1999","7","10","NULL","NULL","NULL","Davis","UT","Black-crowned Night-Heron","NULL","02020","Black-crowned Night-Heron","Nycticorax","nycticorax",1999-07-10,"Utah"
"3339","7/10/1999","00:00.0","1999","7","10","NULL","NULL","NULL","Davis","UT","Snowy Egret","NULL","01970","Snowy Egret","Egretta","thula",1999-07-10,"Utah"
"3340","7/10/1999","00:00.0","1999","7","10","NULL","NULL","NULL","Davis","UT","White-faced Ibis","NULL","01870","White-faced Ibis","Plegadis","chihi",1999-07-10,"Utah"
"3341","6/13/2000","00:00.0","2000","6","13","NULL","NULL","NULL","Davis","UT","Black-crowned Night-Heron","NULL","02020","Black-crowned Night-Heron","Nycticorax","nycticorax",2000-06-13,"Utah"
"3342","6/13/2000","00:00.0","2000","6","13","NULL","NULL","NULL","Davis","UT","Franklin's Gull","NULL","00590","Franklin's Gull","Larus","pipixcan",2000-06-13,"Utah"
"3344","NULL","","1970","NULL","NULL","NULL","NULL","NULL","Davis","UT","White-faced Ibis","NULL","01870","White-faced Ibis","Plegadis","chihi",NA,"Utah"
"3345","NULL","","2000","NULL","NULL","NULL","NULL","NULL","Davis","UT","White-faced Ibis","NULL","01870","White-faced Ibis","Plegadis","chihi",NA,"Utah"
"3346","NULL","","2001","NULL","NULL","NULL","NULL","NULL","Davis","UT","White-faced Ibis","NULL","01870","White-faced Ibis","Plegadis","chihi",NA,"Utah"
"3347","7/10/1999","00:00.0","1999","7","10","NULL","NULL","NULL","Davis","UT","Black-crowned Night-Heron","NULL","02020","Black-crowned Night-Heron","Nycticorax","nycticorax",1999-07-10,"Utah"
"3348","7/10/1999","00:00.0","1999","7","10","NULL","NULL","NULL","Davis","UT","Forster's Tern","NULL","00690","Forster's Tern","Sterna","forsteri",1999-07-10,"Utah"
"3349","7/10/1999","00:00.0","1999","7","10","NULL","NULL","NULL","Davis","UT","Franklin's Gull","NULL","00590","Franklin's Gull","Larus","pipixcan",1999-07-10,"Utah"
"3350","7/10/1999","00:00.0","1999","7","10","NULL","NULL","NULL","Davis","UT","Snowy Egret","NULL","01970","Snowy Egret","Egretta","thula",1999-07-10,"Utah"
"3351","7/10/1999","00:00.0","1999","7","10","NULL","NULL","NULL","Davis","UT","White-faced Ibis","NULL","01870","White-faced Ibis","Plegadis","chihi",1999-07-10,"Utah"
"3352","6/13/2000","00:00.0","2000","6","13","NULL","NULL","NULL","Davis","UT","Franklin's Gull","NULL","00590","Franklin's Gull","Larus","pipixcan",2000-06-13,"Utah"
"3353","6/13/2000","00:00.0","2000","6","13","NULL","NULL","NULL","Davis","UT","Snowy Egret","NULL","01970","Snowy Egret","Egretta","thula",2000-06-13,"Utah"
"3354","6/25/2001","00:00.0","2001","6","25","NULL","NULL","NULL","Davis","UT","Black-crowned Night-Heron","NULL","02020","Black-crowned Night-Heron","Nycticorax","nycticorax",2001-06-25,"Utah"
"3355","NULL","","1982","NULL","NULL","Robinette et al. 1993","NULL","NULL","Rich","UT","California Gull","NULL","00530","California Gull","Larus","californicus",NA,"Utah"
"3356","NULL","","1983","NULL","NULL","Robinette et al. 1993","NULL","NULL","Rich","UT","California Gull","NULL","00530","California Gull","Larus","californicus",NA,"Utah"
"3357","NULL","","1991","NULL","NULL","Robinette et al. 1993","NULL","NULL","Rich","UT","California Gull","NULL","00530","California Gull","Larus","californicus",NA,"Utah"
"3358","NULL","","1992","NULL","NULL","Robinette et al. 1993","NULL","NULL","Rich","UT","California Gull","NULL","00530","California Gull","Larus","californicus",NA,"Utah"
"3359","NULL","","1993","NULL","NULL","Robinette et al. 1993","NULL","NULL","Rich","UT","California Gull","NULL","00530","California Gull","Larus","californicus",NA,"Utah"
"3360","NULL","","1993","NULL","NULL","Robinette et al. 1993","NULL","NULL","Rich","UT","Double-crested Cormorant","NULL","01200","Double-crested Cormorant","Phalacrocorax","auritus",NA,"Utah"
"3361","NULL","","1993","NULL","NULL","Robinette et al. 1993","NULL","NULL","Rich","UT","Ring-billed Gull","NULL","00540","Ring-billed Gull","Larus","delawarensis",NA,"Utah"
"3362","NULL","","2008","NULL","NULL","Paul 2010","NULL","NULL","Rich","UT","California Gull","NULL","00530","California Gull","Larus","californicus",NA,"Utah"
"3363","NULL","","2008","NULL","NULL","Paul 2010","NULL","NULL","Rich","UT","Double-crested Cormorant","NULL","01200","Double-crested Cormorant","Phalacrocorax","auritus",NA,"Utah"
"3364","NULL","","2008","NULL","NULL","Paul 2010","NULL","NULL","Rich","UT","Ring-billed Gull","NULL","00540","Ring-billed Gull","Larus","delawarensis",NA,"Utah"
"3365","NULL","","2008","NULL","NULL","Paul 2010","NULL","NULL","Rich","UT","NULL","Multiple species:  Snowy Egret, Cattle Egret, and Black-crowned Night-Heron","NULL",NA,NA,NA,NA,"Utah"
"3366","NULL","","1985","NULL","NULL","NULL","NULL","NULL","Weber","UT","White-faced Ibis","NULL","01870","White-faced Ibis","Plegadis","chihi",NA,"Utah"
"3367","NULL","","1989","NULL","NULL","NULL","NULL","NULL","Weber","UT","White-faced Ibis","NULL","01870","White-faced Ibis","Plegadis","chihi",NA,"Utah"
"3368","7/15/1998","00:00.0","1998","7","15","Paul","NULL","NULL","Weber","UT","White-faced Ibis","NULL","01870","White-faced Ibis","Plegadis","chihi",1998-07-15,"Utah"
"3369","6/9/1999","00:00.0","1999","6","9","NULL","NULL","NULL","Weber","UT","Snowy Egret","NULL","01970","Snowy Egret","Egretta","thula",1999-06-09,"Utah"
"3370","7/19/1999","00:00.0","1999","7","19","NULL","NULL","NULL","Weber","UT","Eared Grebe","NULL","00040","Eared Grebe","Podiceps","nigricollis",1999-07-19,"Utah"
"3371","7/19/1999","00:00.0","1999","7","19","NULL","NULL","NULL","Weber","UT","Forster's Tern","NULL","00690","Forster's Tern","Sterna","forsteri",1999-07-19,"Utah"
"3372","NULL","","1982","NULL","NULL","Robinette et al. 1998","NULL","NULL","Davis","UT","California Gull","NULL","00530","California Gull","Larus","californicus",NA,"Utah"
"3373","NULL","","1983","NULL","NULL","Robinette et al. 1998","NULL","NULL","Davis","UT","California Gull","NULL","00530","California Gull","Larus","californicus",NA,"Utah"
"3374","NULL","","1982","NULL","NULL","Robinette et al. 1993","NULL","NULL","Box Elder","UT","California Gull","NULL","00530","California Gull","Larus","californicus",NA,"Utah"
"3375","NULL","","1983","NULL","NULL","Robinette et al. 1993","NULL","NULL","Box Elder","UT","California Gull","NULL","00530","California Gull","Larus","californicus",NA,"Utah"
"3376","NULL","","1986","NULL","NULL","Robinette et al. 1993","NULL","NULL","Box Elder","UT","California Gull","NULL","00530","California Gull","Larus","californicus",NA,"Utah"
"3377","NULL","","1987","NULL","NULL","Robinette et al. 1993","NULL","NULL","Box Elder","UT","California Gull","NULL","00530","California Gull","Larus","californicus",NA,"Utah"
"3378","6/13/2000","00:00.0","2000","6","13","NULL","NULL","NULL","Davis","UT","Black-crowned Night-Heron","NULL","02020","Black-crowned Night-Heron","Nycticorax","nycticorax",2000-06-13,"Utah"
"3379","6/13/2000","00:00.0","2000","6","13","NULL","NULL","NULL","Davis","UT","Forster's Tern","NULL","00690","Forster's Tern","Sterna","forsteri",2000-06-13,"Utah"
"3380","6/13/2000","00:00.0","2000","6","13","NULL","NULL","NULL","Davis","UT","Franklin's Gull","NULL","00590","Franklin's Gull","Larus","pipixcan",2000-06-13,"Utah"
"3381","6/13/2000","00:00.0","2000","6","13","NULL","NULL","NULL","Davis","UT","Great Blue Heron","NULL","01940","Great Blue Heron","Ardea","herodias",2000-06-13,"Utah"
"3382","6/13/2000","00:00.0","2000","6","13","NULL","NULL","NULL","Davis","UT","Great Egret","NULL","01960","Great Egret","Ardea","alba",2000-06-13,"Utah"
"3383","6/13/2000","00:00.0","2000","6","13","NULL","NULL","NULL","Davis","UT","Snowy Egret","NULL","01970","Snowy Egret","Egretta","thula",2000-06-13,"Utah"
"3384","6/13/2000","00:00.0","2000","6","13","NULL","NULL","NULL","Davis","UT","Western Grebe","NULL","00010","Western Grebe","Aechmophorus","occidentalis",2000-06-13,"Utah"
"2257","NULL","","1991","NULL","NULL","NULL","NULL","NULL","Sheridan","MT","American White Pelican","NULL","01250","American White Pelican","Pelecanus","erythrorhynchos",NA,"Montana"
"2258","NULL","","1992","NULL","NULL","NULL","NULL","NULL","Sheridan","MT","American White Pelican","NULL","01250","American White Pelican","Pelecanus","erythrorhynchos",NA,"Montana"
"2259","NULL","","1993","NULL","NULL","NULL","NULL","NULL","Sheridan","MT","American White Pelican","NULL","01250","American White Pelican","Pelecanus","erythrorhynchos",NA,"Montana"
"2260","NULL","","1994","NULL","NULL","NULL","NULL","NULL","Sheridan","MT","American White Pelican","NULL","01250","American White Pelican","Pelecanus","erythrorhynchos",NA,"Montana"
"2261","NULL","","1995","NULL","NULL","NULL","NULL","NULL","Sheridan","MT","American White Pelican","NULL","01250","American White Pelican","Pelecanus","erythrorhynchos",NA,"Montana"
"2262","NULL","","1996","NULL","NULL","NULL","NULL","NULL","Sheridan","MT","American White Pelican","NULL","01250","American White Pelican","Pelecanus","erythrorhynchos",NA,"Montana"
"2263","NULL","","1997","NULL","NULL","NULL","NULL","NULL","Sheridan","MT","American White Pelican","NULL","01250","American White Pelican","Pelecanus","erythrorhynchos",NA,"Montana"
"2264","NULL","","1998","NULL","NULL","NULL","NULL","NULL","Sheridan","MT","American White Pelican","NULL","01250","American White Pelican","Pelecanus","erythrorhynchos",NA,"Montana"
"2265","NULL","","1999","NULL","NULL","NULL","NULL","NULL","Sheridan","MT","American White Pelican","NULL","01250","American White Pelican","Pelecanus","erythrorhynchos",NA,"Montana"
"2266","NULL","","2000","NULL","NULL","NULL","NULL","NULL","Sheridan","MT","American White Pelican","NULL","01250","American White Pelican","Pelecanus","erythrorhynchos",NA,"Montana"
"2267","NULL","","2001","NULL","NULL","NULL","NULL","NULL","Sheridan","MT","American White Pelican","NULL","01250","American White Pelican","Pelecanus","erythrorhynchos",NA,"Montana"
"2268","NULL","","2002","NULL","NULL","NULL","NULL","NULL","Sheridan","MT","American White Pelican","NULL","01250","American White Pelican","Pelecanus","erythrorhynchos",NA,"Montana"
"2269","NULL","","2003","NULL","NULL","NULL","NULL","NULL","Sheridan","MT","American White Pelican","NULL","01250","American White Pelican","Pelecanus","erythrorhynchos",NA,"Montana"
"2270","NULL","","2004","NULL","NULL","NULL","NULL","NULL","Sheridan","MT","American White Pelican","NULL","01250","American White Pelican","Pelecanus","erythrorhynchos",NA,"Montana"
"2271","NULL","","2005","NULL","NULL","NULL","NULL","NULL","Sheridan","MT","American White Pelican","NULL","01250","American White Pelican","Pelecanus","erythrorhynchos",NA,"Montana"
"2272","NULL","","2006","NULL","NULL","NULL","NULL","NULL","Sheridan","MT","American White Pelican","NULL","01250","American White Pelican","Pelecanus","erythrorhynchos",NA,"Montana"
"2273","NULL","","2007","NULL","NULL","NULL","NULL","NULL","Sheridan","MT","American White Pelican","NULL","01250","American White Pelican","Pelecanus","erythrorhynchos",NA,"Montana"
"2274","NULL","","2008","NULL","NULL","NULL","NULL","NULL","Sheridan","MT","American White Pelican","NULL","01250","American White Pelican","Pelecanus","erythrorhynchos",NA,"Montana"
"2275","NULL","","1969","NULL","NULL","Marble","NULL","NULL","Hill","MT","Great Blue Heron","NULL","01940","Great Blue Heron","Ardea","herodias",NA,"Montana"
"2276","NULL","","1996","NULL","NULL","NULL","NULL","NULL","Phillips","MT","Black Tern","NULL","00770","Black Tern","Chlidonias","niger",NA,"Montana"
"2277","NULL","","1968","NULL","NULL","Hadden","NULL","NULL","Fergus","MT","Great Blue Heron","NULL","01940","Great Blue Heron","Ardea","herodias",NA,"Montana"
"2278","NULL","","1979","NULL","NULL","Hadden","NULL","NULL","Fergus","MT","Great Blue Heron","NULL","01940","Great Blue Heron","Ardea","herodias",NA,"Montana"
"2279","NULL","","1977","NULL","NULL","Hadden","NULL","NULL","Fergus","MT","Great Blue Heron","NULL","01940","Great Blue Heron","Ardea","herodias",NA,"Montana"
"2280","NULL","","1976","NULL","NULL","Hook","NULL","NULL","Chouteau","MT","Great Blue Heron","NULL","01940","Great Blue Heron","Ardea","herodias",NA,"Montana"
"2281","NULL","","1979","NULL","NULL","Hook","NULL","NULL","Chouteau","MT","Great Blue Heron","NULL","01940","Great Blue Heron","Ardea","herodias",NA,"Montana"
"2282","NULL","","1980","NULL","NULL","Billings","NULL","NULL","Phillips","MT","Great Blue Heron","NULL","01940","Great Blue Heron","Ardea","herodias",NA,"Montana"
"2283","NULL","","1988","NULL","NULL","Prellwitz","NULL","NULL","Phillips","MT","Common Tern","NULL","00700","Common Tern","Sterna","hirundo",NA,"Montana"
"2284","NULL","","1970","NULL","NULL","Moos","NULL","NULL","Blaine","MT","Double-crested Cormorant","NULL","01200","Double-crested Cormorant","Phalacrocorax","auritus",NA,"Montana"
"2285","NULL","","1981","NULL","NULL","Moos","NULL","NULL","Blaine","MT","Great Blue Heron","NULL","01940","Great Blue Heron","Ardea","herodias",NA,"Montana"
"2286","NULL","","1996","NULL","NULL","NULL","NULL","NULL","Blaine","MT","California Gull","NULL","00530","California Gull","Larus","californicus",NA,"Montana"
"2287","NULL","","1996","NULL","NULL","NULL","NULL","NULL","Blaine","MT","Forster's Tern","NULL","00690","Forster's Tern","Sterna","forsteri",NA,"Montana"
"2288","NULL","","1996","NULL","NULL","NULL","NULL","NULL","Blaine","MT","Ring-billed Gull","NULL","00540","Ring-billed Gull","Larus","delawarensis",NA,"Montana"
"2289","NULL","","1996","NULL","NULL","NULL","NULL","NULL","Teton","MT","Black Tern","NULL","00770","Black Tern","Chlidonias","niger",NA,"Montana"
"2290","NULL","","1983","NULL","NULL","NULL","NULL","NULL","Phillips","MT","Eared Grebe","NULL","00040","Eared Grebe","Podiceps","nigricollis",NA,"Montana"
"2291","NULL","","1996","NULL","NULL","NULL","NULL","NULL","Hill","MT","Forster's Tern","NULL","00690","Forster's Tern","Sterna","forsteri",NA,"Montana"
"2292","NULL","","1975","NULL","NULL","Hook","NULL","NULL","Park","MT","Great Blue Heron","NULL","01940","Great Blue Heron","Ardea","herodias",NA,"Montana"
"2293","NULL","","1979","NULL","NULL","Hills","NULL","NULL","Meagher","MT","Great Blue Heron","NULL","01940","Great Blue Heron","Ardea","herodias",NA,"Montana"
"2294","NULL","","1980","NULL","NULL","Ellis","NULL","NULL","Cascade","MT","Great Blue Heron","NULL","01940","Great Blue Heron","Ardea","herodias",NA,"Montana"
"2295","NULL","","1977","NULL","NULL","Fries","NULL","NULL","Garfield","MT","Double-crested Cormorant","NULL","01200","Double-crested Cormorant","Phalacrocorax","auritus",NA,"Montana"
"2296","NULL","","1978","NULL","NULL","Fries","NULL","NULL","Garfield","MT","Double-crested Cormorant","NULL","01200","Double-crested Cormorant","Phalacrocorax","auritus",NA,"Montana"
"2297","NULL","","1976","NULL","NULL","Thompson","NULL","NULL","Lewis & Clark","MT","Double-crested Cormorant","NULL","01200","Double-crested Cormorant","Phalacrocorax","auritus",NA,"Montana"
"2298","NULL","","1976","NULL","NULL","Thompson","NULL","NULL","Lewis & Clark","MT","Great Blue Heron","NULL","01940","Great Blue Heron","Ardea","herodias",NA,"Montana"
"2299","NULL","","1979","NULL","NULL","Marble","NULL","NULL","Liberty","MT","Double-crested Cormorant","NULL","01200","Double-crested Cormorant","Phalacrocorax","auritus",NA,"Montana"
"2300","NULL","","NULL","NULL","NULL","NULL","NULL","NULL","NULL","MT","Double-crested Cormorant","NULL","01200","Double-crested Cormorant","Phalacrocorax","auritus",NA,"Montana"
"2301","NULL","","1996","NULL","NULL","NULL","NULL","NULL","Blaine","MT","Forster's Tern","NULL","00690","Forster's Tern","Sterna","forsteri",NA,"Montana"
"2302","NULL","","1996","NULL","NULL","NULL","NULL","NULL","Valley","MT","Common Tern","NULL","00700","Common Tern","Sterna","hirundo",NA,"Montana"
"2303","NULL","","1996","NULL","NULL","NULL","NULL","NULL","Blaine","MT","Black Tern","NULL","00770","Black Tern","Chlidonias","niger",NA,"Montana"
"2304","NULL","","1979","NULL","NULL","Hadden","NULL","NULL","Chouteau","MT","Great Blue Heron","NULL","01940","Great Blue Heron","Ardea","herodias",NA,"Montana"
"2305","NULL","","1996","NULL","NULL","NULL","NULL","NULL","Valley","MT","Common Tern","NULL","00700","Common Tern","Sterna","hirundo",NA,"Montana"
"2306","NULL","","1996","NULL","NULL","NULL","NULL","NULL","Valley","MT","Common Tern","NULL","00700","Common Tern","Sterna","hirundo",NA,"Montana"
"2307","5/24/2010","00:00.0","2010","5","24","Watson","NULL","NULL","Rio Arriba","NM","Double-crested Cormorant","NULL","01200","Double-crested Cormorant","Phalacrocorax","auritus",2010-05-24,"New Mexico"
"2308","6/9/2010","00:00.0","2010","6","9","Joseph","NULL","NULL","Bernalillo","NM","Black-crowned Night-Heron","NULL","02020","Black-crowned Night-Heron","Nycticorax","nycticorax",2010-06-09,"New Mexico"
"2309","6/12/2010","00:00.0","2010","6","12","Neely/Liddell","NULL","NULL","Bernalillo","NM","Cattle Egret","NULL","02001","Cattle Egret","Bubulcus","ibis",2010-06-12,"New Mexico"
"2310","6/12/2010","00:00.0","2010","6","12","Neely/Liddell","NULL","NULL","Bernalillo","NM","Snowy Egret","(NAD83)","01970","Snowy Egret","Egretta","thula",2010-06-12,"New Mexico"
"2311","5/20/2010","00:00.0","2010","5","20","Williams III","NULL","NULL","Catron","NM","Great Blue Heron","NULL","01940","Great Blue Heron","Ardea","herodias",2010-05-20,"New Mexico"
"2312","4/17/2011","00:00.0","2011","4","17","Newman","NULL","NULL","San Juan","NM","Great Blue Heron","(NAD83)","01940","Great Blue Heron","Ardea","herodias",2011-04-17,"New Mexico"
"2313","6/10/2010","00:00.0","2010","6","10","Liddell","NULL","NULL","Valencia","NM","Black-crowned Night-Heron","NULL","02020","Black-crowned Night-Heron","Nycticorax","nycticorax",2010-06-10,"New Mexico"
"2314","6/10/2010","00:00.0","2010","6","10","Liddell","NULL","NULL","Valencia","NM","Cattle Egret","NULL","02001","Cattle Egret","Bubulcus","ibis",2010-06-10,"New Mexico"
"2315","6/10/2010","00:00.0","2010","6","10","Liddell","NULL","NULL","Valencia","NM","Snowy Egret","NULL","01970","Snowy Egret","Egretta","thula",2010-06-10,"New Mexico"
"2316","3/18/2011","00:00.0","2011","3","18","Chopp","NULL","NULL","Eddy","NM","Great Blue Heron","NULL","01940","Great Blue Heron","Ardea","herodias",2011-03-18,"New Mexico"
"2317","5/13/2011","00:00.0","2011","5","13","Howe","NULL","NULL","Rio Arriba","NM","Great Blue Heron","NULL","01940","Great Blue Heron","Ardea","herodias",2011-05-13,"New Mexico"
"2318","4/5/2011","00:00.0","2011","4","5","Howe","NULL","NULL","Mora","NM","Great Blue Heron","NULL","01940","Great Blue Heron","Ardea","herodias",2011-04-05,"New Mexico"
"2319","4/27/2010","00:00.0","2010","4","27","Howe","NULL","NULL","Curry","NM","Double-crested Cormorant","NULL","01200","Double-crested Cormorant","Phalacrocorax","auritus",2010-04-27,"New Mexico"
"2320","5/19/2010","00:00.0","2010","5","19","Watson","NULL","NULL","Socorro","NM","Double-crested or Neotropic Cormorant","","NULL",NA,NA,NA,2010-05-19,"New Mexico"
"2321","6/20/2010","00:00.0","2010","6","20","Murphy","NULL","NULL","Socorro","NM","Black-crowned Night-Heron","NULL","02020","Black-crowned Night-Heron","Nycticorax","nycticorax",2010-06-20,"New Mexico"
"2322","6/20/2010","00:00.0","2010","6","20","Murphy","NULL","NULL","Socorro","NM","Great Blue Heron","NULL","01940","Great Blue Heron","Ardea","herodias",2010-06-20,"New Mexico"
"2323","6/20/2010","00:00.0","2010","6","20","Murphy","NULL","NULL","Socorro","NM","Snowy Egret","NULL","01970","Snowy Egret","Egretta","thula",2010-06-20,"New Mexico"
"2324","6/20/2010","00:00.0","2010","6","20","Murphy","NULL","NULL","Socorro","NM","Double-crested or Neotropic Cormorant","","NULL",NA,NA,NA,2010-06-20,"New Mexico"
"2325","6/20/2010","00:00.0","2010","6","20","Murphy","NULL","NULL","Socorro","NM","Great Egret","NULL","01960","Great Egret","Ardea","alba",2010-06-20,"New Mexico"
"2326","6/20/2010","00:00.0","2010","6","20","Murphy","NULL","NULL","Socorro","NM","Snowy Egret","NULL","01970","Snowy Egret","Egretta","thula",2010-06-20,"New Mexico"
"2327","5/19/2010","00:00.0","2010","5","19","Watson","NULL","NULL","Socorro","NM","Double-crested or Neotropic Cormorant","","NULL",NA,NA,NA,2010-05-19,"New Mexico"
"2328","6/20/2010","00:00.0","2010","6","20","Murphy","NULL","NULL","Socorro","NM","Double-crested Cormorant","NULL","01200","Double-crested Cormorant","Phalacrocorax","auritus",2010-06-20,"New Mexico"
"2329","6/20/2010","00:00.0","2010","6","20","Murphy","NULL","NULL","Socorro","NM","Great Blue Heron","(NAD27)","01940","Great Blue Heron","Ardea","herodias",2010-06-20,"New Mexico"
"2330","6/20/2010","00:00.0","2010","6","20","Murphy","NULL","NULL","Sierra","NM","Black-crowned Night-Heron","NULL","02020","Black-crowned Night-Heron","Nycticorax","nycticorax",2010-06-20,"New Mexico"
"2331","6/20/2010","00:00.0","2010","6","20","Murphy","NULL","NULL","Sierra","NM","Cattle Egret","NULL","02001","Cattle Egret","Bubulcus","ibis",2010-06-20,"New Mexico"
"2332","6/20/2010","00:00.0","2010","6","20","Murphy","NULL","NULL","Sierra","NM","Double-crested Cormorant","NULL","01200","Double-crested Cormorant","Phalacrocorax","auritus",2010-06-20,"New Mexico"
"2333","6/20/2010","00:00.0","2010","6","20","Murphy","NULL","NULL","Sierra","NM","Great Blue Heron","(NAD83)","01940","Great Blue Heron","Ardea","herodias",2010-06-20,"New Mexico"
"2334","6/20/2010","00:00.0","2010","6","20","Murphy","NULL","NULL","Sierra","NM","Great Egret","NULL","01960","Great Egret","Ardea","alba",2010-06-20,"New Mexico"
"2335","6/20/2010","00:00.0","2010","6","20","Murphy","NULL","NULL","Sierra","NM","Snowy Egret","NULL","01970","Snowy Egret","Egretta","thula",2010-06-20,"New Mexico"
"2336","5/19/2010","00:00.0","2010","5","19","Watson","NULL","NULL","Sierra","NM","Double-crested or Neotropic Cormorant","","NULL",NA,NA,NA,2010-05-19,"New Mexico"
"2337","3/4/2011","00:00.0","2011","3","4","Walkup","NULL","NULL","Grant","NM","Great Blue Heron","NULL","01940","Great Blue Heron","Ardea","herodias",2011-03-04,"New Mexico"
"2338","6/22/2010","00:00.0","2010","6","22","Williams III","NULL","NULL","Grant","NM","Great Blue Heron","NULL","01940","Great Blue Heron","Ardea","herodias",2010-06-22,"New Mexico"
"2339","7/19/2010","00:00.0","2010","7","19","Stahlecker","NULL","NULL","Rio Arriba","NM","Eared Grebe","NULL","00040","Eared Grebe","Podiceps","nigricollis",2010-07-19,"New Mexico"
"2340","7/19/2010","00:00.0","2010","7","19","Stahlecker","NULL","NULL","Rio Arriba","NM","Western Grebe","NULL","00010","Western Grebe","Aechmophorus","occidentalis",2010-07-19,"New Mexico"
"2341","3/22/2011","00:00.0","2011","3","22","Chopp","NULL","NULL","Eddy","NM","Great Blue Heron","NULL","01940","Great Blue Heron","Ardea","herodias",2011-03-22,"New Mexico"
"2342","7/15/2010","00:00.0","2010","7","15","Roper","NULL","NULL","Doa Ana","NM","Cattle Egret","NULL","02001","Cattle Egret","Bubulcus","ibis",2010-07-15,"New Mexico"
"2343","6/3/2010","00:00.0","2010","6","3","Griffin","NULL","NULL","Doa Ana","NM","Black-crowned Night-Heron","(NAD83)","02020","Black-crowned Night-Heron","Nycticorax","nycticorax",2010-06-03,"New Mexico"
"2344","5/25/2010","00:00.0","2010","5","25","Watson","NULL","NULL","San Juan","NM","Great Blue Heron","NULL","01940","Great Blue Heron","Ardea","herodias",2010-05-25,"New Mexico"
"2345","6/21/2011","00:00.0","2011","6","21","Reeves","NULL","NULL","San Juan","NM","Great Blue Heron","NULL","01940","Great Blue Heron","Ardea","herodias",2011-06-21,"New Mexico"
"2346","NULL","","2009","NULL","NULL","Reeves","NULL","NULL","San Juan","NM","Great Blue Heron","SurveyDate: Summer 2009","01940","Great Blue Heron","Ardea","herodias",NA,"New Mexico"
"2347","5/22/2010","00:00.0","2010","5","22","Williams III","NULL","NULL","Grant","NM","Great Blue Heron","NULL","01940","Great Blue Heron","Ardea","herodias",2010-05-22,"New Mexico"
"2348","5/2/2011","00:00.0","2011","5","2","Chopp","NULL","NULL","Eddy","NM","Great Blue Heron","NULL","01940","Great Blue Heron","Ardea","herodias",2011-05-02,"New Mexico"
"2349","5/20/2010","00:00.0","2010","5","20","Williams III","NULL","NULL","Catron","NM","Great Blue Heron","(NAD83)","01940","Great Blue Heron","Ardea","herodias",2010-05-20,"New Mexico"
"2350","NULL","","2009","8","NULL","West","NULL","NULL","San Miguel","NM","Clark's Grebe","NULL","00011","Clark's Grebe","Aechmophorus","clarkii",NA,"New Mexico"
"2351","6/10/2009","00:00.0","2009","6","10","Mumford","NULL","NULL","Guadalupe","NM","Double-crested Cormorant","NULL","01200","Double-crested Cormorant","Phalacrocorax","auritus",2009-06-10,"New Mexico"
"2352","5/31/2010","00:00.0","2010","5","31","Howe","NULL","NULL","Guadalupe","NM","Double-crested Cormorant","NULL","01200","Double-crested Cormorant","Phalacrocorax","auritus",2010-05-31,"New Mexico"
"2353","5/21/2010","00:00.0","2010","5","21","Williams III","NULL","NULL","Catron","NM","Great Blue Heron","NULL","01940","Great Blue Heron","Ardea","herodias",2010-05-21,"New Mexico"
"2354","5/20/2010","00:00.0","2010","5","20","Stahlecker","NULL","NULL","Rio Arriba","NM","Western Grebe","NULL","00010","Western Grebe","Aechmophorus","occidentalis",2010-05-20,"New Mexico"
"2355","7/19/2010","00:00.0","2010","7","19","Stahlecker","NULL","NULL","Rio Arriba","NM","Eared Grebe","NULL","00040","Eared Grebe","Podiceps","nigricollis",2010-07-19,"New Mexico"
"2356","8/10/2010","00:00.0","2010","8","10","Watson","NULL","NULL","Colfax","NM","Western or Clark's Grebe","","NULL",NA,NA,NA,2010-08-10,"New Mexico"
"2357","9/22/2010","00:00.0","2010","9","22","Howe","NULL","NULL","Colfax","NM","Clark's Grebe","NULL","00011","Clark's Grebe","Aechmophorus","clarkii",2010-09-22,"New Mexico"
"2358","9/22/2010","00:00.0","2010","9","22","Howe","NULL","NULL","Colfax","NM","Western Grebe","NULL","00010","Western Grebe","Aechmophorus","occidentalis",2010-09-22,"New Mexico"
"2359","5/26/2010","00:00.0","2010","5","26","Watson","NULL","NULL","Mora","NM","Great Blue Heron","NULL","01940","Great Blue Heron","Ardea","herodias",2010-05-26,"New Mexico"
"2360","4/5/2011","00:00.0","2011","4","5","Howe","NULL","NULL","Mora","NM","Double-crested Cormorant","NULL","01200","Double-crested Cormorant","Phalacrocorax","auritus",2011-04-05,"New Mexico"
"2361","4/5/2011","00:00.0","2011","4","5","Howe","NULL","NULL","Mora","NM","Great Blue Heron","(NAD83)","01940","Great Blue Heron","Ardea","herodias",2011-04-05,"New Mexico"
"2362","NULL","","1986","NULL","NULL","Downer","NULL","NULL","San Juan","NM","Great Blue Heron","SurveyDate: 4/10-5/10/1986","01940","Great Blue Heron","Ardea","herodias",NA,"New Mexico"
"2363","6/28/1980","00:00.0","1980","6","28","Peterson et al.","NULL","NULL","Rio Arriba","NM","Double-crested Cormorant","NULL","01200","Double-crested Cormorant","Phalacrocorax","auritus",1980-06-28,"New Mexico"
"2364","6/26/1981","00:00.0","1981","6","26","Hundertmark","NULL","NULL","Rio Arriba","NM","Double-crested Cormorant","NULL","01200","Double-crested Cormorant","Phalacrocorax","auritus",1981-06-26,"New Mexico"
"2365","6/24/1984","00:00.0","1984","6","24","Vaught","NULL","NULL","Rio Arriba","NM","Double-crested Cormorant","NULL","01200","Double-crested Cormorant","Phalacrocorax","auritus",1984-06-24,"New Mexico"
"2366","3/25/1985","00:00.0","1985","3","25","Domenici","NULL","NULL","Rio Arriba","NM","Double-crested Cormorant","NULL","01200","Double-crested Cormorant","Phalacrocorax","auritus",1985-03-25,"New Mexico"
"2367","6/7/1987","00:00.0","1987","6","7","Insley","NULL","NULL","Rio Arriba","NM","Double-crested Cormorant","NULL","01200","Double-crested Cormorant","Phalacrocorax","auritus",1987-06-07,"New Mexico"
"2368","5/23/1991","00:00.0","1991","5","23","Hubbard","NULL","NULL","Rio Arriba","NM","Double-crested Cormorant","NULL","01200","Double-crested Cormorant","Phalacrocorax","auritus",1991-05-23,"New Mexico"
"2369","6/19/2987","00:00.0","2987","6","19","Rustay","NULL","NULL","Rio Arriba","NM","Great Blue Heron","SurveyDate: 6/2 and 7/2/1993","01940","Great Blue Heron","Ardea","herodias",2987-06-19,"New Mexico"
"2370","NULL","","1993","NULL","NULL","Hubbard/Rustay","NULL","NULL","Rio Arriba","NM","Double-crested Cormorant","NULL","01200","Double-crested Cormorant","Phalacrocorax","auritus",NA,"New Mexico"
"2371","4/8/1984","00:00.0","1984","4","8","Hubbard","NULL","NULL","Catron","NM","Great Blue Heron","NULL","01940","Great Blue Heron","Ardea","herodias",1984-04-08,"New Mexico"
"2372","NULL","","1981","NULL","NULL","Fisher","NULL","NULL","Catron","NM","Great Blue Heron","SurveyDate: summer 1981","01940","Great Blue Heron","Ardea","herodias",NA,"New Mexico"
"2373","8/19/1995","00:00.0","1995","8","19","Zimmer","NULL","NULL","Dona Ana","NM","Cattle Egret","NULL","02001","Cattle Egret","Bubulcus","ibis",1995-08-19,"New Mexico"
"2374","4/27/1997","00:00.0","1997","4","27","Paton","NULL","NULL","Dona Ana","NM","Black-crowned Night-Heron","NULL","02020","Black-crowned Night-Heron","Nycticorax","nycticorax",1997-04-27,"New Mexico"
"2375","4/27/1997","00:00.0","1997","4","27","Paton","NULL","NULL","Dona Ana","NM","Cattle Egret","NULL","02001","Cattle Egret","Bubulcus","ibis",1997-04-27,"New Mexico"
"2376","4/27/1997","00:00.0","1997","4","27","Paton","NULL","NULL","Dona Ana","NM","Snowy Egret","NULL","01970","Snowy Egret","Egretta","thula",1997-04-27,"New Mexico"
"2377","5/28/1998","00:00.0","1998","5","28","Ewing","NULL","NULL","Dona Ana","NM","Cattle Egret","NULL","02001","Cattle Egret","Bubulcus","ibis",1998-05-28,"New Mexico"
"2378","5/1/2007","00:00.0","2007","5","1","Lewis","NULL","NULL","Catron","NM","Great Blue Heron","NAD 83","01940","Great Blue Heron","Ardea","herodias",2007-05-01,"New Mexico"
"2379","NULL","","1987","NULL","NULL","Cook","NULL","NULL","Union","NM","Great Blue Heron","SurveyDate: summer 1987","01940","Great Blue Heron","Ardea","herodias",NA,"New Mexico"
"2380","NULL","","1988","NULL","NULL","Cook","NULL","NULL","Union","NM","Great Blue Heron","SurveyDate: summer 1988","01940","Great Blue Heron","Ardea","herodias",NA,"New Mexico"
"2381","5/5/1980","00:00.0","1980","5","5","Howe","NULL","NULL","Eddy","NM","Black-crowned Night-Heron","NULL","02020","Black-crowned Night-Heron","Nycticorax","nycticorax",1980-05-05,"New Mexico"
"2382","5/24/1980","00:00.0","1980","5","24","Howe","NULL","NULL","Eddy","NM","Black-crowned Night-Heron","NULL","02020","Black-crowned Night-Heron","Nycticorax","nycticorax",1980-05-24,"New Mexico"
"2383","5/24/1980","00:00.0","1980","5","24","Howe","NULL","NULL","Eddy","NM","Snowy Egret","NULL","01970","Snowy Egret","Egretta","thula",1980-05-24,"New Mexico"
"2384","3/29/1981","00:00.0","1981","3","29","Hunter","NULL","NULL","Eddy","NM","Snowy Egret","NULL","01970","Snowy Egret","Egretta","thula",1981-03-29,"New Mexico"
"2385","6/17/1988","00:00.0","1988","6","17","West","NULL","NULL","Eddy","NM","Cattle Egret","NULL","02001","Cattle Egret","Bubulcus","ibis",1988-06-17,"New Mexico"
"2386","6/19/1991","00:00.0","1991","6","19","Williams","NULL","NULL","Eddy","NM","Black-crowned Night-Heron","NULL","02020","Black-crowned Night-Heron","Nycticorax","nycticorax",1991-06-19,"New Mexico"
"2387","6/19/1991","00:00.0","1991","6","19","Williams","NULL","NULL","Eddy","NM","Cattle Egret","NULL","02001","Cattle Egret","Bubulcus","ibis",1991-06-19,"New Mexico"
"2388","6/19/1991","00:00.0","1991","6","19","Williams","NULL","NULL","Eddy","NM","Little Blue Heron","NULL","02000","Little Blue Heron","Egretta","caerulea",1991-06-19,"New Mexico"
"2389","6/19/1991","00:00.0","1991","6","19","Williams","NULL","NULL","Eddy","NM","Snowy Egret","NULL","01970","Snowy Egret","Egretta","thula",1991-06-19,"New Mexico"
"2390","7/4/1994","00:00.0","1994","7","4","Livingston","NULL","NULL","Eddy","NM","Black-crowned Night-Heron","NULL","02020","Black-crowned Night-Heron","Nycticorax","nycticorax",1994-07-04,"New Mexico"
"2391","7/4/1994","00:00.0","1994","7","4","Livingston","NULL","NULL","Eddy","NM","Cattle Egret","NULL","02001","Cattle Egret","Bubulcus","ibis",1994-07-04,"New Mexico"
"2392","7/4/1994","00:00.0","1994","7","4","Livingston","NULL","NULL","Eddy","NM","Snowy Egret","NULL","01970","Snowy Egret","Egretta","thula",1994-07-04,"New Mexico"
"2393","NULL","","1988","NULL","NULL","fide Williams","NULL","NULL","Eddy","NM","Snowy Egret","SurveyDate: summer 1988","01970","Snowy Egret","Egretta","thula",NA,"New Mexico"
"2394","NULL","","1995","NULL","NULL","fide Williams","NULL","NULL","Eddy","NM","Snowy Egret","SurveyDate: summer 1995","01970","Snowy Egret","Egretta","thula",NA,"New Mexico"
"2395","6/10/1983","00:00.0","1983","6","10","Howe","NULL","NULL","Valencia","NM","Cattle Egret","NULL","02001","Cattle Egret","Bubulcus","ibis",1983-06-10,"New Mexico"
"2396","NULL","","1982","NULL","NULL","Howe/Hundertmark","NULL","NULL","Valencia","NM","Black-crowned Night-Heron","SurveyDate: spring 1982","02020","Black-crowned Night-Heron","Nycticorax","nycticorax",NA,"New Mexico"
"2397","NULL","","1982","NULL","NULL","Howe/Hundertmark","NULL","NULL","Valencia","NM","Snowy Egret","SurveyDate: spring 1982","01970","Snowy Egret","Egretta","thula",NA,"New Mexico"
"2398","NULL","","1984","NULL","NULL","Howe","NULL","NULL","Valencia","NM","Cattle Egret","SurveyDate: summer 1984","02001","Cattle Egret","Bubulcus","ibis",NA,"New Mexico"
"2399","NULL","","1984","NULL","NULL","Howe","NULL","NULL","Valencia","NM","Little Blue Heron","SurveyDate: summer 1984","02000","Little Blue Heron","Egretta","caerulea",NA,"New Mexico"
"2400","6/16/1972","00:00.0","1972","6","16","Boggs/Corrie","NULL","NULL","Chaves","NM","Black-crowned Night-Heron","NULL","02020","Black-crowned Night-Heron","Nycticorax","nycticorax",1972-06-16,"New Mexico"
"2401","NULL","","1970","NULL","NULL","fide Williams","NULL","NULL","Chaves","NM","Snowy Egret","SurveyDate: summer 1970","01970","Snowy Egret","Egretta","thula",NA,"New Mexico"
"2402","NULL","","1971","NULL","NULL","Boggs","NULL","NULL","Chaves","NM","Black-crowned Night-Heron","SurveyDate: summer 1971","02020","Black-crowned Night-Heron","Nycticorax","nycticorax",NA,"New Mexico"
"2403","NULL","","1992","NULL","NULL","Marlatt/Williams","NULL","NULL","Chaves","NM","Forster's Tern","SurveyDate: 5/25-6/24/1992","00690","Forster's Tern","Sterna","forsteri",NA,"New Mexico"
"2404","NULL","","NULL","NULL","NULL","NULL","NULL","NULL","Chaves","NM","Least Tern","SurveyDate: summers","00740","Least Tern","Sternula","antillarum",NA,"New Mexico"
"2405","8/17/1999","00:00.0","1999","8","17","Williams/Mehlhop","NULL","NULL","Colfax","NM","Eared Grebe","NULL","00040","Eared Grebe","Podiceps","nigricollis",1999-08-17,"New Mexico"
"2406","7/27/1987","00:00.0","1987","7","27","Cleary","NULL","NULL","McKinley","NM","Eared Grebe","NULL","00040","Eared Grebe","Podiceps","nigricollis",1987-07-27,"New Mexico"
"2407","7/27/1995","00:00.0","1995","7","27","Cleary/Albert","NULL","NULL","McKinley","NM","Eared Grebe","NULL","00040","Eared Grebe","Podiceps","nigricollis",1995-07-27,"New Mexico"
"2408","7/2/2004","00:00.0","2004","7","2","Tanner fide Reeves","NULL","NULL","San Juan","NM","Great Blue Heron","NAD 83","01940","Great Blue Heron","Ardea","herodias",2004-07-02,"New Mexico"
"2409","9/3/1988","00:00.0","1988","9","3","Cleary","NULL","NULL","Cibola/McKinley","NM","Eared Grebe","NULL","00040","Eared Grebe","Podiceps","nigricollis",1988-09-03,"New Mexico"
"2410","8/25/1997","00:00.0","1997","8","25","Snider/West","NULL","NULL","Socorro","NM","Clark's Grebe","NULL","00011","Clark's Grebe","Aechmophorus","clarkii",1997-08-25,"New Mexico"
"2411","7/9/2005","00:00.0","2005","7","9","NULL","NULL","NULL","Socorro","NM","Clark's Grebe","NULL","00011","Clark's Grebe","Aechmophorus","clarkii",2005-07-09,"New Mexico"
"2412","7/19/2005","00:00.0","2005","7","19","Rustay","NULL","NULL","Socorro","NM","Western Grebe","NULL","00010","Western Grebe","Aechmophorus","occidentalis",2005-07-19,"New Mexico"
"2413","8/1/2006","00:00.0","2006","8","1","Lundblad","NULL","NULL","Socorro","NM","Clark's Grebe","NULL","00011","Clark's Grebe","Aechmophorus","clarkii",2006-08-01,"New Mexico"
"2414","7/30/2000","00:00.0","2000","7","30","Rustay","NULL","NULL","Socorro","NM","Great Blue Heron","NULL","01940","Great Blue Heron","Ardea","herodias",2000-07-30,"New Mexico"
"2415","5/29/2003","00:00.0","2003","5","29","Ewing","NULL","NULL","Socorro","NM","Great Blue Heron","NULL","01940","Great Blue Heron","Ardea","herodias",2003-05-29,"New Mexico"
"2416","4/11/2004","00:00.0","2004","4","11","Neville/Shipman","NULL","NULL","Socorro","NM","Great Blue Heron","NULL","01940","Great Blue Heron","Ardea","herodias",2004-04-11,"New Mexico"
"2417","3/26/2005","00:00.0","2005","3","26","Rustay","NULL","NULL","Socorro","NM","Great Blue Heron","NULL","01940","Great Blue Heron","Ardea","herodias",2005-03-26,"New Mexico"
"2418","7/12/1994","00:00.0","1994","7","12","Leal et al.","NULL","NULL","Socorro","NM","Black-crowned Night-Heron","NULL","02020","Black-crowned Night-Heron","Nycticorax","nycticorax",1994-07-12,"New Mexico"
"2419","7/12/1994","00:00.0","1994","7","12","Leal et al.","NULL","NULL","Socorro","NM","Cattle Egret","NULL","02001","Cattle Egret","Bubulcus","ibis",1994-07-12,"New Mexico"
"2420","7/12/1994","00:00.0","1994","7","12","Leal et al.","NULL","NULL","Socorro","NM","Great Egret","NULL","01960","Great Egret","Ardea","alba",1994-07-12,"New Mexico"
"2421","7/12/1994","00:00.0","1994","7","12","Leal et al.","NULL","NULL","Socorro","NM","Snowy Egret","NULL","01970","Snowy Egret","Egretta","thula",1994-07-12,"New Mexico"
"2422","7/18/1994","00:00.0","1994","7","18","Leal","NULL","NULL","Socorro","NM","White-faced Ibis","NULL","01870","White-faced Ibis","Plegadis","chihi",1994-07-18,"New Mexico"
"2423","4/27/1996","00:00.0","1996","4","27","Rustay","NULL","NULL","Socorro","NM","Great Egret","NULL","01960","Great Egret","Ardea","alba",1996-04-27,"New Mexico"
"2424","7/19/1996","00:00.0","1996","7","19","Rustay","NULL","NULL","Socorro","NM","Neotropic Cormorant","NULL","01210","Neotropic Cormorant","Phalacrocorax","brasilianus",1996-07-19,"New Mexico"
"2425","NULL","","1994","7","NULL","Leal et al.","NULL","NULL","Socorro","NM","Neotropic Cormorant","SurveyDate: 7/12 & 18/1994","01210","Neotropic Cormorant","Phalacrocorax","brasilianus",NA,"New Mexico"
"2426","NULL","","1996","7","NULL","Rustay and Ewing","NULL","NULL","Socorro","NM","Great Egret","SurveyDate: 7/9 & 19/1996","01960","Great Egret","Ardea","alba",NA,"New Mexico"
"2427","NULL","","1997","6","NULL","Howe","NULL","NULL","Valencia","NM","Black-crowned Night-Heron","SurveyDate: 6/1997","02020","Black-crowned Night-Heron","Nycticorax","nycticorax",NA,"New Mexico"
"2428","NULL","","1997","6","NULL","Howe","NULL","NULL","Valencia","NM","Snowy Egret","SurveyDate: 6/1997","01970","Snowy Egret","Egretta","thula",NA,"New Mexico"
"2429","NULL","","1998","6","NULL","USDA Wildlife Services, fide Howe","NULL","NULL","Valencia","NM","Black-crowned Night-Heron","SurveyDate: 6/1998","02020","Black-crowned Night-Heron","Nycticorax","nycticorax",NA,"New Mexico"
"2430","NULL","","1998","6","NULL","USDA Wildlife Services, fide Howe","NULL","NULL","Valencia","NM","Snowy Egret","SurveyDate:  6/1998","01970","Snowy Egret","Egretta","thula",NA,"New Mexico"
"2431","NULL","","2004","NULL","NULL","Howe et al.","NULL","NULL","Eddy","NM","Least Tern","SurveyDate: summer 2004","00740","Least Tern","Sternula","antillarum",NA,"New Mexico"
"2432","NULL","","1968","6","NULL","Hubbard","NULL","NULL","Grant","NM","Black-crowned Night-Heron","SurveyDate: 6/22 & 25/1968","02020","Black-crowned Night-Heron","Nycticorax","nycticorax",NA,"New Mexico"
"2433","6/29/1974","00:00.0","1974","6","29","Hundertmark","NULL","NULL","Rio Arriba","NM","Eared Grebe","NULL","00040","Eared Grebe","Podiceps","nigricollis",1974-06-29,"New Mexico"
"2434","7/5/1975","00:00.0","1975","7","5","Hundertmark","NULL","NULL","Rio Arriba","NM","Eared Grebe","NULL","00040","Eared Grebe","Podiceps","nigricollis",1975-07-05,"New Mexico"
"2435","7/5/1975","00:00.0","1975","7","5","Hundertmark","NULL","NULL","Rio Arriba","NM","Western Grebe","NULL","00010","Western Grebe","Aechmophorus","occidentalis",1975-07-05,"New Mexico"
"2436","NULL","","1987","6","NULL","Stahlecker","NULL","NULL","Rio Arriba","NM","Western Grebe","NULL","00010","Western Grebe","Aechmophorus","occidentalis",NA,"New Mexico"
"2437","7/15/1989","00:00.0","1989","7","15","Lewis","NULL","NULL","Rio Arriba","NM","Eared Grebe","NULL","00040","Eared Grebe","Podiceps","nigricollis",1989-07-15,"New Mexico"
"2438","7/15/1990","00:00.0","1990","7","15","Stahlecker","NULL","NULL","Rio Arriba","NM","White-faced Ibis","NULL","01870","White-faced Ibis","Plegadis","chihi",1990-07-15,"New Mexico"
"2439","6/13/1992","00:00.0","1992","6","13","Stahlecker","NULL","NULL","Rio Arriba","NM","Black-crowned Night-Heron","NULL","02020","Black-crowned Night-Heron","Nycticorax","nycticorax",1992-06-13,"New Mexico"
"2440","6/13/1992","00:00.0","1992","6","13","Stahlecker","NULL","NULL","Rio Arriba","NM","White-faced Ibis","NULL","01870","White-faced Ibis","Plegadis","chihi",1992-06-13,"New Mexico"
"2441","7/10/1993","00:00.0","1993","7","10","Stahlecker","NULL","NULL","Rio Arriba","NM","Eared Grebe","NULL","00040","Eared Grebe","Podiceps","nigricollis",1993-07-10,"New Mexico"
"2442","6/11/1994","00:00.0","1994","6","11","Stahlecker","NULL","NULL","Rio Arriba","NM","Eared Grebe","NULL","00040","Eared Grebe","Podiceps","nigricollis",1994-06-11,"New Mexico"
"2443","6/11/1994","00:00.0","1994","6","11","Stahlecker","NULL","NULL","Rio Arriba","NM","Western Grebe","NULL","00010","Western Grebe","Aechmophorus","occidentalis",1994-06-11,"New Mexico"
"2444","6/28/1994","00:00.0","1994","6","28","Stahlecker","NULL","NULL","Rio Arriba","NM","White-faced Ibis","NULL","01870","White-faced Ibis","Plegadis","chihi",1994-06-28,"New Mexico"
"1317","5/14/2010","00:00.0","2010","5","14","Spicer","NULL","NULL","Kootenai","ID","Great Blue Heron","NULL","01940","Great Blue Heron","Ardea","herodias",2010-05-14,"Idaho"
"1318","4/21/2009","00:00.0","2009","4","21","Sauder/Gray","NULL","NULL","Nez Perce","ID","Great Blue Heron","NULL","01940","Great Blue Heron","Ardea","herodias",2009-04-21,"Idaho"
"1319","4/21/2009","00:00.0","2009","4","21","Gray/Sauder","NULL","NULL","Idaho","ID","Great Blue Heron","NULL","01940","Great Blue Heron","Ardea","herodias",2009-04-21,"Idaho"
"1320","4/21/2009","00:00.0","2009","4","21","Sauder/Gray","NULL","NULL","Nez Perce","ID","Great Blue Heron","NULL","01940","Great Blue Heron","Ardea","herodias",2009-04-21,"Idaho"
"1321","4/21/2009","00:00.0","2009","4","21","Sauder/Gray","NULL","NULL","Nez Perce","ID","Great Blue Heron","NULL","01940","Great Blue Heron","Ardea","herodias",2009-04-21,"Idaho"
"1322","4/21/2009","00:00.0","2009","4","21","Sauder/Gray","NULL","NULL","Nez Perce","ID","Great Blue Heron","NULL","01940","Great Blue Heron","Ardea","herodias",2009-04-21,"Idaho"
"1323","5/19/2009","00:00.0","2009","5","19","Nielson et al.","NULL","NULL","Kootenai","ID","Great Blue Heron","NULL","01940","Great Blue Heron","Ardea","herodias",2009-05-19,"Idaho"
"1324","5/12/2010","00:00.0","2010","5","12","Spicer","NULL","NULL","Kootenai","ID","Great Blue Heron","NULL","01940","Great Blue Heron","Ardea","herodias",2010-05-12,"Idaho"
"1325","5/19/2009","00:00.0","2009","5","19","Nielson et al.","NULL","NULL","Kootenai","ID","Great Blue Heron","NULL","01940","Great Blue Heron","Ardea","herodias",2009-05-19,"Idaho"
"1326","6/4/2009","00:00.0","2009","6","4","Biesen","NULL","NULL","Oneida","ID","Great Blue Heron","NULL","01940","Great Blue Heron","Ardea","herodias",2009-06-04,"Idaho"
"1327","5/13/2009","00:00.0","2009","5","13","Wakkinen","NULL","NULL","Boundary","ID","Great Blue Heron","NULL","01940","Great Blue Heron","Ardea","herodias",2009-05-13,"Idaho"
"1328","7/24/2010","00:00.0","2010","7","24","N/A","NULL","NULL","Canyon","ID","Western Grebe","NULL","00010","Western Grebe","Aechmophorus","occidentalis",2010-07-24,"Idaho"
"1329","8/2/2010","00:00.0","2010","8","2","N/A","NULL","NULL","Canyon","ID","Western Grebe","NULL","00010","Western Grebe","Aechmophorus","occidentalis",2010-08-02,"Idaho"
"1330","8/10/2010","00:00.0","2010","8","10","N/A","NULL","NULL","Canyon","ID","Western Grebe","NULL","00010","Western Grebe","Aechmophorus","occidentalis",2010-08-10,"Idaho"
"1331","5/15/2009","00:00.0","2009","5","15","Zerigue","NULL","NULL","Canyon","ID","Great Egret","NULL","01960","Great Egret","Ardea","alba",2009-05-15,"Idaho"
"1332","5/15/2009","00:00.0","2009","5","15","Zerigue","NULL","NULL","Canyon","ID","Great Blue Heron","NULL","01940","Great Blue Heron","Ardea","herodias",2009-05-15,"Idaho"
"1333","7/15/2010","00:00.0","2010","7","15","Ehlers/Runco","NULL","NULL","Owyhee","ID","White-faced Ibis","NULL","01870","White-faced Ibis","Plegadis","chihi",2010-07-15,"Idaho"
"1334","7/15/2010","00:00.0","2010","7","15","Ehlers/Runco","NULL","NULL","Owyhee","ID","Snowy Egret","NULL","01970","Snowy Egret","Egretta","thula",2010-07-15,"Idaho"
"1335","7/15/2010","00:00.0","2010","7","15","Ehlers/Runco","NULL","NULL","Owyhee","ID","Heron or Egret Species","NULL","01945","unid. Heron / Egret","Ardea","sp",2010-07-15,"Idaho"
"1336","7/15/2010","00:00.0","2010","7","15","Ehlers/Runco","NULL","NULL","Owyhee","ID","Great Egret","NULL","01960","Great Egret","Ardea","alba",2010-07-15,"Idaho"
"1337","7/15/2010","00:00.0","2010","7","15","Ehlers/Runco","NULL","NULL","Owyhee","ID","Forster's Tern","NULL","00690","Forster's Tern","Sterna","forsteri",2010-07-15,"Idaho"
"1338","7/15/2010","00:00.0","2010","7","15","Ehlers/Runco","NULL","NULL","Owyhee","ID","Black Tern","NULL","00770","Black Tern","Chlidonias","niger",2010-07-15,"Idaho"
"1339","4/28/2010","00:00.0","2010","4","28","Ehlers/Runco","NULL","NULL","Owyhee","ID","Great Blue Heron","NULL","01940","Great Blue Heron","Ardea","herodias",2010-04-28,"Idaho"
"1340","4/10/2009","00:00.0","2009","4","10","McCarthy","NULL","NULL","Ada","ID","Great Blue Heron","NULL","01940","Great Blue Heron","Ardea","herodias",2009-04-10,"Idaho"
"1341","5/10/2009","00:00.0","2009","5","10","McCarthy","NULL","NULL","Canyon","ID","Great Blue Heron","NULL","01940","Great Blue Heron","Ardea","herodias",2009-05-10,"Idaho"
"1342","5/31/2009","00:00.0","2009","5","31","Sturts","NULL","NULL","Kootenai","ID","Great Blue Heron","NULL","01940","Great Blue Heron","Ardea","herodias",2009-05-31,"Idaho"
"1343","6/22/2010","00:00.0","2010","6","22","Moulton et al.","NULL","NULL","Bonneville","ID","White-faced Ibis","NULL","01870","White-faced Ibis","Plegadis","chihi",2010-06-22,"Idaho"
"1344","6/22/2010","00:00.0","2010","6","22","Moulton et al.","NULL","NULL","Bonneville","ID","Franklin's Gull","NULL","00590","Franklin's Gull","Larus","pipixcan",2010-06-22,"Idaho"
"1345","4/29/2009","00:00.0","2009","4","29","Cavallaro","NULL","NULL","Fremont","ID","Great Blue Heron","NULL","01940","Great Blue Heron","Ardea","herodias",2009-04-29,"Idaho"
"1346","6/5/2009","00:00.0","2009","6","5","Robison/Nielson","NULL","NULL","Fremont","ID","Ring-billed Gull","NULL","00540","Ring-billed Gull","Larus","delawarensis",2009-06-05,"Idaho"
"1347","6/5/2009","00:00.0","2009","6","5","Robison/Nielson","NULL","NULL","Fremont","ID","Great Blue Heron","NULL","01940","Great Blue Heron","Ardea","herodias",2009-06-05,"Idaho"
"1348","6/5/2009","00:00.0","2009","6","5","Robison/Nielson","NULL","NULL","Fremont","ID","Double-crested Cormorant","NULL","01200","Double-crested Cormorant","Phalacrocorax","auritus",2009-06-05,"Idaho"
"1349","6/5/2009","00:00.0","2009","6","5","Robison/Nielson","NULL","NULL","Fremont","ID","Caspian Tern","NULL","00640","Caspian Tern","Hydroprogne","caspia",2009-06-05,"Idaho"
"1350","6/5/2009","00:00.0","2009","6","5","Robison/Nielson","NULL","NULL","Fremont","ID","California Gull","NULL","00530","California Gull","Larus","californicus",2009-06-05,"Idaho"
"1351","6/5/2009","00:00.0","2009","6","5","Robison/Nielson","NULL","NULL","Fremont","ID","Black-crowned Night-Heron","NULL","02020","Black-crowned Night-Heron","Nycticorax","nycticorax",2009-06-05,"Idaho"
"1352","7/2/2010","00:00.0","2010","7","2","Lucid","NULL","NULL","Boundary","ID","Black Tern","NULL","00770","Black Tern","Chlidonias","niger",2010-07-02,"Idaho"
"1353","5/21/2009","00:00.0","2009","5","21","Wakkinen","NULL","NULL","Boundary","ID","Great Blue Heron","NULL","01940","Great Blue Heron","Ardea","herodias",2009-05-21,"Idaho"
"1354","6/25/2010","00:00.0","2010","6","25","Evans-Mack","NULL","NULL","Valley","ID","Western Grebe","NULL","00010","Western Grebe","Aechmophorus","occidentalis",2010-06-25,"Idaho"
"1355","4/29/2009","00:00.0","2009","4","29","Derrig","NULL","NULL","Bonner","ID","Great Blue Heron","NULL","01940","Great Blue Heron","Ardea","herodias",2009-04-29,"Idaho"
"1356","4/29/2009","00:00.0","2009","4","29","Derrig","NULL","NULL","Bonner","ID","Great Blue Heron","NULL","01940","Great Blue Heron","Ardea","herodias",2009-04-29,"Idaho"
"1357","7/12/2010","00:00.0","2010","7","12","Wakkinen/Wakkinen","NULL","NULL","Bonner","ID","Western Grebe","NULL","00010","Western Grebe","Aechmophorus","occidentalis",2010-07-12,"Idaho"
"1358","4/27/2009","00:00.0","2009","4","27","Waterbury/Gadwa","NULL","NULL","Lehmi","ID","Great Blue Heron","NULL","01940","Great Blue Heron","Ardea","herodias",2009-04-27,"Idaho"
"1359","6/3/2009","00:00.0","2009","6","3","Moulton et al.","NULL","NULL","Blaine","ID","Ring-billed Gull","NULL","00540","Ring-billed Gull","Larus","delawarensis",2009-06-03,"Idaho"
"1360","6/3/2009","00:00.0","2009","6","3","Moulton et al.","NULL","NULL","Blaine","ID","Caspian Tern","NULL","00640","Caspian Tern","Hydroprogne","caspia",2009-06-03,"Idaho"
"1361","6/3/2009","00:00.0","2009","6","3","Moulton et al.","NULL","NULL","Blaine","ID","California Gull","NULL","00530","California Gull","Larus","californicus",2009-06-03,"Idaho"
"1362","6/1/2010","00:00.0","2010","6","1","Moulton et al.","NULL","NULL","Jefferson","ID","White-faced Ibis","NULL","01870","White-faced Ibis","Plegadis","chihi",2010-06-01,"Idaho"
"1363","6/1/2010","00:00.0","2010","6","1","Moulton et al.","NULL","NULL","Jefferson","ID","Franklin's Gull","NULL","00590","Franklin's Gull","Larus","pipixcan",2010-06-01,"Idaho"
"1364","6/9/2009","00:00.0","2009","6","9","Nielson/Robison","NULL","NULL","Jefferson","ID","Ring-billed Gull","NULL","00540","Ring-billed Gull","Larus","delawarensis",2009-06-09,"Idaho"
"1437","6/15/1993","00:00.0","1993","6","15","Trost","NULL","NULL","Bingham","ID","Great Egret","NULL","01960","Great Egret","Ardea","alba",1993-06-15,"Idaho"
"1365","4/22/2009","00:00.0","2009","4","22","France et al.","NULL","NULL","Boundary","ID","Great Blue Heron","NULL","01940","Great Blue Heron","Ardea","herodias",2009-04-22,"Idaho"
"1366","5/12/2009","00:00.0","2009","5","12","Biesen","NULL","NULL","Bannock","ID","Great Blue Heron","NULL","01940","Great Blue Heron","Ardea","herodias",2009-05-12,"Idaho"
"1367","5/10/2009","00:00.0","2009","5","10","Cavallaro","NULL","NULL","Teton","ID","Great Blue Heron","NULL","01940","Great Blue Heron","Ardea","herodias",2009-05-10,"Idaho"
"1368","6/3/2009","00:00.0","2009","6","3","Moulton et al.","NULL","NULL","Cassia","ID","Double-crested Cormorant","NULL","01200","Double-crested Cormorant","Phalacrocorax","auritus",2009-06-03,"Idaho"
"1369","6/3/2009","00:00.0","2009","6","3","Moulton et al.","NULL","NULL","Cassia","ID","California Gull","NULL","00530","California Gull","Larus","californicus",2009-06-03,"Idaho"
"1370","6/3/2009","00:00.0","2009","6","3","Moulton et al.","NULL","NULL","Cassia","ID","American White Pelican","NULL","01250","American White Pelican","Pelecanus","erythrorhynchos",2009-06-03,"Idaho"
"1371","6/4/2010","00:00.0","2010","6","4","Moulton et al.","NULL","NULL","Cassia","ID","Double-crested Cormorant","NULL","01200","Double-crested Cormorant","Phalacrocorax","auritus",2010-06-04,"Idaho"
"1372","6/4/2010","00:00.0","2010","6","4","Moulton et al.","NULL","NULL","Cassia","ID","American White Pelican","NULL","01250","American White Pelican","Pelecanus","erythrorhynchos",2010-06-04,"Idaho"
"1373","6/2/2011","00:00.0","2011","6","2","Wackenhut/Lonsinger","NULL","NULL","Cassia","ID","Double-crested Cormorant","NULL","01200","Double-crested Cormorant","Phalacrocorax","auritus",2011-06-02,"Idaho"
"1374","6/2/2011","00:00.0","2011","6","2","Wackenhut/Lonsinger","NULL","NULL","Cassia","ID","Black-crowned Night-Heron","NULL","02020","Black-crowned Night-Heron","Nycticorax","nycticorax",2011-06-02,"Idaho"
"1375","6/2/2011","00:00.0","2011","6","2","Wackenhut/Lonsinger","NULL","NULL","Cassia","ID","American White Pelican","NULL","01250","American White Pelican","Pelecanus","erythrorhynchos",2011-06-02,"Idaho"
"1376","6/3/2009","00:00.0","2009","6","3","Moulton et al.","NULL","NULL","Cassia","ID","Snowy Egret","NULL","01970","Snowy Egret","Egretta","thula",2009-06-03,"Idaho"
"1377","6/3/2009","00:00.0","2009","6","3","Moulton et al.","NULL","NULL","Cassia","ID","Double-crested Cormorant","NULL","01200","Double-crested Cormorant","Phalacrocorax","auritus",2009-06-03,"Idaho"
"1378","6/3/2009","00:00.0","2009","6","3","Moulton et al.","NULL","NULL","Cassia","ID","California Gull","NULL","00530","California Gull","Larus","californicus",2009-06-03,"Idaho"
"1379","6/3/2009","00:00.0","2009","6","3","Moulton et al.","NULL","NULL","Cassia","ID","American White Pelican","NULL","01250","American White Pelican","Pelecanus","erythrorhynchos",2009-06-03,"Idaho"
"1380","6/4/2010","00:00.0","2010","6","4","Moulton et al.","NULL","NULL","Cassia","ID","Double-crested Cormorant","NULL","01200","Double-crested Cormorant","Phalacrocorax","auritus",2010-06-04,"Idaho"
"1381","6/4/2010","00:00.0","2010","6","4","Moulton et al.","NULL","NULL","Cassia","ID","American White Pelican","NULL","01250","American White Pelican","Pelecanus","erythrorhynchos",2010-06-04,"Idaho"
"1382","6/2/2011","00:00.0","2011","6","2","Wackenhut/Lonsinger","NULL","NULL","Cassia","ID","Snowy Egret","NULL","01970","Snowy Egret","Egretta","thula",2011-06-02,"Idaho"
"1383","6/2/2011","00:00.0","2011","6","2","Wackenhut/Lonsinger","NULL","NULL","Cassia","ID","Great Blue Heron","NULL","01940","Great Blue Heron","Ardea","herodias",2011-06-02,"Idaho"
"1384","6/2/2011","00:00.0","2011","6","2","Wackenhut/Lonsinger","NULL","NULL","Cassia","ID","Double-crested Cormorant","NULL","01200","Double-crested Cormorant","Phalacrocorax","auritus",2011-06-02,"Idaho"
"1385","6/2/2011","00:00.0","2011","6","2","Wackenhut/Lonsinger","NULL","NULL","Cassia","ID","American White Pelican","NULL","01250","American White Pelican","Pelecanus","erythrorhynchos",2011-06-02,"Idaho"
"1386","6/3/2009","00:00.0","2009","6","3","Moulton/Fisher","NULL","NULL","Cassia","ID","American White Pelican","NULL","01250","American White Pelican","Pelecanus","erythrorhynchos",2009-06-03,"Idaho"
"1387","6/3/2009","00:00.0","2009","6","3","Moulton et al.","NULL","NULL","Cassia","ID","Great Blue Heron","NULL","01940","Great Blue Heron","Ardea","herodias",2009-06-03,"Idaho"
"1388","6/3/2009","00:00.0","2009","6","3","Moulton/Nielson","NULL","NULL","Cassia","ID","Caspian Tern","NULL","00640","Caspian Tern","Hydroprogne","caspia",2009-06-03,"Idaho"
"1389","6/3/2009","00:00.0","2009","6","3","Moulton/Nielson","NULL","NULL","Cassia","ID","California Gull","NULL","00530","California Gull","Larus","californicus",2009-06-03,"Idaho"
"1390","6/3/2009","00:00.0","2009","6","3","Moulton/Nielson","NULL","NULL","Cassia","ID","American White Pelican","NULL","01250","American White Pelican","Pelecanus","erythrorhynchos",2009-06-03,"Idaho"
"1391","6/4/2010","00:00.0","2010","6","4","Moulton","NULL","NULL","Cassia","ID","American White Pelican","NULL","01250","American White Pelican","Pelecanus","erythrorhynchos",2010-06-04,"Idaho"
"1392","6/2/2011","00:00.0","2011","6","2","Wackenhut/Lonsinger","NULL","NULL","Cassia","ID","American White Pelican","NULL","01250","American White Pelican","Pelecanus","erythrorhynchos",2011-06-02,"Idaho"
"1393","4/27/2009","00:00.0","2009","4","27","Nielson/Robison","NULL","NULL","Jefferson","ID","Great Blue Heron","NULL","01940","Great Blue Heron","Ardea","herodias",2009-04-27,"Idaho"
"1394","4/27/2009","00:00.0","2009","4","27","Trost","NULL","NULL","Jefferson","ID","Double-crested Cormorant","NULL","01200","Double-crested Cormorant","Phalacrocorax","auritus",2009-04-27,"Idaho"
"1395","7/2/2010","00:00.0","2010","7","2","Ehlers/Runco","NULL","NULL","Jefferson","ID","Western Grebe","NULL","00010","Western Grebe","Aechmophorus","occidentalis",2010-07-02,"Idaho"
"1396","6/2/2010","00:00.0","2010","6","2","Moulton et al.","NULL","NULL","Jefferson","ID","White-faced Ibis","NULL","01870","White-faced Ibis","Plegadis","chihi",2010-06-02,"Idaho"
"1397","6/2/2010","00:00.0","2010","6","2","Moulton et al.","NULL","NULL","Jefferson","ID","Franklin's Gull","NULL","00590","Franklin's Gull","Larus","pipixcan",2010-06-02,"Idaho"
"1398","4/26/2011","00:00.0","2011","4","26","Ward","NULL","NULL","Ada","ID","Great Blue Heron","NULL","01940","Great Blue Heron","Ardea","herodias",2011-04-26,"Idaho"
"1399","4/26/2011","00:00.0","2011","4","26","Ward","NULL","NULL","Ada","ID","Double-crested Cormorant","NULL","01200","Double-crested Cormorant","Phalacrocorax","auritus",2011-04-26,"Idaho"
"1400","6/8/2010","00:00.0","2010","6","8","Ehlers/Runco","NULL","NULL","Franklin","ID","White-faced Ibis","NULL","01870","White-faced Ibis","Plegadis","chihi",2010-06-08,"Idaho"
"1401","6/8/2010","00:00.0","2010","6","8","Ehlers/Runco","NULL","NULL","Franklin","ID","Franklin's Gull","NULL","00590","Franklin's Gull","Larus","pipixcan",2010-06-08,"Idaho"
"1402","4/7/2009","00:00.0","2009","4","7","Schoeberl/Potter","NULL","NULL","Payette","ID","Great Blue Heron","NULL","01940","Great Blue Heron","Ardea","herodias",2009-04-07,"Idaho"
"1403","4/7/2009","00:00.0","2009","4","7","Schoeberl/Potter","NULL","NULL","Gem","ID","Great Blue Heron","NULL","01940","Great Blue Heron","Ardea","herodias",2009-04-07,"Idaho"
"1404","4/7/2009","00:00.0","2009","4","7","Schoeberl/Potter","NULL","NULL","Gem","ID","Double-crested Cormorant","NULL","01200","Double-crested Cormorant","Phalacrocorax","auritus",2009-04-07,"Idaho"
"1405","4/7/2009","00:00.0","2009","4","7","Schoeberl/Potter","NULL","NULL","Gem","ID","Great Blue Heron","NULL","01940","Great Blue Heron","Ardea","herodias",2009-04-07,"Idaho"
"1406","4/7/2009","00:00.0","2009","4","7","Schoeberl/Potter","NULL","NULL","Gem","ID","Great Blue Heron","NULL","01940","Great Blue Heron","Ardea","herodias",2009-04-07,"Idaho"
"1407","4/7/2009","00:00.0","2009","4","7","Schoeberl/Potter","NULL","NULL","Gem","ID","Great Egret","NULL","01960","Great Egret","Ardea","alba",2009-04-07,"Idaho"
"1408","4/7/2009","00:00.0","2009","4","7","Schoeberl/Potter","NULL","NULL","Gem","ID","Great Blue Heron","NULL","01940","Great Blue Heron","Ardea","herodias",2009-04-07,"Idaho"
"1409","4/7/2009","00:00.0","2009","4","7","Schoeberl/Potter","NULL","NULL","Gem","ID","Black-crowned Night-Heron","NULL","02020","Black-crowned Night-Heron","Nycticorax","nycticorax",2009-04-07,"Idaho"
"1410","6/18/2009","00:00.0","2009","6","18","Robinson/Robinson","NULL","NULL","Bonner","ID","Great Blue Heron","NULL","01940","Great Blue Heron","Ardea","herodias",2009-06-18,"Idaho"
"1411","5/25/2010","00:00.0","2010","5","25","Robinson/Robinson","NULL","NULL","Bonner","ID","Great Blue Heron","NULL","01940","Great Blue Heron","Ardea","herodias",2010-05-25,"Idaho"
"1412","4/23/2009","00:00.0","2009","4","23","Waterbury et al.","NULL","NULL","Lehmi","ID","Great Blue Heron","NULL","01940","Great Blue Heron","Ardea","herodias",2009-04-23,"Idaho"
"1413","5/6/2009","00:00.0","2009","5","6","Sauder","NULL","NULL","Idaho","ID","Great Blue Heron","NULL","01940","Great Blue Heron","Ardea","herodias",2009-05-06,"Idaho"
"1414","4/22/2009","00:00.0","2009","4","22","Major/Painter","NULL","NULL","Custer","ID","Great Blue Heron","NULL","01940","Great Blue Heron","Ardea","herodias",2009-04-22,"Idaho"
"1415","4/23/2009","00:00.0","2009","4","23","Waterbury et al.","NULL","NULL","Lehmi","ID","Great Blue Heron","NULL","01940","Great Blue Heron","Ardea","herodias",2009-04-23,"Idaho"
"1416","4/22/2009","00:00.0","2009","4","22","Major/Painter","NULL","NULL","Custer","ID","Great Blue Heron","NULL","01940","Great Blue Heron","Ardea","herodias",2009-04-22,"Idaho"
"1417","4/22/2009","00:00.0","2009","4","22","Major/Painter","NULL","NULL","Custer","ID","Great Blue Heron","NULL","01940","Great Blue Heron","Ardea","herodias",2009-04-22,"Idaho"
"1418","4/22/2009","00:00.0","2009","4","22","Waterbury et al.","NULL","NULL","Lehmi","ID","Great Blue Heron","NULL","01940","Great Blue Heron","Ardea","herodias",2009-04-22,"Idaho"
"1419","5/5/2009","00:00.0","2009","5","5","Seymour","NULL","NULL","Blaine","ID","Great Blue Heron","NULL","01940","Great Blue Heron","Ardea","herodias",2009-05-05,"Idaho"
"1420","4/26/2009","00:00.0","2009","4","26","Moulton/Stiefel","NULL","NULL","Owyhee","ID","Snowy Egret","NULL","01970","Snowy Egret","Egretta","thula",2009-04-26,"Idaho"
"1421","4/26/2009","00:00.0","2009","4","26","Moulton/Stiefel","NULL","NULL","Owyhee","ID","Great Egret","NULL","01960","Great Egret","Ardea","alba",2009-04-26,"Idaho"
"1422","4/26/2009","00:00.0","2009","4","26","Moulton/Stiefel","NULL","NULL","Owyhee","ID","Great Blue Heron","NULL","01940","Great Blue Heron","Ardea","herodias",2009-04-26,"Idaho"
"1423","4/26/2009","00:00.0","2009","4","26","Moulton/Stiefel","NULL","NULL","Owyhee","ID","Black-crowned Night-Heron","NULL","02020","Black-crowned Night-Heron","Nycticorax","nycticorax",2009-04-26,"Idaho"
"1424","5/8/2009","00:00.0","2009","5","8","Wackenhut et al.","NULL","NULL","Bingham","ID","Great Blue Heron","NULL","01940","Great Blue Heron","Ardea","herodias",2009-05-08,"Idaho"
"1425","4/8/2009","00:00.0","2009","4","8","Moulton/Runco","NULL","NULL","Canyon","ID","Double-crested Cormorant","NULL","01200","Double-crested Cormorant","Phalacrocorax","auritus",2009-04-08,"Idaho"
"1426","6/5/2009","00:00.0","2009","6","5","Moulton/Kemner","NULL","NULL","Washington","ID","Ring-billed Gull","NULL","00540","Ring-billed Gull","Larus","delawarensis",2009-06-05,"Idaho"
"1427","6/5/2009","00:00.0","2009","6","5","Moulton/Kemner","NULL","NULL","Washington","ID","California Gull","NULL","00530","California Gull","Larus","californicus",2009-06-05,"Idaho"
"1428","5/8/2009","00:00.0","2009","5","8","Wackenhut et al.","NULL","NULL","Bingham","ID","Great Blue Heron","NULL","01940","Great Blue Heron","Ardea","herodias",2009-05-08,"Idaho"
"1429","4/21/2010","00:00.0","2010","4","21","Ehlers/Runco","NULL","NULL","Twin Falls","ID","Great Blue Heron","NULL","01940","Great Blue Heron","Ardea","herodias",2010-04-21,"Idaho"
"1430","4/20/2009","00:00.0","2009","4","20","Cavallaro","NULL","NULL","Teton","ID","Great Blue Heron","NULL","01940","Great Blue Heron","Ardea","herodias",2009-04-20,"Idaho"
"1431","5/1/2009","00:00.0","2009","5","1","Cavallaro","NULL","NULL","Teton","ID","Great Blue Heron","NULL","01940","Great Blue Heron","Ardea","herodias",2009-05-01,"Idaho"
"1432","4/8/2009","00:00.0","2009","4","8","Evans-Mack","NULL","NULL","Washington","ID","Great Blue Heron","NULL","01940","Great Blue Heron","Ardea","herodias",2009-04-08,"Idaho"
"1433","5/5/2009","00:00.0","2009","5","5","Seymour","NULL","NULL","Blaine","ID","Great Blue Heron","NULL","01940","Great Blue Heron","Ardea","herodias",2009-05-05,"Idaho"
"1434","6/28/2010","00:00.0","2010","6","28","Moore","NULL","NULL","Bonner","ID","Black Tern","NULL","00770","Black Tern","Chlidonias","niger",2010-06-28,"Idaho"
"1435","7/2/1993","00:00.0","1993","7","2","Trost","NULL","NULL","Caribou","ID","Clark's Grebe","NULL","00011","Clark's Grebe","Aechmophorus","clarkii",1993-07-02,"Idaho"
"1436","7/4/1993","00:00.0","1993","7","4","Trost","NULL","NULL","Caribou","ID","Western Grebe","NULL","00010","Western Grebe","Aechmophorus","occidentalis",1993-07-04,"Idaho"
"1438","7/5/1993","00:00.0","1993","7","5","Trost","NULL","NULL","Bingham","ID","Ring-billed Gull","NULL","00540","Ring-billed Gull","Larus","delawarensis",1993-07-05,"Idaho"
"1439","7/5/1993","00:00.0","1993","7","5","Trost","NULL","NULL","Bingham","ID","Ring-billed Gull","NULL","00540","Ring-billed Gull","Larus","delawarensis",1993-07-05,"Idaho"
"1440","7/14/1993","00:00.0","1993","7","14","Trost","NULL","NULL","Bingham","ID","California Gull","NULL","00530","California Gull","Larus","californicus",1993-07-14,"Idaho"
"1441","5/16/2006","00:00.0","2006","5","16","Moulton","NULL","NULL","Bingham","ID","California Gull","NULL","00530","California Gull","Larus","californicus",2006-05-16,"Idaho"
"1442","5/16/2006","00:00.0","2006","5","16","Moulton","NULL","NULL","Bingham","ID","Ring-billed Gull","NULL","00540","Ring-billed Gull","Larus","delawarensis",2006-05-16,"Idaho"
"1443","6/8/1993","00:00.0","1993","6","8","Trost","NULL","NULL","Bingham","ID","Black-crowned Night-Heron","NULL","02020","Black-crowned Night-Heron","Nycticorax","nycticorax",1993-06-08,"Idaho"
"1444","6/8/1993","00:00.0","1993","6","8","Trost","NULL","NULL","Bingham","ID","Clark's Grebe","NULL","00011","Clark's Grebe","Aechmophorus","clarkii",1993-06-08,"Idaho"
"1445","6/8/1993","00:00.0","1993","6","8","Trost","NULL","NULL","Bingham","ID","Snowy Egret","NULL","01970","Snowy Egret","Egretta","thula",1993-06-08,"Idaho"
"1446","6/8/1993","00:00.0","1993","6","8","Trost","NULL","NULL","Bingham","ID","White-faced Ibis","NULL","01870","White-faced Ibis","Plegadis","chihi",1993-06-08,"Idaho"
"1447","6/15/1993","00:00.0","1993","6","15","Trost","NULL","NULL","Bingham","ID","White-faced Ibis","NULL","01870","White-faced Ibis","Plegadis","chihi",1993-06-15,"Idaho"
"1448","7/11/1993","00:00.0","1993","7","11","Trost","NULL","NULL","Bingham","ID","White-faced Ibis","NULL","01870","White-faced Ibis","Plegadis","chihi",1993-07-11,"Idaho"
"1449","7/2/1993","00:00.0","1993","7","2","Trost","NULL","NULL","Bannock","ID","Snowy Egret","NULL","01970","Snowy Egret","Egretta","thula",1993-07-02,"Idaho"
"1450","7/1/1993","00:00.0","1993","7","1","Trost","NULL","NULL","Power","ID","Clark's Grebe","NULL","00011","Clark's Grebe","Aechmophorus","clarkii",1993-07-01,"Idaho"
"1451","7/2/1993","00:00.0","1993","7","2","Trost","NULL","NULL","NULL","ID","Clark's Grebe","NULL","00011","Clark's Grebe","Aechmophorus","clarkii",1993-07-02,"Idaho"
"1452","7/1/1993","00:00.0","1993","7","1","Trost","NULL","NULL","NULL","ID","Western Grebe","NULL","00010","Western Grebe","Aechmophorus","occidentalis",1993-07-01,"Idaho"
"1453","7/2/1993","00:00.0","1993","7","2","Trost","NULL","NULL","Bingham","ID","Black-crowned Night-Heron","NULL","02020","Black-crowned Night-Heron","Nycticorax","nycticorax",1993-07-02,"Idaho"
"1454","7/10/1994","00:00.0","1994","7","10","Trost","NULL","NULL","Elmore","ID","Forster's Tern","NULL","00690","Forster's Tern","Sterna","forsteri",1994-07-10,"Idaho"
"1455","6/11/1993","00:00.0","1993","6","11","Trost","NULL","NULL","Bannock","ID","Great Egret","NULL","01960","Great Egret","Ardea","alba",1993-06-11,"Idaho"
"1456","7/11/1993","00:00.0","1993","7","11","Trost","NULL","NULL","Bannock","ID","Cattle Egret","NULL","02001","Cattle Egret","Bubulcus","ibis",1993-07-11,"Idaho"
"1457","6/19/1993","00:00.0","1993","6","19","Trost","NULL","NULL","Bear Lake","ID","Western Grebe","NULL","00010","Western Grebe","Aechmophorus","occidentalis",1993-06-19,"Idaho"
"1458","6/26/1993","00:00.0","1993","6","26","Trost","NULL","NULL","Bear Lake","ID","White-faced Ibis","NULL","01870","White-faced Ibis","Plegadis","chihi",1993-06-26,"Idaho"
"1459","7/8/1993","00:00.0","1993","7","8","Sjostrom","NULL","NULL","Bear Lake","ID","Black-crowned Night-Heron","NULL","02020","Black-crowned Night-Heron","Nycticorax","nycticorax",1993-07-08,"Idaho"
"1460","7/8/1993","00:00.0","1993","7","8","Sjostrom","NULL","NULL","Bear Lake","ID","Cattle Egret","NULL","02001","Cattle Egret","Bubulcus","ibis",1993-07-08,"Idaho"
"1461","7/8/1993","00:00.0","1993","7","8","Sjostrom","NULL","NULL","Bear Lake","ID","Franklin's Gull","NULL","00590","Franklin's Gull","Larus","pipixcan",1993-07-08,"Idaho"
"1462","7/8/1993","00:00.0","1993","7","8","Sjostrom","NULL","NULL","Bear Lake","ID","Snowy Egret","NULL","01970","Snowy Egret","Egretta","thula",1993-07-08,"Idaho"
"1463","7/8/1993","00:00.0","1993","7","8","Sjostrom","NULL","NULL","Bear Lake","ID","Western Grebe","NULL","00010","Western Grebe","Aechmophorus","occidentalis",1993-07-08,"Idaho"
"1464","7/8/1993","00:00.0","1993","7","8","Sjostrom","NULL","NULL","Bear Lake","ID","White-faced Ibis","NULL","01870","White-faced Ibis","Plegadis","chihi",1993-07-08,"Idaho"
"1465","7/10/1993","00:00.0","1993","7","10","Trost","NULL","NULL","Bear Lake","ID","Western Grebe","NULL","00010","Western Grebe","Aechmophorus","occidentalis",1993-07-10,"Idaho"
"1466","7/10/1993","00:00.0","1993","7","10","Trost","NULL","NULL","Bear Lake","ID","White-faced Ibis","NULL","01870","White-faced Ibis","Plegadis","chihi",1993-07-10,"Idaho"
"1467","6/26/1993","00:00.0","1993","6","26","Trost","NULL","NULL","Caribou","ID","White-faced Ibis","NULL","01870","White-faced Ibis","Plegadis","chihi",1993-06-26,"Idaho"
"1468","7/8/1993","00:00.0","1993","7","8","Sjostrom","NULL","NULL","Bear Lake","ID","California Gull","NULL","00530","California Gull","Larus","californicus",1993-07-08,"Idaho"
"1469","5/31/2006","00:00.0","2006","5","31","Moulton","NULL","NULL","Bear Lake","ID","California Gull","NULL","00530","California Gull","Larus","californicus",2006-05-31,"Idaho"
"1470","5/31/2006","00:00.0","2006","5","31","Moulton","NULL","NULL","Bear Lake","ID","Double-crested Cormorant","NULL","01200","Double-crested Cormorant","Phalacrocorax","auritus",2006-05-31,"Idaho"
"1471","5/31/2006","00:00.0","2006","5","31","Moulton","NULL","NULL","Bear Lake","ID","Ring-billed Gull","NULL","00540","Ring-billed Gull","Larus","delawarensis",2006-05-31,"Idaho"
"1472","5/30/2007","00:00.0","2007","5","30","Bjork/Heist","NULL","NULL","Bear Lake","ID","California Gull","NULL","00530","California Gull","Larus","californicus",2007-05-30,"Idaho"
"1473","5/30/2007","00:00.0","2007","5","30","Bjork/Heist","NULL","NULL","Bear Lake","ID","Double-crested Cormorant","Number of young = 56","01200","Double-crested Cormorant","Phalacrocorax","auritus",2007-05-30,"Idaho"
"1474","5/30/2007","00:00.0","2007","5","30","Bjork/Heist","NULL","NULL","Bear Lake","ID","Ring-billed Gull","NULL","00540","Ring-billed Gull","Larus","delawarensis",2007-05-30,"Idaho"
"1475","6/9/1993","00:00.0","1993","6","9","Hlavaty","NULL","NULL","Caribou","ID","Western Grebe","NULL","00010","Western Grebe","Aechmophorus","occidentalis",1993-06-09,"Idaho"
"1476","7/4/1993","00:00.0","1993","7","4","Trost","NULL","NULL","Caribou","ID","Black Tern","NULL","00770","Black Tern","Chlidonias","niger",1993-07-04,"Idaho"
"1477","6/19/1993","00:00.0","1993","6","19","Hlavaty","NULL","NULL","Caribou","ID","American White Pelican","NULL","01250","American White Pelican","Pelecanus","erythrorhynchos",1993-06-19,"Idaho"
"1478","6/19/1993","00:00.0","1993","6","19","Hlavaty","NULL","NULL","Caribou","ID","Black-crowned Night-Heron","NULL","02020","Black-crowned Night-Heron","Nycticorax","nycticorax",1993-06-19,"Idaho"
"1479","6/19/1993","00:00.0","1993","6","19","Hlavaty","NULL","NULL","NULL","ID","California Gull","NULL","00530","California Gull","Larus","californicus",1993-06-19,"Idaho"
"1480","6/19/1993","00:00.0","1993","6","19","Hlavaty","NULL","NULL","Caribou","ID","Cattle Egret","NULL","02001","Cattle Egret","Bubulcus","ibis",1993-06-19,"Idaho"
"1481","6/19/1993","00:00.0","1993","6","19","Hlavaty","NULL","NULL","Caribou","ID","Snowy Egret","NULL","01970","Snowy Egret","Egretta","thula",1993-06-19,"Idaho"
"1482","7/4/1993","00:00.0","1993","7","4","Trost","NULL","NULL","Caribou","ID","California Gull","NULL","00530","California Gull","Larus","californicus",1993-07-04,"Idaho"
"1483","7/4/1993","00:00.0","1993","7","4","Trost","NULL","NULL","Caribou","ID","Caspian Tern","NULL","00640","Caspian Tern","Hydroprogne","caspia",1993-07-04,"Idaho"
"1484","8/11/1993","00:00.0","1993","8","11","Trost","NULL","NULL","Caribou","ID","Snowy Egret","NULL","01970","Snowy Egret","Egretta","thula",1993-08-11,"Idaho"
"1485","6/1/2006","00:00.0","2006","6","1","Moulton","NULL","NULL","Caribou","ID","American White Pelican","NULL","01250","American White Pelican","Pelecanus","erythrorhynchos",2006-06-01,"Idaho"
"1486","6/1/2006","00:00.0","2006","6","1","Moulton","NULL","NULL","Caribou","ID","Black-crowned Night-Heron","NULL","02020","Black-crowned Night-Heron","Nycticorax","nycticorax",2006-06-01,"Idaho"
"1487","6/1/2006","00:00.0","2006","6","1","Moulton","NULL","NULL","Caribou","ID","California Gull","NULL","00530","California Gull","Larus","californicus",2006-06-01,"Idaho"
"1488","6/1/2006","00:00.0","2006","6","1","Moulton","NULL","NULL","Caribou","ID","Caspian Tern","NULL","00640","Caspian Tern","Hydroprogne","caspia",2006-06-01,"Idaho"
"1489","6/1/2006","00:00.0","2006","6","1","Moulton","NULL","NULL","Caribou","ID","Double-crested Cormorant","NULL","01200","Double-crested Cormorant","Phalacrocorax","auritus",2006-06-01,"Idaho"
"1490","6/1/2006","00:00.0","2006","6","1","Moulton","NULL","NULL","Caribou","ID","Great Blue Heron","NULL","01940","Great Blue Heron","Ardea","herodias",2006-06-01,"Idaho"
"1491","6/1/2006","00:00.0","2006","6","1","Moulton","NULL","NULL","Caribou","ID","Ring-billed Gull","NULL","00540","Ring-billed Gull","Larus","delawarensis",2006-06-01,"Idaho"
"1492","6/1/2006","00:00.0","2006","6","1","Moulton","NULL","NULL","Caribou","ID","Snowy Egret","NULL","01970","Snowy Egret","Egretta","thula",2006-06-01,"Idaho"
"1493","5/30/2007","00:00.0","2007","5","30","Moulton/Leist","NULL","NULL","Caribou","ID","American White Pelican","NULL","01250","American White Pelican","Pelecanus","erythrorhynchos",2007-05-30,"Idaho"
"1494","5/30/2007","00:00.0","2007","5","30","Moulton/Leist","NULL","NULL","Caribou","ID","Caspian Tern","NULL","00640","Caspian Tern","Hydroprogne","caspia",2007-05-30,"Idaho"
"1495","5/30/2007","00:00.0","2007","5","30","Moulton/Leist","NULL","NULL","Caribou","ID","Double-crested Cormorant","NULL","01200","Double-crested Cormorant","Phalacrocorax","auritus",2007-05-30,"Idaho"
"1496","6/3/2008","00:00.0","2008","6","3","Moulton","NULL","NULL","Caribou","ID","American White Pelican","NULL","01250","American White Pelican","Pelecanus","erythrorhynchos",2008-06-03,"Idaho"
"1497","6/3/2008","00:00.0","2008","6","3","Moulton","NULL","NULL","Caribou","ID","Caspian Tern","NULL","00640","Caspian Tern","Hydroprogne","caspia",2008-06-03,"Idaho"
"1498","6/3/2008","00:00.0","2008","6","3","Moulton","NULL","NULL","Caribou","ID","Double-crested Cormorant","NULL","01200","Double-crested Cormorant","Phalacrocorax","auritus",2008-06-03,"Idaho"
"1499","6/3/2008","00:00.0","2008","6","3","Moulton","NULL","NULL","Caribou","ID","Heron or Egret species","NULL","01945","unid. Heron / Egret","Ardea","sp",2008-06-03,"Idaho"
"1500","6/18/2008","00:00.0","2008","6","18","Wackenhut/Grunder","NULL","NULL","Caribou","ID","American White Pelican","NULL","01250","American White Pelican","Pelecanus","erythrorhynchos",2008-06-18,"Idaho"
"1501","5/30/2007","00:00.0","2007","5","30","Wackenhut/Nelson","NULL","NULL","Caribou","ID","American White Pelican","NULL","01250","American White Pelican","Pelecanus","erythrorhynchos",2007-05-30,"Idaho"
"1502","6/3/2008","00:00.0","2008","6","3","Moulton","NULL","NULL","Caribou","ID","American White Pelican","NULL","01250","American White Pelican","Pelecanus","erythrorhynchos",2008-06-03,"Idaho"
"1503","6/3/2008","00:00.0","2008","6","3","Moulton","NULL","NULL","Caribou","ID","Heron or Egret species","NULL","NULL",NA,NA,NA,2008-06-03,"Idaho"
"1504","6/18/2008","00:00.0","2008","6","18","Moulton/Weinandt","NULL","NULL","Caribou","ID","American White Pelican","NULL","01250","American White Pelican","Pelecanus","erythrorhynchos",2008-06-18,"Idaho"
"377","6/4/2010","00:00.0","2010","6","4","Klute","NULL","NULL","Adams","CO","Double-crested Cormorant","NULL","01200","Double-crested Cormorant","Phalacrocorax","auritus",2010-06-04,"Colorado"
"378","6/4/2010","00:00.0","2010","6","4","Klute","NULL","NULL","Adams","CO","Great Blue Heron","NULL","01940","Great Blue Heron","Ardea","herodias",2010-06-04,"Colorado"
"379","6/4/2010","00:00.0","2010","6","4","Klute","NULL","NULL","Adams","CO","Black-crowned Night-Heron","NULL","02020","Black-crowned Night-Heron","Nycticorax","nycticorax",2010-06-04,"Colorado"
"380","7/10/2009","00:00.0","2009","7","10","Luke","NULL","NULL","Moffat","CO","Great Blue Heron","NULL","01940","Great Blue Heron","Ardea","herodias",2009-07-10,"Colorado"
"381","4/20/2009","00:00.0","2009","4","20","Huwer","NULL","NULL","Larimer","CO","Great Blue Heron","NULL","01940","Great Blue Heron","Ardea","herodias",2009-04-20,"Colorado"
"382","4/21/2010","00:00.0","2010","4","21","Huwer","NULL","NULL","Larimer","CO","Great Blue Heron","NULL","01940","Great Blue Heron","Ardea","herodias",2010-04-21,"Colorado"
"383","4/24/2009","00:00.0","2009","4","24","Beason","NULL","NULL","Delta","CO","Great Blue Heron","NULL","01940","Great Blue Heron","Ardea","herodias",2009-04-24,"Colorado"
"384","4/30/2009","00:00.0","2009","4","30","George","NULL","NULL","Boulder","CO","Great Blue Heron","NULL","01940","Great Blue Heron","Ardea","herodias",2009-04-30,"Colorado"
"385","4/25/2010","00:00.0","2010","4","25","George","NULL","NULL","Boulder","CO","Great Blue Heron","NULL","01940","Great Blue Heron","Ardea","herodias",2010-04-25,"Colorado"
"386","4/30/2009","00:00.0","2009","4","30","George","NULL","NULL","Boulder","CO","Great Blue Heron","NULL","01940","Great Blue Heron","Ardea","herodias",2009-04-30,"Colorado"
"387","4/24/2010","00:00.0","2010","4","24","George","NULL","NULL","Boulder","CO","Great Blue Heron","NULL","01940","Great Blue Heron","Ardea","herodias",2010-04-24,"Colorado"
"388","4/30/2009","00:00.0","2009","4","30","George","NULL","NULL","Boulder","CO","Great Blue Heron","NULL","01940","Great Blue Heron","Ardea","herodias",2009-04-30,"Colorado"
"389","4/24/2010","00:00.0","2010","4","24","George","NULL","NULL","Boulder","CO","Great Blue Heron","NULL","01940","Great Blue Heron","Ardea","herodias",2010-04-24,"Colorado"
"390","5/15/2009","00:00.0","2009","5","15","Hundertmark","NULL","NULL","Jackson","CO","Western Grebe","NULL","00010","Western Grebe","Aechmophorus","occidentalis",2009-05-15,"Colorado"
"391","7/10/2009","00:00.0","2009","7","10","Hundertmark","NULL","NULL","Jackson","CO","Double-crested Cormorant","NULL","01200","Double-crested Cormorant","Phalacrocorax","auritus",2009-07-10,"Colorado"
"392","7/10/2009","00:00.0","2009","7","10","Hundertmark","NULL","NULL","Jackson","CO","Forster's Tern","NULL","00690","Forster's Tern","Sterna","forsteri",2009-07-10,"Colorado"
"393","8/1/2009","00:00.0","2009","8","1","Hundertmark","NULL","NULL","Jackson","CO","Eared Grebe","NULL","00040","Eared Grebe","Podiceps","nigricollis",2009-08-01,"Colorado"
"394","8/1/2009","00:00.0","2009","8","1","Hundertmark","NULL","NULL","Jackson","CO","California Gull","NULL","00530","California Gull","Larus","californicus",2009-08-01,"Colorado"
"395","8/1/2009","00:00.0","2009","8","1","Hundertmark","NULL","NULL","Jackson","CO","American White Pelican","NULL","01250","American White Pelican","Pelecanus","erythrorhynchos",2009-08-01,"Colorado"
"396","5/14/2010","00:00.0","2010","5","14","Hundertmark","NULL","NULL","Jackson","CO","California Gull","NULL","00530","California Gull","Larus","californicus",2010-05-14,"Colorado"
"397","6/11/2010","00:00.0","2010","6","11","Hundertmark","NULL","NULL","Jackson","CO","Black-crowned Night-Heron","NULL","02020","Black-crowned Night-Heron","Nycticorax","nycticorax",2010-06-11,"Colorado"
"398","6/11/2010","00:00.0","2010","6","11","Hundertmark","NULL","NULL","Jackson","CO","Double-crested Cormorant","NULL","01200","Double-crested Cormorant","Phalacrocorax","auritus",2010-06-11,"Colorado"
"399","6/11/2010","00:00.0","2010","6","11","Hundertmark","NULL","NULL","Jackson","CO","Franklin's Gull","NULL","00590","Franklin's Gull","Larus","pipixcan",2010-06-11,"Colorado"
"400","6/11/2010","00:00.0","2010","6","11","Hundertmark","NULL","NULL","Jackson","CO","Black Tern","NULL","00770","Black Tern","Chlidonias","niger",2010-06-11,"Colorado"
"401","7/9/2010","00:00.0","2010","7","9","Hundertmark","NULL","NULL","Jackson","CO","Western Grebe","NULL","00010","Western Grebe","Aechmophorus","occidentalis",2010-07-09,"Colorado"
"402","8/6/2010","00:00.0","2010","8","6","Hundertmark","NULL","NULL","Jackson","CO","Eared Grebe","NULL","00040","Eared Grebe","Podiceps","nigricollis",2010-08-06,"Colorado"
"403","8/6/2010","00:00.0","2010","8","6","Hundertmark","NULL","NULL","Jackson","CO","American White Pelican","NULL","01250","American White Pelican","Pelecanus","erythrorhynchos",2010-08-06,"Colorado"
"404","8/19/2009","00:00.0","2009","8","19","Jones","NULL","NULL","Teller","CO","Black-crowned Night-Heron","NULL","02020","Black-crowned Night-Heron","Nycticorax","nycticorax",2009-08-19,"Colorado"
"405","4/22/2009","00:00.0","2009","4","22","Ommeren","NULL","NULL","Jefferson","CO","Double-crested Cormorant","NULL","01200","Double-crested Cormorant","Phalacrocorax","auritus",2009-04-22,"Colorado"
"406","4/22/2009","00:00.0","2009","4","22","Ommeren","NULL","NULL","Jefferson","CO","Great Blue Heron","NULL","01940","Great Blue Heron","Ardea","herodias",2009-04-22,"Colorado"
"407","4/22/2009","00:00.0","2009","4","22","Ommeren","NULL","NULL","Jefferson","CO","Black-crowned Night-Heron","NULL","02020","Black-crowned Night-Heron","Nycticorax","nycticorax",2009-04-22,"Colorado"
"408","4/4/2010","00:00.0","2010","4","4","Ommeren","NULL","NULL","Jefferson","CO","Double-crested Cormorant","NULL","01200","Double-crested Cormorant","Phalacrocorax","auritus",2010-04-04,"Colorado"
"409","4/4/2010","00:00.0","2010","4","4","Ommeren","NULL","NULL","Jefferson","CO","Great Blue Heron","NULL","01940","Great Blue Heron","Ardea","herodias",2010-04-04,"Colorado"
"410","5/25/2011","00:00.0","2011","5","25","Rawinski","NULL","NULL","Conejos","CO","Great Blue Heron","NULL","01940","Great Blue Heron","Ardea","herodias",2011-05-25,"Colorado"
"411","4/18/2009","00:00.0","2009","4","18","Pals","NULL","NULL","El Paso","CO","Great Blue Heron","NULL","01940","Great Blue Heron","Ardea","herodias",2009-04-18,"Colorado"
"412","5/31/2009","00:00.0","2009","5","31","Hilkey","NULL","NULL","Rio Blanco","CO","Great Blue Heron","NULL","01940","Great Blue Heron","Ardea","herodias",2009-05-31,"Colorado"
"413","5/10/2010","00:00.0","2010","5","10","HIlkey","NULL","NULL","Rio Blanco","CO","Great Blue Heron","NULL","01940","Great Blue Heron","Ardea","herodias",2010-05-10,"Colorado"
"414","5/2/2010","00:00.0","2010","5","2","Hilkey","NULL","NULL","Rio Blanco","CO","Great Blue Heron","NULL","01940","Great Blue Heron","Ardea","herodias",2010-05-02,"Colorado"
"415","4/25/2009","00:00.0","2009","4","25","Olson","NULL","NULL","Weld","CO","Great Blue Heron","NULL","01940","Great Blue Heron","Ardea","herodias",2009-04-25,"Colorado"
"416","4/25/2009","00:00.0","2009","4","25","Olson","NULL","NULL","Weld","CO","Double-crested Cormorant","NULL","01200","Double-crested Cormorant","Phalacrocorax","auritus",2009-04-25,"Colorado"
"417","4/25/2009","00:00.0","2009","4","25","Olson","NULL","NULL","Weld","CO","Black-crowned Night-Heron","NULL","02020","Black-crowned Night-Heron","Nycticorax","nycticorax",2009-04-25,"Colorado"
"418","4/17/2010","00:00.0","2010","4","17","Olson","NULL","NULL","Weld","CO","Great Blue Heron","NULL","01940","Great Blue Heron","Ardea","herodias",2010-04-17,"Colorado"
"419","4/17/2010","00:00.0","2010","4","17","Olson","NULL","NULL","Weld","CO","Double-crested Cormorant","NULL","01200","Double-crested Cormorant","Phalacrocorax","auritus",2010-04-17,"Colorado"
"420","4/25/2009","00:00.0","2009","4","25","Olson","NULL","NULL","Weld","CO","Double-crested Cormorant","NULL","01200","Double-crested Cormorant","Phalacrocorax","auritus",2009-04-25,"Colorado"
"421","4/25/2009","00:00.0","2009","4","25","Olson","NULL","NULL","Weld","CO","Great Blue Heron","NULL","01940","Great Blue Heron","Ardea","herodias",2009-04-25,"Colorado"
"422","4/25/2009","00:00.0","2009","4","25","Olson","NULL","NULL","Weld","CO","Black-crowned Night-Heron","NULL","02020","Black-crowned Night-Heron","Nycticorax","nycticorax",2009-04-25,"Colorado"
"423","4/25/2009","00:00.0","2009","4","25","Olson","NULL","NULL","Weld","CO","Great Egret","NULL","01960","Great Egret","Ardea","alba",2009-04-25,"Colorado"
"424","4/17/2010","00:00.0","2010","4","17","Olson","NULL","NULL","Weld","CO","American White Pelican","NULL","01250","American White Pelican","Pelecanus","erythrorhynchos",2010-04-17,"Colorado"
"425","4/17/2010","00:00.0","2010","4","17","Olson","NULL","NULL","Weld","CO","Double-crested Cormorant","NULL","01200","Double-crested Cormorant","Phalacrocorax","auritus",2010-04-17,"Colorado"
"426","4/17/2010","00:00.0","2010","4","17","Olson","NULL","NULL","Weld","CO","Great Blue Heron","NULL","01940","Great Blue Heron","Ardea","herodias",2010-04-17,"Colorado"
"427","NULL","","2010","NULL","NULL","Miller","NULL","NULL","Rio Grande","CO","White-faced Ibis","NULL","01870","White-faced Ibis","Plegadis","chihi",NA,"Colorado"
"428","NULL","","2010","NULL","NULL","Miller","NULL","NULL","Rio Grande","CO","Snowy Egret","NULL","01970","Snowy Egret","Egretta","thula",NA,"Colorado"
"429","NULL","","2010","NULL","NULL","Miller","NULL","NULL","Rio Grande","CO","Black-crowned Night-Heron","NULL","02020","Black-crowned Night-Heron","Nycticorax","nycticorax",NA,"Colorado"
"430","5/24/2011","00:00.0","2011","5","24","Rawinski","NULL","NULL","Rio Grande","CO","White-faced Ibis","NULL","01870","White-faced Ibis","Plegadis","chihi",2011-05-24,"Colorado"
"431","5/31/2011","00:00.0","2011","5","31","Rawinski","NULL","NULL","Rio Grande","CO","White-faced Ibis","NULL","01870","White-faced Ibis","Plegadis","chihi",2011-05-31,"Colorado"
"432","5/31/2011","00:00.0","2011","5","31","Rawinski","NULL","NULL","Rio Grande","CO","Snowy Egret","NULL","01970","Snowy Egret","Egretta","thula",2011-05-31,"Colorado"
"433","5/31/2011","00:00.0","2011","5","31","Rawinski","NULL","NULL","Rio Grande","CO","Black-crowned Night-Heron","NULL","02020","Black-crowned Night-Heron","Nycticorax","nycticorax",2011-05-31,"Colorado"
"434","5/31/2011","00:00.0","2011","5","31","Rawinski","NULL","NULL","Rio Grande","CO","Eared Grebe","NULL","00040","Eared Grebe","Podiceps","nigricollis",2011-05-31,"Colorado"
"435","5/24/2011","00:00.0","2011","5","24","Rawinski","NULL","NULL","Conejos","CO","Snowy Egret","NULL","01970","Snowy Egret","Egretta","thula",2011-05-24,"Colorado"
"436","5/24/2011","00:00.0","2011","5","24","Rawinski","NULL","NULL","Rio Grande","CO","Eared Grebe","NULL","00040","Eared Grebe","Podiceps","nigricollis",2011-05-24,"Colorado"
"437","6/6/2011","00:00.0","2011","6","6","Rawinski","NULL","NULL","Rio Grande","CO","Black-crowned Night-Heron","NULL","02020","Black-crowned Night-Heron","Nycticorax","nycticorax",2011-06-06,"Colorado"
"438","6/6/2011","00:00.0","2011","6","6","Rawinski","NULL","NULL","Rio Grande","CO","White-faced Ibis","NULL","01870","White-faced Ibis","Plegadis","chihi",2011-06-06,"Colorado"
"439","6/27/2010","00:00.0","2010","6","27","Beason","NULL","NULL","Archuleta","CO","Western Grebe","NULL","00010","Western Grebe","Aechmophorus","occidentalis",2010-06-27,"Colorado"
"440","7/13/2009","00:00.0","2009","7","13","Hundertmark","NULL","NULL","Jackson","CO","Great Blue Heron","NULL","01940","Great Blue Heron","Ardea","herodias",2009-07-13,"Colorado"
"441","5/16/2010","00:00.0","2010","5","16","Hundertmark","NULL","NULL","Jackson","CO","Great Blue Heron","NULL","01940","Great Blue Heron","Ardea","herodias",2010-05-16,"Colorado"
"442","6/13/2009","00:00.0","2009","6","13","Vidal","NULL","NULL","Pitkin","CO","Great Blue Heron","NULL","01940","Great Blue Heron","Ardea","herodias",2009-06-13,"Colorado"
"443","5/18/2010","00:00.0","2010","5","18","Hopton","NULL","NULL","Pitkin","CO","Great Blue Heron","NULL","01940","Great Blue Heron","Ardea","herodias",2010-05-18,"Colorado"
"444","5/18/2010","00:00.0","2010","5","18","Hopton","NULL","NULL","Boulder","CO","Great Blue Heron","NULL","01940","Great Blue Heron","Ardea","herodias",2010-05-18,"Colorado"
"445","NULL","","2009","NULL","NULL","NULL","NULL","NULL","Delta","CO","Great Blue Heron","NULL","01940","Great Blue Heron","Ardea","herodias",NA,"Colorado"
"446","6/9/2010","00:00.0","2010","6","9","Garrison","NULL","NULL","Delta","CO","Great Blue Heron","NULL","01940","Great Blue Heron","Ardea","herodias",2010-06-09,"Colorado"
"447","NULL","","2009","NULL","NULL","Dahl","NULL","NULL","Garfield","CO","Great Blue Heron","NULL","01940","Great Blue Heron","Ardea","herodias",NA,"Colorado"
"448","5/8/2010","00:00.0","2010","5","8","Dahl","NULL","NULL","Garfield","CO","Great Blue Heron","NULL","01940","Great Blue Heron","Ardea","herodias",2010-05-08,"Colorado"
"449","6/19/2009","00:00.0","2009","6","19","Burger","NULL","NULL","Douglas","CO","Great Blue Heron","NULL","01940","Great Blue Heron","Ardea","herodias",2009-06-19,"Colorado"
"450","5/21/2009","00:00.0","2009","5","21","Brummer","NULL","NULL","Gunnison","CO","Great Blue Heron","NULL","01940","Great Blue Heron","Ardea","herodias",2009-05-21,"Colorado"
"451","4/10/2010","00:00.0","2010","4","10","Fisher","NULL","NULL","Gunnison","CO","Great Blue Heron","NULL","01940","Great Blue Heron","Ardea","herodias",2010-04-10,"Colorado"
"452","8/1/2009","00:00.0","2009","8","1","Hundertmark","NULL","NULL","Jackson","CO","Eared Grebe","NULL","00040","Eared Grebe","Podiceps","nigricollis",2009-08-01,"Colorado"
"453","7/11/2010","00:00.0","2010","7","11","Hundertmark","NULL","NULL","Jackson","CO","Eared Grebe","NULL","00040","Eared Grebe","Podiceps","nigricollis",2010-07-11,"Colorado"
"454","5/3/2009","00:00.0","2009","5","3","Lefko","NULL","NULL","Weld","CO","Great Blue Heron","NULL","01940","Great Blue Heron","Ardea","herodias",2009-05-03,"Colorado"
"455","5/3/2009","00:00.0","2009","5","3","Lefko","NULL","NULL","Weld","CO","Double-crested Cormorant","NULL","01200","Double-crested Cormorant","Phalacrocorax","auritus",2009-05-03,"Colorado"
"456","5/6/2009","00:00.0","2009","5","6","Hilkey","NULL","NULL","Rio Blanco","CO","Great Blue Heron","NULL","01940","Great Blue Heron","Ardea","herodias",2009-05-06,"Colorado"
"457","5/10/2010","00:00.0","2010","5","10","HIlkey","NULL","NULL","Rio Blanco","CO","Great Blue Heron","NULL","01940","Great Blue Heron","Ardea","herodias",2010-05-10,"Colorado"
"458","6/1/2009","00:00.0","2009","6","1","Figueroa","NULL","NULL","Washington","CO","Great Blue Heron","NULL","01940","Great Blue Heron","Ardea","herodias",2009-06-01,"Colorado"
"459","7/31/2010","00:00.0","2010","7","31","Wild/eBird","NULL","NULL","Washington","CO","Black Tern","NULL","00770","Black Tern","Chlidonias","niger",2010-07-31,"Colorado"
"460","6/21/2009","00:00.0","2009","6","21","Bell","NULL","NULL","Jefferson","CO","Double-crested Cormorant","NULL","01200","Double-crested Cormorant","Phalacrocorax","auritus",2009-06-21,"Colorado"
"461","6/21/2009","00:00.0","2009","6","21","Bell","NULL","NULL","Jefferson","CO","Great Blue Heron","NULL","01940","Great Blue Heron","Ardea","herodias",2009-06-21,"Colorado"
"462","5/16/2010","00:00.0","2010","5","16","Bell","NULL","NULL","Jefferson","CO","Double-crested Cormorant","NULL","01200","Double-crested Cormorant","Phalacrocorax","auritus",2010-05-16,"Colorado"
"463","5/16/2010","00:00.0","2010","5","16","Bell","NULL","NULL","Jefferson","CO","Great Blue Heron","NULL","01940","Great Blue Heron","Ardea","herodias",2010-05-16,"Colorado"
"464","4/29/2009","00:00.0","2009","4","29","Nelson","NULL","NULL","Otero","CO","Great Blue Heron","NULL","01940","Great Blue Heron","Ardea","herodias",2009-04-29,"Colorado"
"465","4/10/2010","00:00.0","2010","4","10","Nelson","NULL","NULL","Otero","CO","Great Blue Heron","NULL","01940","Great Blue Heron","Ardea","herodias",2010-04-10,"Colorado"
"466","5/14/2009","00:00.0","2009","5","14","Beason","NULL","NULL","Ouray","CO","Great Blue Heron","NULL","01940","Great Blue Heron","Ardea","herodias",2009-05-14,"Colorado"
"467","5/12/2010","00:00.0","2010","5","12","Beason","NULL","NULL","Ouray","CO","Great Blue Heron","NULL","01940","Great Blue Heron","Ardea","herodias",2010-05-12,"Colorado"
"468","5/8/2009","00:00.0","2009","5","8","Patrick","NULL","NULL","Garfield","CO","Great Blue Heron","NULL","01940","Great Blue Heron","Ardea","herodias",2009-05-08,"Colorado"
"469","5/2/2010","00:00.0","2010","5","2","Patrick","NULL","NULL","Garfield","CO","Great Blue Heron","NULL","01940","Great Blue Heron","Ardea","herodias",2010-05-02,"Colorado"
"470","5/21/2009","00:00.0","2009","5","21","Hilkey","NULL","NULL","Rio Blanco","CO","Great Blue Heron","NULL","01940","Great Blue Heron","Ardea","herodias",2009-05-21,"Colorado"
"471","5/3/2010","00:00.0","2010","5","3","Hilkey","NULL","NULL","Rio Blanco","CO","Great Blue Heron","NULL","01940","Great Blue Heron","Ardea","herodias",2010-05-03,"Colorado"
"472","4/13/2009","00:00.0","2009","4","13","Bond","NULL","NULL","La Plata","CO","Great Blue Heron","NULL","01940","Great Blue Heron","Ardea","herodias",2009-04-13,"Colorado"
"473","4/14/2009","00:00.0","2009","4","14","Lowsky","NULL","NULL","Eagle","CO","Great Blue Heron","NULL","01940","Great Blue Heron","Ardea","herodias",2009-04-14,"Colorado"
"474","5/28/2010","00:00.0","2010","5","28","Bieble","NULL","NULL","Eagle","CO","Great Blue Heron","NULL","01940","Great Blue Heron","Ardea","herodias",2010-05-28,"Colorado"
"475","5/25/2009","00:00.0","2009","5","25","Beason","NULL","NULL","Delta","CO","Great Blue Heron","NULL","01940","Great Blue Heron","Ardea","herodias",2009-05-25,"Colorado"
"476","5/12/2010","00:00.0","2010","5","12","Beason","NULL","NULL","Delta","CO","Great Blue Heron","NULL","01940","Great Blue Heron","Ardea","herodias",2010-05-12,"Colorado"
"477","6/4/2011","00:00.0","2011","6","4","Rawinski","NULL","NULL","Saguache","CO","Eared Grebe","NULL","00040","Eared Grebe","Podiceps","nigricollis",2011-06-04,"Colorado"
"478","6/4/2011","00:00.0","2011","6","4","Rawinski","NULL","NULL","Saguache","CO","White-faced Ibis","NULL","01870","White-faced Ibis","Plegadis","chihi",2011-06-04,"Colorado"
"479","6/4/2011","00:00.0","2011","6","4","Rawinski","NULL","NULL","Saguache","CO","American White Pelican","NULL","01250","American White Pelican","Pelecanus","erythrorhynchos",2011-06-04,"Colorado"
"480","5/20/2009","00:00.0","2009","5","20","Brummer","NULL","NULL","Gunnison","CO","Great Blue Heron","NULL","01940","Great Blue Heron","Ardea","herodias",2009-05-20,"Colorado"
"481","5/8/2010","00:00.0","2010","5","8","Fisher","NULL","NULL","Gunnison","CO","Great Blue Heron","NULL","01940","Great Blue Heron","Ardea","herodias",2010-05-08,"Colorado"
"482","6/7/2011","00:00.0","2011","6","7","Rawinski","NULL","NULL","Alamosa","CO","Western Grebe","NULL","00010","Western Grebe","Aechmophorus","occidentalis",2011-06-07,"Colorado"
"483","6/7/2011","00:00.0","2011","6","7","Rawinski","NULL","NULL","Alamosa","CO","Eared Grebe","NULL","00040","Eared Grebe","Podiceps","nigricollis",2011-06-07,"Colorado"
"484","4/5/2009","00:00.0","2009","4","5","Woodward","NULL","NULL","Mesa","CO","Great Blue Heron","NULL","01940","Great Blue Heron","Ardea","herodias",2009-04-05,"Colorado"
"485","4/18/2010","00:00.0","2010","4","18","Woodward","NULL","NULL","Mesa","CO","Great Blue Heron","NULL","01940","Great Blue Heron","Ardea","herodias",2010-04-18,"Colorado"
"486","8/21/2010","00:00.0","2010","8","21","Rawinski","NULL","NULL","Costilla","CO","Eared Grebe","NULL","00040","Eared Grebe","Podiceps","nigricollis",2010-08-21,"Colorado"
"487","8/21/2010","00:00.0","2010","8","21","Rawinski","NULL","NULL","Costilla","CO","Western Grebe","NULL","00010","Western Grebe","Aechmophorus","occidentalis",2010-08-21,"Colorado"
"488","6/8/2011","00:00.0","2011","6","8","Rawinski","NULL","NULL","Costilla","CO","Eared Grebe","NULL","00040","Eared Grebe","Podiceps","nigricollis",2011-06-08,"Colorado"
"489","6/8/2011","00:00.0","2011","6","8","Rawinski","NULL","NULL","Costilla","CO","Western Grebe","NULL","00010","Western Grebe","Aechmophorus","occidentalis",2011-06-08,"Colorado"
"490","6/8/2011","00:00.0","2011","6","8","Rawinski","NULL","NULL","Costilla","CO","Snowy Egret","NULL","01970","Snowy Egret","Egretta","thula",2011-06-08,"Colorado"
"491","6/7/2011","00:00.0","2011","6","7","Rawinski","NULL","NULL","Conejos","CO","Black Tern","NULL","00770","Black Tern","Chlidonias","niger",2011-06-07,"Colorado"
"492","4/24/2009","00:00.0","2009","4","24","George","NULL","NULL","Weld","CO","Great Blue Heron","NULL","01940","Great Blue Heron","Ardea","herodias",2009-04-24,"Colorado"
"493","4/24/2009","00:00.0","2009","4","24","George","NULL","NULL","Weld","CO","Black-crowned Night-Heron","NULL","02020","Black-crowned Night-Heron","Nycticorax","nycticorax",2009-04-24,"Colorado"
"494","4/26/2010","00:00.0","2010","4","26","George","NULL","NULL","Weld","CO","Great Blue Heron","NULL","01940","Great Blue Heron","Ardea","herodias",2010-04-26,"Colorado"
"495","4/26/2010","00:00.0","2010","4","26","George","NULL","NULL","Weld","CO","Black-crowned Night-Heron","NULL","02020","Black-crowned Night-Heron","Nycticorax","nycticorax",2010-04-26,"Colorado"
"496","7/14/2009","00:00.0","2009","7","14","Litteral","NULL","NULL","Routt","CO","Western Grebe","NULL","00010","Western Grebe","Aechmophorus","occidentalis",2009-07-14,"Colorado"
"497","4/28/2009","00:00.0","2009","4","28","Gano","NULL","NULL","Larimer","CO","Great Blue Heron","NULL","01940","Great Blue Heron","Ardea","herodias",2009-04-28,"Colorado"
"498","4/8/2010","00:00.0","2010","4","8","Gano","NULL","NULL","Larimer","CO","Great Blue Heron","NULL","01940","Great Blue Heron","Ardea","herodias",2010-04-08,"Colorado"
"499","6/25/2009","00:00.0","2009","6","25","Beason","NULL","NULL","Delta","CO","Western Grebe","NULL","00010","Western Grebe","Aechmophorus","occidentalis",2009-06-25,"Colorado"
"500","7/12/2009","00:00.0","2009","7","12","Leatherman","NULL","NULL","Prowers","CO","Black Tern","NULL","00770","Black Tern","Chlidonias","niger",2009-07-12,"Colorado"
"501","NULL","","2010","NULL","NULL","Maeda","NULL","NULL","Larimer","CO","Western Grebe","NULL","00010","Western Grebe","Aechmophorus","occidentalis",NA,"Colorado"
"502","NULL","","2010","NULL","NULL","Maeda","NULL","NULL","Larimer","CO","Double-crested Cormorant","NULL","01200","Double-crested Cormorant","Phalacrocorax","auritus",NA,"Colorado"
"503","5/16/2009","00:00.0","2009","5","16","Maeda","NULL","NULL","Larimer","CO","Double-crested Cormorant","NULL","01200","Double-crested Cormorant","Phalacrocorax","auritus",2009-05-16,"Colorado"
"504","7/6/2009","00:00.0","2009","7","6","Maeda","NULL","NULL","Larimer","CO","Western Grebe","NULL","00010","Western Grebe","Aechmophorus","occidentalis",2009-07-06,"Colorado"
"505","6/7/2011","00:00.0","2011","6","7","Rawinski","NULL","NULL","Saguache","CO","Black Tern","NULL","00770","Black Tern","Chlidonias","niger",2011-06-07,"Colorado"
"506","7/25/2010","00:00.0","2010","7","25","Miller","NULL","NULL","Weld","CO","Western Grebe","NULL","00010","Western Grebe","Aechmophorus","occidentalis",2010-07-25,"Colorado"
"507","7/25/2010","00:00.0","2010","7","25","Miller","NULL","NULL","Weld","CO","Clark's Grebe","NULL","00011","Clark's Grebe","Aechmophorus","clarkii",2010-07-25,"Colorado"
"508","NULL","","2009","NULL","NULL","Dexter","NULL","NULL","Montrose","CO","Great Blue Heron","NULL","01940","Great Blue Heron","Ardea","herodias",NA,"Colorado"
"509","4/25/2010","00:00.0","2010","4","25","Dexter","NULL","NULL","Montrose","CO","Great Blue Heron","NULL","01940","Great Blue Heron","Ardea","herodias",2010-04-25,"Colorado"
"510","7/25/2010","00:00.0","2010","7","25","Bradley","NULL","NULL","Mesa","CO","Western Grebe","NULL","00010","Western Grebe","Aechmophorus","occidentalis",2010-07-25,"Colorado"
"511","3/29/2009","00:00.0","2009","3","29","Takamine","NULL","NULL","Boulder","CO","Great Blue Heron","NULL","01940","Great Blue Heron","Ardea","herodias",2009-03-29,"Colorado"
"512","4/24/2010","00:00.0","2010","4","24","Cannon","NULL","NULL","Boulder","CO","Great Blue Heron","NULL","01940","Great Blue Heron","Ardea","herodias",2010-04-24,"Colorado"
"513","6/15/2009","00:00.0","2009","6","15","Hundertmark","NULL","NULL","Jackson","CO","California Gull","NULL","00530","California Gull","Larus","californicus",2009-06-15,"Colorado"
"514","6/15/2009","00:00.0","2009","6","15","Hundertmark","NULL","NULL","Jackson","CO","Franklin's Gull","NULL","00590","Franklin's Gull","Larus","pipixcan",2009-06-15,"Colorado"
"515","7/12/2009","00:00.0","2009","7","12","Hundertmark","NULL","NULL","Jackson","CO","Double-crested Cormorant","NULL","01200","Double-crested Cormorant","Phalacrocorax","auritus",2009-07-12,"Colorado"
"516","8/2/2009","00:00.0","2009","8","2","Hundertmark","NULL","NULL","Jackson","CO","Eared Grebe","NULL","00040","Eared Grebe","Podiceps","nigricollis",2009-08-02,"Colorado"
"517","8/2/2009","00:00.0","2009","8","2","Hundertmark","NULL","NULL","Jackson","CO","Snowy Egret","NULL","01970","Snowy Egret","Egretta","thula",2009-08-02,"Colorado"
"518","8/2/2009","00:00.0","2009","8","2","Hundertmark","NULL","NULL","Jackson","CO","Western Grebe","NULL","00010","Western Grebe","Aechmophorus","occidentalis",2009-08-02,"Colorado"
"519","5/16/2010","00:00.0","2010","5","16","Hundertmark","NULL","NULL","Jackson","CO","Franklin's Gull","NULL","00590","Franklin's Gull","Larus","pipixcan",2010-05-16,"Colorado"
"520","6/12/2010","00:00.0","2010","6","12","Hundertmark","NULL","NULL","Jackson","CO","California Gull","NULL","00530","California Gull","Larus","californicus",2010-06-12,"Colorado"
"521","6/12/2010","00:00.0","2010","6","12","Hundertmark","NULL","NULL","Jackson","CO","Double-crested Cormorant","NULL","01200","Double-crested Cormorant","Phalacrocorax","auritus",2010-06-12,"Colorado"
"522","6/12/2010","00:00.0","2010","6","12","Hundertmark","NULL","NULL","Jackson","CO","Western Grebe","NULL","00010","Western Grebe","Aechmophorus","occidentalis",2010-06-12,"Colorado"
"523","7/10/2010","00:00.0","2010","7","10","Hundertmark","NULL","NULL","Jackson","CO","Eared Grebe","NULL","00040","Eared Grebe","Podiceps","nigricollis",2010-07-10,"Colorado"
"524","7/10/2010","00:00.0","2010","7","10","Hundertmark","NULL","NULL","Jackson","CO","Forster's Tern","NULL","00690","Forster's Tern","Sterna","forsteri",2010-07-10,"Colorado"
"525","7/10/2010","00:00.0","2010","7","10","Hundertmark","NULL","NULL","Jackson","CO","Snowy Egret","NULL","01970","Snowy Egret","Egretta","thula",2010-07-10,"Colorado"
"526","7/12/2009","00:00.0","2009","7","12","Hundertmark","NULL","NULL","Jackson","CO","American White Pelican","NULL","01250","American White Pelican","Pelecanus","erythrorhynchos",2009-07-12,"Colorado"
"527","8/7/2010","00:00.0","2010","8","7","Hundertmark","NULL","NULL","Jackson","CO","American White Pelican","NULL","01250","American White Pelican","Pelecanus","erythrorhynchos",2010-08-07,"Colorado"
"528","NULL","","2010","NULL","NULL","Lynch","NULL","NULL","Jefferson","CO","Great Blue Heron","NULL","01940","Great Blue Heron","Ardea","herodias",NA,"Colorado"
"529","4/10/2009","00:00.0","2009","4","10","Neubaum","NULL","NULL","Mesa","CO","Great Blue Heron","NULL","01940","Great Blue Heron","Ardea","herodias",2009-04-10,"Colorado"
"530","4/22/2010","00:00.0","2010","4","22","Neubaum","NULL","NULL","Mesa","CO","Great Blue Heron","NULL","01940","Great Blue Heron","Ardea","herodias",2010-04-22,"Colorado"
"531","4/19/2009","00:00.0","2009","4","19","Hilkey","NULL","NULL","Routt","CO","Great Blue Heron","NULL","01940","Great Blue Heron","Ardea","herodias",2009-04-19,"Colorado"
"532","4/15/2010","00:00.0","2010","4","15","Glabach","NULL","NULL","Larimer","CO","Great Blue Heron","NULL","01940","Great Blue Heron","Ardea","herodias",2010-04-15,"Colorado"
"533","4/8/2009","00:00.0","2009","4","8","Lowsky","NULL","NULL","Pitkin","CO","Great Blue Heron","NULL","01940","Great Blue Heron","Ardea","herodias",2009-04-08,"Colorado"
"534","8/1/2010","00:00.0","2010","8","1","Lowsky","NULL","NULL","Pitkin","CO","Great Blue Heron","NULL","01940","Great Blue Heron","Ardea","herodias",2010-08-01,"Colorado"
"535","5/29/2003","00:00.0","2003","5","29","NULL","NULL","NULL","Kiowa","CO","White-faced Ibis","NULL","01870","White-faced Ibis","Plegadis","chihi",2003-05-29,"Colorado"
"536","6/27/2003","00:00.0","2003","6","27","Wilson","NULL","NULL","Kiowa","CO","White-faced Ibis","NULL","01870","White-faced Ibis","Plegadis","chihi",2003-06-27,"Colorado"
"537","NULL","","2001","NULL","NULL","Johnson","NULL","NULL","Jackson","CO","Eared Grebe","NULL","00040","Eared Grebe","Podiceps","nigricollis",NA,"Colorado"
"538","NULL","","2005","NULL","NULL","NULL","NULL","NULL","Jackson","CO","Eared Grebe","NULL","00040","Eared Grebe","Podiceps","nigricollis",NA,"Colorado"
"539","7/23/2002","00:00.0","2002","7","23","NULL","NULL","NULL","Jackson","CO","Eared Grebe","NULL","00040","Eared Grebe","Podiceps","nigricollis",2002-07-23,"Colorado"
"540","NULL","","2005","NULL","NULL","NULL","NULL","NULL","Jackson","CO","Eared Grebe","NULL","00040","Eared Grebe","Podiceps","nigricollis",NA,"Colorado"
"541","7/10/2004","00:00.0","2004","7","10","NULL","NULL","NULL","Jackson","CO","Eared Grebe","NULL","00040","Eared Grebe","Podiceps","nigricollis",2004-07-10,"Colorado"
"542","NULL","","2005","NULL","NULL","NULL","NULL","NULL","Jackson","CO","Black-crowned Night-Heron","NULL","02020","Black-crowned Night-Heron","Nycticorax","nycticorax",NA,"Colorado"
"543","NULL","","2005","NULL","NULL","NULL","NULL","NULL","Jackson","CO","Eared Grebe","NULL","00040","Eared Grebe","Podiceps","nigricollis",NA,"Colorado"
"544","7/13/1999","00:00.0","1999","7","13","NULL","NULL","NULL","Jackson","CO","Eared Grebe","NULL","00040","Eared Grebe","Podiceps","nigricollis",1999-07-13,"Colorado"
"545","7/15/2000","00:00.0","2000","7","15","NULL","NULL","NULL","Jackson","CO","Eared Grebe","NULL","00040","Eared Grebe","Podiceps","nigricollis",2000-07-15,"Colorado"
"546","NULL","","1987","NULL","NULL","Colonial Bird Register","NULL","NULL","Jackson","CO","Black-crowned Night-Heron","NULL","02020","Black-crowned Night-Heron","Nycticorax","nycticorax",NA,"Colorado"
"547","NULL","","1988","NULL","NULL","Colonial Bird Register","NULL","NULL","Jackson","CO","Black-crowned Night-Heron","NULL","02020","Black-crowned Night-Heron","Nycticorax","nycticorax",NA,"Colorado"
"548","6/26/1989","00:00.0","1989","6","26","NULL","NULL","NULL","Jackson","CO","Black-crowned Night-Heron","NULL","02020","Black-crowned Night-Heron","Nycticorax","nycticorax",1989-06-26,"Colorado"
"549","7/14/1999","00:00.0","1999","7","14","NULL","NULL","NULL","Jackson","CO","Black-crowned Night-Heron","NULL","02020","Black-crowned Night-Heron","Nycticorax","nycticorax",1999-07-14,"Colorado"
"550","7/15/2000","00:00.0","2000","7","15","NULL","NULL","NULL","Jackson","CO","Black-crowned Night-Heron","NULL","02020","Black-crowned Night-Heron","Nycticorax","nycticorax",2000-07-15,"Colorado"
"551","7/17/2001","00:00.0","2001","7","17","NULL","NULL","NULL","Jackson","CO","Black-crowned Night-Heron","NULL","02020","Black-crowned Night-Heron","Nycticorax","nycticorax",2001-07-17,"Colorado"
"552","NULL","","2007","NULL","NULL","Miksh","NULL","NULL","Larimer","CO","Great Blue Heron","NULL","01940","Great Blue Heron","Ardea","herodias",NA,"Colorado"
"553","4/6/2004","00:00.0","2004","4","6","NULL","NULL","NULL","Larimer","CO","Great Blue Heron","NULL","01940","Great Blue Heron","Ardea","herodias",2004-04-06,"Colorado"
"554","4/11/2005","00:00.0","2005","4","11","NULL","NULL","NULL","Larimer","CO","Great Blue Heron","NULL","01940","Great Blue Heron","Ardea","herodias",2005-04-11,"Colorado"
"555","NULL","","2000","NULL","NULL","NULL","NULL","NULL","Larimer","CO","Great Blue Heron","NULL","01940","Great Blue Heron","Ardea","herodias",NA,"Colorado"
"556","NULL","","2008","NULL","NULL","District Wildlife Manager","NULL","NULL","Weld","CO","Great Blue Heron","NULL","01940","Great Blue Heron","Ardea","herodias",NA,"Colorado"
"557","NULL","","2005","NULL","NULL","NULL","NULL","NULL","Delta","CO","Great Blue Heron","NULL","01940","Great Blue Heron","Ardea","herodias",NA,"Colorado"
"558","NULL","","1999","NULL","NULL","NULL","NULL","NULL","Douglas","CO","Great Blue Heron","NULL","01940","Great Blue Heron","Ardea","herodias",NA,"Colorado"
"559","NULL","","2003","NULL","NULL","NULL","NULL","NULL","Douglas","CO","Great Blue Heron","NULL","01940","Great Blue Heron","Ardea","herodias",NA,"Colorado"
"560","NULL","","2006","NULL","NULL","Metz","NULL","NULL","Douglas","CO","Great Blue Heron","NULL","01940","Great Blue Heron","Ardea","herodias",NA,"Colorado"
"561","NULL","","2007","NULL","NULL","NULL","NULL","NULL","Douglas","CO","Great Blue Heron","NULL","01940","Great Blue Heron","Ardea","herodias",NA,"Colorado"
"562","5/22/2005","00:00.0","2005","5","22","NULL","NULL","NULL","Douglas","CO","Great Blue Heron","NULL","01940","Great Blue Heron","Ardea","herodias",2005-05-22,"Colorado"
"563","7/22/1998","00:00.0","1998","7","22","NULL","NULL","NULL","Mesa","CO","Eared Grebe","NULL","00040","Eared Grebe","Podiceps","nigricollis",1998-07-22,"Colorado"
"564","8/12/1999","00:00.0","1999","8","12","NULL","NULL","NULL","Mesa","CO","Eared Grebe","NULL","00040","Eared Grebe","Podiceps","nigricollis",1999-08-12,"Colorado"
"3385","5/15/1905","00:00.0","1905","5","15","Behle 1958","NULL","NULL","Davis","UT","California Gull","NULL","00530","California Gull","Larus","californicus",1905-05-15,"Utah"
"3386","5/15/1905","00:00.0","1905","5","15","Behle 1958","NULL","NULL","Davis","UT","Great Blue Heron","NULL","01940","Great Blue Heron","Ardea","herodias",1905-05-15,"Utah"
"3387","NULL","","1983","NULL","NULL","Robinette et al. 1993","NULL","NULL","Davis","UT","California Gull","NULL","00530","California Gull","Larus","californicus",NA,"Utah"
"3388","NULL","","1986","NULL","NULL","Robinette et al. 1993","NULL","NULL","Davis","UT","California Gull","NULL","00530","California Gull","Larus","californicus",NA,"Utah"
"3389","NULL","","1987","NULL","NULL","Robinette et al. 1993","NULL","NULL","Davis","UT","California Gull","NULL","00530","California Gull","Larus","californicus",NA,"Utah"
"3390","NULL","","1989","NULL","NULL","Robinette et al. 1993","NULL","NULL","Davis","UT","California Gull","NULL","00530","California Gull","Larus","californicus",NA,"Utah"
"3391","NULL","","1990","NULL","NULL","Robinette et al. 1993","NULL","NULL","Davis","UT","California Gull","NULL","00530","California Gull","Larus","californicus",NA,"Utah"
"3392","NULL","","1991","NULL","NULL","Robinette et al. 1993","NULL","NULL","Davis","UT","California Gull","NULL","00530","California Gull","Larus","californicus",NA,"Utah"
"3393","NULL","","1993","NULL","NULL","Robinette et al. 1993","NULL","NULL","Davis","UT","California Gull","NULL","00530","California Gull","Larus","californicus",NA,"Utah"
"3394","5/10/1906","00:00.0","1906","5","10","Behle 1958","NULL","NULL","Davis","UT","Great Blue Heron","NULL","01940","Great Blue Heron","Ardea","herodias",1906-05-10,"Utah"
"3395","6/25/1934","00:00.0","1934","6","25","Behle 1958","NULL","NULL","Davis","UT","California Gull","NULL","00530","California Gull","Larus","californicus",1934-06-25,"Utah"
"3396","4/10/1935","00:00.0","1935","4","10","Behle 1958","NULL","NULL","Davis","UT","Great Blue Heron","NULL","01940","Great Blue Heron","Ardea","herodias",1935-04-10,"Utah"
"3397","5/7/1937","00:00.0","1937","5","7","Behle 1958","NULL","NULL","Davis","UT","California Gull","NULL","00530","California Gull","Larus","californicus",1937-05-07,"Utah"
"3398","NULL","","1907","5","NULL","Behle 1958","NULL","NULL","Davis","UT","California Gull","SurveyDate: 5/-/1907","00530","California Gull","Larus","californicus",NA,"Utah"
"3399","NULL","","1907","5","NULL","Behle 1958","NULL","NULL","Davis","UT","Great Blue Heron","SurveyDate:5/-/1907","01940","Great Blue Heron","Ardea","herodias",NA,"Utah"
"3400","6/26/2009","00:00.0","2009","6","26","NULL","NULL","NULL","Teton","WY","Great Blue Heron","NULL","01940","Great Blue Heron","Ardea","herodias",2009-06-26,"Wyoming"
"3401","6/26/2010","00:00.0","2010","6","26","NULL","NULL","NULL","Teton","WY","Great Blue Heron","NULL","01940","Great Blue Heron","Ardea","herodias",2010-06-26,"Wyoming"
"3402","6/22/2011","00:00.0","2011","6","22","NULL","NULL","NULL","Teton","WY","Great Blue Heron","NULL","01940","Great Blue Heron","Ardea","herodias",2011-06-22,"Wyoming"
"3403","6/30/2009","00:00.0","2009","6","30","Kilpatrick","NULL","NULL","Albany","WY","American White Pelican","NULL","01250","American White Pelican","Pelecanus","erythrorhynchos",2009-06-30,"Wyoming"
"3404","6/30/2010","00:00.0","2010","6","30","Shill","NULL","NULL","Albany","WY","American White Pelican","NULL","01250","American White Pelican","Pelecanus","erythrorhynchos",2010-06-30,"Wyoming"
"3405","7/7/2011","00:00.0","2011","7","7","NULL","NULL","NULL","Crook","WY","Great Blue Heron","NULL","01940","Great Blue Heron","Ardea","herodias",2011-07-07,"Wyoming"
"3406","7/7/2011","00:00.0","2011","7","7","NULL","NULL","NULL","Crook","WY","Great Blue Heron","NULL","01940","Great Blue Heron","Ardea","herodias",2011-07-07,"Wyoming"
"3407","5/20/2010","00:00.0","2010","5","20","NULL","NULL","NULL","Sublette","WY","Great Blue Heron","NULL","01940","Great Blue Heron","Ardea","herodias",2010-05-20,"Wyoming"
"3408","6/30/2011","00:00.0","2011","6","30","NULL","NULL","NULL","Sublette","WY","Great Blue Heron","NULL","01940","Great Blue Heron","Ardea","herodias",2011-06-30,"Wyoming"
"3409","4/16/2010","00:00.0","2010","4","16","NULL","NULL","NULL","Sublette","WY","Great Blue Heron","NULL","01940","Great Blue Heron","Ardea","herodias",2010-04-16,"Wyoming"
"3410","7/11/2010","00:00.0","2010","7","11","Shill","NULL","NULL","Carbon","WY","Western Grebe","NULL","00010","Western Grebe","Aechmophorus","occidentalis",2010-07-11,"Wyoming"
"3411","7/11/2010","00:00.0","2010","7","11","Shill","NULL","NULL","Carbon","WY","Black-crowned Night-Heron","NULL","02020","Black-crowned Night-Heron","Nycticorax","nycticorax",2010-07-11,"Wyoming"
"3412","7/15/2009","00:00.0","2009","7","15","NULL","NULL","NULL","Teton","WY","Great Blue Heron","NULL","01940","Great Blue Heron","Ardea","herodias",2009-07-15,"Wyoming"
"3413","7/14/2010","00:00.0","2010","7","14","NULL","NULL","NULL","Teton","WY","Great Blue Heron","NULL","01940","Great Blue Heron","Ardea","herodias",2010-07-14,"Wyoming"
"3414","6/23/2011","00:00.0","2011","6","23","NULL","NULL","NULL","Teton","WY","Great Blue Heron","NULL","01940","Great Blue Heron","Ardea","herodias",2011-06-23,"Wyoming"
"3415","7/1/2010","00:00.0","2010","7","1","Shill","NULL","NULL","Albany","WY","Western Grebe","NULL","00010","Western Grebe","Aechmophorus","occidentalis",2010-07-01,"Wyoming"
"3416","7/1/2010","00:00.0","2010","7","1","Shill","NULL","NULL","Albany","WY","Forster's Tern","NULL","00690","Forster's Tern","Sterna","forsteri",2010-07-01,"Wyoming"
"3417","7/1/2010","00:00.0","2010","7","1","Shill","NULL","NULL","Albany","WY","Black-crowned Night-Heron","NULL","02020","Black-crowned Night-Heron","Nycticorax","nycticorax",2010-07-01,"Wyoming"
"3418","6/23/2011","00:00.0","2011","6","23","Orabona","NULL","NULL","Sheridan","WY","Great Blue Heron","NULL","01940","Great Blue Heron","Ardea","herodias",2011-06-23,"Wyoming"
"3419","6/23/2011","00:00.0","2011","6","23","Orabona","NULL","NULL","Sheridan","WY","Great Blue Heron","NULL","01940","Great Blue Heron","Ardea","herodias",2011-06-23,"Wyoming"
"3420","5/20/2010","00:00.0","2010","5","20","NULL","NULL","NULL","Sublette","WY","Great Blue Heron","NULL","01940","Great Blue Heron","Ardea","herodias",2010-05-20,"Wyoming"
"3421","6/30/2011","00:00.0","2011","6","30","NULL","NULL","NULL","Sublette","WY","Great Blue Heron","NULL","01940","Great Blue Heron","Ardea","herodias",2011-06-30,"Wyoming"
"3422","5/20/2010","00:00.0","2010","5","20","Orabona","NULL","NULL","Lincoln","WY","Great Blue Heron","NULL","01940","Great Blue Heron","Ardea","herodias",2010-05-20,"Wyoming"
"3423","6/28/2011","00:00.0","2011","6","28","Orabona","NULL","NULL","Lincoln","WY","Great Blue Heron","NULL","01940","Great Blue Heron","Ardea","herodias",2011-06-28,"Wyoming"
"3424","5/5/2010","00:00.0","2010","5","5","NULL","NULL","NULL","Fremont","WY","Great Blue Heron","NULL","01940","Great Blue Heron","Ardea","herodias",2010-05-05,"Wyoming"
"3425","6/3/2011","00:00.0","2011","6","3","Orabona","NULL","NULL","Sublette","WY","Great Blue Heron","NULL","01940","Great Blue Heron","Ardea","herodias",2011-06-03,"Wyoming"
"3426","4/28/2011","00:00.0","2011","4","28","NULL","NULL","NULL","Platte","WY","Great Blue Heron","NULL","01940","Great Blue Heron","Ardea","herodias",2011-04-28,"Wyoming"
"3427","6/3/2011","00:00.0","2011","6","3","Orabona","NULL","NULL","Sweetwater","WY","Great Blue Heron","NULL","01940","Great Blue Heron","Ardea","herodias",2011-06-03,"Wyoming"
"3428","6/3/2011","00:00.0","2011","6","3","NULL","NULL","NULL","Sublette","WY","Great Blue Heron","NULL","01940","Great Blue Heron","Ardea","herodias",2011-06-03,"Wyoming"
"3429","6/3/2011","00:00.0","2011","6","3","NULL","NULL","NULL","Sublette","WY","Great Blue Heron","NULL","01940","Great Blue Heron","Ardea","herodias",2011-06-03,"Wyoming"
"3430","6/3/2011","00:00.0","2011","6","3","Orabona","NULL","NULL","Sublette","WY","Great Blue Heron","NULL","01940","Great Blue Heron","Ardea","herodias",2011-06-03,"Wyoming"
"3431","5/19/2010","00:00.0","2010","5","19","NULL","NULL","NULL","Lincoln","WY","Great Blue Heron","NULL","01940","Great Blue Heron","Ardea","herodias",2010-05-19,"Wyoming"
"3432","6/30/2011","00:00.0","2011","6","30","NULL","NULL","NULL","Lincoln","WY","Great Blue Heron","NULL","01940","Great Blue Heron","Ardea","herodias",2011-06-30,"Wyoming"
"3433","6/2/2011","00:00.0","2011","6","2","NULL","NULL","NULL","Sweetwater","WY","Great Blue Heron","NULL","01940","Great Blue Heron","Ardea","herodias",2011-06-02,"Wyoming"
"3434","4/22/2009","00:00.0","2009","4","22","Lebsack","NULL","NULL","Laramie","WY","Black-crowned Night-Heron","NULL","02020","Black-crowned Night-Heron","Nycticorax","nycticorax",2009-04-22,"Wyoming"
"3435","5/18/2010","00:00.0","2010","5","18","Gorges","NULL","NULL","Laramie","WY","Black-crowned Night-Heron","NULL","02020","Black-crowned Night-Heron","Nycticorax","nycticorax",2010-05-18,"Wyoming"
"3436","6/30/2009","00:00.0","2009","6","30","Orabona/Kilpatrick","NULL","NULL","Albany","WY","White-faced Ibis","NULL","01870","White-faced Ibis","Plegadis","chihi",2009-06-30,"Wyoming"
"3437","6/30/2009","00:00.0","2009","6","30","Orabona/Kilpatrick","NULL","NULL","Albany","WY","Forster's Tern","NULL","00690","Forster's Tern","Sterna","forsteri",2009-06-30,"Wyoming"
"3438","6/30/2009","00:00.0","2009","6","30","Orabona/Kilpatrick","NULL","NULL","Albany","WY","Black-crowned Night-Heron","NULL","02020","Black-crowned Night-Heron","Nycticorax","nycticorax",2009-06-30,"Wyoming"
"3439","7/1/2009","00:00.0","2009","7","1","NULL","NULL","NULL","Carbon","WY","Great Blue Heron","NULL","01940","Great Blue Heron","Ardea","herodias",2009-07-01,"Wyoming"
"3440","6/30/2009","00:00.0","2009","6","30","Orabona/Kilpatrick","NULL","NULL","Albany","WY","Forster's Tern","NULL","00690","Forster's Tern","Sterna","forsteri",2009-06-30,"Wyoming"
"3441","4/29/2009","00:00.0","2009","4","29","Knox","NULL","NULL","Femont","WY","Great Blue Heron","NULL","01940","Great Blue Heron","Ardea","herodias",2009-04-29,"Wyoming"
"3442","5/26/2010","00:00.0","2010","5","26","Shill","NULL","NULL","Fremont","WY","Great Blue Heron","NULL","01940","Great Blue Heron","Ardea","herodias",2010-05-26,"Wyoming"
"3443","5/25/2011","00:00.0","2011","5","25","Rudd","NULL","NULL","Fremont","WY","Great Blue Heron","NULL","01940","Great Blue Heron","Ardea","herodias",2011-05-25,"Wyoming"
"3444","5/14/2011","00:00.0","2011","5","14","Orabona","NULL","NULL","Sheridan","WY","Great Blue Heron","NULL","01940","Great Blue Heron","Ardea","herodias",2011-05-14,"Wyoming"
"3445","6/23/2011","00:00.0","2011","6","23","Orabona","NULL","NULL","Johnson","WY","Great Blue Heron","NULL","01940","Great Blue Heron","Ardea","herodias",2011-06-23,"Wyoming"
"3446","7/7/2011","00:00.0","2011","7","7","NULL","NULL","NULL","Campbell","WY","Great Blue Heron","NULL","01940","Great Blue Heron","Ardea","herodias",2011-07-07,"Wyoming"
"3447","6/17/2009","00:00.0","2009","6","17","Kilpatrick","NULL","NULL","Big Horn","WY","Western or Clark's Grebe","","NULL",NA,NA,NA,2009-06-17,"Wyoming"
"3448","4/13/2009","00:00.0","2009","4","13","Oakleaf","NULL","NULL","Carbon","WY","Great Blue Heron","NULL","01940","Great Blue Heron","Ardea","herodias",2009-04-13,"Wyoming"
"3449","5/18/2011","00:00.0","2011","5","18","NULL","NULL","NULL","Fremont","WY","Great Blue Heron","NULL","01940","Great Blue Heron","Ardea","herodias",2011-05-18,"Wyoming"
"3450","5/4/2010","00:00.0","2010","5","4","NULL","NULL","NULL","Fremont","WY","Great Blue Heron","NULL","01940","Great Blue Heron","Ardea","herodias",2010-05-04,"Wyoming"
"3451","5/4/2010","00:00.0","2010","5","4","NULL","NULL","NULL","Fremont","WY","Great Blue Heron","NULL","01940","Great Blue Heron","Ardea","herodias",2010-05-04,"Wyoming"
"3452","4/28/2011","00:00.0","2011","4","28","Orabona","NULL","NULL","Converse","WY","Great Blue Heron","NULL","01940","Great Blue Heron","Ardea","herodias",2011-04-28,"Wyoming"
"3453","4/28/2011","00:00.0","2011","4","28","Orabona","NULL","NULL","Converse","WY","Great Blue Heron","NULL","01940","Great Blue Heron","Ardea","herodias",2011-04-28,"Wyoming"
"3454","5/24/2011","00:00.0","2011","5","24","NULL","NULL","NULL","Big Horn","WY","Great Blue Heron","NULL","01940","Great Blue Heron","Ardea","herodias",2011-05-24,"Wyoming"
"3455","6/3/2010","00:00.0","2010","6","3","NULL","NULL","NULL","Lincoln","WY","Great Blue Heron","NULL","01940","Great Blue Heron","Ardea","herodias",2010-06-03,"Wyoming"
"3456","4/26/2010","00:00.0","2010","4","26","NULL","NULL","NULL","Lincoln","WY","Great Blue Heron","NULL","01940","Great Blue Heron","Ardea","herodias",2010-04-26,"Wyoming"
"3457","4/26/2010","00:00.0","2010","4","26","NULL","NULL","NULL","Lincoln","WY","Great Blue Heron","NULL","01940","Great Blue Heron","Ardea","herodias",2010-04-26,"Wyoming"
"3458","4/26/2010","00:00.0","2010","4","26","NULL","NULL","NULL","Lincoln","WY","Great Blue Heron","NULL","01940","Great Blue Heron","Ardea","herodias",2010-04-26,"Wyoming"
"3459","6/2/2010","00:00.0","2010","6","2","NULL","NULL","NULL","Sweetwater","WY","Great Blue Heron","NULL","01940","Great Blue Heron","Ardea","herodias",2010-06-02,"Wyoming"
"3460","7/11/2010","00:00.0","2010","7","11","Shill","NULL","NULL","Carbon","WY","Double-crested Cormorant","NULL","01200","Double-crested Cormorant","Phalacrocorax","auritus",2010-07-11,"Wyoming"
"3461","7/11/2010","00:00.0","2010","7","11","Shill","NULL","NULL","Carbon","WY","California Gull","NULL","00530","California Gull","Larus","californicus",2010-07-11,"Wyoming"
"3462","7/11/2010","00:00.0","2010","7","11","Shill","NULL","NULL","Carbon","WY","American White Pelican","NULL","01250","American White Pelican","Pelecanus","erythrorhynchos",2010-07-11,"Wyoming"
"3463","6/29/2011","00:00.0","2011","6","29","Orabona","NULL","NULL","Carbon","WY","Double-crested Cormorant","NULL","01200","Double-crested Cormorant","Phalacrocorax","auritus",2011-06-29,"Wyoming"
"3464","6/29/2011","00:00.0","2011","6","29","Orabona","NULL","NULL","Carbon","WY","Black-crowned Night-Heron","NULL","02020","Black-crowned Night-Heron","Nycticorax","nycticorax",2011-06-29,"Wyoming"
"3465","6/29/2011","00:00.0","2011","6","29","Orabona","NULL","NULL","Carbon","WY","American White Pelican","NULL","01250","American White Pelican","Pelecanus","erythrorhynchos",2011-06-29,"Wyoming"
"3466","6/30/2011","00:00.0","2011","6","30","Orabona","NULL","NULL","Carbon","WY","California Gull","NULL","00530","California Gull","Larus","californicus",2011-06-30,"Wyoming"
"3467","6/30/2009","00:00.0","2009","6","30","Orabona/Kilpatrick","NULL","NULL","Albany","WY","Forster's Tern","NULL","00690","Forster's Tern","Sterna","forsteri",2009-06-30,"Wyoming"
"3468","4/13/2009","00:00.0","2009","4","13","Oakleaf","NULL","NULL","Carbon","WY","Great Blue Heron","NULL","01940","Great Blue Heron","Ardea","herodias",2009-04-13,"Wyoming"
"3469","6/23/2011","00:00.0","2011","6","23","Orabona","NULL","NULL","Sheridan","WY","Great Blue Heron","NULL","01940","Great Blue Heron","Ardea","herodias",2011-06-23,"Wyoming"
"3470","4/13/2009","00:00.0","2009","4","13","Oakleaf","NULL","NULL","Carbon","WY","Great Blue Heron","NULL","01940","Great Blue Heron","Ardea","herodias",2009-04-13,"Wyoming"
"3471","7/7/2011","00:00.0","2011","7","7","Orabona","NULL","NULL","Crook","WY","Great Blue Heron","NULL","01940","Great Blue Heron","Ardea","herodias",2011-07-07,"Wyoming"
"3472","7/7/2011","00:00.0","2011","7","7","Orabona","NULL","NULL","Crook","WY","Double-crested Cormorant","NULL","01200","Double-crested Cormorant","Phalacrocorax","auritus",2011-07-07,"Wyoming"
"3473","3/29/2011","00:00.0","2011","3","29","NULL","NULL","NULL","Teton","WY","Great Blue Heron","NULL","01940","Great Blue Heron","Ardea","herodias",2011-03-29,"Wyoming"
"3474","7/11/2009","00:00.0","2009","7","11","Orabona/Kilpatrick","NULL","NULL","Natrona","WY","Snowy Egret","NULL","01970","Snowy Egret","Egretta","thula",2009-07-11,"Wyoming"
"3475","7/11/2009","00:00.0","2009","7","11","Orabona/Kilpatrick","NULL","NULL","Natrona","WY","Double-crested Cormorant","NULL","01200","Double-crested Cormorant","Phalacrocorax","auritus",2009-07-11,"Wyoming"
"3476","7/11/2009","00:00.0","2009","7","11","Orabona/Kilpatrick","NULL","NULL","Natrona","WY","California Gull","NULL","00530","California Gull","Larus","californicus",2009-07-11,"Wyoming"
"3477","7/11/2009","00:00.0","2009","7","11","Orabona/Kilpatrick","NULL","NULL","Natrona","WY","Black-crowned Night-Heron","NULL","02020","Black-crowned Night-Heron","Nycticorax","nycticorax",2009-07-11,"Wyoming"
"3478","6/12/2009","00:00.0","2009","6","12","NULL","NULL","NULL","Teton","WY","Great Blue Heron","NULL","01940","Great Blue Heron","Ardea","herodias",2009-06-12,"Wyoming"
"3479","4/13/2009","00:00.0","2009","4","13","Oakleaf","NULL","NULL","Carbon","WY","Great Blue Heron","NULL","01940","Great Blue Heron","Ardea","herodias",2009-04-13,"Wyoming"
"3480","5/14/2011","00:00.0","2011","5","14","Orabona","NULL","NULL","Sheridan","WY","Great Blue Heron","NULL","01940","Great Blue Heron","Ardea","herodias",2011-05-14,"Wyoming"
"3481","6/23/2011","00:00.0","2011","6","23","Orabona","NULL","NULL","Sheridan","WY","Great Blue Heron","NULL","01940","Great Blue Heron","Ardea","herodias",2011-06-23,"Wyoming"
"3482","5/5/2011","00:00.0","2011","5","5","Orabona","NULL","NULL","Weston","WY","Great Blue Heron","NULL","01940","Great Blue Heron","Ardea","herodias",2011-05-05,"Wyoming"
"3483","5/18/2011","00:00.0","2011","5","18","NULL","NULL","NULL","Fremont","WY","Great Blue Heron","NULL","01940","Great Blue Heron","Ardea","herodias",2011-05-18,"Wyoming"
"3484","5/18/2011","00:00.0","2011","5","18","NULL","NULL","NULL","Fremont","WY","Great Blue Heron","NULL","01940","Great Blue Heron","Ardea","herodias",2011-05-18,"Wyoming"
"3485","8/2/2009","00:00.0","2009","8","2","Baril","NULL","NULL","Teton","WY","Double-crested Cormorant","NULL","01200","Double-crested Cormorant","Phalacrocorax","auritus",2009-08-02,"Wyoming"
"3486","8/2/2009","00:00.0","2009","8","2","Baril","NULL","NULL","Teton","WY","American White Pelican","NULL","01250","American White Pelican","Pelecanus","erythrorhynchos",2009-08-02,"Wyoming"
"3487","NULL","","2010","NULL","NULL","Baril","NULL","NULL","Teton","WY","Double-crested Cormorant","SurveyDate: 5:8/-/ 2010","01200","Double-crested Cormorant","Phalacrocorax","auritus",NA,"Wyoming"
"3488","NULL","","2010","NULL","NULL","Baril","NULL","NULL","Teton","WY","California Gull","SurveyDate: 5:8/-/ 2010","00530","California Gull","Larus","californicus",NA,"Wyoming"
"3489","NULL","","2010","NULL","NULL","Baril","NULL","NULL","Teton","WY","American White Pelican","SurveyDate: 5:8/-/ 2010","01250","American White Pelican","Pelecanus","erythrorhynchos",NA,"Wyoming"
"3490","NULL","","1990","NULL","NULL","NULL","NULL","NULL","Carbon","WY","Snowy Egret","NULL","01970","Snowy Egret","Egretta","thula",NA,"Wyoming"
"3491","NULL","","1990","NULL","NULL","NULL","NULL","NULL","Carbon","WY","Forster's Tern","NULL","00690","Forster's Tern","Sterna","forsteri",NA,"Wyoming"
"3492","NULL","","1990","NULL","NULL","NULL","NULL","NULL","Carbon","WY","Black-crowned Night-Heron","NULL","02020","Black-crowned Night-Heron","Nycticorax","nycticorax",NA,"Wyoming"
"3493","NULL","","1994","NULL","NULL","NULL","NULL","NULL","Carbon","WY","Forster's Tern","NULL","00690","Forster's Tern","Sterna","forsteri",NA,"Wyoming"
"3494","NULL","","1994","NULL","NULL","NULL","NULL","NULL","Carbon","WY","Black-crowned Night-Heron","NULL","02020","Black-crowned Night-Heron","Nycticorax","nycticorax",NA,"Wyoming"
"3495","NULL","","1995","NULL","NULL","NULL","NULL","NULL","Carbon","WY","Forster's Tern","NULL","00690","Forster's Tern","Sterna","forsteri",NA,"Wyoming"
"3496","NULL","","1995","NULL","NULL","NULL","NULL","NULL","Carbon","WY","Black-crowned Night-Heron","NULL","02020","Black-crowned Night-Heron","Nycticorax","nycticorax",NA,"Wyoming"
"3497","NULL","","1996","NULL","NULL","NULL","NULL","NULL","Carbon","WY","White-faced Ibis","NULL","01870","White-faced Ibis","Plegadis","chihi",NA,"Wyoming"
"3498","NULL","","1996","NULL","NULL","NULL","NULL","NULL","Carbon","WY","Snowy Egret","NULL","01970","Snowy Egret","Egretta","thula",NA,"Wyoming"
"3499","NULL","","1996","NULL","NULL","NULL","NULL","NULL","Carbon","WY","Forster's Tern","NULL","00690","Forster's Tern","Sterna","forsteri",NA,"Wyoming"
"3500","NULL","","1996","NULL","NULL","NULL","NULL","NULL","Carbon","WY","Black-crowned Night-Heron","NULL","02020","Black-crowned Night-Heron","Nycticorax","nycticorax",NA,"Wyoming"
"3501","NULL","","1997","NULL","NULL","NULL","NULL","NULL","Carbon","WY","White-faced Ibis","NULL","01870","White-faced Ibis","Plegadis","chihi",NA,"Wyoming"
"3502","NULL","","1997","NULL","NULL","NULL","NULL","NULL","Carbon","WY","Snowy Egret","NULL","01970","Snowy Egret","Egretta","thula",NA,"Wyoming"
"3503","NULL","","1997","NULL","NULL","NULL","NULL","NULL","Carbon","WY","Forster's Tern","NULL","00690","Forster's Tern","Sterna","forsteri",NA,"Wyoming"
"3504","NULL","","1997","NULL","NULL","NULL","NULL","NULL","Carbon","WY","Black-crowned Night-Heron","NULL","02020","Black-crowned Night-Heron","Nycticorax","nycticorax",NA,"Wyoming"
"3505","NULL","","1998","NULL","NULL","NULL","NULL","NULL","Carbon","WY","White-faced Ibis","NULL","01870","White-faced Ibis","Plegadis","chihi",NA,"Wyoming"
"3506","NULL","","1998","NULL","NULL","NULL","NULL","NULL","Carbon","WY","Snowy Egret","NULL","01970","Snowy Egret","Egretta","thula",NA,"Wyoming"
"3507","NULL","","1998","NULL","NULL","NULL","NULL","NULL","Carbon","WY","Forster's Tern","NULL","00690","Forster's Tern","Sterna","forsteri",NA,"Wyoming"
"3508","NULL","","1998","NULL","NULL","NULL","NULL","NULL","Carbon","WY","Black-crowned Night-Heron","NULL","02020","Black-crowned Night-Heron","Nycticorax","nycticorax",NA,"Wyoming"
"3509","NULL","","1999","NULL","NULL","NULL","NULL","NULL","Carbon","WY","White-faced Ibis","NULL","01870","White-faced Ibis","Plegadis","chihi",NA,"Wyoming"
"3510","NULL","","1999","NULL","NULL","NULL","NULL","NULL","Carbon","WY","Snowy Egret","NULL","01970","Snowy Egret","Egretta","thula",NA,"Wyoming"
"3511","NULL","","1999","NULL","NULL","NULL","NULL","NULL","Carbon","WY","Forster's Tern","NULL","00690","Forster's Tern","Sterna","forsteri",NA,"Wyoming"
"3512","NULL","","1999","NULL","NULL","NULL","NULL","NULL","Carbon","WY","Black-crowned Night-Heron","NULL","02020","Black-crowned Night-Heron","Nycticorax","nycticorax",NA,"Wyoming"
"3513","NULL","","2000","NULL","NULL","NULL","NULL","NULL","Carbon","WY","White-faced Ibis","NULL","01870","White-faced Ibis","Plegadis","chihi",NA,"Wyoming"
"3514","NULL","","2000","NULL","NULL","NULL","NULL","NULL","Carbon","WY","Snowy Egret","NULL","01970","Snowy Egret","Egretta","thula",NA,"Wyoming"
"3515","NULL","","2000","NULL","NULL","NULL","NULL","NULL","Carbon","WY","Forster's Tern","NULL","00690","Forster's Tern","Sterna","forsteri",NA,"Wyoming"
"3516","NULL","","2000","NULL","NULL","NULL","NULL","NULL","Carbon","WY","Black-crowned Night-Heron","NULL","02020","Black-crowned Night-Heron","Nycticorax","nycticorax",NA,"Wyoming"
"3517","NULL","","2001","NULL","NULL","NULL","NULL","NULL","Carbon","WY","White-faced Ibis","NULL","01870","White-faced Ibis","Plegadis","chihi",NA,"Wyoming"
"3518","NULL","","2001","NULL","NULL","NULL","NULL","NULL","Carbon","WY","Snowy Egret","NULL","01970","Snowy Egret","Egretta","thula",NA,"Wyoming"
"3519","NULL","","2001","NULL","NULL","NULL","NULL","NULL","Carbon","WY","Forster's Tern","NULL","00690","Forster's Tern","Sterna","forsteri",NA,"Wyoming"
"3520","NULL","","2002","NULL","NULL","NULL","NULL","NULL","Carbon","WY","White-faced Ibis","NULL","01870","White-faced Ibis","Plegadis","chihi",NA,"Wyoming"
"3521","NULL","","2002","NULL","NULL","NULL","NULL","NULL","Carbon","WY","Snowy Egret","NULL","01970","Snowy Egret","Egretta","thula",NA,"Wyoming"
"3522","NULL","","2002","NULL","NULL","NULL","NULL","NULL","Carbon","WY","Forster's Tern","NULL","00690","Forster's Tern","Sterna","forsteri",NA,"Wyoming"
"3523","NULL","","2002","NULL","NULL","NULL","NULL","NULL","Carbon","WY","Black-crowned Night-Heron","NULL","02020","Black-crowned Night-Heron","Nycticorax","nycticorax",NA,"Wyoming"
"3524","NULL","","2003","NULL","NULL","NULL","NULL","NULL","Carbon","WY","White-faced Ibis","NULL","01870","White-faced Ibis","Plegadis","chihi",NA,"Wyoming"
"3525","NULL","","2003","NULL","NULL","NULL","NULL","NULL","Carbon","WY","Snowy Egret","NULL","01970","Snowy Egret","Egretta","thula",NA,"Wyoming"
"3526","NULL","","2003","NULL","NULL","NULL","NULL","NULL","Carbon","WY","Forster's Tern","NULL","00690","Forster's Tern","Sterna","forsteri",NA,"Wyoming"
"3527","NULL","","2003","NULL","NULL","NULL","NULL","NULL","Carbon","WY","Black-crowned Night-Heron","NULL","02020","Black-crowned Night-Heron","Nycticorax","nycticorax",NA,"Wyoming"
"3528","NULL","","2004","NULL","NULL","NULL","NULL","NULL","Carbon","WY","White-faced Ibis","NULL","01870","White-faced Ibis","Plegadis","chihi",NA,"Wyoming"
"3529","NULL","","2004","NULL","NULL","NULL","NULL","NULL","Carbon","WY","Forster's Tern","NULL","00690","Forster's Tern","Sterna","forsteri",NA,"Wyoming"
"3530","NULL","","2004","NULL","NULL","NULL","NULL","NULL","Carbon","WY","Black-crowned Night-Heron","NULL","02020","Black-crowned Night-Heron","Nycticorax","nycticorax",NA,"Wyoming"
"3531","NULL","","2005","NULL","NULL","NULL","NULL","NULL","Albany","WY","White-faced Ibis","NULL","01870","White-faced Ibis","Plegadis","chihi",NA,"Wyoming"
"3532","NULL","","2005","NULL","NULL","NULL","NULL","NULL","Albany","WY","Forster's Tern","NULL","00690","Forster's Tern","Sterna","forsteri",NA,"Wyoming"
"3533","NULL","","2006","NULL","NULL","NULL","NULL","NULL","Albany","WY","White-faced Ibis","NULL","01870","White-faced Ibis","Plegadis","chihi",NA,"Wyoming"
"3534","NULL","","2006","NULL","NULL","NULL","NULL","NULL","Albany","WY","Forster's Tern","NULL","00690","Forster's Tern","Sterna","forsteri",NA,"Wyoming"
"3535","NULL","","2006","NULL","NULL","NULL","NULL","NULL","Albany","WY","Black-crowned Night-Heron","NULL","02020","Black-crowned Night-Heron","Nycticorax","nycticorax",NA,"Wyoming"
"3536","NULL","","1982","NULL","NULL","NULL","NULL","NULL","Albany","WY","Snowy Egret","NULL","01970","Snowy Egret","Egretta","thula",NA,"Wyoming"
"3537","NULL","","1982","NULL","NULL","NULL","NULL","NULL","Albany","WY","Double-crested Cormorant","Adults present","01200","Double-crested Cormorant","Phalacrocorax","auritus",NA,"Wyoming"
"3538","NULL","","1982","NULL","NULL","NULL","NULL","NULL","Albany","WY","Caspian Tern","NULL","00640","Caspian Tern","Hydroprogne","caspia",NA,"Wyoming"
"3539","NULL","","1983","NULL","NULL","NULL","NULL","NULL","Albany","WY","Snowy Egret","NULL","01970","Snowy Egret","Egretta","thula",NA,"Wyoming"
"3540","NULL","","1983","NULL","NULL","NULL","NULL","NULL","Albany","WY","Double-crested Cormorant","NULL","01200","Double-crested Cormorant","Phalacrocorax","auritus",NA,"Wyoming"
"3541","NULL","","1984","NULL","NULL","NULL","NULL","NULL","Albany","WY","Snowy Egret","NULL","01970","Snowy Egret","Egretta","thula",NA,"Wyoming"
"3542","NULL","","1984","NULL","NULL","NULL","NULL","NULL","Albany","WY","Double-crested Cormorant","NULL","01200","Double-crested Cormorant","Phalacrocorax","auritus",NA,"Wyoming"
"3543","NULL","","1984","NULL","NULL","NULL","NULL","NULL","Albany","WY","Black-crowned Night-Heron","NULL","02020","Black-crowned Night-Heron","Nycticorax","nycticorax",NA,"Wyoming"
"3544","NULL","","1985","NULL","NULL","NULL","NULL","NULL","Albany","WY","Double-crested Cormorant","Adults present","01200","Double-crested Cormorant","Phalacrocorax","auritus",NA,"Wyoming"
"3545","NULL","","1986","NULL","NULL","NULL","NULL","NULL","Albany","WY","Snowy Egret","NULL","01970","Snowy Egret","Egretta","thula",NA,"Wyoming"
"3546","NULL","","1986","NULL","NULL","NULL","NULL","NULL","Albany","WY","Double-crested Cormorant","NULL","01200","Double-crested Cormorant","Phalacrocorax","auritus",NA,"Wyoming"
"3547","NULL","","1986","NULL","NULL","NULL","NULL","NULL","Albany","WY","Black-crowned Night-Heron","NULL","02020","Black-crowned Night-Heron","Nycticorax","nycticorax",NA,"Wyoming"
"3548","NULL","","1986","NULL","NULL","NULL","NULL","NULL","Albany","WY","American White Pelican","NULL","01250","American White Pelican","Pelecanus","erythrorhynchos",NA,"Wyoming"
"3549","NULL","","1987","NULL","NULL","NULL","NULL","NULL","Albany","WY","Snowy Egret","NULL","01970","Snowy Egret","Egretta","thula",NA,"Wyoming"
"3550","NULL","","1987","NULL","NULL","NULL","NULL","NULL","Albany","WY","Double-crested Cormorant","Adults present","01200","Double-crested Cormorant","Phalacrocorax","auritus",NA,"Wyoming"
"3551","NULL","","1987","NULL","NULL","NULL","NULL","NULL","Albany","WY","American White Pelican","NULL","01250","American White Pelican","Pelecanus","erythrorhynchos",NA,"Wyoming"
"3552","NULL","","1988","NULL","NULL","NULL","NULL","NULL","Albany","WY","White-faced Ibis","NULL","01870","White-faced Ibis","Plegadis","chihi",NA,"Wyoming"
"3553","NULL","","1988","NULL","NULL","NULL","NULL","NULL","Albany","WY","Snowy Egret","NULL","01970","Snowy Egret","Egretta","thula",NA,"Wyoming"
"3554","NULL","","1988","NULL","NULL","NULL","NULL","NULL","Albany","WY","Double-crested Cormorant","Adults present","01200","Double-crested Cormorant","Phalacrocorax","auritus",NA,"Wyoming"
"3555","NULL","","1988","NULL","NULL","NULL","NULL","NULL","Albany","WY","Black-crowned Night-Heron","Young present","02020","Black-crowned Night-Heron","Nycticorax","nycticorax",NA,"Wyoming"
"3556","NULL","","1988","NULL","NULL","NULL","NULL","NULL","Albany","WY","American White Pelican","NULL","01250","American White Pelican","Pelecanus","erythrorhynchos",NA,"Wyoming"
"3557","NULL","","1989","NULL","NULL","NULL","NULL","NULL","Albany","WY","Snowy Egret","NULL","01970","Snowy Egret","Egretta","thula",NA,"Wyoming"
"3558","NULL","","1989","NULL","NULL","NULL","NULL","NULL","Albany","WY","Double-crested Cormorant","Adults present","01200","Double-crested Cormorant","Phalacrocorax","auritus",NA,"Wyoming"
"3559","NULL","","1989","NULL","NULL","NULL","NULL","NULL","Albany","WY","Caspian Tern","NULL","00640","Caspian Tern","Hydroprogne","caspia",NA,"Wyoming"
"3560","NULL","","1989","NULL","NULL","NULL","NULL","NULL","Albany","WY","Black-crowned Night-Heron","Young present","02020","Black-crowned Night-Heron","Nycticorax","nycticorax",NA,"Wyoming"
"3561","NULL","","1989","NULL","NULL","NULL","NULL","NULL","Albany","WY","American White Pelican","NULL","01250","American White Pelican","Pelecanus","erythrorhynchos",NA,"Wyoming"
"3562","NULL","","1990","NULL","NULL","NULL","NULL","NULL","Albany","WY","Snowy Egret","NULL","01970","Snowy Egret","Egretta","thula",NA,"Wyoming"
"3563","NULL","","1990","NULL","NULL","NULL","NULL","NULL","Albany","WY","Double-crested Cormorant","Adults present","01200","Double-crested Cormorant","Phalacrocorax","auritus",NA,"Wyoming"
"3564","NULL","","1990","NULL","NULL","NULL","NULL","NULL","Albany","WY","Black-crowned Night-Heron","Young present","02020","Black-crowned Night-Heron","Nycticorax","nycticorax",NA,"Wyoming"
"3565","NULL","","1990","NULL","NULL","NULL","NULL","NULL","Albany","WY","American White Pelican","NULL","01250","American White Pelican","Pelecanus","erythrorhynchos",NA,"Wyoming"
"3566","NULL","","1991","NULL","NULL","NULL","NULL","NULL","Albany","WY","Snowy Egret","NULL","01970","Snowy Egret","Egretta","thula",NA,"Wyoming"
"3567","NULL","","1991","NULL","NULL","NULL","NULL","NULL","Albany","WY","Double-crested Cormorant","NULL","01200","Double-crested Cormorant","Phalacrocorax","auritus",NA,"Wyoming"
"3568","NULL","","1991","NULL","NULL","NULL","NULL","NULL","Albany","WY","Caspian Tern","NULL","00640","Caspian Tern","Hydroprogne","caspia",NA,"Wyoming"
"3569","NULL","","1991","NULL","NULL","NULL","NULL","NULL","Albany","WY","Black-crowned Night-Heron","NULL","02020","Black-crowned Night-Heron","Nycticorax","nycticorax",NA,"Wyoming"
"3570","NULL","","1991","NULL","NULL","NULL","NULL","NULL","Albany","WY","American White Pelican","NULL","01250","American White Pelican","Pelecanus","erythrorhynchos",NA,"Wyoming"
"3571","NULL","","1992","NULL","NULL","NULL","NULL","NULL","Albany","WY","Snowy Egret","NULL","01970","Snowy Egret","Egretta","thula",NA,"Wyoming"
"3572","NULL","","1992","NULL","NULL","NULL","NULL","NULL","Albany","WY","Double-crested Cormorant","Active nests","01200","Double-crested Cormorant","Phalacrocorax","auritus",NA,"Wyoming"
"2445","NULL","","1995","6","8","Stahlecker","NULL","NULL","Rio Arriba","NM","White-faced Ibis","NULL","01870","White-faced Ibis","Plegadis","chihi",NA,"New Mexico"
"2446","NULL","","1995","8","NULL","Stahlecker","NULL","NULL","Rio Arriba","NM","Eared Grebe","SurveyDate: Jul 1995","00040","Eared Grebe","Podiceps","nigricollis",NA,"New Mexico"
"2447","6/8/1996","00:00.0","1996","6","8","Stahlecker","NULL","NULL","Rio Arriba","NM","White-faced Ibis","NULL","01870","White-faced Ibis","Plegadis","chihi",1996-06-08,"New Mexico"
"2448","7/12/1996","00:00.0","1996","7","12","Stahlecker","NULL","NULL","Rio Arriba","NM","Eared Grebe","NULL","00040","Eared Grebe","Podiceps","nigricollis",1996-07-12,"New Mexico"
"2449","6/11/1997","00:00.0","1997","6","11","Stahlecker","NULL","NULL","Rio Arriba","NM","White-faced Ibis","NULL","01870","White-faced Ibis","Plegadis","chihi",1997-06-11,"New Mexico"
"2450","7/9/1997","00:00.0","1997","7","9","Stahlecker","NULL","NULL","Rio Arriba","NM","Eared Grebe","NULL","00040","Eared Grebe","Podiceps","nigricollis",1997-07-09,"New Mexico"
"2451","6/18/2004","00:00.0","2004","6","18","Stahlecker","NULL","NULL","Rio Arriba","NM","Eared Grebe","NULL","00040","Eared Grebe","Podiceps","nigricollis",2004-06-18,"New Mexico"
"2452","6/27/2005","00:00.0","2005","6","27","Stahlecker","NULL","NULL","Rio Arriba","NM","Eared Grebe","NULL","00040","Eared Grebe","Podiceps","nigricollis",2005-06-27,"New Mexico"
"2453","7/12/2007","00:00.0","2007","7","12","Stahlecker","NULL","NULL","Rio Arriba","NM","Eared Grebe","NULL","00040","Eared Grebe","Podiceps","nigricollis",2007-07-12,"New Mexico"
"2454","7/13/2008","00:00.0","2008","7","13","Stahlecker","NULL","NULL","Rio Arriba","NM","Eared Grebe","NULL","00040","Eared Grebe","Podiceps","nigricollis",2008-07-13,"New Mexico"
"2455","NULL","","1993","6","0","Stahlecker","NULL","NULL","Rio Arriba","NM","Western Grebe","SurveyDate:6/13-14/1993","00010","Western Grebe","Aechmophorus","occidentalis",NA,"New Mexico"
"2456","NULL","","1988","NULL","NULL","Stahlecker","NULL","NULL","Rio Arriba","NM","White-faced Ibis","SurveyDate:6/25-7/24/1988","01870","White-faced Ibis","Plegadis","chihi",NA,"New Mexico"
"2457","NULL","","1976","NULL","NULL","Hundertmark","NULL","NULL","Rio Arriba","NM","Eared Grebe","SurveyDate:summer 1976","00040","Eared Grebe","Podiceps","nigricollis",NA,"New Mexico"
"2458","NULL","","1987","NULL","NULL","Stahlecker","NULL","NULL","Rio Arriba","NM","Black-crowned Night-Heron","SurveyDate:summer 1987","02020","Black-crowned Night-Heron","Nycticorax","nycticorax",NA,"New Mexico"
"2459","NULL","","1987","NULL","NULL","Stahlecker","NULL","NULL","Rio Arriba","NM","Eared Grebe","SurveyDate:summer 1987","00040","Eared Grebe","Podiceps","nigricollis",NA,"New Mexico"
"2460","NULL","","1988","NULL","NULL","Stahlecker","NULL","NULL","Rio Arriba","NM","Black-crowned Night-Heron","SurveyDate: summer 1988","02020","Black-crowned Night-Heron","Nycticorax","nycticorax",NA,"New Mexico"
"2461","NULL","","1988","NULL","NULL","Stahlecker","NULL","NULL","Rio Arriba","NM","Western Grebe","SurveyDate: summer 1988","00010","Western Grebe","Aechmophorus","occidentalis",NA,"New Mexico"
"2462","NULL","","1990","NULL","NULL","Stahlecker","NULL","NULL","Rio Arriba","NM","Eared Grebe","SurveyDate: summer 1990","00040","Eared Grebe","Podiceps","nigricollis",NA,"New Mexico"
"2463","NULL","","1993","NULL","NULL","Stahlecker","NULL","NULL","Rio Arriba","NM","Black-crowned Night-Heron","SurveyDate:summer 1993","02020","Black-crowned Night-Heron","Nycticorax","nycticorax",NA,"New Mexico"
"2464","NULL","","1993","NULL","NULL","Stahlecker","NULL","NULL","Rio Arriba","NM","White-faced Ibis","SurveyDate:summer 1993","01870","White-faced Ibis","Plegadis","chihi",NA,"New Mexico"
"2465","6/26/1977","00:00.0","1977","6","26","Baltosser","NULL","NULL","Sierra","NM","Western or Clark's Grebe","NULL","NULL",NA,NA,NA,1977-06-26,"New Mexico"
"2466","7/17/1986","00:00.0","1986","7","17","Hubbard","NULL","NULL","Sierra","NM","NULL","MultipleSpecies: Cormorants and Egrets","NULL",NA,NA,NA,1986-07-17,"New Mexico"
"2467","9/28/1986","00:00.0","1986","9","28","Zimmer et al.","NULL","NULL","Sierra","NM","Western Grebe","NULL","00010","Western Grebe","Aechmophorus","occidentalis",1986-09-28,"New Mexico"
"2468","4/13/1990","00:00.0","1990","4","13","Cleary","NULL","NULL","Sierra","NM","Clark's Grebe","NULL","00011","Clark's Grebe","Aechmophorus","clarkii",1990-04-13,"New Mexico"
"2469","6/17/1990","00:00.0","1990","6","17","Sandell","NULL","NULL","Sierra","NM","Double-crested Cormorant","NULL","01200","Double-crested Cormorant","Phalacrocorax","auritus",1990-06-17,"New Mexico"
"2470","6/17/1990","00:00.0","1990","6","17","Sandell","NULL","NULL","Sierra","NM","Great Blue Heron","NULL","01940","Great Blue Heron","Ardea","herodias",1990-06-17,"New Mexico"
"2471","6/17/1990","00:00.0","1990","6","17","Sandell","NULL","NULL","Sierra","NM","Great Egret","NULL","01960","Great Egret","Ardea","alba",1990-06-17,"New Mexico"
"2472","7/6/1991","00:00.0","1991","7","6","Sandell","NULL","NULL","Sierra","NM","Double-crested Cormorant","NULL","01200","Double-crested Cormorant","Phalacrocorax","auritus",1991-07-06,"New Mexico"
"2473","7/6/1991","00:00.0","1991","7","6","Sandell","NULL","NULL","Sierra","NM","Great Blue Heron","NULL","01940","Great Blue Heron","Ardea","herodias",1991-07-06,"New Mexico"
"2474","5/28/1998","00:00.0","1998","5","28","Howe/White","NULL","NULL","Sierra","NM","Double-crested Cormorant","NULL","01200","Double-crested Cormorant","Phalacrocorax","auritus",1998-05-28,"New Mexico"
"2475","5/28/1998","00:00.0","1998","5","28","Howe/White","NULL","NULL","Sierra","NM","Double-crested or Neotropic Cormorant","","NULL",NA,NA,NA,1998-05-28,"New Mexico"
"2476","5/28/1998","00:00.0","1998","5","28","Howe/White","NULL","NULL","Sierra","NM","Great Blue Heron","NULL","01940","Great Blue Heron","Ardea","herodias",1998-05-28,"New Mexico"
"2477","6/10/1999","00:00.0","1999","6","10","Williams/White","NULL","NULL","Sierra","NM","Double-crested or Neotropic Cormorant","","NULL",NA,NA,NA,1999-06-10,"New Mexico"
"2478","6/12/2007","00:00.0","2007","6","12","Stahlecker","NULL","NULL","Sierra","NM","Double-crested Cormorant","NULL","01200","Double-crested Cormorant","Phalacrocorax","auritus",2007-06-12,"New Mexico"
"2479","NULL","","1989","NULL","NULL","fide Pulich","NULL","NULL","Sierra","NM","Double-crested or Neotropic Cormorant","SurveyDate:spring 1989","NULL",NA,NA,NA,NA,"New Mexico"
"2480","NULL","","1989","NULL","NULL","fide Pulich","NULL","NULL","Sierra","NM","Great Blue Heron","SurveyDate:spring 1989","01940","Great Blue Heron","Ardea","herodias",NA,"New Mexico"
"2481","NULL","","1979","NULL","NULL","fide Williams","NULL","NULL","Sierra","NM","Snowy Egret","SurveyDate:summer 1979","01970","Snowy Egret","Egretta","thula",NA,"New Mexico"
"2482","5/30/2009","00:00.0","2009","5","30","Stahlecker","NULL","NULL","Quay","NM","Great Blue Heron","NULL","01940","Great Blue Heron","Ardea","herodias",2009-05-30,"New Mexico"
"2483","3/4/1973","00:00.0","1973","3","4","Fisher","NULL","NULL","Grant","NM","Great Blue Heron","4-6 sites, exact locations unknown","01940","Great Blue Heron","Ardea","herodias",1973-03-04,"New Mexico"
"2484","6/20/1982","00:00.0","1982","6","20","Fisher","NULL","NULL","Grant","NM","Great Blue Heron","4-6 sites, exact locations unknown","01940","Great Blue Heron","Ardea","herodias",1982-06-20,"New Mexico"
"2485","5/9/1991","00:00.0","1991","5","9","Fisher","NULL","NULL","Grant","NM","Great Blue Heron","4-6 sites, exact locations unknown","01940","Great Blue Heron","Ardea","herodias",1991-05-09,"New Mexico"
"2486","6/12/2003","00:00.0","2003","6","12","Brodhead","NULL","NULL","Grant","NM","Great Blue Heron","NULL","01940","Great Blue Heron","Ardea","herodias",2003-06-12,"New Mexico"
"2487","5/22/2008","00:00.0","2008","5","22","Shook","NULL","NULL","Grant","NM","Great Blue Heron","NULL","01940","Great Blue Heron","Ardea","herodias",2008-05-22,"New Mexico"
"2488","6/9/2008","00:00.0","2008","6","9","Shook","NULL","NULL","Grant","NM","Great Blue Heron","NULL","01940","Great Blue Heron","Ardea","herodias",2008-06-09,"New Mexico"
"2489","NULL","","1969","NULL","NULL","Fisher","NULL","NULL","Grant","NM","Great Blue Heron","4-6 sites, exact locations unknown ; SurveryDate: 3/9 - 5/25/1969","01940","Great Blue Heron","Ardea","herodias",NA,"New Mexico"
"2527","5/23/1972","00:00.0","1972","5","23","Hubbard","NULL","NULL","Sierra","NM","Neotropic Cormorant","NULL","01210","Neotropic Cormorant","Phalacrocorax","brasilianus",1972-05-23,"New Mexico"
"2490","NULL","","1972","NULL","NULL","Fisher","NULL","NULL","Grant","NM","Great Blue Heron","4-6 sites, exact locations unknown ; SurveryDate: spring 1972","01940","Great Blue Heron","Ardea","herodias",NA,"New Mexico"
"2491","NULL","","1975","NULL","NULL","Fisher","NULL","NULL","Grant","NM","Great Blue Heron","4-6 sites, exact locations unknown ; SurveryDate: spring 1975","01940","Great Blue Heron","Ardea","herodias",NA,"New Mexico"
"2492","NULL","","1986","NULL","NULL","Fisher","NULL","NULL","Grant","NM","Great Blue Heron","4-6 sites, exact locations unknown ; SurveryDate: spring 1986","01940","Great Blue Heron","Ardea","herodias",NA,"New Mexico"
"2493","NULL","","1994","NULL","NULL","Fisher","NULL","NULL","Grant","NM","Great Blue Heron","SurveyDate: spring 1994","01940","Great Blue Heron","Ardea","herodias",NA,"New Mexico"
"2494","NULL","","1974","NULL","NULL","Fisher","NULL","NULL","Grant","NM","Great Blue Heron","4-6 sites, exact locations unknown ; SurveryDate: summer 1974","01940","Great Blue Heron","Ardea","herodias",NA,"New Mexico"
"2495","NULL","","1981","NULL","NULL","Fisher","NULL","NULL","Grant","NM","Great Blue Heron","4-6 sites, exact locations unknown ; SurveryDate: summer 1981","01940","Great Blue Heron","Ardea","herodias",NA,"New Mexico"
"2496","8/21/2005","00:00.0","2005","8","21","West","NULL","NULL","Curry","NM","Eared Grebe","NULL","00040","Eared Grebe","Podiceps","nigricollis",2005-08-21,"New Mexico"
"2497","5/27/2006","00:00.0","2006","5","27","Rustay","NULL","NULL","Curry","NM","Double-crested Cormorant","NULL","01200","Double-crested Cormorant","Phalacrocorax","auritus",2006-05-27,"New Mexico"
"2498","8/28/2006","00:00.0","2006","8","28","West","NULL","NULL","Curry","NM","Eared Grebe","NULL","00040","Eared Grebe","Podiceps","nigricollis",2006-08-28,"New Mexico"
"2499","5/25/2007","00:00.0","2007","5","25","Oldenettel","NULL","NULL","Curry","NM","Double-crested Cormorant","NULL","01200","Double-crested Cormorant","Phalacrocorax","auritus",2007-05-25,"New Mexico"
"2500","8/8/2008","00:00.0","2008","8","8","Hilchey","NULL","NULL","Curry","NM","Eared Grebe","NULL","00040","Eared Grebe","Podiceps","nigricollis",2008-08-08,"New Mexico"
"2501","5/26/2004","00:00.0","2004","5","26","Hendershot","NULL","NULL","Curry","NM","Black-crowned Night-Heron","NULL","02020","Black-crowned Night-Heron","Nycticorax","nycticorax",2004-05-26,"New Mexico"
"2502","5/23/1989","00:00.0","1989","5","23","Hubbard","NULL","NULL","Socorro","NM","Double-crested Cormorant","NULL","01200","Double-crested Cormorant","Phalacrocorax","auritus",1989-05-23,"New Mexico"
"2503","5/28/1998","00:00.0","1998","5","28","Howe/White","NULL","NULL","Socorro","NM","Black-crowned Night-Heron","NULL","02020","Black-crowned Night-Heron","Nycticorax","nycticorax",1998-05-28,"New Mexico"
"2504","5/28/1998","00:00.0","1998","5","28","Howe/White","NULL","NULL","Socorro","NM","Double-crested or Neotropic Cormorant","","NULL",NA,NA,NA,1998-05-28,"New Mexico"
"2505","5/28/1998","00:00.0","1998","5","28","Howe/White","NULL","NULL","Socorro","NM","Great Blue Heron","NULL","01940","Great Blue Heron","Ardea","herodias",1998-05-28,"New Mexico"
"2506","5/28/1998","00:00.0","1998","5","28","Howe/White","NULL","NULL","Socorro","NM","Neotropic Cormorant","NULL","01210","Neotropic Cormorant","Phalacrocorax","brasilianus",1998-05-28,"New Mexico"
"2507","5/28/1998","00:00.0","1998","5","28","Howe/White","NULL","NULL","Socorro","NM","Snowy Egret","NULL","01970","Snowy Egret","Egretta","thula",1998-05-28,"New Mexico"
"2508","6/10/1999","00:00.0","1999","6","10","Williams/White","NULL","NULL","Socorro","NM","Black-crowned Night-Heron","NULL","02020","Black-crowned Night-Heron","Nycticorax","nycticorax",1999-06-10,"New Mexico"
"2509","6/10/1999","00:00.0","1999","6","10","Williams/White","NULL","NULL","Socorro","NM","Double-crested or Neotropic Cormorant","","NULL",NA,NA,NA,1999-06-10,"New Mexico"
"2510","6/10/1999","00:00.0","1999","6","10","Williams/White","NULL","NULL","Socorro","NM","Great Blue Heron","NULL","01940","Great Blue Heron","Ardea","herodias",1999-06-10,"New Mexico"
"2511","6/10/1999","00:00.0","1999","6","10","Williams/White","NULL","NULL","Socorro","NM","Great Egret","NULL","01960","Great Egret","Ardea","alba",1999-06-10,"New Mexico"
"2512","6/10/1999","00:00.0","1999","6","10","Williams/White","NULL","NULL","Socorro","NM","Snowy Egret","NULL","01970","Snowy Egret","Egretta","thula",1999-06-10,"New Mexico"
"2513","5/2/2006","00:00.0","2006","5","2","Doster","NULL","NULL","Socorro","NM","Double-crested Cormorant","NULL","01200","Double-crested Cormorant","Phalacrocorax","auritus",2006-05-02,"New Mexico"
"2514","5/2/2006","00:00.0","2006","5","2","Doster","NULL","NULL","Socorro","NM","Great Blue Heron","NULL","01940","Great Blue Heron","Ardea","herodias",2006-05-02,"New Mexico"
"2515","5/9/2007","00:00.0","2007","5","9","Doster","NULL","NULL","Socorro","NM","Double-crested Cormorant","NULL","01200","Double-crested Cormorant","Phalacrocorax","auritus",2007-05-09,"New Mexico"
"2516","6/13/2007","00:00.0","2007","6","13","Doster/Stahlecker","NULL","NULL","Socorro","NM","Black-crowned Night-Heron","NULL","02020","Black-crowned Night-Heron","Nycticorax","nycticorax",2007-06-13,"New Mexico"
"2517","6/13/2007","00:00.0","2007","6","13","Doster/Stahlecker","NULL","NULL","Socorro","NM","Great Blue Heron","NULL","01940","Great Blue Heron","Ardea","herodias",2007-06-13,"New Mexico"
"2518","6/13/2007","00:00.0","2007","6","13","Doster/Stahlecker","NULL","NULL","Socorro","NM","Great Egret","NULL","01960","Great Egret","Ardea","alba",2007-06-13,"New Mexico"
"2519","6/13/2007","00:00.0","2007","6","13","Doster","NULL","NULL","Socorro","NM","Neotropic Cormorant","NULL","01210","Neotropic Cormorant","Phalacrocorax","brasilianus",2007-06-13,"New Mexico"
"2520","7/23/2008","00:00.0","2008","7","23","Cleary","NULL","NULL","Socorro","NM","Great Blue Heron","NULL","01940","Great Blue Heron","Ardea","herodias",2008-07-23,"New Mexico"
"2521","5/5/2009","00:00.0","2009","5","5","Doster","NULL","NULL","Socorro","NM","Black-crowned Night-Heron","NULL","02020","Black-crowned Night-Heron","Nycticorax","nycticorax",2009-05-05,"New Mexico"
"2522","5/5/2009","00:00.0","2009","5","5","Doster","NULL","NULL","Socorro","NM","Great Blue Heron","NULL","01940","Great Blue Heron","Ardea","herodias",2009-05-05,"New Mexico"
"2523","5/5/2009","00:00.0","2009","5","5","Doster","NULL","NULL","Socorro","NM","Great Egret","NULL","01960","Great Egret","Ardea","alba",2009-05-05,"New Mexico"
"2524","5/5/2009","00:00.0","2009","5","5","Doster","NULL","NULL","Socorro","NM","Snowy Egret","NULL","01970","Snowy Egret","Egretta","thula",2009-05-05,"New Mexico"
"2525","NULL","","1987","NULL","NULL","Uihlein","NULL","NULL","Quay","NM","Eared Grebe","SurveyDate: 6/1987","00040","Eared Grebe","Podiceps","nigricollis",NA,"New Mexico"
"2526","7/1/2006","00:00.0","2006","7","1","Cleary","NULL","NULL","Colfax","NM","Western Grebe","NULL","00010","Western Grebe","Aechmophorus","occidentalis",2006-07-01,"New Mexico"
"2528","6/16/1972","00:00.0","1972","6","16","Hubbard","NULL","NULL","Sierra","NM","Double-crested Cormorant","NULL","01200","Double-crested Cormorant","Phalacrocorax","auritus",1972-06-16,"New Mexico"
"2529","4/27/1974","00:00.0","1974","4","27","Hundertmark","NULL","NULL","Sierra","NM","Double-crested Cormorant","NULL","01200","Double-crested Cormorant","Phalacrocorax","auritus",1974-04-27,"New Mexico"
"2530","4/27/1974","00:00.0","1974","4","27","Hundertmark","NULL","NULL","Sierra","NM","Great Egret","NULL","01960","Great Egret","Ardea","alba",1974-04-27,"New Mexico"
"2531","5/11/1974","00:00.0","1974","5","11","Hundertmark","NULL","NULL","Sierra","NM","Neotropic Cormorant","NULL","01210","Neotropic Cormorant","Phalacrocorax","brasilianus",1974-05-11,"New Mexico"
"2532","5/18/1974","00:00.0","1974","5","18","Hundertmark","NULL","NULL","Sierra","NM","Great Egret","NULL","01960","Great Egret","Ardea","alba",1974-05-18,"New Mexico"
"2533","7/9/1974","00:00.0","1974","7","9","Hundertmark","NULL","NULL","Sierra","NM","Great Egret","NULL","01960","Great Egret","Ardea","alba",1974-07-09,"New Mexico"
"2534","7/9/1974","00:00.0","1974","7","9","Hundertmark","NULL","NULL","Sierra","NM","Neotropic Cormorant","NULL","01210","Neotropic Cormorant","Phalacrocorax","brasilianus",1974-07-09,"New Mexico"
"2535","5/11/1975","00:00.0","1975","5","11","Hundertmark","NULL","NULL","Sierra","NM","Black-crowned Night-Heron","NULL","02020","Black-crowned Night-Heron","Nycticorax","nycticorax",1975-05-11,"New Mexico"
"2536","5/11/1975","00:00.0","1975","5","11","Hundertmark","NULL","NULL","Sierra","NM","Great Egret","NULL","01960","Great Egret","Ardea","alba",1975-05-11,"New Mexico"
"2537","7/1/1975","00:00.0","1975","7","1","Hundertmark","NULL","NULL","Sierra","NM","Cattle Egret","NULL","02001","Cattle Egret","Bubulcus","ibis",1975-07-01,"New Mexico"
"2538","7/1/1975","00:00.0","1975","7","1","Hundertmark","NULL","NULL","Sierra","NM","Little Blue Heron","NULL","02000","Little Blue Heron","Egretta","caerulea",1975-07-01,"New Mexico"
"2539","6/8/1986","00:00.0","1986","6","8","Mitchessun","NULL","NULL","Sierra","NM","Neotropic Cormorant","NULL","01210","Neotropic Cormorant","Phalacrocorax","brasilianus",1986-06-08,"New Mexico"
"2540","6/1/1990","00:00.0","1990","6","1","Paynter","NULL","NULL","Sierra","NM","Double-crested or Neotropic Cormorant","","NULL",NA,NA,NA,1990-06-01,"New Mexico"
"2541","3/22/1997","00:00.0","1997","3","22","Williams","NULL","NULL","Sierra","NM","Great Blue Heron","NULL","01940","Great Blue Heron","Ardea","herodias",1997-03-22,"New Mexico"
"2542","5/28/1998","00:00.0","1998","5","28","Howe/White","NULL","NULL","Sierra","NM","Double-crested or Neotropic Cormorant","","NULL",NA,NA,NA,1998-05-28,"New Mexico"
"2543","6/10/1999","00:00.0","1999","6","10","Williams/White","NULL","NULL","Sierra","NM","Double-crested or Neotropic Cormorant","","NULL",NA,NA,NA,1999-06-10,"New Mexico"
"2544","NULL","","1972","3","NULL","Hundertmark","NULL","NULL","Sierra","NM","Double-crested Cormorant","3/10-12/1972","01200","Double-crested Cormorant","Phalacrocorax","auritus",NA,"New Mexico"
"2545","NULL","","1986","3","NULL","Kotinek","NULL","NULL","Sierra","NM","Double-crested Cormorant","3/10-13/1986","01200","Double-crested Cormorant","Phalacrocorax","auritus",NA,"New Mexico"
"2546","NULL","","1974","NULL","NULL","Hundertmark","NULL","NULL","Sierra","NM","Black-crowned Night-Heron","4/27 - 7/9/1974","02020","Black-crowned Night-Heron","Nycticorax","nycticorax",NA,"New Mexico"
"2547","NULL","","1973","NULL","NULL","Hundertmark","NULL","NULL","Sierra","NM","Double-crested Cormorant","5/5&24/1973","01200","Double-crested Cormorant","Phalacrocorax","auritus",NA,"New Mexico"
"2548","NULL","","1974","NULL","NULL","Hundertmark","NULL","NULL","Sierra","NM","Snowy Egret","6/5 & 7/9/1974","01970","Snowy Egret","Egretta","thula",NA,"New Mexico"
"2549","NULL","","1972","5","NULL","Hundertmark","NULL","NULL","Sierra","NM","Neotropic Cormorant","mid-May 1972","01210","Neotropic Cormorant","Phalacrocorax","brasilianus",NA,"New Mexico"
"2550","NULL","","1971","NULL","NULL","Hundertmark","NULL","NULL","Sierra","NM","Black-crowned Night-Heron","summer 1971","02020","Black-crowned Night-Heron","Nycticorax","nycticorax",NA,"New Mexico"
"2551","NULL","","1971","NULL","NULL","Hundertmark","NULL","NULL","Sierra","NM","Double-crested Cormorant","summer 1971","01200","Double-crested Cormorant","Phalacrocorax","auritus",NA,"New Mexico"
"2552","NULL","","1975","NULL","NULL","Hundertmark","NULL","NULL","Sierra","NM","Double-crested Cormorant","summer 1975","01200","Double-crested Cormorant","Phalacrocorax","auritus",NA,"New Mexico"
"2553","NULL","","1975","NULL","NULL","Hundertmark","NULL","NULL","Sierra","NM","Snowy Egret","summer 1975","01970","Snowy Egret","Egretta","thula",NA,"New Mexico"
"2554","NULL","","1979","NULL","NULL","fide Williams","NULL","NULL","Sierra","NM","Snowy Egret","summer 1979","01970","Snowy Egret","Egretta","thula",NA,"New Mexico"
"2555","NULL","","1980","NULL","NULL","fide Williams","NULL","NULL","Sierra","NM","Snowy Egret","summer 1980","01970","Snowy Egret","Egretta","thula",NA,"New Mexico"
"2556","7/15/2005","00:00.0","2005","7","15","Stahlecker","NULL","NULL","Rio Arriba","NM","Eared Grebe","NULL","00040","Eared Grebe","Podiceps","nigricollis",2005-07-15,"New Mexico"
"2557","7/13/2006","00:00.0","2006","7","13","Stahlecker","NULL","NULL","Rio Arriba","NM","Western Grebe","NULL","00010","Western Grebe","Aechmophorus","occidentalis",2006-07-13,"New Mexico"
"2558","NULL","","1999","NULL","NULL","Stahlecker","NULL","NULL","Rio Arriba","NM","Western Grebe","6/13 - 7/12/1999","00010","Western Grebe","Aechmophorus","occidentalis",NA,"New Mexico"
"2559","7/10/1988","00:00.0","1988","7","10","Espinosa","NULL","NULL","Mora","NM","Eared Grebe","NULL","00040","Eared Grebe","Podiceps","nigricollis",1988-07-10,"New Mexico"
"2560","6/26/1991","00:00.0","1991","6","26","Paxton/Plimpton","NULL","NULL","Mora","NM","Eared Grebe","NULL","00040","Eared Grebe","Podiceps","nigricollis",1991-06-26,"New Mexico"
"2561","8/29/1985","00:00.0","1985","8","29","Cleary","NULL","NULL","Sierra","NM","Clark's Grebe","locations change with water levels","00011","Clark's Grebe","Aechmophorus","clarkii",1985-08-29,"New Mexico"
"2562","5/10/1986","00:00.0","1986","5","10","Domenici","NULL","NULL","Sierra","NM","Clark's Grebe","locations change with water levels","00011","Clark's Grebe","Aechmophorus","clarkii",1986-05-10,"New Mexico"
"2563","6/8/1986","00:00.0","1986","6","8","Mitchessun","NULL","NULL","Sierra","NM","Western Grebe","locations change with water levels","00010","Western Grebe","Aechmophorus","occidentalis",1986-06-08,"New Mexico"
"2564","8/22/1986","00:00.0","1986","8","22","Mitchessun","NULL","NULL","Sierra","NM","Clark's Grebe","locations change with water levels","00011","Clark's Grebe","Aechmophorus","clarkii",1986-08-22,"New Mexico"
"2565","8/10/1992","00:00.0","1992","8","10","Hubbard","NULL","NULL","Sierra","NM","Western or Clark's Grebe","locations change with water levels , Multiple Species: Western or Clark's Grebe","NULL",NA,NA,NA,1992-08-10,"New Mexico"
"2566","6/10/1999","00:00.0","1999","6","10","Williams/White","NULL","NULL","Sierra","NM","Great Blue Heron","locations change with water levels","01940","Great Blue Heron","Ardea","herodias",1999-06-10,"New Mexico"
"2567","6/10/1999","00:00.0","1999","6","10","Williams/White","NULL","NULL","Sierra","NM","Snowy Egret","locations change with water levels","01970","Snowy Egret","Egretta","thula",1999-06-10,"New Mexico"
"2568","6/5/2006","00:00.0","2006","6","5","West","NULL","NULL","Sierra","NM","Western or Clark's Grebe","locations change with water levels","NULL",NA,NA,NA,2006-06-05,"New Mexico"
"2569","9/24/2006","00:00.0","2006","9","24","Rustay","NULL","NULL","Sierra","NM","Western Grebe","locations change with water levels","00010","Western Grebe","Aechmophorus","occidentalis",2006-09-24,"New Mexico"
"2570","5/21/2007","00:00.0","2007","5","21","Stahlecker","NULL","NULL","Sierra","NM","Western or Clark's Grebe","locations change with water levels","NULL",NA,NA,NA,2007-05-21,"New Mexico"
"2571","6/13/2007","00:00.0","2007","6","13","Stahlecker","NULL","NULL","Sierra","NM","Double-crested Cormorant","locations change with water levels","01200","Double-crested Cormorant","Phalacrocorax","auritus",2007-06-13,"New Mexico"
"2572","6/13/2007","00:00.0","2007","6","13","Stahlecker","NULL","NULL","Sierra","NM","Neotropic Cormorant","locations change with water levels","01210","Neotropic Cormorant","Phalacrocorax","brasilianus",2007-06-13,"New Mexico"
"2573","5/8/2008","00:00.0","2008","5","8","Cleary","NULL","NULL","Sierra","NM","Western or Clark's Grebe","locations change with water levels","NULL",NA,NA,NA,2008-05-08,"New Mexico"
"2574","NULL","","1985","3","NULL","Hubbard","NULL","NULL","Sierra","NM","Double-crested Cormorant","locations change with water levels ; SurveryDate: 3/23 - 24/1985","01200","Double-crested Cormorant","Phalacrocorax","auritus",NA,"New Mexico"
"2575","6/20/1982","00:00.0","1982","6","20","Fisher","NULL","NULL","Grant","NM","Great Blue Heron","WGS84","01940","Great Blue Heron","Ardea","herodias",1982-06-20,"New Mexico"
"2576","NULL","","2006","6","NULL","Yoder fide Beatty","NULL","NULL","Grant","NM","Great Blue Heron","SurveryDate: late Jun 2006","01940","Great Blue Heron","Ardea","herodias",NA,"New Mexico"
"2577","NULL","","1975","NULL","NULL","Fisher","NULL","NULL","Grant","NM","Great Blue Heron","NAD 83 ; SurveryDate: spring 1975","01940","Great Blue Heron","Ardea","herodias",NA,"New Mexico"
"2578","NULL","","1981","NULL","NULL","Fisher","NULL","NULL","Grant","NM","Great Blue Heron","NAD 83 ; SurveryDate: spring 1981","01940","Great Blue Heron","Ardea","herodias",NA,"New Mexico"
"2579","NULL","","1987","NULL","NULL","Fisher","NULL","NULL","Grant","NM","Great Blue Heron","NAD 83 ; SurveryDate: spring 1987","01940","Great Blue Heron","Ardea","herodias",NA,"New Mexico"
"2580","NULL","","1994","NULL","NULL","Fisher","NULL","NULL","Grant","NM","Great Blue Heron","NAD 83 ; SurveryDate: spring 1994","01940","Great Blue Heron","Ardea","herodias",NA,"New Mexico"
"2581","NULL","","1974","NULL","NULL","Fisher","NULL","NULL","Grant","NM","Great Blue Heron","NAD 83 ; SurveryDate: summer 1974","01940","Great Blue Heron","Ardea","herodias",NA,"New Mexico"
"2582","6/6/1987","00:00.0","1987","6","6","Fisher","NULL","NULL","Catron","NM","Great Blue Heron","NULL","01940","Great Blue Heron","Ardea","herodias",1987-06-06,"New Mexico"
"2583","6/1/1989","00:00.0","1989","6","1","Hubbard/Fisher","NULL","NULL","Catron","NM","Great Blue Heron","NULL","01940","Great Blue Heron","Ardea","herodias",1989-06-01,"New Mexico"
"2584","3/29/1995","00:00.0","1995","3","29","Hubbard","NULL","NULL","Catron","NM","Great Blue Heron","NULL","01940","Great Blue Heron","Ardea","herodias",1995-03-29,"New Mexico"
"2585","NULL","","1988","NULL","NULL","Hubbard/Fisher","NULL","NULL","Catron","NM","Great Blue Heron","SurveyDate: 3/12-16/1988","01940","Great Blue Heron","Ardea","herodias",NA,"New Mexico"
"2586","NULL","","1986","NULL","NULL","Fisher","NULL","NULL","Catron","NM","Great Blue Heron","SurveyDate: 3/23 - 6/27/1986","01940","Great Blue Heron","Ardea","herodias",NA,"New Mexico"
"2587","NULL","","1986","NULL","NULL","Fisher","NULL","NULL","Catron","NM","Great Blue Heron","SurveyDate: spring 1986","01940","Great Blue Heron","Ardea","herodias",NA,"New Mexico"
"2588","NULL","","1994","NULL","NULL","Fisher","NULL","NULL","Catron","NM","Great Blue Heron","SurveyDate: spring 1994","01940","Great Blue Heron","Ardea","herodias",NA,"New Mexico"
"2589","NULL","","2000","NULL","NULL","fide Reiser","NULL","NULL","Otero","NM","Snowy Egret","SurveyDate: summer 2000","01970","Snowy Egret","Egretta","thula",NA,"New Mexico"
"2590","6/28/1993","00:00.0","1993","6","28","Stahlecker","NULL","NULL","Rio Arriba","NM","Eared Grebe","NULL","00040","Eared Grebe","Podiceps","nigricollis",1993-06-28,"New Mexico"
"2591","6/28/1993","00:00.0","1993","6","28","Stahlecker","NULL","NULL","Rio Arriba","NM","Western Grebe","NULL","00010","Western Grebe","Aechmophorus","occidentalis",1993-06-28,"New Mexico"
"2592","6/17/1996","00:00.0","1996","6","17","Stahlecker","NULL","NULL","Rio Arriba","NM","Western Grebe","NULL","00010","Western Grebe","Aechmophorus","occidentalis",1996-06-17,"New Mexico"
"2593","6/23/2000","00:00.0","2000","6","23","Stahlecker","NULL","NULL","Rio Arriba","NM","Eared Grebe","NULL","00040","Eared Grebe","Podiceps","nigricollis",2000-06-23,"New Mexico"
"2594","7/21/2000","00:00.0","2000","7","21","Stahlecker","NULL","NULL","Rio Arriba","NM","Western Grebe","NULL","00010","Western Grebe","Aechmophorus","occidentalis",2000-07-21,"New Mexico"
"2595","7/6/2003","00:00.0","2003","7","6","Stahlecker","NULL","NULL","Rio Arriba","NM","Eared Grebe","NULL","00040","Eared Grebe","Podiceps","nigricollis",2003-07-06,"New Mexico"
"2596","7/6/2003","00:00.0","2003","7","6","Stahlecker","NULL","NULL","Rio Arriba","NM","Western Grebe","NULL","00010","Western Grebe","Aechmophorus","occidentalis",2003-07-06,"New Mexico"
"2597","6/20/2004","00:00.0","2004","6","20","Stahlecker","NULL","NULL","Rio Arriba","NM","Eared Grebe","NULL","00040","Eared Grebe","Podiceps","nigricollis",2004-06-20,"New Mexico"
"2598","7/15/2005","00:00.0","2005","7","15","Stahlecker","NULL","NULL","Rio Arriba","NM","Eared Grebe","NULL","00040","Eared Grebe","Podiceps","nigricollis",2005-07-15,"New Mexico"
"2599","7/13/2006","00:00.0","2006","7","13","Stahlecker","NULL","NULL","Rio Arriba","NM","Eared Grebe","NULL","00040","Eared Grebe","Podiceps","nigricollis",2006-07-13,"New Mexico"
"2600","6/29/2007","00:00.0","2007","6","29","Stahlecker","NULL","NULL","Rio Arriba","NM","Eared Grebe","NULL","00040","Eared Grebe","Podiceps","nigricollis",2007-06-29,"New Mexico"
"2601","7/17/1986","00:00.0","1986","7","17","Hubbard","NULL","NULL","Sandoval","NM","Double-crested Cormorant","NULL","01200","Double-crested Cormorant","Phalacrocorax","auritus",1986-07-17,"New Mexico"
"2602","7/17/1986","00:00.0","1986","7","17","Hubbard","NULL","NULL","Sandoval","NM","Snowy Egret","NULL","01970","Snowy Egret","Egretta","thula",1986-07-17,"New Mexico"
"2603","NULL","","1985","NULL","NULL","Howe and Hill","NULL","NULL","Sandoval","NM","Double-crested Cormorant","SurveyDate: spring/summer 1985","01200","Double-crested Cormorant","Phalacrocorax","auritus",NA,"New Mexico"
"2604","5/7/1988","00:00.0","1988","5","7","Williams","NULL","NULL","Grant","NM","Great Blue Heron","NULL","01940","Great Blue Heron","Ardea","herodias",1988-05-07,"New Mexico"
"2605","NULL","","1987","NULL","NULL","Fisher","NULL","NULL","Grant","NM","Great Blue Heron","SurveyDate: spring 1987","01940","Great Blue Heron","Ardea","herodias",NA,"New Mexico"
"2606","4/28/1968","00:00.0","1968","4","28","Schooley","NULL","NULL","Mora","NM","Great Blue Heron","NULL","01940","Great Blue Heron","Ardea","herodias",1968-04-28,"New Mexico"
"2607","6/25/1990","00:00.0","1990","6","25","Stahlecker","NULL","NULL","Rio Arriba","NM","Western Grebe","NULL","00010","Western Grebe","Aechmophorus","occidentalis",1990-06-25,"New Mexico"
"2608","9/15/1993","00:00.0","1993","9","15","Burton","NULL","NULL","Socorro","NM","Western or Clark's Grebe","NULL","NULL",NA,NA,NA,1993-09-15,"New Mexico"
"2609","5/14/1988","00:00.0","1988","5","14","Rustay","NULL","NULL","Rio Arriba","NM","Black-crowned Night-Heron","NULL","02020","Black-crowned Night-Heron","Nycticorax","nycticorax",1988-05-14,"New Mexico"
"2610","6/3/2005","00:00.0","2005","6","3","Cleary","NULL","NULL","Colfax","NM","White-faced Ibis","NULL","01870","White-faced Ibis","Plegadis","chihi",2005-06-03,"New Mexico"
"2611","6/4/2006","00:00.0","2006","6","4","Howe","NULL","NULL","De Baca","NM","Clark's Grebe","NULL","00011","Clark's Grebe","Aechmophorus","clarkii",2006-06-04,"New Mexico"
"2612","NULL","","2003","6","NULL","Scott et al.","NULL","NULL","Dona Ana","NM","Yellow-crowned Night-Heron","SurveyDate: 6/28-30/2003","02030","Yellow-crowned Night-Heron","Nyctanassa","violacea",NA,"New Mexico"
"2613","5/11/2002","00:00.0","2002","5","11","Rustay","NULL","NULL","San Miguel","NM","Black-crowned Night-Heron","NULL","02020","Black-crowned Night-Heron","Nycticorax","nycticorax",2002-05-11,"New Mexico"
"2614","5/20/2007","00:00.0","2007","5","20","West et al.","NULL","NULL","San Miguel","NM","Yellow-crowned Night-Heron","NULL","02030","Yellow-crowned Night-Heron","Nyctanassa","violacea",2007-05-20,"New Mexico"
"2615","5/28/1988","00:00.0","1988","5","28","Rustay","NULL","NULL","San Miguel","NM","Black-crowned Night-Heron","NULL","02020","Black-crowned Night-Heron","Nycticorax","nycticorax",1988-05-28,"New Mexico"
"2616","9/14/1993","00:00.0","1993","9","14","Morrison","NULL","NULL","San Miguel","NM","Western Grebe","NULL","00010","Western Grebe","Aechmophorus","occidentalis",1993-09-14,"New Mexico"
"2617","9/20/1994","00:00.0","1994","9","20","Nistico","NULL","NULL","San Miguel","NM","Clark's Grebe","NULL","00011","Clark's Grebe","Aechmophorus","clarkii",1994-09-20,"New Mexico"
"2618","11/6/1994","00:00.0","1994","11","6","Foy","NULL","NULL","San Miguel","NM","Clark's Grebe","NULL","00011","Clark's Grebe","Aechmophorus","clarkii",1994-11-06,"New Mexico"
"2619","NULL","","1992","8","NULL","Rustay","NULL","NULL","San Miguel","NM","Clark's Grebe","SurveyDate: 8/15 + 24/1992","00011","Clark's Grebe","Aechmophorus","clarkii",NA,"New Mexico"
"2620","NULL","","1992","8","NULL","Rustay","NULL","NULL","San Miguel","NM","Western Grebe","SurveyDate: 8/15 + 24/1992","00010","Western Grebe","Aechmophorus","occidentalis",NA,"New Mexico"
"2621","NULL","","1992","8","NULL","Rustay","NULL","NULL","San Miguel","NM","Western or Clark's Grebe","SurveyDate: 8/15 + 24/1992","NULL",NA,NA,NA,NA,"New Mexico"
"2622","7/21/1995","00:00.0","1995","7","21","Cleary","NULL","NULL","San Juan","NM","Eared Grebe","NULL","00040","Eared Grebe","Podiceps","nigricollis",1995-07-21,"New Mexico"
"2623","7/25/1996","00:00.0","1996","7","25","Cleary","NULL","NULL","San Juan","NM","Eared Grebe","NULL","00040","Eared Grebe","Podiceps","nigricollis",1996-07-25,"New Mexico"
"2624","5/28/1979","00:00.0","1979","5","28","West","NULL","NULL","Eddy","NM","Black-crowned Night-Heron","NULL","02020","Black-crowned Night-Heron","Nycticorax","nycticorax",1979-05-28,"New Mexico"
"2625","5/28/1979","00:00.0","1979","5","28","West","NULL","NULL","Eddy","NM","Snowy Egret","NULL","01970","Snowy Egret","Egretta","thula",1979-05-28,"New Mexico"
"2626","NULL","","1980","6","NULL","Howe","NULL","NULL","Eddy","NM","Black-crowned Night-Heron","SurveyDate: 6/1980","02020","Black-crowned Night-Heron","Nycticorax","nycticorax",NA,"New Mexico"
"2627","NULL","","1980","6","NULL","Howe","NULL","NULL","Eddy","NM","Snowy Egret","SurveyDate: 6/1980","01970","Snowy Egret","Egretta","thula",NA,"New Mexico"
"2628","NULL","","1981","5","NULL","West","NULL","NULL","Eddy","NM","Snowy Egret","SurveyDate: 5/1981","01970","Snowy Egret","Egretta","thula",NA,"New Mexico"
"2629","5/25/1981","00:00.0","1981","5","25","West","NULL","NULL","Eddy","NM","Little Blue Heron","NULL","02000","Little Blue Heron","Egretta","caerulea",1981-05-25,"New Mexico"
"2630","7/2/1981","00:00.0","1981","7","2","West","NULL","NULL","Eddy","NM","Tricolored Heron","NULL","01990","Tricolored Heron","Egretta","tricolor",1981-07-02,"New Mexico"
"2631","5/26/1982","00:00.0","1982","5","26","West","NULL","NULL","Eddy","NM","Black-crowned Night-Heron","NULL","02020","Black-crowned Night-Heron","Nycticorax","nycticorax",1982-05-26,"New Mexico"
"2632","5/26/1982","00:00.0","1982","5","26","West","NULL","NULL","Eddy","NM","Snowy Egret","NULL","01970","Snowy Egret","Egretta","thula",1982-05-26,"New Mexico"
"1505","3/25/2008","00:00.0","2008","3","25","Moulton","NULL","NULL","Canyon","ID","Great Blue Heron","NULL","01940","Great Blue Heron","Ardea","herodias",2008-03-25,"Idaho"
"1506","3/25/2008","00:00.0","2008","3","25","Moulton","NULL","NULL","Canyon","ID","Double-crested Cormorant","NULL","01200","Double-crested Cormorant","Phalacrocorax","auritus",2008-03-25,"Idaho"
"1507","3/25/2008","00:00.0","2008","3","25","Moulton","NULL","NULL","Canyon","ID","Great Blue Heron","NULL","01940","Great Blue Heron","Ardea","herodias",2008-03-25,"Idaho"
"1508","3/25/2008","00:00.0","2008","3","25","Moulton","NULL","NULL","Canyon","ID","Great Egret","NULL","01960","Great Egret","Ardea","alba",2008-03-25,"Idaho"
"1509","3/31/2008","00:00.0","2008","3","31","Sweeney","NULL","NULL","Canyon","ID","Great Egret","NULL","01960","Great Egret","Ardea","alba",2008-03-31,"Idaho"
"1510","3/25/2008","00:00.0","2008","3","25","Moulton","NULL","NULL","Canyon","ID","Great Blue Heron","NULL","01940","Great Blue Heron","Ardea","herodias",2008-03-25,"Idaho"
"1511","3/25/2008","00:00.0","2008","3","25","Moulton","NULL","NULL","Canyon","ID","Great Blue Heron","NULL","01940","Great Blue Heron","Ardea","herodias",2008-03-25,"Idaho"
"1512","3/25/2008","00:00.0","2008","3","25","Moulton","NULL","NULL","Canyon","ID","Double-crested Cormorant","NULL","01200","Double-crested Cormorant","Phalacrocorax","auritus",2008-03-25,"Idaho"
"1513","3/25/2008","00:00.0","2008","3","25","McCarthy/Malhas","NULL","NULL","Canyon","ID","Great Blue Heron","NULL","01940","Great Blue Heron","Ardea","herodias",2008-03-25,"Idaho"
"1514","3/16/2007","00:00.0","2007","3","16","Moulton","NULL","NULL","Ada","ID","Great Blue Heron","NULL","01940","Great Blue Heron","Ardea","herodias",2007-03-16,"Idaho"
"1515","NULL","","1992","7","NULL","Klott","NULL","NULL","Owyhee","ID","Clark's Grebe","NULL","00011","Clark's Grebe","Aechmophorus","clarkii",NA,"Idaho"
"1516","5/28/1993","00:00.0","1993","5","28","Trost","NULL","NULL","Elmore","ID","Black-crowned Night-Heron","NULL","02020","Black-crowned Night-Heron","Nycticorax","nycticorax",1993-05-28,"Idaho"
"1517","5/28/1993","00:00.0","1993","5","28","Trost","NULL","NULL","Elmore","ID","Great Egret","NULL","01960","Great Egret","Ardea","alba",1993-05-28,"Idaho"
"1518","7/8/1993","00:00.0","1993","7","8","Trost","NULL","NULL","Jefferson","ID","White-faced Ibis","NULL","01870","White-faced Ibis","Plegadis","chihi",1993-07-08,"Idaho"
"1519","6/16/1993","00:00.0","1993","6","16","Deutscher","NULL","NULL","Jefferson","ID","White-faced Ibis","NULL","01870","White-faced Ibis","Plegadis","chihi",1993-06-16,"Idaho"
"1520","6/29/1993","00:00.0","1993","6","29","Deutscher","NULL","NULL","Jefferson","ID","Black-crowned Night-Heron","NULL","02020","Black-crowned Night-Heron","Nycticorax","nycticorax",1993-06-29,"Idaho"
"1521","6/29/1993","00:00.0","1993","6","29","Deutscher","NULL","NULL","Jefferson","ID","Cattle Egret","NULL","02001","Cattle Egret","Bubulcus","ibis",1993-06-29,"Idaho"
"1522","6/29/1993","00:00.0","1993","6","29","Deutscher","NULL","NULL","Jefferson","ID","Great Egret","NULL","01960","Great Egret","Ardea","alba",1993-06-29,"Idaho"
"1523","6/29/1993","00:00.0","1993","6","29","Deutscher","NULL","NULL","Jefferson","ID","Snowy Egret","NULL","01970","Snowy Egret","Egretta","thula",1993-06-29,"Idaho"
"1524","7/5/1993","00:00.0","1993","7","5","Trost","NULL","NULL","Jefferson","ID","Black-crowned Night-Heron","NULL","02020","Black-crowned Night-Heron","Nycticorax","nycticorax",1993-07-05,"Idaho"
"1525","7/5/1993","00:00.0","1993","7","5","Trost","NULL","NULL","Jefferson","ID","Black-crowned Night-Heron","NULL","02020","Black-crowned Night-Heron","Nycticorax","nycticorax",1993-07-05,"Idaho"
"1526","7/8/1993","00:00.0","1993","7","8","Trost","NULL","NULL","Jefferson","ID","Cattle Egret","NULL","02001","Cattle Egret","Bubulcus","ibis",1993-07-08,"Idaho"
"1527","7/8/1993","00:00.0","1993","7","8","Deutscher","NULL","NULL","Jefferson","ID","Great Egret","NULL","01960","Great Egret","Ardea","alba",1993-07-08,"Idaho"
"1528","7/5/1993","00:00.0","1993","7","5","Trost","NULL","NULL","Jefferson","ID","White-faced Ibis","NULL","01870","White-faced Ibis","Plegadis","chihi",1993-07-05,"Idaho"
"1529","7/8/1993","00:00.0","1993","7","8","Trost","NULL","NULL","Jefferson","ID","Black Tern","NULL","00770","Black Tern","Chlidonias","niger",1993-07-08,"Idaho"
"1530","6/9/1993","00:00.0","1993","6","9","Trost","NULL","NULL","Blaine","ID","Black Tern","NULL","00770","Black Tern","Chlidonias","niger",1993-06-09,"Idaho"
"1531","6/8/1993","00:00.0","1993","6","8","Trost","NULL","NULL","Bonner","ID","Black Tern","NULL","00770","Black Tern","Chlidonias","niger",1993-06-08,"Idaho"
"1532","5/2/2008","00:00.0","2008","5","2","Gray/Sauder","NULL","NULL","Nez Perce","ID","Great Blue Heron","NULL","01940","Great Blue Heron","Ardea","herodias",2008-05-02,"Idaho"
"1533","3/31/2008","00:00.0","2008","3","31","Gray/de La Rue","NULL","NULL","Nez Perce","ID","Great Blue Heron","NULL","01940","Great Blue Heron","Ardea","herodias",2008-03-31,"Idaho"
"1534","5/2/2008","00:00.0","2008","5","2","Gray/Sauder","NULL","NULL","Idaho","ID","Great Blue Heron","NULL","01940","Great Blue Heron","Ardea","herodias",2008-05-02,"Idaho"
"1535","3/31/2008","00:00.0","2008","3","31","Gray/de La Rue","NULL","NULL","Nez Perce","ID","Great Blue Heron","NULL","01940","Great Blue Heron","Ardea","herodias",2008-03-31,"Idaho"
"1536","3/31/2008","00:00.0","2008","3","31","Gray/de La Rue","NULL","NULL","Nez Perce","ID","Great Blue Heron","NULL","01940","Great Blue Heron","Ardea","herodias",2008-03-31,"Idaho"
"1537","5/2/2008","00:00.0","2008","5","2","Sauder/Gray","NULL","NULL","Clearwater","ID","Great Blue Heron","NULL","01940","Great Blue Heron","Ardea","herodias",2008-05-02,"Idaho"
"1538","5/25/1994","00:00.0","1994","5","25","Trost","NULL","NULL","Kootenai","ID","Clark's Grebe","NULL","00011","Clark's Grebe","Aechmophorus","clarkii",1994-05-25,"Idaho"
"1539","5/26/1994","00:00.0","1994","5","26","Trost","NULL","NULL","Kootenai","ID","Western Grebe","NULL","00010","Western Grebe","Aechmophorus","occidentalis",1994-05-26,"Idaho"
"1540","6/1/2007","00:00.0","2007","6","1","Weinandt/Pfaff","NULL","NULL","Kootenai","ID","Western Grebe","NULL","00010","Western Grebe","Aechmophorus","occidentalis",2007-06-01,"Idaho"
"1541","6/14/2007","00:00.0","2007","6","14","Weinandt/Pfaff","NULL","NULL","Kootenai","ID","Western Grebe","NULL","00010","Western Grebe","Aechmophorus","occidentalis",2007-06-14,"Idaho"
"1542","6/20/2007","00:00.0","2007","6","20","Weinandt/Pfaff","NULL","NULL","Kootenai","ID","Western Grebe","NULL","00010","Western Grebe","Aechmophorus","occidentalis",2007-06-20,"Idaho"
"1543","6/23/2007","00:00.0","2007","6","23","Hugo","NULL","NULL","Kootenai","ID","Western Grebe","NULL","00010","Western Grebe","Aechmophorus","occidentalis",2007-06-23,"Idaho"
"1544","6/28/2007","00:00.0","2007","6","28","Weinandt/Pfaff","NULL","NULL","Kootenai","ID","Western Grebe","NULL","00010","Western Grebe","Aechmophorus","occidentalis",2007-06-28,"Idaho"
"1545","6/28/2007","00:00.0","2007","6","28","Weinandt/Pfaff","NULL","NULL","Kootenai","ID","Western Grebe","NULL","00010","Western Grebe","Aechmophorus","occidentalis",2007-06-28,"Idaho"
"1546","7/12/2007","00:00.0","2007","7","12","Weinandt/Pfaff","NULL","NULL","Kootenai","ID","Western Grebe","NULL","00010","Western Grebe","Aechmophorus","occidentalis",2007-07-12,"Idaho"
"1547","7/19/2007","00:00.0","2007","7","19","Pfaff/Weinandt","NULL","NULL","Kootenai","ID","Western Grebe","NULL","00010","Western Grebe","Aechmophorus","occidentalis",2007-07-19,"Idaho"
"1548","5/26/1994","00:00.0","1994","5","26","Trost","NULL","NULL","Kootenai","ID","Black Tern","NULL","00770","Black Tern","Chlidonias","niger",1994-05-26,"Idaho"
"1549","5/26/1994","00:00.0","1994","5","26","Trost","NULL","NULL","Kootenai","ID","Black Tern","NULL","00770","Black Tern","Chlidonias","niger",1994-05-26,"Idaho"
"1550","5/26/1994","00:00.0","1994","5","26","Trost","NULL","NULL","Kootenai","ID","Black Tern","NULL","00770","Black Tern","Chlidonias","niger",1994-05-26,"Idaho"
"1551","5/26/1993","00:00.0","1993","5","26","Stanley","NULL","NULL","Canyon","ID","Black-crowned Night-Heron","NULL","02020","Black-crowned Night-Heron","Nycticorax","nycticorax",1993-05-26,"Idaho"
"1552","6/3/1993","00:00.0","1993","6","3","Trost","NULL","NULL","Canyon","ID","Black-crowned Night-Heron","NULL","02020","Black-crowned Night-Heron","Nycticorax","nycticorax",1993-06-03,"Idaho"
"1553","5/26/1993","00:00.0","1993","5","26","Stanley","NULL","NULL","Canyon","ID","Western Grebe","NULL","00010","Western Grebe","Aechmophorus","occidentalis",1993-05-26,"Idaho"
"1554","5/26/1993","00:00.0","1993","5","26","Stanley","NULL","NULL","Payette","ID","Clark's Grebe","NULL","00011","Clark's Grebe","Aechmophorus","clarkii",1993-05-26,"Idaho"
"1555","5/28/1993","00:00.0","1993","5","28","Trost","NULL","NULL","Owyhee","ID","Black-crowned Night-Heron","NULL","02020","Black-crowned Night-Heron","Nycticorax","nycticorax",1993-05-28,"Idaho"
"1556","5/28/1993","00:00.0","1993","5","28","Trost","NULL","NULL","Owyhee","ID","Snowy Egret","NULL","01970","Snowy Egret","Egretta","thula",1993-05-28,"Idaho"
"1557","5/28/1993","00:00.0","1993","5","28","Trost","NULL","NULL","Owyhee","ID","White-faced Ibis","NULL","01870","White-faced Ibis","Plegadis","chihi",1993-05-28,"Idaho"
"1558","6/28/1993","00:00.0","1993","6","28","Trost","NULL","NULL","Owyhee","ID","Great Egret","NULL","01960","Great Egret","Ardea","alba",1993-06-28,"Idaho"
"1559","6/28/1993","00:00.0","1993","6","28","Hlavaty","NULL","NULL","Owyhee","ID","Snowy Egret","NULL","01970","Snowy Egret","Egretta","thula",1993-06-28,"Idaho"
"1560","6/28/1993","00:00.0","1993","6","28","Trost","NULL","NULL","Owyhee","ID","White-faced Ibis","NULL","01870","White-faced Ibis","Plegadis","chihi",1993-06-28,"Idaho"
"1561","6/6/2008","00:00.0","2008","6","6","Sturts","NULL","NULL","Kootenai","ID","Great Blue Heron","NULL","01940","Great Blue Heron","Ardea","herodias",2008-06-06,"Idaho"
"1562","5/26/1993","00:00.0","1993","5","26","Trost","NULL","NULL","Bonneville","ID","Black Tern","NULL","00770","Black Tern","Chlidonias","niger",1993-05-26,"Idaho"
"1563","5/26/1993","00:00.0","1993","5","26","Trost","NULL","NULL","Bonneville","ID","Franklin's Gull","NULL","00590","Franklin's Gull","Larus","pipixcan",1993-05-26,"Idaho"
"1564","5/26/1993","00:00.0","1993","5","26","Trost","NULL","NULL","Bonneville","ID","White-faced Ibis","NULL","01870","White-faced Ibis","Plegadis","chihi",1993-05-26,"Idaho"
"1565","6/29/1994","00:00.0","1994","6","29","Trost","NULL","NULL","Bonneville","ID","Forster's Tern","NULL","00690","Forster's Tern","Sterna","forsteri",1994-06-29,"Idaho"
"1566","7/3/1994","00:00.0","1994","7","3","Trost","NULL","NULL","Fremont","ID","Black Tern","NULL","00770","Black Tern","Chlidonias","niger",1994-07-03,"Idaho"
"1567","7/17/1993","00:00.0","1993","7","17","Trost","NULL","NULL","Fremont","ID","Western Grebe","NULL","00010","Western Grebe","Aechmophorus","occidentalis",1993-07-17,"Idaho"
"1568","6/20/2007","00:00.0","2007","6","20","Weinandt/Pfaff","NULL","NULL","Fremont","ID","Franklin's Gull","NULL","00590","Franklin's Gull","Larus","pipixcan",2007-06-20,"Idaho"
"1569","7/17/1993","00:00.0","1993","7","17","Trost","NULL","NULL","Fremont","ID","Black-crowned Night-Heron","NULL","02020","Black-crowned Night-Heron","Nycticorax","nycticorax",1993-07-17,"Idaho"
"1570","7/13/2006","00:00.0","2006","7","13","Moulton","NULL","NULL","Fremont","ID","Black-crowned Night-Heron","NULL","02020","Black-crowned Night-Heron","Nycticorax","nycticorax",2006-07-13,"Idaho"
"1571","7/13/2006","00:00.0","2006","7","13","Moulton","NULL","NULL","Fremont","ID","California Gull","NULL","00530","California Gull","Larus","californicus",2006-07-13,"Idaho"
"1572","7/13/2006","00:00.0","2006","7","13","Moulton","NULL","NULL","Fremont","ID","Caspian Tern","NULL","00640","Caspian Tern","Hydroprogne","caspia",2006-07-13,"Idaho"
"1573","7/13/2006","00:00.0","2006","7","13","Moulton","NULL","NULL","Fremont","ID","Double-crested Cormorant","NULL","01200","Double-crested Cormorant","Phalacrocorax","auritus",2006-07-13,"Idaho"
"1574","7/13/2006","00:00.0","2006","7","13","Moulton","NULL","NULL","Fremont","ID","Great Blue Heron","NULL","01940","Great Blue Heron","Ardea","herodias",2006-07-13,"Idaho"
"1575","7/13/2006","00:00.0","2006","7","13","Moulton","NULL","NULL","Fremont","ID","Ring-billed Gull","NULL","00540","Ring-billed Gull","Larus","delawarensis",2006-07-13,"Idaho"
"1576","6/29/2007","00:00.0","2007","6","29","Leist/Nelson","NULL","NULL","Fremont","ID","Caspian Tern","NULL","00640","Caspian Tern","Hydroprogne","caspia",2007-06-29,"Idaho"
"1577","6/27/2008","00:00.0","2008","6","27","Alexander/Weinandt","NULL","NULL","Fremont","ID","Caspian Tern","NULL","00640","Caspian Tern","Hydroprogne","caspia",2008-06-27,"Idaho"
"1578","6/27/2008","00:00.0","2008","6","27","Alexander/Weinandt","NULL","NULL","Fremont","ID","Double-crested Cormorant","NULL","01200","Double-crested Cormorant","Phalacrocorax","auritus",2008-06-27,"Idaho"
"1579","6/29/1993","00:00.0","1993","6","29","Reynolds","NULL","NULL","NULL","ID","Black Tern","NULL","00770","Black Tern","Chlidonias","niger",1993-06-29,"Idaho"
"1580","7/7/1994","00:00.0","1994","7","7","Trost","NULL","NULL","Valley","ID","Western Grebe","NULL","00010","Western Grebe","Aechmophorus","occidentalis",1994-07-07,"Idaho"
"1581","7/2/2007","00:00.0","2007","7","2","Weinandt/Pfaff","NULL","NULL","Bonner","ID","Western Grebe","NULL","00010","Western Grebe","Aechmophorus","occidentalis",2007-07-02,"Idaho"
"1582","7/9/2007","00:00.0","2007","7","9","Weinandt/Pfaff","NULL","NULL","Bonner","ID","Western Grebe","NULL","00010","Western Grebe","Aechmophorus","occidentalis",2007-07-09,"Idaho"
"1583","7/17/2007","00:00.0","2007","7","17","Weinandt/Pfaff","NULL","NULL","Bonner","ID","Western Grebe","NULL","00010","Western Grebe","Aechmophorus","occidentalis",2007-07-17,"Idaho"
"1584","7/21/2007","00:00.0","2007","7","21","Weinandt/Pfaff","NULL","NULL","Bonner","ID","Western Grebe","NULL","00010","Western Grebe","Aechmophorus","occidentalis",2007-07-21,"Idaho"
"1585","6/13/1993","00:00.0","1993","6","13","Trost","NULL","NULL","Camas or Blaine","ID","California Gull","NULL","00530","California Gull","Larus","californicus",1993-06-13,"Idaho"
